뉴스ID,뉴스GUID,일자(UTC timestamp),뉴스제목,본문,SENTIMENT,주요코인,카테고리,작성자,추천수,비추천수,출처,뉴스URL,이미지URL
42397936,DbF8Q09kuKX2XWBxAbEiQU,1411049475,Luxembourg Startup CoinPlus Closes Seed Funding Round,"CoinPlus has successfully closed a first round of investment, which saw the firm add €172,500 to its coffers.  The Luxembourg-based bitcoin startup reports the seed funding will allow it to speed up the operational and technical development of its impending product and add new members its team.  Though not yet launched, CoinPlus is developing a multi-support payment processor and a currency exchange platform.  Regulatory framework attracts bitcoin businesses  The startup was incorporated last July, following a ruling by the Luxembourg financial regulator, which found that bitcoin could be used as a means of payment.  Thanks to that ruling, Luxembourg became an attractive jurisdiction for bitcoin entrepreneurs.  CoinPlus CEO Christian Bodt said:  “Luxembourg was the obvious choice for us. The country offers state-of-the-art technical and administrative infrastructure, providers at the forefront of technology, a government that is accessible and great open-mindedness. The Luxembourg market is also a safe bet for all the players in the financial world.”  Bodt said CoinPlus is starting the process of applying for the ministerial approval in Luxembourg. While aware that there are still a number of steps to take before it can reach that “grail”, he is optimistic that it will succeed. Additionally, Bodt said he expects another funding round later this year.  CoinPlus has been created and developed so far with the support of Technoport, a state-owned incubator located in southern Luxembourg.  Confident in bitcoin’s potential  As a Python developer with a background in financial industries, Bodt said he originally discovered bitcoin in 2010 and he quickly became interested in the concept.  He met with Gavin Andresen in 2011 and became convinced that he had to join the community, which he did with the creation of his first bitcoin client. Bodt was also active in the fledgling bitcoin communities of both London and Paris.  Bodt said that bitcoin as a currency has some advantages over the traditional monetary system:  “The advantage of bitcoin as a unit of account is that it can store value without any risk linked to other people’s actions. The euro, for example, requires confidence in both the European financial and political system and the European central bank.""  Luxembourg image via Shutterstock",POSITIVE,없음,BTC | EXCHANGE | MARKET | TECHNOLOGY | TRADING,Nermin Hajdarbegovic,0,0,CoinDesk,https://coindesk.com/markets/2014/09/18/luxembourg-startup-coinplus-closes-seed-funding-round,https://cdn.sanity.io/images/s3y3vcno/production/7c5140cdac26fbc41e800484ff3d41ef4d98eaa4-1300x866.jpg?w=300&h=300&fit=crop
42397939,DbF8Q09kuKX2XWBxAbEiTR,1411045358,Huobi Launches USD Exchange With 24/7 Customer Support,"Huobi has added another branded service to its collection with the launch of BitYes.com, a USD-based platform for trading bitcoin and litecoin.  The China-based bitcoin exchange company launched BitYes at its first anniversary celebration at Beijing's Shangri-La Hotel last Saturday.  BitYes  will feature 24/7 English customer support available through multiple channels including Twitter, Facebook and Reddit, with a VIP system providing additional services to 'high-value' users.  It has a 0.2% standard trading fee, 0% BTC and LTC deposit/withdrawal fees, a 1% fiat currency deposit fee, 2% Egopay withdrawal fee, or 0.1% fee for withdrawal to bank card.  Marketing to new customers  Huobi is offering special introductory deals: the first 1,000 users may trade free for 30 days, as well as the first $1,000 depositors.  BitYes is aimed squarely at international customers, but it is registered to Bit International Financial Services Ltd, a Hong Kong-registered subsidiary of Huobi. The company says this will produce both better service and a more secure legal environment.  BitYes has also collaborated closely with leading law firms to ensure regulatory compliance across different jurisdictions.  Growing product mix  Huobi's  product family has grown markedly over the past couple of months with a series of launches and acquisitions, many offering something completely separate to the original and comparatively straightforward exchange business.  Each new product appears to appeal to a wider variety of digital currency traders and reduce the company's dependence on the mainland Chinese market, with its regulatory uncertainty. All new services have been launched simultaneously with English and Chinese versions.  These include BitVC, also part of the Hong-Kong subsidiary, a non-fiat exchange offering margin and futures trading, Yubibao interest-bearing wallets, the multi-signature Quickwallet, the Qukuai/Blockinfo block explorer, mining-linked investment products and an upcoming P2P lending platform.  Quickwallet provides users with the ability to make instant-confirmation deposits from their personal wallet to the exchange. This product will also be integrated with BitYes to provide the same functionality.  A recent cryptographic audit of Huobi's acconts showed it held 103% of claimed bitcoin reserves. It also claims a perfect security record over its one year of operation and, like rivals OKCoin and Huobi, have found a way to operate within a Chinese regulatory framework that once threatened to stifle the country's nascent bitcoin industry.  US dollars image via Shutterstock",POSITIVE,BTC,ASIA | BTC | EXCHANGE | FIAT | TRADING,Jon Southurst,0,0,CoinDesk,https://coindesk.com/markets/2014/09/18/huobi-launches-usd-exchange-with-247-customer-support,https://cdn.sanity.io/images/s3y3vcno/production/678e94a46a36563f9b179f5a7580eeb0d25db6ca-1260x840.jpg?w=300&h=300&fit=crop
42397926,DbF8Q09kuKX2XWBxAbEiGe,1411042775,Politician Keen for Vancouver Citizens to Pay Taxes in Bitcoin,"A Vancouver politician says the city should allow residents to pay their taxes, fines and fees using bitcoin.  Jason Lamarche won 37,286 votes in a recent council election, and now he says he would solicit bitcoin donations if he chose to run again.  In an interview with the Georgia Straight, Lamarche questioned why municipal politicians aren’t discussing bitcoin’s disruptive potential. He pointed out that many people describe Vancouver as the Silicon Valley of the north, yet the city is not doing much to promote new technology.  Lamarche explained:  “Well, when we have companies that are working on the type of innovation that we’re seeing related to bitcoin, why aren’t we helping to promote and use this technology, which clearly has had massive uptake around the world?”  However, the city said it has no plans to consider accepting bitcoin payments at this time.  Bitcoin donations are legal in Vancouver  The issue of whether political donations made in bitcoin are legal was addressed by Nola Western, the deputy chief electoral officer at election information resource Elections BC.  Western confirmed parties and candidates taking part in Vancouver’s upcoming November elections can accept bitcoin donations. She explained bitcoins are treated as non-monetary property and candidates simply need to report the dollar value of bitcoin donations.  The value is set on the day the donation is received, so if the bitcoin price goes up or down in the meantime there is no need to report any changes in value.  However, anonymous donations are limited to $50 and anyone wishing to donate more will have to disclose their identity, complete with address, full name and other details. Such donations have to be reported by the recipient. Western also cautioned that if a candidate received a lot of anonymous $50 donations in bitcoin, questions about their source would be raised.  Bitcoin campaign funding elsewhere  The use of bitcoin in political fundraising is not new. The US Federal Election Commission (FEC) made it clear that political campaigns and action committees can accept bitcoin as a form of in-kind donation.  A number of US politicians and political groups started accepting bitcoin over the past couple of years. Earlier this month, the Republican Party of Louisiana became one of the first state republican parties to accept the digital currency.  Although most US politicians who decided to embrace bitcoin tend to have libertarian views, but many others do not – they come from across the political spectrum.  Image via Shutterstock",POSITIVE,없음,BTC | REGULATION | TECHNOLOGY | TRADING,Nermin Hajdarbegovic,0,0,CoinDesk,https://coindesk.com/markets/2014/09/18/politician-keen-for-vancouver-citizens-to-pay-taxes-in-bitcoin,https://cdn.sanity.io/images/s3y3vcno/production/9be43ca4a309a0a60f708e3a447a77a5c46851e0-1250x833.jpg?w=300&h=300&fit=crop
42397927,DbF8Q09kuKX2XWBxAbEiIc,1411038020,CoinJar Launches Bitcoin Debit Card Trial,"CoinJar is set to begin a national trial of a bitcoin-to-debit card system called Swipe, which can be used to pay at any store that accepts electronic payments and to withdraw cash at some ATMs.  The Australia-based exchange and payment processor's debit cards will work on the country's electronic funds transfer at point of sale (EFTPOS) network, which is supported by all major banks and has 826,769 payment terminals nationwide.  ""CoinJar Swipe is our way of making bitcoin accessible to everyone,"" Asher Tan, CEO of CoinJar, told CoinDesk, adding:  ""Swipe lets CoinJar customers spend their bitcoin at any retail outlet that accepts EFTPOS, or withdraw cash from EFTPOS-compatible ATMs. It's all part of CoinJar's plan to build a simple, usable bitcoin ecosystem.""  According to the Australian Payments Clearing Association (APCA), over 17 million transactions take place via the country's ATM and EFTPOS terminal network per day.  Testing, testing  About 100 CoinJar users will participate in the trial over the next couple of weeks before the company makes the service available to its entire 30,000-strong user base.  Customers will load bitcoins manually onto their debit cards, which will be converted into Australian dollars and incur CoinJar's standard 2% fee. There is no extra charge for using the EFTPOS feature.  The cards are planned to be issued by local company Emerchants.  Benefits of bitcoin  Tan said the card scheme was more about getting more people using bitcoin and understanding its benefits, and that CoinJar wasn't expecting to make much of a profit from the project.  Those benefits included instant and almost free transfers from anywhere in the world (which could benefit freelance workers), to easy payments between individuals. Users can receive bitcoin, load the EFTPOS card and be out spending within minutes, Tan said.  CoinJar has processed about A$50m (US$44.8m) in transactions so far. The company also offers a bitcoin wallet and an iOS app. As well as updating the iOS app for iOS8, it will also launch a new app for Android in the near future.  Image via CoinJar",POSITIVE,없음,BTC | BUSINESS | EXCHANGE,Jon Southurst,0,0,CoinDesk,https://coindesk.com/markets/2014/09/18/coinjar-launches-bitcoin-debit-card-trial,https://cdn.sanity.io/images/s3y3vcno/production/8d799d91d2f38669a1b22aa8990d5f213ca51f61-1300x731.png?w=300&h=300&fit=crop
42397938,DbF8Q09kuKX2XWBxAbEiSS,1411030370,New Exchange SFOX Aims to Find Traders the Best Bitcoin Price,"One of the remarkable – and perhaps most confusing – aspects of bitcoin is the fact that every bitcoin exchange seems to have a different price for the cryptocurrency.  Of course, no two exchanges are ever alike because they all serve different markets. When it comes to how much it costs to buy or sell bitcoin, this is especially true.  The reasoning for this has to do with bitcoin being a global and largely unregulated market. Because it is bought and sold all over the world, there are numerous prices for it – with no centralized entity dictating any one.  A new startup called San Francisco Open Exchange (SFOX) aims to fix that. Or, at the very least, its platform will allow users an opportunity to potentially capitalize on the spread across different bitcoin exchange markets.  Akbar Thobhani is the co-founder of SFOX. He told CoinDesk that his platform allows people to get the best price for bitcoin – a Kayak of sorts for the virtual currency – saying:  “What does Kayak do? It finds you the best liquidity across airlines. We do the same thing [with bitcoin]. We get you the best price and the best liquidity across multiple bitcoin exchanges.”  The idea  SFOX is essentially a platform for users to trade bitcoin and USD in both buy and sell mode. The goal is to provide users the very best price, similar to what an E*Trade or Scottrade offers with more traditional financial instruments like stocks and options.  Thobhani and co-founder George Melika started SFOX with entrepreneurial backgrounds and an understanding of the global payments market.  Thobhani previously worked at mobile payments company Boku before heading up growth at travel website Airbnb, where he said the lodging startup had to send money to over 190 countries, giving him key insight into what it takes to process payments on a global scale.  “I learned that moving money was so complicated and I had no idea about it,” said Thobhani. “I wanted to build technology to make that easy.”  Melika has experience building trading platforms for financial institutions.  Right now, bitcoin is not generally considered a traditional financial instrument because of regulatory concerns from banking institutions. Even so, SFOX does not believe that banks are the enemy of bitcoin.  “I wouldn’t define [banking] as a problem,” Thobhani said.  Bankers, he added, are just doing their jobs:  “I think banks – you just have to work with them. You have to understand what they are. Banks are responsible for following the compliance and the laws that are set in countries.”  It's possible that someday platforms like SFOX will be integrated into something like E-Trade, a financial services company with which investors can by and sell securities on an ETF or by phone.  But for the time being, startups like SFOX will build a place to be a sort of foreign exchange for decentralized currencies. This could eventually make it desirable to banks, because of its experience with bitcoin.  “Banks want to be involved [in bitcoin], they just have to be comfortable,” Thobhani said.  Algorithmic bitcoin trading  SFOX sees its platform as becoming increasingly useful as cryptocurrencies grow as financial assets.  Despite bitcoin's $6bn market capitalization, Thobhani believes BTC has room to grow, bringing specialized algorithms for the financial markets into the cryptocurrency space.  “These algorithms are very special. They have to be rewritten for the world of cryptocurrency,“ said Thobhani.  SFOX sees its main customers as traders who will need access to multiple exchanges at one time. While much there has been much talk about derivatives and options or futures to provide liquidity, SFOX is just managing trading across exchanges as an easy starting point to integrating more complex instruments.  Said Thobhani:  “We [will be] the window into all of these instruments we can trade. We just want to make it super simple and easy for traders to manage that.”  For larger bitcoin deals on the exchange platforms it can be difficult to transact bitcoin in buy and sell orders because of a general lack of liquidity. SFOX offers itself to payment companies and perhaps bitcoin-accepting merchants as a broker of sorts.  “Payment companies [are] going to need a mechanism to trade in large numbers,” Thobhani told CoinDesk. “In a manner that doesn’t move the market – they need to buy or sell one currency or another. We offer liquidity.”  Y Combinator and beyond  SFOX was one of few bitcoin companies that were accepted into Y Combinator’s Summer 2014 class. Others, including Onename.io and card company Shift Payments were accepted with a more complete product to show YC's partners.  However, SFOX came through the renowned accelerator building its product; the founders only applied with the concept for the platform.  Said Thobhani:  “We applied to YC with an idea. Which is rare. Companies come to YC to accelerate growth; we were fortunate to join YC with an idea and leave with a growing company.”  There are a number of companies that are somewhat similar to SFOX – especially by offering a trading platform.  Thobhani argues the startup is doing something unique amongst the competition. The idea for SFOX, he says, is something many in the bitcoin community will need, similar to how the conventional currency markets operate right now, he said.  “There’s a lot of working with other partners in a currency market, and we don’t see how bitcoin is going to be any different. Bitcoin is an open technology, and we are an open platform. We see this as an opportunity to work with the community,” said Thobhani.  SFOX is currently in limited beta. Anyone can sign up but deposits and withdrawals are currently restricted. For full platform access, go to the SFOX deposit page and follow @sfoxtrading on Twitter.  Markets image via Shutterstock",POSITIVE,BTC,BTC | EXCHANGE | MARKET | TECHNOLOGY | TRADING,Daniel Cawrey,0,0,CoinDesk,https://coindesk.com/markets/2014/09/18/new-exchange-sfox-aims-to-find-traders-the-best-bitcoin-price,https://cdn.sanity.io/images/s3y3vcno/production/55e31b7c9e1bb87c8d0d560b95ad58e7eec576bc-1540x750.jpg?w=300&h=300&fit=crop
