뉴스ID,뉴스GUID,일자(UTC timestamp),뉴스제목,본문,SENTIMENT,주요코인,카테고리,작성자,추천수,비추천수,출처,뉴스URL,이미지URL
13839910,https://news.bitcoin.com/?p=593518,1686850210,50 Dormant Bitcoins Worth $1.25 Million Wake Up After 12-Year Slumber,"A dormant Bitcoin address holding 50 Bitcoin, valued at approximately $1.25 million, suddenly sprang to life on June 15 after being inactive since June 21, 2010. This month has seen only one 2010 block reward transfer, with the previous two taking place on May 22, 2023. $1.25 Million in Bitcoin Moves After a Decade of",POSITIVE,없음,BTC | MINING,,0,0,Bitcoin.com,https://news.bitcoin.com/50-dormant-bitcoins-worth-1-25-million-wake-up-after-12-year-slumber/,https://resources.cryptocompare.com/news/14/13839910.jpeg
13839866,https://decrypt.co/?p=144788,1686850145,AMD Debuts AI Chip to Challenge Nvidia,The company's new MI300X AI Chip will be a direct competitor to the dominance of Nvidia's H100.,NEUTRAL,없음,ZRX,,0,0,Decrypt,https://decrypt.co/144788/amd-debuts-ai-chip-to-challenge-nvidia,https://resources.cryptocompare.com/news/44/13839866.jpeg
13839795,https://cointelegraph.com/news/buying-bitcoin-is-preferable-to-btc-mining-in-most-circumstances-analysis,1686850002,Buying Bitcoin is preferable to BTC mining in most circumstances — Analysis,Data suggests that investors are better off buying spot Bitcoin than attempting to mine it unless the market is in a mega bull run.,NEUTRAL,BTC,BTC | BUSINESS | MARKET | MINING | TRADING,,0,0,CoinTelegraph,https://cointelegraph.com/news/buying-bitcoin-is-preferable-to-btc-mining-in-most-circumstances-analysis,https://resources.cryptocompare.com/news/16/13839795.jpeg
13839825,https://decrypt.co/?p=142955,1686849934,Crypto Heads East as Huobi HK Launches Trading Service in Hong Kong,"Huobi has joined the Hong Kong Virtual Assets Consortium (HKVAC), while its Hong Kong arm now offers crypto spot trading and virtual asset custody.",NEUTRAL,없음,ASIA | BUSINESS | EXCHANGE | TRADING,,0,0,Decrypt,https://decrypt.co/142955/crypto-heads-east-as-huobi-hk-launches-trading-service-in-hong-kong,https://resources.cryptocompare.com/news/44/13839825.jpeg
13839590,https://coinedition.com/?p=276202,1686849600,"UNI, ALGO, and LUNC Defy Odds as Fed Triggers Crypto Chaos","The cryptocurrency market declined in response to the US Federal Reserve’s indication of upcoming interest rate hikes. However, amidst the chaos, three standout altcoins, Uniswap (UNI), Algorand (ALGO), and Terra Classic (LUNC), managed to buck the trend and soar to new heights. The Federal Open Market Committee (FOMC), led by Jerome Powell, paused its aggressive The post UNI, ALGO, and LUNC Defy Odds as Fed Triggers Crypto Chaos appeared first on Coin Edition .",NEUTRAL,ALGO | LUNC | UNI,ALGO | ALTCOIN | LUNC | MARKET | UNI,,0,0,Coin Edition,https://coinedition.com/uni-algo-and-lunc-defy-odds-as-fed-triggers-crypto-chaos/,https://resources.cryptocompare.com/news/7/default.png
13839591,https://www.cryptopolitan.com/?p=318913,1686849554,Ripple and Colombia’s central bank collaborate to enhance payment system,"Ripple, a global leader in blockchain solutions, has teamed up with Banco de la República, Colombia’s central bank, to explore the potential use cases of blockchain technology in the country’s high-value payment system. This collaboration aims to drive innovation and efficiency in Colombia’s financial landscape, leveraging Ripple’s Central Bank Digital Currency (CBDC) platform to revolutionize ... Read more",POSITIVE,없음,BLOCKCHAIN | FIAT | TECHNOLOGY,,0,0,Cryptopolitan,https://www.cryptopolitan.com/ripple-and-colombias-central-bank-collaborate-to-enhance-payment-system/,https://images.cryptocompare.com/news/default/cryptopolitan.png
13839274,https://cryptopotato.com/?p=255386,1686848859,Brazil’s President Empowers the Central Bank as Crypto Regulator,The bank will set standards in the local crypto sector and partner with the SEC on the regulation of digital assets classified as securities.,NEUTRAL,없음,FIAT | REGULATION,,0,0,Crypto Potato,https://cryptopotato.com/brazils-president-empowers-the-central-bank-as-crypto-regulator/,https://resources.cryptocompare.com/news/27/13839274.jpeg
13839343,https://cryptonews.com/news/while-revive-token-pumps-up-500-dextools-crypto-experts-are-accumulating-wall-street-memes-as-next-crypto-explode-heres-why.htm,1686848820,"While REVIVE Token Pumps Up 500% on DEXTools, Crypto Experts are Accumulating Wall Street Memes as the Next Crypto to Explode – Here's Why","Revive Token ($REVIVE) has enjoyed an explosive start to life since launching across decentralized exchanges (DEXs) on Wednesday. $REVIVE, which is based around the joke of crypto degens needing to revive their badly performing crypto portfolios, was last trading around $0.0009, up over 500% versus its launch price. The token pumped as high as $0.0015 earlier in the day, giving it a market cap of more than $1.5 million at its peak.... Read More: While REVIVE Token Pumps Up 500% on DEXTools, Crypto Experts are Accumulating Wall Street Memes as the Next Crypto to Explode – Here's Why",POSITIVE,없음,ICO | MARKET | TRADING,,0,0,cryptonews,https://cryptonews.com/news/while-revive-token-pumps-up-500-dextools-crypto-experts-are-accumulating-wall-street-memes-as-next-crypto-explode-heres-why.htm,https://resources.cryptocompare.com/news/52/13839343.jpeg
13839156,https://www.cryptopolitan.com/?p=318891,1686848482,Breaking: 20 countries now vying for BRICS membership,"BRICS, the economic bloc comprising Brazil, Russia, India, China, and South Africa, has sparked international interest, becoming a central player on the world stage. Ahead of the upcoming BRICS Summit, a significant development has come to the fore: nearly two dozen nations have expressed their keen interest in joining this influential alliance. This unprecedented surge ... Read more",POSITIVE,없음,ASIA,,0,0,Cryptopolitan,https://www.cryptopolitan.com/20-countries-now-vying-for-brics-membership/,https://images.cryptocompare.com/news/default/cryptopolitan.png
13839153,https://www.cryptonewsz.com/?p=207062,1686848451,Get in on the ground floor of the AI revolution with InQubeta,It is no secret that AI technology is one of the most popular innovations of recent times. Many DeFi crypto enthusiasts and analysts have begun looking for ways to join the evolution of AI technology. This has prompted the creation of cryptocurrencies that offer a chance to earn from the AI market alongside their crypto …,POSITIVE,없음,MARKET | TECHNOLOGY,,0,0,CryptoNewsZ,https://www.cryptonewsz.com/get-in-on-the-ground-floor-of-the-ai-revolution-with-inqubeta/,https://images.cryptocompare.com/news/default/cryptonewsz.png
13839152,https://www.newsbtc.com/?p=538154,1686848444,BlackRock Inches Closer To Launching Bitcoin ETF: Potential Impact On BTC Price,"Financial circles are buzzing with the news that BlackRock, the world’s largest asset manager, is considering applying for a Bitcoin Exchange Traded Fund (ETF). This development signifies a substantial move by one of the most influential financial institutions into the world of cryptocurrencies. The anticipation is growing amid revelations that BlackRock plans to use Coinbase Custody for the ETF, alongside the crypto exchange’s spot market data for pricing. This alliance represents a significant step in legitimizing cryptocurrencies in traditional finance. Notably, Bitcoin (BTC) and Coinbase (COIN) have not reacted to the news but have only continued to dwell in red, with both assets down 3.9% and 2.81%, respectively, in the past 24 hours. Related Reading: Data Reveals Short-Term Bitcoin Holders Refuse To Sell Despite SEC Crackdown BlackRock’s Foray Into Crypto The move marks a continuation of the collaboration that started last year when BlackRock partnered with Coinbase to offer crypto directly to institutional investors. As of yet, the specifics about the nature of the ETF – whether it will be spot or futures – remain undisclosed. Notably, The Securities and Exchange Commission (SEC), responsible for regulating ETFs in the U.S., has previously turned down every application for a spot Bitcoin ETF. However, several Bitcoin futures ETFs have gained the regulatory body’s approval for trading, indicating a gradually warming stance towards cryptocurrencies. Potential Impact On Bitcoin Price The news of BlackRock’s potential Bitcoin ETF could significantly affect BTC’s price. Creating such an ETF would allow a broader spectrum of investors to gain exposure to Bitcoin, possibly driving up demand and its price. ETFs make it easy for institutional investors to gain exposure to Bitcoin, opening up a substantial new demand avenue. Analyst crypto Daan Crypto reported that Bitcoin had recorded a strong spot bid on Binance in the past few hours – a move that has not been seen for the past few days. According to the trader, Bitcoin’s local bottom is more likely in if the asset continues to the downside in the coming days. At the time of writing, BTC currently trades at $24,977, down by nearly 4%. Its trading volume has also spiked over the past 7 days indicating massive trading activity. Notably, from a technical perspective, BTC could still be prone to a continuous downtrend, given that the asset hasn’t hit major support, which can be found in the order block at $24,500. Related Reading: Bitcoin Price On Shaky Ground: Market Analysts Warn Of Potential Fall To $20,000 Level Furthermore, the association with BlackRock, a globally recognized asset management name, could lend credibility and legitimacy to Bitcoin. This increased trust could lead to greater adoption rates and an upward price trajectory for Bitcoin in the long run. As observed in the past, any positive development or news about BTC ETFs has often led to a spike in Bitcoin’s price due to increased demand from retail and institutional investors. Featured image from iStock, Chart from TradingView",POSITIVE,BTC,BTC | BUSINESS | EXCHANGE | MARKET | TRADING,,0,0,NewsBTC,https://www.newsbtc.com/bitcoin-news/blackrock-inches-closer-to-launching-bitcoin-etf-impact-on-btc-price/,https://resources.cryptocompare.com/news/21/13839152.jpeg
13839119,https://cryptodaily.co.uk/2023/06/blk-dnm-introduces-intelligence-into-clothing-with-blockchain-in-first-use-of-connected-fashion,1686848443,"Blk DNM Introduces Intelligence Into Clothing With Blockchain, In First Use Of ‘Connected Fashion’","Stockholm, Sweden, June 15th, 2023, Chainwire BLK DNM bridging the Physical and Virtual Worlds of Fashion through Blockchain Innovation Swedish-American fashion brand BLK DNM today unveils the first-ever example of connected fashion (garments that exist both physically and virtually, each aspect ‘twinned’ via technology) with the launch of BLK DNM Society and integration of blockchain-powered hardware and software into its products. BLK DNM Society, built on tech designed by blockchain innovator and BLK DNM owner ChromaWay, will grant each garment a unique and recordable identity in both the physical and virtual worlds, while also rewarding ethical behaviour and granting brand influence to owners. Blockchain-powered ‘digital garment ID’ microchips will give each item a unique identity and record of its history Chips form the hardware element of BLK DNM Society, which launches in tandem and rewards responsible behavior and ownership Tech will first appear in BLK DNM’s FW 2023 collection The Hardware: Digital Garment IDs Future BLK DNM clothing will be fitted with a ‘digital garment ID’ - an undetectable chip that gives each physical item a unique and recordable identity. Some of the first features of the digital garment IDs will include: Authentication of the garment as genuine, eliminating fakes and counterfeiting Rewarding responsible behaviours of treasuring and caring for clothing long-term, such as refurbs and second-hand purchases Recording each individual garment's unique history - owners, events and places worn, repairs and alterations - enabling the item to accrue emotional and monetary value over time Acting as a digital ticket for entry to events Access to and voting rights within BLK DNM Society BLK DNM Society The digital garment IDs are the first hardware elements of BLK DNM Society, which launches in tandem. The first example of connected fashion, BLK DNM Society is a community of BLK DNM owners, connected virtually by their physical items, who are rewarded for responsible behaviours and are granted voting rights on key brand decisions based on item ownership - thereby beginning the first ever process of decentralising a fashion brand’s stewardship. Each digital garment ID will create a ‘digital reflection’ of the physical garment: a twin in the virtual world where the physical item’s history and place within BLK DNM Society is recorded. The digital reflection can also be worn in the metaverses, catering especially to younger generations whose identities in virtual worlds are equally as important as in the physical. FW 2023 Digital garment IDs will be revealed at BLK DNM’s FW event in Paris on June 21st. For this first collection, the chips will be embedded in only leather items, with subsequent collections introducing more items to BLK DNM Society through embedded blockchain-enabled hardware. Henrik Hjelte, CEO and Co-founder of ChromaWay, comments: “This is totally futuristic. Nothing like this has been attempted in fashion before. It’s very exciting for us, after much hard work, to see our technology elevating one of fashion’s iconic brands into something completely unique. This has the potential to transform people’s relationships with the clothes they wear and the brands they buy. No longer does the relationship with the customer end at the checkout. And each beautiful garment now becomes its own living, evolving piece of history.” Toni Collin, CEO of BLK DNM, and Henrik Hjelte, CEO and Co-founder of ChromaWay Toni Collin, CEO of BLK DNM, comments: “BLK DNM’s philosophy is one of community, and our clothing is designed, through both its craftsmanship and timeless aesthetic, to be treasured and passed down through generations - the antithesis of irresponsible fast fashion. Now, with the introduction of BLK DNM Society and the first embedded hardware in our garments, we take those two pillars to a revolutionary new level. By embedding intelligence in every item, we hope we can inspire our industry to join us in using connected fashion to do better.” About BLK DNM BLK DNM is a Swedish-American fashion brand that specialises in timeless tailoring, leather, and denim of extraordinary quality. Following its 2023 relaunch as an entry-luxury fashion house under the stewardship of new Creative Director Jessy Heuvelink, BLK DNM’s focus on both enduring craftsmanship and aesthetic timelessness encourages customers to love and treasure each item for decades and across generations. About ChromaWay ChromaWay is an industry leader in blockchain technology and specializes in creating and deploying cutting-edge, scalable blockchain solutions for both businesses and governments. The company, which was established in 2014 and has its headquarters in Stockholm, Sweden, has been at the forefront of driving the widespread adoption of blockchain technology. Its flagship product, relational blockchain Chromia, enables developers to build decentralized applications (dApps) with a relational database model that offers unprecedented scalability and flexibility. ContactFati HakimFati.Hakim@ChromaWay.com",POSITIVE,없음,BLOCKCHAIN | TECHNOLOGY,,0,0,Crypto Daily,https://cryptodaily.co.uk/2023/06/blk-dnm-introduces-intelligence-into-clothing-with-blockchain-in-first-use-of-connected-fashion,https://resources.cryptocompare.com/news/75/13839119.jpeg
13839161,https://cointelegraph.com/news/dubai-s-vara-approves-okx-preparatory-license-as-part-of-exchange-s-expansion-plans,1686848400,Dubai’s VARA approves OKX ‘preparatory’ license as part of exchange’s expansion plans,The Middle Eastern arm of the exchange said it had opened an office in the Dubai World Trade Center and planned to increase its staff to 30 people.,NEUTRAL,없음,EXCHANGE | REGULATION,,0,0,CoinTelegraph,https://cointelegraph.com/news/dubai-s-vara-approves-okx-preparatory-license-as-part-of-exchange-s-expansion-plans,https://resources.cryptocompare.com/news/16/13839161.jpeg
13839195,https://timestabloid.com/?p=16701,1686848374,"Blk DNM Introduces Intelligence Into Clothing With Blockchain, In First Use Of ‘Connected Fashion’","Stockholm, Sweden, June 15th, 2023, Chainwire BLK DNM bridging the Physical and Virtual Worlds of Fashion through Blockchain Innovation Swedish-American fashion brand BLK DNM today unveils the first-ever example of connected fashion (garments that exist both physically and virtually, each aspect ‘twinned’ via technology) with the launch of BLK DNM Society and integration of blockchain-powered The post Blk DNM Introduces Intelligence Into Clothing With Blockchain, In First Use Of ‘Connected Fashion’ appeared first on Times Tabloid .",POSITIVE,없음,BLOCKCHAIN | TECHNOLOGY,,0,0,TimesTabloid,https://timestabloid.com/blk-dnm-introduces-intelligence-into-clothing-with-blockchain-in-first-use-of-connected-fashion/,https://resources.cryptocompare.com/news/67/default.png
13839414,72742,1686848161,"Blk DNM Introduces Intelligence Into Clothing With Blockchain, In First Use Of ‘Connected Fashion’","Stockholm, Sweden, June 15th, 2023, Chainwire",POSITIVE,없음,BLOCKCHAIN,,0,0,Chainwire,https://chainwire.org/2023/06/15/blk-dnm-introduces-intelligence-into-clothing-with-blockchain-in-first-use-of-connected-fashion/,https://resources.cryptocompare.com/news/68/13839414.jpeg
13839081,https://cryptonews.com/news/coinex-refund-thousands-as-part-of-settlement-with-new-york-attorney-general-letitia-james.htm,1686848160,CoinEx Has To Refund Thousands as Part of Settlement With New York Attorney General Letitia James,"Cryptocurrency firm CoinEx will have to refund thousands of New York investors more than $1.7 million and pay penalties to the state as a result of settlement with New York Attorney General Letitia James. CoinEx is also banned from operating in the state, according to a statement on Thursday from James’ office. ... Read More: CoinEx Has To Refund Thousands as Part of Settlement With New York Attorney General Letitia James",NEGATIVE,없음,BUSINESS,,0,0,cryptonews,https://cryptonews.com/news/coinex-refund-thousands-as-part-of-settlement-with-new-york-attorney-general-letitia-james.htm,https://resources.cryptocompare.com/news/52/13839081.jpeg
42410387,GJVPKSa3D710Liw1gdKEU1,1686848108,"Judge Allows FTX Founder Sam Bankman-Fried to Go to Trial on Only Wire Fraud, Political Contribution Charges for Now","The judge overseeing Sam Bankman-Fried's criminal trial will allow the government to treat some of the charges against him as part of a separate criminal trial for the moment.  Judge Lewis Kaplan, of the U.S. District Court for the Southern District of New York, ruled Thursday afternoon that five of the charges brought against Bankman-Fried can be brought to trial in March 2024, allowing the U.S. Department of Justice to proceed only on eight charges brought in an initial indictment last December for the FTX founder's current trial this fall.  During the hearing, the judge asked the FTX founder's defense team several questions about their motion to dismiss bank fraud, wire fraud and campaign finance charges, though he did not make a decision on the motions to dismiss during Thursday's hearing.  ""I'd like to congratulate you on an extraordinarily imaginative [defense],"" the judge told one defense attorney who argued that the U.S. Department of Justice was trying to insert new legal theories into its prosecution.  Mark Cohen, another attorney for Bankman-Fried, argued before a packed courtroom that the campaign finance charge should be dismissed, or at least severed alongside other charges, on a technical detail.  ""The operative document in extradition is the warrant of surrender,"" Cohen said. ""It does not list the campaign finance charge.""  Bankman-Fried never consented to be extradited on that charge, Cohen contended.  A prosecutor pushed back against this assertion later on, saying the U.S. had included the charge in its extradition request.  The warrant in question was addressed to Bahamian police, and while it may not have included the charge, the Bahamian court itself was aware of it, the prosecutor said.  Judge Kaplan seemed unconvinced. He seemed similarly skeptical about the defense's efforts to dismiss bank and wire fraud charges.  Part of Thursday's hearings focused on the possible timeline through the start of the criminal trial. While the DOJ shared a proposed timeline, the judge said it didn't give him enough time to review all of the materials he'd have to look at.  The judge also denied a number of motions made by the defense tied to discovery, including an effort to have the DOJ review FTX documents and materials.  Bankman-Fried's attorneys filed to dismiss most of the charges laid out against him last month, arguing that there were a number of different reasons to grant the motions. Several of the motions to dismiss focused on claimed legal issues, including failure to state an offence or allege valid property rights.  Bankman-Fried also sought to dismiss some charges brought after he was extradited to the U.S. on grounds that the Bahamas hadn't consented to them.  Bankman-Fried was arrested last December on eight initial charges, but prosecutors have added another five through multiple superseding indictments. Bankman-Fried's attorneys have argued that under the U.S.'s extradition treaty with the Bahamas, the Bahamas' government needs to sign off on the charges brought post-extradition. On Tuesday, the Bahamas Supreme Court ruled that he should have an opportunity to argue against the country approving the additional charges.  Late Wednesday night, prosecutors agreed to hold off on these added charges until the Bahamas signed off.  Prosecutors pushed back against the other motions, saying the defense's arguments didn't carry enough weight on the procedural issues.  UPDATE (June 15, 2023, 21:25 UTC): Judge Kaplan ruled on the motion to sever charges after the end of the hearing. This article has been updated with that ruling.",NEUTRAL,없음,FIAT | REGULATION | TRADING,"Nikhilesh De, Elizabeth Napolitano",0,0,CoinDesk,https://coindesk.com/policy/2023/06/15/judge-punts-on-ftx-founder-sam-bankman-frieds-efforts-to-dismiss-some-charges,https://cdn.sanity.io/images/s3y3vcno/production/f901c2d2e024a35f30f4bb5e879fb7d2dc42fca1-2880x1620.jpg?w=300&h=300&fit=crop
13839001,https://dailyhodl.com/?p=249359,1686848103,"SEC Delays Answering Coinbase’s Request for Crypto Clarity, Chief Legal Officer Responds","The U.S. Securities and Exchange Commission (SEC) says it needs more time before deciding whether to respond to Coinbase’s request for regulatory clarity regarding the crypto industry. Coinbase filed a motion in court in April to compel the SEC to respond to a July petition from the company requesting guidance for the digital asset industry. Last The post SEC Delays Answering Coinbase’s Request for Crypto Clarity, Chief Legal Officer Responds appeared first on The Daily Hodl .",NEUTRAL,없음,EXCHANGE | REGULATION,,0,0,The Daily Hodl,https://dailyhodl.com/2023/06/15/sec-delays-answering-coinbases-request-for-crypto-clarity-chief-legal-officer-responds/,https://images.cryptocompare.com/news/default/dailyhodl.png
13839002,https://coinedition.com/?p=276190,1686848100,Analyst Identifies DOGE As Safe Bet For Altcoin Investors,"The crypto trading and analysis YouTube channel, DataDash, shared its latest technical analysis for Dogecoin (DOGE) yesterday. In the video, the analyst named DOGE as a safe bet for any trader or investor looking to stock up on altcoins. Despite this, he did warn that the meme coin’s price may drop another 5-7% in the The post Analyst Identifies DOGE As Safe Bet For Altcoin Investors appeared first on Coin Edition .",POSITIVE,DOGE,ALTCOIN | BUSINESS | DOGE | MARKET | TRADING,,0,0,Coin Edition,https://coinedition.com/analyst-identifies-doge-as-safe-bet-for-altcoin-investors/,https://resources.cryptocompare.com/news/7/default.png
13838987,https://decrypt.co/?p=144786,1686848030,Bitcoin Whale Moves $1.2 Million After 13 Years of Inactivity,Some long-term investors are moving their stashes after years of remaining dormant.,NEUTRAL,없음,BTC | BUSINESS,,0,0,Decrypt,https://decrypt.co/144786/bitcoin-whale-moves-million-after-13-years,https://resources.cryptocompare.com/news/44/13838987.jpeg
13838887,https://www.cryptopolitan.com/?p=318883,1686847854,BlackRock set to file Bitcoin ETF application in partnership with Coinbase,"BlackRock, the world’s largest asset manager with $9 trillion in assets under its control, is on the verge of submitting an application for a Bitcoin exchange-traded fund (ETF), according to reports. However, this move by BlackRock marks a potential breakthrough in the cryptocurrency industry, as the company aims to provide institutional investors with a regulated ... Read more",POSITIVE,없음,BTC | BUSINESS | EXCHANGE,,0,0,Cryptopolitan,https://www.cryptopolitan.com/blackrock-set-to-file-bitcoin-etf-application-in-partnership-with-coinbase/,https://images.cryptocompare.com/news/default/cryptopolitan.png
