뉴스ID,뉴스GUID,일자(UTC timestamp),뉴스제목,본문,SENTIMENT,주요코인,카테고리,작성자,추천수,비추천수,출처,뉴스URL,이미지URL
35930499,https://en.coin-turk.com/?p=172679,1731081644,"Solana Price Poised to Reach $500, as This AI Altcoin Is Set to Make 350% if SOL Reaches $200","Solana could be heading for a massive price increase, with some experts suggesting it might reach $500. At the same time, a specific AI-powered altcoin is expected to soar, potentially rising by 350% if Solana hits $200. Continue Reading: Solana Price Poised to Reach $500, as This AI Altcoin Is Set to Make 350% if SOL Reaches $200 The post Solana Price Poised to Reach $500, as This AI Altcoin Is Set to Make 350% if SOL Reaches $200 appeared first on COINTURK NEWS .",POSITIVE,SOL,ALTCOIN | SOL | TRADING,,0,0,CoinTurk News,https://en.coin-turk.com/solana-price-poised-to-reach-500-as-this-ai-altcoin-is-set-to-make-350-if-sol-reaches-200/,https://resources.cryptocompare.com/news/79/35930499.jpeg
35930540,https://news.bitcoin.com/?p=683310&preview=true&preview_id=683310,1731081637,"Bitcoin Price Keeps Rising: BTC Tops $75,000 and Pepe Unchained ICO Reaches $25.5 Million","Bitcoin (BTC) smashed through $76,000 yesterday and has remained above this key threshold following Trump’s election win this week. Meanwhile, new meme coin project Pepe Unchained (PEPU) has just hit $25.5 million in its ICO – with investors rushing to secure discounted tokens. Bitcoin Posts New All-Time High as Trading Volumes Explode to $59B Bitcoin’s",POSITIVE,BTC,BTC | BUSINESS | TRADING | TOKEN SALE,,0,0,Bitcoin.com,https://news.bitcoin.com/bitcoin-price-keeps-rising-btc-tops-75000-and-pepe-unchained-ico-reaches-25-5-million/,https://resources.cryptocompare.com/news/14/35930540.jpeg
35931902,https://cryptonews.com/?p=305135,1731081630,"Meme Coin Market Cap Nears 2024 Peak, People’s Meme Coin Flockerz Raises $1.3M in Presale","Brand new meme coin Flockerz’s ($FLOCK) fundraising campaign shows no signs of slowing down, with its presale funds now surpassing $1.3 million. The new meme coin is rallying support to launch the industry’s first vote-to-earn (V2E) mechanism, where the community’s voice is rewarded for steering the project’s direction. Flockerz is setting a new standard for The post Meme Coin Market Cap Nears 2024 Peak, People’s Meme Coin Flockerz Raises $1.3M in Presale appeared first on Cryptonews .",POSITIVE,없음,MARKET,,0,0,cryptonews,https://cryptonews.com/news/meme-coin-market-cap-nears-2024-peak-peoples-meme-coin-flockerz-raises-1-3m-in-presale/,https://resources.cryptocompare.com/news/52/35931902.jpeg
35930933,https://thecoinrise.com/xyz-draws-major-whale-attention-as-predicted-gains-reach-10000-could-it-outshine-wif-in-2025/,1731081624,"XYZ Draws Major Whale Attention as Predicted Gains Reach 10,000% — Could It Outshine WIF in 2025?","XYZ Draws Major Whale Attention as Predicted Gains Reach 10,000% — Could It Outshine WIF in 2025? The post XYZ Draws Major Whale Attention as Predicted Gains Reach 10,000% — Could It Outshine WIF in 2025? appeared first on TheCoinrise.com .",POSITIVE,WIF,WIF,,0,0,The Coin Rise,https://thecoinrise.com/xyz-draws-major-whale-attention-as-predicted-gains-reach-10000-could-it-outshine-wif-in-2025/,https://resources.cryptocompare.com/news/60/35930933.jpeg
35930523,https://nulltx.com/?p=134338,1731081620,AVAX & Cardano Millionaires Raise Stakes In DTX Exchange’s $6.8M Presale as Batch 4 Nears Sell Out,"With the approaching bull run in the crypto market, Avalanche and Cardano millionaires set their sights on the DTX Exchange. This trading platform is quickly building a strong community, and as the fourth presale batch is nearing sellout, investors are supporting its mission to revolutionize the trading industry. DTX Exchange",POSITIVE,AVAX,ADA | AVAX | BUSINESS | EXCHANGE | TRADING,,0,0,NullTx,https://nulltx.com/avax-cardano-millionaires-raise-stakes-in-dtx-exchanges-6-8m-presale-as-batch-4-nears-sell-out/,https://images.cryptocompare.com/news/default/nulltx.png
35930472,https://coinpedia.org/?p=377644,1731081609,Bitcoin Fear & Greed Index Score Increased To 75!,"The post Bitcoin Fear & Greed Index Score Increased To 75! appeared first on Coinpedia Fintech News With increasing price volatility in the market, the Bitcoin price has achieved a new ATH five times this week. With a 24-hour trading volume of $59.73 billion, the star crypto is currently valued at $76,308.06. Since Donald Trump won the U.S. Presidential election, the BTC price has added ~$9,000 to its value. This has resulted …",POSITIVE,BTC,BTC | MARKET | TRADING,,0,0,coinpedia,https://coinpedia.org/crypto-live-news/bitcoin-fear-greed-index-score-increased-to-75/,https://images.cryptocompare.com/news/default/coinpedia.png
35930477,https://ambcrypto.com/?p=440722,1731081606,Solana at $199: Will high liquidations trigger a reversal?,Solana's impressive market cap growth raises questions about sustained momentum amid rising volatility.,NEUTRAL,없음,ALTCOIN | MARKET | SOL,,0,0,AMB Crypto,https://ambcrypto.com/solana-at-199-will-high-liquidations-trigger-a-reversal/,https://images.cryptocompare.com/news/default/ambcrypto.png
35930476,https://btc-pulse.com/?p=27266,1731081600,"Want to 100x Your Money? Solana, XRP, WIF, and XYZVerse Could Be the Cryptos to Watch for 2025!","XYZVerse (XYZ) targets major 2025 growth in sports-crypto. XRP, SOL, WIF show promise, but XYZ's presale and sports niche may give it the edge.",POSITIVE,SOL | XRP | WIF,ALTCOIN | SOL | XRP | ZRX | WIF,,0,0,BTC Pulse,https://btc-pulse.com/want-to-100x-your-money-solana-xrp-wif-and-xyzverse-could-be-the-cryptos-to-watch-for-2025/,https://resources.cryptocompare.com/news/85/default.png
35931901,https://cryptonews.com/?p=304972,1731081530,California Permanently Revokes BlockFi’s Lending License Two Years After Bankruptcy,"The California DFPI revoked BlockFi’s lending license for unsafe lending practices and violations of the California Financing Law. Following investigations, BlockFi agreed to surrender its license amid bankruptcy, reflecting heightened regulatory oversight in the evolving crypto lending sector. The post California Permanently Revokes BlockFi’s Lending License Two Years After Bankruptcy appeared first on Cryptonews .",NEGATIVE,없음,REGULATION,,0,0,cryptonews,https://cryptonews.com/news/california-revokes-blockfis-lending-license-after-bankruptcy/,https://resources.cryptocompare.com/news/52/35931901.jpeg
35930444,https://cryptobriefing.com/?p=153548,1731081504,"TRON’s meme coin boom: SunPump, $SUNDOG, and Nexmate.AI drive ecosystem growth","TRON's ecosystem growth highlights the transformative potential of meme coins in driving blockchain innovation and expanding user engagement. The post TRON’s meme coin boom: SunPump, $SUNDOG, and Nexmate.AI drive ecosystem growth appeared first on Crypto Briefing .",POSITIVE,없음,BLOCKCHAIN | SPONSORED,,0,0,Crypto Briefing,https://cryptobriefing.com/tron-memecoin-growth-ecosystem/,https://images.cryptocompare.com/news/default/cryptobriefing.png
35930362,https://cryptopotato.com/?p=369801,1731081500,Ripple Price Analysis: Is XRP on the Verge of an Explosive Rally to $0.7 Soon?,"Ripple’s price has been consolidating over the last few months, as Bitcoin has reached new all-time highs. XRP investors are hopeful that things might be about to change soon. XRP Price Analysis By Edris Derakhshi (TradingRage) The USDT Paired Chart The USDT paired chart shows a choppy rangebound price action over the last few months.",NEUTRAL,USDT | XRP,BTC | MARKET | TRADING | USDT | XRP,,0,0,Crypto Potato,https://cryptopotato.com/ripple-price-analysis-is-xrp-on-the-verge-of-an-explosive-rally-to-0-7-soon/,https://resources.cryptocompare.com/news/27/35930362.jpeg
35930386,https://coinpedia.org/?p=377614,1731081484,Ethereum Ecosystem Treasury Tops $22 Billion!,"The post Ethereum Ecosystem Treasury Tops $22 Billion! appeared first on Coinpedia Fintech News As per the latest report, the Ethereum treasury has totaled ~$970 million. In this, ~$788.7 million worth of holding is in crypto and a large part of it comes from ETH tokens. On the other hand, $181.5 million worth of investment is made in non-crypto-related assets. Moreover, its ETH holdings represent around 0.26% of Ethereum’s …",POSITIVE,ETH,ETH | REGULATION,,0,0,coinpedia,https://coinpedia.org/crypto-live-news/ethereum-ecosystem-treasury-tops-22-billion/,https://images.cryptocompare.com/news/default/coinpedia.png
35930931,https://thecoinrise.com/polygon-faces-stiff-competition-from-this-emerging-ai-yield-farming-solution-projected-to-surpass-pol-by-2025/,1731081455,Polygon Faces Stiff Competition From This Emerging AI Yield Farming Solution: Projected to Surpass POL by 2025,Polygon Faces Stiff Competition From This Emerging AI Yield Farming Solution: Projected to Surpass POL by 2025 The post Polygon Faces Stiff Competition From This Emerging AI Yield Farming Solution: Projected to Surpass POL by 2025 appeared first on TheCoinrise.com .,NEGATIVE,없음,MATIC,,0,0,The Coin Rise,https://thecoinrise.com/polygon-faces-stiff-competition-from-this-emerging-ai-yield-farming-solution-projected-to-surpass-pol-by-2025/,https://resources.cryptocompare.com/news/60/35930931.jpeg
35930439,https://en.coinotag.com/could-a-new-sec-leadership-under-trump-reshape-the-future-for-ethereum-regulation/,1731081450,Could a New SEC Leadership Under Trump Reshape the Future for Ethereum Regulation?,"The SEC’s longstanding regulatory grip on the crypto industry may be loosening, prompting optimism among US crypto leaders for a more lenient regulatory environment. In a recent discussion, John Reed",POSITIVE,없음,ETH | REGULATION,,0,0,CoinOtag,https://en.coinotag.com/could-a-new-sec-leadership-under-trump-reshape-the-future-for-ethereum-regulation/,https://resources.cryptocompare.com/news/77/35930439.jpeg
35930275,https://cryptopotato.com/?p=369802,1731081344,Bitcoin Price Analysis: BTC Bulls Eye $80K Following 8% Weekly Surge,"Bitcoin’s price has finally broken its record high after a gradual uptrend over the last couple of months. Investors are now wondering how far BTC can go. Bitcoin Price Analysis By Edris Derakhshi (TradingRage) The Daily Chart On the daily timeframe, it is evident that the price has broken the previous all-time high of $74K",POSITIVE,BTC,BTC | BUSINESS | MARKET | TRADING,,0,0,Crypto Potato,https://cryptopotato.com/bitcoin-price-analysis-btc-bulls-eye-80k-following-8-weekly-surge/,https://resources.cryptocompare.com/news/27/35930275.jpeg
35930267,https://crypto.news/?p=14309183,1731081342,Tether completes first Middle East crude oil transaction,"Tether has finalized its first funding transaction in a Middle East crude oil investment, expanding the crypto company’s ventures beyond its flagship digital assets product. The investment involves a major publicly traded oil company and a leading commodity trader, aiming…",POSITIVE,없음,COMMODITY | USDT,,0,0,crypto.news,https://crypto.news/tether-completes-first-middle-east-crude-oil-transaction/,https://resources.cryptocompare.com/news/73/35930267.jpeg
35930928,https://thecoinrise.com/altcoins-set-to-disrupt-ethereums-dominance-dont-miss-the-next-big-wave/,1731081308,Altcoins Set to Disrupt Ethereum’s Dominance – Don’t Miss the Next Big Wave,Altcoins Set to Disrupt Ethereum’s Dominance – Don’t Miss the Next Big Wave The post Altcoins Set to Disrupt Ethereum’s Dominance – Don’t Miss the Next Big Wave appeared first on TheCoinrise.com .,POSITIVE,없음,ALTCOIN | ETH,,0,0,The Coin Rise,https://thecoinrise.com/altcoins-set-to-disrupt-ethereums-dominance-dont-miss-the-next-big-wave/,https://resources.cryptocompare.com/news/60/35930928.jpeg
35930266,https://en.coinotag.com/surge-in-cardano-ada-trading-volume-suggests-growing-market-interest-and-price-potential/,1731081275,Surge in Cardano (ADA) Trading Volume Suggests Growing Market Interest and Price Potential,"The cryptocurrency landscape is buzzing as Cardano (ADA) experiences an unprecedented trading volume surge, reflecting renewed investor interest. With derivative trading volume soaring by 251%, ADA has swiftly secured its",POSITIVE,ADA,ADA | BUSINESS | MARKET | TRADING,,0,0,CoinOtag,https://en.coinotag.com/surge-in-cardano-ada-trading-volume-suggests-growing-market-interest-and-price-potential/,https://resources.cryptocompare.com/news/77/35930266.jpeg
35930094,https://en.coinotag.com/neiro-experiences-price-fluctuations-as-whale-accumulation-raises-optimism-for-future-gains/,1731081044,NEIRO Experiences Price Fluctuations as Whale Accumulation Raises Optimism for Future Gains,"NEIRO, a rising meme coin on Ethereum, recently hit an all-time high, showcasing strong market dynamics and bullish sentiment among traders. With large holders aggressively accumulating assets, NEIRO’s price demonstrates",POSITIVE,없음,ETH | MARKET | TRADING | FLOW,,0,0,CoinOtag,https://en.coinotag.com/neiro-experiences-price-fluctuations-as-whale-accumulation-raises-optimism-for-future-gains/,https://resources.cryptocompare.com/news/77/35930094.jpeg
35930089,https://www.cryptonewsz.com/blackrock-bitcoin-etf-surpasses-gold-etf/,1731080978,"BlackRock’s Bitcoin ETF Reaches $33.17B, Surpasses Gold ETF","Blackrock’s iShares Bitcoin trust ETF (IBIT) has officially surpassed the iShares Gold Trust ETF (IAU) in net assets,…",POSITIVE,없음,BTC | FIAT,,0,0,CryptoNewsZ,https://www.cryptonewsz.com/blackrock-bitcoin-etf-surpasses-gold-etf/,https://images.cryptocompare.com/news/default/cryptonewsz.png
35929961,https://en.bitcoinsistemi.com/whats-next-for-bitcoin-btc-analysts-share-what-they-expect-after-trumps-victory/,1731080949,What's Next for Bitcoin (BTC)? Analysts Share What They Expect After Trump's Victory!,"Is $100,000 possible in Bitcoin? Analysts explained what they expect from BTC next. Here are the details... Continue Reading: What's Next for Bitcoin (BTC)? Analysts Share What They Expect After Trump's Victory!",NEUTRAL,BTC,BTC | MARKET,,0,0,BitcoinSistemi,https://en.bitcoinsistemi.com/whats-next-for-bitcoin-btc-analysts-share-what-they-expect-after-trumps-victory/,https://resources.cryptocompare.com/news/81/35929961.jpeg
35929918,https://bitcoinworld.co.in/?p=96980,1731080736,"XRP Was a Favorite in Trump’s First Term—Now Geared to Skyrocket, Yet This 19,900% Alternative Draws Investors In!","Once a standout during the previous administration, certain cryptocurrencies are now poised for significant growth. Yet, an emerging digital asset promising nearly twenty-thousand-percent returns is capturing investor attention, potentially overshadowing established favorites. This shift highlights a changing landscape in the crypto market, where new contenders challenge the dominance of well-known coins. XYZVerse, uniting fans across",NEUTRAL,XRP,BUSINESS | MARKET | XRP,,0,0,Bitcoin World,https://bitcoinworld.co.in/xrp-was-a-favorite-in-trumps-first-term-now-geared-to-skyrocket-yet-this-19900-alternative-draws-investors-in/,https://resources.cryptocompare.com/news/82/default.png
35929791,https://en.coinotag.com/breakingnews/ethereum-surpasses-bank-of-america-and-netflix-with-354-7-billion-market-cap/,1731080668,Ethereum Surpasses Bank of America and Netflix with $354.7 Billion Market Cap,"As of November 8th, Ethereum has demonstrated significant growth, with its market capitalization soaring to a staggering $354.7 billion. This impressive valuation places Ethereum above major corporations such as Bank",POSITIVE,없음,ETH | FIAT | MARKET,,0,0,CoinOtag,https://en.coinotag.com/breakingnews/ethereum-surpasses-bank-of-america-and-netflix-with-354-7-billion-market-cap/,https://resources.cryptocompare.com/news/77/35929791.jpeg
35929584,https://crypto.news/?p=14309178,1731080345,Ethereum meme coins explode and this new token is predicted to 100x after raising $25M,"Ethereum meme coins thrive as traders cheer for Trump’s SEC changes. Pepe Unchained presale raises $25M, unveiling Pepe Pump Pad. #patnercontent",POSITIVE,없음,ETH | REGULATION | SPONSORED | ZRX,,0,0,crypto.news,https://crypto.news/ethereum-meme-coins-explode-and-this-new-token-is-predicted-to-100x-after-raising-25m/,https://resources.cryptocompare.com/news/73/35929584.jpeg
35929550,https://www.cryptonewsz.com/peter-schiff-bitcoin-reserve-biden-sell-btc/,1731080334,Bitcoin Reserve at Risk? Peter Schiff Urges Biden to Sell $15.75 BTC Stash,"Economist Peter Schiff has taken to social media to criticize CNBC, claiming the network is biased in favor…",NEGATIVE,BTC,BTC | FIAT,,0,0,CryptoNewsZ,https://www.cryptonewsz.com/peter-schiff-bitcoin-reserve-biden-sell-btc/,https://images.cryptocompare.com/news/default/cryptonewsz.png
35930161,https://thecoinrise.com/etfswap-etfs-announces-bonus-presale-stage-with-50-incentive-heres-what-you-should-know/,1731080293,ETFSwap (ETFS) Announces Bonus Presale Stage With 50% Incentive – Here’s What You Should Know,ETFSwap (ETFS) Announces Bonus Presale Stage With 50% Incentive – Here’s What You Should Know The post ETFSwap (ETFS) Announces Bonus Presale Stage With 50% Incentive – Here’s What You Should Know appeared first on TheCoinrise.com .,POSITIVE,없음,OTHER,,0,0,The Coin Rise,https://thecoinrise.com/etfswap-etfs-announces-bonus-presale-stage-with-50-incentive-heres-what-you-should-know/,https://resources.cryptocompare.com/news/60/35930161.jpeg
35929473,https://en.coin-turk.com/?p=172707,1731080219,Jerome Powell’s Statements Impact Ripple and Crypto Markets,Jerome Powell's statements stirred uncertainty in the crypto market. XRP aims to reach a target of $1.3 amidst market pressures. Continue Reading: Jerome Powell’s Statements Impact Ripple and Crypto Markets The post Jerome Powell’s Statements Impact Ripple and Crypto Markets appeared first on COINTURK NEWS .,NEGATIVE,XRP,MARKET | XRP,,0,0,CoinTurk News,https://en.coin-turk.com/jerome-powells-statements-impact-ripple-and-crypto-markets/,https://resources.cryptocompare.com/news/79/35929473.jpeg
35929470,https://bitcoinworld.co.in/?p=96660,1731080181,SUI Token Reaches All-Time High Amid Record Trading Volume,"SUI Token Reaches All-Time High Amid Record Trading Volume The cryptocurrency market has witnessed a surge of renewed interest, and the SUI token from the Sui blockchain ecosystem has been a significant player in this trend. Recently, SUI reached a remarkable milestone, setting an all-time high (ATH) price of $2.37 while simultaneously achieving a record-breaking",POSITIVE,SUI,BLOCKCHAIN | MARKET | TRADING | SUI,,0,0,Bitcoin World,https://bitcoinworld.co.in/sui-token-reaches-all-time-high/,https://resources.cryptocompare.com/news/82/default.png
35929416,https://news.bitcoin.com/?p=683322,1731080112,QCP Capital: Trump’s Election Win Impacts Crypto and Treasury Markets,"QCP Capital reports that the 2024 U.S. presidential election outcome is significantly influencing both cryptocurrency and treasury markets. QCP Highlights Trump Victory’s Effect on Bitcoin and Treasury Yields Highlighting a Positive Feedback Loop According to QCP Capital’s latest market updates, Donald Trump’s success in the 2024 presidential race has sparked notable financial shifts. The dollar",NEUTRAL,없음,BTC | MARKET | REGULATION,,0,0,Bitcoin.com,https://news.bitcoin.com/qcp-capital-trumps-election-win-impacts-crypto-and-treasury-markets/,https://resources.cryptocompare.com/news/14/35929416.jpeg
35929361,https://coinpedia.org/?p=377641,1731080049,Tether Trade Finance Completes Funding of First Middle Eastern Crude Oil Transaction,"The post Tether Trade Finance Completes Funding of First Middle Eastern Crude Oil Transaction appeared first on Coinpedia Fintech News In the latest announcement, Tether has revealed that it has financed a physical crude oil transaction between a publicly traded super-major oil company and a top-tier commodity trader. Completed in October 2024, the transaction was to facilitate the loading and transporting of 670,000 barrels of Middle Eastern crude oil, valued at approximately $45 million. This …",POSITIVE,없음,COMMODITY | USDT,,0,0,coinpedia,https://coinpedia.org/crypto-live-news/tether-trade-finance-completes-funding-of-first-middle-eastern-crude-oil-transaction/,https://images.cryptocompare.com/news/default/coinpedia.png
35929284,https://btc-pulse.com/?p=27261,1731079999,What Ethereum and Solana Achieved During Trump’s Term—Now Analysts Bet on These Altcoins!,"Ethereum and Solana surged under Trump. Now, XYZVerse leads memecoin hype, SUI simplifies blockchain, and Ondo offers asset-backed stability.",POSITIVE,SUI,ALTCOIN | BLOCKCHAIN | ETH | SOL | SUI,,0,0,BTC Pulse,https://btc-pulse.com/what-ethereum-and-solana-achieved-during-trumps-term-now-analysts-bet-on-these-altcoins/,https://resources.cryptocompare.com/news/85/default.png
35929241,https://crypto.news/?p=14309163,1731079926,"Flare, Red Date launch KYC solution for Chinese nationals in Hong Kong","Flare has partnered with Red Date Technology to introduce a new identity verification system for Mainland Chinese visitors in Hong Kong. The system, which uses decentralized identity technology, allows users to go through KYC checks while keeping their personal information…",POSITIVE,없음,ASIA | TECHNOLOGY,,0,0,crypto.news,https://crypto.news/flare-red-date-launch-kyc-solution-for-chinese-nationals-in-hong-kong/,https://resources.cryptocompare.com/news/73/35929241.jpeg
35929155,https://dailyhodl.com/?p=308517,1731079839,"US City Handing $600,000 To Residents As New Guaranteed Income Pilot Witnesses ‘Astounding’ Demand","A group of residents in one US city will soon receive thousands of dollars from a new guaranteed income pilot program. Officials in the city of Salem, Massachusetts say they had to abruptly close registrations for Uplift Salem due to an “astounding” amount of demand. The program will distribute a total of $600,000 to people The post US City Handing $600,000 To Residents As New Guaranteed Income Pilot Witnesses ‘Astounding’ Demand appeared first on The Daily Hodl .",POSITIVE,없음,OTHER,,0,0,The Daily Hodl,https://dailyhodl.com/2024/11/08/us-city-handing-600000-to-residents-as-new-guaranteed-income-program-witnesses-astounding-demand/,https://images.cryptocompare.com/news/default/dailyhodl.png
