뉴스ID,뉴스GUID,일자(UTC timestamp),뉴스제목,본문,SENTIMENT,주요코인,카테고리,작성자,추천수,비추천수,출처,뉴스URL,이미지URL
42387200,0r6Zag11PPDEMKgUXBltmB,1624965772,"Bitcoin Gathers Upside Momentum, Faces Resistance Near $40K","Bitcoin (BTC) buyers remained active during Asian trading hours as they defended initial support of about $33,800. The next level of resistance is seen between $38,000 and $40,000, which is near the top of a monthlong range.      The $30,000 support level was retested over the weekend, marking a higher low from the June 22 shakeout of around $29,000. Price remains elevated and could break above the 100-period moving average on the four-hour chart.      Bitcoin was trading at about $35,000 at press time and is up 4% over the past 24 hours.    Bitcoin is attempting to reverse a short-term downtrend, which could yield further upside, especially since the relative strength index (RSI) on the daily chart is not yet overbought.  The corrective phase since May appears to be slowing as buyers return at support levels. A temporary relief rally could stabilize selling pressure until overbought signals appear on the charts.  For now, bitcoin is stuck in a range as sellers have maintained a series of lower price highs since April.",POSITIVE,BTC,BTC | MARKET | TRADING,Damanick Dantes,0,0,CoinDesk,https://coindesk.com/markets/2021/06/29/bitcoin-gathers-upside-momentum-faces-resistance-near-40k,https://cdn.sanity.io/images/s3y3vcno/production/00f3dfb9d3b5f0db1ee0efdc33b755ca142bf86d-1966x1252.png?w=300&h=300&fit=crop
13404867,https://cryptopotato.com/?p=126250,1624965027,Hydropower Plants in China Put on Sale Offering Secret Bitcoin Mining: Report,"Amid the crackdown on BTC mining, owners of hydropower plants in China are selling their businesses and offering &apos;secret&apos; mining.",NEGATIVE,BTC,ASIA | BTC | ICO | MINING,,0,0,Crypto Potato,https://cryptopotato.com/hydropower-plants-in-china-put-on-sale-offering-secret-bitcoin-mining-report/,https://images.cryptocompare.com/news/default/cryptopotato.png
13482655,https://cryptobriefing.com/?p=90009,1624964929,"Erik Voorhees Bets on Ethereum DEXs, THORChain",,POSITIVE,없음,ETH,,0,0,Crypto Briefing,https://cryptobriefing.com/erik-voorhees-bets-ethereum-dexs-thorchain/,https://images.cryptocompare.com/news/default/cryptobriefing.png
13417439,https://coinpedia.org/?p=101518,1624964536,"Ethereum Price Breaches the Critical $2000 level, Is This The Start of ETH Price Rally?","The post Ethereum Price Breaches the Critical $2000 level, Is This The Start of ETH Price Rally? appeared first on Coinpedia - Fintech &amp; Cryptocurreny News Media| Crypto GuideDespite the fact that Bitcoin remains far more valuable, Ethereum has outperformed Bitcoin in terms of gains. In a year, Bitcoin has increased by 245 percent. During the same time frame, the cryptocurrency has increased by 730 percent. Following the previous catastrophe, the ETH Price has exhibited a remarkable comeback this week. ETH Price was …",POSITIVE,ETH,BTC | ETH | TRADING,,0,0,coinpedia,https://coinpedia.org/ethereum/ethereum-price-breaches-the-critical-level/,https://images.cryptocompare.com/news/default/coinpedia.png
13429522,https://news.bitcoin.com/?p=470582,1624964447,Nigerian Learning Institution Says It Now Accepts Crypto as Payment for School Fees,"A learning institution in Nigeria&apos;s Kano state, the New Oxford Science Academy, recently announced it will be accepting cryptocurrency as payment for school fees. According to the school&apos;s proprietor, Sabi&apos;u Musa Haruna, the institution arrived at this decision after consulting parents and guardians of the students. Move Consistent With Global Trends As reported by the ...",POSITIVE,없음,OTHER,,0,0,Bitcoin.com,https://news.bitcoin.com/nigerian-learning-institution-says-it-now-accepts-cryptos-as-payment-for-school-fees/,https://images.cryptocompare.com/news/default/bitcoincom.png
13445271,https://bitcoinist.com/?p=153619,1624964444,AscendEX Lists Radix,"A DeFi Protocol with Developer Incentives AscendEX (formerly BitMax), a global cryptocurrency financial platform with a comprehensive product suite, is thrilled to announce the listing of the Radix tokens (EXRD and XRD) under the pairs USDT/XRD and USDT/EXRD on June 29 at 1 p.m. UTC. Radix intends to remove the technology barriers limiting the expansion ...",POSITIVE,없음,BLOCKCHAIN | TECHNOLOGY,,0,0,Bitcoinist,https://bitcoinist.com/ascendex-lists-radix/?utm_source=rss&utm_medium=rss&utm_campaign=ascendex-lists-radix,https://images.cryptocompare.com/news/default/bitcoinist.png
13272573,https://ambcrypto.com/?p=167413,1624964405,This Bitcoin metric hasn’t seen these levels since the very early BTC days,"The bitcoin market has been witnessing heavy drawdowns since the beginning of June. As the month comes to an end, the largest digital asset has dropped by 30% and was still reflecting high bearishness. This falling value of the digital asset has directly impacted the earnings of miners, who were already facing another concern on ...",NEGATIVE,BTC,BTC | MARKET,,0,0,AMB Crypto,https://ambcrypto.com/this-bitcoin-metric-hasnt-seen-these-levels-since-the-very-early-btc-days/,https://images.cryptocompare.com/news/default/ambcrypto.png
13340636,https://cointelegraph.com/news/crypto-com-taps-circle-for-global-dollar-deposits,1624964370,Crypto.com taps Circle for global dollar deposits,Crypto.com and Circle&apos;s partnership enabled U.S. dollar deposits and receiving USDC for users in more than 30 countries.,POSITIVE,USDC,USDC,,0,0,CoinTelegraph,https://cointelegraph.com/news/crypto-com-taps-circle-for-global-dollar-deposits,https://images.cryptocompare.com/news/default/cointelegraph.png
13574144,https://www.cryptopolitan.com/?p=100454,1624964218,"Ethereum price analysis: Ethereum continues moving towards $2,200 resistance, reversal later this week?","TL;DR Breakdown ETH continued moving higher overnight. Bulls continue targeting the $2,200 resistance. More downside likely to be seen latest this week. Ethereum price analysis is bullish for today as the market continues pushing towards the $2,200 resistance. Once it is reached, we can expect ETH/USD to attempt another push lower and set a lower ...",NEUTRAL,ETH,ETH | MARKET | TRADING,,0,0,Cryptopolitan,https://www.cryptopolitan.com/ethereum-price-analysis-2021-06-29/,https://images.cryptocompare.com/news/default/cryptopolitan.png
13391031,https://decrypt.co/?p=74742,1624964106,Deutsche Börse Group Acquires Majority Stake in Crypto Finance AG,International exchange organization Deutsche Börse Group aims to expand its crypto-focused services for institutional clients.,POSITIVE,없음,BUSINESS | EXCHANGE,,0,0,Decrypt,https://decrypt.co/74742/deutsche-borse-group-acquires-majority-stake-in-crypto-finance-ag,https://images.cryptocompare.com/news/default/decrypt.png
13460617,https://www.cryptonewsz.com/?p=83556,1624963507,SingularityDAO in Pact With Unifarm,"SingularityDAO has partnered with UniFarm to enable digital asset investors to play a part in the DeFi ecosystem. Cohort 15 from UniFarm, which goes active from today on the Ethereum platform, will now include SDAI as well. Four tokens in the Cohort 15 stable-SDAO, NUX, GAINS, and UFARM-can be farmed by users for 90 days …",POSITIVE,없음,BUSINESS | ETH,,0,0,CryptoNewsZ,https://www.cryptonewsz.com/singularitydao-in-pact-with-unifarm/,https://images.cryptocompare.com/news/default/cryptonewsz.png
42387191,0r6Zag11PPDEMKgUXBlted,1624962957,Crypto Firms Are Giving Up UK Regulatory Registration Bids: Report,"Crypto firms are dropping their bids to register with the U.K.'s Financial Conduct Authority (FCA) amid mounting regulatory scrutiny of the industry.    The number of companies abandoning their efforts to register with the financial watchdog has increased by a quarter in less than a month, Reuters reported Monday.  Fifty-one had dropped their bids in early June, a number that has now increased to 64.  The news follows a development over the weekened that the FCA banned crypto exchange Binance from undertaking any regulated activities in the U.K.  Binance withdrew its application in mid-May, an FCA spokesperson said.  Crypto firms have until March 31 to register with the FCA for the regulator to determine whether they are meeting anti-money laundering and counter-terrorist financing standards.  Just six companies have successfully completed registration, the most recent of which was Mode Global. That was announced last week.  Read more: UK Financial Markets Regulator Warns About Unregistered Crypto-Asset Firms: Report",NEGATIVE,없음,EXCHANGE | MARKET | BNB,Jamie Crawley,0,0,CoinDesk,https://coindesk.com/markets/2021/06/29/crypto-firms-are-giving-up-uk-regulatory-registration-bids-report,https://cdn.sanity.io/images/s3y3vcno/production/b6db8cd206ec3786ffaf00fd353af905e9c39f27-1500x1001.jpg?w=300&h=300&fit=crop
13445272,https://bitcoinist.com/?p=153610,1624962739,President Bukele Clears Up Misconceptions About The Government’s Chivo Wallet,"On June 24th, in a national broadcast, President Bukele cleared up misconceptions about El Salvador&apos;s Bitcoin Law and presented the government&apos;s wallet. That created a whole lot of new misconceptions about the app itself, the newly minted Chivo Wallet. Most of the criticism is about the personal data the app aims to collect. It will ...",NEUTRAL,없음,BTC | REGULATION,,0,0,Bitcoinist,https://bitcoinist.com/president-bukele-clears-up-misconceptions-about-the-governments-chivo-wallet/?utm_source=rss&utm_medium=rss&utm_campaign=president-bukele-clears-up-misconceptions-about-the-governments-chivo-wallet,https://images.cryptocompare.com/news/default/bitcoinist.png
13391032,https://decrypt.co/?p=74732,1624962311,GBP Deposits and Withdrawals ‘Suspended’ for Binance UK Customers,"Binance can still be accessed by UK customers, but GBP deposits and withdrawals are currently suspended for both Faster Payments and bank cards.",NEGATIVE,없음,BUSINESS | EXCHANGE | FIAT | BNB,,0,0,Decrypt,https://decrypt.co/74732/fiat-deposits-and-withdrawals-suspended-for-binance-uk-customers,https://images.cryptocompare.com/news/default/decrypt.png
13482656,https://cryptobriefing.com/?p=90570,1624962104,Cathie Wood’s ARK Invest Plans Bitcoin ETF,,POSITIVE,없음,BTC | BUSINESS,,0,0,Crypto Briefing,https://cryptobriefing.com/cathie-woods-ark-invest-plans-bitcoin-etf/,https://images.cryptocompare.com/news/default/cryptobriefing.png
13340637,https://cointelegraph.com/news/deutsche-boerse-acquires-majority-ownership-of-crypto-finance-ag,1624962079,Deutsche Boerse acquires majority ownership of Crypto Finance AG,The German stock exchange operator plans to expand its regulated crypto-asset ecosystem across the European market.,POSITIVE,없음,BUSINESS | EXCHANGE | MARKET,,0,0,CoinTelegraph,https://cointelegraph.com/news/deutsche-boerse-acquires-majority-ownership-of-crypto-finance-ag,https://images.cryptocompare.com/news/default/cointelegraph.png
13460618,https://www.cryptonewsz.com/?p=83568,1624961730,Reef Finance Integrates NFTify on its Blockchain Platform,"In an important collaboration, Reef Finance integrated NFTify on its blockchain ecosystem, Reef Chain. This will pave the way for NFT stores on NFTify to create the store on the blockchain ecosystem of Reef. In other words, this coming together will open up a new world of possibilities as DeFi services can now be accessed …",POSITIVE,없음,BLOCKCHAIN,,0,0,CryptoNewsZ,https://www.cryptonewsz.com/reef-finance-integrates-nftify-on-its-blockchain-platform/,https://images.cryptocompare.com/news/default/cryptonewsz.png
13292997,https://cryptonews.com/news/deutsche-borse-group-tp-icap-make-crypto-bets-with-new-plans-10858.htm,1624961627,"Deutsche Börse Group, TP ICAP Make Crypto Bets With New Plans, Investments","Two major players in the traditional finance world just announced their new crypto moves. First, major UK-based interdealer broker TP ICAP has partnered with US-based mutual fund giant Fidelity Investments and Zodia Custody to launch a crypto trading platform, according to Reuters. Meanwhile, stock exchange giant Deutsche Börse Group said it acquired a majority stake in Crypto",POSITIVE,없음,BUSINESS | EXCHANGE | TRADING,,0,0,cryptonews,https://cryptonews.com/news/deutsche-borse-group-tp-icap-make-crypto-bets-with-new-plans-10858.htm,https://images.cryptocompare.com/news/cryptonews/fAc00880008.jpeg
13404868,https://cryptopotato.com/?p=126304,1624961422,Financial Giant TP ICAP Partners With Fidelity and StanChart to Offer Bitcoin Trading and Custody,"One of the world&apos;s largest interdealer brokers, TP ICAP, has partnered with Fidelity to launch cryptocurrency custody services.",POSITIVE,없음,BTC | TRADING,,0,0,Crypto Potato,https://cryptopotato.com/financial-giant-tp-icap-partners-with-fidelity-and-stanchart-to-offer-bitcoin-trading-and-custody/,https://images.cryptocompare.com/news/default/cryptopotato.png
13391033,https://decrypt.co/?p=74730,1624961066,Nansen Raises $12 Million in Series A Funding Led by Andreessen Horowitz,"In its bid to go big on crypto, Silicon Valley VC firm Andreessen Horowitz has invested in Nansen, a data analytics firm focused on crypto movements.",POSITIVE,없음,BUSINESS,,0,0,Decrypt,https://decrypt.co/74730/nansen-raises-12-million-in-series-a-funding-led-by-andreessen-horowitz,https://images.cryptocompare.com/news/default/decrypt.png
13445273,https://bitcoinist.com/?p=153607,1624960886,NFT Tech and DigiCol Join Forces to Enhance the NFT Economy,"NFT Tech, an upcoming infrastructure provider for the non-fungible token industry, has recently announced it is forming a strategic collaboration with DigiCol, a one-click NFT marketplace, to engineer the next generation of NFT infrastructure. Both platforms have established a name in the industry for providing a streamlined experience for artists, collectors, and the crypto-curious. The ...",POSITIVE,없음,ICO,,0,0,Bitcoinist,https://bitcoinist.com/nft-tech-and-digicol-join-forces-to-enhance-the-nft-economy/?utm_source=rss&utm_medium=rss&utm_campaign=nft-tech-and-digicol-join-forces-to-enhance-the-nft-economy,https://images.cryptocompare.com/news/default/bitcoinist.png
13340638,https://cointelegraph.com/news/blockchain-analytics-firm-nansen-secures-12m-in-andreessen-horowitz-led-raise,1624960800,Blockchain analytics firm Nansen secures $12M in Andreessen Horowitz-led raise,The investment round will allow Nansen to continue building its analytics suite while also expanding its services to emerging networks like Polygon and Binance Smart Chain.,POSITIVE,없음,BLOCKCHAIN | EXCHANGE | ICO | MATIC | BNB,,0,0,CoinTelegraph,https://cointelegraph.com/news/blockchain-analytics-firm-nansen-secures-12m-in-andreessen-horowitz-led-raise,https://images.cryptocompare.com/news/default/cointelegraph.png
42387201,0r6Zag11PPDEMKgUXBltoh,1624960800,A16z Leads $12M Investment in DeFi-Native Crypto Tracing Firm Nansen,"Venture capital’s excitement over blockchain analytics has spilled over into decentralized finance (DeFi).      Nansen, a DeFi-native crypto tracer, has raised $12 million in a Series A funding round led by Andreessen Horowitz (a16z). Also participating in the round was Skyfall Ventures, Coinbase Ventures, imToken Ventures, Mechanism Capital and QCP Capital.      Tracking crypto as it flows from wallets to exchanges and other platforms has become a whole sub-industry within the digital-asset space, with major funding rounds for Chainalysis, CipherTrace and TRM Labs in recent weeks.      But blockchain analytics is often associated with regulators and law enforcement, meaning that, perhaps unfairly, it has a boomer feel about it. Not so for Singapore-based Nansen.      “Blockchain analytics has been focused on law enforcement, government agencies, tax authorities and so forth,” said Nansen CEO Alex Svanevik. “But our philosophy has always been that people on the ground floor of crypto, the actual market participants, should have access to the best on-chain analytics as well.”    Crypto-tracking boom    Since the explosion of interest in DeFi, Nansen’s take has been to track flows of money between different smart contracts, identifying the hottest yield farming platform, for example. Currently, the platform has labeled some 90 million addresses, equating to about 70% of all on-chain DeFi volume, according to Svanevik.      “As participation in the first truly open global financial markets grows, traders and collectors of all kinds – retail novices, institutional professionals, independent experts and more – will want to understand what the smart money is doing across all blockchains,” a16z General Partner Chris Dixon said in a statement.    Read more: Andreessen Horowitz Rakes In $2.2B for Third Crypto Venture Fund    It’s worth noting that major blockchain analytics platforms like Elliptic and CipherTrace are highly adept at following fund flows through decentralized exchanges and DeFi pools. Unlike those firms, Nansen isn’t focused on risk scoring per se, but the service provides the data to allow users to make up their own minds, said Svanevik.      “We don’t have any specific position with regards to regulations on how we think things should develop. We’re not basing our company on some KYC'd version of DeFi coming out in the future,” he said, referring to know your customer rules.",POSITIVE,없음,BLOCKCHAIN | EXCHANGE | MARKET | MINING | REGULATION,Ian Allison,0,0,CoinDesk,https://coindesk.com/business/2021/06/29/a16z-leads-12m-investment-in-defi-native-crypto-tracing-firm-nansen,https://cdn.sanity.io/images/s3y3vcno/production/ce3a9ce5a5d8d8ad5907fd88e2369be98f1b8b0e-1500x1000.jpg?w=300&h=300&fit=crop
13482657,https://cryptobriefing.com/?p=90551,1624960347,Morgan Stanley Reveals Stake in Grayscale Bitcoin Trust,,POSITIVE,없음,BTC | BUSINESS,,0,0,Crypto Briefing,https://cryptobriefing.com/morgan-stanley-reveals-stake-grayscale-bitcoin-trust/,https://images.cryptocompare.com/news/default/cryptobriefing.png
13404869,https://cryptopotato.com/?p=126291,1624959863,CryptoCom Has Partnered With Formula 1 to Become its Global Partner,Crypto.com has announced a significant partnership with Formula 1 ahead of the Pirelli British Grand Prix 2021.,POSITIVE,없음,OTHER,,0,0,Crypto Potato,https://cryptopotato.com/cryptocom-has-partnered-with-formula-1-to-become-its-global-partner/,https://images.cryptocompare.com/news/default/cryptopotato.png
13495166,https://seekingalpha.com/article/4437014-crypto-stocks-hash-rate-collapse-windfall-for-bitcoin-miners-bullish?utm_source=cryptocompare.com&utm_medium=referral,1624959829,Crypto Stocks: Hash Rate Collapse Is A Windfall For Bitcoin Miners - We're Bullish,"The global bitcoin network hash rate has collapsed to a 1-year low following the latest China crackdown on crypto mining forcing production to go offline.Bitcoin mining companies with operations outside of China benefit from a higher share of the network reward adding to current production capacity and implied revenues.While the hash rate will likely normalize higher over time, setup is bullish for crypto stocks as a near-term windfall balancing out what have been weaker price trends.",POSITIVE,없음,ASIA | BTC | MINING | TRADING,,0,0,Seeking Alpha,https://seekingalpha.com/article/4437014-crypto-stocks-hash-rate-collapse-windfall-for-bitcoin-miners-bullish?utm_source=cryptocompare.com&utm_medium=referral,https://images.cryptocompare.com/news/default/seekingalpha.png
13460619,https://www.cryptonewsz.com/?p=83558,1624959799,Cardano (ADA) Ready to Slingshot! Have You Invested?,"Cardano has been through some tough times, and investors have been mostly sitting on position losses. With each upside hit, ADA continues to excite and give new hopes to the investors. Cardano Technical Analysis After prolonged negative stress and retesting on long-term support levels, Cardano is all gearing up towards a major upside move. Not …",POSITIVE,ADA,ADA | BUSINESS | MARKET | TRADING,,0,0,CryptoNewsZ,https://www.cryptonewsz.com/cardano-ada-ready-to-slingshot-have-you-invested/,https://images.cryptocompare.com/news/default/cryptonewsz.png
13417440,https://coinpedia.org/?p=101520,1624959780,"Ethereum Price May To Resume Bull Run Soon, May Hit $3000 in July","The post Ethereum Price May To Resume Bull Run Soon, May Hit $3000 in July appeared first on Coinpedia - Fintech &amp; Cryptocurreny News Media| Crypto GuideEthereum price had lost the plot in the past few days as the attempts to hold above $2000 failed multiple time. However, the ETH price smashed the levels successfully in the early trading hours and could also provide a good buying opportunity in the coming days. The ETH price currently trading around $2149 could experience …",POSITIVE,ETH,ETH | TRADING,,0,0,coinpedia,https://coinpedia.org/price-analysis/ethereum-price-may-resume-bull-run/,https://images.cryptocompare.com/news/default/coinpedia.png
13340639,https://cointelegraph.com/news/binance-tackles-travel-rule-compliance-after-multiple-bans,1624959635,Binance tackles travel rule compliance after multiple bans,"Following bans in Japan, the U.K. and Ontario, Binance is ramping up its compliance efforts with a specialized tool developed by crypto intelligence firm CipherTrace.",NEUTRAL,없음,ASIA | EXCHANGE | BNB,,0,0,CoinTelegraph,https://cointelegraph.com/news/binance-tackles-travel-rule-compliance-after-multiple-bans,https://images.cryptocompare.com/news/default/cointelegraph.png
42387192,0r6Zag11PPDEMKgUXBltft,1624959000,Crypto.com Extends Sports Sponsorships to Formula 1,"Cryptocurrency exchange Crypto.com has extended its sports sponsorships through a partnership with Formula 1.    The Hong Kong-based exchange has become an inaugural partner of F1's new ""Sprint"" format, according to an announcement Tuesday.  Crypto.com's branding will be present trackside at all F1 races for the remainder of the 2021 season starting with British Grand Prix at Silverstone on July 17.  The partnership furthers Crypto.com's presence at major sporting events; the exchange sponsored Italian soccer's Coppa Italia final in May.  It also signed a deal with the National Hockey League team Montreal Canadiens in March.  Read more: Crypto.com Joins With Circle to Enable USD Deposits for USDC",POSITIVE,USDC,ASIA | EXCHANGE | SPONSORED | USDC,Jamie Crawley,0,0,CoinDesk,https://coindesk.com/markets/2021/06/29/cryptocom-extends-sports-sponsorships-to-formula-1,https://cdn.sanity.io/images/s3y3vcno/production/e21df3ddb476522731f8c9ca61b1da07d48a29c0-1280x720.jpg?w=300&h=300&fit=crop
42387193,0r6Zag11PPDEMKgUXBltdN,1624957661,Deutsche Börse Moves Into Crypto Custody With $108.6M+ Buy of Crypto Finance AG Stake,"Deutsche Börse Group said it has agreed to buy a two-thirds stake in Crypto Finance AG for more than US$108.6 million, moving the Germany-based exchange deeper into the cryptocurrency asset class by allowing it to now offer custody and other crypto-related services to institutional and professional clients.      Deutsche Börse said its investment was in the ""moderate"" three-digit Swiss franc million range. Given that 100 million Swiss francs are currently valued at US$108.6 million, the price has to be at least that much.      The exchange said the deal extends its offering for digital assets by providing a direct entry point for investments, including post-trade services such as custody. Switzerland-based Crypto Finance offers 24/7 trading and brokerage of more than 200 digital assets in combination with in-house custody.      Through connections to a variety digital asset venues worldwide, Crypto Finance bridges the problem of liquidity fragmentation in the market, Deutsche Börse said. Professional and institutional clients can directly invest in digital assets, without having to set-up their own infrastructure and operational frameworks, the exchange said.      Deutsche Börse said its goal is to create a neutral, transparent, and highly scalable digital asset ecosystem under European regulation.    Read more: Commerzbank, Deutsche Börse Team Up for Tokenized Real Estate and Art Marketplace    “Digital assets will transform the financial industry,"" said Thomas Book, executive board member for Trading & Clearing at Deutsche Börse. ""There is increasing demand from established financial institutions who are looking to become active in this new asset class and want a trusted partner.”      Grabbing a stake in the Swiss firm is not Deutsche Börse’s first foray into cryptocurrency custody, however, as it was originally a member of the Swiss-based Custodigit consortium alongside Swisscom and digital asset bank Sygnum – but has since left the group.      The Frankfurt Stock Exchange owner has now found another road into custody, with a particular focus on Switzerland as well as Singapore, where Crypto Finance also has a presence.      Crypto Finance founder and CEO Jan Brzezek will continue to run the business.      The transaction is expected to close in Q4 following regulatory approvals.      UPDATED (June 29, 09:33 UTC): Adds background on Deutsche Börse's strategy.",POSITIVE,없음,ASIA | BUSINESS | EXCHANGE | FIAT | TRADING,"Kevin Reynolds, Ian Allison",0,0,CoinDesk,https://coindesk.com/markets/2021/06/29/deutsche-borse-moves-into-crypto-custody-with-1086m-buy-of-crypto-finance-ag-stake,https://cdn.sanity.io/images/s3y3vcno/production/aae428320dc80b1e1a76b664899548d0271b0314-2560x1920.jpg?w=300&h=300&fit=crop
