뉴스ID,뉴스GUID,일자(UTC timestamp),뉴스제목,본문,SENTIMENT,주요코인,카테고리,작성자,추천수,비추천수,출처,뉴스URL,이미지URL
35941305,https://thedefiant.io/news/blockchains/ethereum-foundation-reveals-970-2m-assets-october-31-2024-81-3-crypto-1441b4b9,1731069676,"Ethereum Foundation Reveals $970.2M in Assets as of October 31, 2024, with 81.3% in Crypto","The Ethereum Foundation has released its 2024 financial report, revealing it holds $970M",NEUTRAL,없음,ETH | FIAT,,0,0,The Defiant,https://thedefiant.io/news/blockchains/ethereum-foundation-reveals-970-2m-assets-october-31-2024-81-3-crypto-1441b4b9,https://resources.cryptocompare.com/news/101/35941305.jpeg
35922496,https://coinpedia.org/?p=377525,1731069656,77% PEPE Investors Are Now in Profit As Price Explodes,"The post 77% PEPE Investors Are Now in Profit As Price Explodes appeared first on Coinpedia Fintech News PEPE has captured attention with a notable 21% price surge over the past week, raising its value to $0.00001098. This rally has been a big win for holders, with around 243,500 investors—or 77% of them—now in profit. Still, some remain cautious about whether PEPE can sustain this momentum. The main question: Will PEPE keep rising, …",POSITIVE,PEPE,BUSINESS | TRADING | PEPE,,0,0,coinpedia,https://coinpedia.org/price-analysis/pepe-price-soars-21-243500-investors-in-profit/,https://images.cryptocompare.com/news/default/coinpedia.png
35926659,https://cryptonews.com/?p=304785,1731069589,"Nigerian Authorities Fine Two Crypto Firms $30,000","Nigerian authorities have fined two crypto firms, Egomsinachi Road Autos Limited and Chimera Log & Haulage Services Limited, $30,000 for illegal USDT-to-Naira transactions, continuing the EFCC's crackdown on unlicensed crypto trading in the country. The post Nigerian Authorities Fine Two Crypto Firms $30,000 appeared first on Cryptonews .",NEGATIVE,없음,TRADING,,0,0,cryptonews,https://cryptonews.com/news/nigerian-authorities-fine-two-crypto-firms-30000/,https://resources.cryptocompare.com/news/52/35926659.jpeg
35925481,https://cryptodaily.co.uk/2024/11/crypto-pundit-predicts-450-rally-for-ripple-xrp-while-betting-on-rising-competitor-to-bring-in-17800-returns-in-the-next-3-months,1731069549,Crypto Pundit Predicts 450% Rally for Ripple (XRP) While Betting on Rising Competitor to Bring in 17800% Returns in the Next 3 Months,"Ripple (XRP) stands at a pivotal moment with analysts forecasting a dramatic 450% price surge, potentially marking it as a leading player in the crypto market. This bold outlook comes as XRP approaches a crucial resistance level, bolstered by recent ETF developments and Ripple's network expansion. Meanwhile, Rexas Finance’s (RXS) innovative approach to real-world asset (RWA) tokenization could yield an impressive 17,800% return to a price of $33.2 per Rexas token,",POSITIVE,XRP,MARKET | TRADING | XRP,,0,0,Crypto Daily,https://cryptodaily.co.uk/2024/11/crypto-pundit-predicts-450-rally-for-ripple-xrp-while-betting-on-rising-competitor-to-bring-in-17800-returns-in-the-next-3-months,https://resources.cryptocompare.com/news/75/35925481.jpeg
35922360,https://en.coinotag.com/trumps-election-victory-sparks-optimism-for-bitcoin-and-crypto-market-growth-potential/,1731069462,Trump’s Election Victory Sparks Optimism for Bitcoin and Crypto Market Growth Potential,"Donald Trump’s recent election victory has catalyzed a remarkable rally in both traditional and cryptocurrency markets, propelling Bitcoin and crypto stocks to new heights. The election results have rejuvenated optimism",POSITIVE,없음,BTC | MARKET | TRADING,,0,0,CoinOtag,https://en.coinotag.com/trumps-election-victory-sparks-optimism-for-bitcoin-and-crypto-market-growth-potential/,https://resources.cryptocompare.com/news/77/35922360.jpeg
35922263,https://en.coin-turk.com/?p=172650,1731069400,Cardano Sees Significant Price Surge and Increased Market Activity,"Cardano experienced a significant price surge, reaching a four-month high. Increased market activity indicates strong interest from investors and traders. Continue Reading: Cardano Sees Significant Price Surge and Increased Market Activity The post Cardano Sees Significant Price Surge and Increased Market Activity appeared first on COINTURK NEWS .",POSITIVE,없음,ADA | BUSINESS | MARKET | TRADING,,0,0,CoinTurk News,https://en.coin-turk.com/cardano-sees-significant-price-surge-and-increased-market-activity/,https://resources.cryptocompare.com/news/79/35922263.jpeg
35922282,https://crypto.news/?p=14309097,1731069386,"DTX Exchange surpasses Cardano, Shiba Inu in weekly searches with 220% rally","With a 220% increase in the last few weeks and 40,000+ signups per week, DTX is getting noticed by investors looking for new projects with big growth. #partnercontent",POSITIVE,없음,ADA | EXCHANGE | SHIB | SPONSORED | TRADING,,0,0,crypto.news,https://crypto.news/dtx-exchange-surpasses-cardano-shiba-inu-in-weekly-searches-with-220-rally/,https://resources.cryptocompare.com/news/73/35922282.jpeg
35926658,https://cryptonews.com/?p=304829,1731069341,"Ether Eyes $3.2K Breakout Amid Positive ETF Inflows, Trump Victory Boosts Sentiment","While bullish indicators such as Ether ETF inflows point to potential upside for ETH, recent spikes in derivatives trading volume suggest increased volatility. The post Ether Eyes $3.2K Breakout Amid Positive ETF Inflows, Trump Victory Boosts Sentiment appeared first on Cryptonews .",POSITIVE,ETH,ETH | TRADING,,0,0,cryptonews,https://cryptonews.com/news/ether-eyes-3-2k-breakout-amid-positive-etf-inflows-trump-victory-boosts-sentiment/,https://resources.cryptocompare.com/news/52/35926658.jpeg
35922419,https://www.cryptopolitan.com/?p=610898,1731069295,FTX sues Crypto.com to recover $11.4M linked to Alameda Research,"Bankrupt exchange FTX has sued Crypto.com to recover Alameda Research funds. In a lawsuit filed before the US Bankruptcy Court for the District of Delaware, FTX claims that Crypto.com holds $11.4 million belonging to its sister trading firm Alameda and has refused to return it. According to FTX, Alameda had an account with Crypto.com before",NEGATIVE,없음,EXCHANGE | TRADING | RESEARCH,,0,0,Cryptopolitan,https://www.cryptopolitan.com/ftx-sues-crypto-com-to-recover-funds/,https://resources.cryptocompare.com/news/43/35922419.jpeg
35930159,https://thecoinrise.com/ethereum-foundation-reveals-970m-treasury-amid-calls-for-transparency/,1731069165,Ethereum Foundation Reveals $970M Treasury Amid Calls for Transparency,"The Ethereum Foundation currently holds $970.2 million in combined assets, affirming its choice to prioritize Ethereum in its treasury. The post Ethereum Foundation Reveals $970M Treasury Amid Calls for Transparency appeared first on TheCoinrise.com .",NEUTRAL,없음,ETH | REGULATION,,0,0,The Coin Rise,https://thecoinrise.com/ethereum-foundation-reveals-970m-treasury-amid-calls-for-transparency/,https://resources.cryptocompare.com/news/60/35930159.jpeg
35922133,https://crypto.news/?p=14309064,1731069124,Solana breaks through the $200 barrier after rising nearly 9%,"Solana has broken through the $200 threshold for the first time in seven months of trading. The token’s price saw a 8.69% rise as the crypto market rallies after the US election. According to data from crypto.news, Solana(SOL) is currently…",POSITIVE,SOL,MARKET | SOL | TRADING,,0,0,crypto.news,https://crypto.news/solana-breaks-through-the-200-barrier-after-rising-nearly-9/,https://resources.cryptocompare.com/news/73/35922133.jpeg
35922131,https://crypto.news/?p=14309076,1731069057,Sky rebrand to Maker rejected as whale votes dominate,"Sky’s move to revert to its previous brand name Maker was rejected in a governance vote dominated by four whales. In a Nov. 8 announcement, Sky said its governance proposal to rebrand back to Maker was rejected it will continue…",NEGATIVE,없음,OTHER,,0,0,crypto.news,https://crypto.news/sky-rebrand-to-maker-rejected-as-whale-votes-dominate/,https://resources.cryptocompare.com/news/73/35922131.jpeg
35922059,https://news.bitcoin.com/?p=683184,1731069035,Trump’s Crypto Aide: U.S. Should Act Quickly to Incorporate a Strategic Bitcoin Reserve,"With Trump’s crypto allegiance and his new status as President-Elect of the U.S., talks of establishing a strategic bitcoin reserve have surged. While this can be achieved in several ways, Trump’s cryptocurrency aide and CEO of BTC.Inc., David Bailey, has suggested expediting this task, fearing a possible frontrunning movement from third parties. Trump’s Crypto Aide",POSITIVE,BTC,BTC | FIAT,,0,0,Bitcoin.com,https://news.bitcoin.com/trumps-crypto-aide-u-s-should-act-quickly-to-incorporate-a-strategic-bitcoin-reserve/,https://resources.cryptocompare.com/news/14/35922059.jpeg
35923274,https://cryptodaily.co.uk/2024/11/invest-in-these-3-coins-that-could-explode-like-solana-or-dogecoin-and-make-you-rich-in-the-next-90-days,1731069028,Invest in These 3 Coins That Could Explode Like Solana or Dogecoin and Make You Rich in the Next 90 Days,"The world of cryptocurrency never sleeps, and some coins are currently offering enormous promise, poised to deliver returns comparable to the meteoric rises of Solana and Dogecoin in the 2021 bull market.",POSITIVE,없음,DOGE | MARKET | SOL | TRADING,,0,0,Crypto Daily,https://cryptodaily.co.uk/2024/11/invest-in-these-3-coins-that-could-explode-like-solana-or-dogecoin-and-make-you-rich-in-the-next-90-days,https://resources.cryptocompare.com/news/75/35923274.jpeg
35924057,https://timestabloid.com/?p=49347,1731069020,"Bitcoin Rally or Not, These Altcoins Promise 1,000% Growth This Year","While Bitcoin’s price swings dominate the news, a group of alternative cryptocurrencies is gearing up for remarkable growth. These altcoins, poised to surge by up to 1,000% this year, could deliver significant returns regardless of Bitcoin’s path. Uncovering which digital assets are set for this explosive rise might unlock exceptional opportunities in the ever-evolving crypto The post Bitcoin Rally or Not, These Altcoins Promise 1,000% Growth This Year appeared first on Times Tabloid .",POSITIVE,없음,ALTCOIN | BTC | TRADING,,0,0,TimesTabloid,https://timestabloid.com/bitcoin-rally-or-not-these-altcoins-promise-1000-growth-this-year/,https://resources.cryptocompare.com/news/67/default.png
35922062,https://www.newsbtc.com/?p=652174,1731069018,Cardano (ADA) Price Surges 32% In 4 Days: Here’s Why,"Cardano (ADA) has experienced a significant surge over the past four days, with its price increasing by an impressive 32%. In the last 24 hours alone, ADA has climbed 16%, boosting its market capitalization to $14.932 billion. This surge has propelled Cardano back to its position as the ninth-largest cryptocurrency by market cap. Several factors have contributed to this bullish momentum: #1 Bulls Takes Over The Entire Crypto Market The optimistic market sentiment extends beyond Cardano, with the crypto market as a whole experiencing a significant rally. This upward movement has been mostly driven by Donald Trump’s victory in the US presidential election. Trump’s administration has committed to ending the “war on crypto” and positioning the United States as a central hub for crypto businesses. Related Reading: Cardano (ADA) NVT Ratio Now Highest Since June: What Does It Mean? Adding to the positive momentum, the Federal Reserve’s decision on November 7 to reduce interest rates by 0.25% has provided additional tailwinds for the crypto market. The Fed cited easing labor market conditions and increased confidence that inflation is moving sustainably toward the 2% target. Analysts from The Kobeissi Letter noted that the vote for the rate cut was unanimous. Powell said that “labor market conditions have generally eased” and that “risks to goals remain roughly in balance.” #2 Cardano Whale Activity On-chain analysis firm Santiment has highlighted a surge in whale activity surrounding Cardano. In a recent post on X, they observed that ADA has been “one of the notable surprise altcoins taking flight during this crypto-wide pump.” They suggested that “we may be seeing some retail FOMO coming soon,” acknowledging that this surge “has been a long time coming for the patient ADA community.” Santiment reported that Cardano broke above $0.43 for the first time since July, climbing 25% in three days due to “massive network and whale activity.” Specifically, they pointed out that 37,892 unique ADA addresses made transfers in a single day—the most since the September 4th bottom—and there were 697 transactions exceeding $100,000, also the highest since that date. This uptick in large transactions and active addresses indicates heightened interest from major investors, signaling the potential for continued upward momentum. #3 Technical Breakout Unlike many other altcoins, ADA has been in a prolonged bearish phase. However, the recent surge could mark a pivotal turning point, indicating a potential bullish reversal. Since August, Cardano’s price has been making a series of higher lows. Related Reading: Cardano Might See A Massive Pump Around November 18 – Analyst Exposes 2020 Similarities The current move has also allowed the ADA price to break above a downtrend line that has dictated its price movement since April, after being rejected five times previously. The breakout can be considered significantly bullish as it aligned with the pattern of higher lows. Notably, ADA has surpassed the 20-, 50-, 100-, and 200-day moving averages during this surge. Additionally, ADA has moved past the 0.236 Fibonacci retracement level, the most critical horizontal resistance point. A successful retest of this price level at $0.40 today could pave the way for further upside. At press time, ADA traded at $0.4266. Featured image from Shutterstock, chart from TradingView.com",POSITIVE,ADA,ADA | ALTCOIN | BUSINESS | MARKET | TRADING,,0,0,NewsBTC,https://www.newsbtc.com/news/cardano/cardano-ada-price-surges-32-in-4-days-heres-why/,https://images.cryptocompare.com/news/default/newsbtc.png
35922127,https://ambcrypto.com/?p=440825,1731069006,Crypto stocks and Bitcoin rally after Trump’s victory; Details here…,"Trump's election win sparks a market rally, boosting crypto stocks and Bitcoin amid promises to make the U.S. a crypto hub.",POSITIVE,없음,BTC | MARKET | TRADING,,0,0,AMB Crypto,https://ambcrypto.com/crypto-stocks-and-bitcoin-rally-after-trumps-victory-details-here/,https://images.cryptocompare.com/news/default/ambcrypto.png
35922919,https://coinedition.com/?p=542011,1731069000,Ethereum to $6K; XRP Breakout? The Next Crypto Power Couple?,"Ethereum (ETH) and XRP are riding on a confluence of positive factors. Beyond the market upswing, both boast strong fundamentals, active communities, and thriving ecosystems, with recent developments further fueling their potential for a breakout. ETH, trading at around $2,945, is closely following an ascending trendline that has been intact since early 2023. Market analysts The post Ethereum to $6K; XRP Breakout? The Next Crypto Power Couple? appeared first on Coin Edition .",POSITIVE,ETH | XRP,ETH | MARKET | TRADING | XRP,,0,0,Coin Edition,https://coinedition.com/ethereum-to-6k-xrp-breakout-the-next-crypto-power-couple/,https://resources.cryptocompare.com/news/7/default.png
35922085,https://decrypt.co/?p=290810,1731068996,"WonderFi CEO Safe After Paying $720,000 Ransom to Kidnappers","“Client funds and data remain safe, and were not impacted by this incident,"" the CEO said about the incident in an email.",NEUTRAL,없음,OTHER,,0,0,Decrypt,https://decrypt.co/290810/wonderfi-ceo-safe-720000-ransom,https://resources.cryptocompare.com/news/44/35922085.jpeg
35922009,https://www.cryptoknowmics.com/news/?p=256391,1731068965,Ethereum Foundation Report 2024 Unveils Treasury Holdings and Focus Areas,"The Ethereum Foundation (EF) recently released its 2024 report, providing a comprehensive overview of its treasury holdings, operational focus areas, and ongoing initiatives. Aya Miyaguchi, the Foundation’s executive director, shared the report, which outlines the organization’s financial reserves and its key objectives for the upcoming year. $970 Million in Reserves, Majority Held in ETH According … Continue reading ""Ethereum Foundation Report 2024 Unveils Treasury Holdings and Focus Areas"" The post Ethereum Foundation Report 2024 Unveils Treasury Holdings and Focus Areas appeared first on Cryptoknowmics-Crypto News and Media Platform .",NEUTRAL,ETH,ETH | REGULATION,,0,0,Cryptoknowmics,https://www.cryptoknowmics.com/news/ethereum-foundation-report-2024-unveils-treasury-holdings-and-focus-areas/?utm_source=rss&utm_medium=rss&utm_campaign=ethereum-foundation-report-2024-unveils-treasury-holdings-and-focus-areas,https://images.cryptocompare.com/news/default/cryptoknowmics.png
35922005,https://coinpedia.org/?p=377520,1731068920,Gary Gensler’s Exit: Could He Be Fired Before His Term Ends? A Look at Ripple Case Timeline,"The post Gary Gensler’s Exit: Could He Be Fired Before His Term Ends? A Look at Ripple Case Timeline appeared first on Coinpedia Fintech News The outcome of the 2024 U.S. presidential election will have major implications for the cryptocurrency industry, particularly in the ongoing legal battle between Ripple and the SEC. Now that Donald Trump has won, there’s a growing expectation that the crypto landscape might see shifts, including the potential end of the SEC’s aggressive stance on cryptocurrencies. …",NEUTRAL,없음,REGULATION,,0,0,coinpedia,https://coinpedia.org/news/gary-genslers-exit-could-he-be-fired-before-his-term-ends-a-look-at-ripple-case-timeline/,https://images.cryptocompare.com/news/default/coinpedia.png
35921935,https://en.coinotag.com/breakingnews/bitcoin-set-to-surge-towards-110000-after-federal-reserve-rate-cut-and-etf-inflows/,1731068908,"Bitcoin Set to Surge Towards $110,000 After Federal Reserve Rate Cut and ETF Inflows","The cryptocurrency market is exhibiting dynamic movements in response to recent economic developments. According to a report by CoinDesk on November 8, the Federal Reserve has enacted a 25-basis-point rate",POSITIVE,없음,BTC | FIAT | MARKET,,0,0,CoinOtag,https://en.coinotag.com/breakingnews/bitcoin-set-to-surge-towards-110000-after-federal-reserve-rate-cut-and-etf-inflows/,https://resources.cryptocompare.com/news/77/35921935.jpeg
35921916,https://finbold.com/?p=211533,1731068874,Andrew Tate bets $100k in crypto on ‘BitBoy’ for upcoming fight,"Andrew Tate, the controversial internet personality and former kickboxing champion, has pledged his support for crypto influencer Ben Armstrong, also … Continue reading The post Andrew Tate bets $100k in crypto on ‘BitBoy’ for upcoming fight appeared first on Finbold .",NEUTRAL,없음,OTHER,,0,0,Finbold,https://finbold.com/andrew-tate-bets-100k-in-crypto-on-bitboy-for-upcoming-fight/,https://images.cryptocompare.com/news/default/finbold.png
36291800,https://cryptodaily.co.uk/2024/11/3-best-altcoins-to-buy-post-us-election-1-recently-listed-on-coinmarketcap,1731068631,"3 Best Altcoins to Buy Post US Election, 1 Recently Listed on CoinMarketCap with Explosive Potential","Get a headstart of the three best altcoins to buy post-US election. With PropiChain already listed on CoinMarketCap, discover why these game-changing altcoins stand out for explosive growth potential.",POSITIVE,없음,ALTCOIN,,0,0,Crypto Daily,https://cryptodaily.co.uk/2024/11/3-best-altcoins-to-buy-post-us-election-1-recently-listed-on-coinmarketcap,https://resources.cryptocompare.com/news/75/36291800.jpeg
42435178,vcdRFSInNZZ7jTkxATLR2V,1731068627,D.O.G.E Memecoin Rockets 100% as Traders Savor Elon Musk's Strong Ties to President-Elect Trump,"The parody Department of Government Efficiency (D.O.G.E) memecoin has surged by 100% in the last 24 hours, boosting its trading volumes and demand.  Elon Musk's public discussions about forming a real ""Department of Government Efficiency"" (D.O.G.E.) to streamline government spending have spurred the rise of this parody token.  A parody Department of Government Efficiency (D.O.G.E) memecoin has been up 100% in the past 24 hours as it has started to go viral within crypto circles, boosting trading volumes and demand.  A CoinDesk analysis first flagged the Ethereum-based token in mid October, with prices increasing more than 600% since then.  Entrepreneur and vocal dogecoin {{DOGE}} supporter Elon Musk first tweeted the Department of Government Efficiency in early August - spurring the creation of parody tokens - and further revealed plans for his proposed “Department of Government Efficiency” at a Pennsylvania town hall.  The proposed department, abbreviated as D.O.G.E, will seek to make government spending of taxpayer money more efficient while streamlining departments that handle spending.  Musk has previously suggested the proposed department could be run similarly to a corporate company at the Thursday town hall, with incentives for performers and penalties for those who fail to deliver results.  And Republican Donald Trump’s win has pushed those plans closer to reality — pushing prices of the unrelated D.O.G.E token as traders seek to make money on the term’s virality and popularity.  CoinGecko data shows the token is up 155,00% since early September, reaching a market capitalization of $153 million earlier Friday with nearly $30 million in trading volumes.  Given the virality and appeal of the token, it may be headed for further price gains in the coming months as Trump takes office and D.O.G.E gains mainstream media coverage, some market watchers say.  “There is going to be a media frenzy about Elon and D.O.G.E,” well-known trader ‘unipcs,’ told CoinDesk in an X message. “His aggressive backing ofTrump and the 'Department of Government Efficiency' narrative could have been a deciding factor for a Trump win.  “That's going to end up being a key catalyst that fuels both Dogecoin and the D.O.G.E ETH memecoin much higher,” unipcs added.  Dogecoin has gained more than 22% in the past seven days after Trump’s win given Musk’s closeness to the President-elect.",POSITIVE,DOGE | ETH,DOGE | ETH | MARKET | TRADING,Shaurya Malwa,0,0,CoinDesk,https://coindesk.com/markets/2024/11/08/doge-memecoin-rockets-100-as-traders-savor-elon-musks-strong-link-to-president-elect-trump,https://cdn.sanity.io/images/s3y3vcno/production/f6a19bdba4adea6fb41fc5bfb668b5f8a41861f0-1021x574.jpg?w=300&h=300&fit=crop
35921768,https://bitcoinworld.co.in/?p=96668,1731068624,Powell Stands Firm: “I Won’t Resign Even If Trump Asks Me To”,"Powell Stands Firm: “I Won’t Resign Even If Trump Asks Me To” In a strong assertion of the Federal Reserve’s independence, Jerome Powell, chairman of the U.S. Federal Reserve, has publicly stated that he will not resign even if President-elect Donald Trump asks him to do so. This bold statement, reported by Watcher Guru on",NEUTRAL,없음,FIAT,,0,0,Bitcoin World,https://bitcoinworld.co.in/powell-stands-firm/,https://resources.cryptocompare.com/news/82/default.png
35921673,https://coinpedia.org/?p=377514,1731068526,"Bitcoin Hits $76,940 as Realized Cap Soars to $656 Billion","The post Bitcoin Hits $76,940 as Realized Cap Soars to $656 Billion appeared first on Coinpedia Fintech News After hitting an all-time high of $76,940, Bitcoin’s market strength is on the rise. Its Realized Cap has jumped by 3.8% over the past 30 days, reaching a record high of $656 billion. This surge marks one of the biggest inflow levels since January 2023, with $2.5 billion of net capital inflow over the month. …",POSITIVE,없음,BTC | MARKET,,0,0,coinpedia,https://coinpedia.org/crypto-live-news/bitcoin-hits-76940-as-realized-cap-soars-to-656-billion/,https://images.cryptocompare.com/news/default/coinpedia.png
35921638,https://crypto.news/?p=14309093,1731068470,"The ultimate meme coin battle: XYZ, DOGE, and PEPE compete for the spotlight","The battle for meme coin supremacy is on, with XYZVerse challenging the likes of Dogecoin and PEPE for the top spot in the crypto space. #partnercontent",NEUTRAL,DOGE | PEPE,DOGE | SPONSORED | PEPE,,0,0,crypto.news,https://crypto.news/the-ultimate-meme-coin-battle-xyz-doge-and-pepe-compete-for-the-spotlight/,https://resources.cryptocompare.com/news/73/35921638.jpeg
35921537,https://cryptodaily.co.uk/2024/11/think-all-slots-are-the-same-here-are-5-reasons-youre-wrong,1731068259,Think All Slots Are the Same? Here are 5 Reasons You're Wrong,"To the untrained eye, all online slot machines look the same, but that couldn't be farther from the truth. Here are five reasons why they aren't all the same.",NEUTRAL,없음,OTHER,,0,0,Crypto Daily,https://cryptodaily.co.uk/2024/11/think-all-slots-are-the-same-here-are-5-reasons-youre-wrong,https://resources.cryptocompare.com/news/75/35921537.jpeg
35921526,https://en.coinotag.com/xrp-faces-decreased-network-activity-and-resistance-challenges-amidst-whale-hesitation-and-price-volatility-concerns/,1731068251,XRP Faces Decreased Network Activity and Resistance Challenges Amidst Whale Hesitation and Price Volatility Concerns,"XRP’s network activity has seen a significant decline, raising concerns among investors about the future momentum of this cryptocurrency. With a current trading price of approximately $0.55, recent analyses reveal",NEGATIVE,XRP,BUSINESS | TRADING | XRP,,0,0,CoinOtag,https://en.coinotag.com/xrp-faces-decreased-network-activity-and-resistance-challenges-amidst-whale-hesitation-and-price-volatility-concerns/,https://resources.cryptocompare.com/news/77/default.png
