뉴스ID,뉴스GUID,일자(UTC timestamp),뉴스제목,본문,SENTIMENT,주요코인,카테고리,작성자,추천수,비추천수,출처,뉴스URL,이미지URL
13413258,https://blockworks.co/?p=5200,1624989995,ProShares Opts for ‘Crypto-Lite’ ETF While SEC Mulls Pure Bitcoin Product,"Offering would compete with several existing products, planned fund by InvescoThe post ProShares Opts for &apos;Crypto-Lite&apos; ETF While SEC Mulls Pure Bitcoin Product appeared first on Blockworks.",NEUTRAL,없음,BTC | ICO | REGULATION,,0,0,Blockworks,https://blockworks.co/proshares-opts-for-crypto-lite-etf-while-sec-mulls-pure-bitcoin-product/,https://images.cryptocompare.com/news/default/blockworks.png
42387209,0r6Zag11PPDEMKgUXBltxV,1624989772,Stablecoins and CBDCs: Private Vs. Public Monetary Innovation,"“We do not need to fear stablecoins,” Randal Quarles, vice chairman for supervision at the Federal Reserve, said in a speech yesterday.      That doesn’t sound like a particularly remarkable statement. Except it came from a Fed official, who might be suspicious about stablecoins but was surprisingly bullish on them.    This article is excerpted from The Node, CoinDesk's daily roundup of the most pivotal stories in blockchain and crypto news. You can subscribe to get the full newsletter here.    In a statement to the Utah Bankers Association Annual Convention, Quarles said that privately issued stablecoins (or assets typically pegged to fiat currencies underwritten by a bundle of other financial instruments) could help solve some of the inefficiencies and inequalities in the current payments system. He is intrigued by the instantaneous and cross-border settlements offered by a blockchain-based technology.      Quarles' comments were explicitly framed by the debate over central bank digital currencies (CBDC) and the role of the U.S. government in fostering financial innovation. The big question: Should the U.S. undertake a massive public project to digitize cash – through an alternative consumer deposit infrastructure at the Federal Reserve – or should that be left to the private sector?      Quarles remains skeptical of CBDCs, which he described as a fad, as do many central bankers. The Fed is researching CBDCs and expects to publish a report about the topic this summer. Several senior Fed officials have raised concerns about the risks that stablecoins – which are now worth in excess of $108 billion – present.      “I read [Quarles’] speech as basically a free market-oriented person making the best case they can to let private actors continue doing what they're doing and to hold off on any public alternative,” Willamette University College of Law professor Rohan Grey said in an email. “That's what links the enthusiasm for stablecoins with the pessimism towards CBDCs, in my opinion.” (Grey has argued for an open-source approach to a digital dollar.)    See also: Will a US Digital Dollar Protect Privacy?    According to Quarles, CDBCs could put more stress on the U.S. banking system and pose cybersecurity risks. They might also limit competition between banks that benefits consumers. On a practical level, there may be a host of legislative roadblocks and administrative costs to setting one up. These are just a few of his concerns. Crypto pundits have become anxious about CBDC privacy, with some calling them state-mandated spyware.      Stablecoins are one of the fastest-growing sections of the crypto economy. It’s a financial revolution underway that also raises serious doubts. In Quarles’ own words:    “Stablecoins are an important development that raises difficult questions. For example, how would widespread adoption of stablecoins affect monetary policy or financial stability? How might stablecoins affect the commercial banking system? Do stablecoins represent a fundamental threat to the government's role in money creation?”    But Quarles’ quickly responded to his own questions: “The Federal Reserve has traditionally supported responsible private-sector innovation.” What's more, he said, “Our existing system involves – indeed depends on – private firms creating money every day.”      Although the analogy isn’t perfect, the rise of stablecoins may end up resembling the explosion of consumer credit cards. Those cash equivalents rapidly entered the market and reshaped the economy. Between 1945 and 1960, consumer credit increased from $2.6 billion to $45 billion, according to the Federal Reserve. In 1970, about a decade after Bank of America mailed the first 60,000 charge cards, it stood at $105 billion. About one in six U.S. families held one, according to the Fed.      That growth was entirely a form of private-sector money creation, giving families the ability to buy now and pay later. There are many criticisms of this debt-driven system – some even pointed to by Quarles – but it’s impossible to say it wasn’t a revolution.      Grey’s line is to advocate for strong consumer protections in face of private-sector money creation. He argues that stablecoins should be regulated as deposit takers. Moreover, a large part of the Federal Reserve's mandate has been to limit the efforts of ""shadow banks to engage in traditional banking activity without proper regulation.""      For him, there is a sense of urgency. “The problem is precisely that stablecoins aren't waiting until those concerns have been addressed, they're in circulation now,” he said.      Indeed, the money printer has been let out.",POSITIVE,없음,BLOCKCHAIN | FIAT | MARKET | REGULATION | TRADING,Daniel Kuhn,0,0,CoinDesk,https://coindesk.com/policy/2021/06/29/stablecoins-and-cbdcs-private-vs-public-monetary-innovation,https://cdn.sanity.io/images/s3y3vcno/production/9b4e471108df32bcb8796bb72ac25ce90ff66331-2048x1365.jpg?w=300&h=300&fit=crop
13223509,https://www.newsbtc.com/?p=466446,1624989667,Which Blockchain Companies Will Spark Mainstream Conversations,"Bitcoin never leaves the news these days, with every new story or major mention having the ability to move the price, from crypto crackdowns to Elon Musk airing his thoughts on Twitter. Yet, one thing is for sure and that is that while Bitcoin bulls may call the crypto Bitcoin Gold, and see it as ...",NEUTRAL,없음,BLOCKCHAIN | BTC | FIAT | TRADING | BTG,,0,0,NewsBTC,https://www.newsbtc.com/news/company/which-blockchain-companies-will-spark-mainstream-conversations/,https://images.cryptocompare.com/news/default/newsbtc.png
13272560,https://ambcrypto.com/?p=167526,1624989610,"Bitcoin: another 5-6% rise was possible over the coming sessions, IF…","A bullish start to the week saw Bitcoin shake off some weekend selling pressure as prices continued their upward push. While several analysts have still flagged short-term risks associated with BTC&apos;s price, there were indications of accumulation in the market. As the base support around $28,800 keeps strengthening, BTC&apos;s current upcycle would be a critical ...",POSITIVE,BTC,BTC | MARKET | TRADING,,0,0,AMB Crypto,https://ambcrypto.com/bitcoin-another-5-6-rise-was-possible-over-the-coming-sessions-if/,https://images.cryptocompare.com/news/default/ambcrypto.png
13391022,https://decrypt.co/?p=74806,1624989031,CoinMarketCap Taps Uniswap for ERC20 Token Swaps,Crypto data aggregator CoinMarketCap meets DeFi&apos;s leading protocol Uniswap.,NEUTRAL,없음,BLOCKCHAIN | BUSINESS | ETH | UNI,,0,0,Decrypt,https://decrypt.co/74806/coinmarketcap-taps-uniswap-for-erc20-token-swaps,https://images.cryptocompare.com/news/default/decrypt.png
13445267,https://bitcoinist.com/?p=153675,1624989001,Ardor Network Gains Traction in Real-World Enterprise Blockchain Solutions,"Blockchain is among the technologies that are gradually defining the fourth industrial revolution (4IR) era. Over the years, more people and institutions have come to appreciate the value proposition of blockchain networks towards creating decentralized ecosystems. This upcoming technology is famous for supporting cryptocurrencies like Bitcoin, but it is also changing the face of other ...",POSITIVE,없음,BLOCKCHAIN | BTC | BUSINESS | TECHNOLOGY,,0,0,Bitcoinist,https://bitcoinist.com/ardor-network-gains-traction-in-real-world-enterprise-blockchain-solutions/?utm_source=rss&utm_medium=rss&utm_campaign=ardor-network-gains-traction-in-real-world-enterprise-blockchain-solutions,https://images.cryptocompare.com/news/default/bitcoinist.png
13223510,https://www.newsbtc.com/?p=466406,1624988755,Crypto Analyst: No Bitcoin Monthly Support Until $14K If Current Level Is Lost,"The bulls are given signs of conviction, as Bitcoin reclaims more ground. At the time of writing, BTC&apos;s trades at $36,267 with sideways movement in the 1-hour chart and moderate gains in the 7-day and 30-day chart with 14.2% and 4.2%. Some traders have begun to flip bullish as Bitcoin printed its first green candle ...",NEUTRAL,BTC,BTC | TRADING,,0,0,NewsBTC,https://www.newsbtc.com/news/bitcoin/bitcoin-monthly-support-until-14k/,https://images.cryptocompare.com/news/default/newsbtc.png
13391023,https://decrypt.co/?p=74807,1624988719,"Ethereum Classic, ICP Lead Rising Crypto Market","The entire cryptocurrency market is up nearly 5% over the last 24 hours, with Ethereum Classic and ICP posting sizable gains.",POSITIVE,ICP,ETC | MARKET | ICP,,0,0,Decrypt,https://decrypt.co/74807/ethereum-classic-icp-lead-rising-crypto-market,https://images.cryptocompare.com/news/default/decrypt.png
13223511,https://www.newsbtc.com/?p=466435,1624988671,Why Centralized Exchanges (CEXs) Are Losing Popularity to Decentralized Exchanges (DEXs),"Centralized Finance (CeFi) is the fundamental model of the traditional financial ecosystem, which comprises stakeholders such as monetary oversight bodies, regulators and financial institutions. As such, all these stakeholders work in collaboration towards sustaining sound financial markets. Despite its value proposition in traditional finance, the CeFi model has come under constant criticism due to its ...",POSITIVE,없음,MARKET,,0,0,NewsBTC,https://www.newsbtc.com/news/company/why-centralized-exchanges-cexs-are-losing-popularity-to-decentralized-exchanges-dexs/,https://images.cryptocompare.com/news/default/newsbtc.png
13574130,https://www.cryptopolitan.com/?p=100532,1624988540,"Dogecoin price analysis: Dogecoin aims to retest $0.29, will resistance hold?","TL;DR Breakdown DOGE moved sideways yesterday. The market moved higher earlier today. Next target at $0.29. Dogecoin price analysis is bullish for today as the market moved higher over the past 24 hours, with the previous resistance around the $0.29 mark likely to be retested overnight. Therefore, we can expect DOGE/USD to move towards the ...",POSITIVE,DOGE,DOGE | MARKET | TRADING,,0,0,Cryptopolitan,https://www.cryptopolitan.com/dogecoin-price-analysis-2021-06-29/,https://images.cryptocompare.com/news/default/cryptopolitan.png
13272561,https://ambcrypto.com/?p=167602,1624987845,"Ethereum, Uniswap, Litecoin Price Analysis: 29 June","Following the broader market price correction, most altcoins were on a path to recovery at press time. Ethereum, for instance, was back in the bullish zone after breaking past the $2100-mark. UNI too registered a slight price uptrend over the last 24 hours while finally, LTC broke through its major resistance levels of $135 and ...",POSITIVE,LTC | UNI,ETH | LTC | MARKET | TRADING | UNI,,0,0,AMB Crypto,https://ambcrypto.com/ethereum-uniswap-litecoin-price-analysis-29-june/,https://images.cryptocompare.com/news/default/ambcrypto.png
13258457,https://dailyhodl.com/?p=151315,1624987812,"Here’s Why Bitcoin Needs More Time To Recover, According to Crypto Trader Cantering Clark","Popular crypto trader and analyst Cantering Clark believes Bitcoin is due for an extended cooldown period before continuing its historic bull run. After a powerful rally to a high of $64,804, Bitcoin took a sharp 50% correction in May following a wave of bad news, including fears of China crackdowns on miners and Tesla restricting ...The post Here&apos;s Why Bitcoin Needs More Time To Recover, According to Crypto Trader Cantering Clark appeared first on The Daily Hodl.",NEUTRAL,없음,ASIA | BTC | TRADING,,0,0,The Daily Hodl,https://dailyhodl.com/2021/06/29/heres-why-bitcoin-needs-more-time-to-recover-according-to-crypto-trader-cantering-clark/,https://images.cryptocompare.com/news/default/dailyhodl.png
13340627,https://cointelegraph.com/news/argo-blockchain-receives-20m-bitcoin-backed-loan-from-galaxy-digital-for-texas-mining-facility,1624987705,Argo Blockchain receives $20M Bitcoin-backed loan from Galaxy Digital for Texas mining facility,The U.K.-based mining firm&apos;s announcement comes amid the country&apos;s Financial Conduct Authority cracking down on crypto exchanges.,POSITIVE,없음,BLOCKCHAIN | BUSINESS | MINING,,0,0,CoinTelegraph,https://cointelegraph.com/news/argo-blockchain-receives-20m-bitcoin-backed-loan-from-galaxy-digital-for-texas-mining-facility,https://images.cryptocompare.com/news/default/cointelegraph.png
13384907,https://zycrypto.com/?p=53403,1624987639,"Annual Bitcoin, Dogecoin, Ether Investments In India Grow By 19,900% To Nearly $40 Billion","Bitcoin, Ether, and Dogecoin investments in India have grown by a whopping 19,900% from $200 million to the current $38.8 billion in just 12 months. According to a report by Reuters, the growth is primarily coming from the 18-35 age group consisting of generation Z and millennials. Bitcoin analysis and market commentary handle on Twitter ...",POSITIVE,없음,ALTCOIN | BTC | DOGE | MARKET,,0,0,ZyCrypto,https://zycrypto.com/annual-bitcoin-dogecoin-ether-investments-in-india-grow-by-19900-to-nearly-40-billion/,https://images.cryptocompare.com/news/default/zycrypto.png
13495161,https://seekingalpha.com/news/3711059-slow-ventures-jill-carlson-sees-reason-for-cautious-bullishness-on-bitcoin?utm_source=cryptocompare.com&utm_medium=referral,1624987625,Slow Ventures’ Jill Carlson sees reason for 'cautious bullishness' on Bitcoin,"asbe/E+ via Getty Images Jill Carlson, a venture partner at Slow Ventures, said Tuesday that she sees reason for &apos;cautious bullishness&apos; on Bitcoin (BTC-USD), describing the market as in a &apos;healthier place&apos; following a recent price capitulation. Carlson told CNBC that the recent dip below $30,000 represented a &apos;real capitulation from the retail market.&apos; The Slow Ventures partner added that outflows continue from the institutional market as well. &apos;It&apos;s been outflows, outflows, outflows for weeks now,&apos; she said. Carlson argued that the recent price drop flushed out a lot of retail traders, putting the overall Bitcoin market on firmer ground around the current levels. Bitcoin reached levels above $60,000 in April. It dipped in late April and then suffered a steep decline during the second half of May. It eventually approached the $30,000 mark in the last couple of weeks. Here&apos;s a chart of the crypto&apos;s movement over the last",POSITIVE,BTC,BTC | MARKET | TRADING,,0,0,Seeking Alpha,https://seekingalpha.com/news/3711059-slow-ventures-jill-carlson-sees-reason-for-cautious-bullishness-on-bitcoin?utm_source=cryptocompare.com&utm_medium=referral,https://images.cryptocompare.com/news/default/seekingalpha.png
42387196,0r6Zag11PPDEMKgUXBltiP,1624987220,Bitcoin Miner TeraWulf to Buy 30K Bitmain Mining Machines,"Bitcoin mining company TeraWulf has agreed to purchase 30,000 mining machines from Bitmain.    In a blog post on Tuesday, Bitmain said TeraWulf will buy Bitmain’s latest generation of miners dubbed the Antminer S19j Pro, which will be delivered from January to June 2022.  Once the machines have been delivered and deployed, TeraWulf is expected to increase its total mining hash rate by 3 exahashes per second, which means the machines will be able to compute an extra 3 quintillion calculations per second. Quintillion is a number followed by 18 zeros.  TeraWulf is set for a Nasdaq listing after it agreed to merge with Ikonics, an imaging-technology company whose stock trades on Nasdaq. The combined company will trade under the ticker symbol, ""WULF.""    Read more: Bitcoin Miner TeraWulf to Merge With Nasdaq-Listed Ikonics",POSITIVE,없음,BTC | BUSINESS | MINING,Tanzeel Akhtar,0,0,CoinDesk,https://coindesk.com/markets/2021/06/29/bitcoin-miner-terawulf-to-buy-30k-bitmain-mining-machines,https://cdn.sanity.io/images/s3y3vcno/production/97da02409e886e334d0417d90ba7872392b58bfd-1400x933.jpg?w=300&h=300&fit=crop
13223512,https://www.newsbtc.com/?p=466390,1624987211,"Don’t Buy Bitcoin, It’s NOT Going To Crash","What&apos;s a good reason to buy Bitcoin? Well, the fact that it&apos;s not going to crash is a good one. Looking at the charts can tell you a lot about what you need to know about a coin. Bitcoin is over a decade old by now. This means that there is now a bit of ...",POSITIVE,없음,BTC,,0,0,NewsBTC,https://www.newsbtc.com/analysis/btc/buy-bitcoin/,https://images.cryptocompare.com/news/default/newsbtc.png
13404862,https://cryptopotato.com/?p=126255,1624986658,The Rise of Crypto Poses Important Questions for Central Banks: NY Fed President,"John Williams, the head of the New York Federal Reserve, urged central banks to keep in mind the emergence of cryptocurrencies before issuing their own CBDCs.",NEUTRAL,없음,FIAT | REGULATION,,0,0,Crypto Potato,https://cryptopotato.com/the-rise-of-crypto-poses-important-questions-for-central-banks-ny-fed-president/,https://images.cryptocompare.com/news/default/cryptopotato.png
13384908,https://zycrypto.com/?p=53393,1624986645,Mexican Billionaire Salinas Loves Bitcoin But Sees Ethereum As The Biggest Menace – Here’s Why,"Ricardo Salinas Pliego, the third richest person in Mexico, has stated that the only asset class he sees himself keeping for the long run is Bitcoin. Pliego explained that he has invested a lot of time studying Bitcoin and has come to the conclusion that every investor should make it part of their portfolio. Going ...",POSITIVE,없음,BTC | BUSINESS | ETH,,0,0,ZyCrypto,https://zycrypto.com/mexican-billionaire-salinas-loves-bitcoin-but-sees-ethereum-as-the-biggest-menace-heres-why/,https://images.cryptocompare.com/news/default/zycrypto.png
13445268,https://bitcoinist.com/?p=153663,1624986460,Crypto Exchange Crypto.com Signs Global Sponsorship With Formula 1,"Formula 1 has been growing in popularity lately. In fact, the US audience has found substantial traction this year in a sport that has historically been more popular in Europe and Asia. ESPN TV ratings for F1 are up 50% from last year, and up 36% from 2019. F1 recently renewed it&apos;s partnership with online ...",POSITIVE,없음,ASIA | EXCHANGE,,0,0,Bitcoinist,https://bitcoinist.com/crypto-exchange-crypto-com-signs-global-sponsorship-with-formula-1/?utm_source=rss&utm_medium=rss&utm_campaign=crypto-exchange-crypto-com-signs-global-sponsorship-with-formula-1,https://images.cryptocompare.com/news/default/bitcoinist.png
13429517,https://news.bitcoin.com/?p=470660,1624986058,Craig Wright Wins Default Judgment Against Cobra — Bitcoin.org Forced to Remove White Paper,"The self-proclaimed inventor of Bitcoin, Craig Wright, has won a default judgment in London&apos;s High Court in his copyright infringement case against the pseudonymous operator of bitcoin.org. According to a report, the website and its owner Cobra must remove the Bitcoin white paper from the web portal and pay $48K in legal costs as well. ...",NEGATIVE,없음,BTC | REGULATION,,0,0,Bitcoin.com,https://news.bitcoin.com/craig-wright-wins-default-judgment-against-cobra-bitcoin-org-forced-to-remove-white-paper/,https://images.cryptocompare.com/news/default/bitcoincom.png
13272562,https://ambcrypto.com/?p=167324,1624986053,How Bitcoin has the perfect 3-month window to recover May-June losses?,"Only last week, Bitcoin had tumbled down to $28,000, as a barrage of opinions and speculation hit the space. FUD was typically evident amongst retail investors as weighted social sentiment had dropped down to previous low levels witnessed in early 2020. However, the prices have caught a bullish break over the past few days, as ...",POSITIVE,없음,ALTCOIN | BTC | BUSINESS | MARKET | SPONSORED,,0,0,AMB Crypto,https://ambcrypto.com/how-bitcoin-has-the-perfect-3-month-window-to-recover-may-june-losses/,https://images.cryptocompare.com/news/default/ambcrypto.png
13445269,https://bitcoinist.com/?p=153640,1624986027,What Crypto Should You Buy? Jim Cramer Says Ethereum,Jim Cramer has bought back into Ethereum after selling almost all of his Bitcoin earlier in the year. Cramer had cited the reason for the sale was due to the ongoing China crackdown. He said the crackdown was going to drive down the price of the coin even more. This is what led him to ...,POSITIVE,없음,ALTCOIN | ASIA | BTC | ETH | TRADING,,0,0,Bitcoinist,https://bitcoinist.com/what-crypto-should-you-buy-jim-cramer-says-ethereum/?utm_source=rss&utm_medium=rss&utm_campaign=what-crypto-should-you-buy-jim-cramer-says-ethereum,https://images.cryptocompare.com/news/default/bitcoinist.png
