뉴스ID,뉴스GUID,일자(UTC timestamp),뉴스제목,본문,SENTIMENT,주요코인,카테고리,작성자,추천수,비추천수,출처,뉴스URL,이미지URL
13358966,https://cointelegraph.com/news/walmart-china-will-track-food-in-supply-chain-with-vechains-thor-blockchain,1561479240,Walmart China Will Track Food in Supply Chain with Vechain's Thor Blockchain,Walmart China to monitor fresh food progress through the supply chain using Vechain&apos;s Thor blockchain,POSITIVE,없음,ASIA | BLOCKCHAIN | VET,,0,0,CoinTelegraph,https://cointelegraph.com/news/walmart-china-will-track-food-in-supply-chain-with-vechains-thor-blockchain,https://images.cryptocompare.com/news/cointelegraph/94q1cXAQ8j0.png
13358967,https://cointelegraph.com/news/synthetix-reverses-oracle-error-caused-misplaced-seth-in-exchange-for-a-bug-bounty,1561478760,Synthetix Reverses Oracle Error-Caused Misplaced sETH in Exchange for a Bug Bounty,"Following a recent oracle issue, Synthetix will reverse the misplaced 37 million synthetic ether in exchange for a bug bounty",POSITIVE,ETH,ALTCOIN | ETH | EXCHANGE | ICO,,0,0,CoinTelegraph,https://cointelegraph.com/news/synthetix-reverses-oracle-error-caused-misplaced-seth-in-exchange-for-a-bug-bounty,https://images.cryptocompare.com/news/cointelegraph/d4JcccI4cdc.png
42382212,0r6Zag11PPDEMKgUX9qtiN,1561478738,Bitcoin Startup Lolli Looks to Global Expansion With Hotels.com Partnership,"Hundreds of people are earning bitcoin by taking vacations.  The in-browser app Lolli, which allows users to earn bitcoin rewards for online purchases, just added Hotels.com to its list of partners. Now with Booking.com, Priceline, Hilton and Marriott, Lolli CEO Alex Adelman told CoinDesk travel purchases account for 40 percent of sales.  “We are leveraging our Hotels.com and Booking.com partnerships to begin international expansion in the coming months,” Adelman said about plans for the next six months. “Canada has been in high demand and we think that’s going to be a great test market for us. That will help us expand to other countries as well.”  He estimated almost half of Lolli’s “tens of thousands” of users are getting bitcoin for the first time, based on the types of user feedback his team gets. When it comes to trips costing several thousand dollars, including both flights and hotels, some Lolli users have managed to earn more than $100 worth of bitcoin rewards.  “We want that number to grow,” Adelman said of new bitcoiners. “Now we’re starting to test content for teaching people what ‘stacking stats’ means. … Hopefully, someday 90 percent of our customers will be new because we want to make the market bigger.”  Stepping back, Lolli launched in September 2018 after raising $2.35 million from Forerunner Ventures, Digital Currency Group, Square engineer Gokul Rajaram and other investors.  Speaking of Square, the company’s Cash app has its own cash-back rewards system, called Boost. But Adelman isn’t daunted by the prospect of competition. To the contrary, Lolli is starting work on its own mobile app as part of plans for international expansion. Lolli users skew younger than other cash-back-affiliate programs, which is swaying new merchants to join the company’s 900-member network and lure customers away from Amazon.  “Most international customers are on mobile, so launching mobile in the U.S. is a good way for us to prepare to go international,” Adelman said. “People who want bitcoin are young, millennial customers that merchants are interested in. there’s an opportunity for merchants to make money and that drives bitcoin adoption.”  Switzerland-based Lolli fan Stephanie Verin told CoinDesk she looks forward to the startup's international expansion, adding:  ""They managed to went away from this kinda black, gloomy and very masculine branding that a lot bitcoin related content/startups are still using...It’s the first startup I am seeing that is thinking outside the bitcoin ethos and yet is accepted by all the bitcoiners.""  Travel image via Shutterstock",POSITIVE,없음,BTC | MARKET,Leigh Cuen,0,0,CoinDesk,https://coindesk.com/business/2019/06/25/bitcoin-startup-lolli-looks-to-global-expansion-with-hotelscom-partnership,https://cdn.sanity.io/images/s3y3vcno/production/708b319455753d3c331d90aa217234db837f0f66-1500x1053.jpg?w=300&h=300&fit=crop
13410399,https://cryptopotato.com/?p=33891,1561478625,"Crypto Price Analysis & Overview June 25: Bitcoin, Ethereum, Ripple, Kyber Network, And Monero","Bitcoin The resistant found at $9,400 was broken quite effortlessly. What followed was resistance at $11,000 which is currently being tested. Meanwhile, the enthusiasm continues, eyeing resistance at around $11,800. From there, the path to $15,000 could be rather quick. It&apos;s important to take into account that the support at $9,400 hasn&apos;t been tested and ...The post Crypto Price Analysis &amp; Overview June 25: Bitcoin, Ethereum, Ripple, Kyber Network, And Monero appeared first on CryptoPotato.",POSITIVE,없음,BTC | ETH | KNC | MARKET | TRADING,,0,0,Crypto Potato,https://cryptopotato.com/crypto-price-analysis-overview-june-25-bitcoin-ethereum-ripple-kyber-network-and-monero/,https://images.cryptocompare.com/news/cryptopotato/ch0jpNIHgG4.jpeg
13358968,https://cointelegraph.com/news/you-can-now-get-bitcoin-rewards-when-booking-at-hotelscom,1561478520,You Can Now Get Bitcoin Rewards When Booking at Hotels.Com,"Bitcoin rewards application Lolli adds Hotels.com as a new partner, allowing users to earn bitcoin from purchases online",POSITIVE,없음,BTC,,0,0,CoinTelegraph,https://cointelegraph.com/news/you-can-now-get-bitcoin-rewards-when-booking-at-hotelscom,https://images.cryptocompare.com/news/cointelegraph/9NpC8BbCH1x.png
13264479,https://dailyhodl.com/?p=55811,1561478446,JPMorgan Chase Eyes Trial Date for JPM Coin,"JPMorgan Chase is gearing up to test its new digital currency, JPM Coin. The bank says it plans to start trials for several corporate customers who will be able to use the coin for inter-company remittances, bonds and commodities transactions, reports Bloomberg Japan. Umar Farooq, head of digital treasury services and blockchain at JPMorgan, says ...The post JPMorgan Chase Eyes Trial Date for JPM Coin appeared first on The Daily Hodl.",POSITIVE,없음,ASIA | BLOCKCHAIN | ETH | FIAT | REGULATION,,0,0,The Daily Hodl,https://dailyhodl.com/2019/06/25/jpmorgan-chase-eyes-trial-date-for-jpm-coin/,https://images.cryptocompare.com/news/dailyhodl/bmFaANgppmg.jpeg
13450670,https://bitcoinist.com/?p=111503,1561478413,"Bitcoin Likely to be Overbought by July 13, Says Analyst","Analyst and Economist, Alex Krüger, has predicted that Bitcoin could become overbought within the next 18 days, according to the Keltner channel chart indicator. Keltner Channel Shows Bitcoin in Overbought Position Analyst Alex Krüger tweeted on Monday (June 24, 2019) that bitcoin could be overbought over the next 18 days, based on an analysis of the Keltner Channel indicator - which provides information of price/trend breakouts and if an asset is overbought or oversold. IsRead MoreThe post Bitcoin Likely to be Overbought by July 13, Says Analyst appeared first on Bitcoinist.com.",NEUTRAL,없음,BTC | MARKET,,0,0,Bitcoinist,https://bitcoinist.com/bitcoin-likely-to-be-overbought-by-july-13-says-analyst/,https://images.cryptocompare.com/news/bitcoinist/bkbrpgXhJyj.jpeg
13285833,https://ambcrypto.com/?p=98729,1561478412,"Tron celebrates its Independence Day, Longhash on the risk of a 51% attack and more","Crypto News - 25 June - Tron celebrates its Independence Day, Longhash on the risk of a 51% attack and more Don&apos;t forget to follow us for our daily videos#tron #bitcoin #CryptoNews #cryptocurrency #bitcoinnews #TRONIndependenceDay #Crypto pic.twitter.com/sHXVhHtQdX — AMBCrypto (@CryptoAmb) June 25, 2019 Crypto News - 25 June Circle&apos;s CEO on future of non-sovereign money: ...The post Tron celebrates its Independence Day, Longhash on the risk of a 51% attack and more appeared first on AMBCrypto.",NEUTRAL,없음,ALTCOIN | BTC | TRX,,0,0,AMB Crypto,https://ambcrypto.com/tron-celebrates-its-independence-day-longhash-on-the-risk-of-a-51-attack-and-more/,https://images.cryptocompare.com/news/ambcrypto/cQ868ccNIUy.jpeg
13244936,https://nulltx.com/?p=95539,1561477047,"Facebook’s Libra Is Not Solely Behind Price Rally, It Started Way Back: Circle CEO","The price of bitcoin has been on one hell of a run in the past few weeks, bringing an end to a tough crypto winter. The digital currency currently trades at $11,340 ta press time according to data from Coinmarketcap. In the past 24 hours, it has gained over 4 percent, with the trading volume ...The post Facebook&apos;s Libra Is Not Solely Behind Price Rally, It Started Way Back: Circle CEO appeared first on NullTX.",POSITIVE,없음,BTC | TRADING,,0,0,NullTx,https://nulltx.com/allaire-reveals-btc-pump-factor/,https://images.cryptocompare.com/news/themerkle/c4QCEa8Owg8.jpeg
13285834,https://ambcrypto.com/?p=98702,1561476614,Tron CEO Justin Sun bets on shaking down the ‘existing power structure’ of the Internet,"The cryptocurrency market has always been dictated by the comments of its proponents, be it about updates or just regular events in the digital asset ecosystem. In a recent Ask Me Anything [AMA] session, Justin Sun, Chief Executive Officer [CEO] of the Tron Foundation, spoke about the next generation of the Internet and how Tron ...The post Tron CEO Justin Sun bets on shaking down the &apos;existing power structure&apos; of the Internet appeared first on AMBCrypto.",POSITIVE,없음,ALTCOIN | MARKET | TRX,,0,0,AMB Crypto,https://ambcrypto.com/tron-ceo-justin-sun-bets-on-shaking-down-the-existing-power-structure-of-the-internet/,https://images.cryptocompare.com/news/ambcrypto/9U0o7100200.jpeg
13467512,https://www.cryptonewsz.com/?p=28067,1561476448,Bitcoin IRA Launches Crypto Retirement Accounts By Partnering With BitGo,"Bitcoin IRA, an organization that has more expertise in offering crypto for IRAs (individual retirement accounts), has cracked an association with BitGo Trust, which will provide customers with the flexibility to insure their accounts by BitGo. Bitcoin IRA started offering retirement accounts in 2016 and has created greater than 5,000 hybrid crypto individual retirement accounts …The post Bitcoin IRA Launches Crypto Retirement Accounts By Partnering With BitGo appeared first on CryptoNewsZ.",POSITIVE,없음,BTC | ICO,,0,0,CryptoNewsZ,https://www.cryptonewsz.com/bitcoin-ira-launches-crypto-retirement-accounts-by-partnering-with-bitgo/28067/,https://images.cryptocompare.com/news/cryptonewsz/d13a0m00E10.jpeg
13467513,https://www.cryptonewsz.com/?p=28065,1561475989,"Monero Price Analysis: XMR Coin Is Showing Positive Growth, Unlike Bearish Market Trend","Xmrig 2.16.0-beta update rolled out with RandomX. The update will include a CPU and Proxy server as well. XMR Current Statistics: On June 25, at UTC 12:17, XMR price was trading around 117.050 USD. At the same time, Monero vs. Bitcoin was trading at 0.01027999 BTC. Additionally, the Market Cap of the XMR coin was …The post Monero Price Analysis: XMR Coin Is Showing Positive Growth, Unlike Bearish Market Trend appeared first on CryptoNewsZ.",POSITIVE,BTC | XMR,BTC | MARKET | TRADING | XMR,,0,0,CryptoNewsZ,https://www.cryptonewsz.com/monero-price-analysis-xmr-coin-is-showing-positive-growth-unlike-bearish-market-trend/28065/,https://images.cryptocompare.com/news/cryptonewsz/egjg810w000.jpeg
42382210,0r6Zag11PPDEMKgUX9qtfr,1561475813,CFTC Approves LedgerX to Settle Futures in Real Bitcoin,"The Commodity Futures Trading Commission (CFTC) has cleared bitcoin derivatives provider LedgerX to offer physically settled bitcoin futures contracts.  The CFTC said Tuesday it had approved LedgerX's application for a designated contract market (DCM) license, meaning the company can now offer the new futures contracts. LedgerX is the second company to receive approval to offer physically settled bitcoin futures; other firms, such as Intercontinental Exchange's Bakkt, Seed CX and ErisX plan to enter this market. (While Bakkt's own futures contracts have been self-certified, the firm is waiting for the New York Department of Financial Services to license its warehouse).  Unlike the cash-settled bitcoin futures listed by the Chicago exchanges Cboe and CME, in physically settled futures the buyer receives the underlying commodity when a contract expires, rather than the fiat equivalent.  Monday's approval means that New York-based LedgerX can not only list these bitcoin futures contracts but crucially can offer its products to retail clients, not just institutional ones.  No timeline was provided for when LedgerX might start to offer futures. but chief operating and risk officer Juthica Chou told CoinDesk that the company was looking to be the first provider of this product in the U.S.  ""There’s no doubt that we’re looking to be first, we’re looking to be the incumbent,"" she said. ""We think we’re better positioned and we want to be there to serve customers of all sizes.""  LedgerX would follow the same self-certification process that it already underwent to offer swaps and options, Chou said, adding:  ""Ultimately the products are not that economically different than what we’re already offering … but this would open up to a broader [market].""  While Bakkt has previously announced that it would be testing its own physically-settled bitcoin futures contracts in July, a firm launch date has yet to be announced. Seed CX and ErisX have likewise not yet announced when they would launch their futures products (or forwards, in Seed CX's case).  Months-long process  LedgerX applied for the DCM in November 2018 and has since been working with the CFTC. It already offers swaps and options contracts for customers.  The DCM application came on top of LedgerX's existing Swap Execution Facility (SEF) and Derivatives Clearing Organization (DCO) licenses, which approve the company's exchange platform and clearinghouse, respectively.  The new license carries with it the same set of responsibilities that the other two have, Chou said, though securing the latest approval ""was a pretty difficult process"" due to the issues involved.  LedgerX is now eyeing a gradual rollout of its new products, including its retail-focused Omni platform.  ""We want to be careful and conservative so we'll soft-launch the Omni product,"" she said. ""We'll take customer feedback and we'll make sure it works.""  The company will roll out its existing swaps and options product to all customers, as well as a new block height option product which the company recently self-certified.  Chou added:  ""We have a pretty extensive waitlist and we'll work through that until we feel comfortable.""  LedgerX team image courtesy Juthica Chou",POSITIVE,없음,BTC | COMMODITY | EXCHANGE | FIAT | MARKET,Nikhilesh De,0,0,CoinDesk,https://coindesk.com/markets/2019/06/25/cftc-approves-ledgerx-to-settle-futures-in-real-bitcoin,https://cdn.sanity.io/images/s3y3vcno/production/6cbba9b2c84dd43dc3a99f8a753bcaab69682e59-1500x941.jpg?w=300&h=300&fit=crop
42382221,0r6Zag11PPDEMKgUX9qtrB,1561475413,Synthetix Trader Rolls Back Broken Trades That Netted $1 Billion Profit,"In what amounts to a particularly heart-warming example of the power - and responsibilities - of decentralization, Synthetix founder Kain Warwick announced that an error that netted one legitimate user over $1 billion in profit has been fixed and that the user rolled back all the transactions in exchange for a bug bounty.  The error occurred when a commercial API began reporting wildly high prices for the Korean Won.  ""Our price oracle has a mechanism for discarding outliers and should have absorbed this discrepancy gracefully, unfortunately the price feed for KRW was only being served by two API’s at that time due to an earlier unrelated outage which had not been caught by our exception reporting,"" wrote Warwick.  From the report:  There are currently a number of trading bots actively trading on Synthetix.exchange using different strategies, one of these bots was able to detect this price error and exploit it to trade into and out of sKRW during the window where the API was incorrectly reporting the price. This resulted in several trades with profits of 1000x, resulting in over $1b in profit in less than an hour.  Luckily the bot owner understood their preposterous position and agreed to send the crypto back, a noble and/or important part of growing ecosystems like this one.  ""No funds were lost, the owner of the bot who exploited the issue agreed to reverse the trades,"" Warwick said. ""He was unaware of the issue (his bot was fully automated) until after the news broke. He reached out on Reddit once he knew and we negotiated a bounty for reversing he trades. His goal was to build a profitable bot and he wanted to make sure the profit he had made up to that point, about 30k, was safe. So we paid him a bounty for reversing the trade, since his bot was the only one that was able to exploit the oracle defect.""  Photo by Nanna Moilanen on Unsplash",POSITIVE,없음,BUSINESS | EXCHANGE | MARKET | TRADING | ZRX,John Biggs,0,0,CoinDesk,https://coindesk.com/markets/2019/06/25/synthetix-trader-rolls-back-broken-trades-that-netted-1-billion-profit,https://cdn.sanity.io/images/s3y3vcno/production/7ad68c5909522d1c257ffb013af03a04ea981c41-2560x1707.jpg?w=300&h=300&fit=crop
13467514,https://www.cryptonewsz.com/?p=28059,1561475274,"Ontology Price Analysis: Ontology’s Bullish Trend To Continue, Prices May Reach New High","Over the past few months, the coin has shown growth with very minimal falls in April and May. Having said that, the Ontology coin has managed to bounce back and retain the bullish trend. Today at the time of writing this analysis, the movement is bullish, and it is expected that the same movement of …The post Ontology Price Analysis: Ontology&apos;s Bullish Trend To Continue, Prices May Reach New High appeared first on CryptoNewsZ.",POSITIVE,없음,MARKET | TRADING,,0,0,CryptoNewsZ,https://www.cryptonewsz.com/ontology-price-analysis-ontologys-bullish-trend-to-continue-prices-may-reach-new-high/28059/,https://images.cryptocompare.com/news/cryptonewsz/9E7j9004U22.jpeg
13585130,https://www.cryptopolitan.com/?p=17733,1561474849,TRON price analysis 25 June 2019; TRX fails to maintain $0.04 resistance,"TRON&apos;s most difficult resistance level, the $0.035 mark was broken thanks to the recent uptrend in the market due to Bitcoin&apos;s sudden surge above $11,000. However, TRX didn&apos;t manage to maintain the $0.040 price point after surpassing it yesterday evening and is now struggling at the $0.038 at the moment of writing this article. Despite the mass struggle to finally pass the price point, major resistance levels are starting to be formed above the $0.040 price point at $0.042 and $0.045 respectively. However, the first major indicator is the coin&apos;s performance at $0.04, should it fail to surpass it before",NEUTRAL,TRX,MARKET | TRADING | TRX,,0,0,Cryptopolitan,https://www.cryptopolitan.com/tron-price-analysis-25-june-2019-trx-fails-to-maintain-0-04-resistance/,https://images.cryptocompare.com/news/cryptopolitan/cnIPMx4g80x.jpeg
42382213,0r6Zag11PPDEMKgUX9qtjd,1561474835,Wait for October: New Bitcoin Miner Demand Is Again Outstripping Supply,"Bitcoin's ongoing bull run has juiced demand for new mining equipment, putting pressure on manufacturers to produce enough machines to satiate buyers.  The world's largest cryptocurrency by market cap is currently trading at above $11,000 after it surpassed the $10,000 level over the weekend – a nearly 200 percent jump since February.  “The surge in bitcoin resulted in increased demand and supplies were already short,” said Steven Mosher, head of global sales and marketing at Canaan Creative, maker of the Avalon miner.  While he declined to disclose the firm’s order volume, Mosher said in an email that “the current state of the industry is that inventories are down and demand is high.”  He told CoinDesk:  “It looks like a return to the 2017 Q3, Q4 conditions, where demand was three times the supply.”  Back then, bitcoin’s price had doubled from July to September in 2017 and further jumped by four times in the last quarter, reaching almost $20,000.  The price increase over the past several months also led to a significant drop of the time it takes for new mining equipment to pay for itself, according to data provided by TokenInsight, a crypto startup that focuses on mining and trading research.  The firm estimates the average payback period for most mining equipment in the second quarter has dropped to 60 to 150 days, a notable decrease from the previous range of 120 to 280 days.  New models  To capture the new opportunities, Canaan launched a new mining model last month, the AvalonMiner 1041, which it claims can compute as much as 37 terahashes per second (TH/s) with electricity consumption at 2,361 watts per hour.  By comparison, an older model, the Avalon 851, performs its calculations at a speed of around 14.5Th/s, consuming 1450 watts an hour.  Mosher added that pre-orders for such models are already queued up to as late as October delivery, due to the bulk of buying interest coming from larger customers.  Similarly, crypto mining giant Bitmain rolled out for sale improved versions of its AntMiner S9 model, dubbed AntMiner S9 SE and S9k just last week. Shipment of the first batch won't be scheduled until August, according to the firm’s website.  Even more expensive and powerful products, such as the WhatsMiner M20, launched by ex-Bitmain chip design director Zuoxing Yang, are seeing an increasing level of buying interest.  Yang told CoinDesk that the next batch of M20s, which are scheduled for shipment as late as October, is ""almost sold out"" at the moment.  But Yang added another important reason why the industry's supply is having difficulty catching up with the demand is production capacity due to the limited supply of chips from various vendors to begin with.  ""Bitcoin's hash rate increase just can't keep up with the pace of the price jump,"" Yang said. ""Production capacity is the bottleneck.""  Hash rate boost  Indeed, the resurgence of mining interest is also reflected in the overall amount of computing power devoted to securing the bitcoin network, which recently hit an all-time high.  Based on data from mining pool BTC.com, the latest one day and seven-day average hash rates are at 65 million TH/s and 58 million TH/s, respectively.  This aggregated computing power has jumped by about 80 percent since late last year when the 14-day average bitcoin mining hash rate dropped to as low as 36 million TH/s amid bitcoin’s price decline.  Assuming all such additional computing power has come from more widely used mining models like the AntMiner S9 or Avalon 851 with an average hashing power of about 14 TH/s, that would translate to roughly 2 million mining units having been switched on over the past few months.  As a result, BTC.com estimates that bitcoin mining difficulty – a measure of how hard it is to solve the math problems that earn new coins – will further increase by six percent at the beginning of the next adjustment cycle to an all-time-high level above 7.8 trillion.  Bitcoin ASIC miner image via Shutterstock",POSITIVE,BTC,BTC | MARKET | MINING | TRADING,Wolfie Zhao,0,0,CoinDesk,https://coindesk.com/markets/2019/06/25/wait-for-october-new-bitcoin-miner-demand-is-again-outstripping-supply,https://cdn.sanity.io/images/s3y3vcno/production/9d2139266ea4892fa24bcd65ef5376e7854cb1fe-1500x1000.jpg?w=300&h=300&fit=crop
13285835,https://ambcrypto.com/?p=98764,1561474834,BitMax.io [BTMX.com] Announces Listing of Standard Tokenization Protocol [STPT],"BitMax.io [BTMX.com] has announced the listing of STPT, the native token of Standard Tokenization Protocol, a decentralized network for the tokenization of an asset. Trading for the STPT/BTC and STPT/USDT pairs will be enabled on Tuesday, June 25th at 10:00 am EDT. As part of the listing collaboration, the BitMax.io team will provide strategic support ...The post BitMax.io [BTMX.com] Announces Listing of Standard Tokenization Protocol [STPT] appeared first on AMBCrypto.",POSITIVE,없음,BLOCKCHAIN | ICO | TRADING,,0,0,AMB Crypto,https://ambcrypto.com/bitmax-io-btmx-com-announces-listing-of-standard-tokenization-protocol-stpt/,https://images.cryptocompare.com/news/ambcrypto/9BCCmqppYMP.png
13285836,https://ambcrypto.com/?p=98638,1561474832,"Tron Foundation announces $20 million TRX buy-back plan to promote community activity, market stability","Over the years, the cryptocurrency ecosystem has achieved significant stature in the economic industry. The space presently is highly competitive, with several virtual assets battling to attain higher adoption rates with crypto-users. Justin Sun&apos;s Tron has been one of the most involved cryptocurrencies in the space over the last few months as the token continued ...The post Tron Foundation announces $20 million TRX buy-back plan to promote community activity, market stability appeared first on AMBCrypto.",POSITIVE,TRX,ALTCOIN | ICO | MARKET | TRX,,0,0,AMB Crypto,https://ambcrypto.com/tron-foundation-announces-20-million-trx-buy-back-plan-to-promote-community-activity-market-stability/,https://images.cryptocompare.com/news/ambcrypto/cA0001g0a00.png
