뉴스ID,뉴스GUID,일자(UTC timestamp),뉴스제목,본문,SENTIMENT,주요코인,카테고리,작성자,추천수,비추천수,출처,뉴스URL,이미지URL
13437111,https://news.bitcoin.com/?p=232978,1540035018,$50 Million Bitcoin Mining Farm Opens in Armenia,"A new cryptocurrency mining facility opened in Armenia on Oct. 18. The $50 million farm will extract bitcoin and ethereum using 3,000 machines, according to local media reports. Around 120,000 more miners are to be added in the months to come. Also read: Marks Jewelers Now Accepts Bitcoin Cash For Payments Multi Group and Omnia Establish ...The post $50 Million Bitcoin Mining Farm Opens in Armenia appeared first on Bitcoin News.",POSITIVE,없음,BCH | ETH | MINING,,0,0,Bitcoin.com,https://news.bitcoin.com/50-million-bitcoin-mining-farm-opens-in-armenia/,https://images.cryptocompare.com/news/bitcoin.com/e9c04000000.jpeg
42402020,DbF8Q09kuKX2XWBxAd3Fqg,1540033179,What China's Cashless Revolution Can Teach the West About Crypto,"Michael J. Casey is the chairman of CoinDesk's advisory board and a senior advisor for blockchain research at MIT's Digital Currency Initiative.  The following article originally appeared in CoinDesk Weekly, a custom-curated newsletter delivered every Sunday exclusively to our subscribers.      Cash appears to be disappearing from China's teeming cities.  Foreign tourists talk of struggling to buy things because they don't have Alipay or WeChat Pay installed on their smartphones and because merchants no longer bother to accept the banknotes they get from ATMs.  These stories elicit fascination among Americans, but not much more. Here in the U.S., many can't grasp what the big deal is about digital payments. After all, pulling a credit card from your wallet isn't much more inconvenient than pulling a smartphone out of your pocket and it costs you – if not the merchant – no more than if you used cash. To the average American, China's system seems no different from Venmo or Paypal, just more pervasive.  But as Andreessen Horowitz partner Connie Chan told me during a fireside chat at the HYTSA conference at Stanford a week ago, the real benefits of China's cashless revolution lie in how this new, software-based system of value exchange has become a platform on which new business models can be built.  Digitizing payments in this way, at very low cost, enables micropayments and seamless integration across different service providers, which in turn means merchants can provide a variety of new services to customers over an app. This helps to enhance the user' experience, boost loyalty and engagement, and build network value.  Consider how Kuguo, the most popular of a number of Chinese music apps, provides ""song coins"" to fans, based on their level of engagement, which they can exchange into renminbi, the local currency.  Essentially, by removing intermediation costs from the payments system, Alibaba affiliate Ant Financial's Alipay and Tencent's WeChat Pay – which together now boast a billion users, according to Aite Group – have created a seamless foundation for a whole new digital economy. Chan says this is where U.S. app developers are being left behind, because their products can't integrate with this new model.  The relevance in this for CoinDesk readers, with their interest in cryptocurrency and blockchain technology, starts with the fact that this dream of a seamless, micropayments-enabled system of hitherto impossible new services is one that's often cited by crypto enthusiasts.  So, does China prove that you don't need a blockchain to build a new Internet of Value, powered by device-to-device exchanges in an Internet of Things economy?  Well, yes, and, no.  Crypto dream, Chinese characteristics  There is a very real and illuminating limit to China's system: It can't easily go outside its borders.  Although some U.S.-based providers are now creating services for Chinese tourists so they can buy things in America with their WeChat Pay or Alipay accounts, most of the activity on these networks happens in China. Most importantly, while Alipay and WeChat Pay are trying to crack other markets, there is no cross-currency facility. For all intents and purposes, this ""cashless revolution"" is happening within the boundaries of a renminbi universe.  The reason for that is that unlike cryptocurrency systems, the Chinese digital payments system is entirely built on the rails of the Chinese banking system, which deals almost exclusively in the Chinese currency. In that sense, it does share a foundation more like Venmo's and Paypal's, whose accounts also settle back into the banking system, than that of bitcoin or other cryptocurrencies.  The big difference is that for a host of reasons, the banks don't charge the same kind of exorbitant interchange fees to Chinese merchants that U.S. banks do to U.S. businesses, allowing the digital payments providers to build a much more fluid micropayments model on top.  But here's the thing: the Chinese banking system is essentially an instrument of Chinese policymaking. The four biggest banks make up the bulk of the financial system and are all majority government-owned. Their capacity to make profits, essentially on the spread they charge for loans over what they pay for deposits, is enabled by a carefully managed monetary policy. The People's Bank of China sets a ceiling for deposit rates – often below inflation – and can get away with that because it imposes capital controls on savers to prevent them fleeing low rates for higher-earning currencies.  To be sure, Ant Financial and Tencent both have a variety of financial and banking licenses of their own. But their own financial profits are very much enabled by the same interest rate policy framework that a wider state-run Chinese banking system is compelled to accept.  For now, that policy framework has sustained a quid pro quo arrangement with Chinese savers, who more or less support a banking system that otherwise eats into their savings because the benefits are manifest in continued economic growth and in services like those of Tencent and Alibaba.  But for some time, there has been an expectation that China, in its desire to ""internationalize"" the renminbi, will relax both its interest rate and capital controls, which could seriously undermine banks' profit margins. If China were also to allow more private and foreign investment into the banks, would those institutions continue to subsidize the digital payments economy? Maybe, maybe not.  Since we can't be like China, maybe embrace crypto?  The bigger point is that China's circumstances are unique. There aren't many governments, if any, that could get away with this kind of control over the banking system. Others have tried – such as Venezuela and Argentina – and have destroyed confidence in their currencies in the process.  So, if the rest of the world can't use compliant banks to subsidize a fluid, digital payments system, what instead will it use as the platform?  The answer may well lie in cryptocurrency and blockchain-based protocols. And as the race to build a stablecoin proceeds, a foundation for something that could viably compete with China's model may emerge. It might even go one step better, as it would allow for cross-border payments.  As U.S. government officials look nervously across the Pacific at China's growing economic clout, rather than launching destructive trade wars that do nothing but prop up outdated, 20th-century industries, they should instead be figuring out how to emulate and compete with China's new Internet of Value model for business development and innovation.  It's in that context that they should be looking at cryptocurrencies and blockchain technology less as a threat and more as an opportunity.  Cashless payments in China image via Shutterstock",NEUTRAL,없음,ASIA | BLOCKCHAIN | BUSINESS | EXCHANGE | REGULATION,Michael J. Casey,0,0,CoinDesk,https://coindesk.com/markets/2018/10/20/what-chinas-cashless-revolution-can-teach-the-west-about-crypto,https://cdn.sanity.io/images/s3y3vcno/production/de677b2cfcdc70a60bd9db9cb5283504898429de-1500x1125.jpg?w=300&h=300&fit=crop
13370570,https://blokt.com/?p=24591,1540030085,What is a GPU and What Role Does It Play in Mining Cryptocurrencies?,"By Patricia Bajis Ever since 2009, coders, developers and your computer-savvy friends have been mining cryptocurrencies in order to gain the currency themselves. With the cap of the amount of Bitcoin in the world being 21 million, miners are seeing diminishing returns on their work as we approach the cap and more people join in ...What is a GPU and What Role Does It Play in Mining Cryptocurrencies? was originally found on [blokt] - Blockchain, Bitcoin &amp; Cryptocurrency News.",NEUTRAL,없음,BLOCKCHAIN | BTC | MINING,,0,0,Blokt,https://blokt.com/mining/what-is-a-gpu-and-what-role-does-it-play-in-mining-cryptocurrencies,https://images.cryptocompare.com/news/blokt/e4EE346cg0g.jpeg
42402032,DbF8Q09kuKX2XWBxAd3G0W,1540029637,Bitcoin's White Paper Gave Us Liberty – Let's Not Give It Back,"One of bitcoin's earliest entrepreneurs, Charlie Shrem is the former founder of BitInstant and co-founder of cryptocurrency intelligence service CryptoIQ.  This exclusive opinion piece is part of CoinDesk's ""Bitcoin at 10: The Satoshi White Paper"" opinion series.      Ten years after Satoshi published the white paper that gave us bitcoin – and the explosion of innovation it launched – I continue to be astounded at its transformative power.  Money is such a fundamental part of life, and it has played such a huge role in mine, for good and bad. Bitcoin is the awakened sleeping giant of it all because it has fundamentally and forever changed money and, more importantly, money's seat of power.  For me, this is the most important aspect of bitcoin and cryptocurrency: its role in propagating power to the greatest number of people possible. What Satoshi did when he democratized money was hand every individual alive – and generations to come – vast personal liberty.  This shift in power from the few to the many equals events in history like the advent of democracy itself, the invention of the printing press and the Renaissance. But it's important to remember that nothing is free. What we gained in liberty with bitcoin, we lost in the security of knowing someone else was responsible for protecting our money.  But which would you rather have? Would you rather be able to spend your money exactly how you see fit and know that it is safe from the whims of political leaders with no skin in the game? Or would you rather have the comfort of knowing that if you fail to be vigilant, someone will make you financially whole again?  This is why I'm an ardent student of history. It's a shortcut to understanding human nature, and it tells me I'd rather take my chances being the one making decisions about my life.  A Real Use Case  These days you don't even need to study the past. The 24-hour news cycle gives us a window on economic disaster as it unfolds. We're seeing in real time every stage of financial collapse on a national scale.  Look to Venezuela to see a society in the last throes of a financial meltdown, its people starving while its leaders continue to thrive, inflation hitting numbers that seem made up.  The International Monetary Fund expects that Venezuela's year-end annual inflation rate will approach 13,000 percent. That's astonishing when you consider that 4 or 5 percent makes news in other parts of the world. We've all heard about post World War I Germany and people using bags of money to buy bread. Here we are, a century later, and people are still subject to the capriciousness of the powerful.  Bitcoin could have changed things for the Venezuelans if they'd had an inkling of what was to come – and they should have – and thought to buy bitcoin or some other currency not tied to the bolivar.  Look to Turkey to see the early stages of a financial meltdown. The country is battling rising government debt, double-digit inflation and a currency whose value has plummeted. Turkish citizens are frantically unloading their lira to hang onto whatever value they can.  Many are turning to foreign currencies and many to bitcoin and other cryptocurrencies.  According to a survey of 15,000 people by Statistica, roughly one in five Turks owns cryptocurrency, the greatest rate of adoption of any of the countries surveyed. Bitcoin is already changing things for the Turks.  To see a society in the earliest stages of this kind of collapse, look to the U.S. Few here realize where we are headed with our inflationary monetary policy and runaway spending. But those few are already hedging against what many experts say will be a new and massive financial crisis for this country.  For the few paying attention, bitcoin is changing things in the U.S. before they even get started.  Fiat's Star is Setting  We all know from trading cards and small toys in the schoolyard that money is part of being human. If it doesn't already exist for us, we create it. I saw that in prison.  Despite rules and razor wire, prisoners were able to create a currency of mackerel packets and a black market economy that was stunningly diverse in what it offered for sale – everything from personal services like weight training and letter writing to specialty catering built on the limited, shelf-stable foods available.  So in a sense, bitcoin is nothing new to money. People are always innovating, and bitcoin is the logical next step. It is the response of people long imprisoned by a system that puts them at a significant disadvantage compared to the powerful. It's a system that has allowed those who rule money to steal from the people who use and save it for themselves and their families.  Again, you don't need a history book to see what happens when governments are sloppy and even malicious with monetary policy, when leaders neglect their duty to protect not only a country's currency but also its value. All we need to know from history is that this has happened many more times than once and that it will happen again – is happening now.  Our dependence on others to take care of us at the expense of personal liberty and responsibility has grown insidiously to the point when people are at the mercy of individuals and organizations who have never had their best interests at heart.  Bitcoin comes with great rewards and risk, but your national currency is fiat with everything that entails and has its own even graver risks, I believe. To me, it is handing someone else the keys to the future and crossing your fingers.  Any history book will tell you how well that's worked out.  Liberty Bell image via Shutterstock",POSITIVE,없음,BTC | FIAT | MARKET | TRADING,Charlie Shrem,0,0,CoinDesk,https://coindesk.com/tech/2018/10/20/bitcoins-white-paper-gave-us-liberty-lets-not-give-it-back,https://cdn.sanity.io/images/s3y3vcno/production/a9a51857231806a82ee4c459244903be2b2ddb04-628x356.jpg?w=300&h=300&fit=crop
13452381,https://bitcoinist.com/?p=90293,1540029601,New York City Mansion Hits the Market for Either Cash or Bitcoin,"A 10,720-foot mansion next to Manhattan&apos;s Riverside Park is on the market for $15.9 million dollars. The buyer is open to accepting cash or Bitcoin from a buyer. After a five-year renovation project, Roy Niederhoffer is now reluctantly placing his 10,720-foot mansion on the market for $15.9 million dollars, according to Fortune. Nestled close to Riverside Park in Manhattan with views of the Hudson River and New Jersey, the now six-floor residence is one NiederhofferRead MoreThe post New York City Mansion Hits the Market for Either Cash or Bitcoin appeared first on Bitcoinist.com.",POSITIVE,없음,BTC | MARKET,,0,0,Bitcoinist,https://bitcoinist.com/new-york-city-mansion-hits-the-market-for-either-cash-or-bitcoin/,https://images.cryptocompare.com/news/bitcoinist/dO0cE0g2800.jpeg
13246891,https://nulltx.com/?p=71118,1540022717,XRP Price Still Eyes $0.5 as Third Try Might be the Charm,"It is not uncommon to see all of the top cryptocurrencies in the green on Saturday morning. At the same time, this seemingly promising sign is not necessarily a guarantee for further upward momentum over the weekend. The XRP price is trying to make yet another move, although $0.5 remains well out of reach. XRP ...The post XRP Price Still Eyes $0.5 as Third Try Might be the Charm appeared first on NullTX.",POSITIVE,XRP,TRADING | XRP,,0,0,NullTx,https://nulltx.com/xrp-price-still-eyes-0-5-as-third-try-might-be-the-charm/,https://images.cryptocompare.com/news/themerkle/e00000w0000.jpeg
13235628,https://www.newsbtc.com/?p=354587,1540022608,Bitcoin Congestion Reaches 95%; Fees Remain Relatively Low,"Bitcoin blocks experienced up to 95 percent congestion this month, but it didn&apos;t impact its transaction fees, which remain at around $0.1 Cryptocurrency analyst Willy Woo published a graph to demonstrate a stark comparison between BTC transaction fees in two separate congestion episodes. The first case was from 2017, the year that witnessed Bitcoin congestion...The post Bitcoin Congestion Reaches 95%; Fees Remain Relatively Low appeared first on NewsBTC.",NEUTRAL,BTC,ALTCOIN | BTC,,0,0,NewsBTC,https://www.newsbtc.com/2018/10/20/bitcoin-congestion-reaches-95-fees-remain-relatively-low/,https://images.cryptocompare.com/news/newsbtc/cEh900402g0.jpeg
13452382,https://bitcoinist.com/?p=90256,1540018848,Ledger CEO Wins French Award for Startup With International Potential,"Eric Larchevêque, CEO and co-founder of cryptocurrency hardware wallet-maker Ledger, has won a French award for the startup leader whose model has the greatest potential internationally. The prestigious regional prize in Ernst &amp; Young&apos;s (EY) 26th Entrepreneur of the Year 2018 awards, located in France, is &apos;Startup of the Year.&apos; Ledger&apos;s Eric Larchevêque can lay claim to this award, as well as the &apos;Born Global Award&apos; for the international potential of his startup Ledger. International SuccessRead MoreThe post Ledger CEO Wins French Award for Startup With International Potential appeared first on Bitcoinist.com.",POSITIVE,없음,WALLET,,0,0,Bitcoinist,https://bitcoinist.com/ledger-ceo-wins-french-award-for-startup-with-international-potential/,https://images.cryptocompare.com/news/bitcoinist/8cia0D6Qz44.jpeg
13437112,https://news.bitcoin.com/?p=233012,1540018558,Bitcoin Cash Merchant Directory Marco Coino Surpasses 500 Listings,"Over the last year bitcoin cash adoption has been thriving and in certain regions, BCH merchants are spreading like wildfire. Thanks to a slew of cryptocurrency payment processors and people pressing for adoption there are thousands of BCH accepting merchants these days. One application called Marco Coino helps bitcoiners find BCH brick-and-mortar retailers on a ...The post Bitcoin Cash Merchant Directory Marco Coino Surpasses 500 Listings appeared first on Bitcoin News.",POSITIVE,BCH,BCH,,0,0,Bitcoin.com,https://news.bitcoin.com/bitcoin-cash-merchant-directory-marco-coino-surpasses-500-listings/,https://images.cryptocompare.com/news/bitcoin.com/c2008000000.jpeg
13235629,https://www.newsbtc.com/?p=354578,1540009852,Cryptocurrency Market Update: A New Brave Browser Boosts BAT,FOMO Moments Another flat Saturday as markets are stagnant; Only BAT and DGTX heading higher. The weekend has brought no joy to crypto markets which have remained immobile for the past few days. The slow downward slide seems to have halted just below $210 billion market capitalization where things remain for another day. Bitcoin is...The post Cryptocurrency Market Update: A New Brave Browser Boosts BAT appeared first on NewsBTC.,NEUTRAL,BAT | BTC,ALTCOIN | BAT | BTC | MARKET,,0,0,NewsBTC,https://www.newsbtc.com/2018/10/20/cryptocurrency-market-update-a-new-brave-browser-boosts-bat/,https://images.cryptocompare.com/news/newsbtc/aoI424Yw6m0.jpeg
13437113,https://news.bitcoin.com/?p=233058,1540008357,Only 39 Percent Pass Malta’s Cryptocurrency Exam for Financial Services Practitioners,The pass rate for the exam developed by the Maltese government for financial services practitioners seeking to obtain cryptocurrency agent certification is reportedly only 39 percent. The exam is part of the requirements mandated by the country&apos;s newly established Virtual Financial Assets Act. Also read: Yahoo! Japan Confirms Entrance Into the Crypto Space Low Pass Rate ...The post Only 39 Percent Pass Malta&apos;s Cryptocurrency Exam for Financial Services Practitioners appeared first on Bitcoin News.,NEGATIVE,없음,ASIA | BTC | REGULATION,,0,0,Bitcoin.com,https://news.bitcoin.com/maltas-cryptocurrency-exam/,https://images.cryptocompare.com/news/bitcoin.com/eE1xA2020W0.png
13452383,https://bitcoinist.com/?p=90240,1540008000,Square’s Debut of Payment Terminal Triggers Fresh Bitcoin Acceptance Rumors,"Consumer and merchant payment network Square Inc. unveiled a point-of-sale (PoS) terminal October 19 in a move which sparked excitement about possible Bitcoin integration. Bitcoin PoS Next For Square? Unveiled on social media and in an interview with tech outlet Nerdist, Square&apos;s device is designed as a standalone solution for merchants wishing to accept card payments. The move comes amid testing times for Square, the company&apos;s share price dropping 25 percent since the start of OctoberRead MoreThe post Square&apos;s Debut of Payment Terminal Triggers Fresh Bitcoin Acceptance Rumors appeared first on Bitcoinist.com.",POSITIVE,없음,BTC | EXCHANGE | TRADING,,0,0,Bitcoinist,https://bitcoinist.com/square-payment-terminal-debut-triggers-fresh-bitcoin-acceptance-rumors/,https://images.cryptocompare.com/news/bitcoinist/d1gA6184200.jpeg
13235630,https://www.newsbtc.com/?p=354553,1540001704,"Monero Price Analysis: Price Stable, XMR is Bullish above $100","36 hours after hard forking and Monero buyers are yet to confirm Oct 15 gains. If anything, there seems to be resistance for upsides and this is negative for bulls. Anyhow, we suggest aggressive buyers to load at spot prices with stops at $190 while risk-averse traders should be on the side lines until there...The post Monero Price Analysis: Price Stable, XMR is Bullish above $100 appeared first on NewsBTC.",NEUTRAL,XMR,MARKET | TRADING | XMR | FORKS,,0,0,NewsBTC,https://www.newsbtc.com/2018/10/20/monero-price-analysis-xmr-bullish-above-100/,https://images.cryptocompare.com/news/newsbtc/c2u9X2sx320.jpeg
13235631,https://www.newsbtc.com/?p=354566,1540000834,"Altcoins Price Analysis: Coins Ready to Rally as ADA, Stellar, Litecoin Reject Bears","While Litecoin might be a &apos;relic&apos; according to Tushar Jain, their developers are ready to slash transaction costs by a factor of 10 once Litecoin core 0.17 goes live. The release date is tentative but what we know for sure is that EOS trade volume are roughly five percent that of Ethereum. Besides, it&apos;s prone...The post Altcoins Price Analysis: Coins Ready to Rally as ADA, Stellar, Litecoin Reject Bears appeared first on NewsBTC.",POSITIVE,ADA,ADA | ALTCOIN | LTC | MARKET | TRADING,,0,0,NewsBTC,https://www.newsbtc.com/2018/10/20/altcoins-price-analysis-ada-stellar-litecoin-rally/,https://images.cryptocompare.com/news/newsbtc/8EYX9yMe4eo.jpeg
13452384,https://bitcoinist.com/?p=90243,1539997213,Expect More Crypto Hedge Funds To Close in 2018… But Not For Why You Think.,"In a recent tweet thread, Anthony &apos;Pomp&apos; Pompliano, co-founder of Multicoin Capital, outlines why many of crypto hedge funds might be closing their doors in 2018. Most people would expect that the bear market and the prices would be the number one reason why most hedge funds are closing up shop. While this is certainly a factor, Pomp believes that it has to do more with the fee structures that the funds set-up in 2017. InRead MoreThe post Expect More Crypto Hedge Funds To Close in 2018… But Not For Why You Think. appeared first on Bitcoinist.com.",NEUTRAL,없음,BTC | ETH | LTC | MARKET | TRADING,,0,0,Bitcoinist,https://bitcoinist.com/expect-more-crypto-hedge-funds-to-close-in-2018-but-not-for-why-you-think/,https://images.cryptocompare.com/news/bitcoinist/agv2u1ewAyN.jpeg
