뉴스ID,뉴스GUID,일자(UTC timestamp),뉴스제목,본문,SENTIMENT,주요코인,카테고리,작성자,추천수,비추천수,출처,뉴스URL,이미지URL
42387197,0r6Zag11PPDEMKgUXBltkv,1624981557,Gerald Cotten and Quadriga: Unraveling Crypto's Biggest Mystery,"When Ameer and Raees Caji disappeared last week along with 69,000 bitcoins belonging to customers of their Africrypt exchange, they were continuing a time-honored crypto tradition. Since Bitcoin first appeared, there have been dozens and perhaps hundreds of “exit scams,” in which the heads of exchanges or token projects suddenly disappeared with user or investor funds.      One of the most notorious apparent “exit scams” was the collapse of Canadian exchange QuadrigaCX. In early 2019, the exchange disclosed, months after the fact, that founder Gerald Cotten had died of complications from Crohn’s disease while on a trip to India. His sudden death, according to the exchange, had cut off access to the “cold wallets” holding $145 million in customer tokens. Withdrawals were frozen and the firm eventually entered bankruptcy.    David Z. Morris is CoinDesk's chief insights columnist.    Angry customers and inquisitive journalists, naturally, did not take claims of Cotten’s death at face value. Instead, they started digging and quickly realized that Gerald Cotten had never been quite the upstanding citizen his clean-cut image suggested. Speculation quickly spread that Cotten had faked his death and emptied out the Quadriga piggy bank.      “Exit Scam” is a new podcast that pulls together all the strands of the complex Quadriga story into a compelling eight-part yarn. The show is produced and hosted by Aaron Lammer, also a host of the ""Longform"" podcast, and it offers some truly surprising insights into the case’s core question: Did Gerald Cotten really die in India from complications of Crohn’s disease? Or did he steal customer funds with plans to disappear forever?      The surprising answer that seems increasingly plausible after listening to ""Exit Scam"" is: “Both.”      “I think it’s been pretty well proven that Cotten was criminal in the way he operated his exchange,” says Lammer. “And he strategically extracted crypto from that exchange over time with the intent to defraud his users.”      According to postmortem findings by auditor Ernst & Young, Cotten used fake accounts on his own exchange to buy customers’ bitcoin using Canadian dollars that didn’t exist, and then moved those stolen tokens to take risky bets on other exchanges. Cotten had also taken flying lessons and made other preparations that would have been useful for a life on the lam. His will was signed just two weeks before the ill-fated India trip, and included C$100,000 (US$81,000) left to his two dogs. Most shocking of all, the mild-mannered Canadian had a track record of deception and theft going back to his teenage years.      And yet, according to every piece of evidence Lammer could dig up, Gerald Cotten really did die unexpectedly in India. “Exit Scam” includes interviews with journalists who retraced Cotten’s death, and found no credible evidence of forgery, body doubles or other foul play. Canadian law enforcement agencies seem satisfied, and have refused to exhume Cotten’s body for DNA testing.      What happened to Cotten’s wife, Jennifer Robertson, strikes me as the clearest evidence that his death was truly accidental. Robertson accompanied him to the hospital where he died, and so would have had to be a knowing collaborator if his death was faked. But if she was a collaborator, she didn’t get much for her trouble: Robertson appears to have walked away with next to none of the remaining ill-gotten Quadriga money that for a time fueled the couple’s luxurious, globe-trotting lifestyle. Even Cotten’s dogs wound up empty-pawed.    The happy scammer    Even if it doesn’t solve the Quadriga mystery, “Exit Scam” is worth your while for its insights into an even stranger question: What made Gerald Cotten a lifelong and passionate thief?      Cotten’s history of malfeasance, uncovered in part by investigator Amy Castor, began when he was just 15 years old. That was when he entered the shady world of online “high-yield investment programs” (aka HYIPs, aka Ponzi schemes). It was through that world that he became familiar with digital currencies: Well before Bitcoin even existed, Cotten was working with future QuadrigaCX co-founder Michael Patryn to help HYIP operators and others redeem or move their eGold, a gold-backed digital token later shut down by the FBI for its role in money laundering.      The postmortem discovery of Cotten’s long history of illicit involvements was shocking in part because the soft-spoken Canadian appeared to be trustworthy and mild-mannered to many. “Exit Scam” features interviews with longtime crypto veterans who worked closely with Cotten and found him entirely credible.      Moreover, Cotten would have had plenty of money thanks to his genuinely visionary early stake in crypto. “He was a presale Ethereum buyer,” Lammer points out. “If he’d never gotten involved in the exchange, he would have been rich.”      Some of the blame for Cotten’s dark path may lie with Michael Patryn. Patryn, a fellow Canadian whose role at QuadrigaCX had been occasionally nebulous, was one of the first threads investigators pulled after Cotten’s death. It was quickly discovered that Patryn’s real name was Omar Dhanani – he had changed it after being convicted of identity fraud and spending time in federal prison in the U.S. Patryn was an older, seasoned operator when he met Cotten on an HYIP message board, and they quickly became collaborators.      But Lammer thinks Cotten’s own thrill-seeking was just as much of a factor as any bad influence. “My read was that, on some level, Gerry was addicted to scamming,” the host says. “Addicted to stealing people’s money. This was more of a gambler’s high than a rich guy’s high … as he pursued more and more of other people’s money, the stakes went up.”      All that helps explain the seemingly implausible coincidence that Cotten died at the exact point when he stood to benefit most from disappearing. Cotten a) had a serious medical condition, and b) had been in the middle of one illicit financial operation or another for years. He could have died at nearly any moment since 2010 and been plausibly suspected of faking it to disappear with somebody’s money.    Read more: Most Influential 2019: Mystery Man (Profile of Gerald Cotten)    Gerald’s final thrill may have come from his misuse of customer funds in the months leading up to his death. Cotten created a Quadriga customer account under the false name “Chris Markay” and funded it with fictitious Canadian dollars. He used those fake dollars to buy customers’ cryptocurrencies, and then moved them to other exchanges. “He was putting money on other exchanges and doing risky, degen stuff with it,” says Lammer. Most importantly, Cotten wound up very long ETH.      That turned out to be a very bad bet: ETH crashed by more than 90% over the course of 2018, and stayed in the basement until late 2020. According to an investigation by the Ontario Securities Commission, Cotten’s huge speculative losses on bets made with stolen customer funds made up the bulk of roughly C$115 million ($93 million USD) missing from QuadrigaCX’s balance sheet in the final accounting.      Gerald Cotten’s gambling before his death, rather than a fake death enabling an exit scam, seems to be why Quadriga’s cold wallets were empty. That C$115 million “was more money than Quadriga made the entire time it was in business,” Lammer says. “That’s not just an 'L.' You can’t recover.”    Crime doesn’t pay (no, seriously)    This is how the story usually ends for habitual gamblers, of any stripe. Whether you’re pushing regulatory boundaries, hoping nobody comes after you when a pyramid scheme collapses, or just day-trading shitcoins, the thrill of winning can make bigger risks seem appealing. But of course, everyone loses eventually – and by the time Cotten started losing, his bets were more than big enough to wipe out a lifetime of gains. Though the extent of his personal crypto holdings remain largely opaque, there simply wasn’t much left to take from QuadrigaCX by late 2018.      So while it doesn’t definitively answer the mystery of Gerald Cotten, “Exit Scam” still rewrites the story we thought we knew.      “We thought we were looking for basically a rich guy who had stolen money,” says Lammer. “Now either [Cotten is] dead, or if he’s alive, he’s a gambling addict who’s broke.”",NEGATIVE,ETH,BTC | BUSINESS | ETH | EXCHANGE | FIAT,David Z. Morris,0,0,CoinDesk,https://coindesk.com/markets/2021/06/29/gerald-cotten-and-quadriga-unraveling-cryptos-biggest-mystery,https://cdn.sanity.io/images/s3y3vcno/production/857fdf702644a5180f5ece6ff5a28883bd6eef16-1500x888.png?w=300&h=300&fit=crop
13495164,https://seekingalpha.com/news/3711029-crypto-stocks-rally-as-bitcoin-pushes-further-above-35000?utm_source=cryptocompare.com&utm_medium=referral,1624981473,"Crypto stocks rally as Bitcoin pushes further above $35,000","peshkov/iStock via Getty Images Shares of crypto-linked stocks are on the move higher as Bitcoin (BTC-USD) +3.2% moves above $36K, back to around levels last seen in the middle of the month. Grayscale Bitcoin Trust (GBTC) +5.5%, Coinbase (COIN) +2.5%, Marathon Digital (MARA) +7.4%, MicroStrategy (MSTR) +8.2%, The Crypto Company (CRCW) +2.6% and Riot Blockchain (RIOT) +5.3% are all rallying. Bitcoin hit a six-month low last week. Today Deutsche Boerse revealed it will take a majority stake in Switzerland&apos;s Crypto Finance. Yesterday, Federal Reserve Vice Chairman Randal Quarles expressed skepticism about the need for a central bank digital currency, but sound more favorable toward stablecoins. He also likened Bitcoin to gold without its industrial uses and aesthetic attributes, with the chief attractions being novelty and anonymity. &apos;Gold will always glitter, but novelty, by definition, fades. Bitcoin and its ilk will, accordingly, almost certainly remain a risky and speculative investment rather than a revolutionary means of payment, and they are therefore",POSITIVE,BTC,BLOCKCHAIN | BTC | EXCHANGE | FIAT | TRADING,,0,0,Seeking Alpha,https://seekingalpha.com/news/3711029-crypto-stocks-rally-as-bitcoin-pushes-further-above-35000?utm_source=cryptocompare.com&utm_medium=referral,https://images.cryptocompare.com/news/default/seekingalpha.png
13384909,https://zycrypto.com/?p=53392,1624981272,Ripple’s Lead Lawyer Tells How Big The SEC Battle Is And Why Coinbase Shouldn’t Be Comfortable Listing Dogecoin Over XRP,"After spending a significant part of his professional legal career crawling up the legal ranks and later offering legal services for traditional financial institutions, Ripple&apos;s lead lawyer, Stuart Alderoty tells it all to Protocol, his exciting two years as a front line lawyer in the biggest legal battle rocking the crypto space. How Big Is ...",NEUTRAL,XRP,BLOCKCHAIN | DOGE | EXCHANGE | REGULATION | XRP,,0,0,ZyCrypto,https://zycrypto.com/ripples-lead-lawyer-tells-how-big-the-sec-battle-is-and-why-coinbase-shouldnt-be-comfortable-listing-dogecoin-over-xrp/,https://images.cryptocompare.com/news/default/zycrypto.png
42387206,0r6Zag11PPDEMKgUXBltuz,1624981117,Web3 Creators Have a New Platform for Minting Social Tokens,"Social token platform Coinvise has raised $2.5 million in a seed-funding round led by Galaxy Digital HK and IDEO CoLab Ventures.      ""The overarching goal of Coinvise,"" the firm wrote, ""is to utilize social tokens as a means to incentivize better coordination within communities and enable creators to monetize their work without giving ownership to centralized platforms.""      It's a vision in keeping with Web3's ""ownership economy"" thesis, where a platform's users also own it through a shared currency.      Coinvise joins other social token platforms such as Rally, Roll and Fyooz, but offers a suite of tools aimed at making it easy for creators to use their tokens for ""rewards, airdrops, crowdfunding, gated access and [non-fungible tokens],"" the firm wrote.    Read more: Social Token Platform Rally Raises $22M in RLY Sale on CoinList    The platform operates on both the Ethereum and Polygon networks.      Scalar Capital, A.Capital, DeFi Alliance, FreeCo, Global Coin Research, Perpetual Value, Morgan Beller and Block0 also joined the round. A laundry list of angel investors includes Jill Carlson, Jaynti Kanani, Alex Masmej and others.      ""Coinvise is unlocking tremendous value for communities by streamlining the process around minting and exchanging social tokens as well as NFTs."" said investor Volt Capital's Soona Amhaz. ""We're excited to work with CEO Jenil [Thakker] as he leads the way in building out the new creator economy.""",POSITIVE,없음,BUSINESS | ETH | MATIC | TRADING | RESEARCH,Jamie Crawley,0,0,CoinDesk,https://coindesk.com/markets/2021/06/29/web3-creators-have-a-new-platform-for-minting-social-tokens,https://cdn.sanity.io/images/s3y3vcno/production/1a3be87f4d3b55a980bb9ab7362adceca5968ee1-1500x1125.jpg?w=300&h=300&fit=crop
13429518,https://news.bitcoin.com/?p=470649&preview=true&preview_id=470649,1624980630,Coinbase Approved to Enter German Cryptocurrency Market,"Cryptocurrency exchange Coinbase has obtained approval from Germany&apos;s financial regulator, Bafin, to provide cryptocurrency trading and custody services. Coinbase Germany will launch in the coming weeks. Coinbase, a Nasdaq-listed company, announced Monday that it has secured a cryptocurrency license in Germany. The company explained: &apos;The German Federal Financial Supervisory Authority (Bafin) has awarded Coinbase Germany ...",POSITIVE,없음,EXCHANGE | MARKET | TRADING,,0,0,Bitcoin.com,https://news.bitcoin.com/coinbase-approved-to-enter-german-cryptocurrency-market/,https://images.cryptocompare.com/news/default/bitcoincom.png
13272564,https://ambcrypto.com/?p=167528,1624980618,"Bitcoin, Polkadot, MATIC Price Analysis: 29 June","The cryptocurrency market&apos;s price movement over the last few days, despite recoveries, has been quite repetitive. Owing to the same, most altcoins have been trying to break past their immediate resistance levels. Bitcoin, for example, hiked marginally by 0.7% over the last 24 hours. What&apos;s more, while quite a few altcoins registered buy-momentum on the ...",NEUTRAL,MATIC,BTC | DOT | MARKET | MATIC | TRADING,,0,0,AMB Crypto,https://ambcrypto.com/bitcoin-polkadot-matic-price-analysis-29-june/,https://images.cryptocompare.com/news/default/ambcrypto.png
13243617,https://nulltx.com/?p=101117,1624979926,CurrencyWorks Launches Clean-Energy Crypto Mining Platform,"Bitcoin remains the most valuable cryptocurrency in the world, but anyone paying attention knows that the high energy costs are becoming a serious problem in a world more and more concerned with climate change. Today&apos;s investors want to know where their Bitcoin was mined, when it was mined, and the coin&apos;s provenance, making clean-energy mining ...The post CurrencyWorks Launches Clean-Energy Crypto Mining Platform appeared first on NullTX.",POSITIVE,없음,BTC | BUSINESS | MINING,,0,0,NullTx,https://nulltx.com/currencyworks-launches-clean-energy-crypto-mining-platform/,https://images.cryptocompare.com/news/default/nulltx.png
13340628,https://cointelegraph.com/news/john-mcafee-s-suicide-reports-raise-disbelief-spark-conspiracy-theories,1624979640,"John McAfee’s suicide reports raise disbelief, spark conspiracy theories","John McAfee&apos;s candle may have burned out, but his legacy will live on. Tributes for the tech savant continue to flow in after his passing.",POSITIVE,없음,ICO,,0,0,CoinTelegraph,https://cointelegraph.com/news/john-mcafee-s-suicide-reports-raise-disbelief-spark-conspiracy-theories,https://images.cryptocompare.com/news/default/cointelegraph.png
13258459,https://dailyhodl.com/?p=151307,1624979413,Elon Musk Wants Crypto Enthusiasts To Support New Dogecoin Change Proposal,Tesla CEO and the world&apos;s second-richest person Elon Musk is backing a proposal that seeks to introduce a new fee structure and policy for Dogecoin (DOGE). The billionaire tells his 57.5 million Twitter followers that it is &apos;important to support&apos; the proposal put forth by core Dogecoin developer Patrick Lodder. The proposal titled &apos;Fee Policy ...The post Elon Musk Wants Crypto Enthusiasts To Support New Dogecoin Change Proposal appeared first on The Daily Hodl.,POSITIVE,DOGE,ALTCOIN | BTC | DOGE,,0,0,The Daily Hodl,https://dailyhodl.com/2021/06/29/elon-musk-wants-crypto-enthusiasts-to-support-new-dogecoin-change-proposal/,https://images.cryptocompare.com/news/default/dailyhodl.png
42387205,0r6Zag11PPDEMKgUXBlttj,1624979166,"A16z, Coinbase-Backed Startup Looks to Distribute Crypto to Everyone on Earth by Scanning Their Eyeballs: Report","Worldcoin, a startup founded by former Y Combinator head Sam Altman, wants to distribute crypto to everyone on the planet by scanning their eyeballs.    The company has designed an orb-shaped unit that can produce a unique personal identifier from an iris scan, Bloomberg reported Tuesday.  Altman, former president of startup accelerator Y Combinator, devised the concept in 2019 around experimentation on universal basic income and how money could be distributed to people in a way that circumvents the role of government.  ""I've been interested in things like universal basic income and what's going to happen to global wealth distribution and how we can do that better, is there a way we can use technology to do that at a global scale,"" Altman said to Bloomberg.  Aspirations of financial inclusion are nothing new in crypto, though the concept of scanning eyeballs may be seen as a controversial way of achieving it.  Worldcoin, whose backers include Andreessen Horowitz, Coinbase Ventures and LinkedIn founder Reid Hoffman, recently raised around $25 million from investors, Bloomberg said.  Read more: Anchorage Adds Custody for Celo’s Euro Stablecoin",NEUTRAL,없음,BUSINESS | EXCHANGE | FIAT | REGULATION | WLD,Jamie Crawley,0,0,CoinDesk,https://coindesk.com/markets/2021/06/29/a16z-coinbase-backed-startup-looks-to-distribute-crypto-to-everyone-on-earth-by-scanning-their-eyeballs-report,https://cdn.sanity.io/images/s3y3vcno/production/132d05dd6e7ac3319223bc9f01ba0feb99e81ce9-1024x683.jpg?w=300&h=300&fit=crop
13272565,https://ambcrypto.com/?p=167443,1624978852,Why Chainlink is currently presenting this curious case,"LINK is currently rallying, and it was trading at the $18 level, the price was up 6% in the past 24 hours. The altcoin has rallied from the beginning of 2021 until May 2021, based on the price chart. The price went from $11.87 on January 1 to a peak of $52 in May 2021. ...",POSITIVE,LINK,ALTCOIN | LINK | TRADING,,0,0,AMB Crypto,https://ambcrypto.com/why-chainlink-is-currently-presenting-this-curious-case/,https://images.cryptocompare.com/news/default/ambcrypto.png
13391024,https://decrypt.co/?p=74789,1624978676,Chinese Hydropower Plants Go On Sale Amid Bitcoin Mining Crackdown,"With China forcing crypto miners out of business, owners of small hydropower plants are offloading their hardware.",NEUTRAL,없음,ASIA | BTC | BUSINESS | MINING,,0,0,Decrypt,https://decrypt.co/74789/chinese-hydropower-plants-go-on-sale-amid-bitcoin-mining-crackdown,https://images.cryptocompare.com/news/default/decrypt.png
13413259,https://blockworks.co/?p=5191,1624977854,Inflated Expectations: The Economics of Everyday Life,Inflated Expectations is a new podcast that explores the macroeconomic drivers of growth and the potential for the crypto-revolutionization of monetary regimes.The post Inflated Expectations: The Economics of Everyday Life appeared first on Blockworks.,POSITIVE,없음,OTHER,,0,0,Blockworks,https://blockworks.co/inflated-expectations-the-economics-of-everyday-life/,https://images.cryptocompare.com/news/default/blockworks.png
13495165,https://seekingalpha.com/news/3711008-red-hot-race-to-the-first-bitcoin-etf-builds?utm_source=cryptocompare.com&utm_medium=referral,1624977829,Red hot race to the first Bitcoin ETF builds,"skodonnell/iStock Unreleased via Getty Images The race to the first bitcoin (BTC-USD) ETF has heated up with Cathie Wood&apos;s ARK Invest in partnership with 21 shares has thrown their name into the race. A physically-backed bitcoin ETF has yet to hit U.S. soil. However, countries such as Canada and Brazil have crypto-based exchange traded funds. As of yesterday, news that ARK Invest has submitted paperwork with the U.S. Securities and Exchange Commission for a bitcoin ETF will now place them among the twelve others who are all awaiting approval. Below is an outline of the thirteen issuers that have submitted a formal prospectus to the SEC for a physically-backed bitcoin exchange traded fund or traditional fund. While the United States does not have a traditional crypto-backed ETF, there are some ways investors can circumvent the regulators to gain some exposure to bitcoin and other crypto-assets inside an ETF wrapper. Grayscale Bitcoin Trust (GBTC), which",POSITIVE,BTC,BTC | BUSINESS | EXCHANGE | REGULATION,,0,0,Seeking Alpha,https://seekingalpha.com/news/3711008-red-hot-race-to-the-first-bitcoin-etf-builds?utm_source=cryptocompare.com&utm_medium=referral,https://images.cryptocompare.com/news/default/seekingalpha.png
13384910,https://zycrypto.com/?p=53391,1624977630,"CZ’s BNB Outlook Extremely Bullish, But Heightened Regulatory Scrutiny Puts Binance And Crypto Markets On The Hot Seat","Binance Group and its subsidiary in the UK were recently suspended from offering services that the Financial Conduct Authority (FCA), a regulatory watchdog of the UK, considered classified activities. Concerning the warning issued by the FCA to consumers, the official Twitter handle of Binance has said that its UK subsidiary Binance Markets Limited was a ...",NEGATIVE,BNB,EXCHANGE | ICO | MARKET | TRADING | BNB,,0,0,ZyCrypto,https://zycrypto.com/czs-bnb-outlook-extremely-bullish-but-heightened-regulatory-scrutiny-puts-binance-and-crypto-markets-on-the-hot-seat/,https://images.cryptocompare.com/news/default/zycrypto.png
13417431,https://coinpedia.org/?p=101555,1624977581,"Shiba Inu Price Jumps Again, Will A Zero Be Killed In SHIB Price?","The post Shiba Inu Price Jumps Again, Will A Zero Be Killed In SHIB Price? appeared first on Coinpedia - Fintech &amp; Cryptocurreny News Media| Crypto GuideThe bullish sentiment spiked up for Shiba Inu price since the early trading hours as the price jumped more than 17% at the press time. The SHIB price is currently testing the key resistance area and a successful surge may result in the resumption of the bull run soon. The price is constantly testing the …",POSITIVE,SHIB,SHIB | TRADING,,0,0,coinpedia,https://coinpedia.org/non-fungible-token-nft/shiba-inu-price-jumps-again/,https://images.cryptocompare.com/news/default/coinpedia.png
13471494,https://www.trustnodes.com/?p=38815,1624977493,Germany Opens Floodgates to Bitcoin Investing,As much as €350 billion can start entering the crypto market this Thursday after a law passed earlier this year comes into force in Germany. The new Fund Location Act...,POSITIVE,없음,BTC | MARKET | REGULATION,,0,0,TrustNodes,https://www.trustnodes.com/2021/06/29/germany-opens-floodgates-to-bitcoin-investing,https://images.cryptocompare.com/news/default/trustnodes.png
13404863,https://cryptopotato.com/?p=126428,1624977279,21Shares to Launch a Solana (SOL) ETP on SIX Exchange on June 30th,Institutional investors will be able to get SOL exposure on a regulated exchange courtesy of 21Shares ETP going live on June 30th.,POSITIVE,SOL,BUSINESS | EXCHANGE | SOL,,0,0,Crypto Potato,https://cryptopotato.com/21shares-to-launch-a-solana-sol-etp-on-six-exchange-on-june-30th/,https://images.cryptocompare.com/news/default/cryptopotato.png
13292993,https://cryptonews.com/news/arca-debunks-10-most-popular-crypto-bear-theses-10857.htm,1624977146,Arca Debunks 10 Most Popular Crypto Bear Theses,"The common digital assets bear market theses don&apos;t have &apos;a lot of substance&apos; and are &apos;most likely inaccurate,&apos; according to Jeff Dorman, the Chief Investment Officer (CIO) of US-based investment management firm Arca.While many seem convinced that we are now in a bear market, given the drop in prices, as well as in sentiment - &apos;here&apos;s the problem",POSITIVE,없음,MARKET | TRADING,,0,0,cryptonews,https://cryptonews.com/news/arca-debunks-10-most-popular-crypto-bear-theses-10857.htm,https://images.cryptocompare.com/news/cryptonews/8cw840882og.jpeg
13272566,https://ambcrypto.com/?p=167569,1624977052,"Why did Mexico remind financial institutions that they couldn’t trade Bitcoin, ETH, or XRP?","Following the restrictions put in place by China, the United Kingdom, and other nations on the use and operation of cryptocurrencies, Mexico has also clarified its stance. The financial authorities made it clear on Tuesday that cryptocurrencies cannot be used within the financial system. The country&apos;s central bank, Banco de México released a document with ...",NEGATIVE,ETH | XRP,ALTCOIN | ASIA | BTC | ETH | XRP,,0,0,AMB Crypto,https://ambcrypto.com/why-did-mexico-remind-financial-institutions-that-they-couldnt-trade-bitcoin-eth-or-xrp/,https://images.cryptocompare.com/news/default/ambcrypto.png
