뉴스ID,뉴스GUID,일자(UTC timestamp),뉴스제목,본문,SENTIMENT,주요코인,카테고리,작성자,추천수,비추천수,출처,뉴스URL,이미지URL
6711290,https://newsbtc.com/?p=514237,1672416029,"Most Public Crypto Firms Underperformed Bitcoin In 2022, Miners Hit Worst","Data shows almost all the big public crypto companies have underperformed Bitcoin this year, with the mining firms taking an especially hard hit. Most Public Mining Companies Saw Drawdowns Of 90% Or More In 2022 As per the year-end report from Arcane Research, 2022 was a very challenging year for public firms in the crypto sector. The below chart displays the drawdowns in the valuations of some of the big players in the market, as well as that of Bitcoin, during the last twelve months: The deep red performance of the public companies in the digital asset sector | Source: Arcane Research's 2022 - Year in Review As the graph shows, Bitcoin performed terribly this year, seeing negative returns of around 65%, but the large public crypto firms have done worse still. Even Microstrategy, the company whose stocks’ main attraction is exposure to BTC through its large reserves, couldn’t perform comparably to the asset and observed a deeper year-to-date drawdown of about 74%. The market cap of the popular crypto exchange Coinbase has gone down by 87% this year, which has led to the firm being valued lower than meme coin Dogecoin. The worst performer in the list seems to have been Core Scientific, recording a drawdown of 99%. Core Scientific is one of the biggest Bitcoin mining companies, but due to these large losses, the firm had to file for Chapter 11 bankruptcy earlier in the month. Similarly to Core, other BTC miners have also sustained major drawdowns this year, with most of them being 90% or more underwater for the period. But why did the mining firms perform especially poorly? The explanation behind that is multifold. Related Reading: Bitcoin Now Under Realized Price For 163 Days, Here’s How This Compares Historically “Similar to how crypto lenders were incentivized to prioritize short-term growth over long-term sound business decisions to attract private capital, public miners were incentivized to take on debt and rapidly expand its hashrate share to attract more capital,” the report explains. But three factors meant that this bet from these companies couldn’t pan out. First, the interest rates kept rising this year. Second, the bear market meant that the price of Bitcoin kept plunging, leading to the value of miners’ rewards also becoming lower. And finally, the third nail in the coffin was the rising energy prices, which resulted in very low or no profits for miners as they have to constantly pay electricity bills to keep their facilities running. All these factors lead to the public miners collapsing under the weight of their short-sighted decisions. Related Reading: Bitcoin Interexchange Flow Pulse About To Reverse, What Does It Mean? For 2023, Arcane Research’s prediction for these public crypto companies is that there will be new Chapter 11 bankruptcies filed in the year. BTC Price At the time of writing, Bitcoin is trading around $16,500, down 2% in the last week. Looks like BTC has gone downhill in recent days | Source: BTCUSD on TradingView Featured image from Becca on Unsplash.com, charts from TradingView.com, Arcane Research",NEGATIVE,BTC,BTC | MARKET | MINING | TRADING | RESEARCH,,0,0,NewsBTC,https://newsbtc.com/crypto/crypto-firms-bitcoin-2022-miners-hit-worst/,https://resources.cryptocompare.com/news/21/6711290.jpeg
6711361,https://cryptonews.com/news/today-in-crypto-ftx-owned-liquid-to-start-refunding-customers-in-february-the-bahamas-sec-holds-35m-of-ftx-assets.htm,1672416000,"Today in Crypto: FTX-owned Liquid to Start Refunding Customers in February, The Bahamas SEC Holds $3.5M of FTX Assets","Get your daily, bite-sized digest of cryptoasset and blockchain-related news – investigating the stories flying under the radar of today’s crypto news.__________... Read More: Today in Crypto: FTX-owned Liquid to Start Refunding Customers in February, The Bahamas SEC Holds $3.5M of FTX Assets",NEUTRAL,없음,ADA | ASIA | BTC | EXCHANGE | REGULATION,,0,0,cryptonews,https://cryptonews.com/news/today-in-crypto-ftx-owned-liquid-to-start-refunding-customers-in-february-the-bahamas-sec-holds-35m-of-ftx-assets.htm,https://resources.cryptocompare.com/news/52/6711361.jpeg
6711313,https://decrypt.co/?p=118174,1672415810,Dogecoin Plummets 13% Amid Rumors of Ethereum-Like Merge,"The volatile meme coin is shedding value as 2022 comes to a close, amid chatter over a potential proof-of-stake transition ahead.",NEGATIVE,없음,DOGE,,0,0,Decrypt,https://decrypt.co/118174/dogecoin-plummets-amid-rumors-ethereum-like-merge,https://resources.cryptocompare.com/news/44/6711313.jpeg
42388298,1WhGe7o17bdD4QO5qRDN6b,1672414940,Italian Parliament Approves 26% Crypto-Gains Tax in 2023 Budget,"Crypto traders in Italy will be subject to a 26% capital-gains tax starting in 2023, according to a new budget that won parliamentary approval on Thursday.  Italian Prime Minister Giorgia Meloni's 2023 expansionary budget – which was completed in a rush before the end of the year – features 21 billion euros ($22.3 billion) in tax breaks to assist businesses and households facing the energy crisis, Reuters reported.  In Italy, where crypto remains largely unregulated, the 387-page budget legitimizes crypto assets by defining them as ""a digital representation of value or rights, which can be transferred and stored electronically, using the technology of distributed ledger or similar technology.""  Italy's (and most recently Portugal's) move to introduce a capital-gains tax on crypto comes ahead of the implementation of the European Union's Markets in Crypto Assets (MiCA) regulation that promises a licensing frameworks and stringent operating requirements for crypto-service providers in the 27-member bloc.  The 26% rate applies to gains from crypto trading if they exceed 2,000 euros per tax period. As an incentive for declaring crypto profits, the new bill also sets a ""substitute income tax"" for investors at 14% of the value of the assets held as of Jan. 1, 2023, instead of the cost at the time of purchase.  According to the new rules, losses from crypto investments can be deducted from profits and be carried forward.  Investors, however, may require some additional guidance on what qualifies as a taxable event as the document also says, ""the exchange between crypto assets having same characteristics and functions,"" doesn't constitute a ""fiscal case.""  Read more: Italy Hasn't Vetted the 73 Crypto Firms It Approved This Year",NEUTRAL,없음,BUSINESS | EXCHANGE | MARKET | REGULATION | TECHNOLOGY,Sandali Handagama,0,0,CoinDesk,https://coindesk.com/policy/2022/12/30/italian-parliament-approves-26-crypto-gains-tax-under-2023-budget,https://cdn.sanity.io/images/s3y3vcno/production/29230e81917b49e24abaf4a0e823e6785766f40d-5568x3712.jpg?w=300&h=300&fit=crop
6710394,https://coinedition.com/?p=237773,1672414800,Crypto Analyst Says There is No SBF to Bid Up Solana With Stolen Funds,"Meme coin minimalist Evan Van Ness recently released a slew of tweets about Solana. Ness was speaking about the downfall of SOL after the fall of the FTX exchange. He stressed the fact that if users think that bidding SOL is a value bet, then they are just exiting liquidity for the multicoin LPs. Ness The post Crypto Analyst Says There is No SBF to Bid Up Solana With Stolen Funds appeared first on Coin Edition .",NEUTRAL,SOL,EXCHANGE | SOL,,0,0,Coin Edition,https://coinedition.com/crypto-analyst-says-there-is-no-sbf-to-bid-up-solana-with-stolen-funds/,https://resources.cryptocompare.com/news/7/default.png
6710148,https://finbold.com/?p=95105,1672414486,Bitcoin-themed pub opens in New York City,With the cryptocurrency industry slowly but surely creeping into every pore of modern society and crypto themes becoming increasingly more … Continued The post Bitcoin-themed pub opens in New York City appeared first on Finbold .,NEUTRAL,없음,BTC,,0,0,Finbold,https://finbold.com/bitcoin-themed-pub-opens-in-new-york-city/,https://images.cryptocompare.com/news/default/finbold.png
6709915,https://ambcrypto.com/?p=280855,1672414235,Solana: Vitalik champions calls for SOL’s bright future but is it enough,"Ethereum co-founder Vitalik Buterin said he believed that Solana’s future was bright. SOL continued to plummet as Solana’s founder received praises for his doggedness. The Solana [SOL] community has been subject to tantrums in recent times, as a large section of the ecosystem publicly opined that the once lively chain was now beyond redemption. Off",NEUTRAL,SOL,ALTCOIN | ETH | SOL,,0,0,AMB Crypto,https://ambcrypto.com/solana-vitalik-champions-calls-for-sols-bright-future-but-is-it-enough/,https://images.cryptocompare.com/news/default/ambcrypto.png
42421411,ha93388BwWkPe8xtcXo3UD,1672414230,The Impact of Avraham Eisenberg’s Case on the Future of Crypto,"On Tuesday, federal authorities announced the arrest of Avraham Eisenberg, a crypto trader who conducted what he characterized as a “highly profitable trading strategy” that drained $110 million from Mango Markets, a decentralized crypto exchange. While the complaint details Eisenberg’s activities, none of it will come as a surprise given that the entire operation publicly played out on the blockchain (and in real-time on Twitter). Days after the action, Eisenberg even tweeted he was responsible and would be returning a large portion of the funds.  While Eisenberg’s arrest is likely to raise questions around the application of commodities manipulation and fraud laws to crypto, the more important issue raised by this case involves the work of individuals to uncover weaknesses in decentralized protocols, and the impact and utility of these operations for the future of crypto.  Gareth Rhodes, a managing director at Pacific Street, formerly served as deputy superintendent and special counsel at the NYS Department of Financial Services.  Mango Markets is a crypto trading platform where users can buy, sell, lend and borrow crypto tokens. While Coinbase and Binance are centralized and operate like exchanges in traditional finance, Mango and other decentralized finance (DeFi) exchanges such as Uniswap and Aave are fully decentralized. All transactions are conducted on the blockchain, transparent to all. Rules regarding margin requirements, liquidation triggers and the setting of token prices are established by code that is posted on GitHub, and the marketplace operates without human intervention or oversight.  Mango used oracles to set the price of tokens on its exchange (which monitors the average price the same token is listed for on other exchanges) and allows a user to borrow crypto tokens worth approximately 90% of their collateral. Eisenberg took advantage of these features by accumulating a large amount of Mango’s own token, MNGO, then spending millions of dollars in illiquid markets to drive up that token's price more than 1,300%. He then borrowed $110 million in USDC stablecoins against his temporarily inflated MNGO collateral. Over the course of a few hours, MNGO’s price surged, then collapsed and Eisenberg had $110 million in cash, while Mango’s code-driven liquidation engine automatically sold the MNGO tokens for a far smaller value than what Eisenberg “borrowed.”  Eisenberg’s operation was not exactly a surprise, as the risks of such attacks on decentralized collateralized lending are well known and Eisenberg did not invent this strategy. Sam Bankman-Fried, the ex-CEO of FTX, even tweeted his own prescient observations of the danger of using an illiquid token such as MNGO as collateral. Weeks later, the SEC cited these tweets as evidence that SBF “knew, or was reckless in not knowing, that by not mitigating for the impact of large and illiquid tokens posted as collateral by Alameda, FTX was engaging in precisely the same conduct, and creating the same risk, that he was warning against” with Mango.  Eisenberg’s actions were only possible because of DeFi’s foundational principle: code is law. This means computer code, not human beings, must be the decision makers. The Mango community watched Eisenberg’s operation in real time and could do little to stop it. Eisenberg tweeted he was simply “using the protocol as designed, even if the development team did not fully anticipate all the consequences of setting parameters the way they are.”  Eisenberg is far from the only person who has spent countless hours reviewing a crypto protocol’s code and structure and attempting to attack its weaknesses. These individuals, depending on their perceived and stated intentions, are often met with derision for exploiting these flaws for illicit gain and celebration for pointing out shortcomings that can be fixed and improve protocol resilience. And while no user wants to lose money, if you are a crypto entity seeking to test the resilience of your protocol, your best option is probably to hope an enterprising hacker will take a deep look and attempt an exploit and return the money. Most prominent audit firms decline to work with crypto clients and while some have suggested government regulation will fix these issues, the SEC examined Bernie Madoff’s firm five times without uncovering the fraudulent scheme.  See also: In Praise of White-Hat Hackers, but Overreliance Is Foolish | Opinion  Many observers, and perhaps a jury, will say Eisenberg is a criminal and thief. And the fact pattern – all visible on the blockchain, detailed by Eisenberg’s own self-congratulatory tweets and described in SDNY’s criminal complaint – indicates he did indeed violate the letter of the law that prohibits market manipulation. However, it’s easy to imagine a scenario where without Eisenberg’s operation, the Mango protocol grows much larger and attracts more retail users, and it is North Korea, not Eisenberg, that exploits the protocol to drain user funds to pay for nuclear weapon development, not just a “highly profitable trading strategy.” In fact, as a result of Eisenberg’s successful Mango operation, other decentralized trading platforms implemented new risk mitigation measures, and when Eisenberg went after Aave a few weeks later, he failed.  What’s clear is that the crypto ecosystem will continue to rely on the ability of enterprising blockchain sleuths to find weaknesses in the system. What’s not clear is what framework makes sense to properly incentivize the time and skill required for such activity and protect user funds from being taken. ImmuneFi has a promising model of offering a bounty to hackers who pledge not to take user funds, similar to how the False Claims Act and various whistleblower statutes incentivize individuals to find wrongdoing in return for financial reward.  See also: Calling a Hack an Exploit Minimizes Human Error | Opinion  But it can be hard for a hacker to know a protocol weakness is real without an attempted exploit, and there is no indication these so-called “white-hat hackers” are immune from market manipulation laws, which they may violate even if user funds are fully returned.  Some critics may use Eisenberg’s arrest as the latest example of why crypto is little more than a speculative arena full of scammers. While such arguments may find receptive audiences in developed nations with robust traditional financial systems, look no further than how crypto is being used in everyday life by millions in Brazil, Turkey and Mexico, where residents face political stability, major currency devaluation and decimation of savings on a yearly basis. Or to crypto’s rapid expansion in the Middle East, where authoritarian regimes use the banking system to enforce social control.  Decentralized finance is poised to play an increasingly important role in the crypto ecosystem after the high profile failures of centralized entities and FTX and Celsius. Until a better model is found to pressure test these decentralized protocols, operations such as the one conducted by Eisenberg with Mango will remain a painful part of the journey to making the industry more resilient.  CORRECTION (JAN. 12, 2023 – 23:00 UTC): An earlier version of the subhead misstated the regulatory agency Gareth Rhodes previously worked for – he is a former counsel for the NYDFS, not the CFTC.",NEUTRAL,없음,BLOCKCHAIN | EXCHANGE | MARKET | REGULATION | TRADING,Gareth Rhodes,0,0,CoinDesk,https://coindesk.com/opinion/2022/12/30/the-impact-of-avraham-eisenbergs-case-on-the-future-of-crypto,https://cdn.sanity.io/images/s3y3vcno/production/b4d8026a87f34d5dcfe3733dc61fd09860210e40-1440x1080.jpg?w=300&h=300&fit=crop
6709914,https://dailyhodl.com/?p=230413,1672414221,Solana and Associated Tokens Down Over 96% From All-Time Highs As SOL Gets Delisted From Crypto Exchange,"Smart contract platform Solana (SOL) and other digital assets associated with it continue to freefall as a crypto exchange platform announces it’s going to delist them. According to crypto reporter Colin Wu, crypto exchange Matrixport will delist SOL and its accompanying digital assets starting December 30th, a move that sent the already-ailing cryptocurrencies on another The post Solana and Associated Tokens Down Over 96% From All-Time Highs As SOL Gets Delisted From Crypto Exchange appeared first on The Daily Hodl .",NEGATIVE,SOL,BTC | EXCHANGE | ICO | SOL | RAY,,0,0,The Daily Hodl,https://dailyhodl.com/2022/12/30/solana-and-associated-tokens-down-over-96-from-all-time-highs-as-sol-gets-delisted-from-crypto-exchange/,https://images.cryptocompare.com/news/default/dailyhodl.png
6709776,https://cointelegraph.com/news/3-reasons-why-bitcoin-is-likely-heading-below-16-000,1672413900,"3 reasons why Bitcoin is likely heading below $16,000","Reasons for bearishness include U.S. Federal Reserve tightening, the absence of leverage buyers’ demand, and fearful BTC options traders.",NEGATIVE,BTC,BTC | FIAT | MARKET,,0,0,CoinTelegraph,https://cointelegraph.com/news/3-reasons-why-bitcoin-is-likely-heading-below-16-000,https://resources.cryptocompare.com/news/16/6709776.jpeg
6709640,https://cryptopotato.com/?p=230955,1672413887,"Crypto Price Analysis Dec-30: ETH, XRP, ADA, MATIC and SOL","This week, we take a closer look at Ethereum, Ripple, Cardano, Polygon, and Solana Ethereum (ETH) Another week has passed with little excitement for Ethereum investors as volatility was low – likely due to the Christmas holidays. However, ETH’s price did fall by 2% in the past seven days. This is a negligible move in",NEUTRAL,ADA | ETH | MATIC | SOL,ADA | ETH | MATIC | SOL | TRADING,,0,0,Crypto Potato,https://cryptopotato.com/crypto-price-analysis-dec-30-eth-xrp-ada-matic-and-sol/,https://resources.cryptocompare.com/news/27/6709640.jpeg
6709297,https://thecoinrise.com/?p=56518,1672413371,Bahamas Regulator Froze $3.5B to Refund Affected FTX Users,"The Securities Commission of the Bahamas has announced plans to deliver FTX's frozen $3.5B to the customers who are the rightful owners The post Bahamas Regulator Froze $3.5B to Refund Affected FTX Users appeared first on Blockchain, Crypto and Stock News .",NEUTRAL,없음,BLOCKCHAIN | BUSINESS | REGULATION,,0,0,The Coin Rise,https://thecoinrise.com/bahamas-regulator-froze-3-5b-to-refund-affected-ftx-users/,https://images.cryptocompare.com/news/default/thecoinrise.png
6709227,https://coinedition.com/?p=237909,1672413300,Bitcoin Mining Revenue Towards Pre-Halving Levels: Tweets Pierre,"Pierre Rochard, the Bitcoin Strategist at the US-based cryptocurrency exchange Kraken recently tweeted that the bitcoin mining revenue of December has been back to the pre-halving level. In his tweet, he shared a graph representing the average daily bitcoin mining revenue from 2016 to 2022. Notably, it is clear from the graph that from 2016 The post Bitcoin Mining Revenue Towards Pre-Halving Levels: Tweets Pierre appeared first on Coin Edition .",NEUTRAL,없음,BTC | BUSINESS | EXCHANGE | MINING,,0,0,Coin Edition,https://coinedition.com/bitcoin-mining-revenue-towards-pre-halving-levels-tweets-pierre/,https://resources.cryptocompare.com/news/7/default.png
6708958,https://thecoinrise.com/?p=56514,1672412918,Global Crypto Funding Decline Gradually in Q3 – Report,"The funding rate in the global crypto ecosystem dropped gradually all through the year amid the harsh pangs of the crypto winter The post Global Crypto Funding Decline Gradually in Q3 – Report appeared first on Blockchain, Crypto and Stock News .",NEGATIVE,없음,BLOCKCHAIN | BUSINESS,,0,0,The Coin Rise,https://thecoinrise.com/global-crypto-funding-decline-gradually-in-q3-report/,https://images.cryptocompare.com/news/default/thecoinrise.png
42388285,1WhGe7o17bdD4QO5qRDM7n,1672412528,Defrost Finance Denies Rug Pull Allegations Amid $12M Exploit,"The team behind Defrost Finance, an Avalanche blockchain-based decentralized-finance (DeFi) platform, has pushed back on claims that it ""rug pulled"" the project after $12 million was siphoned out of the smart contract last week.  Blockchain security company DeFiYieldSec this week alleged that the apparent exploit was an inside job, most recently saying that the creator of Defrost Finance’s multi-sig wallet was the same address that requested the oracle to be replaced before the exploit occurred. Defrost Finance denied those claims, labeling them as “slanderous and inaccurate.”  The first of two attacks targeted the V2 contract with a ""flash-loan re-entrancy"" exploit, a Defrost Finance spokesperson told CoinDesk.  The far-larger second attack occurred on Christmas Eve, the spokesperson continued, with another hacker or hackers “[managing] to appropriate the private key and used it to add a fake collateral token and price oracle, then minted 100 million H20 tokens … The hacker then liquidated the existing vaults by manipulating the vaults’ oracles and draining funds.”  Exploits involving price oracles have become more prevalent this year, with an oracle tied to Mango Markets being manipulated in October by crypto investor Avraham Eisenberg, who was arrested in Puerto Rico for the attack last week.  The Mango Markets exploit resulted in a $114 million loss, although Eisenberg returned $67 million shortly after the attack occurred.  In its case, Defrost Finance claims it retrieved all of the funds on Monday after offering a bounty to the hacker.  The Defrost Finance team, the group also behind failed DeFi protocol Phoenix Finance, said it is “very optimistic” all the users who lost tokens will be reimbursed.",NEUTRAL,없음,BLOCKCHAIN | BUSINESS | MARKET | TRADING,Oliver Knight,0,0,CoinDesk,https://coindesk.com/business/2022/12/30/defrost-finance-denies-rug-pull-allegations-amid-12m-exploit,https://cdn.sanity.io/images/s3y3vcno/production/cd1ab2032e03e52b35def7bb380e8e4d3c776d2e-1440x1080.jpg?w=300&h=300&fit=crop
6708610,https://bitcoinist.com/?p=211432,1672412445,Ethereum DeFi Suffered 76% Decline In Total Value Locked This Year,"Data shows the bear market has also hit Ethereum decentralized finance (DeFi) hard, as the total value locked in the sector has declined by 76%. Total Value Locked In Ethereum DeFi Now Only Around $23.1 Billion Decentralized Finance (or DeFi as it’s most commonly known) includes all types of financial services that are done on",NEGATIVE,없음,ETH | MARKET | TRADING,,0,0,Bitcoinist,https://bitcoinist.com/ethereum-defi-suffered-decline-total-value-locked/,https://resources.cryptocompare.com/news/13/6708610.jpeg
6708678,https://cointelegraph.com/news/bitcoin-not-undervalued-yet-says-research-as-btc-price-drifts-nearer-16k,1672412313,"Bitcoin ‘not undervalued yet,’ says research as BTC price drifts nearer to $16K","An indicator tracking transactions in profit and loss has yet to repeat its traditional bear market bottom sequence, says CryptoQuant.",NEUTRAL,BTC,BTC | BUSINESS | MARKET | TRADING | RESEARCH,,0,0,CoinTelegraph,https://cointelegraph.com/news/bitcoin-not-undervalued-yet-says-research-as-btc-price-drifts-nearer-16k,https://resources.cryptocompare.com/news/16/6708678.jpeg
42388283,1WhGe7o17bdD4QO5qRDLyR,1672412312,FTX Japan to Allow Customers to Withdraw Funds Starting in February,"FTX Japan customers will be able to withdraw their funds as of mid-February, the subsidiary of FTX Trading said in a blog post on Thursday, making them some of the first customers of the collapsed crypto exchange to get their money back.  FTX Japan said it was previously able to confirm with the company's bankruptcy lawyers in the U.S. that Japanese customers' funds ""should not be part of FTX Japan’s estate given how these assets are held and property interests under Japanese law.""  In mid-January, FTX Japan customers will first be directed to set up an account with Liquid Japan, a local crypto exchange purchased by FTX earlier this year. Then, after customers check their balances, withdrawals will be made available as of mid-February, according to the post.  The company said the timeline could change, however, “depending on the progress of the external security audit.”  Withdrawals from FTX Japan were halted on Nov. 8 after local financial regulators ordered the exchange to suspend services. Sam Bankman-Fried's global enterprise, FTX Trading Ltd., filed for Chapter 11 bankruptcy protection in the U.S. three days later.  Read more: FTX Japan Plans to Restart Local Customer Withdrawals",POSITIVE,없음,ASIA | BUSINESS | EXCHANGE | TRADING,Nelson Wang,0,0,CoinDesk,https://coindesk.com/business/2022/12/30/ftx-japan-to-allow-customers-to-withdraw-funds-starting-in-mid-february,https://cdn.sanity.io/images/s3y3vcno/production/112a96d6c084eb862694649d48e80c1621c86a8a-1440x1080.jpg?w=300&h=300&fit=crop
