뉴스ID,뉴스GUID,일자(UTC timestamp),뉴스제목,본문,SENTIMENT,주요코인,카테고리,작성자,추천수,비추천수,출처,뉴스URL,이미지URL
42377836,0r6Zag11PPDEMKgUX73izD,1416688912,Boost VC Goes 'Full Bitcoin' For Next Startup Mentor Round,"Boost VC, the startup accelerator and immersive mentorship program co-founded by Adam Draper, will accept only bitcoin companies for its next round, known as 'Tribe 5'.  Boost VC  will include 20-30 bitcoin companies for its next three-month entrepreneurship course starting early 2015. The startups enrolled live in shared housing while they work on growing their companies and meet regularly with key Silicon Valley figures and investors.  According to a message posted on Medium, Boost VC is looking for startups working in the fields of ""payments, exchanges, blockchain technology, sidechains, and companies that service bitcoin companies"".  The issue of trust  Boost VC has always been a 'bitcoin-friendly' accelerator, so the move will not come as a complete shock. Draper had previously vowed to use the program, which he founded in late 2012, to fund 100 bitcoin startups by 2017.  It has also mentored and funded bitcoin services companies like Gliph, Vaurum (now known as Mirror), snapCard and BitPagos. Following the tech industry standard, it invests and takes a small stake in every company it mentors.  Speaking to CoinDesk, Draper said Boost VC's criteria for inclusion were ""hard working entrepreneurs, scrappy (as in committed), and people who are enjoyable to be around"".  For bitcoin to penetrate the masses and find broad appeal, he added, trust is the issue.  ""I think that we need people to understand that it isn't only a toy, that bitcoin is a powerful tool that can help update the current financial system. And all the companies in the space are doing just that.""  No one thing will spark that breakthrough, Draper, said, instead it will be about continuing the momentum that has been started for the technology – which is something Boost seeks to do.  Boost VC's previous program, Tribe 4, wrapped up last month and featured mostly bitcoin-focused companies. The accelerator had received over 700 applications from startups, accepting fewer than 4% to participate.  Bitcoin is just the first step, the company said. Referring to the gap between the 'visionary' and 'pragmatic' stages of a market, it said Boost VC hopes to be able to breach other 'before-the-chasm' industries.  Aims in the space  Boost VC gave three reasons for its decision to focus solely on bitcoin for its next incubator round.  Firstly, 'hyperfocus' – wanting to become the leader of this industry, with the best network, and with the ability to add tremendous value to anyone in the space.  Secondly, 'playing to strengths' – a referral to the success of past participants. On average, a Boost company will have raised over $500,000 in investment, and participating investors were all early bitcoin movers.  Finally, Boost VC says it genuinely loves the bitcoin community and has received significant encouragement from members. Focusing on bitcoin is a way to return some of this respect.  Opportunity to grow  Tina Hui, CEO and founder of bitcoin video news service Follow the Coin, which was a selected participant in Tribe 4, said Boost VC's mentorship and investment motivated her company to focus and grow.  ""Starting any business is difficult, especially in bitcoin. FinTech is global and there are a lot of moving pieces to pay close attention to, from currency rates, the ever-changing competitive complexity of the space and emerging regulatory requirements.""  Joining a startup accelerator with dedicated supportive mentors and 'tribe mates' that become family, she said, makes a difference to how participants develop as teams and individuals.  She also noted that, including herself, Tribe 4 featured two female bitcoin company founders – the other being Catheryne Nicholson of BlockCypher, a cloud-optimized blockchain services platform for web developers.  Startups looking to apply for Boost VC's next round can complete an application form here.",POSITIVE,없음,BLOCKCHAIN | BTC | BUSINESS | SPONSORED | TECHNOLOGY,Jon Southurst,0,0,CoinDesk,https://coindesk.com/markets/2014/11/22/boost-vc-goes-full-bitcoin-for-next-startup-mentor-round,https://cdn.sanity.io/images/s3y3vcno/production/9eae711c98ef77e7e0c12b8fdd4e0e7113051e58-1455x556.png?w=300&h=300&fit=crop
42377843,0r6Zag11PPDEMKgUX73j6l,1416684553,Could Bitcoin Tipping Replace Traditional Online Advertising?,"Online advertising has exploded into a $40bn industry, and unfortunately for many Internet users, this increase has come with the cost of often-annoying user experiences.  To be fair, online advertising has been a boon for the Internet and for content creators. The idea of a digital canvas for advertisers to reach consumers on was enticing in the 1990s at the dawn of the web, and it has enabled many media outlets to weather the transition from print to digital.  Given the size of the industry and many consumers' distaste for invasive display ads, a number of entrepreneurs have started to look for ways to supplement or maybe even supersede revenues from traditional online advertising models using the power of bitcoin.  Still, they face a steep challenge. There is a compelling reason why most online media and content generators use display ads – they are arguably the best vehicle for monetization out there today.  This might not always be the only option going forward, though. Digital currencies have the potential to become a transaction method for the Internet due to their low fees and quick transaction times, and established bitcoin companies like Coinbase and Xapo are seeking to usher in this new future.  Exploring a new frontier  One of the earliest proponents of replacing traditional online advertising with bitcoin is William Waldon, the owner of astronomy-focused website Space Industry News.  Waldon removed all the display ads from his site in March, leaving his visitors with just one option for supporting the website: bitcoin donations.  The site has had a remarkably clean look as a result – and Waldon thinks his audience is the perfect group to experiment with for trying new things like bitcoin tipping to generate revenue.“My audience is smart and tech-savvy,” he said.  He hopes replacing his ads with bitcoin tipping could be viable in the long-term, by providing the right message to the consumers of his content. ""I believe that in the short term I'll be taking a hit, until the message is made clear.""  Waldon is fine with that, as long as he can influence others by setting a good example:  ""I mean, who wants to watch a 30-second video ad while they're trying to read an article? The first time I saw one of those on another website I promised myself that I would never be that kind of content provider.""  Waldon said he has generated around $100-worth of bitcoin each month since he started his effort back in March – enough to pay for site hosting.  It's an experiment for Waldon, a way to set an example for a future where tipping could become normal practice. ""If you really want to change the world, I mean really make people think, you have to get rid of the distractions and focus on the most important part, the content,"" he said.  The rise of a tipping economy  The practice of sending bitcoin tips to show support for content providers like Space Industry News has been gaining momentum in the cryptocurrency community, especially in the past few weeks.    One company, ChangeTip, works specifically with bitcoin in its strategy to bring online tipping to the mainstream as an alternative to traditional advertising models and revenue streams.  ChangeTip currently enables bitcoin tipping directly on social media sites like Twitter, Reddit, GitHub, Google+, Tumblr and StockTwits.  One interesting feature with ChangeTip is that the company has built 'monikers' into its platform. This means users can edit their settings and fix a keyword to specified amount of money.  For example, a 'coffee' could be set as $1.50 in bitcoin, and a 'beer' as $3.50. People can send any of these monikers to others in the form of a tip.  Nick Sullivan, CEO of ChangeTip, told CoinDesk this could open up a totally new field of online marketing with bitcoin tipping:  “We think that has some potential brand or advertising applications. For example, Starbucks buys the 'Starbucks' moniker from us, and then we create an advertising package around that to help them come together with a viral marketing campaign.”  ChangeTip launched earlier this year, and Sullivan said the company is already seeing growth.  A key draw for companies like ChangeTip and its dogecoin-focused counterpart Dogetipbot is that they have the potential to appeal to users outside of the cryptocurrency community.  Sullivan said that he and Dogetipbot founder Josh Mohland recognize this, and that they're working together to tackle one of the major issues plaguing digital currencies – mainstream acceptance.  Sullivan said:  “The ocean is so huge with what needs to be done –the common enemy we’re both fighting is the mass adoption of digital currencies.”  More trials needed  Though promising, this part of the bitcoin ecosystem is still growing, and questions remain that need to be addressed.  For example, businesses that embrace tipping may have an advantage over higher-volume sectors in the bitcoin industry because they're not as adversely affected by bitcoin's price volatility, Sullivan said.  “Price affects our business less than most, because people aren’t speculating and holding lots of money in their ChangeTip wallet. [Users are] using it to tip,” said Sullivan.  Despite this, perception about bitcoin's price volatility is still widespread and may ultimately prevent some from embracing bitcoin tipping.  Waldon, the Space Industry News proprietor, has a sense that digital currencies are something that other websites will end up embracing as a replacement for display ads, but he suggested that this habit needs to take hold on more social media outlets.  On this end, ChangeTip recently added a new feature to its Google Chrome extension embeds a tipping button directly into Twitter's web browser so that sending a tip is as easy as retweeting or favoriting someone's tweet.  For now, however, Space Industry News still serves as an early example of a publisher adopting a hybrid revenue model that may become more prevalent in the future, and Waldon is pleased with the position.  ""I'm feeling a paradigm shift coming and I want to be at the forefront of that,"" he added.  Disclaimer: The views expressed in this article are those of the author and do not necessarily represent the views of, and should not be attributed to, CoinDesk.  Note: Space Industry News had temporarily implemented display advertising on 22nd November, citing issues with its code. The ads have since been removed and replaced with bitcoin tipping buttons.  Image via CoinDesk",NEUTRAL,없음,BTC | BUSINESS | TRADING,Daniel Cawrey,0,0,CoinDesk,https://coindesk.com/markets/2014/11/22/could-bitcoin-tipping-replace-traditional-online-advertising,https://cdn.sanity.io/images/s3y3vcno/production/376a80497e25ea403e56cad05f31f38c598096fb-1500x675.jpg?w=300&h=300&fit=crop
42377834,0r6Zag11PPDEMKgUX73irf,1416675287,"For Bitcoin, It's the Tech – Not the Talk – That Really Matters","To some, the idea of money that's free of governments and banks is extremely appealing.  The money system causes the wealth gap, they say. It’s the reason both the state and the financial sectors have both grown to such disproportionate size.  Use a different money, and the government and banks’ monopoly is destroyed. Their power is reduced. They can’t perpetrate many of the abuses that go on – whether it’s inflation, forex- or libor-rigging, bailouts or even wars.  The same memes were behind the huge bull market in gold that went from 2001 to 2011. Goldbugs (and I’m one) were all saying the same thing. Buy gold, protect yourself from the debasement of currency, it’s nobody else’s liability – all that kind of stuff.  But that bull market ended. Gold is now down 40%, silver by almost 70% and we’re no closer politically to a hard money system than we were in 2001.  Anti-government or anti-banking rhetoric is seductive, but only if you’re of a libertarian or anarchic bent. Not everyone is.  I’m convinced that the great revolution so many are clamouring for can only happen through money reform. But the talk will not make that happen.  The tech could, however.  If Steve Jobs had said he was going to destroy the music business, would you have rushed out to buy an iPod?  If Steve Jobs or Jeff Bezos had promoted their businesses on the basis of all the upheaval they were going to cause to music and publishing, many people might not have been quite so persuaded.  'I quite like vinyl, I like CDs, I like albums. I like my daily paper. I like the chap who writes that column. I like my local bookshop.' There would have been more resistance than we saw in reality.  Instead, Jobs, Bezos and the many others like them focused on the consumer. They gave the consumer better and better products. The consumer did not buy in for political reasons, but because it suited him. The tech was irresistible.  IPods were a new and better way to listen to music, iTunes a better place to store it. Amazon is a great place to buy stuff. The Kindle is a fantastic way to read books. Websites and blogs are better places to consume news. YouTube and Netflix are better ways to watch videos. And so on.  Bitcoin needs to do the same.  In the 80,000 words that Satoshi Nakamoto wrote online, he made about three vaguely political statements. His only focus was on getting the tech working, and the reason bitcoin has been so successful is that the tech actually does work. Now the bitcoin community needs to remember his example.  Focus on the tangible benefits  I may love the fact that bitcoin is apolitical and I loathe the fact that fiat money is a political tool. But there are lots of people – the vast majority in fact – who either don’t agree or don’t care. The reason they’ll start using bitcoin is because it suits them.  'Hey, this money isn’t losing value – it’s actually going up. I don’t get hit by forex charges. Remittances are cheaper and quicker. Lower fees means goods are priced lower in bitcoins. Sending or receiving money is so much less hassle' – all those kinds of reasons.  Earlier in the year, Goldman Sachs IT analyst Roman Leal made some rough calculations as to the savings that bitcoin could have made possible globally in electronic payment in 2013. His findings demonstrate what could make the tech go mainstream – more than any amount of political rhetoric.  There were $49bn of transaction fees globally in 2013 on about $550bn of remittances. Using bitcoin (at an estimated 1% annual fee – which could be a lot less) those fees would have fallen by over 90% to just $5.5bn.  As for electronic payments in retail, currently retailers pay about 2.5% to 3% in transaction fees. In 2013, global transaction fees at retail point of sale were $260bn on over $10tn of sales. Had bitcoin been used (again using a 1% estimated fee) the number would be $104bn – a saving of almost $150bn. Leal notes that all merchants would realize ""sizable savings"" by using bitcoin, but small merchants will benefit most: they have the potential to reduce their payment processing fees by at least half.  Then there is its potential to get the world’s poorest 3.5 billion, who are currently shut out by the financial system, into e-commerce just as the cell phone got them communicating in a way they couldn’t with landlines.  The potential is enormous. But at present the growth of the bitcoin network is stagnant, it might even have slipped into the negative. Transactions are growing, but not compellingly. This is what needs to change.  Why Bitcoin should think like a tech stock  At the weekend David Cameron declared that the warning lights are flashing on the global economy. Japan has slipped back into negative growth territory. Germany’s growth has stalled, Britain’s has slowed.  Growth rates in the developed world have been falling since the 1970s. There's a mixture of reasons for this. Aging populations and workforces, too many asset bubbles leading to busts, excess taxation and regulation costs, an ever-increasing cost of government, high house prices leaving little capital to spend elsewhere, the colossal burden of global debt load above the $100tn-mark and many more reasons you can think of.  One of the only sectors where there is real growth is tech. Take the Nasdaq. It’s a far cry from the bloated bubble of 2000. Names like Apple, Microsoft, Google, Gilead, Intel, Facebook and Amazon are all examples of companies that generate actual cash flow. Collective profits have trebled since 2008, according to newsletter Atlas Pulsehttp://www.atlaspulse.com/, while most countries and sectors remain below pre-crisis levels.  Meanwhile, Nasdaq analysts are much more cautious. Flows into the ETFs are negative. Retail investors are not there in the way they once were. The index is still below its 2000 bubble peak. This all leaves plenty of room for further rises. The potential for the small caps in the sector is enormous.  The boom in tech stocks is just getting going. Both Atlas Pulse and I predict it will be the one area of real growth in 2015. This is the wave – and it is a positive wave – bitcoin wants to ride. Forget the negative attacks on governments or banks. It’s a war that cannot be won and making such powerful enemies does bitcoin no favours.  The tech and the companies operating it need to focus on making the transition to bitcoin irresistible and inevitable, in the same ways that listening to iPods or buying on Amazon has become the status quo. Governments and banks’ money will then be superseded on the Internet – and they’ll have as much choice over the matter as the music and publishing industries did 15 years ago.  That’s the way to get the revolution you’ve dreamed of.  The talk might win the argument. But the tech will win a great deal more. Remember the mantra: ""Cypherpunks write code"".  Disclaimer: The views expressed in this article are those of the author and do not necessarily represent the views of, and should not be attributed to, CoinDesk.  Bitcoin: the Future of Money?  by Dominic Frisby is available directly from the publishers Unbound, from amazon.com or amazon.co.uk. The audiobook is available here. And, yes, you can buy it with Bitcoin.  Image via CoinDesk",NEUTRAL,없음,BTC | BUSINESS | FIAT | MARKET | TRADING,Dominic Frisby,0,0,CoinDesk,https://coindesk.com/markets/2014/11/22/for-bitcoin-its-the-tech-not-the-talk-that-really-matters,https://cdn.sanity.io/images/s3y3vcno/production/9f22e300232c74bd0eedc06acb88350fe80f1851-1500x940.jpg?w=300&h=300&fit=crop
