뉴스ID,뉴스GUID,일자(UTC timestamp),뉴스제목,본문,SENTIMENT,주요코인,카테고리,작성자,추천수,비추천수,출처,뉴스URL,이미지URL
13222283,https://www.newsbtc.com/?p=474735,1635354022,Why Trapped Longs At Bitcoin ATH Could Lead To More Downside,"Bitcoin&apos;s new all-time high this month has led to a number of interesting developments in the crypto space. The success of the first Bitcoin ETF contributed greatly to the price of BTC finally bursting through the $67K price point and with it has come to a spike in funding rates in the market. The ProShares ETF saw over $1 billion in trading volume in its first day, signaling increased inflows into the market. The spike in funding rates moved along with the price movements of BTC in the month of October. This spike maintained momentum along with BTC movements. However, as the price of bitcoin has begun a downward trend, funding rates have also evened out to mid-October levels. Bitcoin Open Interest Spikes Open interest in bitcoin had recorded a significant spike when the price of the digital asset had moved past $67K. BTC-denominated open interest in perpetuals had since a sharp increase to the tune of 15,000 when the asset reached its new all-time high in October. The spike in BTC-dominated perpetuals had risen past levels recorded during the April all-time high. Related Reading | Brace For Impact: Wall Street Is Headed Straight For Bitcoin, Says Analyst The increased interest from big money is credited for the spike in the funding rates recorded last week. More specifically short-term traders expected the value of the digital asset to continue to grow and break past $70K. Funding rates have shown similar movements...",NEGATIVE,BTC,BTC | MARKET | TRADING,,0,0,NewsBTC,https://www.newsbtc.com/news/bitcoin/bitcoin-trapped-longs-to-more-downside/,https://images.cryptocompare.com/news/default/newsbtc.png
13498606,https://coinquora.com/?p=94546,1635354000,"The Polkadot Brand Is Evolving, Community Decides Its Future",Polkadot is launching a major decentralized branding initiative. The community chose four bounty curators to lead the initiative. Polkadot&apos;s community ...Read More...,NEUTRAL,없음,BLOCKCHAIN | DOT,,0,0,Coin Edition,https://coinquora.com/the-polkadot-brand-is-evolving-community-decides-its-future/,https://images.cryptocompare.com/news/default/coinquora.png
42424419,sd6iOBkuiC3F0LYOy2oVnh,1635353958,‘Open Finance’ Project Findora Launches $100M Ecosystem Fund,"Privacy blockchain project Findora is launching a $100 million ecosystem fund “to accelerate the growth and development” of its community, the company announced on Wednesday.  Findora also announced that after more than three months of testing, staking and delegation would be possible on the Findora Mainnet Beta.  Findora described the fund as “part of a broader community-led commitment to support Findora ecosystem research, development and infrastructure projects building upon Findora’s privacy-preserving technology.”  Developers will be able to apply for grants through the initiative.  By staking on the Findora Mainnet Beta, stakers will be able to earn an annualized reward rate of up to 250%, the company said.  Last December, Findora closed an eight-figure funding round that included a number of notable investors, including Allchaineed, Krypital Group, Axia8 Ventures, Cabin VC, Powerscale Capital and Jack Lee, the founding partner of Foxconn’s financial platform, FNConn.  The amount of funding was not disclosed but the company told CoinDesk it was in “the tens of millions.”  Read more: Foxconn’s Jack Lee Join 8-Figure Round for ‘Open Finance’ Project Findora",POSITIVE,없음,BLOCKCHAIN | BUSINESS | MINING | RESEARCH,James Rubin,0,0,CoinDesk,https://coindesk.com/business/2021/10/27/open-finance-project-findora-launches-100m-ecosystem-fund,https://cdn.sanity.io/images/s3y3vcno/production/ce96684caea4ff6f1cbcb69fae8da1301f55194e-720x406.jpg?w=300&h=300&fit=crop
13444009,https://bitcoinist.com/?p=162696,1635353952,How Many Hedera-Based Coins Are There?,"Traditional cryptocurrencies have been around since 2009 when Bitcoin first launched. Innovative and original, it sparked a trend among investors and other interested parties to see how the financial system could change. But, as with many technologies with first-mover advantage, it remains popular but isn&apos;t necessarily the most advanced technology behind the alternative currencies. That&apos;s ...",NEUTRAL,없음,BTC | BUSINESS | TECHNOLOGY,,0,0,Bitcoinist,https://bitcoinist.com/how-many-hedera-based-coins-are-there/?utm_source=rss&utm_medium=rss&utm_campaign=how-many-hedera-based-coins-are-there,https://images.cryptocompare.com/news/default/bitcoinist.png
13257074,https://dailyhodl.com/?p=170778,1635353755,"Fresh Rallies to New Highs Could Be Ahead for Chainlink, According to Crypto Analyst Benjamin Cowen","Crypto analyst Benjamin Cowen thinks that the blockchain oracle Chainlink (LINK) is undervalued. Cowen tells his 582,000 YouTube subscribers that the decentralized network&apos;s native token, LINK, has been one of his top holdings for a long time. He predicts LINK will continue to trend up with time, though he notes it hasn&apos;t been surging as ...The post Fresh Rallies to New Highs Could Be Ahead for Chainlink, According to Crypto Analyst Benjamin Cowen appeared first on The Daily Hodl.",POSITIVE,LINK,ALTCOIN | BLOCKCHAIN | ICO | LINK | TRADING,,0,0,The Daily Hodl,https://dailyhodl.com/2021/10/27/fresh-rallies-to-new-highs-could-be-ahead-for-chainlink-according-to-crypto-analyst-benjamin-cowen/,https://images.cryptocompare.com/news/default/dailyhodl.png
13481851,https://cryptobriefing.com/?p=98855,1635353481,OpenSwap Announces New ‘Spot Price Queue’ Feature to Ensure Zero Slippage For Crypto Swaps,,POSITIVE,없음,TRADING,,0,0,Crypto Briefing,https://cryptobriefing.com/openswap-announces-new-spot-price-queue-feature-ensure-zero-slippage-crypto-swaps/?utm_source=main_feed&utm_medium=rss,https://images.cryptocompare.com/news/default/cryptobriefing.png
13481852,https://cryptobriefing.com/?p=98877,1635353270,$136M Lost as Cream Finance Suffers Another Flash Loan Attack,,NEGATIVE,없음,MARKET,,0,0,Crypto Briefing,https://cryptobriefing.com/136m-lost-cream-finance-suffers-another-flash-loan-attack/?utm_source=main_feed&utm_medium=rss,https://images.cryptocompare.com/news/default/cryptobriefing.png
13412570,https://blockworks.co/?p=9948,1635353185,Osmosis Closes $21M Token Sale Led by Paradigm,"The project has grown from essentially nothing to $500 million total value locked on its decentralized exchange since launching in June, the foundation said.The post Osmosis Closes $21M Token Sale Led by Paradigm appeared first on Blockworks.",POSITIVE,없음,EXCHANGE | LUNA | TOKEN SALE,,0,0,Blockworks,https://blockworks.co/osmosis-closes-21m-token-sale-led-by-paradigm/,https://images.cryptocompare.com/news/default/blockworks.png
13337777,https://cointelegraph.com/news/biden-s-pick-for-cftc-chair-wants-the-agency-to-be-a-beat-cop-with-the-authority-to-oversee-60-of-digital-asset-market,1635353097,Biden's pick for CFTC chair wants the agency to be a 'beat cop' with the authority to oversee 60% of digital asset market,Rostin Behnam said it was &apos;critically important to have a primary cop on on the beat&apos; of an emerging market that included cryptocurrencies and stablecoins.,POSITIVE,없음,MARKET | REGULATION,,0,0,CoinTelegraph,https://cointelegraph.com/news/biden-s-pick-for-cftc-chair-wants-the-agency-to-be-a-beat-cop-with-the-authority-to-oversee-60-of-digital-asset-market,https://images.cryptocompare.com/news/default/cointelegraph.png
13257075,https://dailyhodl.com/?p=170864,1635352264,OpenSwap Announces New ‘Spot Price Queue’ Feature To Ensure Zero Slippage for Crypto Swaps,"October 27, 2021 - Hong Kong, Hong Kong OpenSwap has set a date for the launch of its new &apos;spot price queue&apos; feature, which will be available from the week of October 25, 2021. OpenSwap&apos;s spot price queue feature is going to be a game-changer for on-chain swaps, guaranteeing zero slippage and spot market price ...The post OpenSwap Announces New &apos;Spot Price Queue&apos; Feature To Ensure Zero Slippage for Crypto Swaps appeared first on The Daily Hodl.",POSITIVE,없음,ASIA | MARKET | TRADING,,0,0,The Daily Hodl,https://dailyhodl.com/2021/10/27/openswap-announces-new-spot-price-queue-feature-to-ensure-zero-slippage-for-crypto-swaps/,https://images.cryptocompare.com/news/default/dailyhodl.png
42424425,sd6iOBkuiC3F0LYOy2oVvh,1635352263,"WWE, Blockchain Creative Labs Ink Deal to Launch NFT Marketplace","World Wrestling Entertainment (NYSE:WWE) has signed an agreement with Blockchain Creative Labs, to launch a non-fungible token (NFT) marketplace for licensed digital WWE tokens and collectibles, the company announced Wednesday.  Blockchain Creative Labs is a new NFT business and creative studio owned by FOX Entertainment and Bento Box Entertainment.  Blockchain Creative will work closely with WWE to create NFTs capturing memorable moments in wrestling, including WWE Superstars and events such as WrestleMania and SummerSlam.  In order to take part in the WWE NFT marketplace, fans will need access to the WWE digital wallet through Eluvio which will then allow them to purchase collectibles using traditional currency or cryptocurrency.  In a recent note, Citi said WWE, video game publisher Activision, FormulaOne Group, Discovery Inc, ViacomCBS are expected to benefit from NFTs.  “This new partnership allows us to deepen our relationship with FOX, as we continue to explore new and creative ways to engage our passionate fanbase,” said Scott Zanghellini, WWE Senior Vice President, Revenue Strategy and Development.",POSITIVE,없음,BLOCKCHAIN | BUSINESS | REGULATION,Tanzeel Akhtar,0,0,CoinDesk,https://coindesk.com/business/2021/10/27/wwe-blockchain-creative-labs-ink-deal-to-launch-nft-marketplace,https://cdn.sanity.io/images/s3y3vcno/production/015b057844ed11919d45bfaadeb0f8300a528f23-1024x819.jpg?w=300&h=300&fit=crop
13269632,https://ambcrypto.com/?p=195223,1635352248,"Polkadot, Bitcoin Cash, Avalanche Price Analysis: 27 October","As Bitcoin hits the $58000-mark, several altcoins witnessed a pullback. Altcoins like Bitcoin Cash and Avalanche flashed bearish signs and registered double-digit losses on their daily charts, while Polkadot saw a 4.3% decline over the past 24 hours. Polkadot (DOT) The altcoin traded at $42.09 after noting a nearly 50.53% gain over the last month. ...",NEGATIVE,DOT,ALTCOIN | BCH | DOT | MARKET | TRADING,,0,0,AMB Crypto,https://ambcrypto.com/polkadot-bitcoin-cash-avalanche-price-analysis-27-october/,https://images.cryptocompare.com/news/default/ambcrypto.png
42424429,sd6iOBkuiC3F0LYOy2oW3h,1635352200,"River Financial to Let Clients Mine Bitcoin Without Having to Set Up, Run Machines","River Financial, a San Francisco-based bitcoin technology and financial services company, will enable its clients to buy bitcoin mining machines and start mining without having to set up and maintain the computers themselves.  The company has launched a service called “River Mining” in which customers can buy Bitmain’s Antminer S19j Pro miners and manage the mining process with a mobile app, according to River Financial’s website. The miners have about 100 terahash per second mining power each. Terahash is a measure of the machine’s computational power.  “With River Mining, clients will own their mining hardware and the bitcoin generated will be deposited directly into their River accounts,” the company said in a statement. The company has started a pre-sale of the machines and set up a wait list on its website. Customers can pay for just one miner to get started.  Once clients buy the miners, they will be responsible for the electricity fees and a monthly hosting charge for the machines.  The first miner will go online in early 2022, according to an emailed statement from River Financial CEO Alex Leishman. The service will be initially available to clients in the U.S., but the company plans to expand the program globally in 2022, he said.  The product comes at a time when bitcoin mining has become a lucrative business with high profit margins thanks to a rally in the price of the world’s biggest cryptocurrency by market value. However, the challenges of setting up machines and the lack of access to cheap electricity have made moving into the sector challenging for new entrants. “Chip shortages, supply chain breakdowns and high residential energy costs have made entering mining more difficult,” Leishman said.  “River Mining removes these barriers for clients by making it easy to own, manage and generate bitcoin with their personal bitcoin mining fleets,” he added.",POSITIVE,없음,BTC | BUSINESS | MARKET | MINING | TRADING,Aoyon Ashraf,0,0,CoinDesk,https://coindesk.com/business/2021/10/27/river-financial-to-let-clients-mine-bitcoin-without-having-to-set-up-run-machines,https://cdn.sanity.io/images/s3y3vcno/production/a5a6fed4c3184a0d9ea41076b6882f557aecfc37-720x406.jpg?w=300&h=300&fit=crop
13383959,https://zycrypto.com/?p=57990,1635351727,Ripple Debuts First-Ever In-Market On-Demand Liquidity (ODL) Deployment In The Middle East,"On Monday, Ripple announced that it was partnering with Pyypl, an international blockchain-based financial services firm with offices in the United Arab Emirates. &apos;Ripple announced its continuing contribution to this hotbed of fintech innovation with the first-ever in-market On-Demand Liquidity (ODL) deployment in the Middle East.&apos; The San-Francisco-based Fintech firm noted that countries in the MENA region (Middle-East and North Africa) ...",POSITIVE,없음,OTHER,,0,0,ZyCrypto,https://zycrypto.com/ripple-debuts-first-ever-in-market-on-demand-liquidity-odl-deployment-in-the-middle-east/,https://images.cryptocompare.com/news/default/zycrypto.png
13494360,https://seekingalpha.com/news/3759102-robinhood-focuses-on-new-products-sheds-little-light-on-guidance-earnings-call?utm_source=cryptocompare.com&utm_medium=referral,1635351532,"Robinhood focuses on new products, sheds little light on guidance: earnings call","Robinhood Markets (NASDAQ:HOOD) CEO Vlad Tenev and Chief Financial Officer Jason Warnick emphasized new products the fintech app is planning to roll out, including retirement accounts and a cryptocurrency wallet during their Q3 earnings call. They expanded little on the company&apos;s guidance for Q4 revenue dropping from Q2 and Q3 levels, with Tenev repeating that &apos;the cryptocurrency market is extremely volatile, and we anticipate these conditions are likely to persist.&apos; Robinhood expects new funded accounts in Q4 will be roughly in line with the 660K opened in Q3, Warnick said. Regulatory matters may be a sticking point in adding new crypto coins to Robinhood&apos;s platform, something customers have been asking for. &apos;The regulatory environment in terms of new coins and lending products in crypto is uncertain and evolving,&apos; Tenev said. &apos;And we&apos;re having to carefully evaluate whether we can add new coins in a way that&apos;s safe for customers and in line",NEUTRAL,없음,BUSINESS | MARKET,,0,0,Seeking Alpha,https://seekingalpha.com/news/3759102-robinhood-focuses-on-new-products-sheds-little-light-on-guidance-earnings-call?utm_source=cryptocompare.com&utm_medium=referral,https://images.cryptocompare.com/news/default/seekingalpha.png
13494361,https://seekingalpha.com/news/3759095-voyager-digital-becomes-first-international-partner-of-mark-cubans-dallas-mavericks?utm_source=cryptocompare.com&utm_medium=referral,1635351315,Voyager Digital becomes first international partner of Mark Cuban's Dallas Mavericks,"Cryptocurrency exchange Voyager Digital (OTCQX:VYGVF) enters into a five-year exclusive, integrated partnership with famed billionaire entrepreneur Mark Cuban&apos;s Dallas Mavericks, becoming the team&apos;s first crypto brokerage and international partner. Voyager (OTCQX:VYGVF) and the Dallas basketball team aim to make crypto more accessible through educational and community programs, global activations and fan engagement promotion. The partnership also includes naming rights to the Mavs Gaming Hub, the official gaming and event venue for the Mavs NBA 2K League team. &apos;Crypto assets and applications are changing how business and personal finance are done,&apos; said Mark Cuban. &apos;We believe our partnership with Voyager will allow Mavs and NBA fans to learn more about Voyager and how they can earn more from Voyagers&apos; platform than from traditional financial applications.&apos; Shares of VYGVF rise 1.51% in intra-day trading. Previously, (Oct. 1) Voyager Digital announces strategic investment in Fundstrat for providing crypto research.",POSITIVE,없음,BUSINESS | EXCHANGE | TRADING | RESEARCH,,0,0,Seeking Alpha,https://seekingalpha.com/news/3759095-voyager-digital-becomes-first-international-partner-of-mark-cubans-dallas-mavericks?utm_source=cryptocompare.com&utm_medium=referral,https://images.cryptocompare.com/news/default/seekingalpha.png
13257076,https://dailyhodl.com/?p=170856,1635351280,"After Raising $8.5 Million From Private Investors, Portal Announces Republic.co Offering","October 27, 2021 - San Francisco, California Portal, a self-hosted wallet and true cross-chain layer two DEX built on Bitcoin, is delighted to announce its public equity sale through Republic.co, a multi-asset investment platform that allows anyone to invest in vetted private startups. The public sale will take place mid-November. Portal is extending the capabilities ...The post After Raising $8.5 Million From Private Investors, Portal Announces Republic.co Offering appeared first on The Daily Hodl.",POSITIVE,없음,BTC | BUSINESS | ICO,,0,0,The Daily Hodl,https://dailyhodl.com/2021/10/27/after-raising-8-5-million-from-private-investors-portal-announces-republic-co-offering/,https://images.cryptocompare.com/news/default/dailyhodl.png
13481853,https://cryptobriefing.com/?p=98825,1635351229,"After Raising $8.5 Million from Private Investors, Portal Announces Republic.co Offering",,POSITIVE,없음,BUSINESS | ICO,,0,0,Crypto Briefing,https://cryptobriefing.com/after-raising-8-5-million-from-private-investors-portal-announces-republic-co-offering/?utm_source=main_feed&utm_medium=rss,https://images.cryptocompare.com/news/default/cryptobriefing.png
13389666,https://decrypt.co/?p=84592,1635350936,Ethereum Meme Token SHIB On Pace to Flip Dogecoin as Bitcoin Slumps,"Dog days for DOGE as the leading meme coin is close to being dethroned by a surging SHIB, which has entered the Top 10.",POSITIVE,DOGE | SHIB,BTC | DOGE | ETH | MARKET | SHIB,,0,0,Decrypt,https://decrypt.co/84592/shiba-inu-shib-flip-dogecoin-bitcoin-slumps,https://images.cryptocompare.com/news/default/decrypt.png
13337778,https://cointelegraph.com/news/to-the-roots-of-mining-bitcoin-going-green-faster-than-ever,1635350820,To the roots of mining: Bitcoin going green faster than ever,Many crypto-mining firms are transitioning to renewable sources of energy to help facilitate their operations.,POSITIVE,없음,BTC | MINING,,0,0,CoinTelegraph,https://cointelegraph.com/news/to-the-roots-of-mining-bitcoin-going-green-faster-than-ever,https://images.cryptocompare.com/news/default/cointelegraph.png
13481854,https://cryptobriefing.com/?p=98864,1635350730,"Shiba Inu Hits New All-Time High, Becomes a Top Ten Coin",,POSITIVE,없음,MARKET | SHIB | TRADING,,0,0,Crypto Briefing,https://cryptobriefing.com/shiba-inu-hits-new-all-time-high-becomes-a-top-ten-coin/?utm_source=main_feed&utm_medium=rss,https://images.cryptocompare.com/news/default/cryptobriefing.png
13269633,https://ambcrypto.com/?p=195046,1635350440,India: A law to regulate the crypto-industry could come as soon as…,"Though India and China are in competition across a variety of industries, one wouldn&apos;t think this when comparing the countries&apos; respective crypto-scenes and CBDC programs. However, India could soon be bringing changes to its largely unregulated crypto-sector. A budget to look forward to? According to Business Today, officers from the Finance Ministry have claimed that ...",NEUTRAL,없음,ASIA | BUSINESS | REGULATION,,0,0,AMB Crypto,https://ambcrypto.com/india-a-law-to-regulate-the-crypto-industry-could-come-as-soon-as/,https://images.cryptocompare.com/news/default/ambcrypto.png
13389667,https://decrypt.co/?p=84540,1635350410,Privacy Blockchain Putting Up $100 Million to Compete With Zcash and Monero,Findora has announced a $100 million ecosystem fund as it looks to attract DeFi applications to the network.,POSITIVE,없음,BLOCKCHAIN | TECHNOLOGY | XMR | ZEC,,0,0,Decrypt,https://decrypt.co/84540/privacy-blockchain-putting-100-million-compete-zcash-monero,https://images.cryptocompare.com/news/default/decrypt.png
42375607,0r6Zag11PPDEMKgUWw9Hp5,1635350400,Paradigm Leads $5M Seed Funding Round for Play-to-Earn Game AI Arena,"ArenaX Labs has closed a $5 million seed funding round that was led by Paradigm Capital with participation from Framework Ventures. The funds will help accelerate the development of AI Arena, a player vs. player fighting game where the characters are powered by artificial intelligence (AI). The game is based on the Ethereum blockchain.  AI Arena players own their own fighters that contain typical non-fungible token (NFT) attributes such as power, speed and accuracy. The fighters are also embedded with an artificial neural network, enabling them to operate autonomously.  “You have this autonomous AI that can compete with other autonomous AI around the world. The goal is to train [the fighter] to get better and better so you can earn more on our play-to-earn platform,” ArenaX founder and CEO Brandon Da Silva told CoinDesk in an interview.  Read more: Osmosis Closes $21M Token Sale Led by Paradigm  The AI fighters are trained through either imitation learning, where the player takes control and “teaches” the AI character how to react to a variety of circumstances, or self-play, where the AI character is set loose to start training on its own.  The play-to-earn aspect of AI Arena involves ranked battles where leaderboard standings determine the number of tokens a player receives. Da Silva says ArenaX is planning a wagered battle mode further down the line where players can bet against their opponent.  ArenaX expects to launch AI Arena at the end of the first quarter of 2022 or the beginning of the second quarter, Da Silva told CoinDesk.  “We love the team and think the concept of AI characters as collectibles is ingenious. We’re excited to see how crypto and game mechanics can help drive forward innovation and reward researchers in artificial intelligence,” Dan Robinson, head of research at Paradigm Capital, said in a statement to CoinDesk.",POSITIVE,없음,ETH | MINING | RESEARCH | TOKEN SALE,Brandy Betz,0,0,CoinDesk,https://coindesk.com/business/2021/10/27/paradigm-leads-5m-seed-round-for-play-to-earn-game-ai-arena,https://cdn.sanity.io/images/s3y3vcno/production/6b89b2d2c9ed88cfbe5a5019561b022b473715bd-1280x760.jpg?w=300&h=300&fit=crop
13291701,https://cryptonews.com/news/buoyant-bitcoin-prices-met-with-silence-by-el-salvadors-anti-btc-critics.htm,1635350400,Buoyant Bitcoin Prices Met with Silence by El Salvador’s Anti-BTC Critics,"As bitcoin (BTC) prices continue to hover around the USD 60,000 mark, a kind of hush has fallen over much of the El Salvador mainstream media - most of which is vehemently opposed to both President Nayib Bukele and his bitcoin adoption drive....Read More: Buoyant Bitcoin Prices Met with Silence by El Salvador&apos;s Anti-BTC Critics",NEUTRAL,BTC,BTC | MARKET | REGULATION,,0,0,cryptonews,https://cryptonews.com/news/buoyant-bitcoin-prices-met-with-silence-by-el-salvadors-anti-btc-critics.htm,https://images.cryptocompare.com/news/default/cryptonews.png
13403576,https://cryptopotato.com/?p=147969,1635350074,Is Direxion’s Short Bitcoin Futures Product A Daring Move?,"Another crypto-oriented ETF is seeking SEC&apos;s approval, but is it too much of a daring move?",NEUTRAL,없음,BTC | REGULATION,,0,0,Crypto Potato,https://cryptopotato.com/is-direxions-short-bitcoin-futures-product-a-daring-move/,https://images.cryptocompare.com/news/default/cryptopotato.png
13383960,https://zycrypto.com/?p=57985,1635349708,"Why Shiba Inu Is Far Better Than ‘Boomer Memecoin’ Dogecoin, According To Bloomberg Editor","Dogecoin was everyone&apos;s favorite internet pup for a while. But Shiba Inu (SHIB) has taken over as the latest white-hot crypto asset. The price of SHIB has also enjoyed a dizzying rise in recent weeks, attracting the attention of many in the crypto community. Joe Weisenthal, a Bloomberg Markets editor, and podcast host has suggested ...",POSITIVE,SHIB,DOGE | MARKET | SHIB | TRADING,,0,0,ZyCrypto,https://zycrypto.com/why-shiba-inu-is-far-better-than-boomer-memecoin-dogecoin-according-to-bloomberg-editor/,https://images.cryptocompare.com/news/default/zycrypto.png
