뉴스ID,뉴스GUID,일자(UTC timestamp),뉴스제목,본문,SENTIMENT,주요코인,카테고리,작성자,추천수,비추천수,출처,뉴스URL,이미지URL
6732324,https://seekingalpha.com/news/3921381-ftx-debtors-urge-bahamas-commission-to-explain-crypto-value-of-seized-assets?utm_source=cryptocompare.com&utm_medium=referral,1672443844,FTX debtors urge Bahamas Commission to explain crypto value of seized assets,"FTX Trading and its debtors have informed the Bahamas Securities Commission that neither Sam Bankman-Fried, Gary Wang, or the Securities Commission of the Bahamas had a right to take the cryptocurrency of the FTX debtors, it said in a statement late Friday. Late Thursday, the Securities Commission said it took control of FTX digital assets valued at more than $3.5B as of Nov. 12, because it ""determined that there was a significant risk of imminent dissipation"" if they stayed under FTX's control. That statement did not identify the type of digital assets that were seized. The debtors said they have evidence that ~195M FTT tokens ( FTT-USD ), 1,938 ethereum ( ETH-USD ) and other miscellaneous coins with no substantial value were transferred, without their authorization, after the company filed for Chapter 11 bankruptcy. Blockchain information shows that that crypto is being held in a single digital wallet on Fireblocks. The value of the cryptocurrency at spot prices at the time of transfer was ~$296M, the debtors said, citing etherscan.io. That value, though, assumes that the FTT tokens ( FTT-USD ) in the wallet could be sold at spot prices at the time. The value of the same crypto at spot prices at 2:00 PM ET on Dec. 30 was ~$167M. ""The FTX Debtors urge the Bahamas Commission to clear up any confusion created by their recent statements and provide the public with accurate information concerning the cryptocurrency seized and how it was valued for the purposes of these statements,"" the debtors' statement said. Earlier on Friday, FTX Japan and Liquid Japan aim to resume withdrawals in February.",NEUTRAL,ETH | FTT,ASIA | BLOCKCHAIN | ETH | MARKET | FTT,,0,0,Seeking Alpha,https://seekingalpha.com/news/3921381-ftx-debtors-urge-bahamas-commission-to-explain-crypto-value-of-seized-assets?utm_source=cryptocompare.com&utm_medium=referral,https://resources.cryptocompare.com/news/50/6732324.jpeg
6730804,https://seekingalpha.com/news/3921377-bitcoin-on-track-for-worst-year-since-2018?utm_source=cryptocompare.com&utm_medium=referral,1672441742,Bitcoin on track for worst year since 2018,"Bitcoin ( BTC-USD ) is on track to end the year ~65% lower, capping off one of its most challenging years since its inception. The top cryptocurrency is set to end the last week of the year 1.3% lower. The 65% drop contrasts sharply with ~60% gain in 2021 and a whopping fourfold increase in 2020. In 2018, bitcoin ( BTC-USD ) had declined ~74% . 2022 saw the crypto market buckle under the weight of multiple bankruptcies , including the FTX ( FTT-USD ) crash, along with weak risk appetite as the Federal Reserve's aggressive rate hikes spooked investors, who widely expect a recession next year. ""We still expect (bitcoin) volatility to decline and remain cautious,"" said Matrixport U.S. CEO Anthony DeMartino . He noted that the collapse of crypto-related firms this year ""revealed all the inconsistencies we may have noticed but were unwilling to face"". ""Best practices will have to be adhered to as coming up short will reduce access to funding and capital. This new, strict environment will allow for the next stage of growth to occur on a more solid and risk conscious foundation,"" added DeMartino. The crypto market cap currently stands at $795.22B, down 0.04% over Thursday, according to CoinMarketCap . FTX Developments FTX former CEO Sam Bankman-Fried is reportedly expected to enter a plea next week to criminal charges of fraud and misuse of customer funds. SBF revealed that he and FTX co-founder Gary Wang together borrowed over $546M from Alameda Research to buy a 7.6% stake in Robinhood ( HOOD ). The SEC alleged that FTX's venture arm made two $100M investments using customers' money to companies whose names were not disclosed. The Bahamas' securities regulator seized FTX's digital assets valued at more than $3.5B as it ""determined there was a significant risk of imminent dissipation"" if they stayed under FTX's control. Meanwhile, FTX Japan and Liquid Japan are targeting the resumption of withdrawals in February . Other Crypto N ews Argo Blockchain ( ARBK ) said it will sell its Helios mining facility to Galaxy Digital ( OTCPK:BRPHF ) for $65M. ""The lower debt load should provide some relief. However, going forward, ARBK will be subject to hosting fees for its miners at Helios, which will be operated by Galaxy,"" said Jefferies analyst Jonathan Petersen. Crypto exchange Kraken will cease operations in Japan as of January 31 due to market conditions in the country and the global crypto downturn. Bitcoin price Bitcoin ( BTC-USD ) dipped 0.2% at $16.59K at 6.07 pm ET, while ether ( ETH-USD ) was flat at $1.20K. Bitcoin ( BTC-USD ) remained firmly below $17K this week. SA contributor The Digital Trend believes bitcoin ( BTC-USD ) could find a bottom in H1 2023, and rally in H2. ""However, this doesn't mean we will immediately take off towards new highs. More likely, we will see some 'sideways' action for the year's second half."" Crypto-related stocks that ended in the red on Friday include: MGT Capital Investments ( OTCQB:MGTI ) -4.6% , Soluna ( SLNH ) -3% , Riot Blockchain ( RIOT ) -0.9% . However, crypto mining stocks ended higher: Cipher Mining ( CIFR ) +24.8% , Argo ( ARBK ) +19.5% , Iris Energy ( IREN ) +13.6% , Bitfarms ( BITF ) +10.9% .",NEGATIVE,BTC,ASIA | BLOCKCHAIN | BTC | EXCHANGE | MARKET,,0,0,Seeking Alpha,https://seekingalpha.com/news/3921377-bitcoin-on-track-for-worst-year-since-2018?utm_source=cryptocompare.com&utm_medium=referral,https://resources.cryptocompare.com/news/50/6730804.jpeg
6730563,https://dailyhodl.com/?p=230435,1672441509,"Manager of $2,000,000,000 Hedge Fund Says Crypto Industry Will Take Off After This Happens","The managing partner of crypto hedge fund Morgan Creek Digital says it does not make sense for investors to speculate on crypto assets without insurance. In a new interview on the Blockworks Macro podcast, Mark Yusko says crypto assets need to offer value to customers so the centralized finance industry can take off. “There has The post Manager of $2,000,000,000 Hedge Fund Says Crypto Industry Will Take Off After This Happens appeared first on The Daily Hodl .",NEUTRAL,없음,BLOCKCHAIN | BUSINESS | TRADING,,0,0,The Daily Hodl,https://dailyhodl.com/2022/12/30/manager-of-2000000000-hedge-fund-says-crypto-industry-will-take-off-after-this-happens/,https://images.cryptocompare.com/news/default/dailyhodl.png
6730515,https://decrypt.co/?p=118193,1672441340,Sam Bankman-Fried Denies Moving Alameda-Linked Funds: ‘None of These Are Me’,SBF tweeted for the first time since December 12 to push back against speculation that he moved Alameda funds.,NEUTRAL,없음,BTC | BUSINESS,,0,0,Decrypt,https://decrypt.co/118193/sam-bankman-fried-denies-moving-alameda-linked-funds,https://resources.cryptocompare.com/news/44/6730515.jpeg
6730349,https://dailyhodl.com/?p=230499,1672441293,Ethereum (ETH) Founder Vitalik Buterin Offers Support for Solana Developers As SOL Stumbles Into 2023,"The founder of Ethereum (ETH) is offering words of encouragement to the developers of rival smart contract platform Solana (SOL) as its bear market struggles continue. The former billionaire says that since the “awful opportunistic money” has been washed out of Solana, the blockchain’s future looks bright and he hopes they thrive from here on The post Ethereum (ETH) Founder Vitalik Buterin Offers Support for Solana Developers As SOL Stumbles Into 2023 appeared first on The Daily Hodl .",POSITIVE,ETH | SOL,ALTCOIN | ETH | SOL | TRADING | RAY,,0,0,The Daily Hodl,https://dailyhodl.com/2022/12/30/ethereum-eth-founder-vitalik-buterin-offers-support-for-solana-developers-as-sol-stumbles-into-2023/,https://images.cryptocompare.com/news/default/dailyhodl.png
6730374,https://bitcoinist.com/?p=211478,1672441236,Is The NFT Bull Market Back? Here’s What The Data Says,"The NFT market took a rather significant beating in the year 2022 despite reaching its peak trading volume at the start of the year. Since then, volume is down more than 94% as investors move away from these highly illiquid assets. However, there has been an upturn in NFT volume in the last month, so",NEUTRAL,없음,BUSINESS | MARKET | TRADING,,0,0,Bitcoinist,https://bitcoinist.com/is-the-nft-bull-market-back/,https://resources.cryptocompare.com/news/13/6730374.jpeg
6730373,https://newsbtc.com/?p=514270,1672441205,"Bitcoin Investor Sentiment Remains Steady As BTC Stalls At $16,000","Bitcoin investor sentiment has reached a standstill amid struggling prices in the market. While the digital asset continues to hold the $16,000 level, investors have backed off from the market, ensuring no significant movements either up or down, and as a result, investor sentiment hasn’t moved. Bitcoin Investors Still In Fear The crypto Fear & Greed Index shows that bitcoin investor sentiment hasn’t really moved much in the last month. It closed out the month of November at a score of 29 which put it right in the fear territory but since then has been unable to break out of this trend. Related Reading: Solana Suffers Double-Digit Losses, Is There An End In Sight? The score on this index over the month of December has staggered between 26-30 for the most part, maintaining a nearly straight-line trend during this period. Even now, the Fear & Greed Index sits at a score of 28 and is up one point from last week’s close of 27. Fear & Greed Index trends in an almost straight line | Source: alternative.me What this trend in the Fear & Greed Index shows is that bitcoin investors are not willing to take any risk. This is why the index has been unable to move into the greed territory. On the flip side, sell sentiment has not been as strong as expected during a time like this. If investors were selling more of their bitcoin, then it would have been obvious given that the index would slide further down. Instead, it continues to maintain a near-consistent score level, meaning hold sentiment now dominates the market. Will BTC See A Recovery Soon? Bitcoin is still finding a hard time regaining the momentum it has lost over the past month. This hesitancy from investors to do anything with their tokens has seen the price of the digital asset follow the same path as sentiment. BTC has now refused to move out of the $16,000 price level. BTC price maintains $16,000 level | Source: BTCUSD on TradingView.com As a result of this, bitcoin volatility has fallen to historical lows. So it is likely that the last two days of the year 2022 will follow this same trend. Recovery should not be expected in any way because momentum will continue to decline as people take a break from the markets to celebrate with family. Related Reading: Dogecoin Beats Bitcoin, Ethereum For Best Performance In Crypto Top 10 Rather, it is important that BTC holds above $16,000 to close out the year. Anything below this level would be very bearish and could trigger more declines in the market as bears take control. But a finish above $16,000 strengthens investors’ resolve to hold their coins. BTC is changing hands at a price of $16,519 at the time of this writing. Its price is down 0.43% in the last 24 hours and 2.01% in the last 7 days. Featured image from Finbold, chart from TradingView.com",NEUTRAL,BTC,BTC | BUSINESS | DOGE | MARKET | TRADING,,0,0,NewsBTC,https://newsbtc.com/news/bitcoin/bitcoin-investor-sentiment/,https://resources.cryptocompare.com/news/21/6730373.jpeg
6730372,https://newsbtc.com/?p=514315,1672441204,"Bitcoin Price Remains Stagnated, How Soon Can You Expect A Rebound?","It has been a rough year for Bitcoin and most major altcoins. Over the last 24 hours, Bitcoin lost 1% of its value, which points towards consolidated price action. BTC has not made much progress over the past week either, as the coin only lost 1.6% of its market value. For multiple weeks, the coin has been oscillating between $16,400 and $18,000. The closest support line for the coin stood at $16,000. The technical outlook for Bitcoin depicted mundane price action due to a decline in the buying strength on the one-day chart. Since the price of Bitcoin has remained undecided for quite some time now, sellers have flooded the market, indicating that the coin is headed toward another round of depreciation. The trading volume of Bitcoin has declined considerably, reinforcing that bears were in charge of the asset’s price. If the selling pressure keeps mounting, BTC will soon lose its crucial price level of $16,000. Currently, BTC is down 76% from its all-time high, secured in 2021. Related Reading: Ethereum Finishes 2022 With ATH Correlation To Bitcoin, Despite The Merge Bitcoin Price Analysis: One-Day Chart BTC was trading at $16,550 at the time of writing. Bitcoin was trading close to its immediate support level of $16,000. Going by the technical outlook, the coin might undergo further depreciation before it starts to reverse its price action. Overhead resistance for Bitcoin was $16,900; clearing this could help the crypto reach $17,400 and eventually attempt to breach $18,000. On the flip side, if Bitcoin moves below the current price mark, it will fall through $16,000 and exceed $15,800. The amount of Bitcoin traded in the last session declined, indicating a fall in buying strength for the asset. Technical Analysis BTC traders might again witness a fall in asset prices over the upcoming trading sessions. The Relative Strength Index (RSI) was below the half-line, near the 40-mark, which indicates that sellers outnumbered buyers heavily. RSI had also noted a downtick, signifying further loss of value. Similarly, the BTC price was below the 20-Simple Moving Average (SMA) line, which signals that sellers were driving the price momentum in the market. The SMA also formed a death cross; it is formed when a longer moving average line crosses over a shorter moving average line; in this case, the 50-SMA line was above the 20-SMA line. This sign on the chart is accompanied by the bears strengthening in the market. Other technical indicators have also pointed out that sellers are here to stay a little longer. The Moving Average Convergence Divergence (MACD) indicates price momentum and reversals. MACD depicted a sell signal as the indicator noted red signal bars after undergoing a bearish crossover. The sell signal could mean that the price would depreciate further. The Directional Movement Index, which portrays the price direction, was negative. The -DI (orange) line was above the +DI (blue) line. The Average Directional Index (red) was near the 20-mark with an uptick, emphasizing that bearish action could gain momentum over the immediate trading sessions. Related Reading: A Crypto Holiday Special: Past, Present, And Future With Ex-Binance CFO Wei Zhou Featured Image From Unsplash, Charts From TradingView.com",NEGATIVE,BTC,ALTCOIN | BTC | ETH | MARKET | TRADING,,0,0,NewsBTC,https://newsbtc.com/news/bitcoin/bitcoin-stagnated-soon-can-you-expect-a-rebound/,https://resources.cryptocompare.com/news/21/6730372.jpeg
6730279,https://coinedition.com/?p=238009,1672441200,Alameda Research Converts Its Altcoin Holdings Into Ethereum,"Alameda Research, which is owned by Sam Bankman-Fried and is embroiled in disputes, has changed a number of tokens worth of altcoins that it holds into Ethereum. This comes at a time when the company’s owners are facing criminal accusations connected to the failure of its sister company, FTX both of which were operated by The post Alameda Research Converts Its Altcoin Holdings Into Ethereum appeared first on Coin Edition .",NEUTRAL,없음,ALTCOIN | ETH | RESEARCH,,0,0,Coin Edition,https://coinedition.com/alameda-research-converts-its-altcoin-holdings-into-ethereum/,https://resources.cryptocompare.com/news/7/default.png
6730442,https://decrypt.co/?p=118190,1672441082,Bitcoin Firm Compass Mining Wins $1.5M in Suit Against Dynamics Mining,"After a dispute that spilled out onto social media this summer, Compass has emerged victorious—but Dynamics vows to appeal the ruling.",NEUTRAL,없음,BTC | BUSINESS | MINING,,0,0,Decrypt,https://decrypt.co/118190/bitcoin-firm-compass-mining-wins-1-5m-suit-against-dynamics-mining,https://resources.cryptocompare.com/news/44/6730442.jpeg
6729607,https://www.cryptopolitan.com/?p=252217,1672440245,The Federal Committee may review Binance’s Voyager deal￼,"The U.S. recently announced that the Committee on Foreign Investments in the United States (CFIUS) might need to evaluate Binance’s takeover of Voyager in its notice filing, as it could involve a potential national security risk if subject to their jurisdiction. Specifically, the committee would accordingly assess the inherent risks associated with such transactions. Before … The Federal Committee may review Binance’s Voyager deal￼ Read More »",NEUTRAL,없음,EXCHANGE | BNB,,0,0,Cryptopolitan,https://www.cryptopolitan.com/federal-commitee-may-review-binance-deal/,https://resources.cryptocompare.com/news/43/6729607.jpeg
6729034,https://news.bitcoin.com/?p=566534,1672439434,Media Draws Attention to Sam Bankman-Fried’s 2 Visits While on House Arrest,"After FTX co-founder Sam Bankman-Fried (SBF) was released on bail and traveled to his parent’s home in California, it has been reported that SBF was visited by the crypto advocate Tiffany Fong, and also the “Big Short” author Michael Lewis while he’s been on house arrest. Fong detailed she managed to interview SBF, while Lewis",NEUTRAL,없음,OTHER,,0,0,Bitcoin.com,https://news.bitcoin.com/media-draws-attention-to-sam-bankman-frieds-2-visits-while-on-house-arrest/,https://resources.cryptocompare.com/news/14/6729034.jpeg
6728363,https://cryptopotato.com/?p=231052,1672438664,Did SBF Just Cash Out $684K?,The FTX boss allegedly withdrew the funds via a non-KYC platform and Ren Protocol despite court restrictions.,NEGATIVE,없음,BLOCKCHAIN,,0,0,Crypto Potato,https://cryptopotato.com/did-sbf-just-cash-out-684k/,https://resources.cryptocompare.com/news/27/6728363.jpeg
42388281,1WhGe7o17bdD4QO5qRDLkP,1672437547,"Crypto Asset Manager Valkyrie Investments Wants to Sponsor, Manage Grayscale Bitcoin Trust","Crypto asset manager Valkyrie Investments wants to become the sponsor and manager of the Grayscale Bitcoin Trust (GBTC), the company said in a blog post this week.  Valkyrie, one of Grayscale’s rivals, previously launched a bitcoin trust and a bitcoin-related exchange-traded-fund (ETF) in 2021. As part of their plan to sponsor GBTC, the world’s largest bitcoin fund, the Tennessee-based company also announced the launch of a new fund, the Valkyrie Opportunistic Fund, LP that seeks to take advantage of GBTC’s discount to the value of its underlying bitcoin, the company said.  Valkyrie’s plan would be a tall order, considering that GBTC alone has over $10 billion in assets and Valkyrie only handles roughly $180 million in total assets.  “We understand that Grayscale has played an important role in the development and growth of the bitcoin ecosystem with the launch of GBTC, and we respect the team and the work that they have done,” Valkyrie said. “However, in light of recent events involving Grayscale and its family of affiliated companies, it is time for a change.”  Grayscale and CoinDesk are both owned by the Digital Currency Group.  In its proposal, Valkyrie said it wants to facilitate GBTC redemptions at net asset value (NAV) for investors through a Regulation M filing. It also proposes to lower the fees to 75 basis points as opposed to the current 200 basis points, and to offer redemptions in both bitcoin and cash.  Earlier this month, GBTC shares hit a record-high discount rate of over 50% relative to the price of bitcoin (BTC). GBTC’s recent struggles were triggered by the Security and Exchange Commission’s (SEC) reiteration of its reasons for denying Grayscale Investment’s application to convert GBTC into a spot bitcoin ETF. Grayscale called the initial denial “arbitrary, capricious and discriminatory.”  Grayscale did not immediately return a request for comment.",NEUTRAL,BTC,BTC | BUSINESS | EXCHANGE | REGULATION | TRADING,Helene Braun,0,0,CoinDesk,https://coindesk.com/business/2022/12/30/crypto-asset-manager-valkyrie-investments-wants-to-sponsor-manage-grayscale-bitcoin-trust,https://cdn.sanity.io/images/s3y3vcno/production/8fc7e283ea3ee7f68d260fe458504972239bf699-1500x1238.jpg?w=300&h=300&fit=crop
6727719,https://zycrypto.com/?p=76871,1672437364,"Mark Cuban Says He’ll Keep Buying More Bitcoin In 2023, Diversifies Crypto Holdings","For the majority of bulls, this has been a disappointing year, but that is not the story of Mark Cuban, who sees new possibilities in the bear market.",POSITIVE,없음,BTC | MARKET | TRADING,,0,0,ZyCrypto,https://zycrypto.com/mark-cuban-says-hell-keep-buying-more-bitcoin-in-2023-diversifies-crypto-holdings/,https://images.cryptocompare.com/news/default/zycrypto.png
6727166,https://cointelegraph.com/news/sam-bankman-fried-denies-moving-funds-from-alameda-wallets,1672436898,Sam Bankman-Fried denies moving funds from Alameda wallets,The former FTX CEO denied moving the funds saying; “I’m not and couldn't be moving any of those funds; I don’t have access to them anymore.”,NEUTRAL,없음,TECHNOLOGY,,0,0,CoinTelegraph,https://cointelegraph.com/news/sam-bankman-fried-denies-moving-funds-from-alameda-wallets,https://resources.cryptocompare.com/news/16/6727166.jpeg
6726492,https://zycrypto.com/?p=76869,1672436130,Cardano Gets a Boost After Binance’s Self-Custody Wallet Adds ADA Staking for iOS,"iPhone users can now stake Cardano's native token ADA on the Trust wallet, earn interest, and secure the platform. The official Binance self-custody wallet app rolled out the service for Android users in December.",POSITIVE,ADA,ADA | EXCHANGE | ICO | BNB,,0,0,ZyCrypto,https://zycrypto.com/cardano-gets-a-boost-after-binances-self-custody-wallet-adds-ada-staking-for-ios/,https://images.cryptocompare.com/news/default/zycrypto.png
6726700,https://decrypt.co/?p=118191,1672436065,Sam Bankman-Fried Expected to Plead Not Guilty on FTX Fraud Charges,The FTX founder and former CEO will reportedly enter a not guilty plea to eight charges of fraud from U.S. authorities.,NEUTRAL,없음,BUSINESS,,0,0,Decrypt,https://decrypt.co/118191/sam-bankman-fried-expected-plead-not-guilty-over-ftx-collapse-report,https://resources.cryptocompare.com/news/44/6726700.jpeg
6726330,https://cryptonews.com/news/it-too-late-buy-shiba-inu-crypto-experts-give-their-2023-shib-price-predictions.htm,1672435860,Is it Too Late to Buy Shiba Inu? Crypto Experts Give Their 2023 SHIB Price Predictions,... Read More: Is it Too Late to Buy Shiba Inu? Crypto Experts Give Their 2023 SHIB Price Predictions,NEUTRAL,SHIB,SHIB | TRADING,,0,0,cryptonews,https://cryptonews.com/news/it-too-late-buy-shiba-inu-crypto-experts-give-their-2023-shib-price-predictions.htm,https://resources.cryptocompare.com/news/52/6726330.jpeg
6726259,https://ambcrypto.com/?p=280975,1672435843,"Polygon overtakes Solana in terms of marketcap, but here’s an issue","Polygon outgrew Solana in terms of market cap. It witnessed growth in the NFT sector; however, prices continued to decline. According to a 29 December tweet by economist Alex Kruger, recent developments boosted Solana [SOL], doubling its marketcap to twice that of Polygon [MATIC]. One reason for the growing interest in Polygon could be its emerging",NEUTRAL,MATIC | SOL,ALTCOIN | MARKET | MATIC | SOL,,0,0,AMB Crypto,https://ambcrypto.com/polygon-overtakes-solana-in-terms-of-marketcap-but-heres-an-issue/,https://images.cryptocompare.com/news/default/ambcrypto.png
6726328,https://cointelegraph.com/news/bithumb-s-largest-shareholder-executive-found-dead-following-allegations-of-embezzlement,1672435800,Bithumb’s largest shareholder executive found dead following allegations of embezzlement,Mr. Park Mo was found dead after an investigation had been launched against him for embezzlement and stock price manipulation.,NEGATIVE,없음,BUSINESS | TECHNOLOGY | TRADING,,0,0,CoinTelegraph,https://cointelegraph.com/news/bithumb-s-largest-shareholder-executive-found-dead-following-allegations-of-embezzlement,https://resources.cryptocompare.com/news/16/6726328.jpeg
6726212,https://zycrypto.com/?p=76867,1672435559,"Ripple To Develop National Stablecoin For Island Country Palau, XRP Up 6%","Ripple's XRP gained upwards of 6% in the last week up to December 27, following the announcement that the blockchain was working with Micronesia island nation Palau on a stablecoin project.",POSITIVE,XRP,BLOCKCHAIN | XRP,,0,0,ZyCrypto,https://zycrypto.com/ripple-to-develop-national-stablecoin-for-island-country-palau-xrp-up-6/,https://images.cryptocompare.com/news/default/zycrypto.png
