뉴스ID,뉴스GUID,일자(UTC timestamp),뉴스제목,본문,SENTIMENT,주요코인,카테고리,작성자,추천수,비추천수,출처,뉴스URL,이미지URL
13484591,https://cryptobriefing.com/?p=65765,1596153012,eToro Acquires White-Label Debit Card Platform Marq Millions,"eToro acquired Marq Millions, an FCA authorized white-label debit card issuer for an undisclosed amount. The acquisition will result in rebranding the original company to &apos;eToro Money,&apos; which will serve...",POSITIVE,없음,BUSINESS,,0,0,Crypto Briefing,https://cryptobriefing.com/etoro-acquires-white-label-debit-card-platform-marq-millions/,https://images.cryptocompare.com/news/cryptobriefing/d9o8Q6g8EwM.png
13348902,https://cointelegraph.com/news/william-shatners-nft-collectibles-sell-out-at-warp-speed,1596151860,William Shatner’s NFT Collectibles Sell Out at Warp Speed,"Fans bought 125,000 non-fungible token trading cards featuring Star Trek&apos;s William Shatner on the WAX Blockchain.",POSITIVE,없음,BLOCKCHAIN | BUSINESS | ICO | TRADING,,0,0,CoinTelegraph,https://cointelegraph.com/news/william-shatners-nft-collectibles-sell-out-at-warp-speed,https://images.cryptocompare.com/news/cointelegraph/9Xgw1M1a20a.jpeg
13348903,https://cointelegraph.com/news/is-the-growing-correlation-between-bitcoin-and-gold-a-bullish-sign,1596151560,Is the Growing Correlation Between Bitcoin and Gold a Bullish Sign?,"The correlation between Bitcoin and gold daily returns is increasing, leading investors to expect further upside from BTC price.",POSITIVE,BTC,BTC | ETH | FIAT | MARKET | TRADING,,0,0,CoinTelegraph,https://cointelegraph.com/news/is-the-growing-correlation-between-bitcoin-and-gold-a-bullish-sign,https://images.cryptocompare.com/news/cointelegraph/c30A655jdEi.jpeg
13484592,https://cryptobriefing.com/?p=65691,1596148770,Ethereum: Five Years Leading the Blockchain Revolution,"Ethereum is the oldest smart-contract platform in the blockchain space. While many of the concepts the team utilized were not novel at the time, Ethereum was the first to implement...",POSITIVE,없음,BLOCKCHAIN | ETH | TECHNOLOGY,,0,0,Crypto Briefing,https://cryptobriefing.com/ethereum-five-years-leading-the-blockchain-revolution/,https://images.cryptocompare.com/news/cryptobriefing/88cA6yoM0ww.png
13432941,https://news.bitcoin.com/?p=402869&preview=true&preview_id=402869,1596148205,Crypto Exchange Operator Diginex to List on Nasdaq in September,"Crypto startup Diginex has launched a cryptocurrency exchange ahead of its Nasdaq listing which has already been approved by the U.S. Securities and Exchange Commission (SEC). The new exchange is based in Singapore where Diginex has applied for a license. Diginex Set to List on Nasdaq A cryptocurrency exchange operator, Diginex, is set to list ...The post Crypto Exchange Operator Diginex to List on Nasdaq in September appeared first on Bitcoin News.",POSITIVE,없음,ASIA | BTC | EXCHANGE | REGULATION,,0,0,Bitcoin.com,https://news.bitcoin.com/crypto-exchange-diginex-list-on-nasdaq/,https://images.cryptocompare.com/news/bitcoin.com/dE6Y71Mcb10.jpeg
13261224,https://dailyhodl.com/?p=105256,1596147912,eToro Announces Acquisition to Support Debit Card Launch,"Global investment platform eToro today announces the acquisition of Marq Millions Ltd, the UK based e-money business. Marq Millions is now trading as eToro Money and will be the card issuer for eToro&apos;s forthcoming debit card. Commenting on the acquisition, co-founder and CEO of eToro, Yoni Assia said, &apos;We are proud to announce the acquisition ...The post eToro Announces Acquisition to Support Debit Card Launch appeared first on The Daily Hodl.",POSITIVE,없음,BUSINESS | TRADING,,0,0,The Daily Hodl,https://dailyhodl.com/2020/07/30/etoro-announces-acquisition-to-support-debit-card-launch/,https://images.cryptocompare.com/news/dailyhodl/cs0e00V0cs0.png
13261225,https://dailyhodl.com/?p=105172,1596146703,"Despite Surge, DeFi Market Remains Smaller Than XRP and Bitcoin Cash: Messari Researcher","The decentralized finance (DeFi) industry is experiencing massive growth, with the total value of funds locked in DeFi protocols quadrupling in just three months. Despite this, Messari analyst Ryan Watkins points out that the DeFi market is still smaller than XRP and Bitcoin (BCH), two of the leading cryptocurrencies. In a series of tweets, Watkins ...The post Despite Surge, DeFi Market Remains Smaller Than XRP and Bitcoin Cash: Messari Researcher appeared first on The Daily Hodl.",NEUTRAL,BCH | XRP,ALTCOIN | BCH | BLOCKCHAIN | MARKET | XRP,,0,0,The Daily Hodl,https://dailyhodl.com/2020/07/30/despite-surge-defi-market-remains-smaller-than-xrp-and-bitcoin-cash-messari-researcher/,https://images.cryptocompare.com/news/dailyhodl/efM30$Evw40.jpeg
13348904,https://cointelegraph.com/news/hackers-have-been-using-dogecoin-to-deploy-malware-for-6-months-no-one-noticed,1596146400,Hackers Have Been Using Dogecoin to Deploy Malware for 6 Months & No One Noticed,Researchers at Intezer discovered a new malware that relies on the Dogecoin blockchain network to deploy the attack against cloud servers.,NEGATIVE,없음,ALTCOIN | BLOCKCHAIN | DOGE | TECHNOLOGY,,0,0,CoinTelegraph,https://cointelegraph.com/news/hackers-have-been-using-dogecoin-to-deploy-malware-for-6-months-no-one-noticed,https://images.cryptocompare.com/news/cointelegraph/cj0Op$gwlKy.jpeg
13395551,https://decrypt.co/?p=37281,1596145565,"US GDP takes historic hit in Q2 as Bitcoin, crypto markets rise","US GDP dropped a mammoth 32.9% in Q2, sharply contrasting with a cryptocurrency market that grew over the same timeframe.",NEUTRAL,없음,BTC | BUSINESS | MARKET,,0,0,Decrypt,https://decrypt.co/37281/us-gdp-takes-historic-hit-bitcoin-crypto-markets-rise,https://images.cryptocompare.com/news/decrypt/dy09xboica2.jpeg
13348905,https://cointelegraph.com/news/overstocks-blockchain-ventures-booming-in-q2,1596145560,Overstock's Blockchain Ventures Booming in Q2,Recent second quarter financial reports show big growth for Overstock — the same quarter the company gave its security token to investors as a dividend.,POSITIVE,없음,BLOCKCHAIN | BUSINESS | ICO,,0,0,CoinTelegraph,https://cointelegraph.com/news/overstocks-blockchain-ventures-booming-in-q2,https://images.cryptocompare.com/news/cointelegraph/dhI0p0jj60c.jpeg
13408055,https://cryptopotato.com/?p=64037,1596145044,45% In 10 Days: Ethereum (ETH) Breaks To A New Yearly High,"Ethereum surged to a new yearly high, touching $240 on some exchanges. This happens on the cryptocurrency&apos;s 5th birthday. The post 45% In 10 Days: Ethereum (ETH) Breaks To A New Yearly High appeared first on CryptoPotato.",POSITIVE,ETH,ETH,,0,0,Crypto Potato,https://cryptopotato.com/45-in-10-days-ethereum-eth-breaks-to-a-new-yearly-high/,https://images.cryptocompare.com/news/cryptopotato/aQ0c02000g0.jpeg
13348906,https://cointelegraph.com/news/the-future-of-crypto-mining-is-all-about-computing-power-says-rrmine-global-ceo,1596144600,"The Future of Crypto Mining is All About Computing Power, Says RRMine Global CEO","Crypto mining&apos;s future will become more tech oriented, says CEO of RRMine global.",POSITIVE,없음,BTC | MINING,,0,0,CoinTelegraph,https://cointelegraph.com/news/the-future-of-crypto-mining-is-all-about-computing-power-says-rrmine-global-ceo,https://images.cryptocompare.com/news/cointelegraph/dNxDI1Ew890.png
13484593,https://cryptobriefing.com/?p=65623,1596143879,"Chainlink Gunning for All-Time Highs, Stiff Resistance Ahead","Chainlink is ready to resume its uptrend after suffering a two-week decline that gutted LINK prices by 28%. The charts show that Chainlink is gunning for all-time highs, but there&apos;s...",POSITIVE,LINK,LINK | MARKET,,0,0,Crypto Briefing,https://cryptobriefing.com/chainlink-gunning-for-all-time-highs-stiff-resistance-ahead/,https://images.cryptocompare.com/news/cryptobriefing/egM4f01MAb1.jpeg
13395552,https://decrypt.co/?p=37270,1596143170,Ethereum mining rewards hit all-time high. Here’s why it matters,Ethereum miners are earning more from ETH fees than ever before. Could the increased activity on the network mean another price jump is around the corner?,POSITIVE,ETH,ETH | MINING | TRADING,,0,0,Decrypt,https://decrypt.co/37270/ethereum-mining-rewards-all-time-high-why,https://images.cryptocompare.com/news/decrypt/8lWqamkCFxF.jpeg
13348907,https://cointelegraph.com/news/this-coins-supply-goes-down-as-the-price-rises,1596142860,This Coin’s Supply Goes Down as the Price Rises,"This crypto exhibits no correlation with Bitcoin; it was designed to behave differently from every other currency — crypto or fiat, with a money supply that expands or contracts depending on demand.",POSITIVE,없음,BTC | FIAT | TRADING,,0,0,CoinTelegraph,https://cointelegraph.com/news/this-coins-supply-goes-down-as-the-price-rises,https://images.cryptocompare.com/news/cointelegraph/8pw7dr9eABi.jpeg
13348908,https://cointelegraph.com/news/aave-lend-staking-proposal-could-extend-defi-tokens-600-rally,1596141600,Aave (LEND) Staking Proposal Could Extend DeFi Token’s 600% Rally,Aave&apos;s LEND token continues to rally after DeFi protocol introduced staking rewards in its Aavenomics proposal.,POSITIVE,없음,ALTCOIN | BLOCKCHAIN | ICO | MARKET | TRADING,,0,0,CoinTelegraph,https://cointelegraph.com/news/aave-lend-staking-proposal-could-extend-defi-tokens-600-rally,https://images.cryptocompare.com/news/cointelegraph/etMAE1m0M5w.jpeg
13386662,https://zycrypto.com/?p=44486,1596141469,Terrorist Suspects In Ukraine Detained After Threatening To Bomb City If Not Paid 50 BTC,"Two 60-year old suspects in Ukraine have been detained by the law-enforcement authority, according to a report by the Security Service of Ukraine. The suspects had earlier demanded that 50 BTC be sent to their wallet address or they would blow up strategic locations in Ukraine&apos;s capital city of Kyiv. &apos;In particular, the attackers demanded ...",NEGATIVE,BTC,BTC,,0,0,ZyCrypto,https://zycrypto.com/terrorist-suspects-in-ukraine-detained-after-threatening-to-bomb-city-if-not-paid-50-btc/,https://images.cryptocompare.com/news/zycrypto/8PUugd$Eb0Y.jpeg
13395553,https://decrypt.co/?p=37262,1596141366,"Zcash maker teams with Gemini, Binance for new crypto education program","Electric Coin Company has launched Crypto in Context, a new education program designed to help spread the word of crypto globally.",POSITIVE,없음,BUSINESS | EXCHANGE | ZEC | BNB,,0,0,Decrypt,https://decrypt.co/37262/zcash-gemini-binance-crypto-context-education-program,https://images.cryptocompare.com/news/decrypt/9g6gf9s3NOA.jpeg
42384280,0r6Zag11PPDEMKgUXAERxj,1596141098,"Market Wrap: Bitcoin Clings to $11,000 as Ether Futures Top $1B","Bitcoin was little changed at around $11,000 with lower spot volumes as traders eye growth in the market for ether futures.    Bitcoin (BTC) trading around $11,142 as of 20:00 UTC (4 p.m. ET). Slipping 0.90% over the previous 24 hours.  Bitcoin’s 24-hour range: $10,811-$11,348  BTC above 10-day and 50-day moving averages, a bullish signal for market technicians.    Bitcoin was little changed at around $11,000 Thursday as traders digested reports the U.S. economy shrank during the second quarter at the fastest pace on record, and that President Donald Trump is wondering if the Constitutionally mandated November presidential election could be delayed.      Trading was light, with volume of about $113 million on the Coinbase exchange, after a price rally earlier this week led to a surge in volumes.      “Bitcoin’s push has been fueled by the drive towards safe-haven assets,” said Micah Erstling, trader at digital-asset trading firm GSR. “Markets are being driven by ongoing coronavirus concerns as well as U.S.-China trade tensions, which also helps to explain gold’s meteoric rise.”      Gold is up 28% for the year, while bitcoin has gained 53%.      “In the last couple of weeks, the majority of assets are up – stocks, commodities, crypto – so despite fundamental weaknesses, there’s a seemingly positive risk environment,” said Matt Ficke, head of capital markets for cryptocurrency exchange OKCoin.      Read More: Circle Gets $25M From DCG to Drive USDC Mainstream    Ether futures open interest over $1 billion    The second-largest cryptocurrency by market capitalization, ether (ETH), was up Thursday, trading around $334 after climbing 3.5% in 24 hours as of 20:00 UTC (4:00 p.m. ET).      “Ethereum has been propelled by a new wave of DeFi and stablecoin activity,” said GSR’s Erstling. “The bullish sentiment has been great for market involvement but it has come at a cost as ETH fees are at an all-time high, highlighting how scalability issues are still present,” he added.      Read More: Ether Addresses in Profit Have Soared 132% in a Year      Open interest, or the number of outstanding contracts, in ether futures is at a 2020 high, at over $1.1 billion, according to data aggregator Skew.      The cryptocurrency exchange OKEx is the top ether futures platform, with $307 million in open interest, followed by Huobi at $253 million, BitMEX at $208 million, Binance at $118 million and FTX at $117 million.    Other markets    Digital assets on the CoinDesk 20 are mixed Thursday. Notable winners as of 20:00 UTC (4:00 p.m. ET):    iota (IOTA) + 4.5%  chainlink (LINK) + 4%  litecoin (LTC) + 3%    Read More: Dharma Adds Uniswap Trading in Bid to Become ‘the Robinhood of DeFi’      Notable losers as of 20:00 UTC (4:00 p.m. ET):    zcash (ZEC) - 2.4%  dogecoin (DOGE) - 0.80%  dash (DASH) - 0.70%    Read More: A Crypto Derivatives Exchange Is Getting a Nasdaq Listing in Q3      Equities:    Asia’s Nikkei 225 closed in the red 0.26% as new coronavirus infections passed 1,000 in Tokyo and the government cut back operating hours for bars and restaurants.  Europe’s FTSE 100 ended the day down 2.31% as the German economy reported a double-digit drop amid rising coronavirus cases.  The United States’ S&P 500 slipped 0.40% as gross domestic product dropped a record 32.9%. in the second quarter.    Read More: Sleepy Fed Meeting Belies Tense Economic Reality That May Buoy Bitcoin      Commodities:    Gold is in the red 0.75% at $1,955 as of press time.  Oil is down 2.8%. Price per barrel of West Texas Intermediate crude: $40.17    Read More: Privacy-Focused Smart Contract Forges Ahead After Settlement      Treasurys:    U.S. Treasury bonds all slipped Thursday. Yields, which move in the opposite direction as price, were down most on the two-year, in the red 12.5%.    Read More: Bank of England Building Network to Support a Potential Digital Pound",NEUTRAL,BTC | DOGE,BTC | DOGE | EXCHANGE | MARKET | TRADING,Daniel Cawrey,0,0,CoinDesk,https://coindesk.com/markets/2020/07/30/market-wrap-bitcoin-clings-to-11000-as-ether-futures-top-1b,https://cdn.sanity.io/images/s3y3vcno/production/c4057807e46e1ccb3228ddf5a0e0fb54f4c31c17-2560x1563.jpg?w=300&h=300&fit=crop
13279065,https://eng.ambcrypto.com/?p=55559,1596141040,Ethereum 2.0's complexity will not dent security prospects,"Ethereum&apos;s transition to Proof-of-Stake has been a widely speculated and anticipated event for Ethereum. Despite the delays and the lack of a clear deadline for when ETH 2.0 will launch, Ethereum has The post Ethereum 2.0&apos;s complexity will not dent security prospects appeared first on AMBCrypto.",POSITIVE,ETH,ETH,,0,0,AMB Crypto,https://eng.ambcrypto.com/ethereum-2-0s-complexity-will-not-dent-security-prospects,https://images.cryptocompare.com/news/ambcrypto/96ndNHaqgiC.jpeg
13579156,https://www.cryptopolitan.com/?p=49155,1596139594,Zebpay Bitcoin OTC set to launch to satisfy crypto demand in India,"Zebpay Bitcoin OTC (Over the Counter) desk is all set to launch towards satisfying crypto demands in India among traders and arbitrageurs. According to the Indian exchange firm, Zebpay Bitcoin OTC offers deeper liquidity and private, more personalized service to institutions and individuals with large orders that might be hard to fill on an open ...",POSITIVE,없음,BTC | EXCHANGE,,0,0,Cryptopolitan,https://www.cryptopolitan.com/zebpay-bitcoin-otc-to-launch/,https://images.cryptocompare.com/news/cryptopolitan/c4$y1hSA3QI.jpeg
13408056,https://cryptopotato.com/?p=64030,1596139506,AMPL Completes 75% 3-Day Plunge: What Does Negative Rebase Mean?,"Ampleforth (AMPL) saw its price tank by more than 75% in the past three days alone. With it being below $1, holders are now in the territory of negative rebases. The post AMPL Completes 75% 3-Day Plunge: What Does Negative Rebase Mean? appeared first on CryptoPotato.",NEGATIVE,없음,TRADING,,0,0,Crypto Potato,https://cryptopotato.com/ampl-completes-75-3-day-plunge-what-does-negative-rebase-mean/,https://images.cryptocompare.com/news/cryptopotato/aI000000000.jpeg
42384274,0r6Zag11PPDEMKgUXAERov,1596138887,Social Media Companies Are 'Too Big to Fail',"Jenny Leung is a blockchain and fintech attorney at Blakemore Fallon PLLC dba Ketsal.      This year, 2020, is the year social media institutions became systemically important.      This term, “systemically important,” typically describes a financial institution whose failure poses a significant threat to the economy and is thus ""too big to fail."" Systemically important financial institutions (“SIFI”) have been subject to additional regulatory scrutiny.    If certain social media institutions were to fail today, their failure would pose a significant threat to society due to their outsized influence, size, reach, society’s co-dependence on them and “their power to shape the interpretation of public events.”https://www.whitehouse.gov/presidential-actions/executive-order-preventing-online-censorship/ These systemically important social media institutions (“SISMI”) have become so influential and embedded in society their failure may cause the economy to suffer.    But that doesn’t necessarily mean the solution is as simple as building decentralized alternatives, as some technologists have suggested, or pursuing antitrust action, as outlined in Wednesday’s congressional investigation into Big Tech’s anti-competitive behavior. The threats go much deeper than that.      See also: Michael Casey – CoinDesk’s Twitter Hack Proved the Media Can’t Rely on Web 2.0      Recent phenomena highlighted SISMI’s helpful influence during the COVID-19 pandemic: the ongoing Black Lives Matter movement and the Twitter hack of July 2020. Society now depends on SISMIs to keep businesses and influencers afloat, to support political movements, to document protests and police brutality, to livestream everything from yoga classes to conferences, to provide live tornado warnings, to break news, to propagate political rallies, to expose violent rioters, to hold police accountable and to render a verdict as to what company, product or person should be “canceled.”      During the pandemic, the reliance on SISMIs has grown as businesses shut their doors, switched to online delivery and online streaming and requested virtual donations to keep them alive. As New York City found itself paralyzed under Pause and Curfew, I found myself turning to Instagram and Facebook for updates when neither Google Maps' opening hours nor Seamless were reliable. I was glued to the Citizen App for live updates as the protests marched through my neighborhood and past my doorstep.      At the same time, we've seen violent crimes livestreamed, genocide incited, non-consensual harvesting of personal data for political advertising, doxing of viral subjects, financial scams and, more recently, the hacking of prominent social media accounts – all through the very same platforms.    Despite its growing importance, ‘social media inclusion’ doesn’t quite have the ring of ‘financial inclusion.’    As confirmed by Twitter itself, hackers took control of 45 accounts, including those of Barack Obama, Joe Biden, Elon Musk, Kim Kardashian and Vitalik Buterin, and sent tweets that tricked followers into sending bitcoin to the hacker’s bitcoin address. While only 12.87 bitcoin (approximately $142,000 at press time) had been sent, the real dangers lie in the fact that (1) hackers gained site-wide admin access and tweeted publicly from prominent accounts with global reach and (2) the hackers were able to access and download potentially sensitive unencrypted direct messages.      See also: Brenna Smith – Last Week’s Big Twitter Hack Was Years in the Making      These events highlight society’s increasing dependency on mega-platforms for matters ranging from business to finance, justice and politics. We may approach a situation where a political figure has a voice across every social media platform but their opponent may have been banned on the same influential platforms, with no formal appeal process available. As Zoomers, raised on social media, begin to reach voting age, the banning or censoring of political figures and public events may become a real issue as SISMIs engage in more active censorship and control.      Despite its growing importance, “social media inclusion” doesn’t quite have the ring of “financial inclusion.”      Bitcoin and decentralized finance applications have been gaining traction on the principle that everyone in the world deserves access to financial services. It may only be a matter of time before an unstoppable, decentralized and workable social media platform provides everyone with the ability to have a voice.    What next?    If social media institutions have become systemically important, governments, regulators and political leaders should recognize how tightly intertwined SISMIs have become with society and the economy and acknowledge the risks that come with this marriage.      Some pundits noted the Twitter hackers could have started a war between world leaders, incited violence, manipulated the markets or created social panic. The latter actually occurred in 2013 after hackers tweeted from the account of the Associated Press, saying the White House had been hit by two explosions and that President Obama was injured, sending the U.S. stock market into freefall. We almost saw history repeat when the Twitter hackers actually hijacked Barack Obama’s Twitter account earlier this month.      See also: Nathaniel Whittemore – No, the Twitter Hack Wasn’t About Bitcoin      Are we ready for a world economy dominated by SISMIs? Imagine a stock or crypto market driven by viral posts and TikTok memes, celebrities and corporate personalities, “coin of the day” posts or trends rooted in irrational exuberance.      Once SISMIs pose a bigger threat to the economy than SIFIs (whether directly through markets or indirectly through civil unrest), it may already be too late to be cautious about their influence. While Wednesday’s congressional antitrust hearing was a good start, the issue of antitrust is only one item in a growing list of problems. Whether the solution is more regulation, breaking up SISMIs, making social media decentralized or treating SISMIs like SIFIs is a conversation for another day.      I simply propose we open our eyes to their economic and societal influence.",NEUTRAL,없음,BLOCKCHAIN | BTC | BUSINESS | MARKET | REGULATION,Jenny Leung,0,0,CoinDesk,https://coindesk.com/business/2020/07/30/social-media-companies-are-too-big-to-fail,https://cdn.sanity.io/images/s3y3vcno/production/8c160216ee277c7fa371b4f1c9bdd11807d33535-2400x1600.jpg?w=300&h=300&fit=crop
13432942,https://news.bitcoin.com/?p=402810,1596136533,Bitcoin Exchange Reserves Drop to a 12-Month Low Fueling Bullish Optimism,"The number of bitcoin held on exchanges has touched a 12-month low, as bitcoin exchange balances have reached levels not seen since June 2019. According to onchain statistics, there&apos;s more than 2.6 million BTC held on global trading platforms worldwide. Data from a number of sources show that the bitcoin (BTC) held on exchanges has ...The post Bitcoin Exchange Reserves Drop to a 12-Month Low Fueling Bullish Optimism appeared first on Bitcoin News.",POSITIVE,BTC,BTC | EXCHANGE | TRADING,,0,0,Bitcoin.com,https://news.bitcoin.com/bitcoin-exchange-reserves-drop-to-a-12-month-low-fueling-bullish-optimism/,https://images.cryptocompare.com/news/bitcoin.com/fzRd33Mw830.jpeg
13261226,https://dailyhodl.com/?p=105170,1596135608,"Pantera Bitcoin Fund Has Soared 15,140% Since Inception, Dan Morehead Predicts DeFi Movement Just Getting Started","Crypto-focused venture firm Pantera Capital is bringing in big returns for its investors this year, largely thanks to the impressive growth of decentralized finance (DeFi). The Pantera Digital Asset Fund is up 86% on the year as of July 27, according to Dan Morehead, the company&apos;s CEO and co-chief investment officer, and Joey Krug, their ...The post Pantera Bitcoin Fund Has Soared 15,140% Since Inception, Dan Morehead Predicts DeFi Movement Just Getting Started appeared first on The Daily Hodl.",POSITIVE,없음,BTC | BUSINESS,,0,0,The Daily Hodl,https://dailyhodl.com/2020/07/30/pantera-bitcoin-fund-has-soared-15140-since-inception-dan-morehead-predicts-defi-movement-just-getting-started/,https://images.cryptocompare.com/news/dailyhodl/a9co169w801.jpeg
