뉴스ID,뉴스GUID,일자(UTC timestamp),뉴스제목,본문,SENTIMENT,주요코인,카테고리,작성자,추천수,비추천수,출처,뉴스URL,이미지URL
13486488,https://cryptobriefing.com/?p=40336,1561469089,TRON Price Analysis TRX / USD: $20M Buyback Bull Move,"TRON has an increasingly bullish short-term outlook, with the cryptocurrency testing towards the current 2019 trading high The four-hour time frame continues to show a valid inverted head and shoulders pattern The daily time frame shows sizeable amounts of bullish MACD price divergence Fundamental Analysis TRON has gained momentum after the project announced a $20 ...The post TRON Price Analysis TRX / USD: $20M Buyback Bull Move appeared first on Crypto Briefing.",POSITIVE,TRX,MARKET | TRADING | TRX,,0,0,Crypto Briefing,https://cryptobriefing.com/tron-price-analysis-trx-20m-buyback/,https://images.cryptocompare.com/news/cryptobriefing/8eob8ooMq41.jpeg
13467526,https://www.cryptonewsz.com/?p=28008,1561468786,Ethereum Price Analysis: Ethereum Keeps Surging Higher By Trading Above $310,"Ethereum may cross $320 mark soon Ethereum remains afloat above $310 as Bitcoin prices surge above $11,000 Ethereum has been following the footsteps of Bitcoin and surging exponentially trading above $310 continuously. The second half of the year will be more lucrative for the investors as the firm has planned global events to increase ETH&apos;s …The post Ethereum Price Analysis: Ethereum Keeps Surging Higher By Trading Above $310 appeared first on CryptoNewsZ.",POSITIVE,ETH,BTC | BUSINESS | ETH | MARKET | TRADING,,0,0,CryptoNewsZ,https://www.cryptonewsz.com/ethereum-price-analysis-ethereum-keeps-surging-higher-by-trading-above-310/28008/,https://images.cryptocompare.com/news/cryptonewsz/92ib69189A0.jpeg
13585135,https://www.cryptopolitan.com/?p=17720,1561468675,"Amidst a sea of Libra critics, Swiss Central Bank is feeling confident","According to an announcement of a Swiss central banker, Facebook&apos;s new Libra project falls within the ramifications of the local regulatory framework, and therefore will not face any issues. After suffering nearly a week of ridicule and legal uncertainty from pretty much all of the world&apos;s financial regulators, this comment by the banker is like medicine on an open wound for Facebook. The only other vocal supporter right now is the Bank of England. The Swiss banker, Thomas Moser mentioned that the social media giant made it very clear that it will comply with the local rules. Their previous business",POSITIVE,없음,BUSINESS | FIAT | REGULATION,,0,0,Cryptopolitan,https://www.cryptopolitan.com/amidst-a-sea-of-libra-critics-swiss-central-bank-is-feeling-confident/,https://images.cryptocompare.com/news/cryptopolitan/9E8gh18w8g0.jpeg
13486489,https://cryptobriefing.com/?p=40326,1561468573,VeChain Price Analysis VET / USD: Rising Star,"VeChain has a bullish short-term trading bias, with the cryptocurrency advancing to a fresh 2019 price high The four-hour time frame shows that a strong bullish breakout has occurred The daily time frame is showing that multiple bullish patterns have been triggered Fundamental Analysis VeChain has surged after the project announced the launch of the ...The post VeChain Price Analysis VET / USD: Rising Star appeared first on Crypto Briefing.",POSITIVE,VET,MARKET | TRADING | VET,,0,0,Crypto Briefing,https://cryptobriefing.com/vechain-price-analysis-vet-rising-star/,https://images.cryptocompare.com/news/cryptobriefing/8KySA24AE54.jpeg
13358969,https://cointelegraph.com/news/french-central-bank-facebooks-libra-may-need-banking-license,1561468320,French Central Bank: Facebook’s Libra May Need Banking License,"Facebook&apos;s Libra must comply with anti-money laundering regulation and needs banking licenses, according to the Bank of France Governor",NEUTRAL,없음,FIAT | REGULATION,,0,0,CoinTelegraph,https://cointelegraph.com/news/french-central-bank-facebooks-libra-may-need-banking-license,https://images.cryptocompare.com/news/cointelegraph/d2kz8gAoh2g.png
13264481,https://dailyhodl.com/?p=55768,1561467751,Trump Insider and Conservative Economist Says Facebook Coin Is ‘A Good Thing’,"At least one Trump White House insider is voicing support for Facebook&apos;s new Libra cryptocurrency. Stephen Moore, a fellow at the Heritage Foundation, a conservative think tank, says he thinks Libra is a good thing. Moore, President Donald Trump&apos;s controversial and ultimately withdrawn pick for one of the vacant seats on the Federal Reserve Board ...The post Trump Insider and Conservative Economist Says Facebook Coin Is &apos;A Good Thing&apos; appeared first on The Daily Hodl.",POSITIVE,없음,ALTCOIN | FIAT | REGULATION,,0,0,The Daily Hodl,https://dailyhodl.com/2019/06/25/trump-insider-and-conservative-economist-says-facebook-coin-is-a-good-thing/,https://images.cryptocompare.com/news/dailyhodl/c0v5gCB4x00.jpeg
13285842,https://ambcrypto.com/?p=98616,1561467637,"Coin Metrics data reveals inaccuracies in Kik’s claim of being as dominant as BTC, ETH blockchains","Upon investigating Kik&apos;s claims in response to SEC&apos;s lawsuit filed earlier this month, CoinMetric data reported inconsistencies in the on-chain activity and adoption rate of its native token, Kin. In a study dubbed, &apos;An Analysis of Kin&apos;s On-Chain Activity,&apos; the crypto-asset elaborated on the two assertions made by Kik in its letter to the US ...The post Coin Metrics data reveals inaccuracies in Kik&apos;s claim of being as dominant as BTC, ETH blockchains appeared first on AMBCrypto.",NEGATIVE,BTC | ETH,ALTCOIN | BTC | ETH | ICO | REGULATION,,0,0,AMB Crypto,https://ambcrypto.com/coin-metrics-data-reveals-inaccuracies-in-kiks-claim-of-being-as-dominant-as-btc-eth-blockchains/,https://images.cryptocompare.com/news/ambcrypto/c4000000024.jpeg
13473437,https://www.trustnodes.com/?p=24339,1561467388,Libra Increasing Interest in Bitcoin Google Searches Suggest,"A spike in Google searches for Libra has led to an even bigger spike for bitcoin in USA and across the globe. After Libra&apos;s whitepaper launched last week, searches for...The post Libra Increasing Interest in Bitcoin Google Searches Suggest appeared first on Trustnodes.",POSITIVE,없음,BTC,,0,0,TrustNodes,https://www.trustnodes.com/2019/06/25/libra-increasing-interest-in-bitcoin-google-searches-suggest,https://images.cryptocompare.com/news/trustnodes/8Was6y5BCAF.jpeg
13467527,https://www.cryptonewsz.com/?p=27994,1561467225,Ripple Price Analysis: XRP Eyes $0.47 Price Mark to Strike Higher Price Spike,"Yesterday, XRP went as high as $0.47 but has been ranging between $0.46 to $0.47 today In the 7-hour chart of XRP, the MACD for XRP appears bullish Today morning&apos;s price plunge has trimmed yesterday&apos;s price gains made by XRP. Yesterday, XRP marked its closing price at $0.4700, and today, after the price fall, XRP …The post Ripple Price Analysis: XRP Eyes $0.47 Price Mark to Strike Higher Price Spike appeared first on CryptoNewsZ.",POSITIVE,XRP,MARKET | TRADING | XRP,,0,0,CryptoNewsZ,https://www.cryptonewsz.com/ripple-price-analysis-xrp-eyes-0-47-price-mark-to-strike-higher-price-spike/27994/,https://images.cryptocompare.com/news/cryptonewsz/81At51jk410.jpeg
13467528,https://www.cryptonewsz.com/?p=27995,1561466867,Verge Price Analysis: Verge Showing Trends Of Bearish Nature,"The haters are going to hate, but the followers will keep following. With a drop in the market ranking, the haters of Verge were tweeting the disregards, but one thing they have bygone is the reliability and security of Verge platform. Verge is not like any other currency which is affected by the small dips …The post Verge Price Analysis: Verge Showing Trends Of Bearish Nature appeared first on CryptoNewsZ.",NEGATIVE,없음,MARKET | TRADING,,0,0,CryptoNewsZ,https://www.cryptonewsz.com/verge-price-analysis-verge-showing-trends-of-bearish-nature/27995/,https://images.cryptocompare.com/news/cryptonewsz/8x0Aiwa51mM.png
13467529,https://www.cryptonewsz.com/?p=27991,1561466457,Celgene Deal Setback Wipes Out $6 Billion From Bristol-Myers Squibb,"When it comes to the biggest acquisitions that are valued at tens of billions of dollars, there is almost always a bit of trouble in completing the whole thing. First of all, there is the matter of the two company&apos;s shareholders who might or might not want the deal to happen, while on the other …The post Celgene Deal Setback Wipes Out $6 Billion From Bristol-Myers Squibb appeared first on CryptoNewsZ.",NEGATIVE,없음,OTHER,,0,0,CryptoNewsZ,https://www.cryptonewsz.com/celgene-deal-setback-wipes-out-6-billion-from-bristol-myers-squibb/27991/,https://images.cryptocompare.com/news/cryptonewsz/e942g080000.png
13585136,https://www.cryptopolitan.com/?p=17694,1561466089,MOBU Exposed – More Scam in Crypto Space?,"Unlawful Use of Name Late June 2018, the complexity of a pernicious case of identity theft came to my attention on reading a complaint sounded off by Yaroslav Belkin, CEO of Belkin Marketing, ex-CMO of NewsBTC Media Group, Head of Marketing at Cointelegraph Events, and an expert at ICOBench. The complaint stems from the use of his name as ADVISOR in the MOBU ICO Whitepaper and the MOBU ICO website, without his due knowledge and permission. In effect, this is blatant theft of a man&apos;s name, identity and reputation attached to the name. Then, I had communicated with Mr. Belkin",NEGATIVE,ICO,ICO | TOKEN SALE,,0,0,Cryptopolitan,https://www.cryptopolitan.com/mobu-exposed-more-scam-in-crypto-space/,https://images.cryptocompare.com/news/cryptopolitan/80000000000.jpeg
13467530,https://www.cryptonewsz.com/?p=27979,1561466004,"Ripple vs Bitcoin: BTC Again Crosses $11000, While XRP Struggles to Touch $0.47","Bitcoin Shows an uptrend, while XRP is moving downward since today morning BTC maintains above $11000, meanwhile, XRP struggles to cross $0.47 In its 1 day-chart, XRP has traced a decreasing price trend, contrary to Bitcoin, which has continued to trade upwards. Yesterday, Ripple started its day with a sharp price fall from $0.4670 to …The post Ripple vs Bitcoin: BTC Again Crosses $11000, While XRP Struggles to Touch $0.47 appeared first on CryptoNewsZ.",NEUTRAL,BTC | XRP,BTC | TRADING | XRP,,0,0,CryptoNewsZ,https://www.cryptonewsz.com/ripple-vs-bitcoin-btc-again-crosses-11000/27979/,https://images.cryptocompare.com/news/cryptonewsz/8A0O01hw8ww.jpeg
13467531,https://www.cryptonewsz.com/?p=27981,1561465876,Bitcoin Cash Price Analysis: Bitcoin Cash (BCH) Progressed Almost 200% In Two Quarters,"The market is about to complete almost two quarters. Bitcoin cash opened at $162 at the beginning of the year and is now dealing at $478. In the past six months, BCH has shown enormous improvement. The coin is gaining popularity and is expected to grow more in terms of price on the chart. Based …The post Bitcoin Cash Price Analysis: Bitcoin Cash (BCH) Progressed Almost 200% In Two Quarters appeared first on CryptoNewsZ.",POSITIVE,BCH,BCH | MARKET | TRADING,,0,0,CryptoNewsZ,https://www.cryptonewsz.com/bitcoin-cash-price-analysis-bitcoin-cash-bch-progressed-almost-200-in-two-quarters/27981/,https://images.cryptocompare.com/news/cryptonewsz/cA498000000.jpeg
13285843,https://ambcrypto.com/?p=98675,1561465812,"Facebook’s Libra is the ‘AOL moment’ and not the only contributor to Bitcoin’s surge, claims venture capitalist","Bitcoin neared a 16-month high on 24th June as it continued to post significant gains. A lot has been speculated about the impressive rally posted by the king coin. Facebook&apos;s ambitious cryptocurrency and blockchain project may have prompted Bitcoin&apos;s price to surge higher. However, it is not the sole reason for the pump, and neither ...The post Facebook&apos;s Libra is the &apos;AOL moment&apos; and not the only contributor to Bitcoin&apos;s surge, claims venture capitalist appeared first on AMBCrypto.",POSITIVE,없음,BLOCKCHAIN | BTC | TRADING,,0,0,AMB Crypto,https://ambcrypto.com/facebooks-libra-is-the-aol-moment-and-not-the-only-contributor-to-bitcoins-surge-claims-venture-capitalist/,https://images.cryptocompare.com/news/ambcrypto/8ikaAsMN52M.jpeg
13467532,https://www.cryptonewsz.com/?p=27973,1561464569,Seems Like The Party Time Is Over For The Taiwanese Crypto Mining Suppliers!,"The last year&apos;s bear market is still proving to be quite expensive. The dip in the crypto mining hardware demands due to the bearish market last year is causing a great deal of discomfort for the businesses that deal with manufacturing of the crypto mining hardware. As desperate measures, these companies are now seeking for …The post Seems Like The Party Time Is Over For The Taiwanese Crypto Mining Suppliers! appeared first on CryptoNewsZ.",NEGATIVE,없음,MARKET | MINING | TECHNOLOGY | TRADING,,0,0,CryptoNewsZ,https://www.cryptonewsz.com/seems-like-the-party-time-is-over-for-the-taiwanese-crypto-mining-suppliers/27973/,https://images.cryptocompare.com/news/cryptonewsz/dAOcO6cO60A.jpeg
13467533,https://www.cryptonewsz.com/?p=27970,1561464233,Synthetix Platform Loses 37 Million Of Synthetic Ether In Oracle Attack,"Ethereum based issuer of synthetic assets, Synthetix suffered a huge Oracle attack, which leads to a loss of over 37 million synthetic Ethereum (sETH). The actual loss in traditional terms hasn&apos;t been updated yet, as the token has poor liquidity in the market. The news of the attack was given out by co-founder and CEO, …The post Synthetix Platform Loses 37 Million Of Synthetic Ether In Oracle Attack appeared first on CryptoNewsZ.",NEGATIVE,ETH,BLOCKCHAIN | ETH | ICO | MARKET,,0,0,CryptoNewsZ,https://www.cryptonewsz.com/synthetix-platform-loses-37-million-of-synthetic-ether-in-oracle-attack/27970/,https://images.cryptocompare.com/news/cryptonewsz/98gigbc6282.jpeg
13450672,https://bitcoinist.com/?p=111483,1561464056,Bitcoin On-Chain Metrics That Every Trader Should Know,"Making money with Bitcoin is easy, right? Just HODL for long enough and reap the rewards.. But what if you want to do more? Trading requires a greater understanding of the market and its various metrics, but sometimes analysts just seem to be speaking an alien language. So how are you supposed to know your CV-DD from your NVT Cap? Thankfully, crypto-analyst Adam Taché compiled some handy guides, which we&apos;ll go through in this, and itsRead MoreThe post Bitcoin On-Chain Metrics That Every Trader Should Know appeared first on Bitcoinist.com.",POSITIVE,없음,BTC | MARKET | TRADING,,0,0,Bitcoinist,https://bitcoinist.com/bitcoin-on-chain-metrics-that-every-trader-should-know/,https://images.cryptocompare.com/news/bitcoinist/c1yMo7000g0.jpeg
13285844,https://ambcrypto.com/?p=98632,1561464021,"Gemini outperforms Tether; stablecoins struggle as Libra’s shadow looms, finds Fundstrat report","Last week might have been the last phase of the &apos;Gemini&apos; as Zodiac signs go. However, the twin-heads have surprisingly outperformed their stablecoin equivalent, Tether [USDT] as Libra scaled the market. With bullish sentiment emanating from Menlo Park, pushing Bitcoin [BTC] into fifth-heaven, stablecoins on the whole faltered. According to a recent Weekly Performance Analysis ...The post Gemini outperforms Tether; stablecoins struggle as Libra&apos;s shadow looms, finds Fundstrat report appeared first on AMBCrypto.",POSITIVE,BTC | USDT,ALTCOIN | BTC | MARKET | USDT | USDC,,0,0,AMB Crypto,https://ambcrypto.com/gemini-outperforms-tether-stablecoins-struggle-as-libras-shadow-looms-finds-fundstrat-report/,https://images.cryptocompare.com/news/ambcrypto/9O4o220i200.jpeg
13285846,https://ambcrypto.com/?p=98700,1561464019,Bitcoin IRA teams up with BitGo to launch crypto retirement accounts insured for $100 million,"Bitcoin IRA, a digital asset IRA firm, today announced the launch of its next generation of investment retirement account [IRA] services for crypto-assets. A division of Bitcoin IRA has collaborated with BitGo Trust, a custodian purpose-built for digital assets, which will essentially cover new Bitcoin IRA accounts from theft or loss of cryptographic keys. With its latest collaboration, BitGo will ...The post Bitcoin IRA teams up with BitGo to launch crypto retirement accounts insured for $100 million appeared first on AMBCrypto.",POSITIVE,없음,BTC,,0,0,AMB Crypto,https://ambcrypto.com/bitcoin-ira-teams-up-with-bitgo-to-launch-crypto-retirement-accounts-insured-for-100-million/,https://images.cryptocompare.com/news/ambcrypto/8i4VX01vH0l.jpeg
42382204,0r6Zag11PPDEMKgUX9qtc5,1561464012,Swiss Central Banker 'Relaxed' About Facebook's Libra Crypto,"A Swiss central banker has suggested that Facebook's recently announced cryptocurrency project, Libra, is not ruffling any feathers with the regulator.  As reported by Reuters on Tuesday, Thomas Moser, alternate member of the governing board at the Swiss National Bank, said Facebook has indicated it is ""willing to play according to the rules"" and has been in touch with regulators over the Libra project.  As such, “I think it’s an interesting development and I’m pretty relaxed about it,” said Moser, speaking at the Crypto Valley Conference in Zug, Switzerland.  The comments will likely be welcome at Facebook, which has set up the cryptocurrency's guiding Libra Association in the country, and is also facing calls for regulatory scrutiny over the effort in other jurisdictions.  Also quoted in the Reuters report, Domenico Gammaldi, head of market and payment system oversight at Italy’s central bank, said more information is need on on the Libra project and that a mere white paper is not sufficient.  “I’ve read more than 200 pages of comments, and it’s very strange for me to give a personal opinion on 12 pages in the white paper,” Gammaldi said.  Elsewhere in recent days, France has moved to create a task force within the Group of Seven nations to examine the issues raised by Libra.  Governor of the French central bank Francois Villeroy de Galhau indicated last week that the task force would be led by European Central Bank board member Benoit Coeure and would look at how cryptocurrencies are regulated to avoid money laundering, consumer protection and other potential issues.  In the U.S., the House Financial Services Committee has announced it will host a hearing on Facebook’s cryptocurrency next month, just a day after the Senate Banking Committee holds its own hearing.  Maxine Waters, chair of the House committee called on Facebook to suspend development of the project several times last week. The hearing is scheduled for July 17, and no witness list has yet been released.  “We’ve got to protect our consumers. We just can’t allow [Facebook] to go to Switzerland with all of its associates and begin to compete with the dollar,” Waters reportedly said on Thursday.  In another article from Reuters today, the U.K.'s Financial Conduct Authority (FCA) added to the voices calling for more information on Facebooks plans for crypto payments.  Facebook's Libra could ultimately be important in terms of public policy, said FCA CEO Andrew Bailey, therefore the company should make more information available.  Speaking to the British parliament’s Treasury Select Committee, Bailey warned:  “They are not going to walk through authorisation without that.""  Swiss flag image via Shutterstock",NEUTRAL,없음,FIAT | MARKET | REGULATION,Daniel Palmer,0,0,CoinDesk,https://coindesk.com/markets/2019/06/25/swiss-central-banker-relaxed-about-facebooks-libra-crypto,https://cdn.sanity.io/images/s3y3vcno/production/71783d390b1789d68a3e39a1b1e6da33b61fffc0-1500x1000.jpg?w=300&h=300&fit=crop
13435200,https://news.bitcoin.com/?p=319992,1561463885,Buy Airline Vouchers With BCH From Flightgiftcard,"It&apos;s the season of travel and if you want to surprise someone with a trip, you can now do it using cryptocurrencies like bitcoin cash (BCH). Flightgiftcard.com is a Dutch website that allows you to order airline vouchers and send them to your friends and family with a personal message. Also read: BCH Can Be ...The post Buy Airline Vouchers With BCH From Flightgiftcard appeared first on Bitcoin News.",POSITIVE,BCH,BCH,,0,0,Bitcoin.com,https://news.bitcoin.com/buy-airline-vouchers-with-bch-from-flightgiftcard/,https://images.cryptocompare.com/news/bitcoin.com/cr0360Q2S00.jpeg
13358970,https://cointelegraph.com/news/jpmorgan-will-pilot-jpm-coin-stablecoin-by-end-of-2019-report,1561463640,JPMorgan Will Pilot ‘JPM Coin’ Stablecoin by End of 2019: Report,"The U.S. largest bank, JPMorgan, expects to pilot its own cryptocurrency project JPM Coin around the end of 2019, Bloomberg reports",POSITIVE,없음,BLOCKCHAIN | FIAT,,0,0,CoinTelegraph,https://cointelegraph.com/news/jpmorgan-will-pilot-jpm-coin-stablecoin-by-end-of-2019-report,https://images.cryptocompare.com/news/cointelegraph/c60A0hww00w.png
13467534,https://www.cryptonewsz.com/?p=27960,1561463104,Amazon Patents Drone Surveillance; Will Enable To Have Eyes In The Sky,"Amazon has pretty much taken over the e-commerce industry over the last two decades or so. The company, which started as an online book shop, now sells a plethora of products and is rightly known as &apos;the everything store.&apos; However, it is also important to note that Amazon is not so dominant due to some …The post Amazon Patents Drone Surveillance; Will Enable To Have Eyes In The Sky appeared first on CryptoNewsZ.",NEUTRAL,없음,TECHNOLOGY,,0,0,CryptoNewsZ,https://www.cryptonewsz.com/amazon-patents-drone-surveillance-will-enable-to-have-eyes-in-the-sky/27960/,https://images.cryptocompare.com/news/cryptonewsz/fh0Bg1i4000.png
13231929,https://www.newsbtc.com/?p=387401,1561462809,Who Are ICON P-Reps and Should You Become One?,"Delegated Proof-of-Stake (DPoS) platforms are becoming the new norm in the cryptocurrency space, steadily pushing out their Proof-of-Work (PoW) predecessors. The reasons for that are quite evident. First, DPoS appears to be much more sustainable as a model: instead of relying on the loud, energy-consuming process of mining, it utilizes an algorithm that involves validators...The post Who Are ICON P-Reps and Should You Become One? appeared first on NewsBTC.",POSITIVE,없음,MINING,,0,0,NewsBTC,https://www.newsbtc.com/2019/06/25/who-are-icon-p-reps-and-should-you-become-one/,https://images.cryptocompare.com/news/newsbtc/8M000000002.jpeg
13467535,https://www.cryptonewsz.com/?p=27959,1561462740,Bitfinex Adds Trading Pair Of BTC/XCHF,"Bitfinex, one of the prominent digital asset trading platforms in the world, announced its decision of adding the latest trading pair of BTC/XCHF to its platform. What&apos;s interesting is, this is the first time that the exchange has introduced a non-USD stablecoin base pair on its platform. The exchange shared this exciting news with the …The post Bitfinex Adds Trading Pair Of BTC/XCHF appeared first on CryptoNewsZ.",POSITIVE,없음,EXCHANGE | TRADING,,0,0,CryptoNewsZ,https://www.cryptonewsz.com/bitfinex-adds-trading-pair-of-btc-xchf/27959/,https://images.cryptocompare.com/news/cryptonewsz/aA8x00g4240.jpeg
13358971,https://cointelegraph.com/news/north-americas-largest-solar-bitcoin-mining-farm-coming-to-california,1561462380,North America’s Largest Solar Bitcoin Mining Farm Coming to California,Plouton says it has chosen california to host a giant bitcoin mining facility,POSITIVE,없음,BTC | MINING,,0,0,CoinTelegraph,https://cointelegraph.com/news/north-americas-largest-solar-bitcoin-mining-farm-coming-to-california,https://images.cryptocompare.com/news/cointelegraph/d8OCk20g0g0.png
13467536,https://www.cryptonewsz.com/?p=27901,1561461495,Electroneum Price Analysis: Electroneum (ETN) Might Hop From Bullish to Bearish Soon!,"Uganda is the next stop! Or shall we quote that ETN has spread its words to Uganda already? According to the recent tweets by ETN Tea, they have announced Electroneum Bazaar and conference in Uganda very soon and posting the tweets of the people attending the same. ETN is fabulous with its marketing strategies, so …The post Electroneum Price Analysis: Electroneum (ETN) Might Hop From Bullish to Bearish Soon! appeared first on CryptoNewsZ.",NEUTRAL,없음,MARKET | TRADING,,0,0,CryptoNewsZ,https://www.cryptonewsz.com/electroneum-price-analysis-electroneum-etn-might-hop-from-bullish-to-bearish-soon/27901/,https://images.cryptocompare.com/news/cryptonewsz/e0ggEg00200.jpeg
13467537,https://www.cryptonewsz.com/?p=27927,1561461049,"Bitcoin Vs. Litecoin: If Litecoin (LTC) Is for Easy-Goers, Bitcoin (BTC) Is For Daredevils","Both Bitcoin and Litecoin have a bullish medium-term outlook. By the end of this year, Bitcoin may get to 15,000 USD, and Litecoin may get to 200 USD. Litecoin (LTC) is one of the most sought after altcoins in the current phase of growth in the whole sector. It has been giving stable and promising …The post Bitcoin Vs. Litecoin: If Litecoin (LTC) Is for Easy-Goers, Bitcoin (BTC) Is For Daredevils appeared first on CryptoNewsZ.",POSITIVE,BTC | LTC,ALTCOIN | BTC | LTC | TRADING,,0,0,CryptoNewsZ,https://www.cryptonewsz.com/bitcoin-vs-litecoin-if-litecoin-ltc-is-for-easy-goers-bitcoin-btc-is-for-daredevils/27927/,https://images.cryptocompare.com/news/cryptonewsz/cg0a0202800.jpeg
13358972,https://cointelegraph.com/news/btc-eth-dai-cross-chain-atomic-swaps-launched-by-liquality-on-mainnet,1561460640,"BTC, ETH, DAI Cross-Chain Atomic Swaps Launched By Liquality on Mainnet","P2P cryptocurrency solutions project Liquality has launched its interface for cross-chain atomic swaps between bitcoin, ether and stablecoin dai on the mainnet",POSITIVE,BTC | ETH | DAI,BTC | ETH | WALLET | DAI,,0,0,CoinTelegraph,https://cointelegraph.com/news/btc-eth-dai-cross-chain-atomic-swaps-launched-by-liquality-on-mainnet,https://images.cryptocompare.com/news/cointelegraph/9544rdGc22M.png
