뉴스ID,뉴스GUID,일자(UTC timestamp),뉴스제목,본문,SENTIMENT,주요코인,카테고리,작성자,추천수,비추천수,출처,뉴스URL,이미지URL
13223505,https://www.newsbtc.com/?p=466393,1625009418,"Ethereum Breaks $2,000, What You Should Prepare For","Ethereum has been struggling a lot in the past months. Following the general crashing pattern of the market in recent months. The coin reached a new high of over $4,000. Before falling back down following the market crash over a month ago. Losing over 50% of its value in a matter of weeks. But despite ...",NEGATIVE,없음,ETH | MARKET,,0,0,NewsBTC,https://www.newsbtc.com/analysis/eth/ethereum-breaks-2000/,https://images.cryptocompare.com/news/default/newsbtc.png
13574124,https://www.cryptopolitan.com/?p=100554,1625009389,Bitcoin price analysis: BTC at $36k rekindles hopes of a trend reversal,"TL;DR Breakdown Bitcoin price analysis turns bullish on the short-term charts as price touches $36,100 BTC/USD pair consolidates above $35,000 level in a bid to rise to $40K resistance Past failures to cross the $35k level weighs in heavily on the BTC bulls In the past 24 hours, the price of Bitcoin has risen to ...",POSITIVE,BTC,BTC | MARKET | TRADING,,0,0,Cryptopolitan,https://www.cryptopolitan.com/bitcoin-price-analysis-2021-06-29-2/,https://images.cryptocompare.com/news/default/cryptopolitan.png
13340620,https://cointelegraph.com/news/china-crackdown-shows-industrial-bitcoin-mining-a-problem-for-decentralization,1625008469,China crackdown shows industrial Bitcoin mining a problem for decentralization,The great hash rate plunge caused by an exodus of miners from China shows large scale Proof-of-Work mining facilities are vulnerable to regulation.,NEGATIVE,없음,ASIA | BTC | MINING | REGULATION,,0,0,CoinTelegraph,https://cointelegraph.com/news/china-crackdown-shows-industrial-bitcoin-mining-a-problem-for-decentralization,https://images.cryptocompare.com/news/default/cointelegraph.png
13445264,https://bitcoinist.com/?p=153637,1625007646,Back In The Doge House: Elon Musk Tweets Support For Doge Upgrade,"Elon Musk has recently tweeted support for Doge after what seems to be a hiatus. Musk had stopped tweeting about the coin back in May. This was after consistently tweeting about the coin for months. Driving the coin price up a staggering 11,000 percent within this time frame. Related Reading | Old Doge, New Tricks: Is ...",POSITIVE,없음,DOGE | TRADING,,0,0,Bitcoinist,https://bitcoinist.com/back-in-the-doge-house-elon-musk-tweets-support-for-doge-upgrade/?utm_source=rss&utm_medium=rss&utm_campaign=back-in-the-doge-house-elon-musk-tweets-support-for-doge-upgrade,https://images.cryptocompare.com/news/default/bitcoinist.png
13429513,https://news.bitcoin.com/?p=470709&preview=true&preview_id=470709,1625007632,Korean Crypto Exchanges Consider Suing Government Over Banking Requirements,"All cryptocurrency exchanges in South Korea except the largest four may be unable to meet the bank account requirements needed to stay in business. A number of Korean crypto exchanges are considering suing the government and financial authorities, claiming that the country&apos;s crypto law is unconstitutional. A number of exchanges are currently considering filing a ...",NEGATIVE,없음,ASIA | BUSINESS | FIAT | REGULATION,,0,0,Bitcoin.com,https://news.bitcoin.com/korean-crypto-exchanges-suing-government-banking-requirements/,https://images.cryptocompare.com/news/default/bitcoincom.png
13272554,https://ambcrypto.com/?p=167426,1625007610,Bitcoin: Is there a flip side to the ‘Headwinds originating from China’?,"China&apos;s sweeping ban on cryptocurrency mining incapacitated an industry to a large extent, the impact of which was reflected in the drop in hashrate. According to an estimate by Adam James, a senior editor at OKEx Insights, &apos;more than 20 mining entities were affected by the shutdown, while smaller mining operations may continue to skirt regulations ...",NEGATIVE,없음,ASIA | BTC | MINING,,0,0,AMB Crypto,https://ambcrypto.com/bitcoin-is-there-a-flip-side-to-the-headwinds-originating-from-china/,https://images.cryptocompare.com/news/default/ambcrypto.png
13391018,https://decrypt.co/?p=74828,1625006467,Institutional Investors Losing Interest in Bitcoin: Report,Grayscale&apos;s Bitcoin Trust continues to trade at a discount and money is flowing out of Bitcoin ETFs in Canada. What&apos;s going on?,NEGATIVE,없음,BTC | BUSINESS,,0,0,Decrypt,https://decrypt.co/74828/institutional-investors-losing-interest-bitcoin-report,https://images.cryptocompare.com/news/default/decrypt.png
42434663,sd6iOBkuiC3F0LYOyPsd3h,1625005815,Spain Considers Implementing a Digital Euro,"CORRECTION (June 30, 2021, 19:10 UTC): Spain's governing party has proposed examining how a digital euro would work, not a native central bank digital currency.      The Spanish Socialist Party (PSOE), the governing political body in Spain, has proposed the creation of a study group to implement the digital euro as a public digital currency.      PSOE, which holds the presidency of the country and is the leading force in the Chamber of Deputies, presented a non-law proposition (PNL) in the Spanish Congress to support the launching of a digital euro in response to decreased usage of physical cash, according to an official document cited by the Spanish newspaper El Economista.      New payment trends lead to a “purely private and more insecure money,” according to the political party, while its proposal is committed to “the recovery of money as a public good, more stable and under democratic control.”      PSOE promoted this measure after the European Central Bank (ECB) announced its intentions to create a digital euro, the report added.      Last week, the European Union designated the Bank of Spain and the National Securities Market Commission, Spain’s stock market regulator known as CNMV, to oversee crypto assets in the country.      Carlos Conesa, general director of the financial innovation division at the Spanish Central Bank (Banco de España), said this month that “the decision to launch a project on the digital euro is very close,” the article added.      According to the PSOE, a national digital currency would allow more liquidity in the system. “In the event that a monetary expansion is necessary, it allows a more direct mechanism by injecting liquidity directly into current accounts and thus transferring it immediately and without intermediaries to economic activity,” according to its proposal.      “It would be subject, as at present, ultimately to control by the representatives of the citizenry, who set its monetary policy objectives,” PSOE argued in its PNL presented in Congress, according to the report.      PSOE insisted the project would be achieved “without the nationalization of the banking system or the nationalization of credit.”      A digital currency would end the “privilege” of banks over money, according to the proposal, defining a national digital currency as “a digital public money, intangible and perfectly usable to make electronic payments, but in this case backed by the state, making it a safe money.”      Thus, “it is perfectly feasible that each individual can have his own account with his digital money directly at the central bank. A privilege, for the moment, restricted to banks.”",POSITIVE,없음,BUSINESS | FIAT | MARKET,Andrés Engler,0,0,CoinDesk,https://coindesk.com/markets/2021/06/29/spain-considers-implementing-a-digital-euro,https://cdn.sanity.io/images/s3y3vcno/production/27c7ed2670380224ac8e4a17bd7ebe2d062f7204-1000x696.jpg?w=300&h=300&fit=crop
13391019,https://decrypt.co/?p=74836&preview=true&preview_id=74836,1625005023,Why Paraguay Isn't Going to Make Bitcoin Legal Tender,"Congressman Carlos Rejala has big Bitcoin plans for Paraguay. But legal tender status isn&apos;t in the cards for the South American nation, and here&apos;s why.",NEUTRAL,없음,BTC | REGULATION,,0,0,Decrypt,https://decrypt.co/74836/paraguay-bitcoin-legal-tender-why,https://images.cryptocompare.com/news/default/decrypt.png
13258453,https://dailyhodl.com/?p=151344,1625004321,Top Crypto Analyst Sees Another Bitcoin Collapse on the Horizon – Here’s When,"A closely-followed trader and analyst who twice pinpointed local tops in Bitcoin is outlining when we may see a second collapse in the world&apos;s biggest crypto asset. The pseudonymous analyst known as Dave the Wave tells his 67,500 followers that Bitcoin is lacking strength as it trades within the range between $30,000 and $40,000. According ...The post Top Crypto Analyst Sees Another Bitcoin Collapse on the Horizon - Here&apos;s When appeared first on The Daily Hodl.",NEGATIVE,없음,BTC,,0,0,The Daily Hodl,https://dailyhodl.com/2021/06/29/top-crypto-analyst-sees-another-bitcoin-collapse-on-the-horizon-heres-when/,https://images.cryptocompare.com/news/default/dailyhodl.png
13272555,https://ambcrypto.com/?p=167587,1625004043,Another 30% jump for Cardano? Here’s why it’s possible,"Cardano has seen a busy month of June. Not only was the Alonzo testnet making developments towards establishing smart contract applications, but developers also kept a close eye on the NFT marketplace. A recent piece covered Cardano&apos;s game plan when it came to the hotly trending digital asset. While Cardano&apos;s ecosystem was turning new corners, ...",POSITIVE,없음,ADA | ALTCOIN | MARKET,,0,0,AMB Crypto,https://ambcrypto.com/another-30-jump-for-cardano-heres-why-its-possible/,https://images.cryptocompare.com/news/default/ambcrypto.png
13223506,https://www.newsbtc.com/?p=466397,1625004023,Institutional Bitcoin Selloff Leaves Retail With Bloody Aftermath,"Bitcoin price is trading at around 50% down from 2021 highs set around the Coinbase stock market debut. According to data, the rally fueled by institutions finally getting into crypto came to an end by the same entities who drove up prices in the first place. Here&apos;s why institutions left the crypto market and retail ...",NEGATIVE,없음,BTC | BUSINESS | EXCHANGE | MARKET | TRADING,,0,0,NewsBTC,https://www.newsbtc.com/analysis/btc/institutional-bitcoin-retail-bloody/,https://images.cryptocompare.com/news/default/newsbtc.png
13495159,https://seekingalpha.com/news/3711178-mrin-alt-flxn-and-fulc-among-after-hours-movers?utm_source=cryptocompare.com&utm_medium=referral,1625003457,"MRIN, ALT, FLXN and FULC among after-hours movers",Gainers: [[FLXN]] +8.1%. [[FULC]] +8.1% [[VRA]] +7.1%. [[ELOX]] +4.2%. . [[COHU]] +3.5%.Losers: [[ALT]] -35.8%. [[MRIN]] -20.5%. [[BIOX]] -18.7%. [[ANGN]] -10.4%. [[TCOM]] -6.0%.,NEUTRAL,없음,OTHER,,0,0,Seeking Alpha,https://seekingalpha.com/news/3711178-mrin-alt-flxn-and-fulc-among-after-hours-movers?utm_source=cryptocompare.com&utm_medium=referral,https://images.cryptocompare.com/news/default/seekingalpha.png
42434669,sd6iOBkuiC3F0LYOyPsdFh,1625003284,USDC Stablecoin Could Soon Expand to 10 More Blockchains,"USDC, the stablecoin now native to four blockchains, could soon be on eight to 10 more networks, CoinDesk has learned.      It’d be the broadest expansion of the $25 billion stablecoin to date, potentially surpassing the eight blockchains that support Tether’s USDT, the market leader with a $63 billion market cap.      “We anticipate that in the coming months USDC will become available on Avalanche, Celo, Flow, Hedera, Kava, Nervos, Polkadot, Stacks, Tezos, and Tron,” according to a draft announcement from USDC administrator CENTRE obtained by CoinDesk.      The expansion comes as stablecoins draw increasing scrutiny from regulators, with Eric Rosengren, president of the Federal Reserve Bank of Boston, specifically mentioning USDT and even the relatively obscure TITAN in a recent talk about emerging systemic risks. While Fed Vice Chair Randal Quarles followed with more positive remarks about stablecoins, it is clear the sector is squarely on Washington’s radar.      CENTRE, which is a consortium run by crypto exchange Coinbase and payments firm Circle, said expanding to other chains helps “drive individual and enterprise adoption of open blockchain technologies.”      “We anticipate that USDC on these blockchain platforms and multichain protocols will further accelerate the use of the world’s fastest growing digital dollar currency,” CENTRE said in the draft announcement.      USDC was launched on Ethereum in 2018 and expanded to Algorand, Stellar and Solana in the second half of 2020.      The potential expansion to other blockchains follows a pair of announcements showing momentum behind USDC as an interest-generating savings vehicle. Circle announced its Circle Yield and DeFi API products late last week.      In its draft announcement, CENTRE said updates on the timing of the further integrations would be issued “over the balance of the year.”",POSITIVE,USDT | USDC,BLOCKCHAIN | EXCHANGE | FIAT | USDT | USDC,Zack Seward,0,0,CoinDesk,https://coindesk.com/business/2021/06/29/usdc-stablecoin-could-soon-expand-to-10-more-blockchains,https://cdn.sanity.io/images/s3y3vcno/production/3ff20dcdc35d547860c8ad6486814ba8fbab8d78-1500x1000.jpg?w=300&h=300&fit=crop
42434660,sd6iOBkuiC3F0LYOyPsczh,1625002939,"CEO Brian Armstrong Flags Self-Custody, DeFi Access as Coinbase Priorities","Decentralized finance (DeFi) is “the future of where the industry is going,” according to Coinbase CEO Brian Armstrong. In a Tuesday blog post he delineated how his cryptocurrency exchange will serve the growing demand for DeFi products and services.      “We’re seeing crypto quickly mature … to the trading of thousands of new assets, and the adoption of new use cases"" including DeFi, non-fungible tokens (NFT), smart contracts, decentralized autonomous organizations (DAOs) and more, Armstrong wrote.      Just as Coinbase has “helped people access bitcoin for the first time … we need to do the same for the decentralized cryptoeconomy,"" he said.      Armstrong wrote that Coinbase expects to add assets to the platform more quickly, broaden its geographic focus to ship products “that work globally” and construct a crypto app store, akin to Apple's.      In the more immediate future, Armstrong wrote, Coinbase would cut the length of its legal review to evaluate asset issuers from 70 to 12 questions and create a more efficient compliance and security review process. Coinbase will also construct what he termed “an experimental zone for new assets” ensuring the company can provide a fuller picture of their risks for customers, and take steps so that users can access “most assets for basic wallet functionality.”      Armstrong promised to send more products to new international markets, while still working with regulators “in more established markets,” and that “any app built on decentralized crypto rails will be accessible to users of the Coinbase app.”      He added that customers would have “the option to do self-custody of their crypto in the main Coinbase app.”",POSITIVE,없음,BTC | EXCHANGE | MARKET | REGULATION | TRADING,James Rubin,0,0,CoinDesk,https://coindesk.com/markets/2021/06/29/ceo-brian-armstrong-flags-self-custody-defi-access-as-coinbase-priorities,https://cdn.sanity.io/images/s3y3vcno/production/d4e78a1daadff82381303fcedd0e1c84d61e68c6-1500x1000.jpg?w=300&h=300&fit=crop
13429514,https://news.bitcoin.com/?p=470611,1625002246,"Indians Hold $40 Billion in Cryptocurrency, Report Suggests","Crypto investments in India have been gaining significant traction over the past year, blockchain data indicates. Despite the ambiguous regulatory situation in the country, more than 15 million Indians have bought or sold digital currencies. Indian Crypto Investments Increase Amid Regulatory Uncertainty A growing number of Indians have put money into cryptocurrencies in the past ...",POSITIVE,없음,BLOCKCHAIN | BTC | BUSINESS | DOGE | ETH,,0,0,Bitcoin.com,https://news.bitcoin.com/indians-hold-40-billion-in-cryptocurrency-report-suggests/,https://images.cryptocompare.com/news/default/bitcoincom.png
13340621,https://cointelegraph.com/news/we-don-t-have-much-time-left-to-regulate-crypto-says-bank-of-france-governor,1625002020,"'We don't have much time left' to regulate crypto, says Bank of France governor","&apos;We in Europe need to move as quickly as possible or risk an erosion of our monetary sovereignty,&apos; said Francois Villeroy de Galhau.",NEGATIVE,없음,FIAT | REGULATION,,0,0,CoinTelegraph,https://cointelegraph.com/news/we-don-t-have-much-time-left-to-regulate-crypto-says-bank-of-france-governor,https://images.cryptocompare.com/news/default/cointelegraph.png
13391020,https://decrypt.co/?p=72563,1625001964,From CoinBurp to YOLOrekt: What CoinList Is Doing with Seed Projects,"CoinList made its name during the ICO boom. Now it&apos;s still doing token sales, but also quietly helping early token projects find investors—for free.",POSITIVE,ICO,ICO | TOKEN SALE,,0,0,Decrypt,https://decrypt.co/72563/coinburp-yolorekt-sarcophagus-how-ico-site-coinlist-is-promoting-seed-projects,https://images.cryptocompare.com/news/default/decrypt.png
13384902,https://zycrypto.com/?p=53422,1625001919,Coinbase Becomes First Company To Receive New Crypto-Custody License In Germany,"Coinbase is now authorized to conduct proprietary trading and cryptocurrency custody services (Kryptoverwahrgeschäft) in Germany through its local subsidiary Coinbase Germany GmbH, according to Germany&apos;s Federal Financial Supervisory Authority (BaFin). &apos;The BaFin has the Coinbase Germany GmbH granted permission on 28 June 2021 the Kryptoverwahrgeschäft and proprietary trading - to provide - limited to crypto ...",POSITIVE,없음,EXCHANGE | TRADING,,0,0,ZyCrypto,https://zycrypto.com/coinbase-becomes-first-company-to-receive-new-crypto-custody-license-in-germany/,https://images.cryptocompare.com/news/default/zycrypto.png
13384903,https://zycrypto.com/?p=53423,1625001386,American Banking Giant Morgan Stanley Has Indirectly Invested In Bitcoin,"Global investment bank and financial services provider Morgan Stanley has bought 28,289 shares of Grayscale Bitcoin Trust (GBTC) according to a filing with the US Securities Exchange Commission (SEC). At an estimated price of $29.25 per share, Morgan Stanley&apos;s GBTC investment is currently worth a little over $827,000. The GBTC fund, which is closed to new ...",POSITIVE,BTC,BTC | EXCHANGE | FIAT | REGULATION | TRADING,,0,0,ZyCrypto,https://zycrypto.com/american-banking-giant-morgan-stanley-has-indirectly-invested-in-bitcoin/,https://images.cryptocompare.com/news/default/zycrypto.png
13340622,https://cointelegraph.com/news/coinbase-will-pay-users-4-interest-on-usdc-holdings,1625001300,Coinbase will pay users 4% interest on USDC holdings,"The announced yields represent the exchange increasing interest for USDC holders by more than 2,500% since it was lowered significantly last June.",POSITIVE,USDC,BUSINESS | EXCHANGE | USDC,,0,0,CoinTelegraph,https://cointelegraph.com/news/coinbase-will-pay-users-4-interest-on-usdc-holdings,https://images.cryptocompare.com/news/default/cointelegraph.png
13574125,https://www.cryptopolitan.com/?p=100505,1625001172,TP ICAP launches a crypto trading platform,"TL;DR Breakdown • The UK-regulated crypto trading platform promises to boost the Bitcoin price.• Microstrategy, like other institutional organizations, invests in Bitcoins on their decline. TP ICAP, one of the best brokers globally, announces this Tuesday&apos;s launch of their crypto trading platform. This is achieved in partnership with Fidelity Investments and Standard Chartered. With this ...",POSITIVE,없음,BTC | TRADING,,0,0,Cryptopolitan,https://www.cryptopolitan.com/tp-icap-launches-a-crypto-trading-platform/,https://images.cryptocompare.com/news/default/cryptopolitan.png
13574126,https://www.cryptopolitan.com/?p=100512,1625000945,Ankr recovers to touch $0.0807 as bulls pin hopes for fresh highs,"TL;DR Breakdown • Cryptocurrencies like Ankr serve as a short-term investment.• Cardano and Polygon join the high-risk cryptocurrencies for the investor. While cryptocurrencies are slowly recovering, others are skyrocketing in value. Ankr is one of these cryptocurrencies that has given much to speak of due to the volatility. The cryptocurrency, after falling above 5 cents ...",POSITIVE,없음,ADA | BUSINESS | MATIC,,0,0,Cryptopolitan,https://www.cryptopolitan.com/ankr-recovers-bullish-hopes/,https://images.cryptocompare.com/news/default/cryptopolitan.png
13482648,https://cryptobriefing.com/?p=90639,1625000497,YouTuber Sent Dogecoin to Space In Elon Musk Tribute,,POSITIVE,없음,DOGE,,0,0,Crypto Briefing,https://cryptobriefing.com/youtuber-sent-dogecoin-to-space-in-elon-musk-tribute/,https://images.cryptocompare.com/news/default/cryptobriefing.png
13272556,https://ambcrypto.com/?p=167242,1625000458,Bitcoin: Why it’s considered a good time to make this move,"Crypto markets, specifically Bitcoin, have been shrouded in a cloud of worry and panic for about 3 months now. Every guess and prediction continues to fail, every rally is followed by another crash, BTC is struggling to climb back to $40k. Once the torchbearer of optimism, Bitcoin is now the primary reason for everyone&apos;s concern, ...",NEGATIVE,BTC,ALTCOIN | BTC | MARKET | TRADING,,0,0,AMB Crypto,https://ambcrypto.com/bitcoin-why-its-considered-a-good-time-to-make-this-move/,https://images.cryptocompare.com/news/default/ambcrypto.png
13574127,https://www.cryptopolitan.com/?p=100542,1625000174,Bullish sentiments are back after Bitcoin smashes $35k resistance,TL; DR Breakdown Bitcoin has broken past the resistance at $35k The market is bullish Investor advises people to hold for long term Bitcoin is scoring major gains of late. The crypto&apos;s price seems to have pulled back from a worrisome drift to the bear camp and switched to the bullish movement just in time ...,POSITIVE,없음,BTC | BUSINESS | MARKET | TRADING,,0,0,Cryptopolitan,https://www.cryptopolitan.com/bullish-sentiments-are-after-bitcoin-35k/,https://images.cryptocompare.com/news/default/cryptopolitan.png
13574128,https://www.cryptopolitan.com/?p=100494,1625000021,eToro CEO predicts more crypto regulations,"TL;DR Breakdown eToro platform predicts more regulations to protect cryptocurrency investments The eToro CEO claims that the crypto market is rising, and regulators must impose new rules. eToro CEO hopes that regulators will impose and implement new rules to protect Bitcoin and other cryptocurrency investors. eToro is a fast-growing online platform dedicated to trading derivatives, ...",NEUTRAL,없음,BTC | BUSINESS | MARKET | TRADING,,0,0,Cryptopolitan,https://www.cryptopolitan.com/etoro-ceo-predicts-more-crypto-regulations/,https://images.cryptocompare.com/news/default/cryptopolitan.png
13340623,https://cointelegraph.com/news/binance-faces-regulatory-upheaval-as-lawmakers-target-global-exchanges,1624999774,Binance faces regulatory upheaval as lawmakers target ‘global’ exchanges,"Regulators in Japan, the United Kingdom and the Canadian province of Ontario have all tightened their grip on unauthorized cryptocurrency exchanges. Binance has been caught in the crosshairs.",NEGATIVE,없음,ASIA | EXCHANGE | BNB,,0,0,CoinTelegraph,https://cointelegraph.com/news/binance-faces-regulatory-upheaval-as-lawmakers-target-global-exchanges,https://images.cryptocompare.com/news/default/cointelegraph.png
13258454,https://dailyhodl.com/?p=151499,1624998874,"Powerhouse Broker Launching Bitcoin and Crypto Trading Platform With Fidelity, Standard Chartered","The world&apos;s largest inter-dealer broker, TP ICAP, says it&apos;s launching a new crypto trading platform to meet a surge in demand. Founded in 2004, the London-based provider of market infrastructure acts as an over-the-counter intermediary between banks and investment houses in the daily trading of currencies, interest rate swaps, commodities, shares, and bonds. The new ...The post Powerhouse Broker Launching Bitcoin and Crypto Trading Platform With Fidelity, Standard Chartered appeared first on The Daily Hodl.",POSITIVE,없음,ALTCOIN | BTC | MARKET | TRADING,,0,0,The Daily Hodl,https://dailyhodl.com/2021/06/29/powerhouse-broker-launching-bitcoin-and-crypto-trading-platform-with-fidelity-standard-chartered/,https://images.cryptocompare.com/news/default/dailyhodl.png
13272557,https://ambcrypto.com/?p=167637,1624998651,"Binance Coin, Chainlink, Solana Price Analysis: 29 June","Trading volumes for Binance Coin, LINK, and SOL have risen significantly over the last 24 hours. Curiously, despite the UK&apos;s FCA issuing a warning to Binance, its native token didn&apos;t react too negatively to the same. Finally, Solana recently made headlines when Digital Assets AG announced the operation of tokenized stocks on the Solana blockchain. ...",POSITIVE,LINK | SOL,EXCHANGE | LINK | MARKET | SOL | BNB,,0,0,AMB Crypto,https://ambcrypto.com/binance-coin-chainlink-solana-price-analysis-29-june/,https://images.cryptocompare.com/news/default/ambcrypto.png
13340624,https://cointelegraph.com/news/bulls-are-back-but-regulatory-fears-hamper-the-defi-and-altcoin-recovery,1624998600,"Bulls are back, but regulatory fears hamper the DeFi and altcoin recovery","Bitcoin is staging a comeback, but the lingering threat of regulation continues to weigh on DeFi tokens and select altcoins.",NEGATIVE,없음,ALTCOIN | BTC | ETH | REGULATION | SOL,,0,0,CoinTelegraph,https://cointelegraph.com/news/bulls-are-back-but-regulatory-fears-hamper-the-defi-and-altcoin-recovery,https://images.cryptocompare.com/news/default/cointelegraph.png
