뉴스ID,뉴스GUID,일자(UTC timestamp),뉴스제목,본문,SENTIMENT,주요코인,카테고리,작성자,추천수,비추천수,출처,뉴스URL,이미지URL
13829138,https://cointelegraph.com/news/bybit-plugs-into-chatgpt-for-ai-powered-trading-tools,1686823200,ByBit plugs into ChatGPT for AI-powered trading tools,"ToolsGPT marries ByBit’s market data with ChatGPT’s AI to generate technical analysis, price data and trading metrics.",NEUTRAL,없음,MARKET | TRADING,,0,0,CoinTelegraph,https://cointelegraph.com/news/bybit-plugs-into-chatgpt-for-ai-powered-trading-tools,https://resources.cryptocompare.com/news/16/13829138.jpeg
13829125,https://crypto.news/?p=14169540,1686823200,"Cryptocurrency safe havens: digitoads, ethereum, and bitcoin","DigiToads, boosted by its features such as P2E gaming and NFT staking, is a safe haven like bitcoin and ethereum",POSITIVE,없음,BTC | ETH | SPONSORED,,0,0,crypto.news,https://crypto.news/cryptocurrency-safe-havens-digitoads-ethereum-and-bitcoin/,https://resources.cryptocompare.com/news/73/13829125.jpeg
13829211,https://decrypt.co/?p=144741,1686823143,"Ethereum, Cardano, and Dogecoin Lead Weekly Crypto Losses","After the largest altcoins, Bitcoin is also shedding value as the crypto market continues to digest yesterday’s fed notes.",NEGATIVE,없음,ADA | ALTCOIN | DOGE | ETH | MARKET,,0,0,Decrypt,https://decrypt.co/144741/ethereum-cardano-dogecoin-lead-weekly-crypto-losses,https://resources.cryptocompare.com/news/44/13829211.jpeg
13829057,https://cryptodaily.co.uk/2023/06/fed-pauses-as-crypto-market-continues-slide,1686823055,Fed pauses as crypto market continues slide,"The Federal Reserve did not raise rates for the first time since the inflation-inspired start of its rapid interest rate expansion. However, crypto continues its downward slide. Fed intervention A Fed pivot is on the horizon even though it may not start to actually reduce interest rates until next year. This was certainly coming given that the current mad series of interest rate hikes is forcing the economy into recession. Never before has the Fed tightened as quickly and as harshly as this following Biden and Yellen’s claims back in July of 2021 that inflation was only “temporary”. History tells us that our boom and bust cycles are caused by government and central bank manipulation of credit, and that government intervention in the markets is always a bad thing and could probably be said to be axiomatic. Attempted eradication of crypto In such a chaotic world where the dollar and all other fiat currencies are being debased like crazy, it appears that the last thing the US government needs is the slightest hint of competition to its currency. It could be argued that the government sees this competition coming on two fronts. It is now understanding the full import of cryptocurrencies - which might be classified as a type of private money. After huge successes for some cryptocurrencies, admittedly mostly driven by hype and speculation, the US government has probably decided to try and eradicate them through the auspices of its enforcement agencies (SEC and CFTC). A systemic attack on the crypto ecosystem is now taking place and lacking liquidity and with many crypto investors fleeing the sector the market is bleeding out. Bitcoin unassailable? However, there is one cryptocurrency that even the US government would have the devil of a job in taking down, and that is bitcoin. Bitcoin is the most decentralised and secure private money that exists in the world today, and given that it runs purely on code there is nothing any government or agency can do to stop it. Be that as it may, the rest of the market is obviously having an effect on bitcoin as large crypto businesses run into difficulties with sizable chunks of bitcoin on their books, and Mt Gox and the US government are selling their bitcoin into the market. Once this selling pressure is gone though it might be expected that bitcoin would begin a dramatic rise as investors rush out of a worsening dollar, to say nothing of the rest of the fiat currencies. BRICS currency on the horizon The other front where the US can expect huge competition is from the BRICS nations. In August, at a Summit in South Africa, these nations are expected to announce a new currency which could be backed by gold and/or other commodities, or could even become a rival reserve currency to the dollar by having its own deep and liquid bond market, with the bonds bought by citizens in 20 or so countries that are in or on the point of joining the BRICS nations. So whether it be Bitcoin or the BRICS nations, the dollar is likely to undergo the most profound and serious rivalry since it came into existence. With the unpayable debts owed by the US government and nothing but thin air and promises backing the currency, a new world order may be on the way. Disclaimer: This article is provided for informational purposes only. It is not offered or intended to be used as legal, tax, investment, financial, or other advice.",NEGATIVE,없음,BTC | BUSINESS | FIAT | MARKET | REGULATION,,0,0,Crypto Daily,https://cryptodaily.co.uk/2023/06/fed-pauses-as-crypto-market-continues-slide,https://resources.cryptocompare.com/news/75/13829057.jpeg
13828890,https://finbold.com/?p=111426,1686822642,Bitcoin plunges below $25k; What’s next for BTC price?,"Just as it started to near back the critical threshold of $26,000, Bitcoin (BTC) experienced a sharp decline to below … Continued The post Bitcoin plunges below $25k; What’s next for BTC price? appeared first on Finbold .",NEGATIVE,BTC,BTC | MARKET | TRADING,,0,0,Finbold,https://finbold.com/bitcoin-plunges-below-25k-whats-next-for-btc-price/,https://images.cryptocompare.com/news/default/finbold.png
13828935,https://cryptonews.com/news/tether-loses-peg-massive-usdt-sell-off-on-curve-uniswap-suggests-shift-to-other-stablecoins.htm,1686822600,"Tether Loses Peg: Massive USDT Sell-off on Curve, Uniswap Suggests Shift to Other Stablecoins","Tether’s stablecoin USDT has lost its dollar peg after two major pools for stablecoin trading became heavily imbalanced. On-chain data shows traders have been exchanging millions of dollars worth of USDT for other popular stablecoins like USDC and DAI on Uniswap and Curve pools.... Read More: Tether Loses Peg: Massive USDT Sell-off on Curve, Uniswap Suggests Shift to Other Stablecoins",NEGATIVE,USDT | DAI,MINING | TRADING | UNI | USDT | DAI,,0,0,cryptonews,https://cryptonews.com/news/tether-loses-peg-massive-usdt-sell-off-on-curve-uniswap-suggests-shift-to-other-stablecoins.htm,https://resources.cryptocompare.com/news/52/13828935.jpeg
13828762,https://cointelegraph.com/news/curve-pool-imbalance-usdt-depeg-concerns-tether-cto-calls-it-fud,1686822022,"Curve pool imbalance triggers USDT depeg concerns, Tether CTO calls it FUD","The stablecoin pool ideally has a weightage comprising 33.3% of USDT, USDC and DAI; however, on June 15, the USDT weightage rose above 70%.",NEGATIVE,USDT | DAI | USDC,USDT | DAI | USDC,,0,0,CoinTelegraph,https://cointelegraph.com/news/curve-pool-imbalance-usdt-depeg-concerns-tether-cto-calls-it-fud,https://resources.cryptocompare.com/news/16/13828762.jpeg
13828404,https://www.cryptonewsz.com/?p=207012,1686821421,DEXs can’t be regulated like exchanges: Coinbase to SEC,"The U.S. Securities and Exchange Commission (SEC) has received a letter from the cryptocurrency exchange Coinbase claiming that the DEX cannot be controlled. The statement continues by saying that decentralized exchanges are not subject to the same laws as centralized exchanges, which were established by the relevant authorities, but they do not fall under the …",NEUTRAL,없음,EXCHANGE | REGULATION,,0,0,CryptoNewsZ,https://www.cryptonewsz.com/dexs-cant-be-regulated-like-exchanges-coinbase-to-sec/,https://images.cryptocompare.com/news/default/cryptonewsz.png
13828365,https://ambcrypto.com/?p=320639,1686821417,The chances of Shiba Inu slipping off the top 20 list are…,SHIB has to overcome several challenges to stay in the top 20 as its market cap was on a downtrend.,NEGATIVE,SHIB,ALTCOIN | MARKET | SHIB,,0,0,AMB Crypto,https://ambcrypto.com/the-chances-of-shiba-inu-slipping-off-the-top-20-list-are/,https://images.cryptocompare.com/news/default/ambcrypto.png
13828159,https://thecryptobasic.com/?p=50353,1686820988,Dizer Capital Founder Says XRP Recent Price Action Is a Sign of What Is To Come,"Mobarak says XRP price action during the release of Hinman’s document indicates what’s coming for the asset when Judge Torres issues summary judgment in SEC vs. Ripple case. Yassin Mobarak, the founder of VC firm Dizer Capital, has commented on XRP’s recent price action. Recall that XRP surged nearly 10% on Tuesday following the release The post Dizer Capital Founder Says XRP Recent Price Action Is a Sign of What Is To Come first appeared on The Crypto Basic .",POSITIVE,XRP,MARKET | REGULATION | TRADING | XRP,,0,0,The Crypto Basic,https://thecryptobasic.com/2023/06/15/dizer-capital-founder-says-xrp-recent-price-action-is-a-sign-of-what-is-to-come/?utm_source=rss&#038;utm_medium=rss&#038;utm_campaign=dizer-capital-founder-says-xrp-recent-price-action-is-a-sign-of-what-is-to-come,https://images.cryptocompare.com/news/default/thecryptobasic.png
13828313,https://decrypt.co/?p=144740,1686820980,"Sam Bankman-Fried Trial Can Proceed on Original Charges Only, Says DoJ",The Government is willing to wait a bit longer to try the FTX founder Sam Bankman-Fried on several additional counts.,NEUTRAL,없음,BUSINESS,,0,0,Decrypt,https://decrypt.co/144740/sam-bankman-fried-trial-can-only-proceed-original-charges-says-doj,https://resources.cryptocompare.com/news/44/13828313.jpeg
13828156,https://finbold.com/?p=111421,1686820894,Terra Classic leads 7-day gains amid crypto market crash,The cryptocurrency market has been gripped by tension and a surge of selling pressure following the Securities and Exchange Commission’s … Continued The post Terra Classic leads 7-day gains amid crypto market crash appeared first on Finbold .,NEUTRAL,없음,EXCHANGE | LUNC | MARKET,,0,0,Finbold,https://finbold.com/terra-classic-leads-7-day-gains-amid-crypto-market-crash/,https://images.cryptocompare.com/news/default/finbold.png
13828204,https://cointelegraph.com/news/crypto-trading-bot-borrows-200m-for-a-3-gain,1686820859,Crypto trading bot borrows $200M for a $3 gain,"One community member praised the bot, saying that “profit is profit,” while another said that the event highlights how bad the bear market is.",NEUTRAL,없음,BUSINESS | MARKET | TRADING,,0,0,CoinTelegraph,https://cointelegraph.com/news/crypto-trading-bot-borrows-200m-for-a-3-gain,https://resources.cryptocompare.com/news/16/13828204.jpeg
13827985,https://dailyhodl.com/?p=249297,1686820548,"Trader Predicts Over 50% Jump for One Top-10 Altcoin, Says Bitcoin Could Get ‘Violent’ if Support Level Crumbles","A widely followed crypto analyst and trader is predicting that XRP could go higher while expressing bearish sentiment on Bitcoin (BTC). The pseudonymous trader known as Altcoin Sherpa tells his 195,900 Twitter followers that XRP is flashing signs of strength amid the current market downturn. According to Altcoin Sherpa, XRP could surge to a level The post Trader Predicts Over 50% Jump for One Top-10 Altcoin, Says Bitcoin Could Get ‘Violent’ if Support Level Crumbles appeared first on The Daily Hodl .",POSITIVE,BTC | XRP,ALTCOIN | BTC | MARKET | TRADING | XRP,,0,0,The Daily Hodl,https://dailyhodl.com/2023/06/15/trader-predicts-over-50-jump-for-one-top-10-altcoin-says-bitcoin-could-get-violent-if-support-level-crumbles/,https://images.cryptocompare.com/news/default/dailyhodl.png
13827986,https://www.newsbtc.com/?p=538063,1686820519,"Tether (USDT) De-Pegs As Crypto Market Stumbles, More Downside Coming?","The Bitcoin and crypto markets are deep in the red today. Even though the US Federal Reserve announced the hoped-for interest rate pause yesterday, the release of the updated dot plot was a nasty surprise for the financial markets. The Fed revealed in its updated dot plot that it sees the average terminal interest rate at 5.6% instead of 5.1% for 2023. As Fed Chairman Jerome Powell explained, almost all FOMC members think further hikes are reasonable. And the resulting price slump in the crypto markets is also having an impact on Tether’s stablecoin, USDT, at the moment. Tether (USDT) De-Pegs Slightly USDT has slightly lost its peg to the US dollar at the time of writing. On Binance, the USDC / USDT exchange rate was at 1.0030. The reason for this seems to be Curve’s 3Pool, which is one of the most important pools for stablecoin trading in decentralized finance. Currently USDT accounts for 73.79% of the Curve 3Pool, DAI for 13.05% and USDC for 13.16%. Apparently, users are rushing to exchange tens of millions of USDT in favor of the stablecoins USD Coin (USDC) and Dai (DAI). The ideal balance of the Curve 3Pool should be 33.33% for each of the three stablecoins. Due to the imbalance, USDT is currently de-pegging. Related Reading: Crypto Market Bleeds As SEC Pressures Mount, Is It Time To Buy? Chinese journalist Collin Wu also reports that in Aave V2, the USDT lending rate skyrocketed, including the deposit rate by more than 20% and the loan rate by more than 30%. Some big whales are borrowing USDT on Aave and selling it on DEX like Curve. One of them is Ethereum whale @samczsun. He borrowed 31.5 million USDT from Aave V2 using 17,000 ETH and 14,000 stETH as collateral, and then exchanged all the borrowed USDT for USDC on 1inch. The borrower then deposited USDC 10 million and USDC 21 million to V2 and V3 respectively. This guy then borrowed 12 million USDT from V3 and deposited it with V2. Wu further explains: Twenty minutes after czsamsun.eth borrowed USDT, another address (0xd2…0701) mortgaged 52,200 stETH through Aave V2 and borrowed 50 million USDC, using USDC>USDT de-peg, with a few million USDC converts USDC from Curve to USDT in batches at a time, and each operation can obtain an additional 1000-8000 USDT. However, Tether CTO Paolo Arduino remains calm. On Twitter, he commented that “markets are edgy in these days,” adding: “so it’s easy for attackers to capitalize on this general sentiment. But at Tether we’re ready as always. Let them come. We’re ready to redeem any amount.” Related Reading: Bitcoin Price Hammered Below $25,000 Amid Fed’s Hawkish Tone, SEC Lawsuits The last time Curve 3Pool was unbalanced was in mid-March, when the balance of USDC and DAI rose to over 45% each. Moreover, there was also an imbalance in November 2022 when FTX and in May 2022 when the Terra ecosystem collapsed. Will The Crypto Market Continue To Fall? Bitcoin, as the leading indicator for the crypto market, is in a critical situation. For the first time since the mid-March crash, the BTC price has fallen below the extremely important 200-day EMA (blue line). A recapture of the price level currently at $25,290 could be of high importance to create a recovery similar to mid-March 2023. Featured image from iStock, chart from TradingView.com",NEGATIVE,BTC | USDT | USDC,BTC | MARKET | TRADING | USDT | USDC,,0,0,NewsBTC,https://www.newsbtc.com/news/tether-usdt-de-pegs-as-crypto-market-stumbles/,https://resources.cryptocompare.com/news/21/13827986.jpeg
13827771,https://www.cryptopolitan.com/?p=318666,1686820077,"Voyager App to Resume Customer Withdrawals, Initiating Recovery Process","After a lengthy period of uncertainty, cryptocurrency brokerage Voyager Digital is set to reopen its app, granting customers the long-awaited ability to withdraw their funds. Almost a year after filing for Chapter 11 bankruptcy, the company has made significant strides toward financial recovery. With the Voyager app’s imminent update, customers will finally have visibility into ... Read more",POSITIVE,없음,OTHER,,0,0,Cryptopolitan,https://www.cryptopolitan.com/voyager-app-withdrawals-recovery-process/,https://images.cryptocompare.com/news/default/cryptopolitan.png
13827865,https://invezz.com/?p=1273263,1686820063,"Whale dumps all PEPE tokens, triggering insider trading speculations","Cryptocurrency whales have increasingly dumped meme coin Pepe lately. Another dip-pocketed investor has sold all its PEPE, triggering speculations of potential insider trading. The wallet sold 972.84B tokens for 514 Ether ($848K). Moreover, the altcoin saw a substantial price dip over the past seven days. Whales dump PEPE Lookonchain tweeted that address ox1497 sold all The post Whale dumps all PEPE tokens, triggering insider trading speculations appeared first on Invezz .",NEGATIVE,PEPE,ALTCOIN | BUSINESS | TRADING | PEPE,,0,0,Invezz,https://invezz.com/news/2023/06/15/another-whale-dumps-all-pepe-tokens-triggering-insider-trading-speculations/,https://resources.cryptocompare.com/news/69/default.png
13827562,https://coinpedia.org/?p=209041,1686819600,"DigiToads (TOADS) is The Ultimate Fusion of Innovation, Utility, and Memes; Here’s How","The post DigiToads (TOADS) is The Ultimate Fusion of Innovation, Utility, and Memes; Here’s How appeared first on Coinpedia Fintech News TOADS has harnessed the power of humour by integrating memes into its platform to engage users and build a sense of shared experience. But this blockchain ICO goes beyond just memes; it also offers a range of utility and functionality. With its focus on non-fungible tokens (NFTs), DigiToads enables users to own and trade unique …",POSITIVE,ICO,BLOCKCHAIN | ICO | TOKEN SALE,,0,0,coinpedia,https://coinpedia.org/press-release/digitoads-ultimate-fusion-of-innovation-utility-and-memes/,https://images.cryptocompare.com/news/default/coinpedia.png
13827573,https://cryptodaily.co.uk/2023/06/coinbase-pushes-back-against-secs-proposed-definition-change,1686819540,Coinbase Pushes Back Against SEC’s Proposed Definition Change,"Coinbase has become the latest entity to push back against the United States Securities and Exchange Commission’s proposed definition change. The SEC had moved to expand its definition of an exchange in 2022. What’s The SEC’s Problem With Crypto? The Securities and Exchange Commission has been relentless in its dogged pursuit of everything crypto. In its latest salvo, the regulatory body sued Coinbase in a New York federal court. In its lawsuit, the agency alleged that Coinbase acted as an unregistered broker and exchange and demanded that it be “permanently restrained and enjoined” from doing so. The lawsuit came just a day after the SEC had sued Binance, the world’s largest cryptocurrency exchange, and its CEO, Changpeng Zhao. The SEC in its press release, stated, “Since 2019, Coinbase has been engaging in an unregistered securities offering through its staking-as-a-service program, which allows customers to earn profits from the “proof of stake” mechanisms of certain blockchains and Coinbase’s efforts.” The crypto markets have been fairly nervous since the Securities and Exchange Commission filed a lawsuit against Binance and its CEO, Changpeng Zhao, just a day before its action against Coinbase. According to the SEC, Binance mishandled funds and lied to investors and regulators about operations, a claim Binance refutes. Coinbase Demands Clarity Coinbase has pushed back against the Securities and Exchange Commission, urging it to provide better clarity for the crypto industry. The SEC has responded to Coinbase’s call for clarity, stating that it requires four months or 120 days to respond. The response comes after a barrage of court filings by both, Coinbase and the SEC. Coinbase had filed a writ of Mandamus against the regulatory body after it stated that it was “in no hurry” to respond to the exchange’s demand for regulatory clarity. Coinbase had accused the agency of wilfully ignoring its request for immediate clarity. Prior to this, the SEC had responded to a previous petition stating that it would not give in to the exchange’s demands. SEC’s Proposed Definition Change In 2022, the Securities and Exchange Commission moved to expand its definition of an exchange. In April 2023, the agency reopened its comment period of the proposal, adding that this was needed as it planned to “fold in DeFi and crypto.” SEC Chair Gary Gensler stated that this would help address comments on proposals from market participants, particularly those associated with the crypto markets. Coinbase has been pushing back against the SEC, especially since the agency sued the exchange, alleging it was offering its users unregistered securities. In a letter to the SEC, Coinbase stated that it has no authority to ban an entire industry. “As the Supreme Court has repeatedly held, an agency’s authority to regulate a particular industry does not include the authority to ban that industry, absent clear Congressional authorization.” Coinbase also criticized the SEC’s decision to include crypto and DeFi under its planned exchanges definition. The updated definition also applies to more traditional market makers. The exchange stated that it was especially concerned with the proposal’s potential impact on decentralized exchanges (DEX). In its letter to the SEC, the exchange stated, “The proposed rule, as applied to DEXs, would be just such an impossible requirement. When creating a DEX, a software developer typically writes the code that creates the DEX and then publishes the code onto a public, permissionless blockchain, along with a mechanism for widely distributing the governance tokens that enable holders to alter select elements of the DEX going forward. Criticism From All Quarters The SEC’s proposed exchange definition has come under heavy criticism from all quarters. Critics include the Blockchain Association, Paradigm, DeFi Education Fund (DEF), and Republicans from the House Financial Services Committee, some of whom have urged the SEC to withdraw the proposal. Paradigm stated that a DEX, particularly one using an automated market maker mechanism, does not involve any intermediary between buyers and sellers, adding that it used algorithms to balance crypto pools. It urged the agency to withdraw the proposal, stating, “We write to request that the Commission withdraw its proposed redefinition of ‘exchange’ and begin its consideration of how to adapt its regulations in the DeFi context anew — after rigorous economic analysis, genuine, broad engagement with the industry, and a close look at the limits of its statutory jurisdiction.” Paradigm, the Blockchain Association, and Coinbase have also argued that the SEC has violated the Administrative Procedures Act (APA). The APA governs and guides how agencies devise and implement regulations. “The rule change is vague and ambiguous, and the range of activities that may be captured within its scope are not yet fully fleshed out.” Disclaimer: This article is provided for informational purposes only. It is not offered or intended to be used as legal, tax, investment, financial, or other advice.",NEGATIVE,없음,BLOCKCHAIN | EXCHANGE | MARKET | REGULATION | BNB,,0,0,Crypto Daily,https://cryptodaily.co.uk/2023/06/coinbase-pushes-back-against-secs-proposed-definition-change,https://resources.cryptocompare.com/news/75/13827573.jpeg
13827486,https://thecryptobasic.com/?p=50351,1686819530,Notable Analyst Says No Reason for XRP Not to Hit $100,"Prominent XRP analyst challenges belief in imminent ATH, urging caution and rationality and aligning with whales’ strategies. In a series of tweets, prominent crypto analyst Toray Kortan in the XRP community, known for his expertise in psychological market mastery, shared his thoughts on the future of XRP, challenging the widespread belief that a new all-time The post Notable Analyst Says No Reason for XRP Not to Hit $100 first appeared on The Crypto Basic .",POSITIVE,XRP,MARKET | XRP,,0,0,The Crypto Basic,https://thecryptobasic.com/2023/06/15/notable-analyst-says-no-reason-for-xrp-not-to-hit-100/?utm_source=rss&#038;utm_medium=rss&#038;utm_campaign=notable-analyst-says-no-reason-for-xrp-not-to-hit-100,https://images.cryptocompare.com/news/default/thecryptobasic.png
13827531,https://cointelegraph.com/news/here-s-what-nigeria-s-naira-float-means-for-its-crypto-market,1686819337,Here’s what Nigeria’s naira float means for its crypto market,The move reduces the likelihood of artificial price differences between the naira and cryptocurrencies in different markets.,NEUTRAL,없음,MARKET | REGULATION | TRADING,,0,0,CoinTelegraph,https://cointelegraph.com/news/here-s-what-nigeria-s-naira-float-means-for-its-crypto-market,https://resources.cryptocompare.com/news/16/13827531.jpeg
13827353,https://cryptopotato.com/?p=255377,1686819140,"ETH, XRP, ADA, LTC Nosedive 6% as Crypto Markets Shed $40B Daily (Market Watch)",The total crypto market cap is close to breaking below the $1 trillion mark.,NEGATIVE,ADA | ETH | LTC | XRP,ADA | ETH | LTC | MARKET | XRP,,0,0,Crypto Potato,https://cryptopotato.com/eth-xrp-ada-ltc-nosedive-6-as-crypto-markets-shed-40b-daily-market-watch/,https://resources.cryptocompare.com/news/27/13827353.jpeg
13827316,https://www.cryptonewsz.com/?p=206995,1686819074,EigenLayer Stage 1 positioned on Ethereum mainnet,"EigenLayer Stage 1 has been positioned on the Ethereum mainnet, through which Ethereum stakers can take part in EigenLayer, control their liquid staking tokens, and shift their funds. This is made possible with the help of EigenLayer contracts. Another option is building an EigenPod and shifting the funds to the EigenPod addresses. In the next …",NEUTRAL,없음,BLOCKCHAIN | ETH,,0,0,CryptoNewsZ,https://www.cryptonewsz.com/eigenlayer-stage-1-positioned-on-ethereum-mainnet/,https://images.cryptocompare.com/news/default/cryptonewsz.png
