뉴스ID,뉴스GUID,일자(UTC timestamp),뉴스제목,본문,SENTIMENT,주요코인,카테고리,작성자,추천수,비추천수,출처,뉴스URL,이미지URL
13585121,https://www.cryptopolitan.com/?p=17746,1561506221,JPMorgan Chase to introduce its own digital currency by end of year,"JPMorgan Chase (JPM), one of America&apos;s premier banking institutions, is set to host its own separate digital currency by the end of this year. Reports indicate that the currency has been assigned the working name &apos;JPM Coin&apos;. Umar Farooq, an official from the company&apos;s department of digital treasury services and blockchain, disclosed that the firm intended to begin testing the coin with a few premier clients somewhere around the end of the year, assuming it passed regulatory checks. Mr Farooq believes that the firm&apos;s decision mirrors a heightened interest from its worldwide customer base over a prospective crypto project. He",POSITIVE,없음,BLOCKCHAIN | REGULATION | TECHNOLOGY,,0,0,Cryptopolitan,https://www.cryptopolitan.com/jpmorgan-chase-to-introduce-its-own-digital-currency-by-end-of-year/,https://images.cryptocompare.com/news/cryptopolitan/dM2c7MD04z6.jpeg
13585122,https://www.cryptopolitan.com/?p=17784,1561505564,Square partially enables Bitcoin deposits in CASH app for select users,"According to the latest reports, Square, a mobile payment, financial and merchant services company, is expanding the features of its CASH app by enabling Bitcoin deposits. As of Tuesday, rumblings having been heard of this new development. A reporter for CoinDesk confirmed as much after checking his own account on the square CASH app. Furthermore, Bitcoiners tweeted their surprise to this new addition as earlier a user could only sell or purchase and transfer Bitcoins from the wallets. Square has been slowly rolling out enhancements to its CASH app, and it began in November of 2017 as it enabled a few of the users of its CASH app to sell and",POSITIVE,없음,BTC,,0,0,Cryptopolitan,https://www.cryptopolitan.com/square-partially-enables-bitcoin-deposits-in-cash-app-for-select-users/,https://images.cryptocompare.com/news/cryptopolitan/fZMc830302w.jpeg
13285827,https://ambcrypto.com/?p=98777,1561505442,"Bitcoin’s censorship resistance, freedom make it a game changer in the economic industry","Over the years, the global economic industry has witnessed significant changes. However, no change has been more significant or essential than the one introduced by the concept of virtual assets or Bitcoin. Today, Bitcoin and other virtual currencies are almost as essential as fiat money and despite the fact that digital assets have not reached ...The post Bitcoin&apos;s censorship resistance, freedom make it a game changer in the economic industry appeared first on AMBCrypto.",POSITIVE,없음,BTC | FIAT,,0,0,AMB Crypto,https://ambcrypto.com/bitcoins-censorship-resistance-freedom-makes-it-a-game-changer-in-the-economic-industry/,https://images.cryptocompare.com/news/ambcrypto/f0dfM80080w.jpeg
13231921,https://www.newsbtc.com/?p=387489,1561503654,UK Supermarket Twitter Hackers Try to Revive Classic Bitcoin Scam,"The UK-based supermarket giant Tesco has had its Twitter account compromised by hackers. Almost mirroring an attack last year, those behind it have attempted to scam Bitcoin from the store&apos;s customers. Tesco appears to have now regained control of its Twitter account. The hackers attempts to earn Bitcoin from the supermarket&apos;s customers appear to have...The post UK Supermarket Twitter Hackers Try to Revive Classic Bitcoin Scam appeared first on NewsBTC.",NEGATIVE,BTC,BTC,,0,0,NewsBTC,https://www.newsbtc.com/2019/06/25/uk-supermarket-twitter-hackers-try-to-revive-classic-bitcoin-scam/,https://images.cryptocompare.com/news/newsbtc/f21w8YZ3g3x.jpeg
13244930,https://nulltx.com/?p=95554,1561502209,Why Gibraltar is Behind The Revolutionary New Crypto Card,"Gibraltar today stands as one of the most blockchain and cryptocurrency forward nations in the world. The nation&apos;s visionary outlook to emerging technologies, especially in the areas of regulating blockchain and cryptocurrency, continues to attract many projects in the industry. Charting a New Course At a time when several governments across the globe are reluctant ...The post Why Gibraltar is Behind The Revolutionary New Crypto Card appeared first on NullTX.",POSITIVE,없음,BLOCKCHAIN | SPONSORED,,0,0,NullTx,https://nulltx.com/why-gibraltar-is-behind-the-revolutionary-new-crypto-card/,https://images.cryptocompare.com/news/themerkle/e2k84ag0400.jpeg
13285828,https://ambcrypto.com/?p=98760,1561501807,Crypto-mining firm GAW Miners LLC’s investors given Class status by U.S District Court,"Less than a year ago, Homero Joshua Garza was sentenced to 21 months imprisonment, followed by three years of supervised release. He was also ordered to pay restitution of over $9 million by the U.S. Attorney&apos;s Office of the District of Connecticut. The Founder and CEO of GAW Miners LLC, Garza, was prosecuted for defrauding victims out ...The post Crypto-mining firm GAW Miners LLC&apos;s investors given Class status by U.S District Court appeared first on AMBCrypto.",NEUTRAL,없음,BUSINESS,,0,0,AMB Crypto,https://ambcrypto.com/crypto-mining-firm-gaw-miners-llcs-investors-given-class-status-by-u-s-district-court/,https://images.cryptocompare.com/news/ambcrypto/fF9489wS03M.jpeg
13231922,https://www.newsbtc.com/?p=387479,1561500034,24/7 Bitcoin Derivative Trading Now Available for U.S. Residents; Will This Add Fuel to BTC’s Momentum?,"The crypto markets are continuing to grow and develop by leaps and bounds each day, and the latest piece of positive news that elucidates just how rapidly the markets are maturing is the Commodity Futures Trading Commission&apos;s decision to approve LedgerX for offering physically settled Bitcoin futures contracts. The announcement, which was made by the...The post 24/7 Bitcoin Derivative Trading Now Available for U.S. Residents; Will This Add Fuel to BTC&apos;s Momentum? appeared first on NewsBTC.",POSITIVE,BTC,BTC | COMMODITY | ICO | MARKET | TRADING,,0,0,NewsBTC,https://www.newsbtc.com/2019/06/25/24-7-bitcoin-derivative-trading-now-available-for-u-s-residents-will-this-add-fuel-to-btcs-momentum/,https://images.cryptocompare.com/news/newsbtc/b3A0000000w.jpeg
13585123,https://www.cryptopolitan.com/?p=17781,1561499571,Novel new algorithm unveiled in IOTA Foundations research paper,"According to the latest report, a research paper has been recently published by the IOTA Foundation. The paper contains a new algorithm that takes fundamentals from the Proof-of-Stake and Proof-of-Work (PoW) algorithms for enhancing the ability of the network in order to fight against congestion and spam attacks. The research paper titled, &apos;Achieving Fairness in the Tangle through an Adaptive Rate Control Algorithm&apos; is authored by Wolfgang Welz, Luigi Vigneri, Alon Gal and Vassil Dimitrov mainly proposed three changes to the algorithm of the network : 1. Every transaction will require a PC to be expending resources on the puzzle",POSITIVE,IOTA,TRADING | RESEARCH | IOTA,,0,0,Cryptopolitan,https://www.cryptopolitan.com/novel-new-algorithm-unveiled-in-iota-foundations-research-paper/,https://images.cryptocompare.com/news/cryptopolitan/9gseAf03cpw.jpeg
13435196,https://news.bitcoin.com/?p=320095,1561498216,Iranian Energy Grid Blames 7% Consumption Increase on Bitcoin Miners,"Mostafa Rajabi Mashhad, the spokesperson for Tavanir, an Iranian state-operated grid entity, has explained that electrical consumption has spiked by 7% in comparison to the previous year. Rajabi blames illegal cryptocurrency mining operations for the country&apos;s increased electrical consumption and has warned that illicit mining facilities will be cut off from the grid. Also Read: ...The post Iranian Energy Grid Blames 7% Consumption Increase on Bitcoin Miners appeared first on Bitcoin News.",NEGATIVE,없음,BCH | BTC | ETH | MINING,,0,0,Bitcoin.com,https://news.bitcoin.com/iranian-energy-grid-blames-7-consumption-increase-on-bitcoin-miners/,https://images.cryptocompare.com/news/bitcoin.com/cg000000000.jpeg
13358960,https://cointelegraph.com/news/germany-cdu-and-csu-union-to-integrate-blockchain-into-public-services,1561496460,Germany: CDU and CSU Union to Integrate Blockchain Into Public Services,German CDU and CSU Union proposes the deployment of blockchain tech in public services,POSITIVE,없음,BLOCKCHAIN,,0,0,CoinTelegraph,https://cointelegraph.com/news/germany-cdu-and-csu-union-to-integrate-blockchain-into-public-services,https://images.cryptocompare.com/news/cointelegraph/akg281a8000.png
13231923,https://www.newsbtc.com/?p=387478,1561496440,Six Detained in Connection with $28 Million Crypto Heist in Europe,"Six people have been arrested in Europe in relation to the theft of almost $28 million worth of crypto assets. There are thought to be around 4,000 victims of the scam. Those arrested hail from both the United Kingdom and the Netherlands. They were detained earlier today on suspicion of their involvement with the crypto...The post Six Detained in Connection with $28 Million Crypto Heist in Europe appeared first on NewsBTC.",NEGATIVE,없음,OTHER,,0,0,NewsBTC,https://www.newsbtc.com/2019/06/25/six-detained-in-connection-with-28-million-crypto-heist-in-europe/,https://images.cryptocompare.com/news/newsbtc/e002PYjwfW4.jpeg
13244931,https://nulltx.com/?p=95546,1561496433,4 key Notes on Brave Integrating More Tokens and Cryptocurrencies,"In the cryptocurrency and blockchain world, very few projects managed to achieve a prominent status. Especially when it comes to applications or platforms built to improve mainstream adoption, most efforts come up woefully short. The Brave browser is one notable exception in this regard, and it seems a few new currencies will be receiving in-browser ...The post 4 key Notes on Brave Integrating More Tokens and Cryptocurrencies appeared first on NullTX.",POSITIVE,없음,BLOCKCHAIN | ICO | SPONSORED,,0,0,NullTx,https://nulltx.com/4-key-notes-on-brave-integrating-more-tokens-and-cryptocurrencies/,https://images.cryptocompare.com/news/themerkle/9XwBCyxM0gM.jpeg
13585124,https://www.cryptopolitan.com/?p=17776,1561496351,Privacy & Anonymity at the core of Samourai Wallet’s Whirlpool beta launch,"According to the latest report, the Samourai Wallet has launched the beta version of Whirlpool, a Chaumian CoinJoin implementation. The feature supports privacy of transaction by disassociating the senders and recipients of the cryptocurrency and making it challenging to track the crypto exchange. The Samourai Wallet is one of the leading wallet services in the crypto space. It helps in keeping the transactions private, funds secured, and identity is hidden. By launching this new feature, the company has become the first company to offer such type of technology. Whirlpool, a framework backed up by a collection of software tools that",POSITIVE,없음,EXCHANGE | TECHNOLOGY,,0,0,Cryptopolitan,https://www.cryptopolitan.com/privacy-anonymity-at-the-core-of-samourai-wallets-whirlpool-beta-launch/,https://images.cryptocompare.com/news/cryptopolitan/f1EmI8418i0.jpeg
13358961,https://cointelegraph.com/news/europol-arrests-six-people-allegedly-behind-27-million-bitcoin-theft,1561495740,Europol Arrests Six People Allegedly Behind $27 Million Bitcoin Theft,Europol has arrested 6 individuals arrested in connection with a multimillion dollar theft with authorities claiming they stole bitcoin via typosquatting,NEGATIVE,없음,BTC,,0,0,CoinTelegraph,https://cointelegraph.com/news/europol-arrests-six-people-allegedly-behind-27-million-bitcoin-theft,https://images.cryptocompare.com/news/cointelegraph/c$y0zS9O6b0.png
13264476,https://dailyhodl.com/?p=55842,1561495672,"Nicholas Merten: Bitcoin Could Smash Through $20,000 In Next Few Days – BTC, Ethereum, XRP, Litecoin Forecasts","Crypto analyst Nicholas Merten says Bitcoin could test its all-time high of about $20,000 in a matter of days. The popular YouTube analyst points to the fact that, historically, BTC has only been at its current price levels for a very short period of time. &apos;We&apos;re approaching the price range where we saw very fast ...The post Nicholas Merten: Bitcoin Could Smash Through $20,000 In Next Few Days - BTC, Ethereum, XRP, Litecoin Forecasts appeared first on The Daily Hodl.",POSITIVE,BTC | XRP,BTC | ETH | LTC | TRADING | XRP,,0,0,The Daily Hodl,https://dailyhodl.com/2019/06/25/nicholas-merten-bitcoin-could-smash-through-20000-in-next-few-days-btc-ethereum-xrp-litecoin-forecasts/,https://images.cryptocompare.com/news/dailyhodl/9iBe1PxAsZA.png
13285829,https://ambcrypto.com/?p=98694,1561494627,Philippines gets a breath of fresh ‘crypto-air’ as 48 cryptocurrency exchanges get approval,"While the popularity of cryptocurrencies has surged over the past few years, the uncertainty and FUD around it is still a hurdle to it being accepted as a more convenient form of currency and store of value. While virtual assets have established fairly strong grounds in the United States and in parts of Europe, the ...The post Philippines gets a breath of fresh &apos;crypto-air&apos; as 48 cryptocurrency exchanges get approval appeared first on AMBCrypto.",POSITIVE,없음,OTHER,,0,0,AMB Crypto,https://ambcrypto.com/philippines-gets-a-breath-of-fresh-crypto-air-as-48-cryptocurrencies-exchanges-get-approval/,https://images.cryptocompare.com/news/ambcrypto/cR0M21483H0.jpeg
13450668,https://bitcoinist.com/?p=111513,1561492803,Bitcoin Off-Chain Metrics To Improve Your Trading,"They say it&apos;s not what you know but who you know. Of course, when trading Bitcoin, what you know is kinda important too. Following on from our rundown of on-chain metrics, here are a bunch of useful off-chain indicators that no trader should be without. And possibly a few more on-chain metrics too. Again, these are compiled from a guide by crypto-analyst, Adam Taché. Mayer Multiple The &apos;Mayer Multiple&apos; is one of the most popularRead MoreThe post Bitcoin Off-Chain Metrics To Improve Your Trading appeared first on Bitcoinist.com.",POSITIVE,없음,BTC | TRADING,,0,0,Bitcoinist,https://bitcoinist.com/bitcoin-off-chain-metrics-to-improve-your-trading/,https://images.cryptocompare.com/news/bitcoinist/aBFIV963981.jpeg
13231924,https://www.newsbtc.com/?p=387457,1561492803,Bitcoin Price Chart: Monthly Candle Pattern Shows Strongest Trend Reversal Ever,"Bitcoin price is once again making headlines on mainstream media outlets, revisiting once forgotten memories of the crypto bubble of 2017, where Bitcoin&apos;s meteoric rise captured the interest of the world and took it to its all-time high of $20,000. Just this past week, $10,000 was reclaimed by Bitcoin - a price point that last...The post Bitcoin Price Chart: Monthly Candle Pattern Shows Strongest Trend Reversal Ever appeared first on NewsBTC.",POSITIVE,BTC,BTC | TRADING,,0,0,NewsBTC,https://www.newsbtc.com/2019/06/25/bitcoin-price-chart-monthly-candle-pattern-shows-strongest-trend-reversal-ever/,https://images.cryptocompare.com/news/newsbtc/bo4EjG48iga.jpeg
13358962,https://cointelegraph.com/news/kraken-raises-over-13-million-in-its-latest-fundraising-round,1561492140,Kraken Raises Over $13 Million In Its Latest Fundraising Round,Crypto exchange Kraken has raised $13.5 million from 2264 investors in its latest fundraising round,POSITIVE,없음,BTC | BUSINESS | EXCHANGE | ICO,,0,0,CoinTelegraph,https://cointelegraph.com/news/kraken-raises-over-13-million-in-its-latest-fundraising-round,https://images.cryptocompare.com/news/cointelegraph/ck4v1w0MEg2.png
42382203,0r6Zag11PPDEMKgUX9qtYJ,1561491909,Ex-Trump Economist Joins 'Crypto Central Bank' After Failed Fed Bid,"Stephen Moore, who recently rescinded his bid to join the Federal Reserve, announced plans to start his own cryptocurrency-based mini-Fed – billed as “the world’s decentralized central bank,” according to Fox Business.  A pitch deck sent exclusively to Fox allegedly said Moore has teamed with a group of unnamed entrepreneurs to develop a “central bank” – ironically called “Decentral” – aimed at reducing the volatility among digital currencies.  The bank will attempt to regulate the supply of crypto, just as the Fed controls monetary policy in the U.S. It will exchange its own dollar-backed token for other cryptocurrencies and use an algorithm to control the amount of stable tokens in circulation, Decentral officials told FOX. This stable coin is similar to Facebook’s Libra, and aims to promote uniformity and reliability among a fractured landscape of digital assets.  “I’m really excited about doing this,” Moore told the business media outlet. “I hope it makes me rich.”  Moore said he will officially join Decentral on July 1, as chief economic officer and report to Sam Kazemian, Decentral CEO. “These guys are super smart,” he said of his partners.  He also told Fox, he believes cryptocurrencies can circulate in the economy in such a way that they don’t conflict with the Fed's monetary policy, adding, “This is an alternative way of making payments.”  Kazemian told Fox that Decentral isn’t trying to compete with the Fed, but plans to introduce their business model to Fed officials at some point.  “Decentral will solve the biggest problem facing regulators when it comes to the crypto space: The current instability of pricing,” he said.  “Our goal is to be collaborative, not combative,” he said. “The next big wave in the crypto space is a digital currency that is designed to be useful to consumers and keep stable prices instead of acting as volatile, speculative investments. Stable coins are the next big innovation in the crypto industry.”  It’s unclear how Decentral will convince holders to trade their crypto for this new token, or how the firm will act to prevent inflation – a core mandate of Fed – if the business does not have authority to act as a central clearinghouse.  Kedar Iyer will serve as chief technology officer, Travis Moore as director of software, and Henry Liu as chief operating officer —all of whom have backgrounds in crypto and technology startups. The remaining three partners have political backgrounds.  Mike Novogratz is cited as an investor in Decentral’s parent company.  Moore previously worked as an editorial writer for the Wall Street Journal, and was a member of the conservative Heritage Foundation. He is also a distinguished visiting fellow to the White House, following his advisement on President Trump’s 2017 tax plan.  Moore was picked by Trump in March to fill one of two vacant positions at the Fed, but had not been formally nominated. He withdrew his bid in early May after weeks of criticism about his political partisanship, shifting views on interest rate policy, and sexist comments about women.  His discussions with Decentral began at recent SALT conference, a hedge fund and investing confab in early May run by Anthony Scaramucci of SkyBridge Capital.  Federal Reserve seal via Shutterstock",POSITIVE,없음,BUSINESS | EXCHANGE | FIAT | REGULATION | TECHNOLOGY,Daniel Kuhn,0,0,CoinDesk,https://coindesk.com/markets/2019/06/25/ex-trump-economist-joins-crypto-central-bank-after-failed-fed-bid,https://cdn.sanity.io/images/s3y3vcno/production/cadd58fe3b27a2d63f2a968e8fc62e015bb6b1be-1000x706.jpg?w=300&h=300&fit=crop
13244932,https://nulltx.com/?p=95551,1561491637,"Chainlink, VeChain Soar: is Alt Season Here?","Consensus is in that the bull run has officially returned. From local bottoms in the low US$3,000s, Bitcoin has boomed almost four times to its current position of $11,400. For many, this has been a phenomenal first half of the year. But not for all, many altcoin holders still anxiously wait for their big bull ...The post Chainlink, VeChain Soar: is Alt Season Here? appeared first on NullTX.",POSITIVE,없음,ALTCOIN | BTC | LINK | TRADING | VET,,0,0,NullTx,https://nulltx.com/chainlink-vechain-soar-is-alt-season-here/,https://images.cryptocompare.com/news/themerkle/8oIIm0IaIgo.jpeg
13585125,https://www.cryptopolitan.com/?p=17773,1561491427,Disgruntled Chainalysis employee spills confidential company info in revealing Reddit session,"According to the latest report, an employee of a blockchain analysis platform Chainalysis conducted an Ask Me Anything (AMA) session on Reddit and revealed confidential information about the company. Then after twelve hours, the &apos;gone rogue&apos; employee removed all the comments that were made under the username of &apos;chaninalysis1&apos;.Nevertheless, those comments are still present on Removeddit.com and are a window to the company&apos;s inner workings. Chainalysis is a blockchain company that works alongside the government, defense contractors, law enforcement and many intelligence agencies including HSI, CIA IRS, and FBI. The company has always been very secretive about its working until",NEGATIVE,없음,BLOCKCHAIN | MARKET | REGULATION,,0,0,Cryptopolitan,https://www.cryptopolitan.com/disgruntled-chainalysis-employee-spills-confidential-company-info-in-revealing-reddit-session/,https://images.cryptocompare.com/news/cryptopolitan/8MsgkLIFV3g.jpeg
13264477,https://dailyhodl.com/?p=55821,1561491294,Crypto Boom Caution: Bitcoin Baller Brian Kelly Issues Warning for All the FOMO Investors As BTC Rides High,"Bitcoin continues its volatile projection, rocketing past $11,000 over the weekend - the first time at that level since 2017, the year of BTC&apos;s all-time high of nearly $20,000. Having passed the psychological level of $10,000, analysts say Bitcoin is poised to spark an increasing amount of interest from both retail and institutional investors. Appearing ...The post Crypto Boom Caution: Bitcoin Baller Brian Kelly Issues Warning for All the FOMO Investors As BTC Rides High appeared first on The Daily Hodl.",NEUTRAL,BTC,BTC | BUSINESS | TRADING,,0,0,The Daily Hodl,https://dailyhodl.com/2019/06/25/crypto-boom-caution-bitcoin-baller-brian-kelly-issues-warning-for-all-the-fomo-investors-as-btc-rides-high/,https://images.cryptocompare.com/news/dailyhodl/cPM8K0P2f4v.jpeg
13285830,https://ambcrypto.com/?p=98736,1561491010,Tron’s Justin Sun claims stablecoins will be key to cryptocurrency development,"The Justin Sun-led Tron has been in the news multiple times recently, thanks to its regular updates and noticeable price hikes. The CEO has also played a very active role in promoting the cryptocurrency, as exhibited by his recent AMA on Periscope. Sun focused on how the initial success with protocol governance in the Tron ...The post Tron&apos;s Justin Sun claims stablecoins will be key to cryptocurrency development appeared first on AMBCrypto.",POSITIVE,없음,ALTCOIN | BLOCKCHAIN | TRADING,,0,0,AMB Crypto,https://ambcrypto.com/trons-justin-sun-claims-stablecoins-will-be-key-to-cryptocurrency-development/,https://images.cryptocompare.com/news/ambcrypto/d0ww02g0000.jpeg
13410396,https://cryptopotato.com/?p=33900,1561490505,"Whale Alert: 8,884 Bitcoins ($101 Million) On The Move To Coinbase","While Bitcoin holders are no doubt content with the recent consolidation above $11,000, a whale alert from a short while ago could potential either increase the joy for traders or spoil the merry mood. The 8,884 BTC transaction, which is worth approximately $101,530,110, had left an unknown wallet in its way to the US based ...The post Whale Alert: 8,884 Bitcoins ($101 Million) On The Move To Coinbase appeared first on CryptoPotato.",POSITIVE,BTC,BTC | EXCHANGE,,0,0,Crypto Potato,https://cryptopotato.com/whale-alert-8884-bitcoins-101-million-on-the-move-to-coinbase/,https://images.cryptocompare.com/news/cryptopotato/b8Oyog0O44o.jpeg
13435197,https://news.bitcoin.com/?p=320062,1561489851,The Guns N’ Bitcoin Scorpion Case Holds Your Shooter and Your Satoshis,"Digital assets have become very valuable over the last few years, spawning a string of devices that protect cryptocurrencies from malware and mishandling. Now there&apos;s a company called Guns N&apos; Bitcoin that offers a durable case called the Scorpion that holds not only a hardware wallet, but also three types of full to compact pistols ...The post The Guns N&apos; Bitcoin Scorpion Case Holds Your Shooter and Your Satoshis appeared first on Bitcoin News.",POSITIVE,없음,BTC,,0,0,Bitcoin.com,https://news.bitcoin.com/the-guns-n-bitcoin-scorpion-case-holds-your-shooter-and-your-satoshis/,https://images.cryptocompare.com/news/bitcoin.com/booVb4go100.jpeg
13585126,https://www.cryptopolitan.com/?p=17759,1561489231,Saudi Arabia testing ATM face recognition technology with blockchain,"Alhamrani Universal, one of Saudi Arabia&apos;s largest ATM providers has partnered up with a US-based identity platform ShoCard in order to introduce a completely revamped method of using ATMs in the country. According to research, US citizens suffered as many as 60 million credit card theft last year alone and Saudi Arabia is no different. The local banks are starting to see the issues with credit card fraud and therefore are hoping to solve the issue by using the blockchain technology. ShoCard will introduce a completely new algorithm to the local ATMs which will allow users to access their accounts",POSITIVE,없음,BLOCKCHAIN | TECHNOLOGY | RESEARCH,,0,0,Cryptopolitan,https://www.cryptopolitan.com/saudi-arabia-testing-atm-face-recognition-technology-with-blockchain/,https://images.cryptocompare.com/news/cryptopolitan/dxExOqxgGx6.jpeg
