뉴스ID,뉴스GUID,일자(UTC timestamp),뉴스제목,본문,SENTIMENT,주요코인,카테고리,작성자,추천수,비추천수,출처,뉴스URL,이미지URL
6719768,https://seekingalpha.com/news/3921346-ftx-japan-liquid-japan-aim-to-resume-withdrawals-in-february?utm_source=cryptocompare.com&utm_medium=referral,1672427210,"FTX Japan, Liquid Japan aim to resume withdrawals in February","FTX's ( FTT-USD ) unit FTX Japan and cryptocurrency exchange Liquid Japan are working on resuming withdrawals through Liquid Japan's website in February. FTX Japan users will be able to check their balance and withdraw funds through Liquid Japan, which FTX acquired earlier this year , according to a timeline announced by Liquid in a blog post. FTX Japan customers will be able to open Liquid Japan accounts in mid-January. They can then transfer assets from FTX Japan to Liquid Japan and withdraw funds by mid-February. ""Please note that the timeline may change depending on the progress of the external security audit,"" the blog post cautioned. Earlier, FTX Japan reportedly aimed to resume customer withdrawals by the end of 2022 . After the implosion of beleaguered crypto exchange FTX, its Japanese unit's operations were suspended by the country's financial regulator last month .",NEUTRAL,없음,ASIA | EXCHANGE,,0,0,Seeking Alpha,https://seekingalpha.com/news/3921346-ftx-japan-liquid-japan-aim-to-resume-withdrawals-in-february?utm_source=cryptocompare.com&utm_medium=referral,https://resources.cryptocompare.com/news/50/6719768.jpeg
42394479,CpI5Y2Su0uMQDo69bw8KZx,1672427151,What Is an NFT Floor Price?,"If you are evaluating the intrinsic value of a non-fungible token (NFT) in a collection, you may consider several metrics. One is called the floor price, which is usually denominated in cryptocurrencies or in stablecoins pegged to the U.S. dollar.  The number refers to the minimum price a seller wants for an NFT in any given collection. But the usefulness of floor prices is somewhat more complex – and the metric can be manipulated to make a collection seem more popular than it is.  Floor prices explained  OpenSea, the largest NFT marketplace, defines the floor price as “the lowest price for collection items, rather than the average item price.” The metric is updated in real time as sales of NFTs in a collection roll in. The calculation of a floor price typically doesn't include Dutch auctions, where the price of an NFT is reduced until someone is willing to buy it.  The floor price is often a good starting point for understanding the popularity of an NFT collection and its perceived value over time. Collections with a high floor price might be more popular, and dips in floor price might signal that interest in that project is waning.  For instance, as of this writing, the floor price for an NFT in the wildly popular Bored Ape Yacht Club (BAYC) collection on OpenSea is 74.7 ETH, or about $89,450. The floor price of a collection can vary slightly by platform – for example, on Rarible, the floor price for BAYC is 72 ETH (about $86,200).  Because the floor price sets the bar for the value of an NFT within a collection, many NFTs with rare traits will sell for more than the floor price. Ape #8552, which features rare traits like gold fur, sold for 95 wrapped ether (wETH) in July 2021 (worth about $241,470 at the time).  The discrepancy reveals something inherent to non-fungible tokens: Although they may be part of a collection, each digital asset is unique and can sell for varying prices, depending on rarity traits or features specific to an individual token. Fluctuations in market conditions can also affect floor prices.  In addition, the term floor price is sometimes used to refer to NFTs grouped by trait. So, someone might say that the floor price for a gold Ape is higher than others, and so on.  It’s pretty easy to find the floor price for a collection. On OpenSea, you can click on an individual collection, and it will show the floor price data next to the collection’s total sales volume and the best offer made by a buyer. On the analytics tab, you can view the project’s floor price over the period of a week. Tools like Nansen’s NFT Paradise or CryptoSlam also provide easy access to floor prices, and Gem aggregates floor prices across different platforms.  Can you rely on the floor price metric?  The floor price simply determines the lowest asking price for a given NFT collection. But that doesn't mean that collectors are willing to buy at that price – or that an NFT is really worth the floor price if you buy it.  Data from Nansen’s NFT Paradise analytics tool helps to illustrate this. Tamadoge Common, an NFT project that was released in October 2022, had a floor price of 200 ETH (about $311,500) on Oct. 24, 2022. That price meant that the owners of the NFTs weren't willing to part with their NFTs for less than 200 ETH. At the time, the trading volume was just 12 ETH, suggesting that no buyer was willing to match the floor price. As of December 2022, the collection has done about 22 ETH (about $26,350) in total sales volume, according to OpenSea, and the floor price is hovering at around 0.2 ETH (about $240).  Now, does that mean that a Tamadoge Common NFT was worth 200 ETH? Not really. Even if you bought it, all the market knows is that you thought it was worth 200 ETH at the time, though you may struggle to find another buyer at that price if you decide to sell.  Just as relevant to collectors is the best offer price, which refers to the maximum amount that other traders are willing to pay for an NFT in the collection. Like a floor price, this figure is constantly updated to reflect the most recent highest offer made by an interested buyer. The difference between the best offer price and the floor price is like a spread in a cryptocurrency trade.  Remember who sets the floor price  It’s important to note that only those who hold NFTs in a collection can set the floor price. Those who set the floor price aren't necessarily reliable arbiters of value. Indeed, they may be working to deceive buyers.  Those who hold NFTs may work together to artificially raise the floor price of a collection by refusing to sell for anything less than an agreed price. For example, if I conspired with other holders of a particular NFT collection to not sell our NFTs below 100 ETH, even though that number is artificially inflated beyond the collection's actual value, we could deceptively increase the floor price.  Related is a term called “sweeping the floor,” which refers to the act of purchasing multiple NFTs in a collection at its floor price. If a buyer sweeps the floor, it may imply that the project is gaining momentum, though it could also signal an effort by a single entity to manipulate the floor price.  Another form of manipulation is called wash trading, where the buyer and seller in a transaction are the same or collude together. For example, an owner of a BAYC NFT might list that NFT at an inflated price and buy it back himself.  Ultimately, floor price can be a useful tool for NFT traders to understand if a collection is gaining popularity and what the entry point is for buying an NFT in that collection. It’s important, however, to exercise caution and look at multiple data points to make an informed decision.",NEUTRAL,ETH,ETH | FIAT | MARKET | TRADING,Robert Stevens,0,0,CoinDesk,https://coindesk.com/learn/what-is-an-nft-floor-price,https://cdn.sanity.io/images/s3y3vcno/production/253b137519a4dd27baa0aeb5adbb90aab05259fe-1440x1080.jpg?w=300&h=300&fit=crop
6719657,https://dailyhodl.com/?p=230490,1672427149,"Bitcoin (BTC) To Bottom Out After Another Massive Drop, Predicts Coin Bureau – Here’s the Timeline","A popular crypto analyst says the crypto market could see one more massive decline before bottoming in early 2023. In a new YouTube strategy session, pseudonymous Coin Bureau host Guy tells his 2.19 million subscribers that Bitcoin (BTC) could decline by as much as 60% in the near term. “The bottom will likely come sometime The post Bitcoin (BTC) To Bottom Out After Another Massive Drop, Predicts Coin Bureau – Here’s the Timeline appeared first on The Daily Hodl .",NEGATIVE,BTC,BTC | MARKET,,0,0,The Daily Hodl,https://dailyhodl.com/2022/12/30/bitcoin-btc-to-bottom-out-after-another-massive-drop-predicts-coin-bureau-heres-the-timeline/,https://images.cryptocompare.com/news/default/dailyhodl.png
6719594,https://blockworks.co/news/crypto-market-cap-2022,1672426914,Crypto Market Caps Collapsed in 2022 – With These Notable Exceptions,"Metaverse token ApeCoin’s market cap has soared 38% since its March debut, a rarity in rocky crypto markets this year",POSITIVE,없음,ICO | MARKET,,0,0,Blockworks,https://blockworks.co/news/crypto-market-cap-2022,https://images.cryptocompare.com/news/default/blockworks.png
6719454,https://bitcoinist.com/?p=211471,1672426835,Metaverse: The Biggest Loser Of 2022 In Crypto Sector,"Report shows Metaverse, the killer narrative of 2021, turned out to be the biggest loser in the crypto sector this year. Metaverse Observes Drawdown Of 89% Over The Year 2022 As per the year-end report by Arcane Research, both the alternative layer 1s craze and the Metaverse hype of last year came crashing hard in",NEGATIVE,없음,BTC | ETH | XMR | RESEARCH | BNB,,0,0,Bitcoinist,https://bitcoinist.com/metaverse-biggest-loser-of-2022-crypto-sector/,https://images.cryptocompare.com/news/default/bitcoinist.png
6719458,https://newsbtc.com/?p=514285,1672426819,"Ethereum Finishes 2022 With ATH Correlation To Bitcoin, Despite The Merge","Data shows Ethereum’s year of high correlation with Bitcoin is coming to an end with the metric hitting ATH values. Ethereum Ends 2022 With All-Time High Correlation To Bitcoin According to the year-end report from Arcane Research, the global markets have all fallen strongly correlated this year. The “30-day correlations” is an indicator that measures how in-tune Bitcoin has been with another asset in terms of price movement over a 30-day period. When the value of this metric is greater than zero, it means there has been a positive correlation between BTC and the other asset in the past month. On the other hand, negative values imply that the price of the crypto has been reacting to changes in the value of the other asset by moving in the opposite direction. Also, the higher the metric value (in either direction), the more the degree of the correlation. Naturally, the metric has a value equal to zero suggesting the two prices aren’t tied to each other at the moment. Related Reading: Analyst Explains Why Ethereum Is Bullish Against Bitcoin Now, here is a chart that shows the trend in Bitcoin’s 30-day correlations with Ethereum, S&P 500, and Nasdaq over the past year: Looks like the metric's value corresponding to ETH has been very high in recent weeks | Source: Arcane Research's 2022 - Year in Review As the above graph displays, Bitcoin positively correlated with these three assets during 2022. BTC’s correlation has been around or above 0.5 for most of the year for the US equities, suggesting it has been decently tied with them. The correlation with Ethereum, however, has been at values of around 0.9 or more, implying Bitcoin has been extremely correlated with it. Even now, as the year’s end, the correlation between these cryptos stands at 0.97, around ATH levels. Back in September of this year, ETH successfully finished its much-anticipated transition to a Proof-of-Stake consensus system, an event known as the Merge. Since the Merge brought some developments unique to Ethereum, the correlation with BTC dropped, as is apparent in the chart. However, it wasn’t long before the two started moving on the same wavelength again, so even the Merge wasn’t enough to cause sufficient impact to separate the coins. Related Reading: Most Public Crypto Firms Underperformed Bitcoin In 2022, Miners Hit Worst Also, since Bitcoin is highly correlated with stocks, so is Ethereum. Though, Arcane Research expects that this correlation between the cryptos and the US equities will soften in the next year due to trading volumes in the crypto market declining substantially. ETH Price At the time of writing, Ethereum’s price floats around $1,200, down 2% in the last week. ETH seems to have gone down recently | Source: ETHUSD on TradingView Featured image from Pierre Borthiry – Peiobty on Unsplash.com, charts from TradingView.com, Arcane Research",NEUTRAL,BTC | ETH,BTC | ETH | MARKET | TRADING | RESEARCH,,0,0,NewsBTC,https://newsbtc.com/news/ethereum/ethereum-ath-correlation-bitcoin-merge/,https://resources.cryptocompare.com/news/21/6719458.jpeg
6719129,https://www.cryptoknowmics.com/news/?p=250780,1672426443,Zeus Joins Chain Verse and Receives Funding from Oasys,"Zeus has declared that it has received funding from Oasys. Zeus and Oasys successfully merged with the Chain Verse Network at the same time. For those who are unaware, Chain Verse is a Layer 2 Versus Chain that ChainGuardians have constructed in the proper manner. Additionally, this is situated on the Oasys Chain. In terms of the Chain Verse, Zeus will soon release two brand-new, exhilarating games, namely Race4Sky and Voxel Worlds. .@Voxel_Worlds and @Race4Sky are coming to #ChainVerse on #Oasys 🎮✨ 👇Check more details from the article belowhttps://t.co/9EGPBF3YVc https://t.co/AWMduXW88J — Oasys🏝Blockchain for Games (@oasys_games) December 30, 2022 What Do The post Zeus Joins Chain Verse and Receives Funding from Oasys appeared first on Cryptoknowmics-Crypto News and Media Platform .",NEUTRAL,없음,BLOCKCHAIN,,0,0,Cryptoknowmics,https://www.cryptoknowmics.com/news/zeus-joins-chain-verse-and-receives-funding-from-oasys/,https://images.cryptocompare.com/news/default/cryptoknowmics.png
6719036,https://zycrypto.com/?p=76865,1672426314,"Did FTX’s Sam Bankman-Fried Just Violate House Arrest By Cashing Out $648,000 In ETH?","Recent reports by on-chain analyst, BowTiedIguana, now suggest that Sam Bankman Fried, the embattled FTX co-founder, may have pulled out 570ETH worth close to $682,000 from his wallet, potentially violating the conditions for bail set by the court.",NEGATIVE,ETH,ETH,,0,0,ZyCrypto,https://zycrypto.com/did-ftxs-sam-bankman-fried-just-violate-house-arrest-by-cashing-out-648000-in-eth/,https://images.cryptocompare.com/news/default/zycrypto.png
6718754,https://coinedition.com/?p=238037,1672425960,Ben Armstrong Supports Andrew Tate After Arrest for Human Trafficking,"Crypto analyst Ben Armstrong aka BitBoy has expressed his support for controversial social media personality Andrew Tate, hours after the influencer was arrested in Romania for human trafficking. Tate and his brother Tristan were both detained following a house raid in Bucharest. “Andrew Tate is a top G,” claimed the crypto influencer and followed it The post Ben Armstrong Supports Andrew Tate After Arrest for Human Trafficking appeared first on Coin Edition .",NEUTRAL,없음,OTHER,,0,0,Coin Edition,https://coinedition.com/ben-armstrong-supports-andrew-tate-after-arrest-for-human-trafficking/,https://resources.cryptocompare.com/news/7/default.png
6718287,https://www.cryptopolitan.com/?p=252168,1672425305,Reviewed: Trump NFTs trading stats and why is it not surprising?,"Trump NFTs have been the most talked about digital collectibles across that market sector for a while. This is a result of the hype that followed the Donald Trump-owned digital collectibles launch. Aside from Twitter and other social media, the digital arts were also discussed across various TV stations in the US. However, that hype … Reviewed: Trump NFTs trading stats and why is it not surprising? Read More »",NEUTRAL,없음,MARKET | TRADING,,0,0,Cryptopolitan,https://www.cryptopolitan.com/reviewed-trump-nfts-stats-and-not-surprising/,https://resources.cryptocompare.com/news/43/6718287.jpeg
6718215,https://cryptopotato.com/?p=231001,1672425222,Ethereum’s Vitalik Buterin Comments on Solana’s Future,Buterin believes Solana still has intrinsic value and can recover from its current predicament.,NEUTRAL,없음,ETH | SOL,,0,0,Crypto Potato,https://cryptopotato.com/ethereums-vitalik-buterin-comments-on-solanas-future/,https://resources.cryptocompare.com/news/27/6718215.jpeg
6718048,https://ambcrypto.com/?p=280890,1672425050,Why Bitcoin whales may be the powers that decide BTC’s fate,"Whales with more than 1,000 BTC had been involved in selling for most of 2022. Increased BTC dump could drive the price further down in the mid-term. Bitcoin [BTC] whales’ impact in the broader crypto market has never been in doubt, but their recent behavior could send the king coin further down the charts, a",NEGATIVE,BTC,BTC | MARKET | TRADING,,0,0,AMB Crypto,https://ambcrypto.com/why-bitcoin-whales-may-be-the-powers-that-decides-btcs-fate/,https://images.cryptocompare.com/news/default/ambcrypto.png
6718192,https://cointelegraph.com/news/companies-and-investors-may-need-to-return-billions-in-funds-paid-by-ftx,1672425000,Companies and investors may need to return billions in funds paid by FTX,"Billions of dollars paid in the months leading up to FTX’s bankruptcy may be returned to pay the crypto exchange’s creditors, according to an insolvency attorney.",NEGATIVE,없음,BUSINESS | EXCHANGE | BNB,,0,0,CoinTelegraph,https://cointelegraph.com/news/companies-and-investors-may-need-to-return-billions-in-funds-paid-by-ftx,https://resources.cryptocompare.com/news/16/6718192.jpeg
42388296,1WhGe7o17bdD4QO5qRDMsZ,1672424774,"NFT Market Will Bounce Back With Lower Interest Rates, Digital Artist Says","One of the leading artists in Web3 sees one way for non-fungible tokens (NFTs) to bounce back from the crypto winter: the Federal Reserve lowering interest rates.  Ovie Faruq, who is also known as OSF, told CoinDesk TV’s “First Mover” on Thursday that once that happens, equities will have room to rally, giving digital collectibles the runway to rise again.  “What most of the NFT market has realized is that it's this hybrid asset,” said Faruq, a former credit derivatives trader at Barclays. “But it is correlated to crypto, which is correlated to Nasdaq, which is correlated to global financial markets.”  Read more: Most Influential Artist: Ovie Faruq  According to blockchain data tracker CryptoSlam, global NFT sales declined by 89% in November from a peak of $5 billion in January, Bloomberg reported.  The nosedive in NFTs sales is influenced by the Fed raising interest rates in the face of all-time high inflation coupled with “tourist money” swiftly leaving the market. That leaves retail investors in a tough spot, according to Faruq.  Nonetheless, NFTs may have increased utility down the road as users move toward digital identities.  “This general change in secular trends, that's something that will not change and will continue to escalate and become a larger part of our lives,” Faruq said.  The 33-year-old recently created “Market Wizards” for CoinDesk’s Most Influential 2022, which features four of crypto's biggest scammers. The piece sold for 41 ETH on crypto exchange Coinbase (COIN).  “There will be a lot of art that comes out of this year … and collecting pieces that reflect that will be something that will potentially have a lot of value in the future,” Faruq said.  Read more: Presenting CoinDesk's Most Influential 2022",POSITIVE,ETH,BLOCKCHAIN | BUSINESS | ETH | EXCHANGE | MARKET,Fran Velasquez,0,0,CoinDesk,https://coindesk.com/web3/2022/12/30/nft-market-will-bounce-back-with-lower-interest-rates-digital-artist-says,https://cdn.sanity.io/images/s3y3vcno/production/ff9ffed451dbd313e3faaac9cbb8cf086fbaa794-1440x1080.png?w=300&h=300&fit=crop
6717414,https://coinedition.com/?p=238040,1672424160,Analyst Miles Deutscher Shares Life Lessons About Crypto in 2022,"Crypto analyst Miles Deutscher tweets about the biggest lessons worth learning in 2022. According to Deutscher, DeFi is the only way forward. Most of this year’s major collapses were a reflection of human nature, not the underlying technology. FTX, Celsius, BlockFi, Voyager, Genesis to name a few. He further advocated the need for DeFi. The The post Analyst Miles Deutscher Shares Life Lessons About Crypto in 2022 appeared first on Coin Edition .",NEUTRAL,없음,TECHNOLOGY,,0,0,Coin Edition,https://coinedition.com/analyst-miles-deutscher-shares-life-lessons-about-crypto-in-2022/,https://resources.cryptocompare.com/news/7/default.png
6717367,https://thecoinrise.com/?p=56524,1672424151,Cardano Leads as Blockchain With Highest Development Activity in 2022,"Proof-of-Stake protocol Cardano has managed to maintain its peak position in terms of blockchain development activity this year The post Cardano Leads as Blockchain With Highest Development Activity in 2022 appeared first on Blockchain, Crypto and Stock News .",POSITIVE,없음,ADA | BLOCKCHAIN | BUSINESS,,0,0,The Coin Rise,https://thecoinrise.com/cardano-leads-as-blockchain-with-highest-development-activity-in-2022/,https://images.cryptocompare.com/news/default/thecoinrise.png
6717085,https://thecoinrise.com/?p=56521,1672423711,Galaxy Digital CEO Tags Helios $65M Deal a ‘Transformative Acquisition’,"Mike Novogratz, the CEO of Galaxy Digital with plans for Helios mining has tagged the deal a “transformative acquisition” for the firm The post Galaxy Digital CEO Tags Helios $65M Deal a ‘Transformative Acquisition’ appeared first on Blockchain, Crypto and Stock News .",NEUTRAL,없음,BLOCKCHAIN | BUSINESS | MINING,,0,0,The Coin Rise,https://thecoinrise.com/galaxy-digital-ceo-tags-helios-65m-deal-a-transformative-acquisition/,https://images.cryptocompare.com/news/default/thecoinrise.png
6716709,https://bitcoinist.com/?p=211393,1672423214,"A Crypto Holiday Special: Past, Present, And Future With Ex-Binance CFO Wei Zhou","2022 is coming to an end, and our staff at Bitcoinist decided to launch this Crypto Holiday Special to provide some perspective on the crypto industry. We will talk with multiple guests to understand this year’s highs and lows for crypto. Related Reading: Bitcoin Ends 2022 With 55% Of Supply In Loss, But Is It",NEUTRAL,없음,BTC | ETH,,0,0,Bitcoinist,https://bitcoinist.com/crypto-holiday-past-future-with-ex-binance-cfo-zhou/,https://resources.cryptocompare.com/news/13/6716709.jpeg
