뉴스ID,뉴스GUID,일자(UTC timestamp),뉴스제목,본문,SENTIMENT,주요코인,카테고리,작성자,추천수,비추천수,출처,뉴스URL,이미지URL
13459764,https://www.cryptonewsz.com/?p=105016,1635335127,Federated E-Cash Can Act as Bitcoin Scaling Solution,"David Chaum first introduced the concept of E-cash in 1983. Since then, it has been considered as one of the cornerstones to promoting honest transactions. The Federation of E-Cash is an entity constituted by independent members who act as distributed custodians for the creation of a multi-sig wallet. The basic principle behind the operation of …",POSITIVE,없음,BLOCKCHAIN | BTC,,0,0,CryptoNewsZ,https://www.cryptonewsz.com/federated-e-cash-can-act-as-bitcoin-scaling-solution/,https://images.cryptocompare.com/news/default/cryptonewsz.png
13257078,https://dailyhodl.com/?p=170817,1635335110,Ripple Tackles $78 Billion Remittance Industry in Middle East Using New XRP-Based On-Demand Liquidity Program,"While clashing in court with US regulators, Ripple Labs continues to launch its XRP-powered cross-border payment product, On-Demand Liquidity (ODL), in new regions of the world. ODL works by leveraging XRP to eliminate the necessity for pre-funded accounts in cross-border payments. The San Francisco-based company announced this week that it is deploying ODL in the ...The post Ripple Tackles $78 Billion Remittance Industry in Middle East Using New XRP-Based On-Demand Liquidity Program appeared first on The Daily Hodl.",POSITIVE,XRP,ALTCOIN | XRP,,0,0,The Daily Hodl,https://dailyhodl.com/2021/10/27/ripple-tackles-78-billion-remittance-industry-in-middle-east-using-new-xrp-based-on-demand-liquidity-program/,https://images.cryptocompare.com/news/default/dailyhodl.png
13494368,https://seekingalpha.com/news/3758862-network-media-receives-strategic-investment-from-hive-blockchain-and-us-global-investors?utm_source=cryptocompare.com&utm_medium=referral,1635335010,Network Media receives strategic investment from Hive Blockchain and U.S. Global Investors,"Network Media (OTCPK:NETWF) received a strategic investment from HIVE Blockchain Technologies (NASDAQ:HIVE) and U.S. Global Investors (NASDAQ:GROW) and closed its earlier announced non-brokered private placement. In the offering, the company issued 13.8M shares at $0.15/share for gross proceeds of $2.08M; net proceeds will be used for ancillary business opportunities, operations, research, and development of NFT content initiatives, and working capital requirements. The securities issued are subject to a statutory hold period, expiring Feb.28, 2022. &apos;Network&apos;s creative leadership and reputation as producers of premium content for global audiences, alongside their access to valued intellectual property, presented the perfect opportunity to forge a strategic relationship to embrace the NFT revolution together,&apos; Chairman Frank Holmes commented. Network has granted incentive stock options to certain directors, officers, employees, and consultants for the right to purchase 690K shares; options are exercisable at $0.16/share for 5 years. HIVE shares trading 5% down premarket while GROW shares are 3% higher.",NEUTRAL,없음,BLOCKCHAIN | BUSINESS | ICO | TRADING | RESEARCH,,0,0,Seeking Alpha,https://seekingalpha.com/news/3758862-network-media-receives-strategic-investment-from-hive-blockchain-and-us-global-investors?utm_source=cryptocompare.com&utm_medium=referral,https://images.cryptocompare.com/news/default/seekingalpha.png
13498614,https://coinquora.com/?p=94389,1635334860,"Lark Says Shiba Inu Surpasses SOL, ADA, DOGE, and XRP in Trading Volume","Lark Davis says that Shiba Inu is doing better in trading volume than Shiba Inu (SHIB), Solana (SOL), Cardano (ADA), ...Read More...",POSITIVE,ADA | SHIB | SOL | XRP,ADA | SHIB | SOL | TRADING | XRP,,0,0,Coin Edition,https://coinquora.com/lark-says-shiba-inu-surpasses-sol-ada-doge-and-xrp-in-trading-volume/,https://images.cryptocompare.com/news/default/coinquora.png
13383962,https://zycrypto.com/?p=57967,1635334363,"Bitcoin Drops By $2,000 In Minutes: Here Are Key Factors Of The Slip Below $59,000","The bitcoin price has dropped by almost $2,000 within five minutes from over $60,000 to the $58K level on October 27 in an abrupt market pullback. Bitcoin Slump Wiped Out Over $500 Million Following a recent run-up to all-time highs and a subsequent retesting of the $60,000 region, several pundits expected bitcoin to undergo a ...",NEGATIVE,없음,BTC | MARKET | TRADING,,0,0,ZyCrypto,https://zycrypto.com/bitcoin-drops-by-2000-in-minutes-here-are-key-factors-of-the-slip-below-59000/,https://images.cryptocompare.com/news/default/zycrypto.png
13498615,https://coinquora.com/?p=94014,1635334320,"Exclusive Interview With Igneus Terrenus, Head of Communications at Bybit","Q. Can you please introduce yourself? Hi, I&apos;m Igneus Terrenus. I&apos;m the Head of Communications at Bybit crypto exchange. We ...Read More...",NEUTRAL,없음,EXCHANGE,,0,0,Coin Edition,https://coinquora.com/exclusive-interview-with-igneus-terrenus-head-of-communications-at-bybit/,https://images.cryptocompare.com/news/default/coinquora.png
13494369,https://seekingalpha.com/news/3758848-robinhoods-huge-q3-miss-driven-by-crypto-trading-revenue-dropoff?utm_source=cryptocompare.com&utm_medium=referral,1635334258,Robinhood's huge Q3 miss driven by crypto trading revenue dropoff,"Robinhood (NASDAQ:HOOD) stock falls 9.4% in premarket trading as investors absorb the dramatic dropoff in its cryptocurrency-transaction revenue in the fintech&apos;s Q3 earnings report. Crypto trading revenue sank by 78% from Q2&apos;s $233M. The $51M of crypto trading revenue in Q3 fell $112M short of Piper Sandler analyst Richard Repetto&apos;s estimate. That&apos;s a far sharper drop than the 35% reduction in total crypto trading volume across the industry, Repetto points out in a note. Repetto has a Neutral rating and $38 price target on the stock. Robinhood (HOOD) didn&apos;t break out dogecoin (DOGE-USD) trading revenue this quarter. In Q2, the company said 62% (or $145M) of its crypto trading revenue came from doge, up from 34% in Q1. More Robinhood (HOOD) shares will unlock for trading over the next fives weeks, Repetto adds. Some 62M will become unlocked on Wednesday, and ~49M more will unlock on Nov. 10, Robinhood CFO Jason Warnick",NEGATIVE,DOGE,BUSINESS | DOGE | TRADING,,0,0,Seeking Alpha,https://seekingalpha.com/news/3758848-robinhoods-huge-q3-miss-driven-by-crypto-trading-revenue-dropoff?utm_source=cryptocompare.com&utm_medium=referral,https://images.cryptocompare.com/news/default/seekingalpha.png
42410961,GJVPKSa3D710Liw1ggtkFy,1635334200,The Evolution of Ethereum’s Monetary Policy,"This article originally appeared in Valid Points, CoinDesk’s weekly newsletter breaking down Ethereum 2.0 and its sweeping impact on crypto markets. Subscribe to Valid Points here.  Ethereum’s native asset was once discredited by bitcoiners and investors alike for its lack of hard monetary policy and ever-inflationary “tokenomics.” However, the combination of decentralized finance (DeFi), Ethereum Improvement Proposal (EIP) 1559 and the coming transition to proof-of-stake has worked to create what ether holders call “Ultra Sound Money.”  Ethresear.ch recently introduced multiple new models to predict the circulating supply of ether after the Merge takes place. To understand their findings and the variables involved in their models, it’s essential to know the following:  Ether is distributed to reward miners for producing blocks under proof-of-work (PoW) and, under Ethereum 2.0, will be used to reward validators for proposing blocks in proof-of-stake (PoS).  EIP 1559 introduced a deflationary mechanism to the network, creating a base transaction fee for utilizing block space on the network and then burning that fee out of existence.  Ethereum 2.0 has an adaptive yield demand curve that attempts to ensure “minimum viable issuance,” or that enough validators are working to secure the network.  Since EIP 1559 was implemented on Aug. 4, 620,000 ETH at a market value of $2.6 billion has been burned through transaction fees. Using that burn rate and the current network demand metrics, Ethresear.ch found that around 2.5% of ether’s circulating supply would be burnt annually. Under proof-of-work, the 2.5% burn only offsets a portion (~39%) of ether’s emission schedule. However, emissions fall drastically post-Merge, potentially even making the asset deflationary.  Going back to Ethereum 2.0′s adaptive yield curve, the blockchain looks to incentivize enough validators to properly secure the network and not any more. Assuming that staking yield falls around 3%, Ethresear.ch’s model predicts that the long-term supply of ether may fall anywhere between 27.3-49.5 million ETH or 23%-42% of today’s supply.  Such a reduction in supply could easily be met with the expectation that ether will be infinitely more scarce than it is today. However, the model requires assuming that demand for blockspace will stay at current levels, which is harder to predict now than ever. Alternative layer 1s continue to grow in popularity, but layer 2 systems built atop Ethereum are just getting started.  Read more: The Success of Ethereum’s Alternative Ecosystems  Welcome to another edition of Valid Points.  Pulse check  The following is an overview of network activity on the Ethereum 2.0 Beacon Chain over the past week. For more information about the metrics featured in this section, check out our 101 explainer on Eth 2.0 metrics.     Disclaimer: All profits made from CoinDesk’s Eth 2.0 staking venture will be donated to a charity of the company’s choosing once transfers are enabled on the network.  Validated takes  Terraform Labs CEO Do Kwon is suing the U.S. Securities and Exchange Commission (SEC) after being served with a subpoena at Messari’s conference last month. BACKGROUND: Do Kwon believes the SEC may have violated its own rules by serving him as a South Korea resident. Furthermore, the founder announced that Terra and Mirror are decentralized and cannot simply be “shut down,” contrary to what regulators might believe.  Polymarket, the largest DeFi predictions market, is said to be under investigation by the Commodities Futures Trading Commision (CFTC). BACKGROUND: Amid a potential billion-dollar funding round, the CFTC is looking into whether Polymarket offered unregulated swaps or binary options. The firm hired the CFTC’s former head of enforcement to deal with the investigation.  A large interoperable Merge developer network is aimed for release during November. BACKGROUND: Eth1 and Eth2 clients came together to launch a test network earlier this month and now aim to release a larger version with further client interoperability. The symbiosis between execution and consensus clients and the creation of successful test networks are positive signs for a successful Merge.  Uniswap has done over $500 billion in trading volume since its inception in November 2018. BACKGROUND: Uniswap is the most popular decentralized exchange on Ethereum Layer 1 and is continuing to expand on Arbitrum and Optimism. According to Token Terminal, the protocol has also returned $1.6 billion in revenue to its liquidity providers.  Decentralized stablecoins have come back to the DeFi spotlight as FXS and SPELL surge in price. BACKGROUND: Regulation of stablecoins and the demand for cheap leverage has led to recent growth in the Maker, Abracadabra and Frax ecosystems, with decentralized stablecoins chipping away at USDT and USDC’s market share.  Factoid of the week  Open comms  Valid Points incorporates information and data about CoinDesk’s own Eth 2.0 validator in weekly analysis. All profits made from this staking venture will be donated to a charity of our choosing once transfers are enabled on the network. For a full overview of the project, check out our announcement post.  You can verify the activity of the CoinDesk Eth 2.0 validator in real time through our public validator key, which is:  0xad7fef3b2350d220de3ae360c70d7f488926b6117e5f785a8995487c46d323ddad0f574fdcc50eeefec34ed9d2039ecb.  Search for it on any Eth 2.0 block explorer site.",POSITIVE,ETH,ETH | LUNA | MARKET | REGULATION | TRADING,Edward Oosterbaan,0,0,CoinDesk,https://coindesk.com/tech/2021/10/27/the-evolution-of-ethereums-monetary-policy,https://cdn.sanity.io/images/s3y3vcno/production/3958f74690fb279913cb524c8a797eefd336e841-1440x1080.jpg?w=300&h=300&fit=crop
13459765,https://www.cryptonewsz.com/?p=105011,1635334049,Bitcoin (BTC) Falls Below $60000 After Two Weeks!,"Since the flash crash, a hostile stance has been hovering over BTC, promoting holders to book some of their profits. Flash crash occurs rarely, but once it does, the positivity on the asset goes down the drain. Had this profit booking stopped before the immediate resistance, we would have witnessed a fresh all-time high in …",NEGATIVE,BTC,BTC | BUSINESS,,0,0,CryptoNewsZ,https://www.cryptonewsz.com/bitcoin-falls-below-60000-usd-after-two-weeks/,https://images.cryptocompare.com/news/default/cryptonewsz.png
13403581,https://cryptopotato.com/?p=147869,1635333904,Coinbase Stock Remains Unfazed Despite Citi’s Bullish Calls,Analysts from the Wall Street bank Citi described COIN as &apos;investable&apos; but the news didn&apos;t have an imminent impact on the stock&apos;&apos;s price.,NEUTRAL,없음,BUSINESS | EXCHANGE | FIAT | TRADING,,0,0,Crypto Potato,https://cryptopotato.com/coinbase-stock-remains-unfazed-despite-citis-bullish-calls/,https://images.cryptocompare.com/news/default/cryptopotato.png
13498616,https://coinquora.com/?p=94374,1635333900,Gluwa Network Wins the Inclusive Fintech 50 Event,"Gluwa wins the Inclusive Fintech 50 competition Creditcoin, the cryptocurrency of the Gluwa The crypto world continues to be acknowledged ...Read More...",POSITIVE,없음,BLOCKCHAIN,,0,0,Coin Edition,https://coinquora.com/gluwa-network-wins-the-inclusive-fintech-50-event/,https://images.cryptocompare.com/news/default/coinquora.png
13481857,https://cryptobriefing.com/?p=98828,1635333236,"1inch, Aave Soar on Korean Exchange Listing",,POSITIVE,없음,EXCHANGE | MARKET,,0,0,Crypto Briefing,https://cryptobriefing.com/1inch-aave-soar-korean-exchange-listing/?utm_source=main_feed&utm_medium=rss,https://images.cryptocompare.com/news/default/cryptobriefing.png
13412574,https://blockworks.co/?p=9934,1635333086,Bitcoin and Ether Lead Market Lower in Washout of Leverage,"The entire digital asset market took a sharp nosedive on Wednesday, as BTC and ETH shed 5% and 8% respectively. But there were a few notable exceptions in DeFi.The post Bitcoin and Ether Lead Market Lower in Washout of Leverage appeared first on Blockworks.",NEGATIVE,BTC | ETH,BTC | ETH | MARKET,,0,0,Blockworks,https://blockworks.co/bitcoin-and-ether-lead-market-lower-in-washout-of-leverage/,https://images.cryptocompare.com/news/default/blockworks.png
13444014,https://bitcoinist.com/?p=162639,1635332651,Robots at the Ready – Mech Master IDO Sells Out and $MECH Hits the Market,"The Mech Master Initial DEX Offering (IDO) has just launched to offer the first of the interactive NFT game&apos;s native $MECH to the market. The token sale was conducted via popular DeFi and gaming finance launchpads GameFi and Red Kite. Shortly after the IDO/IGO, the $MECH token was listed on PancakeSwap with a high of ...",POSITIVE,없음,ICO | MARKET | TOKEN SALE,,0,0,Bitcoinist,https://bitcoinist.com/robots-at-the-ready-mech-master-ido-sells-out-and-mech-hits-the-market/?utm_source=rss&utm_medium=rss&utm_campaign=robots-at-the-ready-mech-master-ido-sells-out-and-mech-hits-the-market,https://images.cryptocompare.com/news/default/bitcoinist.png
13459766,https://www.cryptonewsz.com/?p=105005,1635332459,Australian Dollar Rises While Energy Prices Keep Soaring,"The AUD witnessed a slight surge after the Australian CPI numbers were released recently. Q3 headline inflation arrived with 0.8% q/q versus the forecast of 0.8%. Meanwhile, the annual headline rate reached 3.0% in y/y against the expected 3.1%. The former reached 0.7% q/q instead of 0.5% with the RBA&apos;s preferred trimmed measures. Contrarily, the …",NEUTRAL,없음,FIAT | MARKET,,0,0,CryptoNewsZ,https://www.cryptonewsz.com/australian-dollar-rises-while-energy-prices-keep-soaring/,https://images.cryptocompare.com/news/default/cryptonewsz.png
13269643,https://ambcrypto.com/?p=194838,1635332455,KuCoin’s Q3 report says THIS will happen to its KCS token,"Many of 2021&apos;s most exciting developments in the crypto-sector were overshadowed by regulatory pressure and even outright bans by China and other countries. Apart from traders, crypto-exchanges also bore the brunt of this. However, one exchange has reviewed its summer performance to offer up some fascinating data. KuCoin calls for praise On 25 October 2021, ...",POSITIVE,없음,ALTCOIN | ASIA | EXCHANGE | ICO,,0,0,AMB Crypto,https://ambcrypto.com/kucoins-q3-report-says-this-will-happen-to-its-kcs-token/,https://images.cryptocompare.com/news/default/ambcrypto.png
13498617,https://coinquora.com/?p=93768,1635332400,Drops NFT Lending Platform Will Bridge Liquidity Gap,Drops will soon launch its NFT lending platform. The platform hopes to bridge the liquidity gap in NFT markets. Users ...Read More...,POSITIVE,없음,MARKET,,0,0,Coin Edition,https://coinquora.com/drops-nft-lending-platform-will-bridge-liquidity-gap/,https://images.cryptocompare.com/news/default/coinquora.png
13291706,https://cryptonews.com/news/usd-20000-weekly-moves-in-bitcoins-price-likely-this-year-author-says.htm,1635331620,"USD 20,000 Weekly Moves in Bitcoin’s Price Likely This Year, Author Says","Volatility in bitcoin (BTC) is not likely to slow down, and weekly price moves of USD 20,000 or more should be expected before the end of the year, one popular author and bitcoin proponent claims. ...Read More: USD 20,000 Weekly Moves in Bitcoin&apos;s Price Likely This Year, Author Says",POSITIVE,BTC,BTC | TRADING,,0,0,cryptonews,https://cryptonews.com/news/usd-20000-weekly-moves-in-bitcoins-price-likely-this-year-author-says.htm,https://images.cryptocompare.com/news/default/cryptonews.png
13389672,https://decrypt.co/?p=84552,1635331590,"Bitcoin Drops Below $60,000 For The First Time in 10 Days","Bitcoin has dropped below $60,000 for the first time in over a week, ending a bullish run driven by the launch of several Bitcoin futures ETFs.",NEGATIVE,없음,BTC | MARKET | TRADING,,0,0,Decrypt,https://decrypt.co/84552/bitcoin-drops-below-60000-for-the-first-time-in-10-days,https://images.cryptocompare.com/news/default/decrypt.png
13222288,https://www.newsbtc.com/?p=474726,1635331588,Wilder World’s #Wiami to Host Beeple Everydays in Metaverse-First Experience,"Wilder World, an immersive 5D Metaverse and popular community, has teamed up with Metapurse to bring a new interactive Souk landmark to #Wiami. The Souk within #Wiami will be a complete Metaverse experience and bring together some of the most iconic NFT art, such as Beeple&apos;s Everydays: The First 5,000 Days. Everydays: The First 5,000 Days is most notably known for being one of the foundational works of art in the current NFT movement. Artist Mike Winklemann, otherwise known as Beeple, created a unique piece of digital art every day for 5,000 days, culminating in an associated NFT that sold for $69 million in a 2021 Christie&apos;s auction. The buyer of this piece was none other than NFT collector MetaKovan, who is the founder of Metapurse. Together, Metapurse and Wilder World are making it possible to experience Everydays: The First 5,000 days in the Wilder World Metaverse. The Souk will consist of a Metaverse-native superstructure that will house art, open-minded experientialism, music, and performance - all in one place. Within the Souk, visitors will be able to visit Metapurse x Wilder World 5D virtual EDM concerts with famed musicians, many of which will be household names. This is also where visitors can get an up-close glimpse at Everydays: The First 5,000 Days. An Experience Built By Industry Visionaries Wilder World is widely known for being at the forefront of the Metaverse movement, helping pioneer experiences that ...",POSITIVE,없음,OTHER,,0,0,NewsBTC,https://www.newsbtc.com/news/company/wilder-worlds-wiami-to-host-beeple-everydays-in-metaverse-first-experience/,https://images.cryptocompare.com/news/default/newsbtc.png
13337788,https://cointelegraph.com/news/dubai-finance-watchdog-approves-listing-of-bitcoin-fund,1635331468,Dubai finance watchdog approves listing of Bitcoin fund,The DFSA is establishing itself as an innovative regulator for the region by focusing on fintech and innovative technology.,POSITIVE,없음,BTC | TECHNOLOGY,,0,0,CoinTelegraph,https://cointelegraph.com/news/dubai-finance-watchdog-approves-listing-of-bitcoin-fund,https://images.cryptocompare.com/news/default/cointelegraph.png
13498618,https://coinquora.com/?p=94342,1635331337,Tezos To Make a Smashing Appearance for NFTs on Adobe’s Behance,Adobe&apos;s Behance will showcase NFT artwork. To do so it will connect to many blockchains including Tezos. NFT holders can ...Read More...,POSITIVE,없음,BLOCKCHAIN,,0,0,Coin Edition,https://coinquora.com/tezos-to-make-a-smashing-appearance-for-nfts-on-adobes-behance/,https://images.cryptocompare.com/news/default/coinquora.png
13389673,https://decrypt.co/?p=84551,1635331203,British Police Seize $2.7 Million Worth of Bitcoin from Teenager,An unnamed 17-year-old boy has had £2 million worth of Bitcoin seized by police following a &apos;sophisticated cyber fraud.&apos;,NEGATIVE,없음,BTC | BUSINESS,,0,0,Decrypt,https://decrypt.co/84551/british-police-seize-2-7-million-worth-of-bitcoin-from-teenager,https://images.cryptocompare.com/news/default/decrypt.png
13427944,https://news.bitcoin.com/?p=492011,1635330658,Ukraine Security Service Busts Criminal Group Selling Bitcoin-Stealing Malware,"Law enforcement authorities in Ukraine have exposed a crime ring specializing in cryptocurrency theft and laundering of illicit funds for hackers. The gang, which provided services to clients on the darknet, has been dismantled as a result of a joint operation carried out with the United States. Cybercriminals From Ukraine Launder Millions, Offer Flash Drives ...",NEGATIVE,없음,REGULATION,,0,0,Bitcoin.com,https://news.bitcoin.com/ukraine-security-service-busts-criminal-group-selling-bitcoin-stealing-malware/,https://images.cryptocompare.com/news/default/bitcoincom.png
13269644,https://ambcrypto.com/?p=194990,1635330637,Here’s what the purchase of Bitcoin worth $2.1B might mean,"Bitcoin, in its bid, to continue rising, needs to find some support from its investors. The new all-time high registered a couple of days ago was the result of the consistent rally this month. And, when observed closely, you can see that the same rally also woke some previously dormant investors. This led to BTCs ...",POSITIVE,BTC,BTC | BUSINESS | TRADING,,0,0,AMB Crypto,https://ambcrypto.com/heres-what-the-purchase-of-bitcoin-worth-2-1b-might-mean/,https://images.cryptocompare.com/news/default/ambcrypto.png
13459767,https://www.cryptonewsz.com/?p=104980,1635330621,Fantom Hits a Major Rock in Its Progressive Upside Movement,"It will be wise to say that most crypto investors are not looking to invest in an idea like they do in stock investment. Instead, in the crypto market, people are looking for the next 100x coin. The sudden spike in the launch of the new ICO and subsequent main net release has become so …",NEGATIVE,ICO,BUSINESS | ICO | MARKET | ZRX | TOKEN SALE,,0,0,CryptoNewsZ,https://www.cryptonewsz.com/fantom-hits-a-major-rock-in-its-progressive-upside-movement/,https://images.cryptocompare.com/news/default/cryptonewsz.png
42424422,sd6iOBkuiC3F0LYOy2oVph,1635329953,London Commuters Face Ad ‘Assault’ by New Musk-Inspired Coin: Report,"Advertisements for a meme-based coin named after Tesla CEO Elon Musk’s shiba inu dog have appeared on London’s transportation network in recent weeks.  The Floki Inu coin is being advertised to users of the U.K. capital’s bus and metro network with the slogan “Missed Doge? Get Floki,” the Financial Times reported Wednesday.  A blog post by Floki Inu’s founders last month said the advertising campaign would be “a full-out assault on the London public transportation system.”  The ads are ostensibly attempting to capitalize on interest around cryptocurrency, in particular meme-based crypto like dogecoin, which owes much of its popularity to praise from Musk.  The U.K.’s advertising regulator has previously taken a strict stance on ads that directly instruct consumers to invest in cryptocurrency. In May, the Advertising Standards Authority (ASA) ordered crypto exchange Luno to amend its ads proclaiming “If you’re seeing Bitcoin on the Underground, it’s time to buy.”  It remains to be seen how the ASA will respond to Floki Inu’s ads.  Transport for London, the operator of the capital’s mass transit system, said it is not its “responsibility to carry out due diligence on individuals or entities” that advertise on its network, according to the FT’s report.  Floki Inu, which launched in July, is priced at $0.000058 having hit an record high of $0.00008106 on Oct. 13, according to data from CoinMarketCap.  Read more: UK Regulator to Launch £11M Campaign Warning of Crypto Risks",NEUTRAL,없음,BTC | DOGE | EXCHANGE | SHIB,Jamie Crawley,0,0,CoinDesk,https://coindesk.com/business/2021/10/27/london-commuters-face-ad-assault-by-new-musk-inspired-coin-report,https://cdn.sanity.io/images/s3y3vcno/production/2f3be2407e5fe24a20889b1305f6b0daadd98c16-1500x1000.jpg?w=300&h=300&fit=crop
