뉴스ID,뉴스GUID,일자(UTC timestamp),뉴스제목,본문,SENTIMENT,주요코인,카테고리,작성자,추천수,비추천수,출처,뉴스URL,이미지URL
13408060,https://cryptopotato.com/?p=64005,1596117650,"Elrond Mainnet Goes Live, Introduces Deflationary Model","Elrond&apos;s mainnet is live with a running application called Maiar. The native cryptocurrency goes through an economic model change to introduce scarcity and increase its value. The post Elrond Mainnet Goes Live, Introduces Deflationary Model appeared first on CryptoPotato.",POSITIVE,없음,OTHER,,0,0,Crypto Potato,https://cryptopotato.com/elrond-mainnet-goes-live-introduces-deflationary-model/,https://images.cryptocompare.com/news/cryptopotato/a0000000000.jpeg
13348922,https://cointelegraph.com/news/china-didnt-ban-bitcoin-entirely-says-beijing-arbitration-commission,1596117600,"China Didn’t Ban Bitcoin Entirely, Says Beijing Arbitration Commission",Bitcoin-related activities are not prohibited by the Chinese government as the cryptocurrency acts as a virtual commodity.,POSITIVE,없음,ASIA | BTC | FIAT | REGULATION,,0,0,CoinTelegraph,https://cointelegraph.com/news/china-didnt-ban-bitcoin-entirely-says-beijing-arbitration-commission,https://images.cryptocompare.com/news/cointelegraph/arn82ww8a0w.jpeg
13279070,https://eng.ambcrypto.com/?p=55558,1596117600,Bitcoin short-term Price Analysis: 30 July,"Disclaimer: The findings of the following analysis should materialize over the next 24-hours Bitcoin has been brimming with bullish momentum lately, but the world&apos;s largest digital asset could beThe post Bitcoin short-term Price Analysis: 30 July appeared first on AMBCrypto.",NEUTRAL,없음,BTC | MARKET | TRADING,,0,0,AMB Crypto,https://eng.ambcrypto.com/bitcoin-short-term-price-analysis-30-july,https://images.cryptocompare.com/news/ambcrypto/cj88g000000.jpeg
13348923,https://cointelegraph.com/news/five-years-later-the-ethereum-dapp-ecosystem-looks-exactly-as-predicted,1596116160,"Five Years Later, the Ethereum DApp Ecosystem Looks Exactly as Predicted","The Ethereum ecosystem is now seeing the growth and adoption of ideas outlined more than five years ago, including many of the components of DeFi.",POSITIVE,없음,ETH,,0,0,CoinTelegraph,https://cointelegraph.com/news/five-years-later-the-ethereum-dapp-ecosystem-looks-exactly-as-predicted,https://images.cryptocompare.com/news/cointelegraph/c2g6ka080w2.jpeg
13579162,https://www.cryptopolitan.com/?p=49118,1596116114,Japanese crypto exchange delists 29 coins to get license in Singapore,"Popular Japanese crypto exchange firm, Liquid has delisted 29 cryptocurrencies, including Monero (XMR), Zcash (ZEC), among others to abide by Singaporean crypto regulations. Liquid embarked on this delisting to become a licensed crypto firm in Singapore. Crypto regulations in Singapore recently has been upgraded to meet standards set by the Financial Action Task Force (FATF). ...",NEUTRAL,XMR | ZEC,ASIA | EXCHANGE | XMR | ZEC,,0,0,Cryptopolitan,https://www.cryptopolitan.com/japanese-crypto-exchange-delists-29-coins/,https://images.cryptocompare.com/news/cryptopolitan/8g0SE306yio.jpeg
42384246,0r6Zag11PPDEMKgUXA6saB,1596115986,Coda Protocol Touts User Growth One Year Into Testnet,"Coda protocol’s disappearing blockchain is still in the testnet phase, but the O(1) Labs-led project has already garnered a substantial following.    O(1) Labs Head of Product Bijan Shahrokhi told CoinDesk the project has grown its member-base 1,200% since unveiling its testnet for a protocol that cuts down blockchain size using recursive zk-SNARKs exactly one year ago today.  Those 850 users are scattered among 28 different countries, including Russia, Germany, the U.S., China and South Korea, Shahrokhi said. Partner firms now include Bison Trails and Figment Networks.  ""The rapid community growth and global participation is validation for what the lightweight blockchain and ZKP featureset supplied by Coda brings to the table,"" said O(1) Labs CEO Evan Shapiro.  The team expects its mainnet to launch in Q4.",POSITIVE,없음,ASIA | BLOCKCHAIN,Danny Nelson,0,0,CoinDesk,https://coindesk.com/markets/2020/07/30/coda-protocol-touts-user-growth-one-year-into-testnet,https://cdn.sanity.io/images/s3y3vcno/production/41b1eda94a5d0102cd40a9540e1db3ffb0f23b4c-2400x1741.jpg?w=300&h=300&fit=crop
42384257,0r6Zag11PPDEMKgUXA6sml,1596115868,"China Aims to Be the World’s Dominant Blockchain Power – With Help From Google, Amazon and Microsoft","The Takeaway:    China's blockchain infrastructure BSN is set to provide global access to its services next month.  The network’s reliance on U.S. cloud service providers makes it vulnerable to geopolitical risks.  Rising tension between the U.S. and China over the last several months could increase such risks.  China's developments in other technology areas have already met with resistance from the U.S. government.    A state-backed blockchain infrastructure project from China aims to be the dominant internet services provider for decentralized applications (dapps). Its first-mover advantage is significant, as are the geopolitical risks.      The project, called the Blockchain-based Service Network (BSN), is expanding globally as U.S.-China relations become increasingly tense. BSN is a Chinese state-sanctioned blockchain project, but few may realize the network is supported by U.S. technology companies.      Amazon Web Services (AWS), Microsoft and Google are among the major cloud service providers for BSN’s overseas data centers.      This arrangement is notable, given the U.S. government’s hawkishness on Chinese technology. The Trump administration is considering a ban on Chinese social media app Tik Tok, Congress approved $1 billion for rural telecom carriers to ditch services from Huawei and the U.S. Commerce Department restricted semiconductor companies from providing chips to Huawei.      At Wednesday's House antitrust hearing, Facebook CEO Mark Zuckerburg painted the China-U.S. tech competition as a zero-sum game. According to Zuckerberg, “China is building its own version of the internet focused on very different ideas, and they are exporting their vision to other countries.”      This charged environment could potentially spell trouble for BSN. “China tries to grab the lead in blockchain and dominate this domain and that may end up putting this BSN project further into the spotlight of the U.S.-China tech competition,” said Paul Triolo, practice head of geotechnology at Eurasia Group.      “This would be the perception in places like Washington,” he added.      U.S.-China technology competition has been ongoing for decades, but the focus is shifting from search engines and social media to more fundamental levels of technology like telecom equipment provided by Huawei, Triolo said.      Tension between the U.S. and China reached fever pitch earlier this month as the U.S. shut down the Chinese consulate in Houston and China took over the U.S. consulate in Chengdu in retaliation. In a recent speech, U.S. Secretary of State Mike Pompeo slammed U.S.-China engagement as a failure.      It’s unclear whether these tensions will calm in the near future, even if a new U.S. president is elected.      “Even if we get a new administration in the U.S., for example, under [former Vice President and Democratic nominee Joseph] Biden, there is still going to be a lot of scrutiny on China from the technology front,” Triolo said.      There is a real risk that technology that doesn’t present a national security risk will nonetheless be banned because of politics, said Graham Webster, China digital economy fellow at New America, a think-tank with a focus on public policy issues.      Amazon, Google and Microsoft did not return requests for comment by press time.    Containment    One way to limit Chinese tech companies from growing and developing global services is to pressure their suppliers to sever ties with them.      The U.S. prohibited Huawei’s major provider – Taiwan Semiconductor Manufacturing Company (TSMC) – from using American tools to make chips if it produces any product for Huawei. The Chinese company denounced the move as a “pernicious decision.”      BSN could potentially end up in a similar situation, given the prominence of American firms as its overseas data center hosts.      The Chinese network does not build or own any of the data centers where it runs its technical infrastructure; 90% of BSN’s domestic data centers are provided by the telecom company China Mobile. Most overseas data centers will be provided by Amazon’s AWS, given the scope of the cloud services provider’s operations across the globe, according to BSN.      BSN pays these cloud services providers to use their servers and integrates the servers with their software.      Read more: Inside China’s Plan to Power Global Blockchain Adoption      The network has two data centers hosted by AWS in China. It also uses a few global data centers built on Microsoft’s cloud computing arm and Google Cloud Platform. BSN has one data center from Google Cloud based in Tokyo, one from Microsoft in Johannesburg and two from AWS in Paris and California.      Dapp developers can more quickly and easily access services from BSN if they use a data center that is physically close to them. That's why overseas data centers are crucial in terms of providing internet services for the global blockchain community.      “If I were the Chinese company, I would be careful about setting up a system that really depends on continued services in the U.S.,” Webster said. “Anybody who wants to use the global version of this Chinese network should take into account the risk that a data center in the U.S. could get taken off the network because of geopolitics.”      One motivation for curbing Chinese tech companies’ global expansion is data security concerns.      Blockchain technology clearly provides a structurally unusual level of security and integrity, but there is a battle going on over data localization and cloud services, said James Mulnevon, director of intelligence integration at SOS International, a Washington, D.C.-based defense and intelligence company that supports U.S. government agencies.      “The world is clearly becoming a ‘splinternet’ with national boundaries and domestic regulations overturning the previous ‘techno globalism’ motif,” Mulnevon said.      U.S. cloud providers offer services to a wide range of clients and it is hard to tell what specific cyber security concerns would exist if they allow Chinese companies to use their services, Webster said.    No immediate threat    So far, BSN’s global expansion has not met with challenges from U.S. regulators, perhaps because it is relatively new. Or maybe it’s just that few Washington lawmakers can actually make sense of it.      “Part of the reason that BSN has not met with challenges from the U.S. policy makers as the other emerging technologies such as 5G and artificial intelligence is that blockchain technology is not well understood,” Triolo said.      The U.S. government is considering restricting Chinese cloud services companies from operating in the U.S., but has yet to address the question of U.S. companies hosting applications that have a China connection.      Last May, the Federal Communications Commission (FCC) denied China Mobile’s application to operate telecommunications services in the U.S. This could mean Chinese businesses trying to build cloud-based networks in the U.S. need to be aware of the geopolitical risk, said James Mulvenon, director of Intelligence Integration at SOS International, a DC-based defense and intelligence firm.      “I would be wary about big investments in these kinds of transnational cloud networks because regulators seem very grumpy about them right now,” Mulvenon said.      Read more: Meet Red Date, the Little-Known Tech Firm Behind China’s Big Blockchain Vision      Lawmakers who do have concerns might be reassured by the fact that even if the Chinese government does ask for data from BSN nodes hosted overseas, it may not be able to get it.      The Chinese government has a very expansive view of extraterritoriality, Mulnevon said.      “The Chinese government certainly believes that Chinese companies operating abroad (even when they are incorporated abroad) are subject to Chinese law,” he said.      Theoretically, the Chinese government would solicit data from a Chinese company like the one behind BSN regardless of where it is run, meaning it could ask for data stored in the network’s overseas data centers. However, Red Date, the tech firm that architected BSN’s technical framework, has claimed the network does not have access to user data, due to its technical structure.      Red Date CEO Yifan He previously told CoinDesk that BSN’s technical framework fully protects its users’ data privacy and functions like an adapter that better connects developers with data centers where they can run nodes and build applications. He even invited skeptics to examine the network’s code for themselves.    The China connection    The BSN Development Association is led by the State Information Center of China (SIC), a public institution under the National Development and Reform Commission (NDRC), the highest economic planning committee in China. State-owned tech conglomerates China Mobile and China UnionPay are also deeply involved in building the network.      It is certainly rare to get a government affiliate to endorse and lead the effort for a large-scale blockchain infrastructure, and for two of the largest Chinese tech giants to support the network. However, unlike China’s national digital currency, higher-level government agencies such as the Chinese central bank and the Ministry of Industry and Information Technology of China (MIIT) do not appear to be involved in BSN yet.      The precise nature of the relationship between the Chinese government and BSN is not clear. But given BSN’s state connection, its reliance on major U.S. cloud services providers could be a point of contention on the Chinese side as well.      “No foreign firms sit on any BSN leadership committees. As stated in official documents, Beijing intends for BSN to be a ‘global infrastructure network autonomously innovated by Chinese entities,’” according to a May report from Eurasia Group.",NEGATIVE,없음,ASIA | BLOCKCHAIN | REGULATION | TECHNOLOGY | TRADING,David Pan,0,0,CoinDesk,https://coindesk.com/policy/2020/07/30/china-aims-to-be-the-worlds-dominant-blockchain-power-with-help-from-google-amazon-and-microsoft,https://cdn.sanity.io/images/s3y3vcno/production/576e0532fd63ee026a84c8e4186c20defc463260-1500x750.jpg?w=300&h=300&fit=crop
13279071,https://eng.ambcrypto.com/?p=55543,1596115819,"XRP, IOTA, Digibyte Price Analysis: 30 July","Among XRP, IOTA, and Digibyte, IOTA seemed to be the only cryptocurrency showing the short-term promise of a surge. With Bitcoin climbing above $11,000, the market seemed to have returned to normal. HThe post XRP, IOTA, Digibyte Price Analysis: 30 July appeared first on AMBCrypto.",NEUTRAL,XRP | IOTA,ALTCOIN | MARKET | TRADING | XRP | IOTA,,0,0,AMB Crypto,https://eng.ambcrypto.com/xrp-iota-digibyte-price-analysis-30-july,https://images.cryptocompare.com/news/ambcrypto/cL8221yy01w.jpeg
13579163,https://www.cryptopolitan.com/?p=49114,1596114926,Iran: Power plants approved to run Bitcoin mining operations,"The Iranian government has approved Bitcoin mining operations to be conducted in power plants across the country. Industry scale power plants now have the capacity to serve as also crypto mining farms so long as they do not use cheap subsidized electricity tariffs in their activities. Reports on Monday July 27 suggest Mostafa Rajabi Mashhadi, ...",NEUTRAL,없음,BTC | MINING,,0,0,Cryptopolitan,https://www.cryptopolitan.com/power-plants-run-bitcoin-mining-operations/,https://images.cryptocompare.com/news/cryptopolitan/c8yg3zjsijo.jpeg
13348924,https://cointelegraph.com/news/raising-the-security-bar-dash-claims-a-51-attack-is-not-enough,1596114900,Raising the Security Bar? Dash Claims a 51% Attack Is Not Enough,"While a 51% attack on Bitcoin will cost a billion dollars, Dash developers say an attacker needs more than money to attack the Dash network.",NEUTRAL,없음,BLOCKCHAIN | BTC,,0,0,CoinTelegraph,https://cointelegraph.com/news/raising-the-security-bar-dash-claims-a-51-attack-is-not-enough,https://images.cryptocompare.com/news/cointelegraph/cHXegMIMpx$.jpeg
13579164,https://www.cryptopolitan.com/?p=49117,1596114626,Binance crypto exchange launches full-scale operation in Australia,"Binance crypto exchange said to be the largest exchange firm with the volume of transactions it handles, and its user base has launched fully in Australia. Operating in Australia previously under the Binance Lite platform, the exchange&apos;s newly launched fiat-to-crypto trading platform in the country operates crypto trading denominated in the Australian dollar (AUD). Binance ...",POSITIVE,없음,EXCHANGE | TRADING | BNB,,0,0,Cryptopolitan,https://www.cryptopolitan.com/binance-crypto-exchange-launche-in-australia/,https://images.cryptocompare.com/news/cryptopolitan/eENCai1w800.jpeg
13386666,https://zycrypto.com/?p=44474,1596114145,Bitcoiners Are HODLing Hard As BTC’s ‘HODL Wave’ Hits All-Time High,"With Bitcoin reaching $11,000 for the first time in almost a year, a lot of predictions are pointing towards a more bullish growth. This, despite data revealing extreme pressure at that price level. However, a post from Kraken&apos;s Head of Growth Dan Held reveals that the number of dormant addresses in a year has recently ...",POSITIVE,BTC,BTC | TRADING,,0,0,ZyCrypto,https://zycrypto.com/bitcoiners-are-hodling-hard-as-btcs-hodl-wave-hits-all-time-high/,https://images.cryptocompare.com/news/default/zycrypto.png
13261228,https://dailyhodl.com/?p=105163,1596114056,Cardano’s Shelley Hard Fork Launches in Big Leap Toward Decentralization,"IOHK, the firm that oversees the development of Cardano, has finally launched Shelley. IOHK CEO Charles Hoskinson announced the successful hard fork of the blockchain&apos;s long-awaited upgrade, which introduces a number of pivotal changes to the platform&apos;s code. We have reached Orbit. Shelley Hard Fork is Successful. When Shelley? Now!!!!!!!!!! Shelley has fully launched https://t.co/ckuiVJfqnZ ...The post Cardano&apos;s Shelley Hard Fork Launches in Big Leap Toward Decentralization appeared first on The Daily Hodl.",POSITIVE,없음,ADA | ALTCOIN | FORKS,,0,0,The Daily Hodl,https://dailyhodl.com/2020/07/30/cardanos-shelley-hard-fork-launches-in-big-leap-toward-decentralization/,https://images.cryptocompare.com/news/dailyhodl/aaNAIK91gg0.jpeg
42384244,0r6Zag11PPDEMKgUXA6sXf,1596114046,Paxful Chips Away at LocalBitcoins' Russian P2P Market Dominance,"Paxful’s year-old foray into Russian crypto markets is bringing more revenue, boosted liquidity and an influx of new users to the peer-to-peer bitcoin exchange as it challenges LocalBitcoins’ regional rule.    The exchange said Thursday Russian site usage is up 350% and the number of new Russian users has spiked 364% from spring 2019 through spring 2020. Monthly trading volume for the region now averages around $4 million.  Anton Kozlov, Paxful’s Russia manager, said the exchange has made a concerted effort since late 2019 to challenge competitor LocalBitcoins’ Russia dominance by adding support staff, partnering with local influencers and establishing a 10-person specialist team.  LocalBitcoins’ “biggest revenue market is Russia, so Paxful decided as a strategic growth decision to go into Russia as well,” Kozlov said, claiming Paxful’s Russia user base is rising while LocalBitcoins’ growth has stalled following its 2019 know-your-customer policy changes.  While LocalBitcoins remains by far the strongest player in Russia’s peer-to-peer bitcoin trading scene, with monthly ruble trading volume around $30 million, Kozlov said Paxful will continue to chip away.",POSITIVE,없음,BTC | BUSINESS | EXCHANGE | MARKET | TRADING,Danny Nelson,0,0,CoinDesk,https://coindesk.com/markets/2020/07/30/paxful-chips-away-at-localbitcoins-russian-p2p-market-dominance,https://cdn.sanity.io/images/s3y3vcno/production/2ac3afe687dcc90276820ee12f02790462e0a503-1500x1000.jpg?w=300&h=300&fit=crop
13279072,https://eng.ambcrypto.com/?p=55541,1596114019,"Diginex's upcoming listing steals Algorand, Maker's thunder","No day in the cryptocurrency industry passes without news of any major developments. Whether such developments are price-related, regulatory, or simply listing announcements, such developments underliThe post Diginex&apos;s upcoming listing steals Algorand, Maker&apos;s thunder appeared first on AMBCrypto.",NEUTRAL,없음,ALGO | ALTCOIN,,0,0,AMB Crypto,https://eng.ambcrypto.com/diginexs-upcoming-listing-steals-algorand-makers-thunder,https://images.cryptocompare.com/news/ambcrypto/9EVoYMNpAOo.jpeg
13243843,https://nulltx.com/?p=99524,1596114006,Bybit Pledges up to 10 BTC Charitable Donation from WSOT Prize Pool to UNICEF,"Crypto derivatives exchange Bybit has dipped into its bitcoin reserves and pledged up to 10 BTC to Covid-19 relief. The benevolent gesture will support humanitarian efforts made by UNICEF, who will receive the donation, while further raising the profile of Bybit&apos;s World Series of Trading (WSOT) competition. The forthcoming WSOT event has taken the industry ...The post Bybit Pledges up to 10 BTC Charitable Donation from WSOT Prize Pool to UNICEF appeared first on NullTX.",POSITIVE,BTC,BTC | EXCHANGE | TRADING,,0,0,NullTx,https://nulltx.com/bybit-pledges-up-to-10-btc-charitable-donation-from-wsot-prize-pool-to-unicef/,https://images.cryptocompare.com/news/themerkle/aw0w02200w0.png
