뉴스ID,뉴스GUID,일자(UTC timestamp),뉴스제목,본문,SENTIMENT,주요코인,카테고리,작성자,추천수,비추천수,출처,뉴스URL,이미지URL
42424432,sd6iOBkuiC3F0LYOy2oVzh,1635359442,"FTX Looks to Expand Globally Through Local Partners, Bankman-Fried Says","FTX, the cryptocurrency derivatives exchange juggernaut, plans to keep expanding into new jurisdictions through buying local crypto companies or exchanges, CEO Sam Bankman-Fried said Wednesday on CoinDesk TV.  Asked about future acquisitions, the 28-year-old billionaire hinted he may be looking for another LedgerX, which was FTX’s August acquisition. LedgerX, a regulated U.S.-based crypto derivatives firm, is now part of FTX’s American unit, FTX.US. Buying LedgerX allowed FTX to sidestep a grueling registration process in the U.S.     “I would not be surprised if [the amount of money that we spend on acquisitions over the next year or so] was north of a billion dollars,” Bankman-Fried said on CoinDesk’s “First Mover.” Acquisition targets may offer relationships to regulators, licensing or “user-based” fiat on- or off-ramps, he added.  On Monday, FTX.US announced it finalized the acquisition of LedgerX, now called FTX US Derivatives. This follows a $420 million funding round that valued the parent FTX at $25 billion.  “There were a lot of potential acquisitions for us to be had and LedgerX was the start of it, but it’s not going to be the end,” Bankman-Fried said.  FTX is following a similar strategy to rival crypto exchange Binance, which has expanded its brand through licensing deals, local partnerships and a steady stream of acquisitions and investments. Up until recently, the world’s largest crypto exchange even had a stake in FTX.  Read more: FTX Follows Binance’s Lead With Move Into Tokenized Stocks  FTX’s empire continues to grow. The derivatives exchange has purchased a portfolio tracking app and even the naming rights to two U.S. sports stadiums. It is also expanding its exposure by buying ad time during the U.S. National Football League championship game, Super Bowl LVI, on Feb. 13.  Bankman-Fried said a big risk for his company is “becoming distracted.”  “You should be doing your job trying to grow the company. Instead, you’re just growing its balance sheet, way bigger than there’s any need to grow,” he said.",POSITIVE,없음,EXCHANGE | FIAT | BNB,Helene Braun,0,0,CoinDesk,https://coindesk.com/business/2021/10/27/ftx-looks-to-expand-globally-through-local-partners-bankman-fried-says,https://cdn.sanity.io/images/s3y3vcno/production/81fabd0f425278020d838fbba7c5035cbf796110-704x395.jpg?w=300&h=300&fit=crop
13269628,https://ambcrypto.com/?p=195160,1635359424,Nigeria’s e-Naira gains more ground as Bitcoin P2P volume shrinks,"Although the Federal high court gave Nigeria&apos;s central bank digital currency, e-Naira a green light earlier in October, the Central Bank took four weeks to officially launch it. With the launch of e-Naira on 25 October, 2021, Nigeria became the first African country to launch a CBDC. Despite the popularity of Bitcoin in the country, ...",POSITIVE,없음,BTC | FIAT,,0,0,AMB Crypto,https://ambcrypto.com/nigerias-e-naira-gains-more-ground-as-bitcoin-p2p-volum-shrinks/,https://images.cryptocompare.com/news/default/ambcrypto.png
42421205,ha93388BwWkPe8xtcXgrXB,1635359131,He Saw Iceland’s Banking Fraud From Inside. Now He’s Worried About Crypto,"Jared Bibler was in the belly of the beast. Then he got to perform the autopsy.  Bibler was an asset manager at Landsvaki, one of Iceland’s largest banks, from early 2007 to late 2008. By then he had seen enough rampant fraud at the bank to prompt him to jump ship. Less than two weeks later, the bank collapsed.  At the center of Iceland’s huge banking fraud was an elaborate scheme involving stock buybacks and shell companies, which had been going on since the late 1990s. Very quickly the entire Icelandic economy went down. Cash withdrawals were frozen, pensions were destroyed and the small nation’s stock market lost 90% of its value.  David Z Morris is CoinDesk’s Chief Insights Columnist.  Within months, in a very satisfying plot twist, Bibler had taken his insider knowledge to the Financial Supervisory Authority of Iceland, where he served as an investigator, playing a major role in peeling the onion of fraud that led up to the collapse. Bibler recounts his days as an investigator, and his stunning findings, in the immensely readable new book “Iceland’s Secret: The Untold Story of the World’s Biggest Con.” (To learn more of the story, read CoinDesk’s in-depth review.)  Bibler now runs a private consulting firm focused on financial investigations, particularly “greenwashing” fraud meant to conceal corporate environmental misconduct. We talked about his perspective on finance as someone who grew up working class, what went wrong in Iceland and the prospects for a repeat of a crisis fueled by elite fraud.  This interview has been edited for length and clarity.  Tell me about the experience of living through the Icelandic crisis, when the stock market collapsed and failing banks had to limit cash withdrawals.  You know when you have that feeling like, “I’m hungry, what’s in the fridge?” As we were living through the crisis, instead of wondering “What’s in the fridge?” there was a new feeling of, “How much food do we have today?”  How much do we have in our wallets? How long will that last? When will the banks open again? It was a survival mentality for at least a few months. That was a trauma that changed the way I see the world. You realize money is just a construct – it’s a convenience, but it could be worth zero tomorrow. It was a different way of seeing life. That was the kind of visceral piece.  The second piece that I hope people take away would be extending that idea to the markets – there’s not as much there as we think.  You say it changed the way you see the world. How, exactly?  My view of the world is, the vast majority of people are hardworking and honest, and go through life in a pretty upstanding way. Then, it was very obvious in Iceland, there was this very small elite class that was rent-seeking on the people. That class has different words for when they’re going to screw somebody.  I come from a working-class background. And the common people are always the ones who pay the bill in the end. People like us who read the book, who know about markets, we’re shocked. But average people, the guy on the street, he already knew that the system is corrupt. They’re like, “Well, of course these guys are crooks.”  In Iceland the burden fell on people who had nothing, and then had less than nothing. The ease with which these [finance] guys could just see past that, or not be troubled by it, was really shocking to me. When I would bring up things like, “What about these other people?”, the response would be, “Why are you making problems?”  How has the book been received in Iceland? As your title points out, the real story is not well known.  People in Iceland are shocked. They don’t know the degree to which they were deceived with the stock market manipulation. Nobody ever came out and said, this was happening for 10 years, and everything about this market and what you invested in was a lie. The banker’s line today is that they did nothing wrong … The story is, things were fine in Iceland until Lehman [Brothers, whose failure was a major factor in the 2008 financial crash] came along. [In fact, the stock fraud at the center of the Icelandic crisis began 10 years before the global financial crisis.]  And because the story was never really told, I think the lessons never got learned in Iceland. And that was a big driver for me to write the book. I wanted to show the inside of the banks, and how wretched that was. This is how the system works.  I think we’re living on a sand castle financial system. I fear that Iceland 2008 is going to be the rest of us in 2030.  What happened to Iceland’s regulators? Aren’t they supposed to be watching for this kind of stuff?  [Regulatory agencies] hire people I would call “page turners.” The guy who can turn to some page and say, “We don’t do that here” and take his paycheck and go home. That culture is pervasive. They’re not aggressive. They’re not the people like you and me who get excited about some fraud and want to go after it.  Some agencies are better than others. The [U.S. Securities and Exchange Commission] brings a lot of little insider cases. But they don’t go after big systemic [problems].  He won’t let me quote him, but a Nobel economist told me, this is the story of every bank. They’re not all out there buying their own stock. But anything to boost their quarterly [results]. In a financial institution it’s easy to do that. Much easier than in a manufacturing firm.  We’re in the midst of a major debate about monetary policy, particularly in the U.S. Is there a relationship between fraud and the money supply?  The kind of hijinks the banks got up to would not have been possible without easy money. In this case the easy money came from the most profligate lenders in the world – the Germans. Deutsche Bank never met a loan they didn’t want to make. And the German government backs them up.  So [Icelandic banks] always had enough cash to do the [stock] manipulations. That enabled what I see as the fundamental fraud that underlay [the banks’] growth.  More generally, when there’s too much cash sloshing around, people in society make terrible decisions. There’s a lot of fraud and a lot of conspicuous consumption. They sold more Range Rovers in Iceland than in Norway and Sweden combined in 2007 and 2008. My wife’s job [later] was to repossess all those cars.  You had a pretty unique path into banking, as a person who grew up not just working class but surrounded by economic decline.  I grew up in Billerica, Mass. It’s probably pretty Trumpy [Republican] these days. Working class, no hope. So I was kind of a miracle. I was first in my class and I got into MIT.  Because I came up working class, people think that if you’re at MIT your life is fixed. But it turns out it’s not true, because you have to figure out what to do with your life. After I graduated, I got involved in a dot-com that was a big fraud.  They were selling software that didn’t exist. Vaporware. Coming out of MIT, it’s a hard place to go to school, and everything is very factual. If you design a machine that doesn’t work, it falls apart right away. You can’t get around physics. But these guys did it all the time.  They had these high-pressure sales guys. They’d go into an insurance company and say, we can give you a complete claims management system … Like Enron, as soon as they made that software deal, they booked that revenue. Goldman Sachs took them public, and they had 12 or 20 customer lawsuits against them … The sales guys would get a 10% cut, do a couple deals and move to the Caymans or something. Absolutely zero ethics.  It wasn’t a great experience while I was there, but it was a learning experience. Their biggest clients were Enron, HealthSouth and Global Crossing [some of the most notorious frauds of the dot-com bubble]. They were only missing WorldCom.  After that, you got a position with a more above-board operation.  I went to building global back-office software for Morgan Stanley. It was super-hard work but a very good learning experience, and what we delivered I can believe in. That’s another example of something that has to work – they have to settle their trades every day.  Then I went to Iceland and it was just bubblegum and toothpicks.  If the tendency of the financial world is towards fraud, how does crypto fit in?  To take an example, someone here in Switzerland was building a real estate token … which is a cool idea, it’s fine. But none of the things in a regulated fund are being done. It was an even less transparent thing, but because it was packaged up in a token it was like, whoo, exciting.  It seemed like a way to do what every fund manager wants to do – take in a lot of money, charge a big fee and who cares what you do with it. Where you invest that money is often secondary.  I have a lot of worries about crypto being financially [misused]. There’s a whole infrastructure being built where people are packaging things in different ways. I see a lot of the problems in asset management being replicated over in crypto.",NEUTRAL,없음,BUSINESS | EXCHANGE | FIAT | MARKET | TECHNOLOGY,David Z. Morris,0,0,CoinDesk,https://coindesk.com/markets/2021/10/27/he-saw-icelands-banking-fraud-from-inside-now-hes-worried-about-crypto,https://cdn.sanity.io/images/s3y3vcno/production/0f55be4a4760f5788335df71c5cc2b784e110d91-1500x1131.jpg?w=300&h=300&fit=crop
13412569,https://blockworks.co/?p=9970,1635358539,VanEck Ready to Launch Delayed Bitcoin Futures ETF,"The VanEck offering will likely see less demand than a pair of similar funds that launched last week, industry professionals say.The post VanEck Ready to Launch Delayed Bitcoin Futures ETF appeared first on Blockworks.",NEUTRAL,없음,BTC | ICO | MARKET,,0,0,Blockworks,https://blockworks.co/vaneck-ready-to-launch-delayed-bitcoin-futures-etf/,https://images.cryptocompare.com/news/default/blockworks.png
42410948,GJVPKSa3D710Liw1ggtjfb,1635357930,From Pancake Batter to Bitcoin Mining: Struggling Businesses Try 2017-Style Pivots,"Which is harder, mining bitcoin or selling pancake batter?  Nate’s Foods is about to find out.  The little-known, publicly traded company, based in Huntington Beach, Calif., announced Oct. 25 that it has started mining the oldest and largest cryptocurrency by market value. Ditching its original product – premixed pancake and waffle batter in pressurized cans – Nate’s has leased miners manufactured by Bitmain to earn new bitcoin at a rate of 500 terahashes per second.  Nate’s said it plans to ramp up its hashrate, or computer processing power, to 1,500 terahashes per second with the two-year-old model S-17 miners. Nate’s expects those machines to generate about $17,060 per month in revenue.  That would be a step up from the food business, which was flat as a pancake financially for Nate’s – it reported no sales in the fiscal quarter that ended Aug. 31, the most recent period for which it has disclosed results. Nate’s penny stock, which is traded on the over-the-counter markets, has more than tripled in price since the company announced the radical shift in its business model on Sept. 30.  Nate’s is the latest in a long line of companies from different industries pivoting or diversifying to mining or other crypto-related activities. First seen during the 2017 bull market, the trend is making a comeback as bitcoin trades near all-time highs and the crackdown on crypto activities in China, once the world’s mining epicenter, has thinned the competitive field.  Weak tea  An uncharitable interpretation is that such moves are merely ploys to pump up a failing company’s share price. That appeared to be the case with Long Blockchain, formerly Long Island Iced Tea, whose attempt to cash in on the 2017 blockchain frenzy famously soured, making it a poster child for boom-time excesses. Its stock was eventually delisted because of the company’s failed attempt to transition itself into a blockchain player. The U.S. Securities and Exchange Commission (SEC) charged three individuals with insider trading.  If done properly, however, pivoting to mining can succeed, even if a company’s previous business had nothing to do with crypto. For example, Riot Blockchain, which used to be a biotech company called Bioptix, changed its name and business model in 2017. It is now one of the top publicly traded crypto miners, with a market capitalization above $2 billion.  Nate’s Food took the plunge into crypto mining after its CEO, Nate Steck, saw other OTC-traded companies entering the sector. He wanted to guard his company against another supply chain crisis such as the one created by the coronavirus pandemic, he said in an emailed statement to CoinDesk.  “I wanted to get away from the whole disruption of goods and services,” Steck said. So he contacted a crypto mining consultant and started “checking boxes” on what would quickly propel shareholder value and increase revenue.  “The bottom line is that crypto mining has an immediate return on our investment,” Steck said. “Future projects will develop as the coin platform opportunities become similar to the early stages of the internet,” he noted. Nate’s created a subsidiary, Nate’s Mining, and a Twitter handle to reflect its new focus.  Other recent converts to crypto mining include Chinese sports lottery firm 500.com (NYSE: WBAI), which announced in January It will start buying bitcoin miners and has ramped up efforts throughout this year. A shipping company, Sino-Global (SINO), hired executives in February to spearhead the company’s entry into bitcoin mining. In April, a Florida-based longevity and wellness product manufacturer, Graystone Company (GYST), announced it would move into bitcoin mining to improve its own financial health.  Days of plenty  The switch to crypto mining is no surprise when companies are losing money or don’t have a sustainable business model. According to a research note by Jonathan Petersen, an analyst at the Jefferies investment firm, bitcoin mining has been a high-margin business with a short payback period, or the length of time required for an investment to recover its initial outlay.  “This year has been one of the best environments for BTC mining in North America due to the reduction in competition following China’s mining ban and the ongoing global chip shortage, which also puts a cap on new BTC miners being deployed,” he wrote.  DA Davidson analyst Christopher Brendler estimated that for a “best in class” miner with access to cheap power, the average cost to mine a bitcoin is around $5,000, with gross margins as high as 90%, even if bitcoin trades around $50,000. (It’s in the high $50s as of press time.)  He estimated that for miners such as Marathon Digital, the gross margin, or profit retained by a company after operating costs, will be about 89.6% in 2021 and 90.8% in 2022.  With such margins, it’s easy to see why companies would be tempted to start a crypto mining business. However, it will require a long-term strategy to make the move truly profitable, said Zack Voell, director of content and research at Compass Mining.  “Current market conditions make bitcoin mining an extremely profitable activity for almost anyone. But rushing into financing a large-scale mining operation because of current profitability can end in disaster,” he said, cautioning would-be miners to resist fear of missing out (FOMO).  “Any company that wants to dabble in cryptocurrency mining should ignore FOMO and prepare a multi-year strategy for their operations,” Voell said.",NEUTRAL,BTC,BLOCKCHAIN | BTC | BUSINESS | MARKET | MINING,Aoyon Ashraf,0,0,CoinDesk,https://coindesk.com/business/2021/10/27/from-pancake-batter-to-bitcoin-mining-struggling-businesses-try-2017-style-pivots,https://cdn.sanity.io/images/s3y3vcno/production/4515620f893f79c193a712405277feb81e7ae36f-1440x956.jpg?w=300&h=300&fit=crop
42424417,sd6iOBkuiC3F0LYOy2oVfh,1635357814,DOT Holders Are Voting on Polkadot’s New Look,"After months of iteration, Parity Technologies – one of the developers of interoperability protocol Polkadot – launched a web portal on Wednesday for DOT token holders to vote on the future of the blockchain’s logo and brand assets.  The brand overhaul kicked off in January with the hiring of Koto, a design agency. According to a voting website launched today, the vote is the result of months of “qualitative feedback” from users and developers.  In an interview with CoinDesk, Polkadot brand bounty curator Kaye Han said the new branding is key to reaching a casual audience as the project expands, and that it may be a first when it comes to decentralizing brand management.  “The Polkadot ecosystem’s needs for the brand has grown immensely and has struggled to effectively communicate its increased complexity,” said Han. “It’s only by involving the community throughout the process can a more flexible, adaptable and extensible design language be created. This is a novel and experimental approach that is far from perfect, but it’s a step in the right direction in exploring decentralized branding.”  DOT token holders have the option of selecting one of two design formats for future web and social layouts, as well as one of two new logos – all inspired by dots and featuring various animation styles.  Voting is now live and will close Nov. 5.",POSITIVE,DOT,BLOCKCHAIN | DOT,Andrew Thurman,0,0,CoinDesk,https://coindesk.com/tech/2021/10/27/dot-holders-are-voting-on-polkadots-new-look,https://cdn.sanity.io/images/s3y3vcno/production/8bed2abe5785356a4d949e2da7952e26902aaa4e-2013x1510.jpg?w=300&h=300&fit=crop
13444006,https://bitcoinist.com/?p=162665,1635357645,"How Bitcoin Will Help Twitter Improve Commerce On Its Platform, CFO Says","In an interview with CNBC&apos;s Squawk Box, the CFO of Twitter Ned Segal talked about the implementation of Bitcoin in the platform. In his view, the cryptocurrency will be a tool to &apos;facilitate commerce&apos; on the social network. Related Reading | Latin America, Tipping Point: Bitcoin Beach Brazil, Colombia ATMs, Mining Arg Twitter and its ...",POSITIVE,없음,BTC | BUSINESS | MINING,,0,0,Bitcoinist,https://bitcoinist.com/how-bitcoin-will-help-twitter-to-deploy-commerce-on-its-platform-cfo-says/?utm_source=rss&utm_medium=rss&utm_campaign=how-bitcoin-will-help-twitter-to-deploy-commerce-on-its-platform-cfo-says,https://images.cryptocompare.com/news/default/bitcoinist.png
13269629,https://ambcrypto.com/?p=195170,1635357643,Bitcoin Fund worth $200M gets green light from Dubai’s FSA,"Dubai authorities continue to drive more adoption into the cryptocurrency industry by pushing more regulatory approvals. Just recently, the Dubai World Trade Centre Authority (DWTCA) partnered with the UAE&apos;s Securities and Commodities Authority (SCA) to support the regulation and trading of crypto-assets. Of late, a lot of tailwinds originating from this region have triggered significant ...",POSITIVE,없음,BTC | COMMODITY | REGULATION | TRADING,,0,0,AMB Crypto,https://ambcrypto.com/bitcoin-fund-worth-200m-gets-green-light-from-dubais-fsa/,https://images.cryptocompare.com/news/default/ambcrypto.png
13257073,https://dailyhodl.com/?p=170891,1635357603,"$930,000,000 ‘Liquidity Flush’ Hits Bitcoin and Crypto Markets – Here’s What’s Next, According to Crypto Analyst Justin Bennett","After tapping a new all-time high just one week ago, a sharp correction has sent the price of Bitcoin below the $60,000 mark. A precipitous drop in BTC and the overall crypto markets over the past 24 hours has triggered liquidations across exchanges as traders found themselves unable to meet margin requirements in their leveraged ...The post $930,000,000 &apos;Liquidity Flush&apos; Hits Bitcoin and Crypto Markets - Here&apos;s What&apos;s Next, According to Crypto Analyst Justin Bennett appeared first on The Daily Hodl.",NEGATIVE,BTC,ALTCOIN | BTC | MARKET | TRADING,,0,0,The Daily Hodl,https://dailyhodl.com/2021/10/27/liquidity-flush-hits-bitcoin-and-crypto-markets-heres-whats-next-according-to-crypto-analyst-justin-bennett/,https://images.cryptocompare.com/news/default/dailyhodl.png
13337774,https://cointelegraph.com/news/twitter-ceo-jack-dorsey-reiterates-a-positive-outlook-on-bitcoin-tipping-during-earnings-call,1635357600,Twitter CEO Jack Dorsey reiterates a positive outlook on Bitcoin tipping during earnings call,Dorsey suggested that the new initiative is incentivizing content creation and cryptocurrency adoption alike.,POSITIVE,없음,BTC,,0,0,CoinTelegraph,https://cointelegraph.com/news/twitter-ceo-jack-dorsey-reiterates-a-positive-outlook-on-bitcoin-tipping-during-earnings-call,https://images.cryptocompare.com/news/default/cointelegraph.png
13444007,https://bitcoinist.com/?p=162700,1635356865,Evan Luthra Busts Top Misconceptions about Blockchain,"With everything that&apos;s taking place in the blockchain sphere today, many facts have blurred into myths while several myths have become facts. New technologies usually, bring with them mixed reactions from audiences. But as far as blockchain is concerned, Evan Luthra is here to bust the top misconceptions surrounding it. Evan Luthra is a serial ...",POSITIVE,없음,BLOCKCHAIN,,0,0,Bitcoinist,https://bitcoinist.com/evan-luthra-busts-top-misconceptions-about-blockchain/?utm_source=rss&utm_medium=rss&utm_campaign=evan-luthra-busts-top-misconceptions-about-blockchain,https://images.cryptocompare.com/news/default/bitcoinist.png
