뉴스ID,뉴스GUID,일자(UTC timestamp),뉴스제목,본문,SENTIMENT,주요코인,카테고리,작성자,추천수,비추천수,출처,뉴스URL,이미지URL
42384261,0r6Zag11PPDEMKgUXA6srn,1596127450,"Blockchain Bites: Plus Token Ponzi Popped, Cardano Forked and tZERO Cut","Cardano hard forked to its proof-of-stake network, token platform tZERO cut staff and compensation, and a derivatives exchange is looking to list on Nasdaq.      You’re reading Blockchain Bites, the daily roundup of the most pivotal stories in blockchain and crypto news, and why they’re significant. You can subscribe to this and all of CoinDesk’s newsletters here.    Top shelf    Hello, Shelley Cardano is now running a proof-of-stake consensus mechanism. Announced Wednesday, the open-source smart-contract platform designed to challenge Ethereum's lead position, hard-forked from the centralized Byron network into the decentralized Shelley network. IOHK, the lead design firm, said ""hundreds"" of assets are expected to run on the blockchain in a year's time. The PoS delegation process lets users holding Cardano's native token (ADA) commit their tokens to a pool for a share of rewards. A number of additional upgrades and improvements are expected in the coming months, including a new governance model, Project Catalyst.      Ponzi Popped Chinese police have arrested all 27 primary suspects thought to be responsible for running the $5.7 billion Plus Token Ponzi scheme. Led by the Ministry of Public Security, China's top police force agency, the investigators has also arrested another 82 core members of the scheme in what looks like the first crackdown on an international, crypto Ponzi. The scheme allegedly scammed two million people by using cryptocurrencies including bitcoin as a funding channel.      Public Backdoor Newly launched derivatives platform EQUOS.io is set to become the first publicly traded crypto exchange in the U.S. through a “backdoor listing” on Nasdaq later this year. Its operator, Hong Kong-based Diginex, announced Thursday it is combining EQUOS.io with the Nasdaq-listed Singapore’s 8i Enterprises Acquisition Corp – a special-purpose acquisition company. SPACs are shell companies that use funds from their IPOs to acquire target companies, bringing them public through the “backdoor,” a process that is faster and cheaper than traditional listings, according to Diginex CEO Richard Byworth.      Cuts & Capital Security token platform tZERO has cut staff and salaries as it eyes another capital raise. CEO Saum Noursalehi said tZERO had ""significantly reduced"" its cash burn rate 45% year on year by cutting legal costs and staff and trimming executive salaries in exchange for company equity. A majority-owned subsidiary of Overstock, tZERO raised $134 million in a 2018 ICO – short of its $250 million target – and secured $5 million investment from Chinese fund GoldenSands Capital in April.      Bit by Bit Binance launched a new Australian fiat-to-crypto exchange platform Wednesday that CoinDesk has discovered is run by the founders of a company providing crypto payment services for the local tourist industry. A spokesperson said Binance Australia was a separate entity from the main exchange group, and operated by InvestbyBit, a Queensland-based private company and a licensed Australian digital currency exchange. Through InvestbyBit, Binance Australia is registered with AUSTRAC, one of the country's primary financial enforcement agencies, the spokesperson added. As the name suggests, InvestbyBit has close ties to TravelbyBit, a crypto payment provider for the tourist industry in which Binance invested $2.5 million in late 2018.    Quick bites  Distributed data storage network Bluzelle is itching to mainnet.  Malaysia’s national stock exchange eyes blockchain for bonds.  Coinbase now offers 2% rewards on dai.  Indian users almost five times more likely to encounter crypto hacking: Microsoft.  U.S. Marine Corps bans crypto mining apps from government-issued mobile devices.  At stake    Wednesday, the House Judiciary Committee held an investigation into anti-competitive practices at Amazon, Apple, Facebook and Google.      Documents and testimony gave a window into hostile business practices and a business environment where these four U.S.-based firms could crush, buy or steal from startups. This isn’t news. In 2011, it was revealed Google was buying one company a week. It’s market consolidation, not meant to help consumers but an attempt to maintain corporate control over data flows and innovation.      Many, like The Verge’s Casey Newton, criticized the hearing for going widely off-topic, including tangents into conspiracy theories, and generally avoiding the topic of tech innovation. But he still walked away with the sense the federal government is ready to pursue meaningful antitrust action.      “Members of the subcommittee have largely come to believe, as I do, that tech companies have grown too powerful and are in need of regulation,” he wrote.      It’s a sentiment that’s percolating through the small subset of tech called crypto. Coin Center’s Jerry Brito tweeted midway through the hearing, “Repeat after me: Antitrust law exists to protect consumers, not competitors.”      While Elizabeth Renieris, founder of Hackylawer, shot off a succinct Shoshana Zuboff quote: ""Surveillance capitalism unilaterally claims human experience as free raw material for translation into behavioral data.""      Crypto got wise to Big Tech’s chokehold over the internet early. Instead of waiting for government-led action, technologists and developers started building ways to exit the system.      While these systems are still niche, they offer an alternative to both the public and “private governments” that Amazon, Apple, Facebook and Google have become.    Market intel    Overbought or Overwrought? With bitcoin rising to its highest level in 11 months this week, some investors are beginning to worry that the cryptocurrency is overbought and may be due for notable price drop. Bitcoin’s price rose to $11,319 on Monday, the highest level since August 2019, according to CoinDesk’s Bitcoin Price Index. The sudden rally has pushed the 14-day relative strength index (RSI) above 80.00, a number indicating the bullish move may be overstretched. Asim Ahmad, co-chief investment officer at London-based Eterna Capital, said that an above-70 RSI does not necessarily imply an impending major price slide.      In the Green About 93% of all bitcoin address balances were estimated to be “in profit,” according to Glassnode, when bitcoin traded above $11,000 Wednesday. The metric measures the on-paper profits of wallet balances. More than 90% of bitcoin addresses were last in profit through July and August 2019 when bitcoin traded around $11,500, a local top for the leading cryptocurrency. The 11-month high for in-profit addresses came amid bitcoin’s rally to $11,400 and follows steady long-term accumulation by investors at lower prices, with fewer than 40% of all bitcoins having been moved in the past year.      Frozen Fed Moves Zero Degrees The Federal Reserve said Wednesday it would hold benchmark U.S. interest rates close to zero (in range between 0% and 0.25%) and continue buying Treasury bonds to support the coronavirus-devastated economy. The ""path of the economy will depend significantly on the course of the virus,"" it said. Not said at the press conference: Another $5 billion of freshly created money was injected into financial markets, based on the $80 billion of bond purchases that the Fed is conducting every month to keep financial markets functioning smoothly as the fast-spreading coronavirus devastates the global economy, according to First Mover. Cue the inflationary hedge and brr memes.      Year Zero: From Those Who Were There – Thursday, July 30, 4 p.m. ET      Speakers: Anthony Di Iorio, Anthony D’Onofrio, Adam Levine, Camila Russo, Ken Seiff      Getting the “world computer” operational was no easy task. Hear about the 24/7 coding, the infighting and the instant millions minted in that process. Camila Russo, author of the new book “The Infinite Machine,” digs into Ethereum’s highs and lows with the programmers, entrepreneurs and investors who got in on the ground floor.      Watch today's CoinDesk Live session at 4 p.m. ET and sign up for the Ethereum at Five limited-run newsletter, published every morning until July 31.    Tech pod    $500M in Fees A new study from Bitcoin startup Veriphi finds companies and users sending bitcoin transactions could have saved more than $500 million in fees if everyone had used SegWit and a technique called transaction batching. SegWit, a 2017 update to Bitcoin, allows for more space for transactions per block, and transaction batching enables the sending of multiple transactions at once to cut down on paying for each individual transaction. The average fee costs about $3 per transaction, but increases with demand and transaction volume.      Autonomous Aave Aave is going fully autonomous – transferring ownership of the money protocol to a “genesis governance” built and approved by token holders. Formerly EthLend, the platform raised a $16.2 million initial coin offering in 2017, and launched as a peer-to-peer lending protocol. It has since renamed and switched to a pooled protocol that allows for more dynamic asset listings, network liquidity and variable interest rates. Launched January 2020, Aave was among the first to include the novel DeFi product flash loans, and now has plans to incorporate liquidity mining.    Opinion    Lightning Round Richard Myers, a decentralized applications engineer at goTenna’s Global Mesh Labs initiative, thinks as long as people are paying for internet connectivity in fiat, online censorship is inevitable. “As long as telecommunications tools are being paid for in fiat, they will never be free from governmental or corporate repression. To be truly censorship resistant, internet publishers must be able to accept anonymous payments from their subscribers and advertisers,” he said.    Podcast    DeFi Disruptor Chainlink co-founder Sergey Nazarov appeared on the latest episode of The Breakdown to discuss his life’s work: disrupting traditional finance. “Imagine a world without counterparty risk…” he said.    Who won #CryptoTwitter?",NEUTRAL,없음,BLOCKCHAIN | BTC | EXCHANGE | TRADING | TOKEN SALE,Daniel Kuhn,0,0,CoinDesk,https://coindesk.com/markets/2020/07/30/blockchain-bites-plus-token-ponzi-popped-cardano-forked-and-tzero-cut,https://cdn.sanity.io/images/s3y3vcno/production/f446674a94272cf4c0b29bdf88ca69420d54e965-2048x1365.jpg?w=300&h=300&fit=crop
13279068,https://eng.ambcrypto.com/?p=55564,1596126656,"Bitcoin, where art thou headed?","On 27 July 2020, Bitcoin surged by 11% in a single day, a surge that pushed its price from $9,933 to $11,417. This type of surge was last seen in April 2020, a time when BTC surged from $7,700 to $8,9The post Bitcoin, where art thou headed? appeared first on AMBCrypto.",POSITIVE,BTC,BTC | TRADING,,0,0,AMB Crypto,https://eng.ambcrypto.com/bitcoin-where-art-thou-headed,https://images.cryptocompare.com/news/ambcrypto/9m0g4000000.jpeg
13261227,https://dailyhodl.com/?p=105093,1596126605,"Goldman Sachs Issues Dire Dollar Warning, Says US May Lose Global Currency Dominance","Goldman Sachs is sounding the alarm on the US dollar, saying it could lose its status as the world&apos;s dominant currency. In a new report cited by Bloomberg, Goldman Sachs warns investors that US fiscal policies could significantly slash the value of the dollar in the long run. With $2.8 trillion added to the Federal ...The post Goldman Sachs Issues Dire Dollar Warning, Says US May Lose Global Currency Dominance appeared first on The Daily Hodl.",NEGATIVE,없음,BTC | BUSINESS | FIAT,,0,0,The Daily Hodl,https://dailyhodl.com/2020/07/30/goldman-sachs-issues-dire-dollar-warning-says-us-may-lose-global-currency-dominance/,https://images.cryptocompare.com/news/dailyhodl/e2Ubs0wxk40.jpeg
42384259,0r6Zag11PPDEMKgUXA6so1,1596126332,Suspects Detained in Ukraine for Bomb Threats Demanding Bitcoin,"The Security Service of Ukraine (SSU) detained terrorists who demanded bitcoin in return for not blowing up buildings in the country’s capital.      According to a post on SSU’s Facebook page, two 60-year-old men posted a paper note on an apartment building in Kyiv threatening to blow up that building or another one if they didn’t receive 50 BTC to their bitcoin address.      To prove they were serious, the alleged terrorists detonated a small bomb near a subway station on July 21 and then called the police twice, reporting bombs were planted in other locations in Kyiv, and that those actions were related to the explosion near the subway station.      After analyzing cell phone data and street camera footage, the SSU detained two suspects.      “Despite their advanced age, they learned how various criminals have been using crypto and hoped to avoid punishment after getting money in a digital wallet,” wrote Anton Herashchenko, deputy minister at the Ukrainian Ministry of Internal Affairs, on his Facebook page.      The bitcoin wallet address on the threat notice has only one incoming transaction on record, receiving 0.00012258 BTC on July 22 from an unknown address. According to data from Crystal Blockchain transaction tracing software, the money came to the wallet from the LocalBitcoins marketplace via nine hops through other addresses, including several transactions to the Russian dark market Hydra.      In December 2019, a series of bomb threats disrupted work at schools, courthouses, shopping malls and airports in Russia, with anonymous terrorists claiming to be defrauded users of the defunct WEX exchange and demanding 120 BTC.",NEGATIVE,BTC,BLOCKCHAIN | BTC | EXCHANGE | MARKET | TECHNOLOGY,Anna Baydakova,0,0,CoinDesk,https://coindesk.com/policy/2020/07/30/suspects-detained-in-ukraine-for-bomb-threats-demanding-bitcoin,https://cdn.sanity.io/images/s3y3vcno/production/6acc5bed09f7dd27bfaf4760e0267450ef3b3155-1200x674.jpg?w=300&h=300&fit=crop
13579159,https://www.cryptopolitan.com/?p=49133,1596125715,"Bitcoin Cash price rises to $287, what to expect?","The Bitcoin Cash price line varied between the $280 and $290 price marks on the 30th of July. Crypto analysts from TradingView believe that the BCH price will see an uptrend soon. 1-Day Bitcoin Cash price analysis Bitcoin Cash price chart by Trading View Bitcoin Cash was observed trading at $287.49 US Dollars, at the ...",POSITIVE,BCH,BCH | MARKET | TRADING,,0,0,Cryptopolitan,https://www.cryptopolitan.com/bitcoin-cash-price-rises-to-287/,https://images.cryptocompare.com/news/cryptopolitan/8hyB3ixg919.jpeg
13395557,https://decrypt.co/?p=37218&preview=true&preview_id=37218,1596125146,The inside story of YFII: China's celebrated DeFi knockoff,"YFII&apos;s fork of YFI is playing very differently in China, where it is being celebrated by Maoist nationalists as one of DeFi&apos;s first great success stories.",POSITIVE,YFI,ASIA | YFI,,0,0,Decrypt,https://decrypt.co/37218/the-inside-story-of-yfii-chinas-celebrated-defi-knockoff,https://images.cryptocompare.com/news/decrypt/f7A0jH01100.jpeg
42384249,0r6Zag11PPDEMKgUXA6sch,1596124803,CoinList Launches 'Pro' Exchange for Token Sale Buyers,"The Jack Dorsey-backed token platform CoinList launched an exchange Thursday aimed at institutional traders.      CoinList Pro, modeled after incumbent rival Coinbase Pro, is an exchange tailored to trading and buying the new tokens listed by CoinList clients.      CoinList launched some of the trendiest cryptocurrency sales to date for non-U.S. and accredited investors, including offerings from Celo, Solana and Filecoin. CoinList President Andy Bromberg said the token-issuing platform has facilitated nearly $1 billion worth of transactions from “hundreds of thousands” of users since 2017.      Read more: Investors on CoinList Pour $10M Into Celo Token Sale in Roughly 12 Hours      The new service will rely on partnerships with startups such as BitGo, Bison Trails and Anchorage for staking and custody options, including nearly a dozen assets by 2021.      CoinList Pro lists bitcoin (BTC), ether (ETH), celo (CELO), orchid (OXT) and algorand (ALGO) tokens for now. It will be the first exchange to support filecoin trading when the token launches in September, Bromberg said.      Bromberg said CoinList will facilitate roughly a dozen token sales in 2020, so this complementary exchange is meant to reduce friction. Users won’t even need to own separate cryptocurrency wallets, they can wire money from their bank accounts.      “Our dream sequence is users buying from a token sale and eventually selling that asset on CoinList Pro for a seamless flow,” Bromberg said in an interview.",POSITIVE,BTC,BTC | BUSINESS | EXCHANGE | FIL | TOKEN SALE,Leigh Cuen,0,0,CoinDesk,https://coindesk.com/business/2020/07/30/coinlist-launches-pro-exchange-for-token-sale-buyers,https://cdn.sanity.io/images/s3y3vcno/production/30ee7203388343f3523f7100b47959402ac4ac1a-1634x1634.jpg?w=300&h=300&fit=crop
42384243,0r6Zag11PPDEMKgUXA6sWP,1596124800,"Bitcoin News Roundup for July 30, 2020","With the price of bitcoin hovering near recent highs and some wondering whether we're poised for a pullback, CoinDesk's Markets Daily is back for your latest news roundup.      For early access before our regular noon Eastern time releases , subscribe with Apple Podcasts, Spotify, Pocketcasts, Google Podcasts, Castbox, Stitcher, RadioPublica or RSS.      This episode is sponsored by Bitstamp and Crypto.com.    Today's Bitcoin News:    Bitcoin Looks Overbought but Analysts Play Down Drop Fears      Bitcoin's rally looks overstretched, according to a technical indicator, but short-term price consolidation looks more likely than a drop, say analysts.      A Crypto Derivatives Exchange Is Getting a Nasdaq Listing in Q3      Originally postponed due to the pandemic, EQUOS.io is still set to be the first crypto exchange on the Nasdaq.      Police Arrest 27 Alleged Masterminds Behind $5.7B Plus Token Crypto Scam      Chinese police have arrested 27 leaders and 82 others suspected of operating the Ponzi scheme.      Malaysia's Stock Exchange Eyes Blockchain for Bond Market Digitization      Known as Project Harbour, the initiative will use distributed ledger technology as a register for a bond marketplace.      For early access before our regular noon Eastern time releases , subscribe with Apple Podcasts, Spotify, Pocketcasts, Google Podcasts, Castbox, Stitcher, RadioPublica or RSS.",NEUTRAL,없음,BLOCKCHAIN | BTC | EXCHANGE | MARKET | TRADING,"Adam B. Levine, Lyllah Ledesma",0,0,CoinDesk,https://coindesk.com/markets/2020/07/30/bitcoin-news-roundup-for-july-30-2020,https://cdn.sanity.io/images/s3y3vcno/production/19dd77b31b4cf2674854d49d828de44bf2b77ae9-1420x916.jpg?w=300&h=300&fit=crop
13348914,https://cointelegraph.com/news/australian-watchdog-issues-warning-on-fake-celebrity-endorsed-crypto-ads,1596124020,Australian Watchdog Issues Warning on Fake Celebrity-Endorsed Crypto Ads,The ASIC has received numerous reports on fake crypto trading robots and other schemes used to scam Australians.,NEGATIVE,없음,BTC | TRADING,,0,0,CoinTelegraph,https://cointelegraph.com/news/australian-watchdog-issues-warning-on-fake-celebrity-endorsed-crypto-ads,https://images.cryptocompare.com/news/cointelegraph/fuAENd0I10w.jpeg
13579160,https://www.cryptopolitan.com/?p=49126,1596123967,"Litecoin price fluctuates above $57, what’s next?","The Litecoin price line had fallen below the $55.5 mark on the 29th of July, while the trading pair&apos;s trajectory returned above the $57 level on the 30th of July. However, the price is fluctuating between $56 and $57 at the time of writing. 1-Day Litecoin price analysis Litecoin price chart by Trading View The ...",NEUTRAL,없음,LTC | MARKET | TRADING,,0,0,Cryptopolitan,https://www.cryptopolitan.com/litecoin-price-fluctuates-above-57-whats-next/,https://images.cryptocompare.com/news/cryptopolitan/cACcPA830Mu.jpeg
13408057,https://cryptopotato.com/?p=63959,1596123930,5th Birthday: Ethereum Miners Rejoice Over High Network Fees,"The recent strengthening of on-chain metrics such as hash rates, combined with high transaction fees, have resulted in Ethereum mining profits return to a two year high, and to it, on its 5th birthday.The post 5th Birthday: Ethereum Miners Rejoice Over High Network Fees appeared first on CryptoPotato.",POSITIVE,없음,ETH | MINING,,0,0,Crypto Potato,https://cryptopotato.com/5th-birthday-ethereum-miners-rejoice-over-high-network-fees/,https://images.cryptocompare.com/news/cryptopotato/90w2c200000.jpeg
13432943,https://news.bitcoin.com/?p=402772&preview=true&preview_id=402772,1596123037,"Major Investment Bank Oppenheimer Bullish on Bitcoin, Highlights Instead of Gold","U.S. investment bank Oppenheimer&apos;s analyst says gold is &apos;extended&apos; and has &apos;run up a bit,&apos; bringing attention to bitcoin instead. He sees the cryptocurrency reversing its downtrend from the $20K peak, benefiting from the dollar&apos;s weakness. Oppenheimer Analyst on Bitcoin vs Gold Ari Wald, head of technical analysis at Oppenheimer, a major American investment bank ...The post Major Investment Bank Oppenheimer Bullish on Bitcoin, Highlights Instead of Gold appeared first on Bitcoin News.",POSITIVE,없음,BTC | FIAT | MARKET | TRADING,,0,0,Bitcoin.com,https://news.bitcoin.com/oppenheimer-bullish-bitcoin-instead-of-gold/,https://images.cryptocompare.com/news/bitcoin.com/8eN20UTBx98.jpeg
13472410,https://www.trustnodes.com/?p=31674,1596122513,"Tesla is Coming to Synthetix, But Can SpaceX Be Tokenized Without Musk’s Permission?","Synthetix has gone dao, meaning this is now just code run by 10,000 ethereum nodes across the world with no one responsible for it and with curation being by token...",NEUTRAL,없음,ETH | ICO,,0,0,TrustNodes,https://www.trustnodes.com/2020/07/30/tesla-is-coming-to-synthetix-but-can-spacex-be-tokenized-without-musks-permission,https://images.cryptocompare.com/news/trustnodes/884hGOA68wk.jpeg
13348915,https://cointelegraph.com/news/zcash-company-confirms-crypto-in-context-program-as-global-effort,1596121980,Zcash Company Confirms ‘Crypto in Context’ Program as Global Effort,"Zcash&apos;s creator, the Electric Coin Company, confirmed that their recent educational program is a global effort with more events in the months ahead.",POSITIVE,없음,ALTCOIN | ZEC,,0,0,CoinTelegraph,https://cointelegraph.com/news/zcash-company-confirms-crypto-in-context-program-as-global-effort,https://images.cryptocompare.com/news/cointelegraph/f01q6EoM8gC.jpeg
13408058,https://cryptopotato.com/?p=63986,1596121843,"ETH Struggles To Break $323, Bearish Reversal Incoming? Ethereum Price Analysis","Ethereum saw a small 1% price fall today as it drops to $318. This comes after four days of ETH trying to break resistance at $323. Against Bitcoin, Ethereum fell from 0.0317 BTC as it reached the support at 0.0284 BTC ETH/USD: Bulls Challenged By $323 Resistance Key Support Levels: $306, $300, $287. Key Resistance ...The post ETH Struggles To Break $323, Bearish Reversal Incoming? Ethereum Price Analysis appeared first on CryptoPotato.",NEGATIVE,BTC | ETH,BTC | ETH | MARKET | TRADING,,0,0,Crypto Potato,https://cryptopotato.com/eth-struggles-to-break-323-bearish-reversal-incoming-ethereum-price-analysis/,https://images.cryptocompare.com/news/cryptopotato/fwuAE1wa0w0.jpeg
