뉴스ID,뉴스GUID,일자(UTC timestamp),뉴스제목,본문,SENTIMENT,주요코인,카테고리,작성자,추천수,비추천수,출처,뉴스URL,이미지URL
42384248,0r6Zag11PPDEMKgUXA6sYv,1596114000,Circle Gets $25M From DCG to Drive USDC Mainstream,"USDC backer Circle is teaming with Genesis Trading in a $25 million deal aimed at pushing the stablecoin to the fintech masses.      Announced Wednesday, the funding comes from Genesis parent company Digital Currency Group (DCG), which, full disclosure, also owns CoinDesk.      The new partnership and funding will enhance Circle’s suite of products, and launch some new ones too, the companies said. It’s all geared toward additional USDC yield and lending services with a view toward mainstream adoption.      “We’re seeing the evolution from stablecoins as something that’s exclusively been in the crypto capital markets to really moving into a broader set of use cases in payments and commerce and financial applications around the world,” Circle CEO Jeremy Allaire said in an interview. “The logical evolution is that lending markets built on stablecoins are going to grow significantly.”      Read more: Circle CEO Claims ‘Explosive’ Stablecoin Demand From Everyday Businesses      Dollar stablecoins are on a roll, with about 12 billion now in circulation. Out of the stablecoin cohort, USDC has shone in recent months, growing from just over 400 million in early 2020 to around 1.1 billion today.      Meanwhile, Genesis originated more than $2 billion in crypto loans in Q1 2020, and more than $8 billion since launching the business in March 2018. The broker has seen a marked increase in the percentage of USDC within its loan portfolio, said Genesis CEO Michael Moro.      “Look at the interest rates that various lending platforms like ours have been paying people just to buy and hold crypto, in addition to the price move in the crypto itself,” said Moro. “Now compare that to interest rates in the U.S., as well as negative interest rates abroad. With a 10-year Treasury note, we’re looking at 65, 70 basis points a year, versus being able to earn 8% potentially on your crypto, including stablecoins.”    Doubling down    Looking back, Circle has raised $246 million over seven funding rounds, with DCG being a regular investor in the company as far back as early 2014. The USDC stablecoin was born in October 2018 out of a partnership between Circle and San Francisco-based crypto exchange Coinbase, dubbed the CENTRE Consortium.      Allaire could not say specifically if Genesis or anyone else might be joining the CENTRE consortium soon, but he did say expansion plans are afoot.      “Right now, Circle and Coinbase are the two members of the CENTRE consortium, and what I call the board of managers for the governance of the stablecoin standard itself,” said Allaire. “We are going to be expanding ecosystem participation in CENTRE and involving a far broader range of participants in the direction of USDC as a standard.”    DeFi vs. CeFi    Decentralized finance (DeFi) lending is all the rage right now, and stablecoins like USDC are being sucked onto platforms such as Compound and Maker at a rapid pace, which presents something of a contrast to the more traditional world of crypto lending.      Read more: MakerDAO Adds USDC as DeFi Collateral Following ‘Black Thursday’ Chaos      The high-net-worth clients, family offices and institutional players that Genesis typically serves are definitely following everything that’s happening in the DeFi space, said Moro, but these sorts of investors need to know who is the counterparty on the other end of a contract.      “The idea of smart contracts kind of being your counterparty is still a new and nebulous idea, certainly to the legal and compliance arm of a business,” said Moro. “That’s not to say that DeFi couldn’t make its way into corporate America, but it’s a long way from now, in my opinion.”    The logical evolution is that lending markets built on stablecoins are going to grow significantly.    There are possible areas of crossover, involving crypto hedge funds that can handle the counterparty risk in return for price arbitrage opportunities, Moro added.      “There are guys that are comfortable with the counterparty risk, trading liquidity and volatility, who are able to [arbitrage] to two markets and kind of intersect both worlds,” said Moro. “That’s a natural development, but it’s also hard to price the risk.”      Read more: Behind ‘Prime Broker’ Buzzword Lies a Complex Strategy Game for Crypto Firms      While USDC’s 200% growth this year is impressive, in terms of volume, tether (USDT) dominates the stablecoin space with about 10 billion in circulation. Allaire believes issuing a transparent, regulated dollar stablecoin (USDC is audited by global accountancy firm Grant Thornton) will win out in the long run.      “There are obviously other stablecoins that have been in the market for a long time and are not regulated,” Allaire said. “What’s backing them is an open question and we have seen various legal inquiries. If you’re talking about building the future financial system, I think you want to build on something solid.”",POSITIVE,USDC,BUSINESS | EXCHANGE | MARKET | TRADING | USDC,Ian Allison,0,0,CoinDesk,https://coindesk.com/business/2020/07/30/circle-gets-25m-from-dcg-to-drive-usdc-mainstream,https://cdn.sanity.io/images/s3y3vcno/production/5933b8b98d0721cfd9ddfdc8bdcf5dd48f8c0948-1200x968.jpg?w=300&h=300&fit=crop
13484597,https://cryptobriefing.com/?p=65565,1596112799,Ampleforth’s Unique Design Put to the Test After Market Cap Drops 55%,"Ampleforth and its token, AMPL, are the center of attention as the network&apos;s market cap crashed over 55% from its peak. However, this was an expected reaction and proves that...",NEGATIVE,없음,ICO | MARKET,,0,0,Crypto Briefing,https://cryptobriefing.com/ampleforths-unique-design-put-test-market-cap-drops-55/,https://images.cryptocompare.com/news/cryptobriefing/c730o330g30.png
13348925,https://cointelegraph.com/news/blockchain-is-key-to-future-hyperconnected-economy-say-researchers,1596112260,"Blockchain Is Key to Future 'Hyperconnected Economy,' Say Researchers","According to a report by market research firm HFS Research, blockchain technology will play a decisive role in establishing the future &apos;hyperconnected economy.&apos;",POSITIVE,없음,BLOCKCHAIN | BUSINESS | TECHNOLOGY | WALLET | RESEARCH,,0,0,CoinTelegraph,https://cointelegraph.com/news/blockchain-is-key-to-future-hyperconnected-economy-say-researchers,https://images.cryptocompare.com/news/cointelegraph/98lsjryPERh.jpeg
13279073,https://eng.ambcrypto.com/?p=55521,1596112257,"Algorand, Ethereum Classic, Bitcoin SV Price Analysis: 30 July","Bitcoin&apos;s price over the past few days has seen some renewed bullish momentum, enabling the king coin to push past its resistance at around the $10k mark. In the case of altcoins such as Bitcoin SV anThe post Algorand, Ethereum Classic, Bitcoin SV Price Analysis: 30 July appeared first on AMBCrypto.",NEUTRAL,없음,ALGO | BTC | ETC | MARKET | TRADING,,0,0,AMB Crypto,https://eng.ambcrypto.com/algorand-ethereum-classic-bitcoin-sv-price-analysis-30-july,https://images.cryptocompare.com/news/ambcrypto/fV008010000.jpeg
13432944,https://news.bitcoin.com/?p=402765&preview=true&preview_id=402765,1596111313,‘Huge Demand in India’ Spurs Zebpay to Launch OTC Bitcoin Trading Desk,"Indian cryptocurrency exchange Zebpay is launching an OTC bitcoin trading desk. The exchange has shared the details with news.Bitcoin.com, stating that &apos;There is huge demand&apos; among bitcoin traders and arbitrageurs in India for OTC desk services. Zebpay Sees Huge Demand for OTC Crypto Trading in India Zebpay&apos;s OTC desk offers &apos;deeper liquidity and private, more ...The post &apos;Huge Demand in India&apos; Spurs Zebpay to Launch OTC Bitcoin Trading Desk appeared first on Bitcoin News.",POSITIVE,없음,BTC | EXCHANGE | TRADING,,0,0,Bitcoin.com,https://news.bitcoin.com/huge-demand-in-india-zebpay-launch-otc-bitcoin-trading-desk/,https://images.cryptocompare.com/news/default/bitcoincom.png
42384264,0r6Zag11PPDEMKgUXA6st3,1596110852,First Mover: Sleepy Fed Meeting Belies Tense Economic Reality (Brrr) That May Buoy Bitcoin,"After a two-day closed-door meeting this week, the Federal Reserve issued a six-paragraph statement on Wednesday and held an hour-long press conference.      None of that was news, of course, and neither was anything else emanating from the U.S. central bank, which announced no policy changes.      You’re reading First Mover, CoinDesk’s daily markets newsletter. Assembled by the CoinDesk Markets Team, First Mover starts your day with the most up-to-date sentiment around crypto markets, which of course never close, putting in context every wild swing in bitcoin and more. We follow the money so you don’t have to. You can subscribe here.      But here's what really happened over the past two days: Another $5 billion of freshly created money was injected into financial markets, based on the $80 billion of bond purchases the Fed is conducting every month to keep financial markets functioning smoothly as the fast-spreading coronavirus devastates the global economy.      The contrast couldn't have been starker between the lack of drama at the Fed meeting and investors' growing anxiety over what is, by all accounts, one of the most excruciatingly tense and fragile moments in modern economic history.      Mati Greenspan, founder of the cryptocurrency and foreign-exchange firm Quantum Economics, told clients in a note late Tuesday the Fed's money printer – often known by the purported sound it makes, ""Brrr"" – was now mostly producing a ""yawwwwwwwnnnn."" (That's six w's, four n's.)      ""The Fed is doing its best to speak softly (literally) so as not to wake up the markets,"" Greenspan wrote. ""The more boring, the better.""      Beneath the surface, all is not well, and a recent jump in prices for bitcoin might be one of the best indications of that, because a growing number of investors see the cryptocurrency as a decent hedge against everything from hyperinflation to economic armageddon. Similar to gold, even if not always perfectly in sync.      Bitcoin is up 57% this year, climbing to about $11,261 on Wednesday in an anemic but upward drift that barely twitched from its listless trajectory when the Fed's statement emerged at 2 p.m. ET.      U.S. lawmakers are at odds on everything from the specifics of a relief bill likely to cost at least $1 trillion to the possibility of contracting the disease from a mask. The Wall Street firm Goldman Sachs warned earlier this week that the U.S. dollar is at risk of losing its status as the de facto global reserve currency.      Dwindling numbers of big investors are assigning any credibility to the assurances of President Donald Trump's administration that the economy is headed toward a V-shaped recovery. Pantheon, a macroeconomic forecasting firm, says the U.S. economy in the second quarter probably had its ""biggest drop ever recorded, by far."" Jobless claims probably rose to about 16.5 million last week.      Rick Rieder, chief investment officer of global fixed income at money-market giant BlackRock, told CNBC that the U.S. dollar, which is on course to post its worst month in a decade, will likely continue to decline.      ""I think we're in a different regime around the dollar,"" Rieder told the channel.      The only thing that seems certain is that the Federal Reserve will keep creating billions of dollars a day and pumping them into global markets. On Wall Street, it's not even controversial anymore to suggest that the stock market is being propped up by the U.S. central bank.      This week's Fed meeting ""underscored the focus, especially in an election year, that our federal government has in keeping the economy humming,"" Joe DiPasquale, CEO of cryptocurrency-focused hedge fund BitBull Capital, told First Mover in a phone interview.      ""They're going to keep the monetary stock flowing, and that should be good for bitcoin as people become more comfortable with an asset that has in the past been seen as more risky,"" DiPasquale said.      Fidelity Investments, which oversees $7.3 trillion of customer assets, wrote this month in a report that bitcoin's ""next wave of awareness and adoption could be driven by external factors such as unprecedented levels of intervention by central banks and governments, record low interest rates, increasing fiat money supply, deglobalization and the potential for ensuing inflation, all of which have been accelerated by the pandemic and economic shutdown.""      It's quite a list. And hard to argue with any of that, which collectively provided the subtext for this week's Fed meeting.      Powell was candid about the Fed's willingness to provide further monetary accommodation, even after policy makers earlier this year slashed interest rates close to zero and expanded the central bank's balance sheet by roughly $3 trillion. The amount represents roughly 75% of the total amount of money previously created in its 107-year history.      One question might be whether the Fed can stimulate markets with more dollars if the U.S. currency is looking weak in foreign-exchange markets. According to Pantheon, the Fed may have to increase the pace of its monthly bond purchases once the ""Treasury begins to issue the $1.5 trillion extra debt we reckon will be needed to finance the next relief bill.""      ""We are committed to using our full range of tools to support the economy,"" Powell said during the press conference, using language nearly identical to language he has used on multiple prior occasions since March, when the Fed first began plying the financial system with emergency loans and liquidity.      ""The way Powell emphasizes it, they're going to continue to pump liquidity and easy money into the markets,"" John Todaro, of the digital-asset analysis firm TradeBlock, said Wednesday in a phone interview. ""It was just kind of a rehash of, Hey, how dovish are these folks going to get?""      First Mover reported earlier this week that Deutsche Bank Strategist Jim Reid sees the Fed adding another $12 trillion to its balance sheet over the next few years, to the $7.01 trillion of total assets as of last week.      Fed policy makers did their best this week not to make news. That doesn't mean they're not doing a lot. Bitcoin traders are more focused on the Brrr than the yawwwwwwnnnn.    Tweet of the day  Bitcoin watch    BTC: Price: $10,955 (BPI) | 24-Hr High: $11,345 | 24-Hr Low: $10,913      Trend: Despite a small drop, bitcoin's overall trend still looks bullish with longer duration charts showing an upside break of a 2.5-year long descending trendline.      That doesn't necessarily imply a 90-degree run toward resistance at $12,000. In fact, we could see the cryptocurrency pull back to the former resistance-turned-support at $10,500 (February high) in the next day or so, recent price action suggests.      The cryptocurrency hit a wall during another attempt to establish a foothold above $10,300 during the U.S. hours on Wednesday and has been losing altitude ever since. At the time of writing, bitcoin is changing hands a little below $11,000, representing a 1.7% drop on the day.      A similar pattern was seen on Monday, when the cryptocurrency tagged a multi-month high above $11,300 before making a quick retreat to $11,000.      The consecutive failure to keep gains above $11,300 alongside an overbought reading on the 14-day relative strength index (RSI) may indicate ebbing bullish momentum. The 4-hour chart RSI, too, has breached a bullish trendline, representing the rally from $9,000 to $11,300.      As such, a deeper pullback to $10,500 cannot be ruled out. A violation there would expose the psychological support of $10,000. The broader bullish bias would be invalidated only if prices find acceptance under $9,760 – a trendline falling from December 2017 and June 2019 highs.      The case for deeper retracement would weaken if prices rise above the Asian session high of $11,126. In that case, the bulls will likely have another attempt at breaching the newfound resistance zone above $11,300.",NEUTRAL,BTC,BTC | BUSINESS | FIAT | MARKET | TRADING,"Bradley Keoun, Omkar Godbole",0,0,CoinDesk,https://coindesk.com/markets/2020/07/30/first-mover-sleepy-fed-meeting-belies-tense-economic-reality-brrr-that-may-buoy-bitcoin,https://cdn.sanity.io/images/s3y3vcno/production/41c854d1cad703b69ccc3e34ac189a147fceaeb3-1200x800.jpg?w=300&h=300&fit=crop
13408061,https://cryptopotato.com/?p=63985,1596110517,Busted: Core Team Behind $5.8 Billion PlusToken Scam Finally Arrested,A total of 27 core members associated with the $5.7 billion cryptocurrency scam PlusToken have been arrested by the Chinese police. The post Busted: Core Team Behind $5.8 Billion PlusToken Scam Finally Arrested appeared first on CryptoPotato.,NEGATIVE,없음,ASIA,,0,0,Crypto Potato,https://cryptopotato.com/busted-core-team-behind-5-8-billion-plustoken-scam-finally-arrested/,https://images.cryptocompare.com/news/cryptopotato/cr6I3301w30.jpeg
42384255,0r6Zag11PPDEMKgUXA6skF,1596110400,Dapp Data Storage Provider Bluzelle to Begin Mainnet Launch in August,"Distributed data storage network Bluzelle, headquartered in Singapore, will begin the launch of its mainnet on Aug. 8, the company said Thursday.    According to a press statement, phase 1 of the mainnet will enable users to stake bluzelle (BLZ) tokens and earn rewards for participating in the network’s validation process.  Participants are required to create a BluzelleNet address using the Bluzelle staking platform to start earning BLZ, which will be deposited to their addresses every 24 hours.  The launch also marks the platform’s transition to the newest version of Tendermint.  Bluzelle CEO Pavel Bains told CoinDesk that, unlike Filecoin and Storj, which provide file storage services to customers as Dropbox does, Bluzelle facilitates the storage of data particularly for application developers.  The network, marketed as the “Airbnb of databases” will allow developers to pay for storage space and write to the decentralized database, the statement said.  Bluzelle raised $19.5 million in its initial coin offering (ICO) in 2018 to create the network of decentralized databases.  The mainnet will launch in full on Sept. 8.    Read more: The Decentralized Web Just Might Need Databases, Too",POSITIVE,없음,ASIA | FIL | TOKEN SALE,Sandali Handagama,0,0,CoinDesk,https://coindesk.com/markets/2020/07/30/dapp-data-storage-provider-bluzelle-to-begin-mainnet-launch-in-august,https://cdn.sanity.io/images/s3y3vcno/production/59d57b4420be379134cad2df399c215b338df961-1500x1000.jpg?w=300&h=300&fit=crop
13579165,https://www.cryptopolitan.com/?p=49110,1596109293,Crypto-related scams in Russia skyrocketed exponentially during the first half of 2020,"Cybersecurity companies have concluded that crypto-related scams in Russia have seen a rapid rise over the first half of 2020. Moreover, researchers have highlighted about 23,000 active websites involved in cryptocurrency scams in Russia, still actively looking for more victims to defraud. According to a new report by Kommersant, citing a new study conducted by ...",NEGATIVE,없음,OTHER,,0,0,Cryptopolitan,https://www.cryptopolitan.com/crypto-related-scams-in-russia-skyrocketed/,https://images.cryptocompare.com/news/cryptopolitan/e2488300200.jpeg
13279074,https://eng.ambcrypto.com/?p=55507,1596108645,Tezos long-term Price Analysis: 30 July,"With Bitcoin&apos;s dominance growing steadily off-late, the altseason seems to have come to a halt. The same can be seen in Tezos&apos;s falling price, an altcoin that has been one of the market&apos;s best-performThe post Tezos long-term Price Analysis: 30 July appeared first on AMBCrypto.",NEUTRAL,없음,ALTCOIN | MARKET | TRADING,,0,0,AMB Crypto,https://eng.ambcrypto.com/tezos-long-term-price-analysis-30-july,https://images.cryptocompare.com/news/ambcrypto/dIhVxAww0E6.jpeg
13395559,https://decrypt.co/?p=37193,1596108004,China arrests 109 members of Bitcoin’s biggest Ponzi scheme,"Authorities in China arrested the alleged architects behind the PlusToken project, bringing an end to the biggest Bitcoin scheme in history.",NEGATIVE,없음,ASIA | BTC,,0,0,Decrypt,https://decrypt.co/37193/china-arrests-109-members-of-bitcoins-biggest-ponzi-scheme,https://images.cryptocompare.com/news/decrypt/fMgM4210000.jpeg
13348926,https://cointelegraph.com/news/when-robinhood-fomo-bitcoin-price-pulling-a-kodak-means-six-figures,1596107460,When Robinhood FOMO? Bitcoin Price Pulling a ‘Kodak’ Means Six Figures,"If Bitcoin sees similar FOMO rallies like KODK in recent days, BTC price could quickly soar to six figures, as some analysts have previously predicted.",POSITIVE,BTC,BTC | MARKET | TRADING,,0,0,CoinTelegraph,https://cointelegraph.com/news/when-robinhood-fomo-bitcoin-price-pulling-a-kodak-means-six-figures,https://images.cryptocompare.com/news/cointelegraph/cjwiA2cA023.jpeg
13484598,https://cryptobriefing.com/?p=65570,1596107377,"100 Key Members of PlusToken Arrested, $2 Billion Scheme Disbanded","PlusToken&apos;s core members have been arrested in China, and the scheme has been completely demobilized, says a report from Cailian News. The report claims over 100 people were arrested by...",NEGATIVE,없음,ASIA,,0,0,Crypto Briefing,https://cryptobriefing.com/100-key-members-plustoken-arrested-2-billion-scheme-disbanded/,https://images.cryptocompare.com/news/cryptobriefing/8lUe8qg8P32.png
13348927,https://cointelegraph.com/news/27-key-execs-at-plustoken-scam-are-reportedly-arrested,1596107220,27 Key Execs at PlusToken Scam Are Reportedly Arrested,"PlusToken, one of the greatest exit scams in history, defrauded investors of nearly $6 billion, according to latest reports.",NEGATIVE,없음,ASIA | BUSINESS | REGULATION,,0,0,CoinTelegraph,https://cointelegraph.com/news/27-key-execs-at-plustoken-scam-are-reportedly-arrested,https://images.cryptocompare.com/news/cointelegraph/c$y0zS9O6b0.jpeg
13432945,https://news.bitcoin.com/?p=402746&preview=true&preview_id=402746,1596106834,Bybit presents World Series of Trading (WSOT) – 200 BTC Prize Pool up for Grabs,"While movie theaters may be unusually empty this time of the year, a different kind of summer blockbuster is coming soon, one that promises to bring back the exhilaration of competitive crypto trading with up to 200 bitcoins (BTC) prize pool, up to 20% off trading fees and up to $9,400 in USDT bonuses. A ...The post Bybit presents World Series of Trading (WSOT) - 200 BTC Prize Pool up for Grabs appeared first on Bitcoin News.",POSITIVE,BTC | USDT,BTC | EXCHANGE | SPONSORED | TRADING | USDT,,0,0,Bitcoin.com,https://news.bitcoin.com/bybit-presents-world-series-of-trading-wsot-200-btc-prize-pool-up-for-grabs/,https://images.cryptocompare.com/news/bitcoin.com/cPab31F9I6c.png
13461639,https://www.cryptonewsz.com/?p=65381,1596106766,WOM Protocol Integrates With Chainlink,"Working as a leading name in the blockchain arena with its revolutionary services, WOM Protocol Pte. Ltd. has announced its collaboration with Chainlink, the industry-leading decentralized oracle network. The first systematic venture of this integration is the launch of a Chainlink-supported WOM/USD Price Reference Feed, which is running live on the mainnet. The decentralized price …",POSITIVE,없음,BLOCKCHAIN | LINK | TRADING,,0,0,CryptoNewsZ,https://www.cryptonewsz.com/wom-protocol-integrates-with-chainlink/,https://images.cryptocompare.com/news/cryptonewsz/8MP328zz2ec.jpeg
42384242,0r6Zag11PPDEMKgUXA6sV9,1596106626,"tZERO Slashes Jobs, Salaries as It Gears Up for Another Funding Round","Security token platform tZERO, which has tried to raise hundreds of millions of dollars in investment, has cut staff and salaries as it hunts for more capital.    In an otherwise upbeat company update Wednesday, CEO Saum Noursalehi said tZERO had ""significantly reduced"" its cash burn rate by 45% year on year.  Savings came from cuts to legal costs and staff; remaining senior staff took salary cuts in return for company equity.  Board members are now compensated only in equity; Noursalehi said he reduced his own salary by 60%.  ""This underscores just how much I, and others, believe in our mission,"" he wrote, adding that development work for the tZERO platform was mostly complete.  tZERO is now preparing for another capital raise, Noursalehi confirmed, though he didn't disclose a funding target.  A majority-owned subsidiary of U.S. online retailer Overstock, tZERO raised $134 million in an initial coin offering in 2018, short of its $250 million target.  Chinese fund GoldenSands Capital pledged to lead a $374.55 million round for tZERO in 2018 but this was knocked down to a $5 million investment in April 2020.  In the note Wednesday, Noursalehi claimed tZERO dominated the security token space, accounting for 95% of token trading volume and 80% of the dollar value.  But the tZERO platform only has three broker-dealers and two security tokens – a third token, for real estate in Aspen, Colo., will be listed soon.  In an SEC filing for Q1 2020, tZERO said it made a gross profit just shy of $76,000 and the company reported a $10 million net loss in Q2 2019.    See also: US Regulator Clears Security Token Trading System to Launch",NEUTRAL,없음,BUSINESS | REGULATION | TRADING | TOKEN SALE,Paddy Baker,0,0,CoinDesk,https://coindesk.com/markets/2020/07/30/tzero-slashes-jobs-salaries-as-it-gears-up-for-another-funding-round,https://cdn.sanity.io/images/s3y3vcno/production/c753728078c212984c7a60eb1ac4b58c8153e9e4-1500x870.jpg?w=300&h=300&fit=crop
