뉴스ID,뉴스GUID,일자(UTC timestamp),뉴스제목,본문,SENTIMENT,주요코인,카테고리,작성자,추천수,비추천수,출처,뉴스URL,이미지URL
13363452,https://cointelegraph.com/news/crypto-markets-see-little-movement-bitcoin-continues-to-trade-just-below-6-500,1540078980,"Crypto Markets See Little Movement, Bitcoin Continues to Trade Just Below $6,500","Crypto markets are mostly green, with Bitcoin holding just below $6,500 and most major coins seeing little change, capped within a 2 percent range",NEUTRAL,없음,ALTCOIN | BTC | ETH | LTC | MARKET,,0,0,CoinTelegraph,https://cointelegraph.com/news/crypto-markets-see-little-movement-bitcoin-continues-to-trade-just-below-6-500,https://images.cryptocompare.com/news/cointelegraph/c1N0q088500.jpeg
13246884,https://nulltx.com/?p=71125,1540077295,Can You Mine Cryptocurrencies on AWS or DigitalOcean?,"In the world of cryptocurrency, mining is an integral part of Bitcoin and most altcoins. Unfortunately, not everyone has the means to mine at home or partake in cloud mining. Relying on AWS-based mining was a worthwhile solution some time ago, but that concept has fallen out of favor as of right now. AWS Mining ...The post Can You Mine Cryptocurrencies on AWS or DigitalOcean? appeared first on NullTX.",NEUTRAL,없음,ALTCOIN | BTC | MINING,,0,0,NullTx,https://nulltx.com/can-you-mine-cryptocurrencies-on-aws/,https://images.cryptocompare.com/news/themerkle/d514ky10ww2.jpeg
13437106,https://news.bitcoin.com/?p=232631,1540076741,Indian Cryptocurrency Exchanges See Rapid Growth in P2P Trading,"Trading volumes on exchange-escrowed peer-to-peer (P2P) cryptocurrency trading platforms in India are rising rapidly amid the banking ban by the country&apos;s central bank. &apos;Indians are warming up to P2P in amazing ways,&apos; the CEO of a local crypto exchange told news.Bitcoin.com. Several other exchanges competing in the same space are seeing similar responses from their ...The post Indian Cryptocurrency Exchanges See Rapid Growth in P2P Trading appeared first on Bitcoin News.",POSITIVE,없음,BTC | EXCHANGE | FIAT | TRADING,,0,0,Bitcoin.com,https://news.bitcoin.com/indian-cryptocurrency-exchanges-p2p-trading/,https://images.cryptocompare.com/news/bitcoin.com/ca01g201i00.png
13452377,https://bitcoinist.com/?p=90345,1540076436,Bitcoin Con Artist Docked for $2.5 Million By U.S. Federal Court,"A U.S. Federal Court recently indicted Gelfman Blueprint Inc. (GBI) and its CEO Nicholas Gelfman to the tune of $2.5 million for running a Bitcoin Ponzi scheme. The matter is the first ever anti-fraud proceedings concerning Bitcoin taken up by the Commodity Futures Trading Commission (CFTC). Court Levies $2.5 Million Against GBI and Gelfman According to a CFTC press release published on Thursday (October 18, 2018), the defendants - GBI and Gelfman, will pay aboutRead MoreThe post Bitcoin Con Artist Docked for $2.5 Million By U.S. Federal Court appeared first on Bitcoinist.com.",NEGATIVE,없음,BTC | COMMODITY | SPONSORED | TRADING,,0,0,Bitcoinist,https://bitcoinist.com/bitcoin-con-artist-docked-for-2-5-million-by-u-s-federal-court/,https://images.cryptocompare.com/news/bitcoinist/f1yz3AM40a6.jpeg
13235623,https://www.newsbtc.com/?p=354368,1540072819,Japanese Consortium to Research Direct Trading of Electricity with Blockchain,"A Japanese consortium is to research the use of blockchain technology to determine the price of surplus electricity generated by photovoltaic power generation, and a new system capable of direct trading. Japan Unisys to Build Blockchain Platform to Facilitate Trading of Electricity A partnership between the University of Tokyo, IT company Japan Unisys, electric utility Kansai...The post Japanese Consortium to Research Direct Trading of Electricity with Blockchain appeared first on NewsBTC.",POSITIVE,없음,ASIA | BLOCKCHAIN | TECHNOLOGY | TRADING | RESEARCH,,0,0,NewsBTC,https://www.newsbtc.com/2018/10/20/japanese-consortium-to-research-direct-trading-of-electricity-with-blockchain/,https://images.cryptocompare.com/news/newsbtc/a000yig0104.jpeg
13363453,https://cointelegraph.com/news/bitfinex-the-rumors-of-insolvency-banking-partners-escape-and-the-suspension-of-fiat-deposits,1540072260,"Bitfinex: The Rumors of “Insolvency”, Banking Partners’ Escape, and the Suspension of Fiat Deposits","Bitfinex brought back fiat deposits, but users are still reporting delays in processing transactions. Do the rumors of the exchange&apos;s insolvency have something to do with its suspended banking partner relations and the sale of USDT?",NEGATIVE,USDT,BLOCKCHAIN | EXCHANGE | FIAT | USDT,,0,0,CoinTelegraph,https://cointelegraph.com/news/bitfinex-the-rumors-of-insolvency-banking-partners-escape-and-the-suspension-of-fiat-deposits,https://images.cryptocompare.com/news/cointelegraph/80cgy7i0R0E.jpeg
13437107,https://news.bitcoin.com/?p=233151,1540069526,"The Daily: Huobi Unveils HUSD, New Cryptocurrency Loans Launch","It&apos;s been a week for stablecoin stories in the crypto sphere, and while we&apos;d like to have started the weekend on a different tack, Huobi&apos;s effort was too intriguing not to share. We&apos;ll also detail the latest cryptocurrency lending options in Saturday&apos;s edition of The Daily and consider a topical Halloween costume for bitcoiners. Also ...The post The Daily: Huobi Unveils HUSD, New Cryptocurrency Loans Launch appeared first on Bitcoin News.",POSITIVE,없음,BTC | DOGE | EXCHANGE | XRP,,0,0,Bitcoin.com,https://news.bitcoin.com/the-daily-huobi-unveils-husd-new-cryptocurrency-loans-launch/,https://images.cryptocompare.com/news/bitcoin.com/dKw1EwcUB04.png
13246885,https://nulltx.com/?p=71127,1540069316,Huobi Global Will Support Stablecoin Trading Through its HUSD Offering,"It would appear there is still plenty of stablecoin action on the horizon in the cryptocurrency industry. More specifically, there has been an influx of such currencies over the past few months. Huobi Global is now planning to introduce its own stablecoin, although it is a bit different from what one would expect. The Huobi ...The post Huobi Global Will Support Stablecoin Trading Through its HUSD Offering appeared first on NullTX.",POSITIVE,없음,EXCHANGE | ICO | TRADING,,0,0,NullTx,https://nulltx.com/huobi-global-will-support-stablecoin-trading-through-its-husd-offering/,https://images.cryptocompare.com/news/themerkle/ag0cj0wcM00.jpeg
13246886,https://nulltx.com/?p=71155,1540065883,CryptoSlots Launches ‘Coin Rush’ – the Ultimate Cryptocurency Slot Game,"October 20, 2018: CryptoSlots.com, a cryptocurrency-only casino, is already making waves with its new original slot game. Coin Rush lets players spin through cryptocurrency symbols to make winning combinations across 20 active paylines. The Bitcoin logo is the highest paying symbol but Monero, Litecoin, and more, also adorn the reels for big wins. Backed by ...The post CryptoSlots Launches &apos;Coin Rush&apos; - the Ultimate Cryptocurency Slot Game appeared first on NullTX.",POSITIVE,없음,BTC | LTC | SPONSORED | XMR,,0,0,NullTx,https://nulltx.com/cryptoslots-launches-coin-rush-the-ultimate-cryptocurency-slot-game/,https://images.cryptocompare.com/news/themerkle/9silBqV9iiQ.jpeg
13235624,https://www.newsbtc.com/?p=354511,1540065633,Is Demand For Bitcoin Mining in Decline? Chip Maker Slashes Target,"Taiwan Semiconductor Manufacturing Co. (TSMC), the world&apos;s largest dedicated independent chipmaker, has predicted a drop in demand from the cryptocurrency mining community in the fourth quarter this year. The growth target of 7 to 9 percent was slashed to 6.5 percent partly due to the demand dynamics of bitcoin miners. Crypto Mining Demand For TSMC...The post Is Demand For Bitcoin Mining in Decline? Chip Maker Slashes Target appeared first on NewsBTC.",NEGATIVE,BTC,ASIA | BTC | MINING,,0,0,NewsBTC,https://www.newsbtc.com/2018/10/20/is-demand-for-bitcoin-mining-in-decline-chip-maker-slashes-target/,https://images.cryptocompare.com/news/newsbtc/9BC6P7ASzMB.jpeg
13235625,https://www.newsbtc.com/?p=354513,1540065621,Major Online Rental Platform Allows Users to be Paid in Ripple,"Omni, the online item rental and storage management startup, is now allowing its users to get paid in Ripple, capitalizing off of the cryptocurrency boom. The addition of the XRP payment method comes after the startup raised $25 million in XRP this past January. The company will be paying users out of their own stash...The post Major Online Rental Platform Allows Users to be Paid in Ripple appeared first on NewsBTC.",POSITIVE,XRP,ICO | XRP,,0,0,NewsBTC,https://www.newsbtc.com/2018/10/20/major-online-rental-platform-allows-users-to-be-paid-in-ripple/,https://images.cryptocompare.com/news/newsbtc/c1aJ03mFa0m.jpeg
13452378,https://bitcoinist.com/?p=90323,1540065603,"Brave: 10,000 Content Creators Can Now Be Tipped In-Browser on Reddit and Twitter","Privacy focussed web browser Brave is introducing a new feature to allow the tipping of individual Reddit and Twitter users. The functionality will be available from directly within the browser window and enable micro-payments using its native BAT token. Brave New World Brave browser has been making waves online with innovative features to enhance online privacy and security. It doesn&apos;t store browsing data, blocks malware and phishing by default, and prevents identification and site-to-site tracking. OneRead MoreThe post Brave: 10,000 Content Creators Can Now Be Tipped In-Browser on Reddit and Twitter appeared first on Bitcoinist.com.",POSITIVE,BAT,ALTCOIN | BAT | ICO,,0,0,Bitcoinist,https://bitcoinist.com/brave-basic-attention-token-bat-reddit-twitter/,https://images.cryptocompare.com/news/bitcoinist/8lM2BjaMy6Y.jpeg
13437108,https://news.bitcoin.com/?p=227932,1540062323,Bitcoin Intentions: Are We Aiming to Replace the Status Quo or Become Them?,"When the idea of a working digital currency like bitcoin was introduced, many of its early adopters disliked the current bureaucratic system, with a cartel of bankers pulling the world&apos;s monetary strings. Over time, however, something weird has happened and the idea of permissionless innovation perverted into people literally asking nation states for permission, begging ...The post Bitcoin Intentions: Are We Aiming to Replace the Status Quo or Become Them? appeared first on Bitcoin News.",NEUTRAL,없음,BCH | BTC | FIAT,,0,0,Bitcoin.com,https://news.bitcoin.com/bitcoin-intentions-are-we-aiming-to-replace-the-status-quo-or-become-them/,https://images.cryptocompare.com/news/bitcoin.com/bo0O02h0804.jpeg
13246887,https://nulltx.com/?p=71148,1540059813,IOTA Price Blazes Past $0.5 All of a Sudden,"Most of the top altcoins are not doing all that great as of right now. Things may improve moving forward, as the IOTA price is slowly carving out some gains over the past few hours. There is still a long way to go to speak of an official uptrend, albeit these early signs appear to ...The post IOTA Price Blazes Past $0.5 All of a Sudden appeared first on NullTX.",POSITIVE,IOTA,ALTCOIN | TRADING | IOTA,,0,0,NullTx,https://nulltx.com/iota-price-blazes-past-0-5-all-of-a-sudden/,https://images.cryptocompare.com/news/themerkle/85KeK1Fpil2.jpeg
13235626,https://www.newsbtc.com/?p=354365,1540058428,Japan’s Tax Committee Looks to Simplify Cryptocurrency Gains Reporting,"Japan&apos;s Tax Investigation Committee, an advisory body of the government, is looking to simplify its tax filling system as confusion has led to poor reporting of profits with digital currencies in the country. Japan Lawmakers Discuss Ways to Simplify Tax Returns of Cryptocurrency Gains At a meeting held on Wednesday, members of the taxation committee...The post Japan&apos;s Tax Committee Looks to Simplify Cryptocurrency Gains Reporting appeared first on NewsBTC.",POSITIVE,BTC,ASIA | BTC | REGULATION,,0,0,NewsBTC,https://www.newsbtc.com/2018/10/20/japans-tax-committee-looks-to-simplify-cryptocurrency-gains-reporting/,https://images.cryptocompare.com/news/newsbtc/d313808cw08.jpeg
13246888,https://nulltx.com/?p=71142,1540056566,Bytom Price Surpasses $0.2 as Bulls Remain in Control,"Altcoins are slowly hitting their stride again after a tremendously bearish 2018. Most markets lost anywhere from 50% to 90% in value. Recovering those losses is difficult, but some coins appear to be better off than others. In the case of Bytom, it would appear the current price trend may remain in place for a ...The post Bytom Price Surpasses $0.2 as Bulls Remain in Control appeared first on NullTX.",POSITIVE,없음,ALTCOIN | MARKET | TRADING,,0,0,NullTx,https://nulltx.com/bytom-price-surpasses-0-2-as-bulls-remain-in-control/,https://images.cryptocompare.com/news/themerkle/dagQy40902g.jpeg
13437109,https://news.bitcoin.com/?p=233182,1540055107,Weak Demand for Mining Hardware Impacts TSMC’s Growth Outlook,"During a recent Q3 earnings call, the world&apos;s largest producer of semiconductors, Taiwan Semiconductor Manufacturing Company (TSMC), forecasted weakening growth for the rest of 2018 due to declining demand for cryptocurrency mining hardware. This outlook comes despite anticipating a significant increase in demand for its 7-nanometer processing chips from the high-end smartphone industry. Also Read: ...The post Weak Demand for Mining Hardware Impacts TSMC&apos;s Growth Outlook appeared first on Bitcoin News.",NEGATIVE,없음,ASIA | BTC | MINING,,0,0,Bitcoin.com,https://news.bitcoin.com/weak-demand-mining-tsmc-growth/,https://images.cryptocompare.com/news/bitcoin.com/dagBEM48200.jpeg
13411223,https://cryptopotato.com/?p=22636,1540054817,"OKEX Tim Byun Talks about ETFs, Regulations, The $460M liquidation, Star Xu Rumors and More","OKEX is a world leading digital asset exchange based in Malta. The company provides hundreds of token trading pairs as well as derivatives, serves millions of users in over 100 countries, and handles nearly $1.5B of daily trading volume. We had to chance to interview Tim Byun, OKEX&apos;s Chief Risk Officer. We discussed what got ...The post OKEX Tim Byun Talks about ETFs, Regulations, The $460M liquidation, Star Xu Rumors and More appeared first on CryptoPotato.",NEUTRAL,없음,EXCHANGE | ICO | TRADING,,0,0,Crypto Potato,https://cryptopotato.com/okex-tim-byun-talks-about-etfs-regulations-the-460m-liquidation-star-xu-rumors-and-more/,https://images.cryptocompare.com/news/cryptopotato/b80020w0000.png
13452379,https://bitcoinist.com/?p=90231,1540054815,"3 Cryptocurrencies Well-Positioned to Beat BTC Price in Q4 (AMB, BCH, ADA)","This week&apos;s cryptocurrencies market analysis will concentrate on technological advancements in the blockchain space in quarter 4. The analysis will focus on major technological upgrades occurring in quarter four along with Ambrosus (AMB) being a top contender to produce returns well in excess of 100% in the immediate short term. 3 Cryptocurrencies We Predicted Would Rally Last Week&apos;s Piece, which highlighted the cryptocurrency GOChain , resulted in GO increasing more than 50% in value in theRead MoreThe post 3 Cryptocurrencies Well-Positioned to Beat BTC Price in Q4 (AMB, BCH, ADA) appeared first on Bitcoinist.com.",POSITIVE,ADA | BCH | BTC,ADA | BCH | BLOCKCHAIN | BTC | TRADING,,0,0,Bitcoinist,https://bitcoinist.com/cryptocurrencies-btc-price-amb-bch-ada/,https://images.cryptocompare.com/news/bitcoinist/8jekExEM0P0.jpeg
13370567,https://blokt.com/?p=24711,1540054783,"No, Tron’s Partnership With Baidu Isn’t Worth the Hype Justin Sun Created on Social Media","Tron CEO Justin Sun has done it again! Turns out the new partnership with &apos;an industry giant valued at tens of billions of dollars&apos; he was hyping so much about on social media actually only gives Tron access to Baidu Inc.&apos;s cloud computing resources. It is NOT a contract that binds the two companies at ...No, Tron&apos;s Partnership With Baidu Isn&apos;t Worth the Hype Justin Sun Created on Social Media was originally found on [blokt] - Blockchain, Bitcoin &amp; Cryptocurrency News.",NEGATIVE,없음,BLOCKCHAIN | BTC,,0,0,Blokt,https://blokt.com/news/no-trons-partnership-with-baidu-isnt-worth-the-hype-justin-sun-created-on-social-media,https://images.cryptocompare.com/news/blokt/cO0ock0g000.jpeg
13246889,https://nulltx.com/?p=71136,1540052338,ZCash Price Heads to $125 as Coinbase Listing Rumors Persist,"Today is a very unusual day in the world of cryptocurrencies. Especially in the altcoin department, things are looking a lot more positive than they have in a while. Although most of the gains are not notable, the optimism is certainly present. ZCash is the biggest gainer of the day in the top 20, as ...The post ZCash Price Heads to $125 as Coinbase Listing Rumors Persist appeared first on NullTX.",POSITIVE,없음,ALTCOIN | EXCHANGE | TRADING | ZEC,,0,0,NullTx,https://nulltx.com/zcash-price-heads-to-125-as-coinbase-listing-rumors-persist/,https://images.cryptocompare.com/news/themerkle/9i4ez9Jyig4.jpeg
13411224,https://cryptopotato.com/?p=22810,1540047868,Why Civil’s response to its failed ICO sets an excellent example for blockchain projects,"Civil, a project focused on revolutionizing journalism through blockchain technology, recently shared some thoughts on their failure to reach their $8m soft cap ICO target. The project had received lots of media attention and was already partnered with Forbes to help the magazine publish cryptocurrency related articles on the blockchain as a test pilot. What ...The post Why Civil&apos;s response to its failed ICO sets an excellent example for blockchain projects appeared first on CryptoPotato.",POSITIVE,ICO,BLOCKCHAIN | ICO | TECHNOLOGY | TOKEN SALE,,0,0,Crypto Potato,https://cryptopotato.com/why-civils-response-to-its-failed-ico-sets-an-excellent-example-for-blockchain-projects/,https://images.cryptocompare.com/news/cryptopotato/b0Ii4304100.jpeg
13437110,https://news.bitcoin.com/?p=233092,1540047629,Wendy McElroy: Crypto Anarchism and Civil Society – The Technology is the Revolution,"The Satoshi Revolution: A Revolution of Rising Expectations Section 5: Saving the World Through Anarchism Chapter 11, Part 3 Crypto Anarchism and Civil Society. The Technology is the Revolution. by Wendy McElroy Not only is democracy mystical nonsense, it is also immoral. If one man has no right to impose his wishes on another, then ...The post Wendy McElroy: Crypto Anarchism and Civil Society - The Technology is the Revolution appeared first on Bitcoin News.",NEUTRAL,없음,BTC | REGULATION | TECHNOLOGY,,0,0,Bitcoin.com,https://news.bitcoin.com/wendy-mcelroy-crypto-anarchism-and-civil-society-the-technology-is-the-revolution/,https://images.cryptocompare.com/news/bitcoin.com/d9JapbCrUoU.jpeg
13474242,https://www.trustnodes.com/?p=18482,1540046562,One Thousand Applications Made for Devcon Speaking Slots,"&apos;We received ~1,000 applications - that&apos;s almost more than the first three devcons had in attendees,&apos; says an ethereum Devcon4 staff member. Many had to be rejected due to space...The post One Thousand Applications Made for Devcon Speaking Slots appeared first on Trustnodes.",POSITIVE,없음,ETH,,0,0,TrustNodes,https://www.trustnodes.com/2018/10/20/one-thousand-applications-made-for-devcon-speaking-slots,https://images.cryptocompare.com/news/trustnodes/fN24Q00w020.png
13363454,https://cointelegraph.com/news/ethereum-devs-reach-consensus-to-delay-constantinople-hard-fork-until-january-2019,1540042980,Ethereum Devs Reach Consensus to Delay Constantinople Hard Fork Until January 2019,"Ethereum core devs have officially decided to delay a planned hard fork, dubbed &apos;Constantinople,&apos; until January 2019 &apos;at the earliest&apos;",NEUTRAL,없음,ALTCOIN | ETH | FORKS,,0,0,CoinTelegraph,https://cointelegraph.com/news/ethereum-devs-reach-consensus-to-delay-constantinople-hard-fork-until-january-2019,https://images.cryptocompare.com/news/cointelegraph/ed3wgqg8201.jpeg
13370568,https://blokt.com/?p=24703,1540042162,Alleged Bitcoin Ponzi Firm and CEO Ordered to Pay $2.5 Million in Penalties by Federal Court,"In a press release by the US Commodities Futures and Trading Commission (CFTC) on Oct. 18, the agency confirmed that Gelfman Blueprint Inc. (GBI) and its CEO, Nicholas Gelfman, had been ordered to pay more than $2.5 million in civil monetary penalties and restitution by a New York federal court. This judgment came in relation ...Alleged Bitcoin Ponzi Firm and CEO Ordered to Pay $2.5 Million in Penalties by Federal Court was originally found on [blokt] - Blockchain, Bitcoin &amp; Cryptocurrency News.",NEGATIVE,없음,BLOCKCHAIN | BTC | COMMODITY | SPONSORED | TRADING,,0,0,Blokt,https://blokt.com/news/alleged-bitcoin-ponzi-firm-and-ceo-ordered-to-pay-2-5-million-in-penalties-by-federal-court,https://images.cryptocompare.com/news/blokt/82ccUsc8gM0.jpeg
13452380,https://bitcoinist.com/?p=90274,1540040425,Crypto-Mergers and Acquisitions Increased by 200% in 2018,"Institutional investors, venture capitalists, and other well-heeled entities &apos;in the know&apos; are using a year-long bear market to buy up future technologies for what might turn out to be pennies on the dollar. It Takes Money to Make Money Yesterday CNBC reported that most of 2018 has been a &apos;deal frenzy&apos; for cryptocurrency and blockchain-related companies as mergers and acquisitions (M&amp;A) are reported to have increased by 200 percent. Pitchbook had JMP Securities crunch M&amp;A dataRead MoreThe post Crypto-Mergers and Acquisitions Increased by 200% in 2018 appeared first on Bitcoinist.com.",POSITIVE,없음,BLOCKCHAIN | BUSINESS | MARKET | TRADING,,0,0,Bitcoinist,https://bitcoinist.com/crypto-mergers-and-acquisitions-increased-by-200-in-2018/,https://images.cryptocompare.com/news/bitcoinist/c34c8000000.jpeg
13474243,https://www.trustnodes.com/?p=18476,1540040146,"Metropolis Pushed Off to January, Courts Criticism","Ethereum will see no upgrade this year with the issuance reduction pushed off to January or maybe February. &apos;The earliest we gone have it is January,&apos; Hudson Jameson said on...The post Metropolis Pushed Off to January, Courts Criticism appeared first on Trustnodes.",NEGATIVE,없음,ETH,,0,0,TrustNodes,https://www.trustnodes.com/2018/10/20/metropolis-pushed-off-to-january-courts-criticism,https://images.cryptocompare.com/news/trustnodes/dwx4wAg44x2.png
13370569,https://blokt.com/?p=24697,1540038558,Cindicator Researches Correlation Between Bitcoin Futures and BTC Price Movements,"Cindicator, a US-based fintech company that develops hybrid intelligence (human + artificial intelligence) for effective asset management, released on Oct. 18 a report called &apos;Bitcoin Futures: Market Evolution.&apos; The Study&apos;s Objectives The study investigates whether there is a correlation between the price movements of Bitcoin and Bitcoin futures after their launch on CBOE and CME ...Cindicator Researches Correlation Between Bitcoin Futures and BTC Price Movements was originally found on [blokt] - Blockchain, Bitcoin &amp; Cryptocurrency News.",NEUTRAL,BTC,BLOCKCHAIN | BTC | MARKET | TRADING,,0,0,Blokt,https://blokt.com/news/cindicator-researches-correlation-between-bitcoin-futures-and-btc-price-movements,https://images.cryptocompare.com/news/blokt/8lwf85EAQg9.jpeg
13235627,https://www.newsbtc.com/?p=354593,1540037956,"Mike Novogratz Clarifies Anti-Tether Comments, Wants FUD Stopped","The dismissal market performance of so-called stablecoin Tether should not be the reason to spread FUD against it, clarified Mike Novogratz in his tweet. The billionaire Bitcoin bull, who recently criticized USDT for misbalancing its dollar-peg, later said that he believes Tether has every dollar for every USDT. However, he retained his criticism over Tether...The post Mike Novogratz Clarifies Anti-Tether Comments, Wants FUD Stopped appeared first on NewsBTC.",NEUTRAL,BTC | USDT,ALTCOIN | BTC | MARKET | TRADING | USDT,,0,0,NewsBTC,https://www.newsbtc.com/2018/10/20/mike-novogratz-clarifies-anti-tether-comments-wants-fud-stopped/,https://images.cryptocompare.com/news/newsbtc/cc453Io1AV3.jpeg
13246890,https://nulltx.com/?p=71131,1540035869,Cardano Price Notes a Small Gain Following Favorable Icarus Audit,"The cryptocurrency markets have seen some interesting momentum today, even though no major price changes have occurred as of yet. Cardano is trying to note some solid gains right now, albeit reaching $0.08 seems to be a stretch too far. Even so, the positive momentum among altcoins can make for a rather interesting weekend. Cardano ...The post Cardano Price Notes a Small Gain Following Favorable Icarus Audit appeared first on NullTX.",POSITIVE,없음,ADA | ALTCOIN | MARKET | TRADING,,0,0,NullTx,https://nulltx.com/cardano-price-notes-a-small-gain-following-favorable-icarus-audit/,https://images.cryptocompare.com/news/themerkle/c0RfYug9sAI.jpeg
13363455,https://cointelegraph.com/news/ernst-young-report-one-year-on-icos-fate-is-worse-than-we-thought,1540035660,"Ernst & Young Report: One Year on, ICOs' Fate Is 'Worse Than We Thought'","An EY report into &apos;The Class of 2017&apos; ICOs found that 86% of tokens are trading below their listing price, 71% have no working product",NEGATIVE,없음,TRADING,,0,0,CoinTelegraph,https://cointelegraph.com/news/ernst-young-report-one-year-on-icos-fate-is-worse-than-we-thought,https://images.cryptocompare.com/news/cointelegraph/doFmgcO430o.jpeg
