뉴스ID,뉴스GUID,일자(UTC timestamp),뉴스제목,본문,SENTIMENT,주요코인,카테고리,작성자,추천수,비추천수,출처,뉴스URL,이미지URL
13849555,https://cryptopotato.com/?p=255284,1686872931,South Korean Crypto Lender Suspends Withdrawals,"Delio is suspending withdrawals on its platform following its exposure to Haru Invest, which previously halted its services.",NEGATIVE,없음,OTHER,,0,0,Crypto Potato,https://cryptopotato.com/south-korean-crypto-lender-suspends-withdrawals/,https://resources.cryptocompare.com/news/27/13849555.jpeg
13849290,https://cointelegraph.com/magazine/hong-kong-crypto-exchanges-do-kwon-jail-korean-crypto-lenders-contagion-asia-express/,1686871993,"Korean crypto contagion, Bank of China on Ethereum, HK’s exchange red carpet: Asia Express","Hong Kong lays out welcome mat for exchanges, Korean crypto lender contagion, Do Kwon banged up abroad, Bank of China’s Ethereum debt note.",NEUTRAL,없음,ASIA | ETH | EXCHANGE | FIAT,,0,0,CoinTelegraph,https://cointelegraph.com/magazine/hong-kong-crypto-exchanges-do-kwon-jail-korean-crypto-lenders-contagion-asia-express/,https://resources.cryptocompare.com/news/16/13849290.jpeg
13849053,https://ambcrypto.com/?p=320754,1686871857,MATIC’s recovery elusive amidst regulatory uncertainty,"A negative sentiment still grips MATIC, which could dim the prospects of a strong recovery on the price charts.",NEGATIVE,MATIC,ALTCOIN | MARKET | MATIC | TRADING,,0,0,AMB Crypto,https://ambcrypto.com/matics-recovery-elusive-amidst-regulatory-uncertainty/,https://images.cryptocompare.com/news/default/ambcrypto.png
13849155,https://news.bitcoin.com/?p=593536,1686871829,Token Sale Ahead: Celsius to Convert Customer ‘Altcoins’ to BTC and ETH,"Amid the regulatory crackdown in the United States, the bankrupt crypto lender Celsius has announced that all of its customers’ “altcoins” will be converted to bitcoin (BTC) and ethereum (ETH). Over $215 million worth of coins such as CEL, ADA, LINK, LTC, and others will be sold beginning on July 1, 2023. Celsius Plans to",NEUTRAL,ADA | BTC | ETH,ADA | ALTCOIN | BTC | ETH | TOKEN SALE,,0,0,Bitcoin.com,https://news.bitcoin.com/token-sale-ahead-celsius-to-convert-customer-altcoins-to-btc-and-eth/,https://resources.cryptocompare.com/news/14/13849155.jpeg
13848511,https://cointelegraph.com/news/blackrock-apply-spot-bitcoin-etf-sec-nasdaq,1686870228,BlackRock applies for spot Bitcoin ETF — a US first if approved,"The investment firm joins a long line of applicants; ARK is among those still waiting to hear from the SEC, and Grayscale has appealed its rejection.",NEUTRAL,없음,BTC | REGULATION | TRADING,,0,0,CoinTelegraph,https://cointelegraph.com/news/blackrock-apply-spot-bitcoin-etf-sec-nasdaq,https://resources.cryptocompare.com/news/16/13848511.jpeg
13848475,https://decrypt.co/?p=144856,1686870125,Alchemy's ChatGPT Plugin Enables Easier Blockchain Analysis Via AI,"Alchemy’s new GPT-4 plugin harnesses the power of AI to deliver user-friendly, real-time blockchain analysis.",POSITIVE,없음,BLOCKCHAIN | MARKET,,0,0,Decrypt,https://decrypt.co/144856/alchemy-chatgpt-ai-plugin-enables-easier-blockchain-analysis,https://resources.cryptocompare.com/news/44/13848475.jpeg
13848633,https://decrypt.co/videos/interviews/HXlThlXv/ai-is-game-changing-but-needs-fact-checking-alchemyai-project-lead,1686870000,"""AI Is Game-Changing But Needs Fact-Checking"": AlchemyAI Project Lead","In this interview, Decrypt's Jason Nelson chats with Alchemy product manager and AlchemyAI project lead Elan Halpern on blockchain analysis using ChatGPT, what AI means for better user experience, and the need to fact-check AI. Halpern also gives a demo of the new AlchemyAI ChatGPT plugin.",NEUTRAL,없음,BLOCKCHAIN | MARKET,,0,0,Decrypt,https://decrypt.co/videos/interviews/HXlThlXv/ai-is-game-changing-but-needs-fact-checking-alchemyai-project-lead,https://images.cryptocompare.com/news/default/decrypt.png
13848008,https://www.cryptopolitan.com/?p=319052,1686869438,OKX expands into the Middle East with licensing approval,"Cryptocurrency exchange OKX has obtained a minimal viable product preparation license from the Middle Eastern division, enabling its expansion into the Middle East. The license allows OKX to establish an office in Dubai’s World Trade Center and increase its local workforce to 30 employees. The crypto exchange emphasizes the importance of regulatory compliance and security ... Read more",POSITIVE,없음,EXCHANGE,,0,0,Cryptopolitan,https://www.cryptopolitan.com/okx-expands-into-middle-east-dubai-license/,https://images.cryptocompare.com/news/default/cryptopolitan.png
13848082,https://decrypt.co/?p=144820,1686869428,"Banned In New York, CoinEx Returns $1.7 Million to Settle Lawsuit",New York Attorney General Letitia James announced a $1.7 million settlement with Hong Kong-based CoinEx over securities violations.,NEGATIVE,없음,ASIA | BUSINESS,,0,0,Decrypt,https://decrypt.co/144820/banned-in-new-york-coinex-returns-1-7-million-to-settle-lawsuit,https://resources.cryptocompare.com/news/44/13848082.jpeg
13847597,https://www.cryptopolitan.com/?p=319042,1686868417,Internal tensions at the SEC exposed in Hinman documents,"Hinman documents recently made public have exposed internal tensions within the U.S. Securities and Exchange Commission (SEC), raising concerns about the agency’s intentions in the continuing legal battle with Ripple. The documents revealed the SEC’s position on crypto, which impacted investor safety. Stuart Alderoty, the chief legal officer of Ripple, claims that the SEC purposefully ... Read more",NEGATIVE,없음,BUSINESS | EXCHANGE | REGULATION,,0,0,Cryptopolitan,https://www.cryptopolitan.com/hinman-docs-expose-internal-sec-tensions/,https://images.cryptocompare.com/news/default/cryptopolitan.png
13847474,https://ambcrypto.com/?p=320757,1686868200,Aptos’ latest milestone could leave investors craving for more because…,"Aptos’ daily user transactions and active users have gained upward momentum since May began. However, APT’s price action was bearish.",NEGATIVE,APT,ALTCOIN | BUSINESS | TRADING | APT,,0,0,AMB Crypto,https://ambcrypto.com/aptos-latest-milestone-could-leave-investors-craving-for-more-because/,https://images.cryptocompare.com/news/default/ambcrypto.png
13847303,https://decrypt.co/?p=144833,1686867712,Prometheum: What You Need to Know About the SEC’s Poster Child for Crypto Compliance,Prometheum's co-CEO gave remarks on Capitol Hill that mirrored the SEC's stance. Now industry observers are poring over the startup’s paper trail.,NEUTRAL,없음,REGULATION,,0,0,Decrypt,https://decrypt.co/144833/prometheum-sec-poster-child-crypto-compliance,https://resources.cryptocompare.com/news/44/13847303.jpeg
42420232,ha93388BwWkPe8xtcUaCQX,1686867289,Do Kwon to Remain in Custody While Montenegro Courts Consider Extradition Request,"Terraform Labs co-founder Do Kwon is to remain in Montenegro custody for six months while the country's courts consider an extradition request from South Korea, local news outlet RFE reported on Thursday.  The report, which the Podgorica High Court later confirmed to CoinDesk, followed an announcement from the same court on the approval of bail for a case involving document forgery. Kwon's bail request was approved after a previous rejection by the same court.  In March, the South Korean national was arrested in Montenegro over the alleged possession of falsified documents along with fellow Terra executive Han Chang-Joon. South Korean officials were already searching for Kwon, and following his arrest, the country requested Kwon's extradition, as did the U.S. Kwon also faces possible jail time in Montenegro over the document forgery case.  Kwon and Han are due to appear in a Montenegro court on Friday.  Read more: Do Kwon's $428K Bail Request in Fake Passport Case Approved by Montenegro Court  UPDATE (June 19, 07:17 UTC): Adds confirmation from Podgorica high court.",NEGATIVE,없음,ASIA | LUNA,Sandali Handagama,0,0,CoinDesk,https://coindesk.com/policy/2023/06/15/do-kwon-to-remain-in-custody-while-montenegro-courts-consider-extradition-request-report,https://cdn.sanity.io/images/s3y3vcno/production/3e24ee63f08b34fde8e95a43f158405d68f6d785-1440x1080.jpg?w=300&h=300&fit=crop
13847106,https://cryptonews.com/news/blockchain-analytics-firm-chainalysis-urges-crypto-firms-start-mica-preparations-now.htm,1686867180,Blockchain Analytics Firm Chainalysis Urges Crypto Firms to Start MiCA Preparations Now,"The past week saw the forthcoming Markets in Crypto Assets (MiCA) regulation formally published in the EU's official journal, marking a significant milestone for regulation in the crypto space. Consequently, Chainalysis’ head of policy for Europe has urged cryptocurrency companies to start preparing for it as soon as possible.... Read More: Blockchain Analytics Firm Chainalysis Urges Crypto Firms to Start MiCA Preparations Now",NEUTRAL,없음,BLOCKCHAIN | MARKET | REGULATION,,0,0,cryptonews,https://cryptonews.com/news/blockchain-analytics-firm-chainalysis-urges-crypto-firms-start-mica-preparations-now.htm,https://resources.cryptocompare.com/news/52/13847106.jpeg
13846737,https://dailyhodl.com/?p=249459,1686866491,"Dogecoin Whales Move Over $335,000,000 in DOGE in the Last 24 Hours","Deep-pocketed Dogecoin (DOGE) investors have abruptly moved hundreds of millions of dollars worth of the meme asset during the last 24 hours. According to new data from whale-tracking platform Whale Alert, high-net-worth DOGE traders have moved about $335,000,000 million worth of the dog-themed memecoin during the last day. Of the seven notable transactions on Whale The post Dogecoin Whales Move Over $335,000,000 in DOGE in the Last 24 Hours appeared first on The Daily Hodl .",NEUTRAL,DOGE,ALTCOIN | BUSINESS | DOGE | TRADING,,0,0,The Daily Hodl,https://dailyhodl.com/2023/06/15/dogecoin-whales-move-over-335000000-in-doge-in-the-last-24-hours/,https://images.cryptocompare.com/news/default/dailyhodl.png
13846696,https://ambcrypto.com/?p=320837,1686866447,Tether under attack as whales dump USDT; CTO stands firm,"Tether witnessed a slight depegging from its 1:1 ratio with USD amid whales dumping the stablecoin. However, Tether's CTO stood strong in the face of the selling pressure.",NEGATIVE,USDT,ALTCOIN | USDT,,0,0,AMB Crypto,https://ambcrypto.com/tether-under-attack-as-whales-dump-usdt-cto-stands-firm/,https://images.cryptocompare.com/news/default/ambcrypto.png
13846531,https://cryptopotato.com/?p=255366,1686866138,Voyager to Enable Customer Withdrawals This Month,Customers of the broker could start receiving their funds as soon as June 20.,POSITIVE,없음,EXCHANGE | BNB,,0,0,Crypto Potato,https://cryptopotato.com/voyager-to-enable-customer-withdrawals-this-month/,https://resources.cryptocompare.com/news/27/13846531.jpeg
13846283,https://cryptonews.com/news/best-crypto-buy-now-15-june-trust-wallet-uniswap-casper.htm,1686865560,"Best Crypto to Buy Now 15 June – Trust Wallet, Uniswap, Casper","A slight deviation in Tether's (USDT) stablecoin earlier today has caught the attention of cryptocurrency traders. The move occurred within Curve's 3Pool decentralized finance ecosystem, which holds significant liquidity and three primary stablecoins: USDT, USDC, and DAI. In light of this development, what are the best cryptos to buy now?... Read More: Best Crypto to Buy Now 15 June – Trust Wallet, Uniswap, Casper",NEUTRAL,USDT | DAI,BTC | UNI | USDT | DAI | TWT,,0,0,cryptonews,https://cryptonews.com/news/best-crypto-buy-now-15-june-trust-wallet-uniswap-casper.htm,https://resources.cryptocompare.com/news/52/13846283.jpeg
42420237,ha93388BwWkPe8xtcUaCUf,1686865526,Bitcoin Jumps Past $25.7K After BlackRock iShares ETF Filing,"Bitcoin jumped past $25.700, a more than 1.3% gain, in the hour after the iShares unit of fund management powerhouse BlackRock (BLK) filed paperwork Thursday afternoon with the U.S. Securities and Exchange Commission (SEC) for the formation of a spot bitcoin (BTC) ETF.  Bitcoin dipped below $25,000 just a day earlier for the first time in three months and spent most of Thursday prior to the BlackRock announcement hovering just over that threshold. BTC's price sank amid concerns about U.S. central bank hawkishness and increasing U.S. regulatory scrutiny of the crypto industry.  But the BlackRock announcement rekindled optimism about the possibility of a spot bitcoin ETF, even after the SEC has rejected multiple applications over the past 18 months.  To be named the iShares Bitcoin Trust, the fund's assets are to ""consist primarily of bitcoin held by a custodian on behalf of the Trust,"" according to the filing. That custodian will by crypto exchange Coinbase (COIN), said the filing.  CoinDesk earlier on Thursday reported on BlackRock's intention to soon file for a bitcoin ETF.",POSITIVE,BTC,BTC | EXCHANGE | FIAT | REGULATION | TRADING,James Rubin,0,0,CoinDesk,https://coindesk.com/markets/2023/06/15/bitcoin-jumps-past-257k-after-blackrock-ishares-etf-filing,https://cdn.sanity.io/images/s3y3vcno/production/9ed08c85174e8853cb21d9e085566b1436ee094f-1722x974.png?w=300&h=300&fit=crop
13846314,https://cointelegraph.com/news/fed-sec-investigate-goldman-sachs-silicon-valley-bank-securities-portfolio-report,1686865432,"Fed, SEC investigate Goldman Sachs over Silicon Valley Bank’s securities portfolio: Report",Both regulatory bodies are inquiring into the activities of Goldman Sachs during its unsuccessful capital raise preceding the downfall of Silicon Valley Bank.,NEGATIVE,없음,FIAT | ICO | REGULATION,,0,0,CoinTelegraph,https://cointelegraph.com/news/fed-sec-investigate-goldman-sachs-silicon-valley-bank-securities-portfolio-report,https://resources.cryptocompare.com/news/16/13846314.jpeg
13846163,https://cointelegraph.com/news/sotheby-auctions-the-goose-nft-3ac-collection,1686865243,Sotheby’s auctions off Dmitri Cherniak’s ‘The Goose’ NFT from 3AC collection for $6.2M,Su Zhu and Kyle Davies originally purchased ‘The Goose’ digital artwork in August 2021 for roughly $5.8 million in Ether.,POSITIVE,없음,BUSINESS,,0,0,CoinTelegraph,https://cointelegraph.com/news/sotheby-auctions-the-goose-nft-3ac-collection,https://resources.cryptocompare.com/news/16/13846163.jpeg
13846118,https://ambcrypto.com/?p=320844,1686865190,Blackrock set to enter Bitcoin ETF field with SEC registration,Asset management firm Blackrock filed a Bitcoin ETF registration statement with the U.S. SEC. This led to a slight impact in the price of BTC as the king of cryptocurrencies saw some slight recovery.,POSITIVE,BTC,BTC | REGULATION | TRADING,,0,0,AMB Crypto,https://ambcrypto.com/blackrock-set-to-enter-bitcoin-etf-field-with-sec-registration/,https://images.cryptocompare.com/news/default/ambcrypto.png
13846029,https://decrypt.co/?p=144815,1686864713,Twitch's New Favorite Game 'Only Up' Is Loaded With Goblintown NFT Art,"More than 100,000 simultaneous viewers watched streamers play clumsy climbing game Only Up, which is packed with Goblintown references.",POSITIVE,없음,ETH,,0,0,Decrypt,https://decrypt.co/144815/twitch-new-game-only-up-goblintown-nft,https://resources.cryptocompare.com/news/44/13846029.jpeg
13845898,https://news.bitcoin.com/?p=593397,1686864658,"House Financial Services Republicans Blast SEC’s Proposed Rule, State Gensler Is Pushing ‘His Own Personal Views Regarding Digital Assets’","Republicans of the House Financial Services Committee have criticized U.S. Securities and Exchange Commission (SEC) Chair Gary Gensler, stating he is using Rule 3b-16 amendments to impose his views on cryptocurrency assets. In a letter sent to the SEC, republicans push back against the new proposed definition of “exchange” and its implications. Financial Services Committee",NEGATIVE,없음,EXCHANGE | REGULATION,,0,0,Bitcoin.com,https://news.bitcoin.com/house-financial-services-republicans-blast-secs-proposed-rule-state-gensler-is-pushing-his-own-personal-views-regarding-digital-assets/,https://resources.cryptocompare.com/news/14/13845898.jpeg
13845859,https://ambcrypto.com/?p=320614,1686864615,Where’s Bitcoin headed next as bulls fail to defend $25.2k,"Bitcoin has posted a series of lower highs and lower lows after breaching the $27.2k higher low on 24 April, breaking the formerly bullish market structure.",NEGATIVE,없음,BTC | MARKET | TRADING,,0,0,AMB Crypto,https://ambcrypto.com/wheres-bitcoin-headed-next-as-bulls-fail-to-defend-25-2k/,https://images.cryptocompare.com/news/default/ambcrypto.png
13838410,https://decrypt.co/?p=144782,1686864534,BlackRock Files Bitcoin ETF Application With the SEC,"BlackRock, with Coinbase as its partner, has submitted an application for a spot Bitcoin ETF following a Thursday morning report.",POSITIVE,없음,BTC | BUSINESS | EXCHANGE | REGULATION,,0,0,Decrypt,https://decrypt.co/144782/blackrock-filing-bitcoin-etf-application-soon-reports,https://resources.cryptocompare.com/news/44/13838410.jpeg
13845852,https://seekingalpha.com/news/3980358-blackrock-files-bitcoin-etf-coinbase-as-custodian?utm_source=cryptocompare.com&utm_medium=referral,1686864482,BlackRock files for bitcoin ETF; Coinbase as custodian,"BlackRock ( NYSE: BLK ) has filed paperwork with the SEC to establish a spot bitcoin ETF to be known as the iShares Bitcoin Trust. The filing names Coinbase ( NASDAQ: COIN ) as the custodian for the ETF's bitcoin holdings. ""The Shares have been designed to remove the obstacles represented by the complexities and operational burdens involved in a direct investment in bitcoin, while at the same time having an intrinsic value that reflects, at any given time, the investment exposure to the bitcoin owned by the Trust at such time, less the Trust's expenses and liabilities,"" the filing states . If approved, the ETF would be first on the market dedicated to bitcoin.",POSITIVE,없음,BTC | EXCHANGE | MARKET | REGULATION,,0,0,Seeking Alpha,https://seekingalpha.com/news/3980358-blackrock-files-bitcoin-etf-coinbase-as-custodian?utm_source=cryptocompare.com&utm_medium=referral,https://resources.cryptocompare.com/news/50/13845852.jpeg
42420240,ha93388BwWkPe8xtcUaCYn,1686864348,"Sotheby's Second 3AC NFT Sale Nets $10.9M, With 'The Goose' Alone Netting $6.2M","On Thursday, Sotheby's concluded another sale of non-fungible token (NFT) artwork seized from bankrupt crypto hedge fund Three Arrows Capital (3AC), bringing in over $10.9 million in sales.  The live auction took place in New York and included pieces from the ""Grails"" collection. In total, there were 37 works from generative artists like Dmitri Cherniak, Tyler Hobbs, Jeff Davis and more.  Highlights from this lot included Dmitri Cherniak's Ringers #879 (often referred to as ""The Goose"" for its resemblance to the bird), estimated to sell for $2-3 million. After back-and-forth bidding, it ended up selling for $6.2 million to notable NFT investor 6529. In a tweet following the sale, Sotheby's reported it was the second-highest sale of all time for a work of generative art.  3AC co-founders Su Zhu and Kyle Davies had purchased ""The Goose"" in August 2021 for about 1,800 ETH – worth roughly $5.8 million at the time. Michael Bouhanna, Sotheby's head of digital art and NFTs, told CoinDesk that the piece is a major highlight of Cherniak's portfolio and ""one of the most significant works from the generative art movement.""  In a statement, 6529 said that The Goose held cultural significance within the NFT community.  ""On-chain long form generative art is an act of faith by the artist and the minter. Once the algorithm is committed to the blockchain, nobody knows what outputs it will produce. The Goose represents this more clearly than any generative NFT. We could have run the Ringers mint thousands of times without producing anything like it again. The Goose has had a historic journey so far through key moments in NFT history and I suspect its journey has just begun.""  Other highlights included Tyler Hobbs' Fidenza #479, which sold for $622,300, Snowfro's Chromie Squiggle #1780, which sold for $635,000, Larva Labs' Autoglyph #218 and Kjetil Golid's Archetype #397, both of which sold for $330,200 each.Nearly all the NFTs in the auction sold for higher than their estimates.  Last month, Sotheby's began its multi-part sale of NFTs from Three Arrows' extensive NFT collection, formed as part of 3AC's asset portfolio primarily in 2021. The Singapore-based hedge fund filed for bankruptcy in July and its liquidator Teneo has outlined its intention to sell the expansive list of NFTs estimated to be worth millions in order to recoup funds.  In the first Grails auction, Sotheby's said it brought in nearly $2.5 million. Another group of works from the Grails collection was also recently sold privately for a combined total of over $3 million.  So far, the Grails collection liquidation sales have brought in nearly $17 million.  Sotheby's has said that the Grails collection contains ""some of the most significant digital artworks ever assembled.""  ""From groundbreaking works that have transformed the art world to culturally significant pieces, this collection is poised to redefine the way we think about and appreciate digital art,"" the website reads.  The upcoming Sotheby's sales are not related to Starry Night Capital's impressive NFT portfolio, which was set up by 3AC in partnership with well-known NFT collector Vincent Van Dough in August 2021.",POSITIVE,ETH,BLOCKCHAIN | BUSINESS | ETH,Rosie Perper,0,0,CoinDesk,https://coindesk.com/web3/2023/06/15/sothebys-second-3ac-nft-sale-nets-109m-with-the-goose-alone-netting-62m,https://cdn.sanity.io/images/s3y3vcno/production/647989da490d3fb00e69e9478e441b39927bd132-3264x1934.jpg?w=300&h=300&fit=crop
13845498,https://cryptonews.com/news/bitcoin-price-prediction-as-fed-chair-powell-says-may-couple-of-years-before-rates-can-cut-will-btc-crash-20000-soon.htm,1686863700,"Bitcoin Price Prediction as Fed Chair Powell Says May Be a 'Couple of Years' Before Rates Can Be Cut – Will BTC Crash to $20,000 Soon?","As Bitcoin continues its volatile journey, the latest statement from Federal Reserve Chair Jerome Powell has sparked concerns among investors. Powell's remarks suggesting that it may be a ""couple of years"" before interest rates can be cut have left many questioning the future trajectory of Bitcoin's price. With this uncertainty looming, there are growing speculations about a potential crash that could drive Bitcoin's value down to $20,000. ... Read More: Bitcoin Price Prediction as Fed Chair Powell Says May Be a 'Couple of Years' Before Rates Can Be Cut – Will BTC Crash to $20,000 Soon?",NEGATIVE,BTC,BTC | BUSINESS | FIAT | TRADING,,0,0,cryptonews,https://cryptonews.com/news/bitcoin-price-prediction-as-fed-chair-powell-says-may-couple-of-years-before-rates-can-cut-will-btc-crash-20000-soon.htm,https://resources.cryptocompare.com/news/52/13845498.jpeg
42420228,ha93388BwWkPe8xtcUaCMP,1686863333,BlackRock's iShares Files Paperwork for Spot Bitcoin ETF,"The iShares unit of fund management giant BlackRock (BLK) filed paperwork Thursday afternoon with the U.S. Securities and Exchange Commission (SEC) for the formation of a spot bitcoin (BTC) ETF.  To be named the iShares Bitcoin Trust, the fund's assets are to ""consist primarily of bitcoin held by a custodian on behalf of the Trust,"" according to the filing. That custodian will by crypto exchange Coinbase (COIN), said the filing.  CoinDesk earlier on Thursday reported on BlackRock's intention to soon file for a bitcoin ETF.  Though approving a number of futures-based bitcoin ETFs, the SEC has notably rejected other fund management company attempts at opening a spot bitcoin ETF, including those from Grayscale, VanEck, and WisdomTree.  BlackRock, however, may not be as easy for the SEC to turn away. It's the world's largest asset manager with more than $10 trillion in assets under management (AUM) and the company and its CEO Larry Fink has political power to possibly match that of the SEC and its leader Gary Gensler.  ""The proposed ETF is benchmarked against the CME CF Bitcoin Reference Rate,"" said Sui Chung, CEO of CF Benchmarks, a subsidiary of crypto exchange Kraken, commenting on the filing.  ""CF Benchmarks takes price data exclusively from cryptocurrency exchanges that adhere to the highest possible standards of market integrity and transparency. This protects investors as products benchmarked against it can then consistently and reliably track the spot price of the underlying asset,"" Chung added.  The move comes at a time when crypto industry is reeling from U.S. regulatory crackdown, which recently saw the SEC suing crypto exchange Coinbase and Binance. The market sentiment, following the filing of the ETF application by a TradFi giant, seem to have gotten a slight boost as the price of bitcoin is gained a bit on the news, rising to just shy of $25,600.  “BlackRock’s increasing engagement shows Bitcoin continues to be an asset of interest for some of the world’s largest financial institutions,” said Chung.  UPDATE (22:20 UTC, June 15, 2023): Adds additional context and comment from Kraken.  UPDATE (22:44 UTC, June 15, 2023): Adds additional context and comment from CF Benchmarks.",POSITIVE,BTC,BTC | EXCHANGE | MARKET | REGULATION | TRADING,Stephen Alpher,0,0,CoinDesk,https://coindesk.com/business/2023/06/15/blackrocks-ishares-files-paperwork-for-spot-bitcoin-etf,https://cdn.sanity.io/images/s3y3vcno/production/5ba4e49ddffd762d22c0425a56fc08272bcd872d-1440x1080.jpg?w=300&h=300&fit=crop
