뉴스ID,뉴스GUID,일자(UTC timestamp),뉴스제목,본문,SENTIMENT,주요코인,카테고리,작성자,추천수,비추천수,출처,뉴스URL,이미지URL
13833149,https://en.coinotag.com/?p=116188,1686832772,What’s Happening with Tether? USDT Loses Dollar Peg!,"- Newly Released Coins With Plenty of Zeros -Click Here to Buy at a Low Fee Before Anyone Else! Whales are selling significant amounts on Tether (USDT), the largest stablecoin in the cryptocurrency market. The unusual flow of USDT has triggered concerns about the stability of the stablecoin and raised worries about its depegging. Recently, The post What’s Happening with Tether? USDT Loses Dollar Peg! appeared first on COINOTAG .",NEGATIVE,USDT,FIAT | ICO | MARKET | USDT,,0,0,CoinOtag,https://en.coinotag.com/whats-happening-with-tether-usdt-loses-dollar-peg/,https://resources.cryptocompare.com/news/77/13833149.jpeg
13833143,https://coinpedia.org/?p=209177,1686832739,"Bitcoin Price Crash Below $25K, How Low Will BTC Price Drop?","The post Bitcoin Price Crash Below $25K, How Low Will BTC Price Drop? appeared first on Coinpedia Fintech News In the past two days, the Bitcoin price has dipped below the $25k threshold, triggering apprehension among crypto experts who foresee a period of increased volatility. The total crypto market capitalization experienced a decline of approximately 4.2 percent within the last 24 hours, settling around $1.05 trillion during the early New York time zone. Additionally, …",NEGATIVE,BTC,BTC | MARKET | TRADING,,0,0,coinpedia,https://coinpedia.org/bitcoin/bitcoin-price-crash-below-25k-how-low-will-btc-price-drop/,https://images.cryptocompare.com/news/default/coinpedia.png
13833114,https://en.coinotag.com/?p=116186,1686832733,Which Levels Should Ethereum Investors Follow? June 15th ETH Analysis,"- Newly Released Coins With Plenty of Zeros -Click Here to Buy at a Low Fee Before Anyone Else! According to Ethereum’s 12-hour technical chart, the $1630 level has been identified as an important support zone and the price has started to rise after encountering buyers at this level. If the ETH price continues to The post Which Levels Should Ethereum Investors Follow? June 15th ETH Analysis appeared first on COINOTAG .",NEUTRAL,ETH,BUSINESS | ETH | MARKET | TRADING,,0,0,CoinOtag,https://en.coinotag.com/which-levels-should-ethereum-investors-follow-june-15th-eth-analysis/,https://resources.cryptocompare.com/news/77/13833114.jpeg
13833191,https://cryptonews.com/news/ethereum-price-prediction-as-market-sell-off-sends-eth-below-1800-level-where-is-the-next-eth-support.htm,1686832680,"Ethereum Price Prediction as Market Sell-Off Sends ETH Below $1,800 Level – Where is the Next ETH Support?","The price of Ethereum (ETH) has dropped by 6.5% in the past 24 hours, with its fall to $1,637 coming as the cryptocurrency market continues to suffer losses amid regulatory uncertainty. ETH is now down by 11% in the past week, although it does remain up by 52% in the last 12 months, with the coin having recovered relatively well since the start of the year.... Read More: Ethereum Price Prediction as Market Sell-Off Sends ETH Below $1,800 Level – Where is the Next ETH Support?",NEGATIVE,ETH,ETH | MARKET | TRADING,,0,0,cryptonews,https://cryptonews.com/news/ethereum-price-prediction-as-market-sell-off-sends-eth-below-1800-level-where-is-the-next-eth-support.htm,https://resources.cryptocompare.com/news/52/13833191.jpeg
13833112,https://en.coinotag.com/?p=116185,1686832672,Ethereum Could Lose its DeFi Dominance: Is ETH Price Heading to $1400?,"- Newly Released Coins With Plenty of Zeros -Click Here to Buy at a Low Fee Before Anyone Else! The Federal Open Market Committee’s (FOMC) decision to halt interest rate hikes has caused many investors to incur losses. Ethereum, which invalidated the positive market sentiment created by news of easing inflation in the US, is The post Ethereum Could Lose its DeFi Dominance: Is ETH Price Heading to $1400? appeared first on COINOTAG .",NEGATIVE,ETH,BUSINESS | ETH | MARKET | TRADING,,0,0,CoinOtag,https://en.coinotag.com/ethereum-could-lose-its-defi-dominance-is-eth-price-heading-to-1400/,https://resources.cryptocompare.com/news/77/13833112.jpeg
13833073,https://en.coinotag.com/?p=116183,1686832634,Bitcoin is Trading at Critical Levels: Support and Resistance Levels to Watch,"- Newly Released Coins With Plenty of Zeros -Click Here to Buy at a Low Fee Before Anyone Else! Bitcoin is gaining bearish momentum below the $25,500 support. The price is trading below $25,500 and the 100-hour Simple Moving Average. An important ascending channel around $25,800 was broken on the hourly chart of the BTC/USD The post Bitcoin is Trading at Critical Levels: Support and Resistance Levels to Watch appeared first on COINOTAG .",NEUTRAL,BTC,BTC | TRADING,,0,0,CoinOtag,https://en.coinotag.com/bitcoin-is-trading-at-critical-levels-support-and-resistance-levels-to-watch/,https://resources.cryptocompare.com/news/77/13833073.jpeg
13833072,https://en.coinotag.com/?p=116182,1686832575,Ethereum Price Plummets: Investors Should Monitor These Levels Carefully!,"- Newly Released Coins With Plenty of Zeros -Click Here to Buy at a Low Fee Before Anyone Else! Ethereum experienced a 5% decrease and fell below the support of $1,720. The price is trading below $1,700 and the 100-hour Simple Moving Average. Bears are struggling with a significant downward trend line along with resistance The post Ethereum Price Plummets: Investors Should Monitor These Levels Carefully! appeared first on COINOTAG .",NEGATIVE,없음,BUSINESS | ETH | TRADING,,0,0,CoinOtag,https://en.coinotag.com/ethereum-price-plummets-investors-should-monitor-these-levels-carefully/,https://resources.cryptocompare.com/news/77/13833072.jpeg
13833066,https://coinpedia.org/?p=209166,1686832562,"Affordable Altcoins with Massive Potential for 2023 – Uwerx (WERX), Waves (WAVES), and Dai (DAI)","The post Affordable Altcoins with Massive Potential for 2023 – Uwerx (WERX), Waves (WAVES), and Dai (DAI) appeared first on Coinpedia Fintech News The crypto market flourishes in the 21st century, and Bitcoin (BTC) is a big hit to investors. Other coins after Bitcoin (BTC), called altcoins, didn’t do as well, but each was successful in its own right. This article will explore the most affordable altcoins with great potential to give investors substantial profits in 2023. They …",POSITIVE,BTC | DAI,ALTCOIN | BTC | BUSINESS | MARKET | DAI,,0,0,coinpedia,https://coinpedia.org/press-release/altcoins-with-massive-potential-for-2023-uwerx-waves-dai/,https://images.cryptocompare.com/news/default/coinpedia.png
13833034,https://en.coinotag.com/?p=116181,1686832527,Will Bitcoin Hold on to Criticism Support? June 15 BTC Analysis,"- Newly Released Coins With Plenty of Zeros -Click Here to Buy at a Low Fee Before Anyone Else! The range of $24,600 – $25,200 is seen as an important support range in Bitcoin’s daily price chart. If the BTC price continues to close above the $24,600 level on a daily basis, it has the The post Will Bitcoin Hold on to Criticism Support? June 15 BTC Analysis appeared first on COINOTAG .",NEUTRAL,BTC,BTC | MARKET | TRADING,,0,0,CoinOtag,https://en.coinotag.com/will-bitcoin-hold-on-to-criticism-support-june-15-btc-analysis/,https://resources.cryptocompare.com/news/77/13833034.jpeg
13833031,https://www.cryptopolitan.com/?p=318721,1686832485,Binance starts Bitcoin mining cloud venture away from the US,"Binance, the leading global cryptocurrency exchange, has ventured into a new realm of business: the Bitcoin mining industry. This groundbreaking venture starts with a bang, offering a subscription-based cloud service dedicated to the mining of the world’s first digital currency, Bitcoin. Binance ushers in a new era of Bitcoin mining As of June 15, this ... Read more",POSITIVE,없음,BTC | BUSINESS | EXCHANGE | MINING | BNB,,0,0,Cryptopolitan,https://www.cryptopolitan.com/binance-starts-bitcoin-mining-cloud-venture/,https://images.cryptocompare.com/news/default/cryptopolitan.png
13833027,https://coinpedia.org/?p=209174,1686832460,"XRP Price Poised To Surge 50%, While Bitcoin Price Might See Massive Crash – Here Are The Watch Levels","The post XRP Price Poised To Surge 50%, While Bitcoin Price Might See Massive Crash – Here Are The Watch Levels appeared first on Coinpedia Fintech News Altcoin Sherpa, a famous crypto expert, appears bullish on the altcoin XRP’s performance amidst the prevailing downturn. At the same time, he harbors pessimistic expectations for the crypto stalwart, Bitcoin. https://twitter.com/AltcoinSherpa/status/1668624914407112711 The Rising Strength of XRP Sherpa observes that XRP exhibits promising signs of robustness amidst the ongoing market slump. He asserts that the crypto …",POSITIVE,XRP,ALTCOIN | BTC | MARKET | TRADING | XRP,,0,0,coinpedia,https://coinpedia.org/price-analysis/xrp-price-poised-to-surge-50-while-bitcoin-price-might-see-massive-crash-here-are-the-watch-levels/,https://images.cryptocompare.com/news/default/coinpedia.png
13833113,https://cryptonews.com/news/bitcoin-based-strike-debuts-lightning-network-cross-border-payments-in-mexico-crypto-adoption-on-the-rise.htm,1686832440,Bitcoin-Based Strike Debuts Lightning Network Cross-Border Payments in Mexico – Crypto Adoption on the Rise,"Bitcoin payments firm Strike has extended the reach of its cross-border payments service to Mexico, as the company aims to leverage the country’s expansive remittances market. As of June 14, 2023, the company has introduced its 'Send Globally' service to the third-largest country in Latin America. The service allows users to send funds internationally, providing a convenient solution for cross-border transactions.... Read More: Bitcoin-Based Strike Debuts Lightning Network Cross-Border Payments in Mexico – Crypto Adoption on the Rise",POSITIVE,없음,BTC | EXCHANGE | MARKET | BNB,,0,0,cryptonews,https://cryptonews.com/news/bitcoin-based-strike-debuts-lightning-network-cross-border-payments-in-mexico-crypto-adoption-on-the-rise.htm,https://resources.cryptocompare.com/news/52/13833113.jpeg
13832921,https://ambcrypto.com/?p=320718,1686832231,Celsius submits revised bankruptcy plan after Fahrenheit deal,Defunct crypto lender Celsius has submitted an updated bankruptcy plan to reflect the Fahrenheit consortium’s successful bid for Celsius assets.,NEUTRAL,없음,OTHER,,0,0,AMB Crypto,https://ambcrypto.com/celsius-submits-revised-bankruptcy-plan-after-fahrenheit-deal/,https://images.cryptocompare.com/news/default/ambcrypto.png
13832878,https://coinpedia.org/?p=209168,1686832029,The Fate of Crypto Hangs in the Balance: U.S. Congressman’s Intentions Revealed,"The post The Fate of Crypto Hangs in the Balance: U.S. Congressman’s Intentions Revealed appeared first on Coinpedia Fintech News Notorious crypto-skeptic, U.S. Congressman Brad Sherman has once again stirred the crypto cauldron. In a recent interview with CNBC, Sherman openly expressed his hopes for the sun to set on the age of cryptocurrencies. Congressman’s Candid Crypto Critique When asked if the recent crackdowns by the SEC against crypto giants like Binance and Coinbase signal …",NEGATIVE,없음,EXCHANGE | REGULATION | BNB,,0,0,coinpedia,https://coinpedia.org/news/the-fate-of-crypto-hangs-in-the-balance-u-s-congressmans-intentions-revealed/,https://images.cryptocompare.com/news/default/coinpedia.png
13832920,https://timestabloid.com/?p=16683,1686831959,Ripple CTO Responds to Allegations that Ripple Paid Six Exchanges $1M – $5M to List XRP,"The latest documents released in the ongoing lawsuit involving Ripple and the United States Securities and Exchange Commission (SEC) have caused a commotion in the crypto community, resulting in a clarifying response from the CTO David Schwartz. Per the released court documents, Ripple is said to have entered into six partnerships with different trading platforms The post Ripple CTO Responds to Allegations that Ripple Paid Six Exchanges $1M – $5M to List XRP appeared first on Times Tabloid .",NEUTRAL,XRP,EXCHANGE | REGULATION | TRADING | XRP,,0,0,TimesTabloid,https://timestabloid.com/ripple-cto-responds-to-allegations-that-ripple-paid-6-exchanges-1-to-5m-to-list-xrp/,https://resources.cryptocompare.com/news/67/default.png
13832780,https://www.cryptoknowmics.com/news/?p=251975,1686831891,Crypto AI Projects See Global AI Coordination As A Positive Sign,"Following a tour of Asian capitals, Sam Altman, CEO of ChatGPT developer OpenAI, said on Monday that he was “quite optimistic” about the prospects for international cooperation in artificial intelligence (AI). OpenAI, supported by Microsoft Corp., has been attempting to capitalise on the growing interest in generative AI. It also wants to influence the field’s regulations. Additionally, during Altman’s April trip to Japan, he met with Prime Minister Fumio Kishida and expressed an interest in opening a local office there. Japan is regarded as a laggard in AI, despite the fact that its major manufacturing players are investing heavily in The post Crypto AI Projects See Global AI Coordination As A Positive Sign appeared first on Cryptoknowmics-Crypto News and Media Platform .",POSITIVE,없음,ASIA,,0,0,Cryptoknowmics,https://www.cryptoknowmics.com/news/crypto-ai-projects-see-global-ai-coordination-as-a-positive-sign/,https://images.cryptocompare.com/news/default/cryptoknowmics.png
13832806,https://www.cryptopolitan.com/?p=318701,1686831871,Kenya urges Africa to dump the US dollar,"Making a compelling case to free Africa’s economic prospects from the influence of the U.S. dollar, Kenya’s President William Ruto recently pressed the continent to embrace a new financial future. Advocating for a pivot in the African trading system, Ruto emphasized the need for continental economic self-reliance. Kenya takes the lead in advocating for Pan-African ... Read more",NEUTRAL,없음,REGULATION | TRADING,,0,0,Cryptopolitan,https://www.cryptopolitan.com/kenya-urges-africa-to-dump-the-us-dollar/,https://images.cryptocompare.com/news/default/cryptopolitan.png
13832792,https://www.cryptonewsz.com/?p=207059,1686831828,Vechain Technology collaborates with Frac,"Vechain Technology has gone ahead and formed an exclusive collaboration with Frac, which is an absolute top-of-the-line platform in terms of the valuable fractional asset trading market. As per a Vechain forecast, through this collaboration, the platform will be witnessing improved safety features, as well as better-established verification. Frac, on its part, is involved in …",POSITIVE,없음,MARKET | TECHNOLOGY | TRADING | VET,,0,0,CryptoNewsZ,https://www.cryptonewsz.com/vechain-technology-collaborates-with-frac/,https://images.cryptocompare.com/news/default/cryptonewsz.png
13832767,https://en.coinotag.com/?p=116179,1686831815,"Solana Falls Below $15! If SOL Price Fails to Hold, the Decline Could Deepen!","Solana gained bearish momentum and traded below $15. It is believed that the SOL price may struggle to recover above the $15 and $17.50 resistance levels. The post Solana Falls Below $15! If SOL Price Fails to Hold, the Decline Could Deepen! appeared first on COINOTAG .",NEGATIVE,SOL,SOL | TRADING,,0,0,CoinOtag,https://en.coinotag.com/solana-falls-below-15-if-sol-price-fails-to-hold-the-decline-could-deepen/,https://resources.cryptocompare.com/news/77/13832767.jpeg
13832847,https://invezz.com/?p=1273464,1686831758,Institutional crypto brokerage firm Floating Point Group (FPG) suspends operations,"Due to the unfortunate cyber security incident on Sunday, June 11th, an institutional cryptocurrency brokerage firm Floating Point Group (FPG) has through a tweet confirmed that trading, deposits, and withdrawals have been suspended on its platform. The attack on FPG resulted in a loss of between $15 million and $20 million worth of cryptocurrencies. FPG The post Institutional crypto brokerage firm Floating Point Group (FPG) suspends operations appeared first on Invezz .",NEGATIVE,없음,TRADING,,0,0,Invezz,https://invezz.com/news/2023/06/15/institutional-crypto-brokerage-firm-floating-point-group-fpg-suspends-operations/,https://resources.cryptocompare.com/news/69/default.png
13832726,https://coinedition.com/?p=276061,1686831658,Here Are the Top 5 Centralized Exchange Tokens by Market Capitalization,"The cryptocurrency market experienced a pullback yesterday, with almost all the top cryptocurrencies shedding a significant part of their value. The impact of this resulted in a drop in the overall market capitalization. At the time of writing, the total market cap of the crypto market, according to CoinMarketCap, stood at $1,018,129,585,579. The market capitalization The post Here Are the Top 5 Centralized Exchange Tokens by Market Capitalization appeared first on Coin Edition .",NEUTRAL,없음,EXCHANGE | ICO | MARKET,,0,0,Coin Edition,https://coinedition.com/here-are-the-top-5-centralized-exchange-tokens-by-market-capitalization/,https://resources.cryptocompare.com/news/7/default.png
13832731,https://cointelegraph.com/news/hashing-it-out-blockchain-africa-podcast-interview,1686831600,How blockchain technology makes it easier for Africans to upskill,The narrative that blockchain technology could revolutionize how people interact with technology in Africa may not be stale after all.,POSITIVE,없음,BLOCKCHAIN | TECHNOLOGY,,0,0,CoinTelegraph,https://cointelegraph.com/news/hashing-it-out-blockchain-africa-podcast-interview,https://resources.cryptocompare.com/news/16/13832731.jpeg
42420265,ha93388BwWkPe8xtcUaGgn,1686831417,First Mover Americas: Bitcoin Tumbles Below $25K,"This article originally appeared in First Mover, CoinDesk’s daily newsletter putting the latest moves in crypto markets in context. Subscribe to get it in your inbox every day.  Latest Prices  Top Stories  Cryptocurrencies fell sharply late Wednesday and into Thursday, with bitcoin dropping below $25,000 and Polygon’s MATIC, and Cardano’s ADA extending 24-hour declines to as much as 9% and 8%, respectively. This comes following Wednesday’s Federal Reserve policy decision at which the central bank suspended rate hikes for at least one meeting, but signaled it expects further monetary tightening before the end of the year. Bitcoin could see further short-term losses, according to LMAX Digital’s morning note. “As per our technical insights in today’s update, any additional setbacks in the price of bitcoin should be well supported ahead of $22K.”  Paying interest on or surcharges for using a digital euro would be banned under a draft law seen by CoinDesk, and set to be proposed by the European Commission on June 28. The proposed central bank digital currency (CBDC) would have to be available for cash-style offline payments from day one, and users shouldn’t be able to program it to limit onward use, the leaked bill said. “The digital euro shall be available for both online and offline digital euro payment transactions as of the first issuance of the digital euro,” said the text viewed by CoinDesk. The level of privacy for offline, face-to-face use should be “comparable” to withdrawing banknotes at an ATM, it said.  The Middle Eastern arm of OKX, the second-largest cryptocurrency exchange by trading volume, has received an MVP Preparatory license from the Dubai Virtual Assets Regulatory Authority (VARA). OKX Middle East has already taken up residence in a new office in Dubai World Trade Center, and says it plans to expand the number of staff to 30, with a focus on local hires and senior management. Once the Minimal Viable Product (MVP) license becomes fully operational, OKX Middle East will provide spot, derivatives and fiat services, including U.S. dollar and United Arab Emirates dirham (AED) deposits, withdrawals and spot-pairs, the company said in a press release.  Chart of The Day  The chart shows total value locked in Binance Smart Chain (BSC) has declined to $3.29 billion, the lowest since March 2021.  Investors are pulling capital from BSC-based projects in the wake of the U.S. SEC's crackdown on Binance.  BSC's fee revenue has declined 50% from a year ago and is currently down 30% from the second quarter's daily average, according to data tracked by Matrixport.  Trending Posts  Bitcoin Halving History Provides Little Guidance on Outcome: Coinbase  USDT Selling on Curve, Uniswap Spooks Traders Amid Bitcoin Drop  Crypto Exchange Bybit Integrates ChatGPT Into Trading Tools",NEGATIVE,없음,BTC | EXCHANGE | FIAT | MARKET | TRADING,"Lyllah Ledesma, Omkar Godbole",0,0,CoinDesk,https://coindesk.com/markets/2023/06/15/first-mover-americas-btc-bitcoin-tumbles-below-25k,https://cdn.sanity.io/images/s3y3vcno/production/a5ef70c0c55266755c0d7473234cab1f2af24c5e-1134x657.png?w=300&h=300&fit=crop
13832485,https://www.cryptopolitan.com/?p=318705,1686831062,Brazil’s new legislation sets the stage for cryptocurrency success under president Lula,"In recent developments, Luiz Inácio Lula da Silva, the current president of Brazil, has emerged as a prominent figure in cryptocurrency. His recent actions have captured the public’s attention, as he has taken significant steps toward bringing clarity to the regulatory landscape surrounding digital assets in the country. One of his noteworthy achievements is the ... Read more",POSITIVE,없음,REGULATION,,0,0,Cryptopolitan,https://www.cryptopolitan.com/brazils-new-legislation-sets-the-stage-for-cryptocurrency-success-under-president-lula/,https://images.cryptocompare.com/news/default/cryptopolitan.png
13832347,https://cryptopotato.com/?p=255388,1686830804,Hong Kong Pressures Banks to Accept Crypto Exchanges as Clients: FT,The pressure highlights the challenges posed by Hong Kong's attempt to position itself as a worldwide hub for the cryptocurrency industry.,NEUTRAL,없음,ASIA,,0,0,Crypto Potato,https://cryptopotato.com/hong-kong-pressures-banks-to-accept-crypto-exchanges-as-clients-ft/,https://resources.cryptocompare.com/news/27/13832347.jpeg
