뉴스ID,뉴스GUID,일자(UTC timestamp),뉴스제목,본문,SENTIMENT,주요코인,카테고리,작성자,추천수,비추천수,출처,뉴스URL,이미지URL
6700625,https://newsbtc.com/?p=514228,1672401606,These Are The Bitcoin Predictions For 2023 By Arcane Research,"Historically, 2022 could end up being the second-worst year for Bitcoin since 2011. At the current price, BTC has a year-to-date (YTD) performance of -65%, topped only by 2018 when the price lost -73% in one year. As Arcane Research notes in its year-end report for 2022, physical gold (-1% YTD) has significantly outperformed digital gold, Bitcoin, in a period of high inflation. As a result, the analytics firm notes that the digital gold narrative was premature. As Arcane Research notes, the crypto winter was essentially fueled by tightening macroeconomic conditions and crypto-specific leverage and miserable risk management by core market participants. BTC had followed the U.S. equity markets due to its high correlation. “Apart from two distinct events in 2022, BTC followed U.S. equities very closely. The two outliers of June (3AC, Celsius etc.) and November (FTX), are responsible for the entire underperformance of BTC vs. the U.S. equities,” the report states, displaying the following chart. Bitcoin Predictions For 2023 For the coming year 2023, Arcane Research expects that contagion effects will “probably” continue in early 2023. “[B]ut we view it as likely that the majority of 2023 will be less frantic and borderline uneventful compared to the last three years,” Arcane Research predicts. Related Reading: Solana Prediction For 2023: SOL Is Not Dead Yet, Analyst Says With that in mind, the firm expects Bitcoin to trade in a “mostly flat range” in 2023, but to finish the year with a higher price than it did at the start. Bitcoin’s current drawdowns closely resemble the bear market patterns of previous cycles, Arcane Research elicits. While the 2018 bear market lasted 364 days from peak to end, the 2014-15 bear market lasted 407 days. The current cycle is on its 376th day. This puts the ongoing bear market exactly between the duration in both previous cycles. “If a new bottom is reached in 2023, this will be the longest-lasting BTC drawdown ever,” the firm said and further elaborated that there are quite a few potential catalysts for a renowned bull market: The FTX proceedings may incentivize more rapid progress with regulations, and we view both positive signals related to U.S. spot BTC ETF launches and more coherent classifications of tokens as a plausible outcome by the end of the year, with exchange tokens being particularly exposed for potential security classifications. Regarding Grayscale’s Bitcoin spot ETF application, February 3 will be an important date for the industry when the three-judge panel will rule on the SEC complaint. Related Reading: Bitcoin Price Could End The Year Further Lower, Key Resistance Intact In addition, Arcane Research expects another catalyst from Europe: namely, the passage of the MiCA Act by the European Parliament in February 2023. The core prediction for 2023 remains that Bitcoin will recover despite the tightening macroeconomic situation and that now is “an excellent area to build gradual BTC exposure.” However, the start of 2023 could be bumpy as trading volumes and volatility decline in a much duller market than in the past three years. In summary, Arcane Research therefore estimates: As we advance into the next year, patience and long-term positioning will be key. At press time, the BTC price traded at $16,497, facing further downward pressure, probably due to tax harvesting by year-end. Featured image from Wance Paleri / Unsplash, Charts from Arcane Research and TradingView.com",NEUTRAL,BTC,BTC | FIAT | MARKET | TRADING | RESEARCH,,0,0,NewsBTC,https://newsbtc.com/news/bitcoin/bitcoin-prediction-2023-arcane-research/,https://resources.cryptocompare.com/news/21/6700625.jpeg
6700760,https://cointelegraph.com/news/investors-seek-to-sell-ftx-celsius-blockfi-voyager-claims,1672401600,"Investors seek to sell FTX, Celsius, BlockFi, Voyager claims",Hedge funds and debt investors have already purchased some of the claims.,NEUTRAL,없음,BUSINESS,,0,0,CoinTelegraph,https://cointelegraph.com/news/investors-seek-to-sell-ftx-celsius-blockfi-voyager-claims,https://resources.cryptocompare.com/news/16/6700760.jpeg
6700533,https://thecryptobasic.com/?p=38529,1672401461,Logan Paul Trolls Coffeezilla After CryptoZoo Investigation,"Both media personalities have relentlessly engaged in a war of words following Coffeezilla’s investigation of CryptoZoo. American media personality, podcaster and professional wrestler Logan Paul has swiped at YouTuber and online sleuth Stephen Findeisen, popularly known as Coffeezilla. The move comes amid a heated war of words between both personalities after Coffeezilla revealed unwholesome details The post Logan Paul Trolls Coffeezilla After CryptoZoo Investigation first appeared on The Crypto Basic .",NEGATIVE,없음,MARKET,,0,0,The Crypto Basic,https://thecryptobasic.com/2022/12/30/logan-paul-trolls-coffeezilla-after-cryptozoo-investigation/?utm_source=rss&#038;utm_medium=rss&#038;utm_campaign=logan-paul-trolls-coffeezilla-after-cryptozoo-investigation,https://images.cryptocompare.com/news/default/thecryptobasic.png
6700516,https://www.cryptonewsz.com/?p=181387,1672401410,Vitalik Buterin supports Solana in the latter’s hour of distress,"Solana has lost several projects to its competitors; however, there appears to be a ray of hope as Vitalik Buterin expresses his support for the blockchain and its ecosystem. Ethereum’s Buterin believes that the network can still get a hold of its operations and get the values back to the list of top 20 cryptocurrencies. …",POSITIVE,없음,BLOCKCHAIN | ETH | SOL,,0,0,CryptoNewsZ,https://www.cryptonewsz.com/vitalik-buterin-supports-solana-in-the-latters-hour-of-distress/,https://images.cryptocompare.com/news/default/cryptonewsz.png
6700345,https://cointelegraph.com/news/ethereum-needs-to-defend-1-180-to-sustain-this-50-day-ascending-pattern,1672401213,"Ethereum needs to defend $1,180 to sustain this 50-day ascending pattern","ETH price bulls struggle as futures remain trading below its fair value, signaling excessive demand for shorts.",NEGATIVE,ETH,ETH | MARKET | TRADING | ZK,,0,0,CoinTelegraph,https://cointelegraph.com/news/ethereum-needs-to-defend-1-180-to-sustain-this-50-day-ascending-pattern,https://resources.cryptocompare.com/news/16/6700345.jpeg
6700282,https://newsbtc.com/?p=514243,1672401137,"Dogecoin Price Tumbles Below Support, Why This Could Be Strong Bearish","Dogecoin extended its decline below the $0.070 support against the US Dollar. DOGE could continue to move down towards the $0.0620 support zone. DOGE gained pace and traded below the $0.072 support against the US dollar. The price is trading below the $0.0700 zone and the 100 simple moving average (4-hours). There is a key bearish trend line forming with resistance near $0.0698 on the 4-hours chart of the DOGE/USD pair (data source from Kraken). The pair could dive further towards the $0.062 support in the near term. Dogecoin Price Signals Bearish In the past few days, dogecoin saw a steady decline from the $0.080 resistance zone. DOGE reacted to the downside below the $0.0750 and $0.0720 support levels. The decline gained pace below the $0.072 level and the 100 simple moving average (4-hours). More importantly, there was a clear move below the $0.070 support zone, opening the doors for a major decline. The price is now trading well below the $0.0700 zone and the 100 simple moving average (4-hours). Doge price traded as low as $0.0667 and is currently showing a lot of bearish signs, similar bitcoin and ethereum. On the upside, the price is facing resistance near the $0.0695 level. The first major resistance is near the $0.0700 level. There is also a key bearish trend line forming with resistance near $0.0698 on the 4-hours chart of the DOGE/USD pair. The trend line is near the 23.6% Fib retracement level of the downward move from the $0.0795 swing high to $0.0667 low. A clear move above the trend line might send the price towards the $0.073 resistance. It is near the 50% Fib retracement level of the downward move from the $0.0795 swing high to $0.0667 low. Source: DOGEUSD on TradingView.com Any more gains might send the price towards the $0.0765 level and the 100 SMA. The main hurdle seems to be forming near the $0.080 zone. A clear move above the $0.080 resistance could open the gates for a rally towards the $0.100 level. More Losses in DOGE? If DOGE price fails to gain pace above the $0.070 level, it could continue to move down. An initial support on the downside is near the $0.0665 level. The next major support is near the $0.062 level. If there is a downside break below the $0.0620 support, the price could decline further. In the stated case, the price might decline towards the $0.060 level. Technical Indicators 4-Hours MACD – The MACD for DOGE/USD is now gaining momentum in the bearish zone. 4-Hours RSI (Relative Strength Index) – The RSI for DOGE/USD is now in the oversold zone. Major Support Levels – $0.0665, $0.0662 and $0.0600. Major Resistance Levels – $0.070, $0.0730 and $0.080.",NEGATIVE,DOGE,BTC | DOGE | ETH | EXCHANGE | TRADING,,0,0,NewsBTC,https://newsbtc.com/analysis/dogecoin-price-tumbles-070/,https://images.cryptocompare.com/news/default/newsbtc.png
6700133,https://cryptopotato.com/?p=230934,1672401008,FTX Japan Reveals When it Will Resume Withdrawals,The Japanese exchange will shut down its business operations once users withdraw their assets from the platform.,NEUTRAL,없음,ASIA | BUSINESS | EXCHANGE,,0,0,Crypto Potato,https://cryptopotato.com/ftx-japan-reveals-when-it-will-resume-withdrawals/,https://resources.cryptocompare.com/news/27/6700133.jpeg
6700160,https://www.cryptonewsz.com/?p=181384,1672400939,Fuse Gold collaborates with PoR & secures the minting function,"Fuse Gold, which happens to be a tokenized gold protocol supported by LBMA-approved gold, happens to be kept in vaults all over the United Kingdom. At present, it has decided to incorporate Chainlink Proof of Reserve (PoR) to secure the FUSEG minting function, which is duly carried out on the BNB Chain. In this scenario, …",NEUTRAL,BNB,BLOCKCHAIN | FIAT | LINK | BNB,,0,0,CryptoNewsZ,https://www.cryptonewsz.com/fuse-gold-collaborates-with-por-and-secures-the-minting-function/,https://images.cryptocompare.com/news/default/cryptonewsz.png
6699300,https://news.bitcoin.com/?p=566299,1672399840,Venezuelan Banking Watchdog to Oversee Crypto Transactions to Preserve Currency Stability,"Sudeban, the Venezuelan banking watchdog, is currently working on a mechanism to review crypto-related transactions in real-time to control the influence these have on the stability of the exchange market. Analysts have recently linked the situation in peer-to-peer (P2P) crypto markets to the recent drop in the value of the bolivar. Venezuelan Government to Monitor",NEUTRAL,없음,EXCHANGE | FIAT | MARKET,,0,0,Bitcoin.com,https://news.bitcoin.com/venezuelan-banking-watchdog-to-oversee-crypto-transactions-to-preserve-currency-stability/,https://resources.cryptocompare.com/news/14/6699300.jpeg
6699298,https://ambcrypto.com/?p=280925,1672399835,SBF met Biden aides to discuss crypto policy before FTX downfall,"Former FTX CEO Sam Bankman-Fried “SBF” met with White House officials on at least four separate occasions in 2022. Bankman-Fried donated over $70 million to election campaigns within 18 months, being one of the top political donors in the US. Former FTX CEO Sam Bankman-Fried “SBF” met with White House officials on at least four",NEUTRAL,없음,OTHER,,0,0,AMB Crypto,https://ambcrypto.com/sbf-met-biden-aides-to-discuss-crypto-policy-before-ftx-downfall/,https://images.cryptocompare.com/news/default/ambcrypto.png
6699227,https://coinedition.com/?p=237775,1672399800,Weary Bears Watch from Afar as Bulls Push ETC Price Up to $15.44,"Ethereum Classic (ETC) bulls seem to be picking up the slack, as the day’s low and high ranges are $15.35 and $16.01, respectively. It is up from yesterday’s low and high of $14.92 and $16.01, respectively. In light of this positive trend, the current price of ETC is $15.44, a 0.52% increase over the last The post Weary Bears Watch from Afar as Bulls Push ETC Price Up to $15.44 appeared first on Coin Edition .",POSITIVE,ETC,ETC | TRADING,,0,0,Coin Edition,https://coinedition.com/weary-bears-watch-from-afar-as-bulls-push-etc-price-up-to-15-44/,https://resources.cryptocompare.com/news/7/default.png
6699157,https://www.cryptopolitan.com/?p=252053,1672399641,Bahamas Securities Commission seized $3.5B in customers’ assets from FTX,"According to a statement released on December 29, the Bahamian regulator Bahamas Securities Commission gained possession of digital assets valued at $3.5 billion at FTX Digital Markets shortly after the company filed for Chapter 11 bankruptcy protection. Tokens worth around $370 million were taken from the FTX exchange by an unknown actor, who is believed … Bahamas Securities Commission seized $3.5B in customers’ assets from FTX Read More »",NEGATIVE,없음,EXCHANGE | ICO | MARKET,,0,0,Cryptopolitan,https://www.cryptopolitan.com/bahamas-securities-commission-seized-3-5b-in-customers-assets-from-ftx/,https://resources.cryptocompare.com/news/43/6699157.jpeg
6698909,https://www.cryptonewsz.com/?p=181379,1672399362,Internet Computer turns long-term bearish: Can ICP reach $5?,"The Internet Computer is the next version of smart contract platforms and payment providers in the crypto world. After its launch, the ICP token triggered hype and became a popular coin in the crypto world. DFINITY Foundation is behind the Internet Computer ecosystem, which was launched in 2016 by Dominic Williams. The aim is to …",NEGATIVE,ICP,ICO | TRADING | ICP,,0,0,CryptoNewsZ,https://www.cryptonewsz.com/internet-computer-turns-long-term-bearish-can-icp-reach-five-usd/,https://images.cryptocompare.com/news/default/cryptonewsz.png
7344188,https://www.bitdegree.org/crypto/news/ftx-japanese-subsidiary-liquid-hopes-to-return-customer-funds-in-2023,1672398666,"FTX Japanese Subsidiary, Liquid, Hopes to Return Customer Funds in 2023",FTX Japan customers are expected to be able to withdraw their cryptocurrency holdings in mid-February.,NEUTRAL,없음,ASIA,,0,0,BitDegree,https://www.bitdegree.org/crypto/news/ftx-japanese-subsidiary-liquid-hopes-to-return-customer-funds-in-2023,https://resources.cryptocompare.com/news/66/7344188.jpeg
6698358,https://www.cryptonewsz.com/?p=181374,1672398540,VeChain shows no sign of recovery: Is it an end of VET?,"VeChain is a decentralized blockchain platform that helps to improve supply chain management, mostly popular in the USA, Singapore, China, Japan, and Europe. This distributed ledger technology was created in 2016 to start a digital business transformation for the automobile and fashion industry. It aims to develop a solution for product traceability and for supply …",NEGATIVE,VET,ASIA | BLOCKCHAIN | BUSINESS | TECHNOLOGY | VET,,0,0,CryptoNewsZ,https://www.cryptonewsz.com/vechain-shows-no-sign-of-recovery-is-it-an-end-of-vet/,https://images.cryptocompare.com/news/default/cryptonewsz.png
6698114,https://coinedition.com/?p=237751,1672398287,Investigator Questions Huobi Global`s Defective KYC Policies,The public company investigator Aurelius Capital Value has cast doubt on Silvergate’s association with Huobi Global. This results from the establishment that Huobi Global has poor KYC standards. It was also a result of an experiment conducted in 2020 by the forensics company Cipherblade. The experiment demonstrated how simple it was to create false accounts The post Investigator Questions Huobi Global`s Defective KYC Policies appeared first on Coin Edition .,NEGATIVE,없음,EXCHANGE,,0,0,Coin Edition,https://coinedition.com/investigator-questions-huobi-globals-defective-kyc-policies/,https://resources.cryptocompare.com/news/7/default.png
6698120,https://coinpedia.org/?p=174726,1672398215,Will Snowfall Protocol Survive The Competition Against Avalanche And Polkadot?,"The post Will Snowfall Protocol Survive The Competition Against Avalanche And Polkadot? appeared first on Coinpedia Fintech News Avalanche (AVAX) and Polkadot (DOT) are both ERC-20 blockchains that have created quite a stir in the market. So, any new cryptocurrency that launches in their domain of use cases is expected to face stiff competition from them. However, given the inherent issues of Avalanche (AVAX) and Polkadot (DOT), it is not impossible to beat …",NEUTRAL,AVAX | DOT,AVAX | BLOCKCHAIN | DOT | MARKET,,0,0,coinpedia,https://coinpedia.org/press-release/will-snowfall-protocol-survive-the-competition-against-avalanche-and-polkadot/,https://images.cryptocompare.com/news/default/coinpedia.png
6698190,https://blockworks.co/news/these-crypto-startups-nabbed-funding-rounds-to-close-out-2022,1672397937,These Crypto Startups Nabbed Funding Rounds To Close Out 2022,"Despite all the bad news, crypto startups are still securing funding rounds as the bear market stretches into its second year",NEUTRAL,없음,MARKET | TRADING,,0,0,Blockworks,https://blockworks.co/news/these-crypto-startups-nabbed-funding-rounds-to-close-out-2022,https://images.cryptocompare.com/news/default/blockworks.png
6697992,https://decrypt.co/?p=118164,1672397921,Bahamas Securities Commission Confirms It Has $3.5B in FTX Assets,The confirmation comes as tensions remain about the Bahamian regulators' role in FTX’s ongoing legal issues.,NEUTRAL,없음,BUSINESS | REGULATION,,0,0,Decrypt,https://decrypt.co/118164/bahamas-securities-commission-confirms-has-3-5b-ftx-assets,https://resources.cryptocompare.com/news/44/6697992.jpeg
6697903,https://cointelegraph.com/news/ftx-founder-reportedly-cashes-out-684k-after-being-released-on-bail,1672397864,FTX founder reportedly cashes out $684K after being released on bail,"SBF has allegedly cashed out $684,000 from a crypto exchange in Seychelles while being under house arrest, according to an on-chain investigation.",NEGATIVE,없음,EXCHANGE | REGULATION,,0,0,CoinTelegraph,https://cointelegraph.com/news/ftx-founder-reportedly-cashes-out-684k-after-being-released-on-bail,https://resources.cryptocompare.com/news/16/6697903.jpeg
6697652,https://bitcoinist.com/?p=211433,1672397657,"Winklevoss Twins, Gemini Face Class-Action Lawsuit Over $900 Million Crypto Mess","Who will be the next crypto top honchos to fall? Will it be the Winklevoss twins? Investors have filed a lawsuit against embattled Gemini and its founders Tyler and Cameron Winklevoss, accusing them of fraud and other crimes, reports disclosed Tuesday. A group of investors filed a class-action lawsuit in Manhattan federal court on Tuesday,",NEGATIVE,없음,BUSINESS,,0,0,Bitcoinist,https://bitcoinist.com/winklevoss-twins-face-lawsuit/,https://resources.cryptocompare.com/news/13/6697652.jpeg
6697237,https://www.cryptopolitan.com/?p=252060,1672397115,"3 reasons Solana could turn bullish, and is it time to buy?","Solana has struggled under immense pressure from negative market sentiment. The would-be ‘Ethereum killer’ has dropped to position 18 by market value behind Shiba Inu, Uniswap, and Avalanche. Solana is a highly scalable blockchain infrastructure designed to host decentralized applications. The blockchain is much faster and cheaper than Ethereum. Users relate the blockchain’s current woes … 3 reasons Solana could turn bullish, and is it time to buy? Read More »",NEUTRAL,없음,BLOCKCHAIN | ETH | SHIB | SOL | TRADING,,0,0,Cryptopolitan,https://www.cryptopolitan.com/3-reasons-solana-bullish-is-it-time-to-buy/,https://resources.cryptocompare.com/news/43/6697237.jpeg
6696814,https://www.cryptopolitan.com/?p=252054,1672396539,SBF white house meetings 2 months before FTX collapse exposed,"At least four times in 2022, former FTX CEO Sam Bankman-Fried visited with government representatives at the White House, including one meeting that apparently took place only two months before his crypto company collapsed. Most of the encounters were made public in visitor logs, which the White House posts every month. According to the records, … SBF white house meetings 2 months before FTX collapse exposed Read More »",NEUTRAL,없음,OTHER,,0,0,Cryptopolitan,https://www.cryptopolitan.com/ftx-sbf-white-house-meetings-exposed/,https://resources.cryptocompare.com/news/43/6696814.jpeg
6696815,https://cryptonews.com/news/chinese-govt-unveil-its-version-of-an-nft-marketplace.htm,1672396500,Chinese Gov’t to Unveil Its Version of an ‘NFT’ Marketplace,The Chinese government has announced plans to launch its own version of a state-backed “non-fungible token (NFT)” marketplace. But Beijing won’t be using blockchain to power its platform. And it wants to do away with crypto as the marketplace’s currency – in favor of fiat.... Read More: Chinese Gov’t to Unveil Its Version of an ‘NFT’ Marketplace,NEUTRAL,없음,ASIA | BLOCKCHAIN | FIAT | ICO,,0,0,cryptonews,https://cryptonews.com/news/chinese-govt-unveil-its-version-of-an-nft-marketplace.htm,https://resources.cryptocompare.com/news/52/6696815.jpeg
6696611,https://www.cryptopolitan.com/?p=252042,1672396233,Filecoin price analysis: FIL/USD faces bearish pressure at $2.95,"Filecoin price analysis shows a strong bearish day ahead. Filecoin has been hovering around a local resistance of $3.03. Towards the closure of yesterday’s market, FIL/USD showed highly bearish reactions in price as FIL sought support at 2.93. Filecoin is trading at a range of $2.93 to $3.30. Filecoin’s current price is $2.95 with a … Filecoin price analysis: FIL/USD faces bearish pressure at $2.95 Read More »",NEGATIVE,FIL,FIL | MARKET | TRADING,,0,0,Cryptopolitan,https://www.cryptopolitan.com/filecoin-price-analysis-2022-12-30/,https://resources.cryptocompare.com/news/43/6696611.jpeg
6696344,https://www.cryptonewsz.com/?p=181368,1672395946,You can now use Google Pay & Apple Pay on Binance!,"Binance, one of the biggest names in the crypto domain, recently announced the integration of Google Pay and Apple Pay. The integration has opened the exchange to 43.9 million Apple Pay and 25 million Google Pay users. The platform released an official post to inform users about the development. According to the post, the recent …",POSITIVE,없음,EXCHANGE | BNB,,0,0,CryptoNewsZ,https://www.cryptonewsz.com/you-can-now-use-google-pay-apple-pay-on-binance/,https://images.cryptocompare.com/news/default/cryptonewsz.png
6696129,https://finbold.com/?p=95065,1672395640,"Shiba Inu (SHIB) price prediction for January 31, 2023","As the cryptocurrency market prepares to conclude one of its worst years in history on a bearish note, Shiba Inu … Continued The post Shiba Inu (SHIB) price prediction for January 31, 2023 appeared first on Finbold .",NEUTRAL,SHIB,MARKET | SHIB | TRADING,,0,0,Finbold,https://finbold.com/shiba-inu-shib-price-prediction-for-january-31-2023/,https://images.cryptocompare.com/news/default/finbold.png
6696196,https://cryptonews.com/news/central-bank-digital-currency-turkeys-central-bank-conducts-first-transactions-of-digital-lira-will-other-countries-follow-suit.htm,1672395600,Central Bank Digital Currency: Turkey's Central Bank Conducts First Transactions of Digital Lira – Will Other Countries Follow Suit?,"The Central Bank of the Republic of Turkey (CBRT) has completed the first trial of its central bank digital currency (CBDC), the Digital Turkish Lira. The country's central bank issued a press release on December 29, stating that, ""In the scope of the first-phase studies of the Digital Turkish Lira Project, conducted under the leadership of the [CBRT], the first payment transactions on the Digital Turkish Lira Network were executed successfully."" ... Read More: Central Bank Digital Currency: Turkey's Central Bank Conducts First Transactions of Digital Lira – Will Other Countries Follow Suit?",NEUTRAL,없음,FIAT | SPONSORED,,0,0,cryptonews,https://cryptonews.com/news/central-bank-digital-currency-turkeys-central-bank-conducts-first-transactions-of-digital-lira-will-other-countries-follow-suit.htm,https://resources.cryptocompare.com/news/52/6696196.jpeg
6696195,https://blockworks.co/news/ftx-crypto-worth-3-5b-held-by-bahamas-regulator,1672395483,FTX Crypto Worth $3.5B Held By Bahamas Regulator,Bahamas regulators took control of FTX crypto following a peculiar cyberattack as the exchange prepared to file for bankruptcy,NEGATIVE,없음,EXCHANGE,,0,0,Blockworks,https://blockworks.co/news/ftx-crypto-worth-3-5b-held-by-bahamas-regulator,https://images.cryptocompare.com/news/default/blockworks.png
6695899,https://dailyhodl.com/?p=230372,1672395341,Litecoin (LTC) and Binance Coin (BNB) Are Crypto Assets To Keep on the Radar As Whale Activity Spikes: Santiment,"A prominent crypto analytics platform says that whale transactions centered around Litecoin (LTC) and the native tokens of Binance are drastically on the rise. According to the market intelligence firm Santiment, investors should keep an eye on Bitcoin (BTC) alternative LTC, Binance Coin (BNB) and BUSD, Binance’s proprietary stablecoin, as transactions valued over $1 million The post Litecoin (LTC) and Binance Coin (BNB) Are Crypto Assets To Keep on the Radar As Whale Activity Spikes: Santiment appeared first on The Daily Hodl .",NEUTRAL,BTC | LTC | BNB,ALTCOIN | BTC | EXCHANGE | LTC | BNB,,0,0,The Daily Hodl,https://dailyhodl.com/2022/12/30/litecoin-ltc-and-binance-coin-bnb-are-crypto-assets-to-keep-on-the-radar-as-whale-activity-spikes-santiment/,https://images.cryptocompare.com/news/default/dailyhodl.png
