뉴스ID,뉴스GUID,일자(UTC timestamp),뉴스제목,본문,SENTIMENT,주요코인,카테고리,작성자,추천수,비추천수,출처,뉴스URL,이미지URL
42377650,0r6Zag11PPDEMKgUX72gcd,1411077936,BitPay API Update Lets Apps Enable Easy Bitcoin Refunds,"BitPay has introduced the newest version of its BitPay API, a representational state transfer (RESTful) service that will allow the customers of all API-using developers the ability to initiate refunds directly from those applications.  The updated API follows a string of recent releases for developers from a number of key bitcoin companies, including Coinbase and CEX.io, which revealed new offerings for this community this past week.  For BitPay, however, the emphasis of the release was on the convenience the update will provide for the customers of API users, who will now be able to interact with merchants in a manner more familiar to the users of other payment methods.  BitPay's Eric Martindale wrote in the official announcement:  ""We hope [this] will lead to more smooth Bitcoin payment experiences for everyone, regardless of platform or wallet.""  Outside of this update, Martindale said that BitPay's primary goal was to better ensure the security of transactions on its platform, and to increase the number of resources available in its API without adding complexity.  For merchants, the company also updated its Billing API so companies that accept bitcoin can automate the submission of bills, allowing them to request future payments.  The API integrates BitPay's earlier offerings with BitAuth, the company's decentralized authentication tool. Further, as it uses the Bitcoin Payment Protocol, BitPay refunds will work with any bitcoin address or wallet service.  Move toward tokenization  Yet, another emphasis point for the company was that this latest version of its API cryptographically secures interactions with BitPay through tokenization.  Martindale indicated that all requests made to its API will now need to be signed with BitAuth keypairs. These signatures, he explained, are then matched against other parameters to verify that the security of the payment.  Expanding on the possibilities of this latest addition, Martindale wrote:  ""Tokens can be restricted to an identity, requiring a signature by that identity to utilize, or even a list of identities – perhaps a group of devices (such as point of sale tablets) or a list of people and their keys.""  Notably, the movement by BitPay toward tokenization follows Apple's use of similar security methods for Apple Pay, its new payment product introduced last week.  Open-source API  Overall, BitPay framed the release as one that also opens up the abilities of developers to interface with its API in new and more creative ways.  As such, the post concluded with the company directing users to contributions developers have made to Bitcore, the company's open-source Javascript library unveiled in February.  BitPay ended this post by further stressing this call to action, adding:  ""We look forward to seeing what you build.""  Disclaimer: CoinDesk founder Shakil Khan is an investor in BitPay.  Image via Shutterstock",POSITIVE,없음,BLOCKCHAIN | BTC | BUSINESS,Pete Rizzo,0,0,CoinDesk,https://coindesk.com/markets/2014/09/18/bitpay-api-update-lets-apps-enable-easy-bitcoin-refunds,https://cdn.sanity.io/images/s3y3vcno/production/5af4281f2a625c95e524e4ec3316e9f73801fd14-2560x1813.jpg?w=300&h=300&fit=crop
42377655,0r6Zag11PPDEMKgUX72gf9,1411074909,Bitcoin Think Tank Coin Center Launches with Star-Studded Support,"Coin Center, a new public policy organisation dedicated to digital currency research and advocacy, has launched with widespread backing from the bitcoin industry.  The Washington, DC-based group is supported by prominent figures such as VC investor Marc Andreessen, SecondMarket chairman Barry Silbert, bitcoin developer Jeff Garzik and a host of the industry's most prominent companies.  In an open letter to the community, executive director Jerry Brito said that one major goal of the group is to help shape the global regulatory debate that could decide the fate of digital currency usage in the US and abroad.  Brito, a former executive director and research fellow at noted market research organisation Mercatus Center, wrote:  “Digital currencies like Bitcoin will be an important part of our economy, and policymakers are now beginning to consider how to regulate their use. As a result, there is a need for an organization that can be a trusted and credible source of information about the regulatory implications of digital currencies. We seek to be that trusted and credible source.”  Notably, Brito recently co-authored a critique of the BitLicense that was published by Mercatus. He formally left the organisation on 18th August, cryptically announcing by email that we would be moving on to another venture.  Star-studded support  In addition to Brito, Andreessen and Garzik, the group’s board of directors includes angel investor Alex Morcos; Stanford professor and Ripple Labs advisor Susan Athey; and Andreessen Horowitz general partner Balaji Srinivasan.  Coin Center will have an initial budget of $1m to support its efforts.  The organisation received funding from a variety of well-known bitcoin investors, companies and venture groups including:  Andreessen Horowitz  BitGo  BitPay  Coinbase  Hudson River Trading  itBit’s Charles Cascarilla  Liberty City Ventures’ Emil Woods  RRE Ventures  Union Square Ventures  Xapo.  Move toward advocacy  The group’s emergence comes at a critical juncture for digital currency adoption as regulators and governments worldwide debate if and how the technology should be regulated.  Further, it joins other organisations also focused on bitcoin public policy, including fellow Washington DC-based Chamber of Digital Commerce, led by former Forbes correspondent Perianne Boring, and the industry's oldest support group, the Bitcoin Foundation.  Speaking to CoinDesk, Jeff Garzik explained that there is demand for more information about bitcoin, both on the policy front and beyond, and that as a result, new groups are being formed to fill this need.  Given the fact that regulators are still working out how they plan on defining digital currencies, he said that ""new policy research and study is needed"".  ""The time was really right for this effort,"" he argued.  Image via Shutterstock",POSITIVE,없음,BTC | BUSINESS | MARKET | REGULATION | RESEARCH,Stan Higgins,0,0,CoinDesk,https://coindesk.com/markets/2014/09/18/bitcoin-think-tank-coin-center-launches-with-star-studded-support,https://cdn.sanity.io/images/s3y3vcno/production/80c26468a9278a6aa1887ae755f004de45640e00-2560x1771.jpg?w=300&h=300&fit=crop
42397943,DbF8Q09kuKX2XWBxAbEiWO,1411071912,Optimism Grows as Isle of Man Bitcoin Conference Draws to Close,"The island's growth has been helped in recent years by the number of online gambling companies who base their operations there. The world's largest online poker firm, Poker Stars, for example, had only four staff when it started on the island, but employs nearly 300 people today, Corlett said.  ""We can now pat ourselves on the back for our successful e-gaming sector, but there were plenty of mistakes in the early days [...] But you have to take risks, we have tried to innovate responsibly, but we do need to protect our consumers and protect our reputation,"" he said.  Corlett underlined the importance of the ˝e-business˝ sector, which includes digital currency companies, in the projected growth of the island's economy.  ""It's front and centre for us as an economy and as a government. We need to create the right environment for e-business to thrive,"" he said.  Currency and beyond  Corlett's talk followed presentations by Bruce Fenton of the non-profit group Bitcoin Association and David Johnston of the Decentralised Applications Fund.  Fenton discussed the technological impact cryptocurrency will have, even if bitcoin as a currency doesn't take off, saying:  ""Some die-hard people in the bitcoin space think it's going to wipe out banks or governments or something like that. But, it doesn't have to come anything near that. The technology is here to stay.""  Johnston, however, explored the potential of applications built on top of the block chain, emphasising the myriad ways in which decentralisation could create value for users.  ""We now have lower level protocols, but it's starting to evolve into higher level applications that we can build on. We will see an explosion of decentralised applications,"" he said.  Business showcase  Before the talks, conference delegates could have face-to-face sessions with a variety of professional services providers based on the Isle of Man.  These included global consulting and accountancy firms like KPMG, a major sponsor of the conference, and local firms like Boston Trust, which provides consulting services to firms, especially in the online gambling sector.  Some local startups also set up booths in the courtyard of the Sefton Hotel, where the conference was located on its second day.  One of them was TGBEX, which makes physical bitcoins out of a variety of metals, including gold and silver. The firm was launching its products, hoping to start marketing in time for the Christmas gifting season, said co-founder Richard Owusu-Awuah.  Each coin is engraved with a map of the world, with a private key hidden behind a holographic sticker on the back. The public key is printed on the sticker.  Movie star entrepreneur  Delegates rolled into the conference following a dinner the previous night that featured a speech from GoCoin co-founder and active angel investor Brock Pierce.  Pierce took the podium in the restaurant of the Claremont Hotel after a trailer of the 1996 movie First Kid was played. The movie starred Sinbad as a bodyguard of the US president's son, played by Pierce.  ""I don't think I've seen any of my movies since I was 15 or 16 [years old], probably because I didn't want to be reminded of how bad I was,"" Pierce said of his early career as a child actor.  ""Talking about this can make me blush,"" he added.",POSITIVE,없음,BTC | BUSINESS | FIAT | REGULATION | SPONSORED,Joon Ian Wong,0,0,CoinDesk,https://coindesk.com/markets/2014/09/18/optimism-grows-as-isle-of-man-bitcoin-conference-draws-to-close,https://cdn.sanity.io/images/s3y3vcno/production/870ce88ab333b9d52d7db829e364884b57533031-2560x1920.jpg?w=300&h=300&fit=crop
42397934,DbF8Q09kuKX2XWBxAbEiPV,1411065941,Bitmarket.lt Takes Bitcoin's Fight Against Big Banks to Court,"A close look at recent headlines reveals the current reality for the bitcoin industry – that despite the potential world-changing promise of its underlying technology, its businesses are still facing hurdles when attempting to bring their products and services to market.  However, not all startups are taking the indecision of banks lightly.  Lithuania-based bitcoin startup Bitmarket.lt is fighting back against its former bank, Swedish financial services giant Swedbank, after it shut down the company's accounts. Launched in late 2013, the dispute created headlines in Lithuania, and as of September, it's still being fought in court.  Speaking to CoinDesk, founder Audrius Ramanauskas said that Bitmarket.lt has since found a stable banking partnership, but that now, he's carrying on the fight for the greater community good.  Ramanauskas told CoinDesk:  ""I want to fight for the bitcoin industry, at least in Lithuania. I would like to create precedent. I mean if we win against Swedbank, it will be easier for other players in this market and around the world.""  Legal issues aside, the 42-year-old serial entrepreneur has used his connections and business savvy to promote bitcoin in a part of the world where digital currency awareness remains low, most recently by signing notable national airline Air Lituanica to its payment processing service.  Despite the trials he's faced, Ramanauskas remains a bitcoin believer.  ""Bitcoin is the future of e-commerce payments,"" he said. ""So, I made a decision to start a bitcoin exchange and to promote bitcoin in Eastern Europe.""  Bitmarket.lt targets Europe  Though Bitmarket.lt has global ambitions, the startup is currently focused on providing bitcoin exchange and processing services to the Estonian, Latvian and Lithuanian markets.  Each market is home to a dedicated Bitmarket website – Bitmarket.lt, Bitmarket.lv and Bitmarket24.ee, which are united under the umbrella brand Bitmarket UAB, though the company promotes itself as Bitmarket.lt. The company is not affiliated with Bitmarket.pl.  Ramanauskas, however, is looking beyond providing basic services to these markets.  Founded in 2002, his online travel agency, Interneto Partneris recently launched Abitsky.com, a bitcoin-only airline booking service. Interneto Partneris UAB operates Bookinghouse.ee, Eticket.fi, Flyhi.se, and other travel services companies in 12 countries, and provides web service and ticketing solutions to Air Lituanica  For Ramanauskas, bitcoin is an extension of his history in the travel industry, where he saw Interneto Partneris bear the burden of significant expenses from bank transactions, currency exchange, fraud and other side effects of legacy banking.  Ramanauskas recalls:  ""Every month, my company was spending huge amounts of money on these costs. Keep in mind, that profit margins in travel are very small. Bitcoin can resolve these problems.""  Case against Swedbank  Lawyers representing Bitmarket.lt told CoinDesk that Swedbank opened the company's account in mid-November of last year, first allowing Bitmarket.lt to use it for money transfers. But, after just weeks, the account was closed, a fact Ramanauskas realized when his business payments were declined.  Jonas Bložė, a partner at Vilnius-based Zeta Law, told CoinDesk that he is confident his client has a case to overturn the decision because neither the EU or Lithuania has outlawed bitcoin.  Bložė said:  ""Even Lithuanian Bank (as supervising body) doesn’t have clear opinion regarding bitcoins, only guidance for consumers, who they say could be misguided because of bitcoin's volatility.""  Swedbank claims that Bitmarket.lt never revealed its intention to buy and sell bitcoin. Speaking to 15min.lt in December about the decision, the bank said that the account was closed because it was deemed high risk.  In a separate yet notable move, the bank also closed the account of one customer for selling bitcoin in October, 2013.  Confidence to win  To date, however, Bitmarket.lt has not fared well in court, losing its first round when the court deemed that bitcoin posed a significant risk for Swedbank due to its possible use for terrorism and money laundering.  Ramanauskas said Bitmarket.lt isn't optimistic that the case it will move forward soon, either, suggesting this could still take six to nine months. Bitmarket.lt has since filed an appeal of the original decision, and intends to return to court at the beginning of 2015.  Still, he is confident that Bitmarket.lt will triumph in its efforts, remarking:  ""Banks are not a government institution and do not have any right to decide. [...] Lithuanian law is quite strong describing what a bank can do or not do with clients' bank accounts. I strongly believe we will win this case, because we are absolutely right.""  Quotes from Ramanauskas and Bložė have been edited for clarity.  Images via Bitmarket.lt; Shutterstock",POSITIVE,없음,BTC | BUSINESS | EXCHANGE | FIAT | MARKET,Pete Rizzo,0,0,CoinDesk,https://coindesk.com/markets/2014/09/18/bitmarketlt-takes-bitcoins-fight-against-big-banks-to-court,https://cdn.sanity.io/images/s3y3vcno/production/1d5dd1b0a370eb4cf2e8dfae9bd80c55dee87c42-1267x625.jpg?w=300&h=300&fit=crop
42397932,DbF8Q09kuKX2XWBxAbEiNX,1411060874,CoinTerra Opens Pre-Orders for First 16nm Bitcoin ASIC,"CoinTerra has announced the AIRE Miner, the company’s first bitcoin miner based on 16nm silicon.  The Texas-based mining hardware maker said the AIRE will deliver a substantial increase in efficiency and performance when it ships in the first quarter of 2015, as the chip will be one of the first commercial products based on 16nm technology.  CoinTerra  CTO Timo Hanke framed the offering as one that would benefit the wider consumer market, saying:  ""With exceptional hashing performance and power efficiency, we are ready to put the power of high performance bitcoin mining back into the hands of bitcoin enthusiasts the world over.""  The SHIVA ASIC employed in the miner has not taped out yet, but the company said a date has been scheduled for late September.  Most bitcoin ASICs shipping today are based on the 28nm process. For example, KnCMiner launched the 20nm Neptune miner back in June, making it one of the first 20nm chips available on the market.  Unprecedented power efficiency  Cointerra said that moving to a new node allowed it design an ASIC capable of delivering “unprecedented” power efficiency. Further, it claims the new SHIVA ASIC delivers a five-fold increase in performance-per-watt.  The development of the 16nm SHIVA chip reportedly took more than nine months, for CoinTerra and its partner Global Unichip Corp, which designed the chip.  Louis Lin, vice president of Global Unichip’s design service, said working with CoinTerra on the state of the art 16nm ASIC design gave the company a “chance to push the boundaries of modern technology”.  The AIRE Miner is now available for pre-order, retailing for $2,499 plus shipping and handling.  New chip efficiencies in 2015  Looking ahead to 2015, many chipmakers are shifting their focus to 14nm and 16nm processes.  The need for such improvements was recently heightened by Apple’s launch of the A8 System-on-Chip, used in its iPhone 6 and iPhone 6 Plus smartphones. The sheer volume of Apple’s massive orders from Taiwan Semiconducor Manufacturing Company (TSMC) reportedly resulted in capacity issues for the foundry.  Earlier this year, the world's biggest foundry-for-hire revealed it will now be able to commence volume production of 16nm silicon in the first quarter of 2015, and the company is not alone.  Samsung and GlobalFoundries have teamed up for a 14nm push early next year. At the time, the companies said the new process would deliver 20% more performance, 35% better power efficiency and a 15% reduction in die size.  Intel launched its first 14nm processors at the Intel Developers Forum in San Francisco earlier this month. The first Core M processors (codenamed Broadwell) should appear in retail soon, though it should be noted Intel’s 14nm node is reserved solely for Intel products.  Image via Cointerra",POSITIVE,없음,ASIA | BTC | MARKET | MINING | REGULATION,Nermin Hajdarbegovic,0,0,CoinDesk,https://coindesk.com/markets/2014/09/18/cointerra-opens-pre-orders-for-first-16nm-bitcoin-asic,https://cdn.sanity.io/images/s3y3vcno/production/63105c6c09487a80bbb8639ec129600c77e0583d-1270x591.jpg?w=300&h=300&fit=crop
42397922,DbF8Q09kuKX2XWBxAbEiEg,1411057248,Isle of Man Residents Could Soon Settle Tax Bills in Bitcoin,"Isle of Man residents and businesses could soon have the option to pay their taxes in bitcoin, according to a government representative who indicated the option is under serious consideration.  ""Everything from paying your car tax to your income tax bill, we're seeking to operate a wider range of choices for citizens and businesses for how they can settle their account with the government,"" said Chris Corlett, chief executive of the government's department of economic development.  The island's government is currently inviting expressions of interest from payment services providers, including those dealing in digital currencies, so that they may be considered for inclusion in the payment options available. Companies must submit their expression of interest by noon of 3rd October.  Corlett said the number of new payment providers will not be capped, meaning multiple new providers could be selected. He also said a date for the selection of new providers had not been decided yet, although he noted the process typically takes about two months.  ""We'll need to ensure the organisations are suitably competent and all parties have their monies protected. This is the best way of showing we are open-minded about digital currencies,"" he said.  More payment methods needed  The Isle of Man is a self-governing dependency of the British crown. The local government currently takes payments in person, at counters around the island, where people can pay with debit and credit cards. It also accepts payments in the form of direct bank transfers.  Payment platforms like PayPal, which allow users to store payment details using an online wallet or to enable repeat payments, are not currently permitted to be used, according to the official noticehttps://www.gov.im/media/1345724/pin-notice-provision-of-pay-payment-merchant-services-closing-3-october-2014.pdf announcing the call for expressions of interest.  Rather, the government is seeking digital currency services that will let customers perform transactions at ""points of presence"", using card services or over-the-counter methods, as well as facilitating transactions online. The notice also says the government is seeking card services providers with points of presence and online capabilities.  ""Reassure us that you have the right KYC, AML and governance procedures that we can rely upon. If you convince Government Technology Services and Treasury of that, we can hopefully add several to our list of payment providers,"" said Corlett.  Government won't hold bitcoin  Corlett stressed that the government would not hold digital currencies, even if bills were settled that way. However, he said that the decision to seek digital currency payment solutions was a ""simple one"" and was not subject to much objection within the government.  ""There is an evolution here, given what we've learned about digital currencies in the last year, it was a relatively simple decision to take,"" he said.  Professional services providers on the island welcomed the announcement.  Kevin Perks, director at consultancy I-Cap, which provides services to companies looking to relocate to the Isle of Man, including several digital currency-related companies, was enthusiastic about the potential for digital currency payments to the government:  ""I think it's extremely bold. In terms of the day-to-day reality, I'm not sure how many people will actually choose to settle their bills in [cryptocurrency]. But it's about sending a message to the outside world, to say this jurisdiction is open to this type of business. It's part of a revolution.""  Corlett's announcement came as he gave the closing speech on the second day of Crypto Valley Summit, an event meant to focus attention on the island's attractiveness to cryptocurrency businesses.  Man selecting bitcoin image via Shutterstock",POSITIVE,없음,BTC | BUSINESS | FIAT | REGULATION | TECHNOLOGY,Joon Ian Wong,0,0,CoinDesk,https://coindesk.com/markets/2014/09/18/isle-of-man-residents-could-soon-settle-tax-bills-in-bitcoin,https://cdn.sanity.io/images/s3y3vcno/production/889fd246263cc09f6c42f1ce42971f1d547ed8d9-1300x866.jpg?w=300&h=300&fit=crop
