뉴스ID,뉴스GUID,일자(UTC timestamp),뉴스제목,본문,SENTIMENT,주요코인,카테고리,작성자,추천수,비추천수,출처,뉴스URL,이미지URL
42397334,DbF8Q09kuKX2XWBxAapfG7,1388498705,Bitcoin's Best Competitors: The Top Altcoins of 2013,"Bitcoin has dominated the headlines this year, with massive price fluctuations, regulatory developments, and even Senate hearings by the US government. All these factors indicate that people are beginning to take the young currency seriously.  But let's not forget about the alternative coins out there. 2013 has been a busy year for them, too. How have they fared? Though CoinDesk has covered some of these alternative coins in depth already, it is interesting to note which currencies have stood out from a market capitalization perspective this year.  Here are the six top altcoins of 2013, based on market capitalization figures from Dustcoin.  Litecoin  Market cap (BTC): 788,023  Much like bitcoin, litecoin's value has fluctuated wildly over the last few months. The altcoin spike in March and April, during the bitcoin bubble, demonstrated how closely linked litecoin is to the price of the incumbent top virtual currency. At the time, its value rocketed from approximately $0.05 to $5.00.  In November, prices spiked again – but far higher this time, reaching around $48 for a brief period, before slowly falling once more. Now, following bitcoin’s fall in value after China’s policy shifts on virtual currency, litecoin is hovering around the $22 mark.  All this interest in the currency has caused its difficulty to increase, tripling in the last two months. Litecoin's market capitalization has also skyrocketed. On 16th November, its market cap stood at around $95m. It may be on the same roller coaster ride as bitcoin, but as of now, it still stands at a very respectable $573.9m or so.  Peercoin (PPCoin)  Market cap (BTC): 126,411  Peercoin, the currency launched by the mysterious 'Sunny King', currently rests at just under one sixth the market cap of litecoin, making it the third-largest coin in existence.  Peercoin uses proof-of-stake, an alternative to the conventional proof-of-work mechanism used by bitcoin. It is designed to produce more coins automatically, based on the number of coins that a person already has in their possession.  John Manglaviti, previously the community relations leader for feathercoin, came on board earlier this year to try and breathe life into peercoin's community. Working with King (who focuses on technology development), he has recruited 120 volunteers for the currency. Most recently, Canadian exchange Vault of Satoshi announced that it would support peercoin, lending more credibility to the currency.  Namecoin  Market cap (BTC): 51,911  Namecoin is bouncing back from a nasty technical flaw it suffered late in 2013, which allowed anyone to take advantage of its domain naming system. The coin was designed to enable people to cryptographically store and transmit pairs of keys and values, in a system that enabled it to create a domain name system that was entirely decentralized. Its top-level domain is ‘.bit’, and it is effectively a form of dark web.  The currency operates on a merged mining basis with bitcoin, meaning that clients can be configured to check both the bitcoin and the namecoin block chains when solving proof-of-work problems.  Namecoin’s market capitalization stands at a little under half that of peercoin.  Worldcoin  Market cap (BTC): 31,370  Worldcoin's biggest claim to fame this year may have been its involvement with phenixcoin and feathercoin in UNOCS, the abortive attempt to create a bridge between these altcoins. While phenixcoin subsequently imploded after a prominent developer absconded with many peoples' coins, worldcoin continues to forge ahead.  Its goals are also very clear, with a stated claim to become the “cryptocurrency of choice for merchants and consumers”, with a 60-second confirmation time.  Feathercoin  Market cap (BTC): 13,045  Feathercoin, itself a relative newcomer to the market, was founded in April, and gained heavy traction as many people began mining and trading the currency.  With a market cap of just over 13,000 BTC, feathercoin is still a relative featherweight compared to bitcoin, but there's no denying that founder Peter Bushnell has done a good job of developing the coin. In turn, the community has gone from strength to strength.  Actually, that's not quite true. It went from strength to relative weakness after UNOCS collapsed, but has since gone back to strength again, regaining some of its former enthusiasm under the new community leadership of Chris Ellis.  In addition to a weekly newsletter to keep everyone abreast of events, there was also an Amsterdam conference. That itself was an interesting story, because the Amsterdam bitcoin-based event conference that feathercoin members were supposed to attend was reportedly canceled. So they just organized another onehttp://forum.feathercoin.com/index.php?topic=4307.0, with both physical and virtual attendees. And it did so in just a couple of days.  This seems to be the story of feathercoin. It is a plucky little currency, with a very dedicated following, and able to weather apparently any storm, including the 51% attack that someone threw at it earlier in the year (Bushnell simply bought peercoin’s Sunny King on board and had him help secure the block chain with a feature called advanced checkpointing, which was built into the client’s code).  Since it was launched, feathercoin has also established its own nascent eBay-style marketplace, and there is now a Local Feathercoins website, enabling people to trade coins directly with each other. Someone is developing a physical version of feathercoin, potentially with an NFC reader embedded in it, and another enthusiastic developer is working on a proposal to put metadata in the block chain, to assist with the transmission of files. There's lots going on here.  Dogecoin  Market cap (BTC): 10,421  Market capitalization figures at Dustcoin show dogecoin in seventh place overall, just behind feathercoin. It's a currency based around a meme, it's been around for about five minutes, and has already been accepted by Cryptsyhttps://www.cryptsy.com/markets/view/132, which is now trading it. The price spiked at least 400% in mid-late December, and what's interesting is how this bizarre phenomenon bucked the trend and continued to rise even after bitcoin’s value fell in the wake of the China fiasco. There are few other altcoins that can make that claim. Dogecoin's value and place in this list did, however, slip after a Christmas holiday ""hacking incident"" that saw a total of 21m dogecoins disappear from users' wallets.  Dogecoins are being traded for bitcoins, which means they have a market cap which currently stands at 10,421 BTC, or a little over $7.8m at the time of writing. That’s partly because, while the value of the coins is still relatively low, there are a lot of them. At least an eighth of the coins (which a total limit of 100 billion), have already been mined. Not bad, for a currency based on a dog joke.  Bitcoin may be the incumbent top virtual currency, but there is no doubt that there are many alternative coins with a lot to offer, if nothing other than inspiring communities dedicated to their survival. It's been a busy 2013. What will the next year bring?  *All market capitalization figures accurate as of time of writing  Coin grab image via Shutterstock",NEUTRAL,BTC,ALTCOIN | BTC | LTC | MARKET | TRADING,Danny Bradbury,0,0,CoinDesk,https://coindesk.com/markets/2013/12/31/bitcoins-best-competitors-the-top-altcoins-of-2013,https://cdn.sanity.io/images/s3y3vcno/production/b1eb9ecdfc3d9c6480c809fccc7b1f5b631e024f-1000x623.jpg?w=300&h=300&fit=crop
42397346,DbF8Q09kuKX2XWBxAapfQw,1388493031,Clipperz Password Manager Only Accepts Bitcoin,"The open source Clipperz password manager focuses on complete user privacy and only accepts bitcoin as a form of payment.  “Bitcoin pseudonymity gives any user the option to make it very hard for everyone to create a link between his/her bitcoin payment and his/her data stored on Clipperz servers,” says Marco Barulli, who is one of the co-founders.  “It gives any user the option to make it very hard for everyone to create a link between his/her bitcoin payment and his/her data stored on Clipperz servers.”  Clipperz  is different to other password managers on the market today because it doesn’t want to know anything about its users. Barulli said:  “Clipperz doesn't require any personal data to setup an account, not even your email address. Actually not even the username you select is known. We want to learn nothing about our users.”  Barulli says that eschewing the collection of any shred of personally identifiable information by Clipperz means less chance of a security vulnerability.  “Anonymity of data is not an ideological position. Anonymity is extremely important from a security point of view. Linking your encrypted data stored with Clipperz to your real identity widens the range of potential attacks,” he said.  And while some security-minded software can be difficult to use, Clipperz is built upon open web standards, making it easy for the masses to utilize.  “Clipperz is purely web based. It runs on most browsers and on all platforms, both desktop and mobile,” Barulli said.  “We believe that convenience and ease of use is an important part of security. And the browser is ... an ideal place to run crypto-based services.”  The company made the headlines recently by moving its hosting servers over to Iceland after running into some issues with Italian authorities, which claimed some suspicious wire transfers had taken place. The complete story is posted on its official blog.  The idea is that Iceland has amenable laws that protect the existence of privacy-minded software such as Clipperz. The Icelandic Modern Media Initiative,https://immi.is/index.php/projects/immi or IMMI, is legislation that has been passed in that country to help protect certain media freedoms that may prove beneficial to Clipperz.  “Our understanding is that IMMI will require a foreign court to prove ‘beyond a reasonable doubt’ that a certain server is storing data or providing services that are part of a criminal conduct,” said Barulli.  Bitcoin is the only payment option users have to support the Clipperz effort, which has been solely via donations. Barulli says that Clipperz could also accept other pseudonymous cryptocurrencies as a form of payment at some point. But it is not in the works right now.  “This is not in our current plans. Let's start with bitcoin and see what happens. We are certainly open to alternatives.”  Barulli himself first discovered bitcoin a few years ago. He has found it one of the best innovations for serving those without access to financial tools such as banks.  “I was first intrigued by bitcoin during winter 2010. I even installed the client on my old PC and did some mining for a few months.”  “I was, and still am, mostly excited by the potential of bringing payment services to the unbanked of the world,” he said.  Donations have supported Clipperz up to this point, but the company is implementing a paid model soon. Users will still be able to try the software for free during a trial period.  This article should not be viewed as an endorsement of Clipperz, please do your own research before using this service.  Username and password image via Shutterstock",POSITIVE,없음,BTC | MARKET | MINING | REGULATION | TECHNOLOGY,Daniel Cawrey,0,0,CoinDesk,https://coindesk.com/tech/2013/12/31/clipperz-password-manager-only-accepts-bitcoin,https://cdn.sanity.io/images/s3y3vcno/production/7ba6072c3c658be3dd5105702594099f0750405f-1000x664.jpg?w=300&h=300&fit=crop
42397330,DbF8Q09kuKX2XWBxAapfCB,1388490605,Taiwan Welcomes New Year with Bitcoin Warning,"The Financial Supervisory Commission of the Republic of China and the Central Bank of the ROC have issued a joint statement warning against the use of bitcoin in Taiwan. The regulators said bitcoin remains volatile, that it does not have any legal protection, and that it is not issued by a monetary authority.  The regulators noted that bitcoin trading is highly speculative and that investors should be wary of volatility, cyber attacks, malicious defaults, theft and other risks. Apart from the now more-or-less standard list of warnings and concerns, the regulators also announced that they may take “necessary steps” if financial institutions engage in bitcoin operations, reported Taipei Times.  The reference starts to make sense when we consider that SinoPac Financial Holding Co. was an early supporter of bitcoin, allowing investments in bitcoins and trying to increase its popularity and use in e-commerce.  The regulators also warned that there is no guarantee of conversion:  “Bitcoin holders are on their own, as the currency is not issued by any monetary authority and is therefore not entitled to legal claims or guarantee of conversion.”  The warning comes as no surprise, as similar warnings have already been issued by regulators across the world. Last month Central Bank Governor Perng Fai-nan hinted at possible regulatory moves, saying that the bank is keeping a close eye on bitcoin development. At the time he compared bitcoin transactions to deals in precious metals.  Another interesting trend emerged over the last couple of weeks and it could have motivated Taiwanese regulators to react. After the Chinese central bank clamped down on local exchanges, one Taiwanese e-tailer decided to cash in, pledging to support bitcoin transactions as of early 2014. Wayi International Digital Entertainment hoped the China ban would simply drive shoppers to its new e-commerce site. This may be a shot across the bow to other merchants who were hoping to make some quick money following the ban in mainland China.",NEGATIVE,없음,ASIA | BTC | BUSINESS | FIAT | REGULATION,Nermin Hajdarbegovic,0,0,CoinDesk,https://coindesk.com/markets/2013/12/31/taiwan-welcomes-new-year-with-bitcoin-warning,https://cdn.sanity.io/images/s3y3vcno/production/201a64ee735d71ce9b856cd6aab633add587ff1e-1000x772.jpg?w=300&h=300&fit=crop
42397348,DbF8Q09kuKX2XWBxAapfTt,1388469633,From China to Cyberspace: Bitcoin's Year in Review,"Welcome to CoinDesk's Yearly Review 2013 – a look at the five hottest, most controversial and thought-provoking events in the world of digital currency through the eyes of skepticism and wonder. Your host … John Law.      It is a legal requirement for journalists to write an end-of-year roundup, and John Law is nothing if not law-abiding. One valid set of stories would read along the lines of:      January – collapse of bitcoin predicted!      March – price goes up.      May – collapse of bitcoin predicted!      July – price shoots up!      October – collapse of bitcoin predicted!      December – bitcoin collapses … oh no, wait a moment, it’s still here!      Yet it's true. The biggest single story in 2013, bitcoin’s most tumultuous year to date, is just that: it’s still here. And more than just 'still here'. For those who think that the most important aspect of the cryptocurrency is its dollar price, it’s here with nearly sixty times its $13 valuation at the end of 2012.      Not that it’s all been good news: it’s at around half its peak price of around $1,100 at the end of November. So, how did that happen – and what fun did we have along the way? Here are bitcoin's five biggest moments.    1. China    Bitcoin started 2013 as a four-year-old curiosity, albeit one that was starting to be taken seriously by the sane. It ended the year as a top-level item on the agenda of the world’s greatest economies: nowhere more dramatically than in China.      While it is too soon to write the definitive story of bitcoin’s annus mirabilis, the evidence is strong that a lot of its increasing heft was through widescale adoption by individuals and businesses in China.      There are plenty of possible drivers behind this, including the difficulty of trading yuan and that currency’s over-valuation, which makes it an unattractive vehicle for speculators and savers – especially those within the republic.      Other options are limited: China remains, lest we forget, the world’s largest authoritarian non-democratic state. It is not a free country. The introduction of the libertarian-scented, government-goosing bitcoin is thus a history-grade experiment in immovable objects and irresistible forces.      It’s an experiment that has been gratefully adopted by the Chinese, who became the majority traders in bitcoin mid-year – fuelled, interestingly, by state TV running short programmes explaining what it was and how it worked. Someone somewhere wanted that to happen.      While it’s hard to say just how much this movement pushed bitcoin up, it’s easy to find the cause of the end-of-year crash: the Chinese government told its banking systems not to support yuan-bitcoin trades. Someone somewhere wanted that to stop.      One cannot plumb the 'who' or 'why' of Chinese state fiscal policy, only – fitfully – the 'what'. This remains one of the core paradoxes in the rise of the Chinese economy as a global force: dealing with someone who not only hides their cards but the rules by which they’re playing is not, in the long term, a good bet.      But the power of the bitcoin mosquito to sting the hide of the Communist elephant (and to survive the slap of the trunk) is not only the cryptocurrency’s best story of 2013, it’s one of the most intriguing developments this year by any measure.    2. Newport    Newport resident and hapless tech fiddler James Howells idly mined over 7000 btc in 2009, then forgot all about them until 2013 – sadly, a few weeks after he’d thrown away the most expensive hard drive in history.      At best, the storage device with millions of dollars hidden in its megabytes was probably still intact, just under six feet of Welsh household waste in his local tip. However, the council wouldn’t let him in to look.      This story caught the imagination of the general public more than any other, at least by the lopsided metric of how many people wanted to talk to John Law about it.      It had everything – incomprehensible tech matched to human fallibility, with the tantalising prospect of redemption still up for grabs. Had the hard drive gone into an incinerator, the tale wouldn’t have had nearly so much traction.      It’s a bit more than just an amusing tale of someone else’s misfortune, though. It raised the profile of bitcoin still further, slipping in the idea that it was something that ordinary people could be a part of and that it had a certain durability – the expectation that it would have survived the garbage of Gwent won’t have been lost on readers.      From the sublime reaches of geopolitical fiscal intrigue, to the corporation rubbish dumps of South Wales: bitcoin bestrides the globe.    3. Vancouver    Another small story – man installs ATM machine in Canadian coffee shop – is much, much bigger than it seems. The man is Robocoin CEO Jordan Kelley, and the machine is the world’s first bidirectional bitcoin ATM (meaning it can sell you bitcoins for cash, or give you cash for bitcoins).      It went on to take more than $1,000,000 in its first month, not bad trade for a coffee shop, even in Vancouver. What makes this an October revolution, though, isn’t that it demonstrates a thirst for bitcoin that exceeds even that of hipsters for caffeine, but that it bypasses the only effective tool native states have for controlling cybercurrencies.      The Canadian government (or the Chinese, or the Global Illuminati Conspiracy) can tell banks to refuse to accept payments that are connected to bitcoin. However, they can’t ask them not to take cash.      So, if you want your bitcoin, you can pop into your local espressery and get some: the ATM owner gets a bunch of cash. Job done.      Can ATMs be controlled? They can, if they’re connected to the global banking system. These aren’t.      Can they be banned? Sure, but since they’re very easy to build and install without telling anyone, and can be made extremely portable, and don’t of themselves break any laws, that’s not a simple process to put in place without banning bitcoin itself – and near-impossible to enforce.      What makes John Law particularly keen on this approach is that it doesn’t scale to speculator level. It’s great for bitcoin as an insanely low-cost, personal way of buying stuff over the Internet or across borders, which is where its future lies once the shouting dies down, but not if you want to manage a multimillion bitcoin fund.      Sorry, Winklevii. Have a nice cup of coffee.    4. New York    Not that there was a lack of big stories that looked just as important as they really were.      There is a technical term for markets, capitulation, which means what it sounds like: after fighting a certain result for a while, the market gives in, lets it happen and takes its lumps.      Capitulation is the best way to describe what happened in New York in November, when a Senate hearing into this whole darn bitcoin thing was preceded by the head of the US Federal Reserve, Ben Bernanke, saying that it (bitcoin, not the Senate) had legitimate uses.      There were warnings aplenty about the dark side of the bitcoin force, and much discussion about what regulation will look like: there’s every chance that bitcoin will be larded about with as much statutory baggage as the regulators think it can carry without encouraging normal people to become scofflaws.      But the message from the world’s most important people when it comes to money: ""Yeah, it’s here. It won’t go away, it works, and we’ll have to make the best of it.""      Which, for a young invention implicated in blackmail, drug running and people who read Ayn Rand, is as good as it gets.      This was the biggest regulatory news of the year for bitcoin, whose practical future will be all about the regulations – poor thing. But John Law recommends you take a few minutes to read the same sort of news coming in from across the globe. China might be big, and America may be bigger, but the world is bigger – and for a stateless currency, that’s its true home.    5. Cyberspace    Lest you think all is bright and shiny in bitcoinland, now that the Silk Road has been rendered impassable and you can buy a nice wine to go along with your steak instead of some LSD, the last of John Law’s top stories is an ongoing report from the front line of cybercrime.      In October, a new piece of Internet-carried malware named CryptoLocker was discovered. By November it had hit the radars of top crime fighters. By the end of 2013, it had infected an estimated quarter of a million PCs and bilked its victims for millions, possibly hundreds of millions, of dollars.      It works by surreptitiously encrypting your computer files, then popping up and demanding a ransom paid in bitcoin. Three months after it began, it’s still going strong and nobody seems much closer to catching those responsible.      If there is some good news, it’s that the bitcoin transfer system has shown that the evildoers are most likely operating from Russia. Unlike the Dread Pirate Roberts, they’re good at covering their tracks.      Indeed, with the chutzpah of true gangsters, they even offer customer support, and have been interacting with victims through public bitcoin forums, Early rumours that files wouldn’t be decrypted proved false - these chaps care about customer satisfaction.      Bitcoin’s role in this isn’t vital: the villains offer an alternative way to pay, and similar bits of bad software have been produced well before the advent of the cryptocurrency. What it does offer is a rapid, efficient route to payment – and thus multiplied their take. It made the effort much more worthwhile. This won’t have gone unnoticed by their pals.      Still, the loot hasn’t been disposed of yet – and that will expose the gang to more scrutiny. The feds didn’t need to break bitcoin to squelch the Silk Road: they used good old-fashioned gumshoe work, with a bit of help from their spook friends.      That’s the overall picture from 2013: bitcoin can change the rules but doesn’t have to break them – and it’s not going away anytime soon. Here’s to 2014. Just don’t expect another 55x jump in value.      John Law is an 18th century Scottish entrepreneur, financial engineer and gambler. Having reformed the French economy, invented paper currency, state banks, the Mississippi Bubble and other ideas essential to modern economics, he took three hundred years off in a small cottage outside Bude. He has returned to write for CoinDesk on the foibles of digital currency.      China, Rubbish Dump, Coffee Beans, New York and Hostage Images via Shutterstock",NEUTRAL,없음,ASIA | BTC | MARKET | REGULATION | TRADING,John Law,0,0,CoinDesk,https://coindesk.com/markets/2013/12/31/from-china-to-cyberspace-bitcoins-year-in-review,https://cdn.sanity.io/images/s3y3vcno/production/a7cee63ea24a108e54a0565cc1c38977a6328d96-1000x768.jpg?w=300&h=300&fit=crop
