뉴스ID,뉴스GUID,일자(UTC timestamp),뉴스제목,본문,SENTIMENT,주요코인,카테고리,작성자,추천수,비추천수,출처,뉴스URL,이미지URL
13467544,https://www.cryptonewsz.com/?p=27907,1561455712,Tron To Buyback TRX Up To $20 Million; Will Do It In Phases For A Year,"It&apos;s Tron Independence Day and new announcements are expected to pour in. One of the important news coming out is that Tron will buyback TRX worth up to $20 million. The buyback will take place for a year, in a phased manner. Justin Sun, founder of Tron stated that this will be the biggest TRX …The post Tron To Buyback TRX Up To $20 Million; Will Do It In Phases For A Year appeared first on CryptoNewsZ.",POSITIVE,TRX,TRX,,0,0,CryptoNewsZ,https://www.cryptonewsz.com/tron-to-buyback-trx-up-to-20-million-will-do-it-in-phases-for-a-year/27907/,https://images.cryptocompare.com/news/cryptonewsz/8loewv9J69A.jpeg
13467545,https://www.cryptonewsz.com/?p=27914,1561455699,"EOS Price Analysis: EOS Price On Recovery Mode, Expected To Regain Momentum","EOS reflects a recovery from yesterday&apos;s price. The selling pressure deflects from EOS EOS is moving in the right direction for intraday trading. The coin is reflecting a slight recovery. The same is likely to continue for the rest of the day. The coin usually moves in the direction of Bitcoin, and today, BTC is …The post EOS Price Analysis: EOS Price On Recovery Mode, Expected To Regain Momentum appeared first on CryptoNewsZ.",POSITIVE,BTC,BTC | MARKET | TRADING,,0,0,CryptoNewsZ,https://www.cryptonewsz.com/eos-price-analysis-eos-price-on-recovery-mode-expected-to-regain-momentum/27914/,https://images.cryptocompare.com/news/cryptonewsz/eN0gwwMw800.jpeg
13467546,https://www.cryptonewsz.com/?p=27909,1561454882,"Dash Price Analysis: Price Upsurge in Dash, leads to touch $180","Dash is riding the bull on the chart. The price is moving up with every passing moment. Yesterday, when all the coins were dropping, Dash was moving up. The momentum in Dash has improved and looks like the coin will give huge dividends to the investors. The market usually reacts according to Bitcoin, and the …The post Dash Price Analysis: Price Upsurge in Dash, leads to touch $180 appeared first on CryptoNewsZ.",POSITIVE,없음,BTC | BUSINESS | MARKET | TRADING,,0,0,CryptoNewsZ,https://www.cryptonewsz.com/dash-price-analysis-price-upsurge-in-dash-leads-to-touch-180/27909/,https://images.cryptocompare.com/news/cryptonewsz/e10y0200000.jpeg
13358976,https://cointelegraph.com/news/new-35-raspberry-pi-is-the-most-powerful-yet-for-running-a-full-bitcoin-node,1561454520,New $35 Raspberry Pi is the Most Powerful Yet for Running a Full Bitcoin Node,"The Raspberry Pi Foundation released a new, more powerful model of its miniscule single-board computer, which costs $35 a pop and can run full nodes on the bitcoin network",POSITIVE,없음,BTC,,0,0,CoinTelegraph,https://cointelegraph.com/news/new-35-raspberry-pi-is-the-most-powerful-yet-for-running-a-full-bitcoin-node,https://images.cryptocompare.com/news/cointelegraph/ekgka000000.png
13410400,https://cryptopotato.com/?p=33842,1561454409,VeChain Partners Up With Walmart For Blockchain Food Tracking: VET Price Surges 32%,"The Senior Director of Emerging Technology Labs at Big Four accounting and auditing company PricewaterhouseCoopers (PwC), has announced that Walmart will be partnering up with the popular blockchain project VeChain (VET). Following the announcement, VET surged more than 32 percent in an instant. Big News For VeChain Tom Foth, the Senior Directo at the Emerging ...The post VeChain Partners Up With Walmart For Blockchain Food Tracking: VET Price Surges 32% appeared first on CryptoPotato.",POSITIVE,VET,BLOCKCHAIN | TECHNOLOGY | TRADING | VET,,0,0,Crypto Potato,https://cryptopotato.com/vechain-partners-up-with-walmart-for-blockchain-food-tracking-vet-price-surges-32/,https://images.cryptocompare.com/news/default/cryptopotato.png
13467547,https://www.cryptonewsz.com/?p=27872,1561454162,Litecoin Price Analysis: Litecoin’s Slow Yet Steady Gain Anticipates a Bullish Run,"Litecoin (LTC) has shown five price swings in the last 24 hours. The 2019 target is unchanged at 200 USD. Litecoin (LTC) is one of the major coins of current times, and it is being valued with a stable pace against many major cryptocurrencies. But it has given some tough times to the intraday traders …The post Litecoin Price Analysis: Litecoin&apos;s Slow Yet Steady Gain Anticipates a Bullish Run appeared first on CryptoNewsZ.",POSITIVE,LTC,LTC | MARKET | TRADING,,0,0,CryptoNewsZ,https://www.cryptonewsz.com/litecoin-price-analysis-litecoins-slow-yet-steady-gain-anticipates-a-bullish-run/27872/,https://images.cryptocompare.com/news/cryptonewsz/800w00w00wg.jpeg
13467548,https://www.cryptonewsz.com/?p=27899,1561453797,"More Than Its Own Platform, Libra Will Be Beneficial For Blockchain Systems And Bitcoin","Libra is touted to be the next big thing in the world of crypto and blockchain. The kind of backing it has is unprecedented in the industry, and the user base is humongous. However, many experts believe that more than itself, Libra will benefit other blockchain systems and Bitcoin. For example, Ethereum co-founder and ConsenSys …The post More Than Its Own Platform, Libra Will Be Beneficial For Blockchain Systems And Bitcoin appeared first on CryptoNewsZ.",POSITIVE,없음,BLOCKCHAIN | BTC | ETH,,0,0,CryptoNewsZ,https://www.cryptonewsz.com/more-than-its-own-platform-libra-will-be-beneficial-for-blockchain-systems-and-bitcoin/27899/,https://images.cryptocompare.com/news/cryptonewsz/cwA02ywg011.jpeg
13467549,https://www.cryptonewsz.com/?p=27819,1561453648,Golem Price Analysis: Will Golem (GNT) Continue To Be A Profitable Investment?,One of the more ambitious blockchain project launched in recent times GNT price seems to be moving towards stability Golem released in 2016 aims to provide an alternative to big data solutions on the blockchain platform. The system works by exchanging computing power for GNT through an interface. Golem aims to solve real market problems …The post Golem Price Analysis: Will Golem (GNT) Continue To Be A Profitable Investment? appeared first on CryptoNewsZ.,POSITIVE,없음,BLOCKCHAIN | MARKET | TRADING,,0,0,CryptoNewsZ,https://www.cryptonewsz.com/golem-price-analysis-will-golem-gnt-continue-to-be-a-profitable-investment/27819/,https://images.cryptocompare.com/news/cryptonewsz/e0y80000000.jpeg
13467550,https://www.cryptonewsz.com/?p=27893,1561453631,Local Chinese Startups Leave IBM And Oracle In The Dust,The trade war between the United States and China is expected to continue for the foreseeable future and it has had far-reaching effects across a range of industries so far. One of the most interesting developments in that regard is the way in which local Chinese tech startups have now managed to upstage global behemoths …The post Local Chinese Startups Leave IBM And Oracle In The Dust appeared first on CryptoNewsZ.,POSITIVE,없음,ASIA,,0,0,CryptoNewsZ,https://www.cryptonewsz.com/local-chinese-startups-leave-ibm-and-oracle-in-the-dust/27893/,https://images.cryptocompare.com/news/cryptonewsz/a8000000000.jpeg
13467551,https://www.cryptonewsz.com/?p=27874,1561452645,Date Set For Beta-Testing of Bakkt Bitcoin Futures; Is Crypto Market All Set?,"According to the latest reports, Bakkt is all set to begin the beta testing of its Bitcoin futures on 22nd July on the exchange of ICE, i.e., Intercontinental Exchange. This endeavor has been delayed for long and the entity is yet to announce the final date of launch. In addition to that, reports were doing …The post Date Set For Beta-Testing of Bakkt Bitcoin Futures; Is Crypto Market All Set? appeared first on CryptoNewsZ.",POSITIVE,없음,BTC | EXCHANGE | MARKET,,0,0,CryptoNewsZ,https://www.cryptonewsz.com/date-set-for-beta-testing-of-bakkt-bitcoin-futures-is-crypto-market-all-set/27874/,https://images.cryptocompare.com/news/cryptonewsz/9$4gApy906g.jpeg
13467552,https://www.cryptonewsz.com/?p=27883,1561452464,Ripple (XRP) Price Analysis: XRP/USD Struggles to Remain Above $0.47,"Ripple price rallied above $0.47 yesterday XRP/USD moves up to cross major resistance above $0.46 Today, over the last 4 hours, XRP coin returns back to $0.46 price range near its key support level Ripple is currently correcting upwards after reaching as low as 0.465 Yesterday&apos;s price surge of XRP against U.S Dollar has turned …The post Ripple (XRP) Price Analysis: XRP/USD Struggles to Remain Above $0.47 appeared first on CryptoNewsZ.",NEUTRAL,XRP,FIAT | MARKET | TRADING | XRP,,0,0,CryptoNewsZ,https://www.cryptonewsz.com/ripple-xrp-price-analysis-xrp-usd-struggles-to-remain-above-0-47/27883/,https://images.cryptocompare.com/news/cryptonewsz/ej0c1Mw0148.jpeg
42430669,sd6iOBkuiC3F0LYOyMwdhh,1561452044,JPMorgan to Start Customer Trials of Its 'JPM Coin' Crypto,"JPMorgan Chase is to start trials of its ""JPM Coin"" cryptocurrency in conjunction with corporate clients.  According to a report from Bloomberg Japan on Tuesday, Umar Farooq, the investment bank's head of digital treasury services and blockchain, said that customers would trial the technology with the ultimate aim of speeding up transactions, such as payments between firms and bond transactions.  The trials are being conducted on the assumption regulatory permission will ultimately be granted, according to Bloomberg.  First revealed in February, JPM Coin initially runs on top of Quorum, a private version of ethereum developed by the bank.  JPM Coin will function as a stablecoin, with fiat cash being deposited at the bank in exchange for the token, which can then be transferred via a permissioned distributed ledger. The recipient can later redeem the token for cash from JPMorgan.  Initially linked to the U.S. dollar, the coin is expected to be extended to other fiat currencies in time. Real-world trials were expected in “a few months,” according to a report at the time.  Discussing JPM Coin's state of development, Farooq told Bloomberg in today's report: “The technology is very good, but it takes time in terms of licensing and approval. It must be explained.""  As well as inter-firm remittances, he said that the cryptocurrency could be used to settle bonds and commodities transactions. Clients in regions including Europe, the US and Japan have already shown interest, according to Farooq. He would not name any companies involved in the upcoming trials, the report states.  JPMorgan Chase image via Shutterstock",POSITIVE,없음,ASIA | BLOCKCHAIN | ETH | FIAT | TECHNOLOGY,Daniel Palmer,0,0,CoinDesk,https://coindesk.com/markets/2019/06/25/jpmorgan-to-start-customer-trials-of-its-jpm-coin-crypto,https://cdn.sanity.io/images/s3y3vcno/production/7f3fb2c9740fc0e9d251fab0d366ee1ea7a2c9ba-1500x651.jpg?w=300&h=300&fit=crop
13410401,https://cryptopotato.com/?p=33020,1561452022,The 2018 Crypto Bear Market Was Perfect For Us: ETHLend’s Founder Stani Kulechov (Special Interview),"With the prevalence of lending in the traditional financial world, it makes sense that lending activities and services would surface in the cryptocurrency space as well. CryptoPotato recently caught up with Aave&apos;s CEO Stani Kulechov, and the interview took place in the middle of the Mediterranean on board a Royal Caribbean cruise during Coinsbank&apos;s recent Blockchain ...The post The 2018 Crypto Bear Market Was Perfect For Us: ETHLend&apos;s Founder Stani Kulechov (Special Interview) appeared first on CryptoPotato.",POSITIVE,없음,BLOCKCHAIN | MARKET | TRADING,,0,0,Crypto Potato,https://cryptopotato.com/the-2018-crypto-bear-market-was-perfect-for-us-ethlends-founder-stani-kulechov-special-interview/,https://images.cryptocompare.com/news/cryptopotato/82000000000.jpeg
13467553,https://www.cryptonewsz.com/?p=27875,1561451848,Ethereum Classic Price Analysis: Ethereum Classic (ETC) Touches $9 After Days Of Struggle,Ethereum Classic (ETC) goes beyond 9 USD mark. The target price for 2019 should be 20 USD. Ethereum Classic has been slowly making its mark on the crypto market by taking small steps at a time. The coin has been stable for a large part of this year. It has shown only 4 major price …The post Ethereum Classic Price Analysis: Ethereum Classic (ETC) Touches $9 After Days Of Struggle appeared first on CryptoNewsZ.,POSITIVE,ETC,ETC | MARKET | TRADING,,0,0,CryptoNewsZ,https://www.cryptonewsz.com/ethereum-classic-price-analysis-ethereum-classic-etc-touches-9-after-days-of-struggle/27875/,https://images.cryptocompare.com/news/cryptonewsz/8u6uEpx88s4.jpeg
13467554,https://www.cryptonewsz.com/?p=27869,1561451764,Fake Websites Tries To Steal The Investors’ Attention From Libra,"Facebook has a massive presence in most of the developing economies. In some parts of the world, it is synonymous to the internet. Seeing this enormous presence, some envious money makers tried to draw the attention of Libra enthusiast with fake websites. Until now, Libra has not been launched officially by Facebook but has gained …The post Fake Websites Tries To Steal The Investors&apos; Attention From Libra appeared first on CryptoNewsZ.",NEGATIVE,없음,BUSINESS,,0,0,CryptoNewsZ,https://www.cryptonewsz.com/fake-websites-tries-to-steal-the-investors-attention-from-libra/27869/,https://images.cryptocompare.com/news/cryptonewsz/8z78020220A.jpeg
13231930,https://www.newsbtc.com/?p=387357,1561451448,"Bitcoin up 250% From Bottom, Same Again to $40,000 BTC","A big bullish weekend is usually followed by a red Monday for bitcoin and crypto markets but this has yet to materialize. BTC has continued to climb and is now back at its 2019 and fifteen month high again. Further gains are likely and if Bitcoin can repeat is previous six month&apos;s performance big things...The post Bitcoin up 250% From Bottom, Same Again to $40,000 BTC appeared first on NewsBTC.",POSITIVE,BTC,ALTCOIN | BTC | MARKET | TRADING,,0,0,NewsBTC,https://www.newsbtc.com/2019/06/25/bitcoin-up-250-from-bottom-same-again-to-40000-btc/,https://images.cryptocompare.com/news/newsbtc/dVJcFc80200.jpeg
13285849,https://ambcrypto.com/?p=98583,1561451437,"Non-sovereign money like Bitcoin is going to become more important, claims Circle’s Jeremy Allaire","Bitcoin [BTC] and the rest of the cryptocurrency market has been on an uptrend for the past couple of months, with several people calling the December low as its bottom. Additionally, the coin also rose to its 15-month high. Jeremy Allaire, CEO of Circle, spoke about the market&apos;s upward price movement over the past three ...The post Non-sovereign money like Bitcoin is going to become more important, claims Circle&apos;s Jeremy Allaire appeared first on AMBCrypto.",POSITIVE,BTC,BTC | MARKET | TRADING,,0,0,AMB Crypto,https://ambcrypto.com/non-sovereign-money-like-bitcoin-is-going-to-become-more-important-claims-circles-jeremy-allaire/,https://images.cryptocompare.com/news/ambcrypto/c0If0a0wI1w.jpeg
13467555,https://www.cryptonewsz.com/?p=27854,1561451186,Lisk Price Analysis: Lisk (LSK) Is Taking Small Leaps To A Bright Future,"YTD price indicates the upward price momentum for LSK at a steady pace Year-end target price stays between $3 -$4 Lisk (LSK) users can advantage of the platform&apos;s framework and tools to create customized decentralized applications. With its focus on the JavaScript programming language, Lisk aims at becoming the developer&apos;s first choice for creating dApp …The post Lisk Price Analysis: Lisk (LSK) Is Taking Small Leaps To A Bright Future appeared first on CryptoNewsZ.",POSITIVE,없음,MARKET | TRADING,,0,0,CryptoNewsZ,https://www.cryptonewsz.com/lisk-price-analysis-lisk-lsk-is-taking-small-leaps-to-a-bright-future/27854/,https://images.cryptocompare.com/news/cryptonewsz/dyRioN9Awgg.jpeg
13467556,https://www.cryptonewsz.com/?p=27850,1561450701,Smaller Rival Altran Merges with Capgemini in 3.6 Billion Euros Deal,"When it comes to the biggest companies in the world of consulting and technology, the idea of acquisition in order to keep growing is a well-known strategy and that has been even more prevalent in recent years. In a new development, French consultancy and information technology giant Capgemini has struck a deal worth 3.6 billion …The post Smaller Rival Altran Merges with Capgemini in 3.6 Billion Euros Deal appeared first on CryptoNewsZ.",NEUTRAL,없음,TECHNOLOGY,,0,0,CryptoNewsZ,https://www.cryptonewsz.com/smaller-rival-altran-merges-with-capgemini-in-3-6-billion-euros-deal/27850/,https://images.cryptocompare.com/news/cryptonewsz/caQw8100Ah0.jpeg
13358977,https://cointelegraph.com/news/there-are-now-more-than-5000-bitcoin-atms-around-the-world,1561450560,There Are Now More Than 5000 Bitcoin ATMs Around The World,"As bitcoin price soars, the ATM market is hitting its own records this week",POSITIVE,없음,BTC | MARKET | TRADING,,0,0,CoinTelegraph,https://cointelegraph.com/news/there-are-now-more-than-5000-bitcoin-atms-around-the-world,https://images.cryptocompare.com/news/cointelegraph/cck10GgowAg.png
13488311,https://www.cryptocompare.com/email-updates/daily/2019/jun/25/,1561449711,Market Analysis Report (25 Jun 2019),Facebook&apos;s Libra to See Another U.S. Congressional Hearing | Top Bitcoin Analyst Studies Price Effect of Bitcoin Block Reward Halving | There Are Now 48 Crypto Exchanges Approved in the Philippines,NEUTRAL,없음,BTC | ETH | MARKET | MINING | TRADING,,0,0,CryptoCompare,https://www.cryptocompare.com/email-updates/daily/2019/jun/25/,https://images.cryptocompare.com/news/default/cryptocompare.png
13450674,https://bitcoinist.com/?p=111476,1561449626,Predicable Bitcoin Bubble Rants Begin Again as BTC Booms,"Nothing grabs the attention more than an epic price pump of any asset. Bitcoin is no different; however the groups of those against it, probably because they don&apos;t comprehend it, are starting to emerge from their caves hollering about bubbles once again. Bitcoin Is A Bubble … Again We heard it all before in 2017; &apos;Bitcoin is a bubble that will burst&apos;. Granted, BTC did fall over 80% the following year but has since recoveredRead MoreThe post Predicable Bitcoin Bubble Rants Begin Again as BTC Booms appeared first on Bitcoinist.com.",POSITIVE,BTC,BTC | FIAT | TRADING,,0,0,Bitcoinist,https://bitcoinist.com/bitcoin-bubble-rants-begin-again-as-btc-booms/,https://images.cryptocompare.com/news/bitcoinist/8dU6Vhx62o1.jpeg
13467557,https://www.cryptonewsz.com/?p=27846,1561449012,"Bitcoin Crosses $11,000 Mark, Experts Predict $100,000 Price During The Next Bull Run","Bitcoin crossed the $11,000 mark on Monday, June 24, and the rally seems to be growing by the day. This could be an indicator of a massive bull market ahead, and a testament to the fact that Bitcoin is still the king of the crypto markets. BITCOIN IS KING AND THATS NOT CHANGING ANYTIME SOON …The post Bitcoin Crosses $11,000 Mark, Experts Predict $100,000 Price During The Next Bull Run appeared first on CryptoNewsZ.",POSITIVE,없음,BTC | MARKET | TRADING,,0,0,CryptoNewsZ,https://www.cryptonewsz.com/bitcoin-crosses-11000-mark-experts-predict-100000-price-during-the-next-bull-run/27846/,https://images.cryptocompare.com/news/cryptonewsz/8d2c8g0E300.jpeg
13467558,https://www.cryptonewsz.com/?p=27839,1561448474,"Cryptocurrency And The United States, The Troubled Marriage (Part II – Political Reasons)","Cryptocurrencies are a big threat to the US in economic terms. However, they also pose a political threat to the global leadership of the United States. The United Stated is undisputedly the leader of global politics and is politically involved with every country in the world. While most are its allies, Washington also has several …The post Cryptocurrency And The United States, The Troubled Marriage (Part II - Political Reasons) appeared first on CryptoNewsZ.",NEGATIVE,없음,OTHER,,0,0,CryptoNewsZ,https://www.cryptonewsz.com/cryptocurrency-and-the-united-states-the-troubled-marriage-part-ii-political-reasons/27839/,https://images.cryptocompare.com/news/cryptonewsz/a0w1l0qg9g4.jpeg
13358978,https://cointelegraph.com/news/circle-ceo-non-sovereign-bitcoin-and-cryptos-will-see-continued-growth,1561447800,Circle CEO: ‘Non-Sovereign’ Bitcoin and Cryptos Will See Continued Growth,Circle CEO Jeremy Allaire believes non-sovereign cryptos such as bitcoin will see continued growth despite the emergence of assets such as Facebook&apos;s Libra and stablecoins,POSITIVE,없음,BTC,,0,0,CoinTelegraph,https://cointelegraph.com/news/circle-ceo-non-sovereign-bitcoin-and-cryptos-will-see-continued-growth,https://images.cryptocompare.com/news/cointelegraph/da8B2e5aoM0.png
13467559,https://www.cryptonewsz.com/?p=27823,1561447723,"Bitcoin Price Analysis: Bitcoin (BTC) Breaches The $11,000 Barrier To Trade Persistently","Bitcoin reaches the 11,000 USD mark, more to add in future. The target price of 2019 should be revised to 15,000 USD. The leader of all coins, Bitcoin, has finally reached the 11,000 USD barrier point, this time to trade persistently above the same. A lot many stakes were raised about Bitcoin&apos;s price movement and …The post Bitcoin Price Analysis: Bitcoin (BTC) Breaches The $11,000 Barrier To Trade Persistently appeared first on CryptoNewsZ.",POSITIVE,BTC,BTC | ICO | MARKET | TRADING,,0,0,CryptoNewsZ,https://www.cryptonewsz.com/bitcoin-price-analysis-bitcoin-btc-breaches-the-11000-barrier-to-trade-persistently/27823/,https://images.cryptocompare.com/news/cryptonewsz/80w10200000.jpeg
13585139,https://www.cryptopolitan.com/?p=17667,1561447121,"Florida’s Riviera Beach finally surrenders – Pays $600,000 in ransom","In a piece of heartbreaking news, the popular beach destination of Florida has finally caved into its hackers&apos; demands and paid them six hundred thousand dollars ($600k) worth of Bitcoins in the hopes that the cyber-terrorists would finally release the control over city&apos;s systems. Appalling cases of cyber attacks CP reported on June 21 that the city officials may consider paying this whopping amount to hackers. Amidst the unnerving trend hitting several cities across the U.S, the Riviera Beach situation has been slated to be the most dismaying case of recent times as the city&apos;s council are still",NEGATIVE,없음,OTHER,,0,0,Cryptopolitan,https://www.cryptopolitan.com/floridas-riviera-beach-finally-surrenders-to-citys-hackers-pays-600000-in-ransom/,https://images.cryptocompare.com/news/cryptopolitan/8sOu84ACHr_.jpeg
13467560,https://www.cryptonewsz.com/?p=27835,1561447012,StableUSD Gets Listed On Binance DEX,"In an important development, Stably had finally been able to list its StableUSD on the Binance DEX which is the largest cryptocurrency exchange by the trading volume. This means now the trader have the additional opportunity to hedge against the volatility and risks, especially while redeeming the value of cryptocurrencies against the fiat currency. In …The post StableUSD Gets Listed On Binance DEX appeared first on CryptoNewsZ.",POSITIVE,없음,EXCHANGE | FIAT | TRADING | BNB,,0,0,CryptoNewsZ,https://www.cryptonewsz.com/stableusd-gets-listed-on-binance-dex/27835/,https://images.cryptocompare.com/news/cryptonewsz/bAp04000000.png
13358979,https://cointelegraph.com/news/bitcoin-breaks-200-billion-market-cap-for-the-first-time-in-17-months,1561446660,Bitcoin Breaks $200 Billion Market Cap For the First Time in 17 Months,Bitcoin is busy deleting the last traces of its 2018 bear market,POSITIVE,없음,ALTCOIN | BTC | MARKET | TRADING,,0,0,CoinTelegraph,https://cointelegraph.com/news/bitcoin-breaks-200-billion-market-cap-for-the-first-time-in-17-months,https://images.cryptocompare.com/news/cointelegraph/dp4wi640000.png
13264482,https://dailyhodl.com/?p=55777,1561446362,"ThinkMarkets Chief Analyst: Bitcoin Beast Unleashed, Targeting $60K to $100K – Plus Ethereum, Ripple and XRP, Stellar, Tron, IOTA","From new analysis on Bitcoin&apos;s revival to new adoption at IOTA, here&apos;s a look at some of the stories breaking in the world of crypto. Bitcoin The chief analyst at ThinkMarkets says the Bitcoin beast has been unleashed. In a new piece at Forbes, Naeem Aslam says the relatively low number of people searching for ...The post ThinkMarkets Chief Analyst: Bitcoin Beast Unleashed, Targeting $60K to $100K - Plus Ethereum, Ripple and XRP, Stellar, Tron, IOTA appeared first on The Daily Hodl.",POSITIVE,XRP | IOTA,ALTCOIN | BTC | ETH | XRP | IOTA,,0,0,The Daily Hodl,https://dailyhodl.com/2019/06/25/thinkmarkets-chief-analyst-bitcoin-beast-unleashed-targeting-60k-to-100k-plus-ethereum-ripple-and-xrp-stellar-tron-iota/,https://images.cryptocompare.com/news/dailyhodl/9pzpQOp60wc.png
13285850,https://ambcrypto.com/?p=98532,1561446049,ICOs on the back-burner; token sales on a US exodus following regulatory crackdown,"Let&apos;s admit it, 2018 was a forgettable year for the cryptocurrency market. The price of Bitcoin plummeted from $17,000 to $3,000, while the collective market shaved over $700 billion off its market cap. The only standout, if there was one from the dreaded crypto-winter, was the rise and fall of the Initial Coin Offering [ICOs] ...The post ICOs on the back-burner; token sales on a US exodus following regulatory crackdown appeared first on AMBCrypto.",NEGATIVE,ICO,BTC | ICO | MARKET | TRADING | TOKEN SALE,,0,0,AMB Crypto,https://ambcrypto.com/icos-on-the-back-burner-token-sales-on-a-us-exodus-following-regulatory-crackdown/,https://images.cryptocompare.com/news/ambcrypto/cr4ahz6pMCq.jpeg
