뉴스ID,뉴스GUID,일자(UTC timestamp),뉴스제목,본문,SENTIMENT,주요코인,카테고리,작성자,추천수,비추천수,출처,뉴스URL,이미지URL
13403572,https://cryptopotato.com/?p=147933,1635378846,Singapore’s Central Bank Chairman Shows Openness to Stablecoins,The head of Singapore&apos;s central bank said there are some great use cases for crypto - especially stablecoins.,POSITIVE,없음,ASIA | FIAT,,0,0,Crypto Potato,https://cryptopotato.com/singapores-central-bank-chairman-shows-openness-to-stablecoins/,https://images.cryptocompare.com/news/default/cryptopotato.png
13494356,https://seekingalpha.com/article/4462661-grayscale-bitcoin-trust-files-become-etf?utm_source=cryptocompare.com&utm_medium=referral,1635378106,Grayscale Bitcoin Trust Files To Become An ETF: How To Make Money Off It,"The Grayscale Bitcoin Trust has officially filed to change from a CEF to an ETF.If successful, the roughly 16% discount between the price of GBTC and its net asset value will be closed, earning investors a risk premium. I&apos;ll explain how.How statistical arbitrage in CEFs works, and how you can take advantage as an investor using free software.",POSITIVE,BTC,BTC | BUSINESS | TECHNOLOGY | TRADING,,0,0,Seeking Alpha,https://seekingalpha.com/article/4462661-grayscale-bitcoin-trust-files-become-etf?utm_source=cryptocompare.com&utm_medium=referral,https://images.cryptocompare.com/news/default/seekingalpha.png
13269623,https://ambcrypto.com/?p=195157,1635377456,"Before Digital Euro, Europe must win over Germany’s worried cash-users","Investigations are underway to prepare the financial sector for a Digital Euro. However, before that, central banks need to check in with the public and understand how private citizens view the proposed CBDC. Deutsche Bundesbank - the central bank of the Federal Republic of Germany - did just that and recently reported its findings. Nein! ...",NEGATIVE,없음,FIAT | TECHNOLOGY,,0,0,AMB Crypto,https://ambcrypto.com/before-digital-euro-europe-must-win-over-germanys-worried-cash-users/,https://images.cryptocompare.com/news/default/ambcrypto.png
13427935,https://news.bitcoin.com/?p=492159&preview=true&preview_id=492159,1635377409,"Federal Reserve, FDIC, OCC Discuss Allowing Banks to Hold Crypto on Balance Sheets","A group of U.S. banking regulators is working on how banks can be allowed to offer crypto services and hold cryptocurrencies on their balance sheets. The chairman of the Federal Deposit Insurance Corporation (FDIC) said, &apos;If we don&apos;t bring this activity inside the banks, it is going to develop outside of the banks … The ...",POSITIVE,없음,FIAT | REGULATION,,0,0,Bitcoin.com,https://news.bitcoin.com/federal-reserve-fdic-occ-discuss-allowing-banks-to-hold-crypto-on-balance-sheets/,https://images.cryptocompare.com/news/default/bitcoincom.png
13389662,https://decrypt.co/?p=84618,1635377201,"El Salvador President Buys the Dip, Adds 420 Bitcoin to Treasury","The Central American country now holds 1,120 BTC in its reserves.",POSITIVE,BTC,BTC | REGULATION,,0,0,Decrypt,https://decrypt.co/84618/el-salvador-president-buys-dip-adds-420-bitcoin-treasury,https://images.cryptocompare.com/news/default/decrypt.png
13222279,https://www.newsbtc.com/?p=474734,1635375646,Bitcoin Exchange Balances Decline To Three-Year Low Amid Rising Prices,"Bitcoin exchange balances have been on the decline since the bull rally began. The volumes were expected to go up once the digital asset had hit a new all-time high in October. However, this was not the case. Previous trends have often pointed to exchange balances seeing an increase in bull markets when investors moved their holdings to exchanges in order to take profits. This bull market has defied all expectations for it and continues to do so. Outflows from exchanges outpace inflows as investors withdraw BTC from exchanges en masse. Exchange balance volumes relative to the circulating supply of bitcoin have declined towards three-year lows. BTC exchange balances now sit at levels not seen since January 2018. This has led to a supply squeeze on exchanges, causing sell pressures to drop tremendously. Related Reading | American Singer Mariah Carey Offers Free $20 In Bitcoin To Promote Adoption Big Exchanges See Declining Balances Big exchanges like Binance, Coinbase, and Huobi have seen large volumes of bitcoin withdrawn from their exchanges. Binance recorded the highest outflows for the last week with 21,000 BTC withdrawn from the crypto exchange. This is one of the sharpest declines recorded in the market. BTC exchange balances continue to decline | Source: Arcane Research Huobi also saw thousands of BTC leave the exchange in the past week. The past seven days save 8,000 BTC withdrawn from the cryptocurrency exchan...",NEGATIVE,BTC,BTC | EXCHANGE | MARKET | TRADING | BNB,,0,0,NewsBTC,https://www.newsbtc.com/news/bitcoin/bitcoin-exchange-balances-decline/,https://images.cryptocompare.com/news/default/newsbtc.png
13444004,https://bitcoinist.com/?p=162643,1635375634,Grayscale Discount Hints At Spot Bitcoin ETF Denial,Grayscale had filed for a Bitcoin Spot ETF after the SEC had greenlighted three Bitcoin ETF Futures for trading last week. Expectations were high that the regulatory body would also approve this ETF which would prove to be a better trading option for investors in comparison to the futures ETFs. The investment firm filed to ...,NEUTRAL,없음,BTC | BUSINESS | REGULATION | TRADING,,0,0,Bitcoinist,https://bitcoinist.com/grayscale-discount-hints-at-spot-bitcoin-etf-denial/?utm_source=rss&utm_medium=rss&utm_campaign=grayscale-discount-hints-at-spot-bitcoin-etf-denial,https://images.cryptocompare.com/news/default/bitcoinist.png
13337765,https://cointelegraph.com/news/litecoin-transactions-near-an-all-time-high-after-gaining-ground-in-consumer-finance,1635374370,Litecoin transactions near an all-time high after gaining ground in consumer finance,It&apos;s become easier to use Litecoin for everyday payments thanks to several recent partnerships.,POSITIVE,없음,LTC | TECHNOLOGY,,0,0,CoinTelegraph,https://cointelegraph.com/news/litecoin-transactions-near-an-all-time-high-after-gaining-ground-in-consumer-finance,https://images.cryptocompare.com/news/default/cointelegraph.png
13412566,https://blockworks.co/?p=9972,1635374323,"SHIB Overtakes DOGE as Top Dog in Possible Sign of Froth, Bitcoin Retreats: Markets Wrap","SHIB and DOGE battle it out for &apos;top dog&apos; status, BTC retreats as evidence of froth in the market emerges.The post SHIB Overtakes DOGE as Top Dog in Possible Sign of Froth, Bitcoin Retreats: Markets Wrap appeared first on Blockworks.",NEUTRAL,BTC | DOGE | SHIB,BTC | DOGE | ETH | MARKET | SHIB,,0,0,Blockworks,https://blockworks.co/shib-overtakes-doge-as-top-dog-in-possible-sign-of-froth-bitcoin-retreats-markets-wrap/,https://images.cryptocompare.com/news/default/blockworks.png
13269624,https://ambcrypto.com/?p=195083,1635373830,Are gaming tokens like Enjin Coin not following Bitcoin’s footsteps anymore,"Over the past few days, Bitcoin has remained quite complacent around the $60k-level. After registering new highs last Wednesday, the world&apos;s largest asset&apos;s price crashed during the early hours of the 27th. In fact, at press time, it was seen trading at $58.8k. This accounted for dips of 6% and 8% on the daily and ...",NEUTRAL,없음,ALTCOIN | BTC | ENJ | SAND | TECHNOLOGY,,0,0,AMB Crypto,https://ambcrypto.com/are-gaming-tokens-like-enjin-coin-not-following-bitcoins-footsteps-anymore/,https://images.cryptocompare.com/news/default/ambcrypto.png
13337766,https://cointelegraph.com/news/friday-s-jaw-breaking-3-2b-bitcoin-options-expiry-could-kick-start-a-new-rally,1635373800,Friday’s jaw-breaking $3.2B Bitcoin options expiry could kick-start a new rally,"Bitcoin bulls could be in for a $715 million profit if BTC price is above $60,000 ahead of Friday&apos;s $3.2 billion options expiry.",POSITIVE,BTC,BTC | BUSINESS | MARKET | REGULATION | TRADING,,0,0,CoinTelegraph,https://cointelegraph.com/news/friday-s-jaw-breaking-3-2b-bitcoin-options-expiry-could-kick-start-a-new-rally,https://images.cryptocompare.com/news/default/cointelegraph.png
13494357,https://seekingalpha.com/news/3759647-sec-is-said-to-not-allow-leveraged-bitcoin-etf-wsj?utm_source=cryptocompare.com&utm_medium=referral,1635373337,SEC is said to not allow leveraged Bitcoin ETF - WSJ,"The U.S. Securities and Exchange Commission is said to have told at leas one asset manger not to go forward with plans for a leveraged bitcoin exchange-traded fund. The SEC appears to want to restrict bitcoin-related products to to only unleveraged exposure to bitcoin futures contracts, according to a WSJ report. The WSJ report comes after the SEC recenty allowed a few bitcoin-related ETFs to begin trading, including the ProShares Bitcoin Strategy ETF (NYSEARCA:BITO) and the Valkyrie Bitcoin Strategy ETF (NASDAQ:BTF). While BITO does not directly hold Bitcoin (BTC-USD), the new ETF aims to provide market participants with capital appreciation through managed exposure to Bitcoin-futures contracts.",NEGATIVE,BTC,BTC | EXCHANGE | MARKET | REGULATION | TRADING,,0,0,Seeking Alpha,https://seekingalpha.com/news/3759647-sec-is-said-to-not-allow-leveraged-bitcoin-etf-wsj?utm_source=cryptocompare.com&utm_medium=referral,https://images.cryptocompare.com/news/default/seekingalpha.png
13257068,https://dailyhodl.com/?p=170663,1635372336,Shark Tank Star Kevin O’Leary Aims To Nearly Triple His Investments in Crypto Ecosystem,"Shark Tank star and billionaire investor Kevin O&apos;Leary is planning to triple down on his conviction in cryptocurrencies. In an interview with Anthony Pompliano on The Best Business Show, O&apos;Leary says he sees big potential in the emerging cryptocurrency space, calling it the &apos;twelfth sector of the S&amp;P.&apos; O&apos;Leary says that he wants his operating company ...The post Shark Tank Star Kevin O&apos;Leary Aims To Nearly Triple His Investments in Crypto Ecosystem appeared first on The Daily Hodl.",POSITIVE,없음,BTC | BUSINESS,,0,0,The Daily Hodl,https://dailyhodl.com/2021/10/27/shark-tank-star-kevin-oleary-aims-to-nearly-triple-his-investments-in-crypto-ecosystem/,https://images.cryptocompare.com/news/default/dailyhodl.png
13337767,https://cointelegraph.com/news/infrastructure-platform-quicknode-raises-35m-in-series-a-financing,1635372211,Infrastructure platform Quicknode raises $35M in Series A financing,Miami continues to emerge as a hub for Blockchain-based services and technology.,POSITIVE,없음,TECHNOLOGY,,0,0,CoinTelegraph,https://cointelegraph.com/news/infrastructure-platform-quicknode-raises-35m-in-series-a-financing,https://images.cryptocompare.com/news/default/cointelegraph.png
13257069,https://dailyhodl.com/?p=170872,1635372116,"Here Are the Must-Hold Levels for Bitcoin, Ethereum and Solana, According to Top Crypto Analyst","A closely followed crypto analyst is laying out where he thinks the critical support levels are for Bitcoin (BTC), Ethereum (ETH) and Solana (SOL) as the digital asset markets correct. In the latest Technical Roundup weekly newsletter, the pseudonymous analyst known as Cred says that a bullish structure remains intact for Bitcoin in the long-term ...The post Here Are the Must-Hold Levels for Bitcoin, Ethereum and Solana, According to Top Crypto Analyst appeared first on The Daily Hodl.",POSITIVE,BTC | ETH | SOL,ALTCOIN | BTC | ETH | SOL | TRADING,,0,0,The Daily Hodl,https://dailyhodl.com/2021/10/27/here-are-the-must-hold-levels-for-bitcoin-ethereum-and-solana-according-to-top-crypto-analyst/,https://images.cryptocompare.com/news/default/dailyhodl.png
13222280,https://www.newsbtc.com/?p=474790,1635372007,XRP Builds Momentum With 7% Increase As Ripple Launches New ODL Partnership,"XRP has been soaring in the monthly chart with a 7.2% profit as Ripple continues to expand its corridors worldwide. As of press time, the seventh crypto by market cap trades at $1,01 and records a 10.3% correction in the daily chart. XRP seems to be reacting to the general trend in the market as Bitcoin, Ethereum, and other cryptocurrencies in the top 10 by market cap trend to the downside. As NewsBTC has reported, the derivatives sector has been heating up due to the recent rise in the aforementioned coins. Related Reading | SEC Takes Blow In Action Against Ripple, Will It Impact XRP Price? Historically, this has taken a toll on the bullish momentum built by the bulls. In the case of XRP, it&apos;s a positive sign that it has been able to sustain gains in higher timeframes. The sentiment around XRP has flipped bullish since Ripple has been able to sustain and push back against the U.S. SEC in their case for the alleged sales of a security. In addition, the payment corridors, one of the most important use cases for the XRPL Ledger and its native token, are recovering. These entities use Ripple&apos;s payment solution On-Demand Liquidity (ODL), based on XRP, and were negatively impacted after the SEC filed for their legal action. The Liquidity Index Bot, an ODL payment corridors monitor, records an increase in the daily volume for these entities. As seen below, the XRP/AUD payment corridors show some recovery after it went negative ...",POSITIVE,BTC | XRP,BTC | MARKET | REGULATION | TRADING | XRP,,0,0,NewsBTC,https://www.newsbtc.com/news/ripple/xrp-ripple-builds-momentum-odl-partner/,https://images.cryptocompare.com/news/default/newsbtc.png
13494358,https://seekingalpha.com/news/3759636-el-salvador-buys-the-dip-in-bitcoin?utm_source=cryptocompare.com&utm_medium=referral,1635371637,El Salvador buys the dip in Bitcoin,"El Salvador President Nayib Bukele is either taking advantage of bitcoin&apos;s (BTC-USD) dip below $60K, or he&apos;s channeling his inner Elon Musk, but minutes ago he took to Twitter to announce the purchase of another 420 bitcoins. That would take the country&apos;s stash to 1,120 bitcoins, worth $66M at the crypto&apos;s current price of $59K. Bitcoin has had a rough few days of it since hitting a new all-time high of about $67K on Wednesday, sliding as low as $58.3K at one point this afternoon. Even with that decline, it&apos;s higher by about 40% over the past month. The action in the crypto market was pretty wild today, with nearly every coin selling off sharply, except for Shiba Inu (SHIB-USD), which climbed as much as 75%. It&apos;s currently ahead 56%. Morning Brew takes note of one wallet address that purchased about $8K of Shiba in August that&apos;s now worth $5.7B. Has it really been",POSITIVE,BTC | SHIB,BTC | MARKET | REGULATION | SHIB | TRADING,,0,0,Seeking Alpha,https://seekingalpha.com/news/3759636-el-salvador-buys-the-dip-in-bitcoin?utm_source=cryptocompare.com&utm_medium=referral,https://images.cryptocompare.com/news/default/seekingalpha.png
42394386,CpI5Y2Su0uMQDo69bvckRl,1635371122,A Need for More Regulatory Clarity,"For years fintech leaders, investors and technologists in the cryptocurrency space have whined about the lack of regulatory clarity coming from the U.S. Securities and Exchange Commission (SEC).  It was only in February 2020, amended in April of this year, that SEC Commissioner Hester M. Peirce proposed her forward-thinking safe harbor rules providing a three-year grace period from prosecution related to securities registration and a regulatory sandbox to develop decentralized networks. Meanwhile, the SEC charged alleged violators of the Securities Act of 1933 as disparate as Ripple Labs, BitConnect, actor Steven Seagal, political lobbyist Jack Abramoff and legendary innovator and outlaw John McAfee.  Such securities law enforcement is proliferating. According to Cornerstone Research, the SEC brought 75 enforcement actions and 19 trading suspensions against companies and individuals in the crypto industry between July 2013 and December 2020.  James Cooper, a CoinDesk columnist, is a professor of law at California Western School of Law in San Diego.  After taking the helm at the SEC, Gary Gensler unsurprisingly announced there was not enough protection for crypto investors. A few weeks later, Sen. Elizabeth Warren (D-Mass.) warned that cryptocurrency services were “spinning straw into gold” and that the United States’ financial stability was at risk without strict regulation. Last week, Democrat U.S. senators called for Facebook to refrain from launching its Novi crypto wallet because the company “cannot be trusted to manage a payment system or digital currency.”  Now, it is essential that we all get clear, specific direction on what is and what is not permissible. After years of hemming and hawing, our legislators must determine whether crypto is a security, a utility, a commodity, a currency or the latest tulip mania.  They must act, on the one hand, to ensure that the United States is a leader, if not the leader, in this new area of capital formation and financial technology. But on the other hand, they must also protect small-time investors and the general public from fraudsters, pump and dumpsters and the vagaries of exploding asset bubbles.  The current geopolitical situation also necessitates regulatory clarity. The Chinese government has banned bitcoin mining, forcing a huge migration of ASIC computers out of the country and providing a great opportunity for the U.S. to dominate mining. The Chinese are rolling out their Digital Currency/Electronic Payment initiative nationally in the coming year as the People’s Republic of China implements its sovereign-backed, central bank digital currency, long before the U.S. develops a digital dollar. Some sense of what the U.S. is planning for digital assets and a sovereign-backed digital currency would help incentivize a private industry response here.  There is worry that even much smaller players worldwide (Estonia, Malta or Singapore, for example) may have the first mover advantage in financial technology by being the most lenient jurisdiction for incorporation, funding and development. This race to the bottom is no way to run an industry, even a disruptive one.  But we should be careful what we ask for regarding regulation. Not all new rules will be beneficial. The pending Infrastructure Investments and Jobs Act (still a bill at this point) provided the crypto space a little too much regulatory clarity: The new list of actors who are to be considered broker-dealers under U.S. securities laws include miners, programmers and node operators, and they all have reporting requirements to the Internal Revenue Service.  The goal is to raise $28 billion to help pay for new infrastructure in the United States over the coming years, but the pending legislation may create more problems than it solves for fintech, putting compliance requirements on many actors who did not have such duties before. Talk about a chilling effect.  Earlier this month, Coinbase provided the U.S. government with ideas about regulating the crypto space, a sign of maturity in the industry. The main contribution was the innovative call for a new federal agency to regulate digital asset markets. Notwithstanding, this may be viewed as a move toward regulatory capture – an economic theory positing that regulatory agencies may be dominated by the industries or interests they are charged with regulating.  The result would be an agency that acts to benefit existing firms in the industry it is charged to regulate rather than acts in the public interest. But Coinbase is, after all, reacting to the missing regulatory clarity.  A tangential issue is the revolving door between the U.S. government and the crypto industry – another predictable danger. Middle-level lawyers from the SEC, for example, are going to leading law firms to help crypto clients after stints in the regulator seat. Law enforcement leaders are joining digital asset firms, lending legitimacy and expertise to their burgeoning businesses.  This is all part of a maturation process that the digital asset industry requires. It cannot be worth $2.7 trillion without some attention from governments. That kind of attention can be unpredictable. And predictability is what we are all allegedly pining for.",NEUTRAL,없음,ASIA | BUSINESS | EXCHANGE | FIAT | REGULATION,James Cooper,0,0,CoinDesk,https://coindesk.com/policy/2021/10/27/a-need-for-more-regulatory-clarity,https://cdn.sanity.io/images/s3y3vcno/production/619458d9f7a53600036d8cd5548e9061f659a830-1500x1000.jpg?w=300&h=300&fit=crop
13383955,https://zycrypto.com/?p=58005,1635371031,Shiba Inu Becomes First Meme Token To Live Up To The ‘DOGE Killer’ Title,"Shiba Inu successfully knocks out Dogecoin. SHIB bulls remain hyper active as daily gains surpass 66%. Shiba Inu, the meme token termed as the &apos;Dogecoin killer&apos; is experiencing unrivaled growth. The asset has continued its rally from late last month into October. Even as the month is coming to a close, Shiba Inu is still ...",POSITIVE,DOGE | SHIB,DOGE | ICO | SHIB | TRADING,,0,0,ZyCrypto,https://zycrypto.com/shiba-inu-becomes-first-meme-token-to-live-up-to-the-doge-killer-title/,https://images.cryptocompare.com/news/default/zycrypto.png
13412567,https://blockworks.co/?p=9980,1635370586,WallStreetBets Founder Predicts Bitcoin Hits $100K by Year End,"The WallStreetBets founder Jaime Rogozinski owns &apos;tons of crypto, from a handful of &apos;shitcoins,&apos; or altcoins, and a couple of bigger ones like bitcoin, ethereum, polygon and LUNA,&apos; he told Blockworks in an interview.The post WallStreetBets Founder Predicts Bitcoin Hits $100K by Year End appeared first on Blockworks.",POSITIVE,없음,ALTCOIN | BTC | ETH | MARKET,,0,0,Blockworks,https://blockworks.co/wallstreetbets-founder-predicts-bitcoin-hits-100k-by-year-end/,https://images.cryptocompare.com/news/default/blockworks.png
13403573,https://cryptopotato.com/?p=147825,1635370513,FDIC Chair: US Regulators Work on Rules How Banks Can Hold Cryptocurrencies,"If regulators don&apos;t find a way for banks to hold cryptocurrencies, other organizations will do so, said Jelena McWilliams.",NEUTRAL,없음,OTHER,,0,0,Crypto Potato,https://cryptopotato.com/fdic-chair-us-regulators-work-on-rules-how-banks-can-hold-cryptocurrencies/,https://images.cryptocompare.com/news/default/cryptopotato.png
13269625,https://ambcrypto.com/?p=195219,1635370207,"What happens if Ethereum weakens below $4,000?","Ethereum continued its gaining spree during October, extending gains up to nearly 60% since the start of the month. However, a correctional phase was in effect as Bitcoin&apos;s snapped a 12-day low at $58,000. For ETH, onus now fell to near-term support levels of $4K and $3,650. Should bulls falter at these levels, ETH could ...",NEUTRAL,ETH,ALTCOIN | ETH | MARKET,,0,0,AMB Crypto,https://ambcrypto.com/what-happens-if-ethereum-weakens-below-4000/,https://images.cryptocompare.com/news/default/ambcrypto.png
13427936,https://news.bitcoin.com/?p=492137,1635370201,Adobe Jumps Into Non-Fungible Token Ecosystem With ‘Prepare as NFT’ Photoshop Tool,"Adobe Inc., the American multinational computer software company that&apos;s well known for its platforms like Photoshop and Illustrator, has jumped into the non-fungible token (NFT) universe. According to Adobe chief product officer Scott Belsky in a recent interview with The Verge, &apos;NFTs will change creativity.&apos; New Adobe Photoshop Tool Will Assist NFT Creators in &apos;Packaging ...",POSITIVE,없음,BLOCKCHAIN | ICO | TECHNOLOGY,,0,0,Bitcoin.com,https://news.bitcoin.com/adobe-jumps-into-non-fungible-token-ecosystem-with-prepare-as-nft-photoshop-tool/,https://images.cryptocompare.com/news/default/bitcoincom.png
42396676,DbF8Q09kuKX2XWBxAT4jyD,1635369202,Florida’s Miami-Dade County to ‘Study Feasibility’ of Paying Taxes With Crypto,"Miami-Dade County in Florida has approved a resolution to create a task force to study the feasibility of accepting cryptocurrency as a form of payment for taxes.  The Cryptocurrency Task Force will offer recommendations around other potential policies related to crypto that could prove advantageous, according to an announcement Wednesday.  First and foremost, the task force will explore how Miami-Dade could accept crypto as a method of payment for taxes, fees and services.  The task force also intends to meet with Cheyenne, Wyoming-based American CryptoFed DAO, the first legally recognized decentralized autonomous organization (DAO) in the U.S., and other legislators and regulators in Wyoming to discuss crypto and blockchain initiatives.  Wyoming has attempted to attract investment in recent years through establishing itself as a crypto and blockchain-friendly state, passing legislation in April to legally recognize DAOs, companies whose governance is built on smart contracts and where decision making is shared around the organization.  The City of Miami is another jurisdiction to have adopted such a stance, thanks to some degree to its pro-crypto Mayor Francis Suarez.  Read more: Is Crypto Miami for Real?",POSITIVE,없음,BLOCKCHAIN | REGULATION,Jamie Crawley,0,0,CoinDesk,https://coindesk.com/policy/2021/10/27/florida-county-miami-dade-to-study-feasibility-of-paying-taxes-with-crypto,https://cdn.sanity.io/images/s3y3vcno/production/3940e7b06265d855cfc2ff7912e317fc20796bfa-1500x1000.jpg?w=300&h=300&fit=crop
13481849,https://cryptobriefing.com/?p=98923,1635369187,GameStop NFT Plans Continue With Flurry of Job Listings,,NEUTRAL,없음,OTHER,,0,0,Crypto Briefing,https://cryptobriefing.com/gamestop-nft-plans-continue-with-flurry-of-job-listings/?utm_source=main_feed&utm_medium=rss,https://images.cryptocompare.com/news/default/cryptobriefing.png
