뉴스ID,뉴스GUID,일자(UTC timestamp),뉴스제목,본문,SENTIMENT,주요코인,카테고리,작성자,추천수,비추천수,출처,뉴스URL,이미지URL
42379154,0r6Zag11PPDEMKgUX7n9GV,1483643753,Bitcoin's Rollercoaster 2017: What's Happened So Far,"2016 may have been a dynamic year for the price of bitcoin, but 2017 is shaping up to be a dramatic one already.  Bitcoin's race past $1,000 (and subsequent gyrations above and below that line) have already sparked headlines (both good and bad) worldwide, as today's dramatic fall from above $1,100 drove a massive influx of interest in the the digital currency.  If you’re just tuning in to the action, you may be wondering how things got to this point in the first place.  To get you up to speed, it may be helpful to look back at the past week's major price developments that took exchange markets near new all-time highs – and, as today showed, dramatic lows.  Here's the blow-by-blow for 2017 thus far:  Bitcoin tops $1,000  The year got started with a bang on 1st January, when the price of bitcoin crossed the $1,000 mark.  After spending the day approaching that level – climbing as high as $999 before settling back down – the price climbed to its then-highest point since January 2014.  The movement was notable given less-than-average trade volume figures at the time. Conversely, in the days before, bitcoin prices had approached (but not quite exceeded) $1,000.  Read more here.  Bitcoin eyes all-time highs  Things began heating up within a few short days.  As reported by CoinDesk on 4th January, early trading this week saw the digital currency’s price drift ever higher after crossing the $1,000 line.  A high of $1,060 meant that the price was inching closer to its all-time high of $1,165.89, reached on 30th November, 2013, according to data from the CoinDesk Bitcoin Price Index (BPI).  It was during this time as well that mainstream media sources, including The New York Times and The Washington Post began taking note, which continues to today  Read more here.  Bitcoin closes in  The price, as may be expected, continued to climb that day.  Bitcoin shot above the $1,100 line in late-day trading on 4th January, quickly spiking to as much as $1,129.28 before settling back. CNY-denominated markets saw sharp gains that day as well, surging more than 23%.  A notable development at that point was the emergence of sell-side pressure in markets like Bitfinex.  As reported at the time, there were more sell orders than buy orders between the $1,137 and $1,140 – potentially foreshadowing the developments to come.  Read more here.  Sell orders slow rally  4th January continued to surprise with heightened volatility, with markets seeing some of the day’s gains lost before re-reaching them once more as trading continued.  The day saw prices climb as high as $1,141.05 during the session, the highest total since 5th December, 2013, according to BPI data. Yet prices fell as low as $1,087.53 before climbing once more, signaling that there could be more volatility to come.  It was here that at least some observers – who previously had indicated broadly bullish sentiment – began to suspect that a market pullback was on the horizon.  Read more here.  Bitcoin bounces back  Today, opened with significant gains, as the price climbed as high as $1,153.02 – well within striking distance of the all-time BPI high.  As reported this morning, the market behavior seen seemed to follow a pattern previously exhibited the day prior. That is to say, sharp movements upward before consolidation.  One noticeable change was a shift to more buy orders on exchanges like Bitfinex, potentially signaling that the price of bitcoin would climb even further.  Read more here.  Bitcoin pulls back  This morning’s dramatic price plunge, however, would cast a shadow on those bullish sentiments.  Just hours after climbing closer to the all-time high set in 2013, market averages suddenly tumbled. Markets had been fluctuating between the $1,080 and $1,070 lines, according to BPI data, before falling to as low as $887.47.  Overall, USD-denominated markets fell as much 23%, with CNY-denominated markets tumbling more than 15% as well.  However, in the hours since, the price of bitcoin has recovered. At press time, the average market price is $978.25.  Developers keep on working  Of course, we'd be remiss to note that bitcoin is an open-source technology – meaning, tweaks to its core protocol are ongoing.  Amidst all the ups and downs, a number of bug fixes were released that showcase how bitcoin could continue to evolve and become more useful, even in the face of challenges.  Read more here.  Image via Shutterstock",NEUTRAL,없음,BLOCKCHAIN | BTC | EXCHANGE | MARKET | TRADING,Stan Higgins,0,0,CoinDesk,https://coindesk.com/markets/2017/01/05/bitcoins-rollercoaster-2017-whats-happened-so-far,https://cdn.sanity.io/images/s3y3vcno/production/515189b05662866ae62dd5c684bcbc983be2cd58-1500x1022.jpg?w=300&h=300&fit=crop
42379150,0r6Zag11PPDEMKgUX7n9FF,1483635646,Volatility and Liquidity: How Bitcoin Compares to its Crypto Competitors,"Willy Woo is an entrepreneur, angel investor, derivatives trader and cryptocurrency enthusiast.  In this opinion piece, Woo takes readers on a deep dive into the historical performance of bitcoin and other cryptocurrencies that he believes already compete against it as general purpose consumer ""payment coins"".  2016 has been a bull year for privacy-focused cryptocurrencies.  Just as an example, last year we saw the rapid appreciation of monero, the mega-hyped launch of zcash (which peaked at an astounding $5,300 per coin) and subsequent pumps in other similar offerings including shadowcash and navcoin.  But, while it may seem like these crypotcurrencies are something new or novel, I would argue that all of these are ""payment coins"" competing in the battle to win the war to be general money.  Let me explain.  While most altcoins tend to be forging into market specific ""appcoin"" territory, what makes payment coins unique is the sheer size of the potential win. While appcoins can only capture a market segment that effectively puts a cap on their valuation, payment coins being a kind of generalized money can capture ""M2 money supply"" as a ceiling – ie trillions.  When I look at payment coins, I see that very strong economic network effects are in play.  As I covered earlier with my Commerce Index, liquidity and low volatility are very important for a coin to be useful for general trade as both of these qualities are crucial to make it compelling for end consumers to charge their wallet with a payment token for spending. With high volatility, there’s too much risk holding funds, and with insufficient liquidity, wallet recharge and merchant fees will be high.  When looking at the combined qualities of liquidity and price stability together as a Commerce Index, we could see other coins catching up with Bitcoin. In this study I will be doing a deeper dive into these two qualities individually.  For the sake of this study, I will be looking at the leading coins by market cap, namely bitcoin, monero, dash, Zcash and ShadowCash. All of these coins are well above $5m market cap, navCoin and others at less than $3m have been excluded.  Liquidity of payment coins  The plot above shows the liquidity (weekly traded volume) of each payment coin.  For the sake of comparing apples with apples, the Chinese zero-fee markets for bitcoin have been ignored as volumes can be faked easily. If we had included them, you can multiply bitcoin's volumes by 10x to 100x.  The liquidity of alternative payment coins has been on a rapid rise in 2016, particularly in the case of monero (which if this year’s trend continues could match bitcoin in just one year). But, there’s an argument here that liquidity can climb quickly upon the introduction of a new currency as can be seen by the steep liquidity growth of bitcoin in its first two years.  Of note is Zcash’s introduction which opened with remarkable liquidity, levels similar to what monero and dash enjoy today but which took them two to three years to achieve.  It's pretty clear that liquidity can be won very quickly.  Volatility of payment coins  Arguably achieving low volatility is more important than sheer liquidity as this is key to mass adoption.  Consumers need to be sure a payment currency is stable before charging their wallets. If the token price swings wildly like we saw in bitcoin's early days, we would see very few people holding it in their wallets, and no chance for user adoption.  It’s the prerequisite – if nobody is using your coin because of high volatility, then who cares if you have liquidity to assist in lowering merchant fees.  In this section, I’ll plot each payment coin’s volatility trend.  Bitcoin Volatility  In a previous volatility study, I established that bitcoin is well on the path to being the most stable currency in the world, an astounding claim, one that surprised even me.  Yet, when I break down the mechanism in which price stability is achieved, it makes sense.  Price stability happens at the exchanges. If you want to buy or sell a currency, and there’s millions of buyers or sellers on the other side of the market wanting to take your order, you will see a very small change in price movement from your trade.  When we look at fiat forex markets, the orders comprise of speculative trade, international trade and remittances. National trade within a currency never hits the forex exchanges.  But with bitcoin nearly all merchant and remittance activity worldwide hits the exchanges to convert to fiat, thus the potential for a much deeper order book. Another way to say this that with bitcoin, every cup of coffee you buy, anywhere in the world adds to market stability.  Its ceiling on stability should be orders of magnitude higher than fiat currencies.  The study concluded bitcoin would achieve fiat level volatility by mid-2019, which in my opinion is a level that will create a positive feedback loop that leads to more mainstream comfort with the currency.  This should open the way for bitcoin as a viable mainstream currency for the use of day to day commerce, further increasing its stability. A side conclusion was that payment startups such as BitPay are too early, and that their time will come in 2-3 years.  Monero Volatility  First up in our alternative payment coin list is monero, the biggest payment coin behind bitcoin.  Unfortunately, monero over its 2.5-year history has shown an increasing trend in volatility, and we've seen a lot more speculators pushing the price around during its 2016 price breakouts.  Here, we see how keeping liquidity high and volatility low can be like pulling on opposite ends of a tug-o-war. Often high volatility attracts traders which then feeds an increase in liquidity.  Though monero may be losing out on reduced volatility, it has a very important feature. Unlike dash, zcash and shadowcash, it is unique in that it is not a fork of bitcoin, so it has a chance of winning the payment coin war by competitor implosion should there be a vulnerability in bitcoin’s codebase.  In this regard, monero is an excellent bitcoin hedge in my opinion.  Dash Volatility  Dash was pleasantly surprising, showing a volatility reduction in line with bitcoin, and a slowly climbing liquidity rate, that if sustained, could catch bitcoin in one to two years.  In terms of lag, dash is about 18 months behind bitcoin in volatility, but unlikely to catch up if its present trend continues.  Last time I checked, 65% of dash is locked up in MasterNode staking, which creates a flow of currency to MasterNode owners, also 10% of block rewards are spent to develop the network.  This flow of currency could be responsible for dash's lower volatility.  The theory is that currency flowing to more people should add more depth and more even distribution to the order books of dash, and that it’s these two properties that ultimately reduces volatility.  ZCash Volatility  ZCash is the new kid on the block, at barely six weeks old, it’s not had enough time in the market to even calculate a single 60-day volatility point on a chart.  I ran a check of 30-day volatility, and it varied between 90% and 9500%. That’s literally off the charts, so we'll need wait some time before we see any meaningful trends.  ShadowCash Volatility  Shadowcash, like dash, is making inroads with liquidity, with just over two years to match bitcoin liquidity if 2016 trends can be sustained.  From our two years of history on this coin, we can see a slight reduction in volatility, but not at any rate that will catch up with bitcoin. Like dash, this coin allows staking with a 3-4% return for holders compared to dash’s 10-11% returns.  This could be the reason for SDC’s proportionally smaller decline in volatility compared to dash.  Conclusions  I started this study to double check my assumptions that bitcoin was well ahead of the pack in network effects. What the data showed was this was only partly true.  Bitcoin’s lead in liquidity is not unassailable, monero could match it in a year, while dash and shadowcash could achieve it in just over two.  This ignores bitcoin's zero-fee markets, which are colossal so perhaps it’s not a fair comparison. Probably the most accurate comparison would be to look at on-chain transaction volume which is difficult data to get, involving estimates of transaction values (technically, an estimate of change outputs back to the sender).  Interestingly, dash and shadowcash’s staking mechanisms (which distribute payouts to more participants than just miners) seem be making a significant difference in reducing volatility.  This is in no way conclusive, but in theory it makes sense.  All of bitcoin’s competitors tote features that bitcoin is lacking – faster confirmation times and private payments. Both of these features will most likely be coming to bitcoin as layer two protocols in 2017.  If and when this happens, the battle for payments and general money will be fought solely on the playing field of economic network effects, that of liquidity and volatility.  Bitcoin remains the standout contender in this regard.  This article originally appeared on Woo's blog and has been republished with his permission.  Disclaimer: This article is not intended to provide, and should not be taken as, investment advice.  Disclosure: CoinDesk is a subsidiary of Digital Currency Group, which has an ownership stake in Zcash.  Apples and oranges via Shutterstock",NEUTRAL,없음,BTC | MARKET | TRADING | XMR | ZEC,Willy Woo,0,0,CoinDesk,https://coindesk.com/markets/2017/01/05/volatility-and-liquidity-how-bitcoin-compares-to-its-crypto-competitors,https://cdn.sanity.io/images/s3y3vcno/production/5bd06fa1df2fef0434ede9760111c6e2797126ec-1500x1000.jpg?w=300&h=300&fit=crop
42379134,0r6Zag11PPDEMKgUX7n8xd,1483632044,Bitstamp Collects $1.3 Million As Funding Campaign Continues,"Bitcoin exchange Bitstamp's ongoing funding campaign has already netted more than $1.3m in capital, exceeding its goal weeks before the effort is scheduled to end.  Bitstamp has another 21 days of its campaign on the BnkToTheFuture platform. The exchange is selling shares totalling 2% of total equity.  At press time, Bitstamp had raised $1,365,240 out of a planned $1.2m, drawing from 258 backers.  Co-founder and CEO Nejc Kodrič said the funding will go towards expanding into new markets, as well as offering new services to the existing trading platform.  He told CoinDesk:  ""Our successful BnkToTheFuture campaign will enable us to focus more of our attention on new, unexplored markets and to implement some exciting new features (like new trading pairs, for example) and functionality to our site. We will continue to put our users first and make sure that our platform offers advanced solutions in a user-friendly manner.""  The move comes months after Bitstamp obtained a Payment Institution License from Luxembourg in mid-2016, which opened the door to new markets across Europe and, at the time, signaled a more positive regulatory environment for bitcoin startups in the region.  The funding success is a far cry from two years ago, when Bitstamp revealed that it had lost $5m in a phishing attack.  Bitstamp is the seventh-largest exchange by 30-day trading volume, according to data provider Bitcoinity.  Kodrič said that the funding success validates the exchange’s approach and puts it on a path to continued growth.  “We are extremely grateful for the success of our BnkToTheFuture campaign and remain thankful to every investor or client, whether it be new or old, for believing in Bitstamp and seeing our potential,” he said.  Image via Shutterstock",POSITIVE,없음,BTC | BUSINESS | EXCHANGE | MARKET | TRADING,Stan Higgins,0,0,CoinDesk,https://coindesk.com/markets/2017/01/05/bitstamp-collects-13-million-as-funding-campaign-continues,https://cdn.sanity.io/images/s3y3vcno/production/1aca59e4c942ec3d5e3f42c929a8eb7deca15e27-1500x1018.jpg?w=300&h=300&fit=crop
42379135,0r6Zag11PPDEMKgUX7n8yt,1483628748,What is 'Enterprise Ethereum'? Details Emerge on Secret Blockchain Project,"A secretive project that would aim to make ethereum more suitable for corporate users is taking shape, according to multiple sources familiar with the project.  Rumored to be called Enterprise Ethereum, the exact nature of the effort remains veiled behind an unusual degree of privacy – especially so for participants who are better known for their work in more transparent open-source communities.  Based on comments from sources, the group – which has the appearance of a broad consortium – intends to remain quiet until it is ready for a forthcoming public launch. Yet, word is already beginning to leak out.  On Thursday, 15th December, a group of startup founders and representatives from some of the world's largest financial institutions reportedly gathered in New York to discuss the common problems they face when building enterprise applications on ethereum.  On site at the undisclosed location appears to have been several bulge bracket banks, including at least one who was in the past involved with R3CEV, a stock exchange and a major software provider, among others.  Independently confirmed attendees include Deloitte blockchain spin-off Nuco, Taiwanese blockchain consortium Amis and ConsenSys, an ethereum platform known for working closely with major tech firms including Red Hat and Microsoft.  Though all the parties involved were discreet, a few additional details have begun to take shape.  ConsenSys chief of staff Jeremy Millar, who previously worked at Goldman Sachs and Barclays, described the secretive project to CoinDesk, stating:  ""We are collaborating with a number of large corporate users of ethereum in banking, energy, supply chain, insurance and other industries along with leading enterprise technology vendors and blockchain startups to establish a standard for private ethereum networks.""  According to Millar, who joined ConsenSys after founding enterprise blockchain consulting firm Ledger Partners LLP, the work is being done in partnership with multiple Ethereum Foundation members and core contributors.  Emphasis on privacy  Present at the meeting was Alex Liu, founder of blockchain consortium Amis.  A former employee of Qualcomm and Samsung, Liu indicated that the Enterprise Ethereum project would consist of an ""enterprise-grade stack"" and provide tools for users with demands to ensure the privacy of transactions – a major pain point for institutions today.  But, he added that the technology would leverage the strengths of ethereum’s public blockchain.  ""The scalability, security, privacy that any enterprise blockchain will want, those are being added or addressed,"" Liu told CoinDesk, adding:  ""But you’ll also see interaction with the public chain.""  In the days following the Ethereum Enterprise meeting, Nuco co-founder Matthew Spoke confirmed he was in New York City to participate in the event.  Possible motives  So far, the reason for the secrecy appears to be concerns about the competition coming from other sectors of the blockchain industry. But, there's reason to be skeptical about this possible reasoning for the group's launch.  Former IBM blockchain developer Henning Diedrich, who left the company last year to work on his own smart contract language, contends that ethereum's software is already suitable for private blockchains that he tested at IBM.  However, he noted that the relatively nascent state of enterprise products like Hyperledger and R3CEV's Corda platform may be forcing enterprise interest in a more robust offering from ethereum, a comparatively more tested alternative.  Though Diedrich argued that ethereum developers still have room to improve the product, he remains skeptical that a large-scale ethereum consortium is even necessary.  ""Sure you can always make it easier,"" he said. ""But the limits are being tackled.""  Not so fast  Regardless of who else might be involved, blockchain consortia have already proven their ability to help organizers recruit high-profile participants.  Ethereum users are no different, according to Hudson Jameson, a former lead blockchain researcher at USAA, and now a member of the Ethereum Foundation.  Jameson told CoinDesk that he believes ""2017 is going to have a number of consortiums, primarily between banks that are all testing on ethereum or ethereum derivatives.""  But, to his knowledge, not a single one of his peers at the Ethereum Foundation was at that secretive meeting in New York City on 15th December.  As for Alex Liu, he’s not surprised in the least that little is known about ""Ethereum Enterprise"", if it exists.  Liu indicated the secrecy is part of the plan, but only for the short term.  He said:  ""As you’ll see, the most exciting thing to come out of it was a series of events over the next month or two months that will become successively more formal.""  Industrial manufacturing image via Shutterstock",NEUTRAL,없음,BLOCKCHAIN | BUSINESS | ETH | EXCHANGE | TECHNOLOGY,Michael del Castillo,0,0,CoinDesk,https://coindesk.com/markets/2017/01/05/what-is-enterprise-ethereum-details-emerge-on-secret-blockchain-project,https://cdn.sanity.io/images/s3y3vcno/production/f6e4e3a6bcb92b7f9d57825fb64fb94c02102bcd-1500x1027.jpg?w=300&h=300&fit=crop
