뉴스ID,뉴스GUID,일자(UTC timestamp),뉴스제목,본문,SENTIMENT,주요코인,카테고리,작성자,추천수,비추천수,출처,뉴스URL,이미지URL
42420977,ha93388BwWkPe8xtcXAoqz,1648738968,The UK Wants to Regulate Crypto: Here's What That Could Look Like,"The United Kingdom is set to create a broad regulatory framework detailing how cryptocurrency businesses can set up shop and operate in the country.  The U.K. Treasury is due to unveil a package for regulating crypto in the coming weeks. Many in the crypto community welcome such a plan, hoping the U.K. will take a similar approach to what the U.S. and European Union have done.  CNBC first reported the U.K.'s plan to regulate crypto earlier this week.  ""Of course reducing financial risk for crypto holders is important, but we hope it does not become over-regulated,” Humayun Sheikh, CEO of artificial intelligence platform Fetch.ai, wrote in an email to CoinDesk. “We look forward to how the regulations plan to address the current opportunities and challenges.""  The U.K. is the latest jurisdiction to speed up efforts to regulate the industry in a comprehensive way in the face of the rising adoption of cryptocurrencies.  The country is a leading decentralized finance (DeFi) spot in Europe in terms of adoption. Crypto investors poured $170 billion into DeFi platforms between June 2020 and July 2021, the most in Europe during that period, according to a Chainalysis report.  The EU approach  In February, the Treasury released a report saying that the U.K. needed to “act quickly” to preserve its position as a crypto hub by having a new framework to regulate crypto.  The report said that the framework should be similar to the European Union’s (EU) Markets in Crypto-Assets (MiCA) package that is making its way through the bloc’s legislative process. The report also said that the Treasury’s regulatory framework should be a functional and technology-neutral approach that would be in line with current regulations and that would factor in crypto risks.  “MiCA negotiations may be finished by the middle of 2022, meaning the U.K. must quickly choose how closely it replicates or diverges from MiCA,” Nicholas du Cros, head of compliance and regulatory affairs at CoinShares, a leading digital asset management firm in Europe, said in an email to CoinDesk.  The MiCA bill, which is meant to be applicable to all 27 EU nations, has a heavy focus on stablecoins.  MiCA defines three subcategories of crypto assets, including the following: asset-referenced tokens, which are stablecoins like Facebook’s now-canceled project Libra that were designed to be backed by a basket of currencies; e-money tokens, which are stablecoins pegged to a fiat currency; and utility tokens, which are intended to provide access to a good or service and are accepted only by their issuers.  Issuers of those kinds of cryptos in the EU must, in the future, publish a white paper.  Meanwhile, firms that provide any service related to the defined crypto assets must obtain approval from regulatory authorities in an EU country. Once they have approval from one local authority and are in accordance with the EU regulations, they can operate anywhere in the EU.  MiCA doesn’t apply to digital currencies issued by central banks or security tokens like securities, deposits, treasury bills or derivatives.  Read more: Europe’s MiCA Crypto Rules Are Coming Soon. Here’s Why They Matter  According to CNBC, the U.K. crypto regulations would likely focus on stablecoins, something the government has been consulting on since the Treasury’s March 2020 budget prioritized the issue.  “Measures are likely to include prior authorization for issuers to operate, capital and liquidity requirements as well as auditing and accounting requirements including the obligation to have sufficient reserves held in high-quality liquid assets,” Ryan Shea, a crypto economist at Trakx, a U.K.-based digital-assets company, said in an email to CoinDesk.  “These additional requirements, on top of standard KYC/AML requirements, increase the regulatory burden and will naturally favor larger crypto firms who have the infrastructure and financial resources to satisfy these demands,” Shea said, referring to know-your-customer and anti-money-laundering requirements.  The U.S. approach  A parallel can be drawn with U.S. President Joe Biden’s recent executive order, du Cross said. In early March, Biden encouraged federal agencies to coordinate their approach to the crypto sector.  The U.K. already set up a joint crypto asset task force in 2018 that consisted of senior representatives from top U.K. regulators, including the Bank of England, Financial Conduct Authority (FCA) and Treasury.  What the U.K. has done so far  The U.K. doesn’t consider crypto as a currency or commodity, and has been regulating the crypto industry in different ways.  The FCA became the U.K.'s regulator for anti-money laundering and countering financing of terrorism (AML/CFT) in 2020, and more than 100 firms have registered to be supervised by the regulator since then. Firms waiting for approval by the FCA were put on its “Temporary Registration Regime” (TRR), which enabled them to do business until April 1.  A small number of firms will be allowed to have temporary registration, beyond that date, the FCA said.  Read more: Crypto Firms Weigh Options as UK Registration Deadline Looms  The FCA also announced in 2018 that cryptocurrency derivatives are capable of being financial instruments under the Markets in Financial Instruments Directive II (MIFID II) and must comply with the regulator's rules for such products.  In 2019, it also published its “Guidance on Crypto Assets,” which set out three other ways crypto could be regulated. Crypto regarded as utility tokens that grant access to prospective products or services in the U.K. can be regulated under e-money regulations. Crypto firms with digital assets for cross-border payments could be subject to payments services regulations, but the tokens themselves wouldn’t be regulated.  The Treasury announced in January that crypto adverts will be subject to FCA rules. Meanwhile, the Advertising Standards Authority (ASA) has been clamping down on crypto ads to make sure they comply with current regulations and don’t mislead consumers.  What is next?  What the U.K. really seems to be missing are ways to regulate cryptocurrencies themselves.  ""I think the real unregulated aspects [in the U.K.] are other crypto assets, especially cryptocurrencies like bitcoin or ethereum,"" Patrick Gruhn, head of FTX Europe, which has been considering expanding to the U.K., said in an interview with CoinDesk.  The answer to what is next also partly depends on what crypto companies and trade groups have pushed to the U.K. Treasury. The Treasury has been in discussions with a number of firms, including the Gemini exchange and crypto trade groups, CNBC reported.  The U.K. Treasury didn’t respond to a request for comment.",POSITIVE,없음,BTC | BUSINESS | EXCHANGE | FIAT | REGULATION,Camomile Shumba,0,0,CoinDesk,https://coindesk.com/policy/2022/03/31/the-uk-wants-to-regulate-crypto-heres-what-that-could-look-like,https://cdn.sanity.io/images/s3y3vcno/production/455eb5207857da0b9fe5d1a90808a753306cb6dd-2005x1496.jpg?w=300&h=300&fit=crop
13388054,https://decrypt.co/?p=96396,1648738897,Bitcoin Exchange Blockchain.com Allowing NFT Usernames for Its 82 Million Wallets,Blockchain.com is integrating with Unstoppable Domains so wallet users can skip the alphanumeric addresses in favor of NFT usernames.,POSITIVE,없음,BTC | ETH | EXCHANGE,,0,0,Decrypt,https://decrypt.co/96396/bitcoin-exchange-blockchain-com-allowing-nft-domain-names-82-million-wallets,https://images.cryptocompare.com/news/default/decrypt.png
13496652,https://coinquora.com/?p=145622,1648738865,"Shiba Inu Metaverse is Out, Dogecoin Creator Reacts Negatively",Shiba Inu announces the launch of its metaverse. Shiba Inu promises over 600K land plots priced between 0.2 ETH and ...Read More...,NEGATIVE,ETH,DOGE | ETH | SHIB,,0,0,Coin Edition,https://coinquora.com/shiba-inu-metaverse-is-out-dogecoin-creator-reacts-negatively/,https://images.cryptocompare.com/news/default/coinquora.png
13571326,https://www.cryptopolitan.com/?p=161234,1648738851,Proxy42 partners with Nodle to Bring Extended Reality into the Gaming Metaverse,"San Francisco, United States, 31st March, 2022, Chainwire Proxy42, a pioneer in extended reality gaming and the metaverse creator behind World League Live!, is partnering with Nodle to generate revenues, ...",POSITIVE,없음,OTHER,,0,0,Cryptopolitan,https://www.cryptopolitan.com/proxy42-partners-with-nodle-to-bring-extended-reality-into-the-gaming-metaverse/,https://images.cryptocompare.com/news/default/cryptopolitan.png
13587807,https://finbold.com/?p=41721,1648738817,IMF warns Russian sanctions could boost use of crypto and erode dollar’s supremacy,"As the Russian invasion of Ukraine enters its second month, the top International Monetary Fund (IMF) official has warned that... Continue reading The post IMF warns Russian sanctions could boost use of crypto and erode dollar&apos;s supremacy appeared first on Finbold.",NEUTRAL,없음,OTHER,,0,0,Finbold,https://finbold.com/imf-warns-russian-sanctions-could-boost-use-of-crypto-and-erode-dollars-supremacy/,https://images.cryptocompare.com/news/default/finbold.png
42374972,0r6Zag11PPDEMKgUWw4hlR,1648738800,DeFi Portal 1inch Launches Wallet App on Android,"1inch, a decentralized finance (DeFi) protocol for routing cryptocurrency trades, has released a wallet for Android users, according to a statement on Thursday.  Android users will be able to store, send, receive and trade crypto on Ethereum, BNB Chain, Polygon and Avalanche, as well as take advantage of token swaps, according to the statement. They'll also be able to connect the wallet to the decentralized application in any browser or device.  1inch released its wallet app on Apple's iPhone in late April 2021, two months after it went live on Binance Smart Chain (now known as BNB Chain).  1inch is one of the largest decentralized exchange (DEX) aggregators, with 24-hour trading volume of $309 million on Ethereum, according to Dune Analytics.  Read more: Solana Wallets Phantom, Solflare Eye Mobile for Growth",POSITIVE,BNB,BLOCKCHAIN | ETH | EXCHANGE | MATIC | BNB,Camomile Shumba,0,0,CoinDesk,https://coindesk.com/business/2022/03/31/defi-portal-1inch-launches-wallet-on-android,https://cdn.sanity.io/images/s3y3vcno/production/095f31f64b7d4e28de2e0cb20c0ddc3e2f6e2a06-1920x1080.png?w=300&h=300&fit=crop
13411501,https://blockworks.co/?p=19661,1648738785,Ted Cruz’s Senate Bill on CBDCs Replicates January House Proposal,The senator&apos;s legislation calls to prohibit the Federal Reserve from issuing a government-backed currency to individualsThe post Ted Cruz&apos;s Senate Bill on CBDCs Replicates January House Proposal appeared first on Blockworks.,NEUTRAL,없음,FIAT | REGULATION,,0,0,Blockworks,https://blockworks.co/ted-cruzs-senate-bill-on-cbdcs-replicates-january-house-proposal/,https://images.cryptocompare.com/news/default/blockworks.png
13334039,https://cointelegraph.com/news/bitcoin-suddenly-dives-to-46k-as-attention-focuses-on-large-cme-futures-gaps,1648738652,Bitcoin suddenly dives to $46K as attention focuses on large CME futures gaps,"There are forces at work which could take BTC price action back to $44,500 in the short term, analysts reveal.",NEGATIVE,BTC,BTC | TRADING,,0,0,CoinTelegraph,https://cointelegraph.com/news/bitcoin-suddenly-dives-to-46k-as-attention-focuses-on-large-cme-futures-gaps,https://images.cryptocompare.com/news/default/cointelegraph.png
13371623,https://thecoinrise.com/?p=19727,1648738634,Kyrgyzstan MP suggests crypto legalization and CBDC in the nation,"It is undeniable that crypto and Blockchain technology is a bubble as many say and the latest statement by Kyrgyzstan member of parliament (MP) Karim Khanjeza agrees with that. However, the MP highlighted the urgent need for the legalization of cryptocurrency in the nation during a parliamentary committee meeting on law and order and fighting corruption. While ...The post Kyrgyzstan MP suggests crypto legalization and CBDC in the nation appeared first on Blockchain, Crypto and Stock News.",POSITIVE,없음,BLOCKCHAIN | BUSINESS | REGULATION | TECHNOLOGY,,0,0,The Coin Rise,https://thecoinrise.com/kyrgyzstan-mp-suggests-crypto-legalization-and-cbdc-in-the-nation/,https://images.cryptocompare.com/news/default/thecoinrise.png
13496653,https://coinquora.com/?p=145417,1648738591,Ronin Bridge Hack May Change the Future of VC Investment in Crypto,Ethereum-based sidechain Ronin was hacked earlier this week. This hack could change how VCs invest in crypto. Auditing the code ...Read More...,NEUTRAL,없음,MARKET,,0,0,Coin Edition,https://coinquora.com/ronin-bridge-hack-may-change-the-future-of-vc-investment-in-crypto/,https://images.cryptocompare.com/news/default/coinquora.png
13413830,https://coinpedia.org/?p=122817,1648738508,BitKan Celebrates 9th Anniversary By Launching BitKan Earn Up To 40% Bonus APY Passive Income,"The post BitKan Celebrates 9th Anniversary By Launching BitKan Earn Up To 40% Bonus APY Passive Income appeared first on Coinpedia - Fintech &amp; Cryptocurreny News Media| Crypto GuideIt has been nine years since BitKan was established. The cryptocurrency exchange has come a long way since its humble beginnings in 2012. In less than a decade, BitKan has withstood the ebb and flow of the crypto markets and grown to serve millions of users in over 170 countries. Since the launch of automated …",POSITIVE,없음,EXCHANGE | MARKET,,0,0,coinpedia,https://coinpedia.org/press-release/bitkan-celebrates-9th-anniversary-by-launching-bitkan-earn-up-to-40-bonus-apy-passive-income/,https://images.cryptocompare.com/news/default/coinpedia.png
13496654,https://coinquora.com/?p=145664,1648738368,The brutal Drunk Robots Enters the IDO octagon on April 7,"For users, this will be a unique chance to become the owner of $METAL tokens at an early stage. Famous ...Read More...",POSITIVE,없음,OTHER,,0,0,Coin Edition,https://coinquora.com/the-brutal-drunk-robots-enters-the-ido-octagon-on-april-7/,https://images.cryptocompare.com/news/default/coinquora.png
13496655,https://coinquora.com/?p=145657,1648737561,"Aladdin Exchange Lists First BEP-20 Token, Launches SAHARA Trading Event","Dubbed as one of the fastest-growing crypto exchange platforms, Aladdin Exchange never ceases to amaze users with its round-the-clock upgrades ...Read More...",POSITIVE,없음,EXCHANGE | TRADING,,0,0,Coin Edition,https://coinquora.com/aladdin-exchange-lists-first-bep-20-token-launches-sahara-trading-event/,https://images.cryptocompare.com/news/default/coinquora.png
13425700,https://news.bitcoin.com/?p=518444,1648737439,"Bitcoin, Ethereum Technical Analysis: ETH Remains Above $3,400 Despite Bullish Momentum Slowing","Ethereum was trading above the $3,400 level for a third consecutive session, however bullish momentum has somewhat eased, as market uncertainty has gradually risen. With prices trading near resistance levels, bulls have pulled back, giving way to bears looking at re-entering the market. Bitcoin Bulls in BTC have also pulled back, as prices continue to ...",NEUTRAL,BTC | ETH,BTC | ETH | MARKET | TRADING,,0,0,Bitcoin.com,https://news.bitcoin.com/bitcoin-ethereum-technical-analysis-eth-remains-above-3400-despite-bullish-momentum-slowing/,https://images.cryptocompare.com/news/default/bitcoincom.png
13266142,https://ambcrypto.com/?p=225378,1648737021,What Ethereum Classic’s is up to after its recent massive 60% rally,Disclaimer: The findings of the following analysis are the sole opinions of the writer and should not be considered investment advice Ethereum Classic was trading at $49.25 at the time of writing. It has made enormous bullish strides in the past few days as it smashed its way past multiple levels of resistance. Can Ethereum Classic ...,POSITIVE,없음,ALTCOIN | ETC | MARKET | TRADING,,0,0,AMB Crypto,https://ambcrypto.com/what-ethereum-classics-is-up-to-after-its-recent-massive-60-rally/,https://images.cryptocompare.com/news/default/ambcrypto.png
13255014,https://dailyhodl.com/?p=196832,1648737004,"Bitcoin Will Continue To Outperform Stock Market, Says Bloomberg Intelligence Analyst Mike McGlone – Here’s Why","Bloomberg Intelligence analyst Mike McGlone says that Bitcoin (BTC) will continue to see more gains than the stock market as the benchmark crypto asset catapults to a 2022 record high. In a new interview with Yahoo Finance, McGlone identifies what&apos;s behind Bitcoin&apos;s recent rally after BTC dropped below $40,000 earlier this year. &apos;The significance of ...The post Bitcoin Will Continue To Outperform Stock Market, Says Bloomberg Intelligence Analyst Mike McGlone - Here&apos;s Why appeared first on The Daily Hodl.",POSITIVE,BTC,BTC | BUSINESS | MARKET | TRADING,,0,0,The Daily Hodl,https://dailyhodl.com/2022/03/31/bitcoin-will-continue-to-outperform-stock-market-says-bloomberg-intelligence-analyst-mike-mcglone-heres-why/,https://images.cryptocompare.com/news/default/dailyhodl.png
42374971,0r6Zag11PPDEMKgUWw4hkB,1648736875,Binance Is Sponsoring the Grammys This Year,"Binance wants its slice of the red carpet.  The company said in a press release Thursday that it is ""the first-ever official cryptocurrency exchange partner"" of the Recording Academy, the organizer of the annual Grammy Awards.  In a year of Super Bowl ad blitzes and Oscars TV spots, the Binance deal aims to get the world's largest crypto exchange by trade volume into the Hollywood spotlight.  Held this year in Las Vegas on April 3, the Grammys are meant to honor 2021's best musical performances.  Binance said in a press release that the partnership with the Recording Academy could extend beyond just a branding opportunity.  ""Starting with the Grammys, we are excited to work together with the Recording Academy to bring fresh new experiences powered by blockchain and all the great things Web3 technology can bring to entertainment,"" Binance co-founder Yi He said in a statement.  It's not the Grammys' first Web 3 foray. Last November, the awards show tapped the Tezos-based OneOf non-fungible token (NFT) platform for a three-year partnership.  Read more: NFT Platform OneOf Signs 3-Year Deal With Grammys",POSITIVE,없음,BLOCKCHAIN | EXCHANGE | SPONSORED | TECHNOLOGY | BNB,Zack Seward,0,0,CoinDesk,https://coindesk.com/business/2022/03/31/binance-is-sponsoring-the-grammys-this-year,https://cdn.sanity.io/images/s3y3vcno/production/a1853dfe5987e714ee566e754424f6cce6b148f4-5089x3513.jpg?w=300&h=300&fit=crop
42374962,0r6Zag11PPDEMKgUWw4hbN,1648736615,Russia Sanctions Could Spur Use of Crypto: IMF's Gopinath,"A top International Monetary Fund official called for international regulation of digital finance, predicting ""the adoption of digital finance, from cryptocurrencies to stablecoins and central bank digital currencies"" following the unprecedented sanctions on Russia after its invasion of Ukraine.  Gita Gopinath, the first deputy managing director at the IMF, made the comments in an interview with the Financial Times published Thursday.  Gopinath said that ""all of these will get even greater attention following the recent episodes, which draws us to the question of international regulation."" She advocated for a coordinated approach to fill a gap in international regulation.  Measures imposed by western countries on Russia ""could encourage the emergence of small currency blocs based on trade between separate groups of countries,"" she said.  While the dollar may become less dominant in the international financial system, it will remain the major global currency, even if fragmented, according to Gopinath.  Gopinath's comments reiterate the stance taken by the IMF last year, when it outlined the need for a global approach to crypto regulation. A blog post from December stated the need for a “comprehensive, consistent and coordinated” approach in order to harness the benefits of crypto’s underlying technology while mitigating some of its risks.",NEUTRAL,없음,FIAT | REGULATION | TECHNOLOGY,Amitoj Singh,0,0,CoinDesk,https://coindesk.com/policy/2022/03/31/russia-sanctions-could-spur-use-of-crypto-imfs-gopinath,https://cdn.sanity.io/images/s3y3vcno/production/ec95a34abb5578a93c5ef246a3e974a5cbee8fae-1500x1035.jpg?w=300&h=300&fit=crop
13493137,https://seekingalpha.com/article/4498956-voyager-digital-plunged-25-percent-heres-why?utm_source=cryptocompare.com&utm_medium=referral,1648736407,Voyager Digital Plunged By Nearly 25%: Here's Why,Markets panic - sold Voyager after it received a court order.Sudden stock decline creates a better price for cryptocurrency investors seeking exposure to crypto platform.$8.00 - $10.00 price target discussed.,NEGATIVE,없음,BUSINESS | MARKET | TRADING,,0,0,Seeking Alpha,https://seekingalpha.com/article/4498956-voyager-digital-plunged-25-percent-heres-why?utm_source=cryptocompare.com&utm_medium=referral,https://images.cryptocompare.com/news/default/seekingalpha.png
13586591,https://blog.tipranks.com/?p=208923,1648736141,Bulliverse to Launch Decentralized 3D Metaverse Ads,"Advertisement has been the backbone of businesses in the past. There is a chance that you&apos;ve seen a video or banner ad when you were surfing through various websites today. According to statistica, nearly $356 billion was spent on digital advertising in 2020 while just 40 billion was spent on digital advertising in 2012, which shows an accelerated growth in the digital advertising industry. The arrival of the Internet brought a revolution in the display of advertisement. Currently, there&apos;s an emergence in the advertising industry, the Metaverse. The Metaverse is a rich virtual space in which people can work, play, shop and socialize.",NEUTRAL,없음,OTHER,,0,0,TipRanks,https://www.tipranks.com/news/article/bulliverse-to-launch-decentralized-3d-metaverse-ads?utm_source=cryptocompare.com&utm_medium=referral,https://images.cryptocompare.com/news/default/tipranks.png
13586590,https://trblogstaging.wpengine.com/?p=208923,1648736141,Bulliverse to Launch Decentralized 3D Metaverse Ads,"Advertisement has been the backbone of businesses in the past. There is a chance that you&apos;ve seen a video or banner ad when you were surfing through various websites today. According to statistica, nearly $356 billion was spent on digital advertising in 2020 while just 40 billion was spent on digital advertising in 2012, which shows an accelerated growth in the digital advertising industry. The arrival of the Internet brought a revolution in the display of advertisement. Currently, there&apos;s an emergence in the advertising industry, the Metaverse. The Metaverse is a rich virtual space in which people can work, play, shop and socialize.",NEUTRAL,없음,OTHER,,0,0,TipRanks,https://trblogstaging.wpengine.com/bulliverse-to-launch-decentralized-3d-metaverse-ads?utm_source=cryptocompare.com&utm_medium=referral,https://images.cryptocompare.com/news/default/tipranks.png
61848,https://www.bitdegree.org/crypto/news/delta-app-implements-nft-tracking-tool,1648736118,Delta App Adds NFTs to Investment Tracker,The multi asset investment tracking platform will now let users track the performance of their cryptocurrencies.,NEUTRAL,없음,OTHER,,0,0,BitDegree,https://www.bitdegree.org/crypto/news/delta-app-implements-nft-tracking-tool,https://resources.cryptocompare.com/news/66/61848.jpeg
13496656,https://coinquora.com/?p=145626,1648736100,Introducing Alpha Venture DAO – A Builders’ DAO for Web3 Projects,Alpha Finance Labs announces a new Builders&apos; DAO - Alpha Venture DAO. Alpha Venture DAO will build and incubate cutting-edge ...Read More...,POSITIVE,없음,OTHER,,0,0,Coin Edition,https://coinquora.com/introducing-alpha-venture-dao-a-builders-dao-for-web3-projects/,https://images.cryptocompare.com/news/default/coinquora.png
13586592,https://blog.tipranks.com/?p=208928,1648735861,This Week in Crypto: Bitcoin Breaks Out,"Following weeks of uncertainty, the crypto ecosystem is showing promising signs of a renewed bullish run. Over the last seven sessions, nearly every major cryptocurrency experienced upward momentum as the aggregate market capitalization inches closer to $2.2 trillion. BTC Breaks Past Key Resistance Bitcoin prices have finally broken above resistance sitting at $43,500 after consolidating within a narrowing range over the last few months. Over this week, BTC gained nearly 11%, crossing the $47,000 mark, and is now looking to close above the key resistance level at $48,000 before making another attempt to retake $50,000.",POSITIVE,BTC,BTC | MARKET | TRADING,,0,0,TipRanks,https://www.tipranks.com/news/article/this-week-in-crypto-bitcoin-breaks-out?utm_source=cryptocompare.com&utm_medium=referral,https://images.cryptocompare.com/news/default/tipranks.png
13334040,https://cointelegraph.com/news/seven-common-mistakes-crypto-investors-and-traders-make,1648735759,Seven common mistakes crypto investors and traders make,"Cryptocurrency markets are volatile enough without making simple, easily avoidable mistakes.",NEGATIVE,없음,BUSINESS | ICO | MARKET | TECHNOLOGY | TRADING,,0,0,CoinTelegraph,https://cointelegraph.com/news/seven-common-mistakes-crypto-investors-and-traders-make,https://images.cryptocompare.com/news/default/cointelegraph.png
13401497,https://cryptopotato.com/?p=179888,1648735584,America’s Oldest Bank to Become Primary Custodian of Circle’s USDC,"BNY Mellon will be the primary custodian for Circle&apos;s stablecoin, according to a recent announcement.",POSITIVE,USDC,FIAT | USDC,,0,0,Crypto Potato,https://cryptopotato.com/americas-oldest-bank-to-become-primary-custodian-of-circles-usdc/,https://images.cryptocompare.com/news/default/cryptopotato.png
