뉴스ID,뉴스GUID,일자(UTC timestamp),뉴스제목,본문,SENTIMENT,주요코인,카테고리,작성자,추천수,비추천수,출처,뉴스URL,이미지URL
42397354,DbF8Q09kuKX2XWBxAaq2Bo,1391725922,Chicago Sun-Times Bitcoin Paywall Shows 25 Cents is Sweet Spot,"The Chicago Sun-Times and BitWall have released new metrics regarding their 1st February bitcoin paywall test, revealing that Sun-Times readers contributed more than 700 donations to the Taproot Foundation as part of the 24-hour trial.  Conducted last Saturday, the introductory partnership found the ninth-largest US newspaper teaming up with an emerging San Francisco startup as a way to explore its own monetization options. BitWall, on the other hand, received its first chance to launch a large-scale test of whether bitcoin micropayments could deliver for mainstream publishers.  Speaking to CoinDesk, BitWallhttp://www.bitwall.io/ CEO and co-founder Nic Meliones recounted what was at stake for his company and the wider industry:  ""The big picture was testing bitcoin as a payment method and showing that there is an appetite for consumers out there to use this technology, and do it easily,"" Meliones said.  Meliones said that on this count, both his company and bitcoin passed the test. BitWall experienced no downtime during the 24-hour period, and received positive feedback from readers, including mobile users, a key demographic given how content consumption is trending, the CEO said.  ""There were a lot of users out there on mobile, and we've been priming the product to get it ready for that, to make things as frictionless as possible,"" said Meliones.  In turn, the Sun-Times got its first glimpse of what kind of revenue micropayments could bring to its operations.  Micropayment data  Broken down by donation size, the 713 bitcoin contributors were most likely to give 25 cents - 63% of the bitcoin donations made to the Sun-Times were for payments in this denomination.        Chicago Sun-Times Bitcoin Donations by Size        As shown by this chart, perhaps most encouragingly for content providers, less than 2% of bitcoin users donated an amount of less than 25 cents, while 31% donated between 25 cents and $13 for content.  Meliones said the size of the donations was indicative of how easy it is for consumers to engage in small bitcoin payments.  Social engagement  As an alternative to bitcoin gifting, readers were also able to donate tweets in support of the Taproot Foundation.  Perhaps unsurprisingly, the test showed users were eager to receive content for providing the organization free publicity. The data shows just how much exposure publishers could gain from a social paywall. Each tweet generated an additional 38 clicks for the nonprofit.  Still, Meliones suggested bitcoin payments were the more popular option due to the high community support for the test.  ""For a lot of different publications, tweets and bitcoin donations have been in line, but in this case, bitcoin donations were more prolific,"" Meliones said.  Next steps  For now, Meliones is confident in the results and what they say about BitWall's capabilities to deliver on its value proposition. The CEO said that the test was proof that it could successfully launch its service, and do so on a platform with the kind of high-volume traffic of the Sun-Times.  While Meliones declined to comment on how talks with the Sun-Times had progressed since Saturday's test, he did indicate that conversation is still persisting between the two organizations.  ""We're still chatting on that quite a bit,"" he said.  Image credit: US quarter | adam*b",POSITIVE,없음,BTC | BUSINESS | TECHNOLOGY,Pete Rizzo,0,0,CoinDesk,https://coindesk.com/markets/2014/02/06/chicago-sun-times-bitcoin-paywall-shows-25-cents-is-sweet-spot,https://cdn.sanity.io/images/s3y3vcno/production/eba9961be89dd774eda2592de1b3cb652cf8b4c0-1024x681.jpg?w=300&h=300&fit=crop
42397352,DbF8Q09kuKX2XWBxAaq2Ap,1391722753,Gavin Andresen: It's Going to be Tough for Governments to Control Bitcoin,"Bitcoin Foundation's chief scientist Gavin Andresen addressed the subject of bitcoin regulation as part of the US Council on Foreign Relations' (CFR) latest 'Voices of the Next Generation' discussion in Washington, DC today.    During the 60-minute question-and-answer session, attendees and moderator Douglas Rediker asked Andresenhttps://bitcoinfoundation.org/about/board probing and sometimes pointed questions about the emerging virtual currency, as well as its implications for governments and the world economy.    Perhaps most notably, Andresen stated that the bitcoin community would welcome smart regulations that enhance the safety of the ecosystem:      ""Consumer protection makes sense. You should have some idea of who you're interacting with if you're trusting them with money,"" Andresen said.              Furthermore, Andresen suggested that democratic governments won't be likely to have success if they try to control bitcoin.      ""For other more liberal countries, it's going to be tough to say don't buy shoes from someone in this country because we don't like that country.""              Overall, Andresen said he did his best to ""stay humble"" while building a rapport between bitcoin and an audience that was not yet familiar with the goals and concepts driving the currency.      ""I think people love to think that there's somebody that does have all the answers, I just try to be careful to not pretend that I have some knowledge that I don't,"" Andresen told CoinDesk after the meeting.    Discussion points    [post-quote]      Despite, or perhaps because of, the open nature of the discussion, the majority of the questions focused on what could be perceived as potential weak points in Bitcoin's design.      These included queries about how much control Bitcoin Foundation members have over the Bitcoin protocol, whether bitcoin users viewed any regulation as beneficial, and whether bitcoin's deflationary nature could inhibit spending when used on a mass scale.      As a result, the tone seemed more indicative of the growing public concern over bitcoin than the tenor of the CFR's original email suggested.      ""Bitcoin is still in its early adopter phase. It's so young still, it doesn't surprise me that people don't grasp the basics,"" Andresen said.      If those asking questions were seeking more direct answers, Andresen did his best to frame bitcoin the currency as a work in progress that is seeking larger shared benefits for the world, and bitcoin the community as one where questions are always welcomed, if not yet answerable.      ""All moneys are this shared delusion. They're valuable because they say we have value. Money doesn't grow on trees,"" Andresen commented.              Like witnesses at the NYDFS hearings last month, Andresen chose to compare bitcoin to the Internet, focusing on how it could improve pain points shared by all consumers and lead to cheaper, faster and better ways of payment that promote the common good.      ""If you think about the payment systems we have today, it was created in the paper days. It's evolved, although if you try to pay somebody, it may take three to four to five days, that's kind of crazy,"" Andresen said.            A successful failure    The chief scientist also emphasized that bitcoin could still fail, and that certain unforeseeable events – such as errors with coding, or a new and improved system – could ultimately render it useless.      The problem with the current payment system, Andresen postured, is bigger than bitcoin, and may prove beyond its capabilities. He added:      ""If Bitcoin turns out to be a miserable failure, but it does encourage some government to realize that our payment systems are broken and archaic, and some country decides we're going to make a payment system for this century, I think that would be a huge success.""            ""Voices of the Next Generation"" series    Andresen's invitation to the noted CFR series inspired mixed reactions on bitcoin forums, with some viewing the invitation as a promising sign of bitcoin's increasing mainstream acceptance, and others suggesting the CFR's decision could potentially harbor more hostile motives.      Andresen has been an outspoken thought leader in the burgeoning industry, and joins other distinguished alumni of the series, including New Republic editor Peter Beinart and Eurasia Group president Ian Bremmer, on the list of those who have given talks to the CFR.    Andresen's bitcoin history    Andresen began the CFR discussion by introducing himself and his past work on bitcoin, which began in 2010. He notably mentioned Bitcoin Faucet, a now defunct project that over the course of its run ""gave away 10,000 BTC,"" which Andresen estimated to be worth $8m by today's standards.      ""Since then, my life has been endlessly fascinating,"" he remarked.      In May, Andresen sat down with CoinDesk to reveal his views on where the currency was headed. Andresen described himself as conservative – and, unsurprisingly given the day's comments, suggested that he sees government playing an increasing role in regulating virtual currency.      Image credit: Gil C / Shutterstock.com",NEUTRAL,BTC,BLOCKCHAIN | BTC | REGULATION,Pete Rizzo,0,0,CoinDesk,https://coindesk.com/markets/2014/02/06/gavin-andresen-its-going-to-be-tough-for-governments-to-control-bitcoin,https://cdn.sanity.io/images/s3y3vcno/production/3b234fd9a257df15969201748de2159177b4f916-1000x672.jpg?w=300&h=300&fit=crop
42397368,DbF8Q09kuKX2XWBxAaq2Ob,1391716213,Watch this Bitcoin Fanatic Shoot His iPhone After Apple Blacklists Blockchain,"Infuriated by Apple's sudden move to ban bitcoin wallet provider Blockchain from its App stores on Wednesday, the bitcoin community flocked to reddit today in a spirited and controversial showing of support for the virtual currency.      Reddit posts abounded decrying Apple's move as an anti-competitive maneuver that positions the Cupertino company against innovation and its core values.      However, there may be no more dedicated bitcoin supporter than Ryan of the YouTube video series Ryan's Range Report, a vlogger and long-range shooting devotee who found a rare combination of his passions when he blasted his iPhone 4S to pieces to voice his displeasure with Apple's decision.      The gesture was not unprompted, however, as it was in response to a reddit post by user round-peg, who engaged the reddit's bitcoin community with a unique proposition. For every 100 upvotes his post received, round-peg indicated that he would ""gift someone a Nexus 5 for a video of them smashing their iPhone"".      At press time, the post had received more than 2,400 upvotes, and 1,037 comments. Though, notably, round-peg's account was no longer accessible. Round-peg was likely banned for his open solicitation of upvoting, which was in violation of reddit's rules.    Rules of engagement    Round-peg did put a cap on his philanthropy, noting in his post that his offer would extend for ""up to 500 upvotes (5 devices)"", and that new phones would be distributed on a ""first-come, first serve"" basis. The user eventually expanded this limit to include six videos.      Round-peg also listed the criteria videos needed to meet to be eligible, which was taken down and later reposted:    The device must be an iPhone 5 or 5S running iOS7  The video must be uploaded to YouTube and publicly accessible  The video must show the participants face, name and why they are smashing the iPhone  The link must be posted in the initial thread.    The reddit user also posted a number of additional considerations that he felt participants should take into account before creatively discarding their iPhones. Interestingly, round-peg takes his name from a famous Apple commercial:    “Here's to the crazy ones. The misfits. The rebels. The troublemakers. The round pegs in the square holes. The ones who see things differently. They're not fond of rules. And they have no respect for the status quo. You can quote them, disagree with them, glorify or vilify them. About the only thing you can't do is ignore them. Because they change things. They push the human race forward. And while some may see them as the crazy ones, we see genius. Because the people who are crazy enough to think they can change the world, are the ones who do.”  iPhone fury unleashed    Whatever response roung-peg expected, it was clear that the offer struck a chord in a community that felt betrayed by a company many had come to view as the preeminent voice in the tech industry.      User netpastor took round-peg up on this offer, posting a two-minute video of himself reading round-peg's conditions and ultimately smashing his iPhone 5 with a metal bar.    ""This is a game changing decision on Apple's part, and the Bitcoin community won't take it lying down. I'm not a spokesperson, just someone who's very unhappy with this dishonorable action by Apple,"" netpastor, who goes by the YouTube name Boanerges, wrote in the post.  Round-peg followed up this show of support, with a comment indicating that the replacement phone had been purchased as promised.    User upgradesolution voiced his support with what appeared to be a tire iron.      ""I'm about to destroy my iPhone 5 32G, because Apple has decided to block bitcoin apps on their app store.""                  Reddit user OscarChapa_ felt similarly, also citing Apple's stance toward the NSA as a factor.          ""Apple has decided to effectively block any advances in bitcoin and any sort of cryptocurrency, and for a company that promotes any kind of futurism, that is not acceptable,"" he said before taking a machete to his device.              User Downhill280Z took a more soft-spoken approach, dropping his iPhone down a flight of stairs.    User huskyminers chose the wrench as his weapon of choice:  Controversy    Stacy Herbert, co-host of the Keiser Report on RT, told CoinDesk that the community reaction is a strong sign that Apple's policies are beginning to alienate core users.      ""This decision will ultimately have a bigger negative impact on Apple than it will on bitcoin. Once you become as uncool as Microsoft, it's hard to ever get that groove back. Apple's mistake, however, will be someone else's gain. I would think that immediately, for example, Android smartphones will be the big winner. And we see that with the smashing iPhone videos,"" Herbert said.              Though some community members chose to view the events as a show of support in the face of Apple's seemingly staunch resistance to bitcoin, others were less amused.      Some redditors suggested that the contest was in poor spirit and that it reflected negatively on bitcoin and the wider community.    What's your opinion of the iPhone smashings? Weigh in below.  Image credit: Smashed iPhone | carrrrrlos",NEGATIVE,없음,BLOCKCHAIN | BTC,Pete Rizzo,0,0,CoinDesk,https://coindesk.com/markets/2014/02/06/watch-this-bitcoin-fanatic-shoot-his-iphone-after-apple-blacklists-blockchain,https://cdn.sanity.io/images/s3y3vcno/production/0a8d90598b8c233b561ba95eb052e4fdb3d7de6c-1024x681.jpg?w=300&h=300&fit=crop
42397353,DbF8Q09kuKX2XWBxAaq29q,1391712217,Venture Capitalists and Bitcoin Companies React to Apple’s Blockchain Ban,"News that Apple had pulled the Blockchain.info app from its App Store broke in the early hours of this morning (UK-time) and the short-term effect seemed to be a dip in the price of bitcoin.  At midnight (GMT), the price was $822. Some 15 minutes later, Blockchain tweeted its response to Apple's decision and, over the course of the next hour, the bitcoin price fell to $793. By 08:30, the price had fallen to $783.04, the lowest it has been since 2nd January.  At the time of writing, the price is back up to $802, but this is still 8% lower than yesterday's high of $874.  Jeremy Allaire, CEO of Circle, the bitcoin company that raised $9m in funding last year, said he's not convinced the price drop was caused by Apple's actions. He said:  ""The volume of bitcoin that is traded each day is so small that just one person, maybe a large miner who is selling BTC to get liquidity, can move the price. So price fluctuations are often absolutely nothing to do with what's going on in the news.""  Nic Cary, CEO of Blockchain agreed, adding that any time significant news breaks about bitcoin, the price moves one way or the other. However, he doesn't consider the latest price drop to be an issue.  ""Bitcoin is extremely resilient. I'm confident the price will rebound quickly. Bitcoin is impervious to Apple's app store policies,"" he said.  The effect on VC activity  Cary also doesn't think Apple's decision will have any wider-reaching implications. He certainly doesn't think the move will put a dampener on VC activity in the bitcoin space.  [post-quote]  ""VCs understand that Apple's harsh anti-Bitcoin policy is nothing new. Coinbase raised $25 million after their app was yanked last year,"" he said. ""The largest migration of human and financial capital is underway into bitcoin projects and we're just getting started.""  Jeremy Allaire also doesn't think Venture Capital firms will be put off investing in bitcoin companies because of Apple's harsh stance on digital currency apps.  ""Quality VC firms are not news-driven in their decisions. Those that are excited about bitcoin are taking a long view and are interested in how the space is going to evolve,"" he said.  Allaire believes companies can build ""outstanding"" applications that can be used on iOS in a browser and that these can accomplish 99% of what can be done in a native app.  VC activity in the bitcoin space certainly doesn't appear to be slowing down. Blockchain, BitPay and Bitstamp are all rumoured to be in the process of raising mammoth funding rounds.  Losing favour  It's evident that Apple's actions have lost it a fair few fans over the past 24 hours. Twitter, Reddit and other forums are awash with negative comments aimed at the tech giant.  Barry Silbert, CEO of Second Market and founder of the Bitcoin Investment Trust, voiced his disappointment in a tweet:    Disappointing to see @Apple turn its back on millions of bitcoin users worldwide. I'll be buying a new phone asap http://t.co/x5Rwfy5ugr      — Barry Silbert (@barrysilbert) February 6, 2014    Twitter user Bitrific was equally disgruntled by the move:    Goodbye to my iPhone and iPad - Never Again Any Apple Product: After banning blockchain app from the store, I ... http://t.co/VvVv3tpHnw      — B I T R I F I C (@bitrific) February 6, 2014    Ex-Facebook executive Chamath Palihapitiya threw in his two cents' worth, too:    $AAPL blocking blockchain makes me think: 1) they will legislate where they can't innovate 2) creates huge motivation to move to android      — Chamath Palihapitiya (@chamath) February 6, 2014    Cary said his company has received a ""tremendous response"" from the bitcoin community, in the form of hundreds of supportive comments and messages.  He went on to stress Blockchain isn't giving up and highlighted that his colleagues have already started engineering an HTML5 app that will launch soon on Blockchain.com.  ""Of course, users can download our Android app anytime - in fact, it's having a record day. Apple is losing ground across the world and they will find themselves on the wrong side of history here. We'll just leapfrog them,"" Cary concluded.  Eradicating competition  Allaire speculated that there are two possible reasons why Apple has banned bitcoin wallet apps. The first is conservatism – that the company is fearful of the perceived risk that comes with bitcoin.  Those on the risk assessment side of Apple's policy team may be looking at the bitcoin-associated federal indictments, law enforcement actions and money laundering stories that are flying around and decide it's safest to steer clear, at least for the time being.  The second motive Allaire suggests is that Apple wishes to cordon off and gain a position of advantage in the digital payments space. He said:  ""Apple's iBeacon and Bluetooth protocols are very clearly designed for payments. Those two things are proprietary – no one can use them, and I think it's very clear that Apple is planning to introduce its own digital wallet.""  He doesn't, however, believe the company will launch its own digital currency, just that it will maintain an advantage in digital payments by blocking bitcoin apps that can be used for sending and receiving funds.  Allaire believes that if this were the case, though, the Federal Communications Commission (FCC) would step in to prevent Apple from using the App Store to monopolise the market.  ""There is precedent for this,"" he said. ""When the iPhone came out and Google wanted to launch Google Voice as an app on iOS, Apple banned it and wouldn't approve any voice apps. The FCC then took action.""  For the mean time, Apple is sticking to its guns and making it extremely difficult for bitcoiners to stay loyal to the brand. Something tells me Android is going to see a spike in new users over the coming days.",NEUTRAL,BTC,BLOCKCHAIN | BTC | EXCHANGE | MARKET | TRADING,Emily Spaven,0,0,CoinDesk,https://coindesk.com/markets/2014/02/06/venture-capitalists-and-bitcoin-companies-react-to-apples-blockchain-ban,https://cdn.sanity.io/images/s3y3vcno/production/6638b5d9e4e41d18e3be48ad49ec29221d5b5d1b-1024x768.jpg?w=300&h=300&fit=crop
42397362,DbF8Q09kuKX2XWBxAaq2Jg,1391711263,Perseus Telecom Partners With GoCoin to Accept Bitcoin,"Perseus Telecom, a high-speed, heavy-bandwidth communications channel provider for major global stock and securities exchanges, has revealed today that it will accept bitcoin payments.    Perseus connects hedge funds, high-speed trading firms, media organizations and stock exchanges in the world's top trading centers, including: Brazil, Dublin, Frankfurt, Hong Kong, London, Madrid, Moscow, New York, Stockholm and Tokyo.      Commenting on the news, Jock Percy, Perseus' CEO, called bitcoin ""a valuable digital asset and form of payment"", and indicated in an interview that it was not the company's traditional financial services clients that brought about the decision.      Rather, Percy noted it was his customers who provide online gaming to worldwide players who were the key drivers:      ""They reached out to us and a couple of them said: 'We would like to pay in bitcoin because it's the currency of our user base.'""            Positioning for expansion    Still, Percy, who joined the company in 2010, sees its bitcoin decision as one that positions it for future growth in customer bases that have yet to emerge.      For example, the CEO said he expects an expansion in bitcoin transactions throughout the financial services and securities trading sectors in the future.      However, until then, expansion is expected to continue rapidly in the gaming sector, as more major online gaming providers begin experimenting with and accepting bitcoin.      Of course, certain aspects of the deal are geared toward limiting Perseus' short-term risk from bitcoin's price volatility.      The company selected Singapore and California-based bitcoin payment gateway GoCoin as its processor, and under the terms of the deal, Perseus may choose whether to receive bitcoin payments in BTC or convert all or part of its payments into USD.    GoCoin's latest customer    Founded in 2013, GoCoin is one of the newer payment processors serving the industry, though, it is already making headlines for its funding and innovative service features.      In November, the company raised $550,000 as part of a seed funding round led by a former COO of Facebook, and in January if became one of the first bitcoin processors to begin accepting litecoin.      GoCoin Chairman Brock Pierce weighed in on the impact of the news, saying that it shows that the traditional financial services industry is realizing bitcoin is ""something that they should at least be thinking about"", if not embracing.    Opening the B2B market    Perseus' acceptance is likely to be seen as a boon for bitcoin, given its status as a reputable supplier of services to major traditional financial exchanges and a major player in the business-to-business (B2B) sector.    As executives in the developing world have noted, one of the as-yet-untapped benefits of bitcoin could be its ability to remove restrictions on global trade that are caused by a lack of financial services.  Perseus' acceptance of bitcoin, if successful, could be another step toward raising awareness and spurring this adoption.  Satellite Dish Image via Shutterstock",POSITIVE,BTC,ASIA | BTC | BUSINESS | TRADING,Pete Rizzo,0,0,CoinDesk,https://coindesk.com/markets/2014/02/06/perseus-telecom-partners-with-gocoin-to-accept-bitcoin,https://cdn.sanity.io/images/s3y3vcno/production/5ac027d22e162c4c09ec15dfa219327aa3518d29-1000x685.jpg?w=300&h=300&fit=crop
