뉴스ID,뉴스GUID,일자(UTC timestamp),뉴스제목,본문,SENTIMENT,주요코인,카테고리,작성자,추천수,비추천수,출처,뉴스URL,이미지URL
13437069,https://news.bitcoin.com/?p=235224,1540425330,"Bitcoin Cash Association to Fund Eatbch Charity in $1,000 BCH per Month","On Oct. 24, the community-driven Bitcoin Cash Association announced a new initiative where $1,000 worth of bitcoin cash will be sent to the two Eatbch campaigns in Venezuela and South Sudan every month. According to the nonprofit, the $1,000 will be divided between both organizations in order to help the Eatbch crew provide a solid ...The post Bitcoin Cash Association to Fund Eatbch Charity in $1,000 BCH per Month appeared first on Bitcoin News.",POSITIVE,BCH,BCH,,0,0,Bitcoin.com,https://news.bitcoin.com/bitcoin-cash-association-to-fund-eatbch-charity-1000-in-bch-per-month/,https://images.cryptocompare.com/news/bitcoin.com/853y210m00g.jpeg
13246843,https://nulltx.com/?p=71370,1540423111,XRP is a Valuable Tool for Addressing Crypto Spam on Twitter,"There are numerous innovative projects in the blockchain and cryptocurrency world which are often overlooked. In the case of &apos;You&apos;re Welcome&apos;, their approach is pretty interesting to keep an eye on. Although trusting third-party Chrome plugins is always a risk, this crypto spam blocker with XRP support is pretty interesting in its own regard. The ...The post XRP is a Valuable Tool for Addressing Crypto Spam on Twitter appeared first on NullTX.",POSITIVE,XRP,BLOCKCHAIN | XRP,,0,0,NullTx,https://nulltx.com/xrp-is-a-valuable-tool-for-addressing-crypto-spam-on-twitter/,https://images.cryptocompare.com/news/themerkle/dPih0bc8yo6.jpeg
13235544,https://www.newsbtc.com/?p=355073,1540422006,Australian DTA Tells Senate There is Better Technology Than Blockchain,"Australia&apos;s Digital Transformation Agency (DTA) has told the Senate that there is better technology for every use of blockchain considered today. The agency received AU$700,000 from the Australian 2018-19 Budget to explore blockchain for efficient government services purposes. Australian Government to Launch Blockchain Applications In May, the DTA was sent on a mission to look...The post Australian DTA Tells Senate There is Better Technology Than Blockchain appeared first on NewsBTC.",NEGATIVE,없음,BLOCKCHAIN | REGULATION | TECHNOLOGY,,0,0,NewsBTC,https://www.newsbtc.com/2018/10/24/australian-dta-tells-senate-there-is-better-technology-than-blockchain/,https://images.cryptocompare.com/news/newsbtc/cbwayo9Gg0M.jpeg
13363384,https://cointelegraph.com/news/air-canada-to-integrate-blockchain-based-travel-distribution-platform,1540421280,Air Canada to Integrate Blockchain-Based Travel Distribution Platform,"Air Canada has signed a letter of intent to participate in a decentralized, open-source travel distribution platform developed by blockchain travel startup Winding Tree",POSITIVE,없음,BLOCKCHAIN,,0,0,CoinTelegraph,https://cointelegraph.com/news/air-canada-to-integrate-blockchain-based-travel-distribution-platform,https://images.cryptocompare.com/news/cointelegraph/bW0w4x0g400.jpeg
13246844,https://nulltx.com/?p=71307,1540419485,New Regulation in China to Require Blockchain Users to Register with their IDs,"So far, China&apos;s attitude towards digital currencies was oppressive, yet the country encouraged blockchain innovation. It seems like things are now changing. Recent reports indicate that China&apos;s government has drafted a new regulation that requires users to register for blockchain services with their names and government IDs. Discouraging Blockchain Anonymity The first draft for the ...The post New Regulation in China to Require Blockchain Users to Register with their IDs appeared first on NullTX.",NEGATIVE,없음,ASIA | BLOCKCHAIN | REGULATION,,0,0,NullTx,https://nulltx.com/new-regulation-in-china-to-require-blockchain-users-to-register-with-their-ids/,https://images.cryptocompare.com/news/themerkle/dM0oM2802o0.jpeg
13235545,https://www.newsbtc.com/?p=355094,1540418442,"DeVere CEO: Crypto Market to Increase by 5,000% in Its Second Decade","The CEO of global financial consultancy firm the deVere Group has stated that the cryptocurrency market will expand by a massive 5,000% over the next 10 years. Nigel Green also believes that Bitcoin&apos;s dominance will continue to fall during the same period. Nigel Green: Competition Will Weaken BTC, But Where is It? As Bitcoin&apos;s first...The post DeVere CEO: Crypto Market to Increase by 5,000% in Its Second Decade appeared first on NewsBTC.",POSITIVE,BTC,ALTCOIN | BTC | MARKET,,0,0,NewsBTC,https://www.newsbtc.com/2018/10/24/devere-ceo-crypto-market-to-increase-by-5000-in-its-second-decade/,https://images.cryptocompare.com/news/newsbtc/e9xg0C8A330.jpeg
