뉴스ID,뉴스GUID,일자(UTC timestamp),뉴스제목,본문,SENTIMENT,주요코인,카테고리,작성자,추천수,비추천수,출처,뉴스URL,이미지URL
42427365,sd6iOBkuiC3F0LYOyK1eRh,1486675822,China Fears Spread Beyond Bitcoin As Crypto Markets Slide,"The digital currency markets experienced widespread price declines today, as concerns surrounding the latest developments in China motivated many traders to sell off not only bitcoin, but alternative digital assets.  The development follows the PBoC's announcement today that it warned several domestic exchange operators that they must comply with regulations or risk being shut down. Traders also received startling news from major operations Huobi and OKCoin that, effective immediately, they would suspend bitcoin withdrawals for one month.  Markets reacted strongly to these developments, with bitcoin prices falling to as little as $942 at 14:30 UTC, a more than 10% decline from the opening price, according to the CoinDesk Bitcoin Price Index (BPI).  The digital currency then recovered, rising to $975.21 at the time of report.  Yet, even after this increase, bitcoin prices were still roughly 7.5% lower for the session, BPI figures show.  Impact spreads  Even in alternative digital asset markets, the impact of the development in bitcoin was widely felt.  Ether, which powers the smart contract-based platform ethereum and is the second-largest cryptocurrency by market capitalization, fell to as little as $10.67 on CoinMarketCap, down close to 7% since the start of the day.  The digital token then recovered lost ground, reaching $10.92 at the time of report. Yet, even after making these gains, ether was roughly 4.8% lower for the session at time of writing.  Ether classic, which was created roughly six months ago as a result of an ethereum hard fork, provided the most striking example of a price decline, dropping upwards of 20% for the day to $1.20 on CoinMarketCap, after trading at $1.47 at 12:04 UTC.  The digital currency, which helps power the smart contract-based platform ethereum classic, later rose to $1.28 at the time of report.  At this price, ether was roughly 12% lower for the day.  Monero, a digital currency that leverages ring signatures to help provide market participants with a high level of privacy, fell to as little as $11.83 during the day, close to 8% below the price of $12.83 at 12:04 UTC, according to CoinMarketCap.  At the time of report, the digital currency had recovered slightly, trading at $11.91, still more than 7% lower for the session.  The fact that digital currency prices suffered widespread declines today, and then proceeded to recover, is merely part of a broader trend, Jacob Eliosoff told CoinDesk.  He emphasized that in some cases, news that bodes poorly for bitcoin ""may actually help (or at least be neutral for) other major coins."" He pointed to a bug in bitcoin's blockchain or a major disagreement between bitcoin developers as potential examples.  However, news that causes bitcoin prices to push lower usually has the same effect on the price of altcoins, he said.  The high correlation that exists between the price of digital currencies may simply be a sign of the market’s immaturity. Bitcoin was the first cryptocurrency to scale, and has grabbed the lion's share of the total market capitalization owned by these digital assets. (In most cases, you have to buy bitcoin before purchasing other altcoins).  Watch and wait  However, several altcoins have risen to prominence by offering some compelling value not provided by bitcoin.  Ethereum, whose currency ether had a market capitalization of roughly $970m at the time of report, has drawn interest by offering developers a platform where they can create applications that rely on smart contracts.  Likewise, Monero, the fifth-largest digital currency by market capitalization according to CoinMarketCap, has carved out its own niche by offering a level of privacy far higher than that of bitcoin.  In this way, Eliosoff and others are hoping that the ""extreme correlation"" that exists between the prices of digital currencies today will diminish over time as more establish singular use cases and establish unique infrastructure.  As evidenced by today's moves, however, this development remains in the distance.  Dominoes image via Shutterstock",NEGATIVE,없음,ASIA | BTC | ETC | MARKET | TRADING,Charles Lloyd Bovaird II,0,0,CoinDesk,https://coindesk.com/markets/2017/02/09/china-fears-spread-beyond-bitcoin-as-crypto-markets-slide,https://cdn.sanity.io/images/s3y3vcno/production/4713108432acbcf2b1dfc8f42b212716fcbcc961-1500x1000.jpg?w=300&h=300&fit=crop
42427344,sd6iOBkuiC3F0LYOyK1e1h,1486669205,Lawyer Arrested in Attempt to Sell Confidential Complaint for Bitcoin,"A lawyer for a major US lobbying firm has been arrested and charged after trying to sell confidential information for bitcoin.  According to court documents filed on 1st February and unsealed yesterday, Jeffrey Wertkin sought to sell a criminal complaint related to a whistleblower case for $310,000, asking that he be paid in bitcoin for the offer.  Wertkin, who was arrested on 31st January, was previously a partner for Akin Gump Strauss Hauer & Feld, a major Washington, DC-based law practice and lobbying firm. According to OpenSecrets.org, the firm's clients include AT&T, Volkswagen and Mobil Oil, among others.  Wertkin also served six years as a trial lawyer for the US Justice Department, The New York Times reported yesterday.  Court documents show that Wertkin reached out to an unnamed employee of a California cybersecurity firm, ultimately moving to sell that individual sealed information related to a complaint that had been filed against the company.  Using the moniker ""Dan"", Wertkin sent a partial copy of the complaint to the company, offering a full copy in exchange for $310,000 in bitcoin.  The filing states:  ""...Dan suggested to EMPLOYEE that Dan be paid in bitcoin and explained to EMPLOYEE how bitcoin worked and that the advantage to bitcoin was that it could not be traced.""  Wertkin and the employee, after a series of additional conversations, were scheduled to meet at the Hilton Garden Inn in Cupertino, California. FBI agent William Scanlon, who submitted the affidavit, was waiting nearby in the place of the tech company employee.  Once the copy of the complaint was handed to Scanlon, other FBI agents quickly moved in to arrest Wertkin, who, according to the affidavit, ""was wearing a wig which I believed was to conceal his identity"".  ""My life is over,"" Wertkin reportedly said as he was arrested.  A full copy of the FBI affidavit can be found below:    FBI Affidavit by CoinDesk on Scribd    Image via Shutterstock",NEGATIVE,없음,BTC | COMMODITY | EXCHANGE | REGULATION,Stan Higgins,0,0,CoinDesk,https://coindesk.com/markets/2017/02/09/lawyer-arrested-in-attempt-to-sell-confidential-complaint-for-bitcoin,https://cdn.sanity.io/images/s3y3vcno/production/6d90849b97e195996c8b24fad1f7459c9a965da9-1500x844.jpg?w=300&h=300&fit=crop
42427340,sd6iOBkuiC3F0LYOyK1dxh,1486664373,Winklevoss Bitcoin ETF Offering Expands to $100 Million,"New documents filed for the bitcoin exchange traded fund (ETF) sought by investors Cameron and Tyler Winklevoss reveal that the size of the offering has grown to $100m.  The years-long effort – delayed more than once by the US Securities and Exchange Commission (SEC) – is aimed at providing a means for investors to gain exposure to bitcoin without actually having to buy the digital currency.  The SEC is expected to make a decision on the Winklevoss Bitcoin ETF later this year, with its self-imposed deadline of 11th March inching closer. Speculation around the approval is such that at least one exchange has moved to offer a prediction market, letting traders bet on the possible outcome.  Documents  submitted to the SEC on 8th February show that the planned offering has changed somewhat in scope.  For example, the size of the offering has increased, from $65m to $100m, as well as a boost in the number of shares being offered, from 1m shares to 10m shares. The filing goes on to indicate that the maximum offering price per share has been lowered, from $65 down to just $10.  Notably, the filing also features new language about the prospect of a network split following a software hard fork, or a backwards-incompatible change to bitcoin’s underlying code.  In that circumstance, the filing states, the ETF’s custodian will support the blockchain that has “the greatest cumulative computational difficulty for the forty-eight (48) hour period following a given hard fork”. During that 48-hour period, the creation or redemption of new ETF baskets will be suspended.  The filing goes on to state:  “If the Custodian, in consultation with the Sponsor, is unable to make a conclusive determination about which Bitcoin Network has the greatest cumulative computational difficulty after forty-eight (48) hours, or determines in good faith that this is not a reasonable criterion upon which to make a determination, the Custodian will support the Bitcoin Network which it deems in good faith is most likely to be supported by a greater number of users and miners.”  The new filing also includes other minor updates such as the companies that will act as authorized participants. These firms are Convergex Execution Solutions LLC, KCG Americas LLC and Virtu Financial BD LLC.  Image Credit: Sky Cinema / Shutterstock.com",NEUTRAL,없음,BTC | EXCHANGE | MARKET | REGULATION | FORKS,Stan Higgins,0,0,CoinDesk,https://coindesk.com/markets/2017/02/09/winklevoss-bitcoin-etf-offering-expands-to-100-million,https://cdn.sanity.io/images/s3y3vcno/production/ae9d49e83929371b8430e00329225e080c6b3458-1500x916.png?w=300&h=300&fit=crop
42427346,sd6iOBkuiC3F0LYOyK1e5h,1486655759,China's Bitcoin Exchanges Impose Fees Following Central Bank Meeting,"The era of no-fee trading in China appears to be over.  Following in the footsteps of China's 'Big Three' exchanges, smaller competitors BTC Trade, BTC100, CHBTC, Dahonghuo, Yuanbao and BitBays all moved to impose or increase trading fees yesterday in the wake of a meeting with the People's Bank of China, China's central bank.  Both BTC Trade and CHBTC said that the fees would come into force on 13th February, whereas the other exchanges did not identify a starting date. Further, with the exception of BTC 100 and BitBays, the exchanges all moved to add 0.2% maker and taker fees.  BitBays is now charging 0.1% maker fees and 0.15% taker fees, while BTC 100 announced that it would begin collecting trading fees, without adding details. Yunbi, in turn, announced a reduction in trading fees two days ago, dropping its trading fees from 0.2% to 0.05%.  It was not immediately clear at press time whether Jubi – another of the exchanges to meet with the PBoC – had made a similar move.  The developments come on the heels of a new warning from the PBoC to domestic bitcoin exchanges about the need for tighter anti-money laundering and foreign exchange controls. Two of China's ""Big Three"" exchanges – Huobi and OKCoin – went on to freeze bitcoin and litecoin withdrawals, stating that the new policy would last for one month.  Fee policy changes  at Huobi, OKCoin and BTCC had previously driven volume to no-fee exchanges – a trend that is now unlikely given the updates across the sector.  Notably, Yuanbao and BitBays explicitly referenced regulatory concerns in their messages. By contrast, BTC Trade said it had moved to add fees ""in order to curb speculation [and] to prevent price speculation"", a message echoed in CHBTC's post.  Bitcoin prices have fallen sharply since today’s news out of China first broke, averaging $957 at press time.  Image via Shutterstock",NEGATIVE,BTC,ASIA | BTC | EXCHANGE | FIAT | TRADING,Stan Higgins,0,0,CoinDesk,https://coindesk.com/markets/2017/02/09/chinas-bitcoin-exchanges-impose-fees-following-central-bank-meeting,https://cdn.sanity.io/images/s3y3vcno/production/26f2a431ddad658294fcd4c5edd69eecabe41ac9-1500x1000.jpg?w=300&h=300&fit=crop
42427353,sd6iOBkuiC3F0LYOyK1eDh,1486648313,"Bitcoin Price Sinks Below $1,000 as Exchanges Cut Services","Bitcoin's price has fallen sharply, dropping below $1,000 amid news from China that major exchanges had temporarily cut services.  At press time, prices were down more than 7% after word emerged this morning that two of China’s biggest bitcoin exchanges – Beijing-based OKCoin and Huobi – are freezing bitcoin and litecoin withdrawals for a month following pressure from the People's Bank of China.  Yuan deposits and withdrawals are not affected, the exchanges said.  Markets had been hovering around $1,063 when the news broke, though this has now changed as the market seeks to price in the news.  According to the CoinDesk USD Bitcoin Price Index (BPI), prices fell as much as $80, hitting a low of $958.56. BPI data shows that prices had previously hit a high of $1,077.76 earlier today.  At press time, bitcoin prices are at an average of $988.  CNY-denominated markets were down more than 13% from their peak on the news at one point, according to the BPI, falling from a high of ¥7,598.92 to an average of ¥6,755.52.  However, the price was up 5% on the day at press time, indicating traders were perhaps viewing the news as a buying opportunity.  Real-time response  So far, market observers appear to be reacting with a mixture of surprise and concern when reached for comment.  OTC trader Zhao Dong indicated that he expected further price weakening stoked by traders ""since you can only deposit coins and sell"" in light of the exchange policy changes.  Kong Gao, overseas marketing director at OTC trading firm Richfund, remarked more simply, stating:  ""This is big news.""  CoinDesk will continue monitoring this developing story.  Trading candles image via Shutterstock",NEGATIVE,없음,ASIA | BTC | EXCHANGE | MARKET | TRADING,Stan Higgins,0,0,CoinDesk,https://coindesk.com/markets/2017/02/09/bitcoin-price-sinks-below-1000-as-exchanges-cut-services,https://cdn.sanity.io/images/s3y3vcno/production/2c7ccad3aadf82dff36890f7d905bcdd57f4b108-1500x1000.jpg?w=300&h=300&fit=crop
42427349,sd6iOBkuiC3F0LYOyK1e9h,1486645249,Two of China's Biggest Exchanges Stop Bitcoin Withdrawals,"UPDATE (9th February 16:22 BST): This article has been updated with new information regarding BTCC’s bitcoin and litecoin withdrawal policy.      Yuan recharge, withdrawals and other services will not be affected, the exchanges said.  In public posts that showcase the increasingly coordinated nature of exchange policy in the region, both OKCoin and Huobi said today that the move was a bid to bolster their anti-money laundering (AML) capabilities and prevent ""illegal transactions"". In the case of OKCoin, only it's OKCoin.cn portal is affected.  Both OKCoin and Huobi indicated that their platforms would now go through an “upgrade” to combat “money laundering, exchange, pyramid schemes and other illegal activities”, though no further details were provided.  Following the publication of this article, BTCC announced that it would also upgrade its internal systems. In the meantime, the exchange said, bitcoin and litecoin withdrawals will take 72 hours to process.  All told, the move comes amid a rocky period for local exchanges that began with the wider scrutiny of major bitcoin exchanges by the People's Bank of China (PBOC), the country's central bank.  Earlier today, China's central bank issued a warning to domestic exchanges, going so far as to state it would move to shutter startups that violated its guidance through the necessary government channels.  In statements provided to CoinDesk, Huobi indicated that the move was a proactive one that found the two exchanges seeking to ""promote bitcoin industry self-discipline"".  Update: This article has been updated to clarify that only OKCoin's OKCoin.cn platform is affected by the withdrawal freeze.  Image via Shutterstock",NEGATIVE,BTC,ASIA | BTC | EXCHANGE | FIAT | LTC,Pete Rizzo,0,0,CoinDesk,https://coindesk.com/markets/2017/02/09/two-of-chinas-biggest-exchanges-stop-bitcoin-withdrawals,https://cdn.sanity.io/images/s3y3vcno/production/206a4a0f79bc18c1d875e8ae427b122768ff6319-2560x1707.jpg?w=300&h=300&fit=crop
42399607,DbF8Q09kuKX2XWBxAbjt95,1486643661,LinkedIn Killer? Bitcoin Upstart 21 Takes on Social With Email Play,"Cryptic bitcoin company 21 Inc has launched a paid email platform that seems far removed from its initial focus on hardware.  The move is yet another in a string of pivots by the firm. Since it revealed it had raised $116m in 2015 (accrued over multiple rounds), 21 has evolved its strategy several times.  Originally founded as a bitcoin mining company, it soon appointed a new CEO – Andreessen Horowitz partner Balaji Srinivasan – and announced plans to distribute bitcoin mining chips embedded in consumer and enterprise hardware devices. The chips, attached to a Raspberry Pi and called '21 Bitcoin Computers', started shipping in November 2015 and quickly developers began building applications for the device.  Then, in March 2016, the company launched its first proof-of-concept for a network of devices incentivized to monitor websites with bitcoin. Several months later, it launched a software package that allowed any connected device to join the 21 network, enabling capabilities that were once only available to those with a 21 Bitcoin Computer.  The new communications platform seems to be yet another evolution for 21 Inc, though Srinivasan said the company has been working on this idea for some time, pointing to an SMS version of the current product that was published in late 2015.  Further, the CEO said, the email platform still aligns with the company’s primary goal.  He told CoinDesk:  ""Allowing people to earn bitcoin by responding to emails and completing tasks achieves many of the same goals in that it may get millions of people their first exposure to digital currency.""  In the old SMS version, 21 Inc showed users how to set up a 21 Bitcoin Computer to allow them to receive paid text messages from anyone without revealing the recipient’s number. The new platform, which allows users to set their own rate, makes the service accessible for people even without the company’s hardware.  Rewarding the recipient  The new service – available via the website and a MacOS app – looks similar to LinkedIn's InMail (which Srinivasan said is the platform’s closest competitor). And some enthusiasts, including Craig Lauer, an angel investor and mentor to TechStars and EvoNexus, have even made it public that they'd rather use 21’s platform over LinkedIn.  That’s probably because, according to Srinivasan, the recipient gets paid instead of the social network giant. On LinkedIn, payments made to send email to people outside your network are taken by LinkedIn itself, but on 21's platform, the money goes straight to the recipient.  Most of it, anyway. When a user sends an email, 21 adds a 10% fee to transactions – for instance, sending an email to someone charging $1 means paying $1.10 total.  That small fee, though, has the potential to turn into big revenue for 21.  ""InMail is nevertheless estimated to be a $300m per year business for LinkedIn, and we think that market could expand if recipients can get paid,"" Srinivasan said.  Premium prices  This is especially true if well-known early adopters keep setting high prices (and people are prepared to pay for access to them).  Andreessen Horowitz's Ben Horowitz set his account at $100 via the service. With such high values, some wonder what the benefit of using bitcoin would be since, in these cases, it might be just as easy to add debit and credit payment options.  But Srinivasan contends there are several advantages.  ""It allows instant receipt of funds without linking a bank account, it works across borders and it can scale up and down to very small and large payments alike,"" he said.  This appreciation is also, it seems, why people have rushed to the new service, since users can make $2 in bitcoin just by reading through how the site works and setting up an account.  This mechanism for offering monetary value for tasks is the real mission of the 21 platform, according to Srinivasan.  ""The goal is to make it possible to send targeted tasks to people. In the same way that your resume qualifies you for an offline job, a verified 21 profile qualifies you for online tasks, payable in bitcoin,"" he said.  The Gerson Lehrman Group, an expert network that provides independent consulting services, offers a service like this, although it is aimed at survey participants, rewarding users with virtual event credits and monetary reimbursement.  ""Think of it like a hybrid of LinkedIn and Amazon Mechanical Turk,"" Srinivasan said.  Mixed reviews  John Light, head of product marketing at Abra, a bitcoin-based mobile app for remittances, suggested the paid email use case is merely a way to market the tasks platform.  ""The email application seems like a useful idea, especially for those getting a lot of inbound requests and they need to apply some filter to decide what’s worth responding to – especially if those people are outside your network,"" Light said. ""The messaging product is also useful because it’s public-facing … and acts as a marketing tool.""  Although others, like Wayne Vaughan, founder and CEO of Tierion, remain skeptical – not only of the paid inbox, but also of the tasks platform.  In today’s world, social signals such as getting introduced by a mutual friend are generally seen as more valuable than monetary compensation, Vaughan suggested.  ""Putting a price on that … it's like if I want to tell you something interesting, but you ask for $50 to do that, I want to tell you to go screw yourself,"" he said.  Not to mention, high prices put some people – such as young entrepreneurs or developers and small publication journalists – at a disadvantage.  ""It’s not a perfect solution,"" conceded Light, ""but it’s a new option for purely unsolicited messages with no pre-applied filter.""  Of course, there will always be other channels on which people can reach out, such as the public networks like Twitter. On these, though, account holders aren’t guaranteed to respond, and surely, said Light, they would if someone paid them to.  As an added incentive for some, the money received from incoming emails or earned from tasks can be donated to three different “tech-savvy and bitcoin-friendly” charities, said Srinivasan.  ""Because price is a signal, money could be a very interesting way to prioritize messages,"" he argued. ""At the same time, the recipients often don’t actually need the money, so donating it to a good cause is a creative solution.""  Exit play?  Yet, some like Vaughan are still doubtful.  All in all, Vaughan (and other observers) wonders if 21 isn’t trying to amass a large user base, a new asset so the company can sell.  ""If you’re trying to sell your company and show fast customer acquisition this might be a way to do it,"" he said.  But maybe it's more about finding a business model that gains traction, allowing 21 to drill down on a specific use case, Light argued.  While the move isn't necessarily a desperation play, Vaughan thinks 21's ability to raise money could be limited since its mining equipment business hasn't worked itself into a commercial success as of yet.  In Vaughan’s mind, this is the latest pivot that shows a company experimenting with revenue-generating business models.  He concluded:  ""If there’s a thread of continuity, then they need to do a better job of communicating what they’re all about.""  Images via 21 Inc",NEUTRAL,없음,BTC | BUSINESS | MARKET | MINING | TRADING,Bailey Reutzel,0,0,CoinDesk,https://coindesk.com/markets/2017/02/09/linkedin-killer-bitcoin-upstart-21-takes-on-social-with-email-play,https://cdn.sanity.io/images/s3y3vcno/production/da4fca10b043b6c09af15be01be044d85065cd84-2372x1224.png?w=300&h=300&fit=crop
42399603,DbF8Q09kuKX2XWBxAbjt4A,1486638015,Qiwi's CEO Will Head Up Russia's Distributed Ledger Efforts,"Russia's FinTech Association, established in part to encourage wider exploration of distributed ledger tech, has appointed Qiwi chief Sergey Solonin as its new CEO.  Solonin will now lead the consortium effort, a role that will find him coordinating R&D efforts with the Bank of Russia, Sberbank, VTB Bank, Alfa Bank, Gazprombank, Bank Otkritie and the National System of Payment Cards (NSPK).  According to a release from the group, the consortium members will explore applications including digital identity, distributed ledgers and open APIs.  Solonin said in the statement:  ""The concept behind the association is оne-of-a-kind in Russia and unionizes not only our market participants, but also our regulator and the experts in communications and technology platforms.""  For Qiwi, one of Russia's largest payment firms, the move marks a milestone in its efforts to launch a blockchain and distributed ledger working group in the country, which began in April 2016.  The firm is also now a member of R3CEV, a global banking consortium focused on blockchain and distributed ledger efforts.  To date, Qiwi has been among the more active firms in its efforts to explore blockchain, building a processing system based on the technology and experimenting with its own digital currencies as early as 2015.  Qiwi app image via Facebook",POSITIVE,없음,BLOCKCHAIN | FIAT | MARKET | TECHNOLOGY | WALLET,Pete Rizzo,0,0,CoinDesk,https://coindesk.com/markets/2017/02/09/qiwis-ceo-will-head-up-russias-distributed-ledger-efforts,https://cdn.sanity.io/images/s3y3vcno/production/b28d4199f9f1a7b4daa53ea28462af8c11ea4c72-1964x1252.png?w=300&h=300&fit=crop
