뉴스ID,뉴스GUID,일자(UTC timestamp),뉴스제목,본문,SENTIMENT,주요코인,카테고리,작성자,추천수,비추천수,출처,뉴스URL,이미지URL
13365790,https://cointelegraph.com/news/survey-30-of-financial-executives-to-commit-resources-to-blockchain,1525909593,Survey: 30% Of Financial Executives To Commit Resources To Blockchain,A new survey on blockchain use by financial organizations shows that 30 percent of respondents &apos;plan to commit resources to blockchain within the next year and a half&apos;,POSITIVE,없음,BLOCKCHAIN,,0,0,CoinTelegraph,https://cointelegraph.com/news/survey-30-of-financial-executives-to-commit-resources-to-blockchain,https://images.cryptocompare.com/news/cointelegraph/9Ggog300040.jpeg
13439037,https://news.bitcoin.com/?p=158476,1525908923,Cryptocurrency Projects Aiming to be ‘ASIC Resistant’ Have Little Success,"Just recently the Bitcoin Gold (BTG) developers announced the project&apos;s consensus algorithm Equihash was &apos;threatened&apos; in a blog post called &apos;A Response to the ASIC Threat.&apos; In the post, the BTG project&apos;s team members explain that they might change the cryptocurrency&apos;s current Equihash algorithm due to the recent launch of the Antminer Z9 mining rig. ...The post Cryptocurrency Projects Aiming to be &apos;ASIC Resistant&apos; Have Little Success appeared first on Bitcoin News.",NEUTRAL,BTG,BTC | ETH | LTC | MINING | BTG,,0,0,Bitcoin.com,https://news.bitcoin.com/cryptocurrency-projects-aiming-to-be-asic-resistant-have-little-success/,https://images.cryptocompare.com/news/bitcoin.com/dpd6Mb0wI26.jpeg
13249443,https://themerkle.com/?p=56760,1525906851,Texas Serves Bitcoin Investment Company with Cease and Desist Order,"Deceptive and misleading advertisements targeting Texans - including those which falsely assured them that investing in Bitcoin was risk-free - were among the offenses cited by the Texas State Securities Board in its emergency cease and desist order against a Bitcoin investment company. The company, Forex EA &amp; Bitcoin Investment LLC, was also accused of failing to disclose the identity of the principals behind it as well as concealing some pertinent facts regarding the buying and selling of digital currencies. Unregistered Sale Of Securities The company, along with its representatives, James Butcher and Richard Dunn, were accused of claiming that an investment in their",NEGATIVE,없음,BTC,,0,0,NullTx,https://themerkle.com/texas-serves-bitcoin-investment-company-with-cease-and-desist-order/,https://images.cryptocompare.com/news/themerkle/e4UM8W6xw00.jpeg
13454263,http://bitcoinist.com/?p=67929,1525906824,"Ex-Goldman Chief Says We’ll Have a Global Cryptocurrency, But Not Bitcoin","Former president of Goldman Sachs, Gary Cohn, said on Tuesday that he believes the world will have a global currency. However, he doesn&apos;t seem to believe that the latter will be bitcoin.&apos; &apos;Not a big believer in bitcoin&apos; In an interview for CNBC on Tuesday, Gary Cohn said that he believes there will be a global cryptocurrency. He also shared that he&apos;s not a Bitcoin believer but he does favor its underlying technology. He said:Read MoreThe post Ex-Goldman Chief Says We&apos;ll Have a Global Cryptocurrency, But Not Bitcoin appeared first on Bitcoinist.com.",NEUTRAL,없음,BTC | REGULATION | TECHNOLOGY,,0,0,Bitcoinist,https://bitcoinist.com/ex-goldman-chief-global-cryptocurrency-not-bitcoin/,https://images.cryptocompare.com/news/bitcoinist/eyb8kMYs8t0.jpeg
13454264,http://bitcoinist.com/?p=67957,1525906811,Australia Criminalizes Cash Over $10K While Funding Blockchain Research,"Australia will crack down on cash freedom while dedicating over half a million dollars to blockchain research in its 2018-19 budget. Blockchain for Government Services The budget, which the country&apos;s government unveiled May 8th, apportions $700,000 AUD ($521,000 USD) to the Digital Transformation Agency (DTA) to look at how blockchain technology can improve government services. The budget document reads: The Government will provide $0.7 million in 2018-19 for the Digital Transformation Agency to investigate areasRead MoreThe post Australia Criminalizes Cash Over $10K While Funding Blockchain Research appeared first on Bitcoinist.com.",POSITIVE,없음,BLOCKCHAIN | TECHNOLOGY | RESEARCH,,0,0,Bitcoinist,https://bitcoinist.com/australia-criminalizes-cash-10k-funding-blockchain-research/,https://images.cryptocompare.com/news/bitcoinist/c1Vf9D39203.jpeg
13365791,https://cointelegraph.com/news/chinese-social-app-wechat-suspends-third-party-blockchain-app,1525906180,Chinese Social App WeChat Suspends Third-party Blockchain App,Chinese messaging giant WeChat has suspended a third-party blockchain app designed for arranging contracts a day after its launch,NEGATIVE,없음,ASIA | BLOCKCHAIN,,0,0,CoinTelegraph,https://cointelegraph.com/news/chinese-social-app-wechat-suspends-third-party-blockchain-app,https://images.cryptocompare.com/news/cointelegraph/c1ox0g00000.jpeg
13439038,https://news.bitcoin.com/?p=158608,1525905302,Markets Update: Cryptocurrency Prices See Relief After Three Day Losses,"Cryptocurrency prices have dropped significantly over the past 72 hours after reaching new highs on May 5. When Bitcoin Core (BTC) prices touched a high of $9,940 USD this past Saturday buyers met resistance and the price tumbled to a low of $8,975. BTC prices today are hovering along between $9,100 and $9,400. Bitcoin Cash ...The post Markets Update: Cryptocurrency Prices See Relief After Three Day Losses appeared first on Bitcoin News.",POSITIVE,없음,BCH | MARKET | TRADING,,0,0,Bitcoin.com,https://news.bitcoin.com/markets-update-cryptocurrency-prices-see-relief-after-three-day-losses/,https://images.cryptocompare.com/news/bitcoin.com/aw0Ak2i04w0.jpeg
13365792,https://cointelegraph.com/news/bitcoin-ethereum-bitcoin-cash-ripple-stellar-litecoin-cardano-iota-eos-price-analysis-may-09,1525904054,"Bitcoin, Ethereum, Bitcoin Cash, Ripple, Stellar, Litecoin, Cardano, IOTA, EOS: Price Analysis, May 09","Despite the criticism from the household names such as Warren Buffett, Charlie Munger, and Bill Gates, the crypto market remains strong",POSITIVE,IOTA,ADA | BCH | LTC | MARKET | IOTA,,0,0,CoinTelegraph,https://cointelegraph.com/news/bitcoin-ethereum-bitcoin-cash-ripple-stellar-litecoin-cardano-iota-eos-price-analysis-may-09,https://images.cryptocompare.com/news/cointelegraph/dy00l02291w.jpeg
13249444,https://themerkle.com/?p=56711,1525903243,Facebook Turns to the Blockchain with Coinbase Board Member at the Helm,"Three months after banning cryptocurrency ads from all its platforms, Facebook is launching a blockchain research and development initiative. With fellow tech giants Oracle and Microsoft already deeply invested in the research and development of blockchain technology, Facebook has joined the bandwagon, and it&apos;s looking to the current head of Messenger, David Marcus, to lead the initiative. The team will include other high-ranking executives from Facebook and its subsidiary, Instagram, according to people privy to the matter. Marcus has been at the helm of Facebook&apos;s messaging app since 2014 and has led it from a relatively new product to one of",POSITIVE,없음,BLOCKCHAIN | EXCHANGE | TECHNOLOGY | RESEARCH,,0,0,NullTx,https://themerkle.com/facebook-turns-to-the-blockchain-with-coinbase-board-member-at-the-helm/,https://images.cryptocompare.com/news/themerkle/cy8E3a2OIw0.jpeg
13238345,https://www.newsbtc.com/?p=331514,1525903203,Tech Venture Capitalist: Warren Buffet is Wrong About Bitcoin,"Following Warren Buffet and his understudy Charlie Munger&apos;s words on Bitcoin earlier this week, technology-focused investor Chamath Palihapitiya has come to digital currency&apos;s defence. Despite claiming to be a Buffet &apos;disciple,&apos; he also states that Buffet is wrong about Bitcoin. Palihapitiya: &apos;Not Everybody is Right All the Time&apos; Speaking in an interview with CNBC&apos;s &apos;Squawk Box,&apos;...The post Tech Venture Capitalist: Warren Buffet is Wrong About Bitcoin appeared first on NewsBTC.",POSITIVE,BTC,BTC | BUSINESS,,0,0,NewsBTC,https://www.newsbtc.com/2018/05/09/tech-venture-capitalist-warren-buffet-is-wrong-about-bitcoin/,https://images.cryptocompare.com/news/newsbtc/80040wg4200.jpeg
13439039,https://news.bitcoin.com/?p=158334,1525901759,New Movies Featuring Bitcoin Hitting Theaters Soon,"Several films featuring Bitcoin are coming out before the summer. The main character in &apos;Superfly&apos;, a remake of the 1972 crime drama &apos;Super Fly&apos;, is now &apos;swapping cash for crypto.&apos; Director X&apos;s debut movie is scheduled for release on July 15. And in Russia, two college students are chasing a hard disk storing a fortune ...The post New Movies Featuring Bitcoin Hitting Theaters Soon appeared first on Bitcoin News.",POSITIVE,없음,BTC,,0,0,Bitcoin.com,https://news.bitcoin.com/new-movies-featuring-bitcoin-hitting-theaters-soon/,https://images.cryptocompare.com/news/bitcoin.com/8i22kEwhd00.jpeg
13365793,https://cointelegraph.com/news/new-report-on-crypto-ownership-shows-majority-of-early-adopters-already-on-board,1525899844,New Report On Crypto Ownership Shows ‘Majority Of Early Adopters Already On Board’,"A recent analysis of knowledge and ownership of crypto showed that on average 50% of people globally understand what crypto is, but only 4% of non-holders plan to invest",NEUTRAL,없음,BTC | MARKET,,0,0,CoinTelegraph,https://cointelegraph.com/news/new-report-on-crypto-ownership-shows-majority-of-early-adopters-already-on-board,https://images.cryptocompare.com/news/cointelegraph/8maqhEzfM5q.jpeg
13249445,https://themerkle.com/?p=56680,1525899640,The 2018 Year of Cryptocurrency Challenge – Week 17,"At the beginning of 2018, I wrote an article outlining a New Year&apos;s resolution that I thought could help boost cryptocurrency adoption and awareness in 2018, as long as enough people were doing it. Last week was the sixteenth installment of my challenge. I&apos;ll apologize to my readers for the tardiness of this installment, as I&apos;ve been very busy this past week. TRY TO SPEAK TO AS MANY PEOPLE ABOUT CRYPTOCURRENCY AS YOU POSSIBLY CAN The recent uptick in cryptocurrency&apos;s price (particularly Ethereum) has captivated the minds of the crypto-curious again in the wake of a rather bearish few months.",POSITIVE,없음,ETH | TRADING | PEOPLE,,0,0,NullTx,https://themerkle.com/the-2018-year-of-cryptocurrency-challenge-week-17/,https://images.cryptocompare.com/news/themerkle/ewAxE0gk0a0.jpeg
13454265,http://bitcoinist.com/?p=67974,1525899619,Coinone Joins RippleNet Amid Claims That Ripple ‘Is Trying to Build a Private Central Bank’,"Ripple&apos;s array of partners continues to expand as Coinone joins RippleNet. Another Day, Another Partnership According to an announcement from the Ripple team, Coinone Transfer — a subsidiary of Coinone — has officially joined RippleNet. The payments business is set to use xCurrent, Ripple&apos;s increasingly popular blockchain solution for cross-border payments and settlement. Coinone is one of Korea&apos;s largest exchanges for digital assets and is now poised to become the country&apos;s first to utilize RippleNet.Read MoreThe post Coinone Joins RippleNet Amid Claims That Ripple &apos;Is Trying to Build a Private Central Bank&apos; appeared first on Bitcoinist.com.",POSITIVE,없음,BLOCKCHAIN | BUSINESS | FIAT | XRP,,0,0,Bitcoinist,https://bitcoinist.com/coinone-joins-ripplenet-amid-claims-that-ripple-is-trying-to-build-a-private-central-bank/,https://images.cryptocompare.com/news/bitcoinist/9$Ea1rA4xjO.jpeg
13238346,https://www.newsbtc.com/?p=331482,1525899615,Reddit Co-Founder: Cryptocurrencies Are ‘Fuel for a New Internet’,The co-founder of online social news forum Reddit has said that cryptocurrencies are &apos;fuel for a new internet&apos; and that they are an opportunity for people to have &apos;a store of value.&apos; Alexis Ohanian was appearing as a guest on the Late Show with Stephen Colbert yesterday when he made these comments. After talking about how...The post Reddit Co-Founder: Cryptocurrencies Are &apos;Fuel for a New Internet&apos; appeared first on NewsBTC.,POSITIVE,없음,OTHER,,0,0,NewsBTC,https://www.newsbtc.com/2018/05/09/331482/,https://images.cryptocompare.com/news/newsbtc/bgCk5cEO6Sk.jpeg
42401518,DbF8Q09kuKX2XWBxAczuUR,1525899611,"Zcash Privacy Weakened by Certain Behaviors, Researchers Say","Researchers have identified patterns in certain kinds of zcash transactions that weaken their anonymity, according to a paper published Tuesday.  George Kappos, Haaroon Yousaf, Mary Maller and Sarah Meiklejohn found that when coins move from ""unshielded"" to ""shielded"" and back to ""unshielded"" addresses, they lose much of the anonymity that zcash users expect. The University College London team wrote that their ""relatively simple heuristics … reduce the size of the overall anonymity set by 69.1 percent.""  Zcash, one of the most prominent and well-regarded privacy coins, offers two kinds of addresses: ""t-addresses"" are transparent or unshielded, meaning that their balances and transactions are publicly visible on the blockchain; ""z-addresses"" are shielded, meaning that their balances and transactions are invisible.  Transactions from one unshielded address to another are completely public, if pseudonymous, as in bitcoin. Transactions from one shielded address to another are almost completely invisible, showing only the timestamps and fees associated with mining.  Transactions between different types of addresses introduce complications, however, making it possible to glean some information about the z-addresses involved, according to the paper.  Part of the reason is behavioral, the authors explain. ""Our heuristics would have been significantly less effective if the founders interacting with the pool behaved in a less regular fashion,"" they write. ""In particular, by always withdrawing the same amount in the same time intervals, it became possible to distinguish founders withdrawing funds from other users.""  The reason for these transactions – and similar ones performed by miners – is that zcash coins are required to pass through the ""shielded pool"" of z-addresses before they can be used for another transaction.  The researchers wrote that they alerted the founders to this problem before publishing their research, which they add has already led to a change in behavior.  In a response, Zcash founder Zooko Wilcox and marketing director Josh Swihart congratulated the research team, saying they ""invite other scientists to join with us in investigating these questions that are important to the future of human society.""  Regarding the actual privacy concern, the post said:  ""It is valuable to understand how much privacy is lost when using shielded addresses as a pass-through mechanism, but using it in that way is not recommended. Instead, store your Zcash in a shielded address.""  Further, Wilcox and Swihart said that planned upgrades to the zcash protocol - specifically the Sapling hard fork - would lessen the risks to anonymity identified in the paper.  Currently, only a minority of transactions are shielded, and far fewer are fully shielded, with z-addresses on both sides. According to the Zchain block explorer, 85 percent of transactions over the past month are fully public, and just 0.6 percent are fully shielded.  Fence image via Shutterstock",NEGATIVE,없음,BLOCKCHAIN | BTC | ZEC | RESEARCH | FORKS,David Floyd,0,0,CoinDesk,https://coindesk.com/markets/2018/05/09/zcash-privacy-weakened-by-certain-behaviors-researchers-say,https://cdn.sanity.io/images/s3y3vcno/production/51a0c5c639ac781cae73a22bdad84797b9089653-1900x1268.jpg?w=300&h=300&fit=crop
13238347,https://www.newsbtc.com/?p=331489,1525896032,Tech Investor: Bitcoin Could be Betamax to Another Crypto’s VHS,"According to an investor in the technology industry, Bitcoin could experience a similar fate to Sony&apos;s Betamax video format. Glenn Hutchins feels that another cryptocurrency could rise up and take Bitcoin&apos;s current position as the number one digital currency by market capitalisation. Glenn Hutchins: Bitcoin Could be Overtaken by Another Coin Hutchins spoke earlier today...The post Tech Investor: Bitcoin Could be Betamax to Another Crypto&apos;s VHS appeared first on NewsBTC.",NEGATIVE,BTC,BTC | BUSINESS | MARKET | TECHNOLOGY,,0,0,NewsBTC,https://www.newsbtc.com/2018/05/09/tech-investor-bitcoin-could-be-betamax-to-another-cryptos-vhs/,https://images.cryptocompare.com/news/newsbtc/ez8Ai4w1000.jpeg
42401521,DbF8Q09kuKX2XWBxAczuXO,1525894511,Messaging Giant WeChat Suspends Third-Party Blockchain App,"China's most popular messaging application, WeChat, has frozen a third-party blockchain application designed to introduce the nascent technology to a wide user base.  The mini-program, called Xiao Xieyi (or Mini Protocol in a literal translation), was launched on Wednesday and touted as a service that would allow users on WeChat to initiate contractual agreements, according to the Chinese business news outlet Caijinghttp://tech.caijing.com.cn/20180509/4450162.shtml. However, the app, which is owned by Tencent, suspended the program within a day.  Upon reaching consensus, the tool - developed by a Beijing-based blockchain-as-a-service platform called Niuco Box - would encrypt and record agreements on a blockchain for a fee. The funds raised through the app would pay miners who write transactions onto the network underpinning the application.  The effort may mark one of the first moves by Chinese blockchain developers to make the technology accessible to mainstream social media users. In March 2018, Tencent CEO Pony Ma claimed the messaging app now has more than 1 billion monthly active users across the world.  Yet, the program has already been suspended by WeChat. A search of its name now leads to a page which explains the program has violated rules on the platform, though the exact violation remains unknown.  ""The Mini Protocol is now being suspended because the type of its service is not yet authorized by the platform,"" the app said.  WeChat could not be reached for comment as of press time.  WeChat image via Shutterstock; Screen capture via Wolfie Zhao for CoinDesk",NEGATIVE,없음,ASIA | BLOCKCHAIN | BUSINESS | ETH | TECHNOLOGY,Wolfie Zhao,0,0,CoinDesk,https://coindesk.com/markets/2018/05/09/messaging-giant-wechat-suspends-third-party-blockchain-app,https://cdn.sanity.io/images/s3y3vcno/production/aad64ec7024bf174640a244b610218daabfbe53a-1000x667.jpg?w=300&h=300&fit=crop
13439040,https://news.bitcoin.com/?p=158288,1525894468,Crypto Youtuber Launching Bitcoin Funded TV Series on CBS,"A crypto Youtuber is launching his own television series that is fully paid for by bitcoin. They will air on CBS, the CW, and Roku. The first 13 episodes will air on CBS in selected areas, featuring topics such as crypto security, exchange trading, initial coin offerings, crypto crashes, mining, and the future of cryptocurrency. ...The post Crypto Youtuber Launching Bitcoin Funded TV Series on CBS appeared first on Bitcoin News.",POSITIVE,없음,BTC | EXCHANGE | ICO | MINING | TOKEN SALE,,0,0,Bitcoin.com,https://news.bitcoin.com/crypto-youtuber-bitcoin-funded-tv-series-cbs/,https://images.cryptocompare.com/news/bitcoin.com/c3sN71wy8ww.png
13474998,https://www.trustnodes.com/?p=12735,1525893553,EOS Has Spent One Billion Dollars Worth of Eth in the Past Month Data Reveals,"EOS has spent 1,268,066 eth, currently worth more than $950 million, in the past 30 days, trustnodes is told based on data provided by Santiment, an eth based ICOed project that...The post EOS Has Spent One Billion Dollars Worth of Eth in the Past Month Data Reveals appeared first on Trustnodes.",NEUTRAL,ICO,ETH | ICO | TOKEN SALE,,0,0,TrustNodes,https://www.trustnodes.com/2018/05/09/eos-spent-one-billion-dollars-worth-eth-past-month-data-reveals,https://images.cryptocompare.com/news/trustnodes/dNz8yKgOpj8.png
13238348,https://www.newsbtc.com/?p=331488,1525893325,Holdvest Will Close Their Pre-ICO in the Next Few Days,"After about two days of pre-ICO, all-in-one cryptocurrency platform Holdvest.com released an announcement about closing the ongoing round of crowdsale. As stated in their official Medium blog announcement, they are going to restructure their ICO profile, and the amount that was collected already is quite enough to continue work and prepare for the main stage...The post Holdvest Will Close Their Pre-ICO in the Next Few Days appeared first on NewsBTC.",NEUTRAL,ICO,ICO | SPONSORED | TOKEN SALE,,0,0,NewsBTC,https://www.newsbtc.com/2018/05/09/holdvest-close-pre-ico-in-next-few-days/,https://images.cryptocompare.com/news/newsbtc/cow08000000.jpeg
13249446,https://themerkle.com/?p=56648,1525892459,What Happens When Artificial Intelligence and Blockchain Tech Collide?,"Oftentimes in this cutthroat world, one emerging technology replaces another. Just think about your alarm clock, Rolodex, or camera. And as for fax machines and cassette players? No one&apos;s shedding a tear over their demise. But sometimes different technologies can actually complement each other, rather than remove and replace. Here we are in 2018, standing on the cusp of never-ending possibilities. We don&apos;t know yet how far-reaching the implications of blockchain technology are, nor that of AI. And when these two powerhouse technologies collide, amazing things can happen (if not just a little creepy). A Tailor-Made Travel Experience If you like to",POSITIVE,없음,BLOCKCHAIN | TECHNOLOGY,,0,0,NullTx,https://themerkle.com/what-happens-when-artificial-intelligence-and-blockchain-tech-collide/,https://images.cryptocompare.com/news/themerkle/9kBqI8pAz0f.jpeg
13454266,http://bitcoinist.com/?p=67889,1525892417,What Was Behind the Bytecoin (BCN) Price Pump?,"Following an announcement that Binance had opened up three trading pairs with Bytecoin (BCN) on their exchange, prices for the coin there quickly shot up over eight times their value. Prices on Poloniex and HitBTC, however, remained stagnant. As I was waiting for my Uber ride home from work this evening, a coworker spotted me as he was leaving and asked me if I&apos;d heard the latest news: &apos;Hey, you hear about that Bytecoin thingRead MoreThe post What Was Behind the Bytecoin (BCN) Price Pump? appeared first on Bitcoinist.com.",POSITIVE,없음,ALTCOIN | EXCHANGE | MARKET | TRADING | BNB,,0,0,Bitcoinist,https://bitcoinist.com/what-behind-bytecoin-bcn-price-pump/,https://images.cryptocompare.com/news/bitcoinist/e24B78Mg12c.jpeg
13249447,https://themerkle.com/?p=56808,1525892120,"Bitcoin Price Watch: Currency Spikes to $9,300","Bitcoin has jumped back to the $9,300 mark. The currency had recently been tested at $9,800, and was unable to surpass $10,000 mark over the weekend as so many analysts and users were hoping. It fell to $9,500 the following day, $9,300 after that, and ultimately settled at $9,100 during yesterday&apos;s early morning hours. Overall, the total drop amounted to $700 over the course of three days. Now that the currency has moved up, many are wondering if the bulls have once again taken the reins and are pushing bitcoin back up the financial hill. One source verifies that this",POSITIVE,없음,BTC | REGULATION | TRADING,,0,0,NullTx,https://themerkle.com/bitcoin-price-watch-currency-spikes-to-9300/,https://images.cryptocompare.com/news/themerkle/b6ippfcip9J.png
13238349,https://www.newsbtc.com/?p=331483,1525891220,"Xapo Reportedly Holds $10 Billion in Bitcoin, Roughly 7% of the Global Supply","Meet Wences Casares, the Argentine entrepreneur who has spent the past several years convincing Silicon Valley&apos;s wealthiest investors that Bitcoin, and only Bitcoin, is the global currency of the future. His startup, Xapo, has built a network of underground cold storage vaults across five continents, specifically designed to safeguard and protect large sums of the...The post Xapo Reportedly Holds $10 Billion in Bitcoin, Roughly 7% of the Global Supply appeared first on NewsBTC.",POSITIVE,BTC,BTC | BUSINESS,,0,0,NewsBTC,https://www.newsbtc.com/2018/05/09/xapo-reportedly-holds-10-billion-in-bitcoin-roughly-7-of-the-global-supply/,https://images.cryptocompare.com/news/newsbtc/dw00i1A41w0.jpeg
13249448,https://themerkle.com/?p=56729,1525890633,Decentralized crypto platform aims to become the world’s first hybrid exchange,"In 2017, the crypto market demonstrated that its value is limitless. ICOs have increased tremendously in popularity because they provide entrepreneurs with a more convenient way to raise money in order to fund their startups. As a consequence, trading cryptocurrency is now a favorite activity of investors looking to diversify their portfolios. Binance is the perfect example of a company that proves investors can attain excellent returns on their investment and become leaders in their niche with excellent marketing techniques and a high-quality product. Disclosure: This is a Sponsored Article However, trading cryptocurrency or promoting a crypto exchange business poses",POSITIVE,없음,BUSINESS | EXCHANGE | SPONSORED | TRADING | BNB,,0,0,NullTx,https://themerkle.com/decentralized-crypto-platform-aims-to-become-the-worlds-first-hybrid-exchange/,https://images.cryptocompare.com/news/themerkle/eek0200w00w.png
