뉴스ID,뉴스GUID,일자(UTC timestamp),뉴스제목,본문,SENTIMENT,주요코인,카테고리,작성자,추천수,비추천수,출처,뉴스URL,이미지URL
4191700,https://cryptopotato.com/?p=223754,1668383127,Luxury Hotel in Dubai Accepts Shiba Inu as Payment Method,W Dubai - The Palm and three of Subway's outlets in Germany are the latest entities to accept digital currencies for payments.,NEUTRAL,없음,SHIB,,0,0,Crypto Potato,https://cryptopotato.com/luxury-hotel-in-dubai-accepts-shiba-inu-as-payment-method/,https://resources.cryptocompare.com/news/27/4191700.jpeg
4191210,https://ambcrypto.com/?p=270556,1668382202,Flustered Bitcoin investors could expect a quiet start to the week thanks to…,BTC’s MVRV Index indicated a possible market bottom Number of Addresses Holding 0.01+ Bitcoins reached an ATH The current cycle in the crypto market was seen favoring sellers. This was the reason for most of the crypto market bleeding red. The market leader Bitcoin [BTC] was also hit as its price declined by 21% over the,NEUTRAL,BTC,BTC | BUSINESS | MARKET | TRADING,,0,0,AMB Crypto,https://ambcrypto.com/flustered-bitcoin-investors-could-expect-a-quiet-start-to-the-week-thanks-to/,https://images.cryptocompare.com/news/default/ambcrypto.png
4190978,https://timestabloid.com/?p=11890,1668381677,Ethereum’s Vitalik Buterin: FTX Exchange Meltdown “Cuts Deeper” Than Terra (LUNA) Collapse,"It is no longer news that FTX, the once-thriving and popular cryptocurrency exchange founded by Sam Bank-man Fried, has collapsed, causing a massive decline in the price of its native token, FTT. This unfortunate incident has left many investors wrecked while also opening the door for rigid regulatory policies from the SEC and other related The post Ethereum’s Vitalik Buterin: FTX Exchange Meltdown “Cuts Deeper” Than Terra (LUNA) Collapse appeared first on Times Tabloid .",NEGATIVE,LUNA | FTT,BUSINESS | ETH | EXCHANGE | LUNA | FTT,,0,0,TimesTabloid,https://timestabloid.com/ethereum-vitalik-buterin-ftx-exchange-meltdown-cuts-deeper-than-terra-luna-collapse/,https://resources.cryptocompare.com/news/67/default.png
4190648,https://www.cryptopolitan.com/?p=237690,1668381091,"Bitcoin price analysis: BTC could boost up to $18,200 after consecutive days of decline","Bitcoin price analysis shows price decline deepened a further 3 percent over today’s trade, as price went down to $16,200. BTC has been in consistent decline since November 6, and a further 4 percent decline could push price to test the $16,000 support mark. The intraday Bitcoin volume went down to $24.9 billion, recording a … Bitcoin price analysis: BTC could boost up to $18,200 after consecutive days of decline Read More »",NEUTRAL,BTC,BTC | MARKET | TRADING,,0,0,Cryptopolitan,https://www.cryptopolitan.com/bitcoin-price-analysis-2022-11-13/,https://images.cryptocompare.com/news/default/cryptopolitan.png
4190382,https://dailyhodl.com/?p=225120,1668380706,"Shark Tank’s Kevin O’Leary Says FTX Investment Went to Zero, Needs One Thing To Happen Before Touching Crypto Again","Shark Tank investor Kevin O’Leary has revealed that his investment in FTX International has gone to “zero” and that he doesn’t want to make any more capital allocations to crypto until one thing happens. In an interview with CNBC, O’Leary, a former paid spokesperson for FTX, says that institutional investors like himself won’t be engaging The post Shark Tank’s Kevin O’Leary Says FTX Investment Went to Zero, Needs One Thing To Happen Before Touching Crypto Again appeared first on The Daily Hodl .",NEGATIVE,없음,BUSINESS,,0,0,The Daily Hodl,https://dailyhodl.com/2022/11/13/shark-tanks-kevin-oleary-says-ftx-investment-went-to-zero-needs-one-thing-to-happen-before-touching-crypto-again/,https://images.cryptocompare.com/news/default/dailyhodl.png
4190291,https://news.bitcoin.com/?p=558335&preview=true&preview_id=558335,1668380446,"Kraken CEO Discusses Impact of FTX Failure — Says Damage to Crypto Industry Is Huge, Will Take Years to Undo","The CEO of cryptocurrency exchange Kraken has outlined the impact of FTX’s failure on the crypto industry. After listing multiple red flags, the executive stressed: “The damage here is huge … We’re going to be working to undo this for years.” Crypto Exchange Kraken’s CEO on Damage to Crypto Industry Caused by FTX’s Failure The",NEGATIVE,없음,EXCHANGE | SPONSORED,,0,0,Bitcoin.com,https://news.bitcoin.com/kraken-ceo-discusses-impact-of-ftx-failure-says-damage-to-crypto-industry-is-huge-will-take-years-to-undo/,https://resources.cryptocompare.com/news/14/4190291.jpeg
4189296,https://ambcrypto.com/?p=270630,1668378640,Why LINK investors might be sitting on a goldmine thanks to proof of reserve,"LINK’s velocity and supply in smart contracts dropped significantly in the last five days However, LINK held in smart contracts grew substantially during the last four weeks It is often difficult to find winners in the crypto market during a major crash but Chainlink [LINK] might be it. Even though its native currency LINK suffered",NEUTRAL,LINK,ALTCOIN | BUSINESS | FIAT | LINK | MARKET,,0,0,AMB Crypto,https://ambcrypto.com/why-link-investors-might-be-sitting-on-a-goldmine-thanks-to-proof-of-reserve/,https://images.cryptocompare.com/news/default/ambcrypto.png
4188870,https://cryptonews.com/exclusives/alex-tapscott-managing-director-at-ninepoint-partners-and-best-selling-author-of-blockchain-revolution-and-digital-asset-revolution-ep-177.htm,1668377640,"Alex Tapscott, Managing Director at Ninepoint Partners and Best-Selling Author of Blockchain Revolution and Digital Asset Revolution | Ep. 177","In an exclusive interview with cryptonews.com, Alex Tapscott, Managing Director at Ninepoint Partners and Best-Selling Author of Blockchain Revolution and Digital Asset Revolution, talks about Crypto in Toronto, becoming a best-selling author, and the Dollar MilkShake Theory. ... Read More: Alex Tapscott, Managing Director at Ninepoint Partners and Best-Selling Author of Blockchain Revolution and Digital Asset Revolution | Ep. 177",NEUTRAL,없음,BLOCKCHAIN | FIAT,,0,0,cryptonews,https://cryptonews.com/exclusives/alex-tapscott-managing-director-at-ninepoint-partners-and-best-selling-author-of-blockchain-revolution-and-digital-asset-revolution-ep-177.htm,https://resources.cryptocompare.com/news/52/4188870.jpeg
4188378,https://cointelegraph.com/news/crosstower-revises-new-offer-for-voyager-s-assets-after-ftx-s-bankruptcy,1668376831,CrossTower revises new offer for Voyager’s assets after FTX’s bankruptcy,"Voyager reopened its bidding process after FTX US, the original winner, filed for bankruptcy on Nov. 11.",NEUTRAL,없음,OTHER,,0,0,CoinTelegraph,https://cointelegraph.com/news/crosstower-revises-new-offer-for-voyager-s-assets-after-ftx-s-bankruptcy,https://resources.cryptocompare.com/news/16/4188378.jpeg
4188061,https://cointelegraph.com/news/developers-could-have-prevented-crypto-s-2022-hacks-if-they-took-basic-security-measures,1668376011,Developers could have prevented crypto's 2022 hacks if they took basic security measures,Crypto doesn’t need reversible transactions. It needs real-time threat monitoring and more audits.,NEUTRAL,없음,OTHER,,0,0,CoinTelegraph,https://cointelegraph.com/news/developers-could-have-prevented-crypto-s-2022-hacks-if-they-took-basic-security-measures,https://resources.cryptocompare.com/news/16/4188061.jpeg
4187813,https://decrypt.co/?p=114333,1668375626,Chorus of Lawmakers Collectively Call for Crypto Controls in FTX Fallout,Lawmakers sounded off on the need for better investor protections after a chaotic week.,NEUTRAL,없음,BUSINESS,,0,0,Decrypt,https://decrypt.co/114333/chorus-of-lawmakers-collectively-call-for-crypto-controls-in-ftx-fallout,https://resources.cryptocompare.com/news/44/4187813.jpeg
4187368,https://ambcrypto.com/?p=270530,1668375018,"As ETC retests $23.3 as resistance, could extended losses bring $13 in sight","Disclaimer: The findings of the following analysis are the sole opinions of the writer and should not be considered investment advice The higher timeframe structure is bearish for Ethereum Classic Some respite was seen at $18.3, but this bounce was short-lived USDT Dominance (Tether Dominance) rose to 8.53%, the highest value it reached since mid-June. Investor",NEGATIVE,ETC | USDT,ALTCOIN | BUSINESS | ETC | MARKET | USDT,,0,0,AMB Crypto,https://ambcrypto.com/as-etc-retests-23-3-as-resistance-could-extended-losses-bring-13-in-sight/,https://images.cryptocompare.com/news/default/ambcrypto.png
4186463,https://news.bitcoin.com/?p=558382,1668373224,"Bank of Russia Sets Out to Regulate Digital Asset Taxation, Exchange, Still Opposed to Crypto","The Central Bank of Russia supports the development of digital financial assets but remains opposed to legalizing crypto payments, its top management has reiterated. The monetary authority is now working on a set of regulatory proposals that will be submitted to parliament by the end of the year. Russia’s Central Bank Takes Legislative Initiative in",NEUTRAL,없음,EXCHANGE | FIAT | REGULATION,,0,0,Bitcoin.com,https://news.bitcoin.com/bank-of-russia-sets-out-to-regulate-digital-asset-taxation-exchange-still-opposed-to-crypto/,https://resources.cryptocompare.com/news/14/4186463.jpeg
4186420,https://dailyhodl.com/?p=225118,1668373205,Bitcoin Bull Anthony Pompliano Says Confidence Game Now Over for Crypto Industry,"Longtime Bitcoin (BTC) supporter and entrepreneur Anthony Pompliano says that people in the crypto space are underestimating just how much damage has been done to the industry following the collapse of FTX and its associated entities. Pompliano tells his 1.6 million Twitter followers that following the FTX debacle, the crypto industry as a whole is The post Bitcoin Bull Anthony Pompliano Says Confidence Game Now Over for Crypto Industry appeared first on The Daily Hodl .",NEGATIVE,BTC,BTC | TRADING,,0,0,The Daily Hodl,https://dailyhodl.com/2022/11/13/bitcoin-bull-anthony-pompliano-says-confidence-game-now-over-for-crypto-industry/,https://images.cryptocompare.com/news/default/dailyhodl.png
4185460,https://ambcrypto.com/?p=270581,1668371432,Why Polygon’s metaverse update could be a game changer for MATIC holders,"Polygon becomes the first ecosystem to host an airport metaverse MATIC is still struggling to recover despite healthy network growth. Polygon has been celebrating different wins lately but its latest one slaps different. With the network leaning heavily towards metaverse offerings, Polygon has become the first blockchain network to host an airport metaverse courtesy of",POSITIVE,MATIC,ALTCOIN | BLOCKCHAIN | MATIC,,0,0,AMB Crypto,https://ambcrypto.com/why-polygons-metaverse-update-could-be-a-game-changer-for-matic-holders/,https://images.cryptocompare.com/news/default/ambcrypto.png
4185281,https://www.cryptopolitan.com/?p=237676,1668371067,Learning from the FTX collapse: Are centralized exchanges really safe?,"The recent collapse of popular crypto exchange FTX is again raising the question of ‘who actually controls our crypto assets?”. This whole debacle has significantly damaged the crypto industry, as almost every major cryptocurrency is experiencing historical downtrends. What’s worse is that thousands of users have lost full control of their crypto assets on the … Learning from the FTX collapse: Are centralized exchanges really safe? Read More »",NEGATIVE,없음,EXCHANGE,,0,0,Cryptopolitan,https://www.cryptopolitan.com/ftx-collapse-are-centralized-exchanges-safe/,https://resources.cryptocompare.com/news/43/4185281.jpeg
4185035,https://cryptopotato.com/?p=223967,1668370552,Bitcoin Will Be The Winner: Michael Saylor on the FTX Collapse,Michael Saylor thinks the FTX fiasco could accelerate the enforcement of appropriate crypto rules.,NEUTRAL,없음,BTC,,0,0,Crypto Potato,https://cryptopotato.com/bitcoin-will-be-the-winner-michael-saylor-on-the-ftx-collapse/,https://resources.cryptocompare.com/news/27/4185035.jpeg
4184048,https://dailyhodl.com/?p=225124,1668368719,"Cardano (ADA) Founder Charles Hoskinson Issues Warning, Says FTX Collapse Will Bring More Fallout","The co-creator of Ethereum (ETH) rival Cardano (ADA) is warning investors that there will be more fallout from crypto exchange FTX’s recent collapse. In a new video update, Charles Hoskinson says that the disintegration of FTX may push lawmakers to bring about new regulations for the digital assets industry. Hoskinson says that FTX was not The post Cardano (ADA) Founder Charles Hoskinson Issues Warning, Says FTX Collapse Will Bring More Fallout appeared first on The Daily Hodl .",NEGATIVE,ADA | ETH,ADA | ALTCOIN | BUSINESS | ETH | EXCHANGE,,0,0,The Daily Hodl,https://dailyhodl.com/2022/11/13/cardano-ada-founder-charles-hoskinson-issues-warning-says-ftx-collapse-will-bring-more-fallout/,https://images.cryptocompare.com/news/default/dailyhodl.png
4182914,https://www.cryptopolitan.com/?p=237613,1668368001,Hong Kong takes a strong stand on crypto amidst FTX saga,"According to an essay that was written on November 13th by the Financial Secretary of Hong Kong, Paul Chan, he is urging for a greater emphasis on transparency and competent supervision when dealing with digital assets in the face of the current FTX disaster. Since the middle of this year, cryptocurrencies have crashed or related … Hong Kong takes a strong stand on crypto amidst FTX saga Read More »",NEUTRAL,없음,ASIA,,0,0,Cryptopolitan,https://www.cryptopolitan.com/hong-kong-takes-a-strong-stand-on-crypto/,https://resources.cryptocompare.com/news/43/4182914.jpeg
4183594,https://ambcrypto.com/?p=270512,1668367846,Why ETH investors could have tough days despite these promising updates,"The total annualized issuance rate of ETH reduced substantially Circulation also decreased, adding to Ethereum’s deflationary nature Many speculations were made regarding what would lie ahead for Ethereum [ETH] post the Merge. One of the doubts that most had was around ETH’s deflationary nature. However, there was some clarity seen on that front as according",NEUTRAL,ETH,ALTCOIN | BUSINESS | ETH | SPONSORED,,0,0,AMB Crypto,https://ambcrypto.com/why-eth-investors-could-have-tough-days-despite-these-promising-updates/,https://images.cryptocompare.com/news/default/ambcrypto.png
4183548,https://thecoinrise.com/?p=53706,1668367751,Solana Developers to Fork Serum Following FTX Hack,"Developers in the Solana ecosystem have created new codes to fork Serum, a decentralized exchange software built on the protocol The post Solana Developers to Fork Serum Following FTX Hack appeared first on Blockchain, Crypto and Stock News .",NEUTRAL,없음,BLOCKCHAIN | BUSINESS | EXCHANGE | SOL | TECHNOLOGY,,0,0,The Coin Rise,https://thecoinrise.com/solana-developers-to-fork-serum-following-ftx-hack/,https://images.cryptocompare.com/news/default/thecoinrise.png
4183422,https://blockworks.co/?p=38697,1668367491,"4,500 Doxed Tokensoft Users, a Rush on Cold Storage Wallets: Where’s the Silver Lining?","If crypto is to evolve, more people need to learn that exchanges are not necessarily the safest place for their assets - and their data safety is paramount. The post 4,500 Doxed Tokensoft Users, a Rush on Cold Storage Wallets: Where’s the Silver Lining? appeared first on Blockworks .",NEUTRAL,없음,WALLET,,0,0,Blockworks,https://blockworks.co/news/doxed-tokensoft-cold-storage-wallets/,https://images.cryptocompare.com/news/default/blockworks.png
4182658,https://news.bitcoin.com/?p=558474,1668366055,Royal Bahamas Police Force Reveals FTX Is Being Investigated for ‘Criminal Misconduct’,"“A team of financial investigators” are currently investigating the now-defunct crypto exchange FTX, the Royal Bahamas Police Force said in a statement shared on Sunday. The police noted that the financial investigators were searching to see if “any criminal misconduct occurred.” Bahamas Law Enforcement Looks Into FTX Collapse After the Bahamas securities regulator took action",NEGATIVE,없음,EXCHANGE | REGULATION,,0,0,Bitcoin.com,https://news.bitcoin.com/royal-bahamas-police-force-reveals-ftx-is-being-investigated-for-criminal-misconduct/,https://resources.cryptocompare.com/news/14/4182658.jpeg
42388678,1WhGe7o17bdD4QO5qRQJxh,1668365145,Binance CEO Zhao Pushes for Crypto Self-Custody; Trust Wallet Token Soars 80% to Record,"The CEO of leading cryptocurrency exchange Binance, Changpeng ""CZ"" Zhao, called on members of the crypto community to take personal control of their digital assets using Trust Wallet, sending the app's native token, TWT, to a record high.  ""Self-custody is a fundamental human right,"" Zhao tweeted Sunday. ""You are free to do it at any time. Just make sure you do it right.""  Zhao's push for self-custody comes as investors rethink how to keep their assets safe in the wake of cryptocurrency exchange FTX's collapse and a subsequent hack that drained $600 million worth of coins from its wallets. Acquired by Binance in 2018, Trust Wallet is a decentralized hot wallet facilitating the storage of cryptocurrencies and non-fungible tokens. It is compatible with several blockchains.  Trust Wallet Token (TWT) is the wallet's official token, allowing holders to participate in decision-making related to app features and updates. The token has soared 80% in the past 24 hours to a record $2.3, according to data source Messari.  Zhao recommended investors start with small amounts and get comfortable with the technology to avoid mistakes that can be very costly. Zhao added that Trust Wallet facilitates the self-custody of crypto. ""@TrustWallet your keys, your coins,"" Zhao said in another tweet.  ""You have not bought bitcoin until you receive it in a wallet for which you control the private keys to,"" Blockware Solutions said in a market intelligence newsletter published Friday. ""The repeated, reckless handling of user funds by exchanges is proof that you cannot trust that these institutions actually have the bitcoin you purchased.""  ""The 'not your keys, not your coins' mantra rings truer than ever,"" Ilan Solot, co-head of digital assets at London-based Marex Solutions, said in an email.  Investors have been moving coins off exchanges since FTX went down. Early today, Binance saw a net outflow of more than $72 million, while Huobi and Crypto.com registered outflows of $12.7 million and $7.3 million, respectively, according to data tracked by blockchain analytics firm Nansen.  Data from Glassnode show bitcoin's exchange withdrawals have picked up recently, indicating increased investor preference for self-custody.",POSITIVE,TWT,BTC | BUSINESS | EXCHANGE | BNB | TWT,Omkar Godbole,0,0,CoinDesk,https://coindesk.com/markets/2022/11/13/binances-cz-pushes-for-self-custody-trust-wallet-token-soars-80-to-record-high,https://cdn.sanity.io/images/s3y3vcno/production/6ac7e0dc4912340e19e9644f567b170e732147bc-1242x781.png?w=300&h=300&fit=crop
42388676,1WhGe7o17bdD4QO5qRQJaJ,1668365048,Bankrupt FTX Faces Criminal Investigation in the Bahamas,"Law enforcement in the Bahamas are investigating Sam Bankman-Fried's crypto exchange FTX following the platform's swift collapse and bankruptcy filing last week.  A team at the jurisdiction's Financial Crimes Investigation Branch are ""working closely"" with the Bahamas Securities Commission to investigate if any criminal misconduct occurred, an official notice on Sunday said.  The Securities Commission of the Bahamas had already suspended FTX’s registration and ordered assets tied to the exchange frozen on Thursday.  Read more: Crypto Exchange FTX Reopens Bahamian Withdrawals: Nansen  The once multi-billion dollar cryptocurrency enterprise, which was headquartered in the Bahamas, started unraveling after a CoinDesk article questioning the financials of FTX's sister company Alameda Research led to a liquidity crunch in early November. On Tuesday, rival exchange Binance was looking to buy the embattled FTX before the deal was scrapped – the exchange is now seeking protection from bankruptcy in the U.S.  Financial regulators in the Bahamas have been watching the proceedings closely. When FTX admitted it had allowed some Bahamian customers to withdraw funds from the exchange citing local regulatory requirements, the Securities Commission issued a statement saying it had not directed the exchange to reinstate withdrawals.  FTX is also under investigation by the U.S. Securities and Exchange Commission and the Justice Department.  Read more: Bankman-Fried’s Cabal of Roommates in the Bahamas Ran His Crypto Empire – and Dated. Other Employees Have Lots of Questions",NEGATIVE,없음,BUSINESS | EXCHANGE | REGULATION | RESEARCH | BNB,Sandali Handagama,0,0,CoinDesk,https://coindesk.com/policy/2022/11/13/bankrupt-ftx-faces-criminal-investigation-in-the-bahamas,https://cdn.sanity.io/images/s3y3vcno/production/0382344ecf5d5aaef92ffbe91d3b0a9fa43f3187-3226x2419.jpg?w=300&h=300&fit=crop
4181934,https://cointelegraph.com/news/ftx-under-investigation-in-the-bahamas-for-criminal-misconduct-report,1668364684,FTX under investigation in the Bahamas for criminal misconduct: Report,The Bahamas securities regulator and financial investigators are reportedly investigating the collapsed crypto exchange.,NEGATIVE,없음,EXCHANGE,,0,0,CoinTelegraph,https://cointelegraph.com/news/ftx-under-investigation-in-the-bahamas-for-criminal-misconduct-report,https://resources.cryptocompare.com/news/16/4181934.jpeg
4181845,https://thecoinrise.com/?p=53697,1668364610,Hong Kong Calls for Increased Supervision and Transparency after FTX Fall,"Hong Kong’s financial secretary Paul Chan has called for proper supervision and transparency when handling digital assets in the country The post Hong Kong Calls for Increased Supervision and Transparency after FTX Fall appeared first on Blockchain, Crypto and Stock News .",NEUTRAL,없음,ASIA | BLOCKCHAIN | BUSINESS,,0,0,The Coin Rise,https://thecoinrise.com/hong-kong-calls-for-increased-supervision-and-transparency-after-ftx-fall/,https://images.cryptocompare.com/news/default/thecoinrise.png
4181844,https://cryptonews.com/exclusives/investment-daos.htm,1668364140,Investment DAOs: What Are They & How Do They Work?,"For a long time, venture capital has dominated startup funding, but that is slowly changing. Although the crypto industry is still at a nascent stage, a new funding approach is taking root, thanks to this new world. Investment DAOs are making it possible for anyone to invest in crypto projects and reap potential rewards. Read on to learn about investment DAOs and whether it makes sense or not to join one. ... Read More: Investment DAOs: What Are They & How Do They Work?",NEUTRAL,없음,OTHER,,0,0,cryptonews,https://cryptonews.com/exclusives/investment-daos.htm,https://resources.cryptocompare.com/news/52/4181844.jpeg
4181620,https://thecoinrise.com/?p=53688,1668364122,Kraken Freezes Accounts Owned by FTX and its Executives,"Kraken has frozen accounts operated by beleaguered Bahamian crypto exchange FTX, its associate Alameda Research and their executives The post Kraken Freezes Accounts Owned by FTX and its Executives appeared first on Blockchain, Crypto and Stock News .",NEGATIVE,없음,BLOCKCHAIN | BUSINESS | EXCHANGE | RESEARCH,,0,0,The Coin Rise,https://thecoinrise.com/kraken-freezes-accounts-owned-by-ftx-and-its-executives/,https://images.cryptocompare.com/news/default/thecoinrise.png
4181643,https://decrypt.co/?p=114319,1668363940,"This Week on Crypto Twitter: FTX’s Collapse as it Happened, in Tweets",The entire market crashed this week as one of the industry’s biggest players watched their empire totally evaporate in five days flat.,NEGATIVE,없음,MARKET,,0,0,Decrypt,https://decrypt.co/114319/this-week-crypto-twitter-ftx-collapse-tweets,https://resources.cryptocompare.com/news/44/4181643.jpeg
