뉴스ID,뉴스GUID,일자(UTC timestamp),뉴스제목,본문,SENTIMENT,주요코인,카테고리,작성자,추천수,비추천수,출처,뉴스URL,이미지URL
13220440,https://www.newsbtc.com/?p=487338,1648771150,Possible Timelines For Bitcoin To Hit $100k: Why CEOs See Bullish Signs,"After bitcoin broke above the $45k resistance level reaching the $48k mark, it has retested the $45k level. Some analysts still expect a rise to above $50k, others have abandoned their bullish approach. Meanwhile, leading CEOs from Pantera Capital and Skybridge Capital remain positive that the coin will reach the $100k mark in a period of one to two years. Pantera Capital CEO Is &apos;Wildly Bullish&apos; In an interview with Yahoo Finance, the CEO of Pantera Capital Dan Morehead commented on Bitcoin&apos;s price action so far in the year. Morehead noted that within the history of Bitcoin cycles, it&apos;s had six previous bear markets that average about 60%, and 2022&apos;s has been 50%. In his opinion, the bitcoin cycles will begin to moderate thanks to large institutional engagement, and &apos;a 50% bear market is probably all you&apos;re going to get going forward.&apos; &apos;I think we&apos;re either at the lows or very close to it.&apos; Morehead said he is &apos;wildly bullish right now&apos; because he believes that Bitcoin and the asset classes will decouple, noting that the high correlation that usually happens during periods of stress -similar to 2022&apos;s turmoil- eventually breaks, usually after a 72-days average. &apos;I think stocks and bonds may keep going down potentially for years, whereas blockchain assets can go up.&apos; Morehead accepted that Pantera Capital failed to predict how fear over the Fed&apos;s rate...",POSITIVE,없음,BLOCKCHAIN | BTC | MARKET | TRADING,,0,0,NewsBTC,https://www.newsbtc.com/news/bitcoin/possible-timelines-for-bitcoin-to-hit-100k-why-ceos-see-bullish-signs/,https://images.cryptocompare.com/news/default/newsbtc.png
13334028,https://cointelegraph.com/news/analysts-debate-bitcoin-s-next-step-after-today-s-45-5k-retest,1648770459,Analysts debate Bitcoin’s next step after today’s $45.5K retest,"BTC finally hit the projected $45,000 support zone, but analysts have mixed views on whether continuation or consolidation will be the next step.",NEUTRAL,BTC,BTC | MARKET,,0,0,CoinTelegraph,https://cointelegraph.com/news/analysts-debate-bitcoin-s-next-step-after-today-s-45-5k-retest,https://images.cryptocompare.com/news/default/cointelegraph.png
13401489,https://cryptopotato.com/?p=179842,1648770313,Crypto Donations to Ukraine Top $100 Million,"In the month after Russia invaded Ukraine, the latter has received over $100 million worth of cryptocurrency donations.",POSITIVE,없음,OTHER,,0,0,Crypto Potato,https://cryptopotato.com/crypto-donations-to-ukraine-top-100-million/,https://images.cryptocompare.com/news/default/cryptopotato.png
13266133,https://ambcrypto.com/?p=225486,1648769433,Could SAND climb to $4.4 and beyond with its recent momentum,"Disclaimer: The findings of the following analysis are the sole opinions of the writer and should not be considered investment advice The Sandbox dropped to $2.55 in January, when there was intense selling pressure in the market and the sentiment was extremely fearful. Another wave of selling was seen in mid-February, but The Sandbox was not ...",POSITIVE,SAND,ALTCOIN | MARKET | SAND,,0,0,AMB Crypto,https://ambcrypto.com/could-sand-climb-to-4-4-and-beyond-with-its-recent-momentum/,https://images.cryptocompare.com/news/default/ambcrypto.png
13382630,https://zycrypto.com/?p=66488,1648768543,EU Parliament Passes Controversial Rules Targeting Self-Hosted Crypto Wallet Users,The European Union (EU) parliament has today voted in favor of new harsh rules that call for the crackdown of unhosted or non-custodial wallets. This is a big blow for cryptocurrency privacy advocates in Europe.,NEGATIVE,없음,OTHER,,0,0,ZyCrypto,https://zycrypto.com/eu-parliament-passes-controversial-rules-targeting-self-hosted-crypto-wallet-users/,https://images.cryptocompare.com/news/default/zycrypto.png
42374953,0r6Zag11PPDEMKgUWw4dkL,1648767797,"First Mover Asia: Tailwinds for South Korea's Crypto Industry; Bitcoin, Ether Plunge","Good morning. Here’s what’s happening:  Prices: Bitcoin and other major cryptocurrencies decline.  Insights: The South Korean crypto industry has had some good news lately.  Technician's take: BTC is declining from overbought levels; support at $43K.  Catch the latest episodes of CoinDesk TV for insightful interviews with crypto industry leaders and analysis. And sign up for First Mover,our daily newsletter putting the latest moves in crypto markets in context.  Prices  Bitcoin (BTC): $45,808 -2.7%  Ether (ETH): $3,292 -2.7%  Top Gainers  Asset Ticker Returns Sector Solana SOL +3.2% Smart Contract Platform Bitcoin Cash BCH +1.3% Currency Algorand ALGO +0.7% Smart Contract Platform  Top Losers  Asset Ticker Returns Sector Filecoin FIL −5.1% Computing Internet Computer ICP −5.1% Computing Litecoin LTC −4.9% Currency  Bitcoin, other major cryptos plunge  Bitcoin and other major cryptocurrencies plunged on Thursday amid worsening inflation numbers and a vote by the European Union on crypto legislation that the industry viewed unfavorably.  The largest cryptocurrency by market capitalization was recently trading at under $46,00, a more than 2% drop over the past 24 hours. Ether, the second-largest crypto by market cap, was similarly off for the same period and changing hands at about $3,300. A number of prominent altcoins were faring even worse, suggesting lessened risk appetite among investors. Meme coins DOGE and SHIB were recently off about 3% and 4.5% respectively.  Major cryptos' performances dovetailed with those of equity markets. The tech-heavy Nasdaq, S&P 500 and Dow Jones Industrial Average were all down 1.5%. Traditional safe havens such as gold and the U.S. dollar rose, while the 10-year Treasury yield continued to decline from Tuesday's high of 2.5%, as CoinDesk reported.  The U.S. central bank's preferred inflation gauge, the Personal Consumption Expenditures price index (PCE), showed annual inflation rose 6.4% in February, the Labor Department's Bureau of Economic Analysis reported Thursday. The inflation rate accelerated from the 6% clip reported a month ago. The February pace was the highest since 1982.  Some crypto traders watch inflation readings closely because the bitcoin (BTC) market sometimes moves after economic indicators are released. Some investors hold bitcoin as a protection against inflation. The report also showed that consumer spending slowed to 0.2%, from 2.7% in January. Bitcoin at least initially did not react to the news.  European Union lawmakers voted in favor of controversial measures to outlaw anonymous crypto transactions, a move the industry said would stifle innovation and invade privacy. The proposals are intended to extend anti-money laundering (AML) requirements that apply to conventional payments over EUR 1,000 (US$1,114) to the crypto sector. They also scrap the floor for crypto payments, so payers and recipients of even the smallest crypto transactions would need to be identified, including for transactions with unhosted or self-hosted wallets.  Meanwhile, lawmakers worldwide continued to look for ways to protect consumers from further increases in energy prices stemming from Russia's invasion of Ukraine. On Thursday, the Biden administration said it was considering the release of about 180 million barrels of oil over the next six months from the U.S.'s reserves at a rate of one million barrels per day. The price of Brent crude oil, a frequently watched measure of energy prices, was recently selling at about $105 per barrel, down about 1%.  Markets  S&P 500: 4,530 -1.5%  DJIA: 34,678 -1.5%  Nasdaq: 14,420 -1.5%  Gold: $1,937 +0.1%  Insights  Crypto in South Korea has enjoyed a tailwind lately.  Earlier this week, The Korean Herald reported that SK Square, the investment arm of South Korean conglomerate SK Group, would spend 2 trillion won (US$1.6 billion) in the next three years on semiconductors and blockchain.  “This will mark the first year when SK Square creates new shareholder value by investing in chips and blockchain, the fields that we are familiar with, and we see a high growth potential,” Park Jung-ho, CEO and vice chairman of SK Square, told The Korean Herald on Monday.  Seoul-based SK, which has 95 separate companies in chemicals, logistics, energy and materials, among other sectors, has been looking to broaden its portfolio. It is South Korea's third-largest conglomerate. The interest of a so-called chaebol reflects South Korean investors' and entrepreneurs' surging interest in crypto.  The firm plans to introduce its own token before the end of the year, according to a report last week by the Korea Economic Daily last week. SK Square, has set up a blockchain task force that is responsible for the project.  The token would be the first of its kind launched by any company under the purview of South Korea's top 10 conglomerates. The cryptocurrency will be aimed at integrating virtual economies across the group's businesses, the Economic Daily reported.  SK Square is also the largest shareholder of SK Hynix, the world's second-largest memory chipmaker after Samsung. In November 2021, SK Telecom spent KRW 87.3 billion acquire a 35% stake in crypto exchange Korbit.  SK Group's most recent initiative follows close behind the election of one of two presidential candidates who promoted crypto-friendly proposals in an effort to win younger voters. Yoon Suk-yeol, the conservative candidate who won the election, said he would take legal measures to confiscate crypto profits gained through illegitimate means and return them to the victims.  ***  India's passage of a finance bill with high taxes will hinder the fledgling industry's innovation and growth, the bill's opponents say.  “Treating profits and losses of each market pair separately” will discourage crypto participation and throttle the industry's growth,” said Nischal Shetty, CEO of crypto exchange WazirX, in a statement. “It’s very unfortunate and we urge the government to reconsider this.”  The crypto measures impose a daunting 30% capital gains tax on crypto transactions and a 1% tax deducted at source (TDS) with no offsetting losses. Industry advocates had hoped to convince lawmakers to limit at least the source tax.     Technician's take  Bitcoin Dips From $48K Resistance; Support at $43K  Bitcoin (BTC) is in pullback mode after sellers responded to resistance at $48,000. The cryptocurrency could find support at $43,000 into the Asia trading day, which could stabilize the down move.  The relative strength index (RSI) on the daily chart is declining from overbought levels, which typically precede pullbacks in price. On the weekly chart, however, the RSI is neutral with positive momentum readings. That means buyers could remain active at lower support levels.  Still, BTC is attempting to break below a two-week long uptrend, similar to what occurred in early February, which preceded a brief price drop.  For now, buyers will need to maintain the breakout above $45,000 to yield an upside target toward $50,966.  Important events  Miami NFT Week: Speakers include Mark Cuban and Miami Mayor Francis Suarez  8:30 a.m. HKT/SGT(12:30 a.m. UTC): Jibun (Japan) Bank manufacturing PMI (March)  9:45 a.m. HKT/SGT(1:45 a.m. UTC): Caixin (China) manufacturing PMI (March)  CoinDesk TV  In case you missed it, here is the most recent episode of ""First Mover"" on CoinDesk TV:  What a $625M Hack Says About the State of Crypto, Snoop Dogg Unveils Comic Book NFT and More  Hackers stole $625 million worth of USDC and ether from the Ronin Network and then used centralized exchanges to deposit thousands in ETH. Adam Darrah of ZeroFox joined ""First Mover"" and shared his analysis on what may be the biggest hack in crypto history. Mauricio Di Bartolomeo of Ledn provided his crypto markets analysis. Plus, Snoop Dogg's son, and crypto entrepreneur, Cordell Broadus explained their latest comic book NFT collection.  Headlines  Shiba Inu's Metaverse Will Feature More Than 100K Land Plots: Developers have decided to use Ethereum's native cryptocurrency ether as a land pricing token.  Crypto Industry Mobilizes Against Proposed EU Transparency Rules: Crypto advocates were able to sway lawmakers against a provision that could have effectively banned bitcoin in the European Union. Can they do it again?  Fed’s Preferred Inflation Gauge Up 6.4% in February to Four-Decade High: Bitcoin remained roughly flat after the release of the Labor Department's report.  Can Avalanche Win Over Wall Street and 'Degens' Alike?: At the inaugural Avalanche Summit in Barcelona, Spain, the speedy Ethereum alternative is looking to court users onto its subnets.  How a Post-Merge Ethereum Could Attract Institutional Investment: Ethereum’s staking derivatives offer many of the qualities institutions look for in investments.  Longer reads  Chris Larsen’s Plan to Greenify Bitcoin: Risky, Impractical and Maybe Nonsensical: As he strides away from the wreckage of Ripple, bags full to bursting, Larsen thinks he knows what’s best for the coin he failed to replace.  Today's crypto explainer: What Is Avalanche? A Look at the Popular ‘Ethereum-Killer’ Blockchain  Other voices: Bitcoin Prices Shake Off Pressure from a Crypto Heist. A Prominent Whale Is Growing Even Bigger.  Said and heard  ""Now, Europe is seeking new sources of natural gas to replace Russian imports, which account for 38% of the gas imported into the European Union. In addition to Qatar, European nations are talking with gas producers in Angola, Algeria, Libya and the U.S., according to officials in these countries."" (The Wall Street Journal) ... ""We are preparing a full exit from fossil energy coming from Russia, starting with oil - but without exporting our energy crisis to other countries. We need to think globally, invest in #RenewableEnergies worldwide & build energy partnerships."" (German Foreign Office) ... ""Modern know-your-customer/anti-money laundering (KYC/AML) regulations are equivalent to financial bloodletting today: They do little good and may cause a lot of harm. Yet, whether we like it or not, the KYC/AML nightmare is coming to crypto."" (CoinDesk contributor Boaz Sobrado) ... ""Ethereum could have been less complex, [Vitalik] Buterin writes. Its virtual machine could have used existing code rather than a bespoke solution. Its developers could have gone with a crude version of proof-of-stake (the consensus algorithm that will eventually secure Ethereum) that existed in 2013. Ethereum could have been “more Bitcoin-like,” Buterin said, referencing that first blockchain, which aims to do one thing well – serve as a global, peer-to-peer settlements layer denominated in a secure, digital bearer-asset, BTC."" (CoinDesk Assistant Opinion Editor Daniel Kuhn)",NEUTRAL,ETH,ASIA | ETH | MARKET | REGULATION | TRADING,"Shaurya Malwa, Damanick Dantes, James Rubin",0,0,CoinDesk,https://coindesk.com/markets/2022/03/31/first-mover-asia-tailwinds-for-south-koreas-crypto-industry-bitcoin-ether-plunge,https://cdn.sanity.io/images/s3y3vcno/production/220376cb654ad745368435e254a3b46e8742e812-5425x3617.jpg?w=300&h=300&fit=crop
13442255,https://bitcoinist.com/?p=176691,1648767639,Dogecoin Founder Gives Shiba Inu Metaverse A Thumbs Down,"Meme project Shiba Inu recently announced the launch of its metaverse project titled SHIB: The Metaverse. It has been a long-awaited step for the digital asset but not everyone is pleased with what the project has been doing. One of those is Dogecoin co-founder Billy Markus, who has taken to Twitter to express his displeasure ...",NEGATIVE,SHIB,DOGE | SHIB,,0,0,Bitcoinist,https://bitcoinist.com/dogecoin-founder-gives-shiba-inu-metaverse-a-thumbs-down/,https://images.cryptocompare.com/news/default/bitcoinist.png
13220441,https://www.newsbtc.com/?p=487335,1648767637,Bitcoin Mining Difficulty Eyes New ATH As Block Production Ramps Up,"Bitcoin mining difficulty has been on the rise as the network has gained more popularity. This is a far cry from what was expected after China, which was known as the mining capital of the world at that point, had laid a blanket ban on crypto mining. Bitcoin miners had been able to successfully set up in other regions of the world and mining activities have ramped up since then. This time around, it comes along with the growth of blocks mined per hour which has smashed all expectations. Not only has the mining difficulty been affected by this but its effects are being felt all around the mining industry. Bitcoin Mining Difficulty At New ATH? Block production rates have risen higher than anticipated to beat the previous target of 6 blocks mined per hour. This number now stands at 6.2 blocks mined in an hour. This increase in block production has led to an increase in mining difficulty which has pushed it towards new all-time highs. Going forward, there is expected to be a 4-5% difficulty adjustment in mining difficulty. Related Reading | Cardano Turns Bullish In The Short-Term, But Is That All? If this happens, it will easily send the bitcoin mining difficulty towards a new all-time high. It continues to follow the growing trend that began in August of 2021 after the China ban had gone into effect. It would beat all expectations given that the China ban had seen the bitcoin hash rate crash 50% last year. BTC hash rate on t...",POSITIVE,BTC,ADA | ASIA | BTC | MINING | TRADING,,0,0,NewsBTC,https://www.newsbtc.com/news/bitcoin/bitcoin-mining-difficulty-eyes-new-ath-as-block-production-ramps-up/,https://images.cryptocompare.com/news/default/newsbtc.png
13266134,https://ambcrypto.com/?p=225420,1648765859,"Amid criticism, will Shiba Inu’s ‘The Metaverse’ gamble pay off","The Shiba Inu team has finally introduced its much-anticipated metaverse project. It is aimed to take on established players like Decentraland. In a blog post published on 30 March, the team revealed details about its much-talked-about metaverse project called &apos;SHIB: The Metaverse.&apos; Spreading my claws Developers behind popular meme cryptocurrency Shiba Inu (SHIB) have unveiled ...",NEUTRAL,SHIB,ALTCOIN | ETH | MANA | SHIB | SPONSORED,,0,0,AMB Crypto,https://ambcrypto.com/amid-criticism-will-shiba-inus-the-metaverse-gamble-pay-off/,https://images.cryptocompare.com/news/default/ambcrypto.png
13493129,https://seekingalpha.com/article/4499102-how-control-risk-cryptos-portfolio?utm_source=cryptocompare.com&utm_medium=referral,1648765091,How To Control The Risk Of Cryptos To Your Portfolio,"Cryptocurrencies have become a wildly popular market.The risks of cryptocurrencies are much higher than the traditional equity index markets.To control risk when trading cryptocurrencies, you need to balance the volatility in your portfolio.Equity and futures markets use different methods to determine risk.",NEUTRAL,없음,MARKET | TRADING,,0,0,Seeking Alpha,https://seekingalpha.com/article/4499102-how-control-risk-cryptos-portfolio?utm_source=cryptocompare.com&utm_medium=referral,https://images.cryptocompare.com/news/default/seekingalpha.png
13480877,https://cryptobriefing.com/?p=114058,1648764990,Half of Ukrainian Crypto-Donation Campaigns “Obvious Scams:” Report,,NEGATIVE,없음,MARKET,,0,0,Crypto Briefing,https://cryptobriefing.com/half-of-ukrainian-crypto-donation-campaigns-obvious-scams-report/?utm_source=main_feed&utm_medium=rss,https://images.cryptocompare.com/news/default/cryptobriefing.png
42374949,0r6Zag11PPDEMKgUWw4dgZ,1648764716,Newly Introduced Bill Aims to Bring Transparency to the Stablecoin Marketplace,"The days of murky stablecoin reserves might soon be over.  Two U.S. lawmakers, Rep. Trey Hollingsworth (R-Indiana) and Sen. Bill Hagerty (R-Tenn.), introduced a bill in both the House of Representatives and Senate on Thursday aimed at bringing greater transparency to the stablecoin marketplace.  The aptly named “Stablecoin Transparency Act” would set standards for the “quality of assets held in reserves” as well as require stablecoin issuers to report on their reserves.  If passed, the bill would have a significant impact on stablecoin issuers including Circle and Tether, whose stablecoins' backing has been the source of much speculation in the crypto industry.  Tether, by far the largest stablecoin issuer, has been especially secretive about its reserves for USDT. The company has kicked the can on promises to issue audits on its reserves and has fought tooth and claw to keep information away from the public.  The now-$180 billion stablecoin market has also become a concern for regulators, many of whom have voiced concerns about potential exposure risks for the broader economy in the event of a “run” on stablecoin issuers.  Lawmakers are trying to find a solution that protects consumers and the economy without stifling innovation. Hollingsworth sees his bill as a step in the right direction.  “This bill isn't going to solve everything,” Hollingsworth told CoinDesk. “But it is an incremental step towards the unveiling of a balanced approach between development, technology and protection of consumers.”  Hollingsworth said he’s been amazed by the outpouring of support for the new bill, both from fellow lawmakers and industry participants.  “Even in its infancy of being introduced, we've just seen tremendous support on how this is a really thoughtful first step,” Hollingsworth said.  Good actors vs. bad actors  Hollingsworth believes the bill, whether it eventually passes or not, will give stablecoin issuers a sneak peek at where Congress is headed with stablecoin regulation.  “Even presenting this and dropping this to Congress is a signal to industry where we are headed,” Hollingsworth told CoinDesk. “They can begin to make decisions and move in that same direction.”  Hollingsworth wants to ensure that “good actors” in the stablecoin sphere – those that are interested in regulatory compliance – get the clarity necessary to make decisions about investments, regulation, and how to continue to develop the technology.  “Good actors in the space want to see the bad actors removed from the space, precluded from acting in the space, so that one bad actor will not besmirch the good reputation and good efforts of the entire industry,” he said.  Though Hollingsworth declined to name names on which stablecoin issuer he considered a “bad actor,” other representatives, including crypto-friendly Rep. Warren Davidson (R-Ohio), have pointed fingers at Tether.  Global reach  Though most stablecoins are pegged to the U.S. dollar, Hollingsworth felt it was important to craft a bill that did not have a limited scope.  “We’re working as broadly as possible with industry and consumers globally to make sure we’re coming out with a thoughtful framework,” Hollingsworth said. “That’s one of the reasons, frankly, why the bill isn’t dollar-specific.”  “I don’t want to be behind the curve when this bill gets passed and then have to amend it to reflect the different currencies that people are issuing stablecoins in,” he added.  Even if the bill is passed, implementation of the new requirements won’t be immediate.  “Agencies have to act upon the laws Congress passes,” Hollingsworth said. “But I think the effect is immediate, because everyone knows this is going to be the law. So everyone starts to comply, even ahead of the enforcement.”",POSITIVE,USDT,MARKET | REGULATION | TECHNOLOGY | USDT,Cheyenne Ligon,0,0,CoinDesk,https://coindesk.com/policy/2022/03/31/newly-introduced-bill-aims-to-bring-transparency-to-the-stablecoin-marketplace,https://cdn.sanity.io/images/s3y3vcno/production/99af29c72ecc17cc2a9196dec317eb4ce05c4875-5587x3725.jpg?w=300&h=300&fit=crop
