뉴스ID,뉴스GUID,일자(UTC timestamp),뉴스제목,본문,SENTIMENT,주요코인,카테고리,작성자,추천수,비추천수,출처,뉴스URL,이미지URL
42388673,1WhGe7o17bdD4QO5qRQJjf,1668363875,Crypto Exchange AAX Suspends Withdrawals as FTX Failure Reverberates,"Crypto exchange AAX said it had suspended activity, citing a scheduled upgrade that had been delayed by turbulent markets.  The failure of a third-party partner means services will be delayed for as long as 10 days, the Hong Kong-based company said Sunday. The exchange did not identify the partner, and has said it has no exposure to FTX, a rival whose collapse has caused chaos in the industry.  “Withdrawals have been suspended to avoid fraud and exploitation,” the company said. “AAX will continue our best efforts to resume regular operations for all users within 7-10 days to ensure the utmost accuracy.”  Users’ balances have to be manually restored after a partner failed, causing the system to record abnormal data, the company said. Vice-President Ben Caselin tweeted that the delay was being taken as an “extra precaution” following scheduled maintenance.  On Friday, the company, which launched in 2019 as the first crypto user of the London Stock Exchange Group’s (LSEG) matching technology, said it had no financial exposure to FTX or its affiliates. It stores a “substantial amount” of its assets in cold wallets and doesn't lend out user funds to venture activities, it said.  FTX filed for bankruptcy protection in the U.S. on Friday, and CEO Sam Bankman-Fried resigned. There have also been reports of FTX’s assets being hacked, and of the exchange using customer funds to prop up its trading arm Alameda.  A spokesperson for the London Stock Exchange told CoinDesk it was not the third party referred to by AAX and that there were ""no issues"" with its systems.  UPDATE (Nov. 14, 11:33 UTC): Adds London Stock Exchange comment.  CORRECTION (Nov. 14, 17:05 UTC): AAX was the first crypto user of LSEG technology, not the first external user.",NEGATIVE,없음,ASIA | BUSINESS | EXCHANGE | TECHNOLOGY | TRADING,Jack Schickler,0,0,CoinDesk,https://coindesk.com/business/2022/11/13/crypto-exchange-aax-suspends-withdrawals-as-ftx-failure-reverberates,https://cdn.sanity.io/images/s3y3vcno/production/14181346571834c0d2f1aa61d91f36c2f540dc40-1440x1080.jpg?w=300&h=300&fit=crop
4181255,https://thecoinrise.com/?p=53687,1668363456,El Salvador does not keep its Bitcoin holdings on FTX: Changpeng Zhao,"According to reports, the President of El Salvador has dispelled the claims that his government has its bitcoin storage on the exchange FTX. The post El Salvador does not keep its Bitcoin holdings on FTX: Changpeng Zhao appeared first on Blockchain, Crypto and Stock News .",NEUTRAL,없음,BLOCKCHAIN | BTC | BUSINESS | EXCHANGE | REGULATION,,0,0,The Coin Rise,https://thecoinrise.com/el-salvador-does-not-keep-its-bitcoin-holdings-on-ftx-changpeng-zhao/,https://images.cryptocompare.com/news/default/thecoinrise.png
4181032,https://finbold.com/?p=73467,1668363018,3 crypto tips from ‘The Wolf of Wall Street’ J. Belfort on how to survive crashing markets,"The cryptocurrency market is experiencing one of the longest downturns, with investors focusing on a possible price bottom. Amid the … Continued The post 3 crypto tips from ‘The Wolf of Wall Street’ J. Belfort on how to survive crashing markets appeared first on Finbold .",NEUTRAL,없음,BTC | BUSINESS | ETH | MARKET | TRADING,,0,0,Finbold,https://finbold.com/3-crypto-tips-from-the-wolf-of-wall-street-j-belfort-on-how-to-survive-crashing-markets/,https://images.cryptocompare.com/news/default/finbold.png
4180573,https://dailyhodl.com/?p=225127,1668362118,Skybridge Capital CEO Anthony Scaramucci Urges Sam Bankman-Fried To Tell Truth About FTX Debacle,"The chief executive of Skybridge Capital is urging FTX founder Sam Bankman-Fried to be more transparent about the exchange platform’s recent collapse. In a new interview on CNBC Squawk Box, Anthony Scaramucci implores former FTX CEO Bankman-Fried to tell the truth to investors and regulators about exactly what happened to the bankrupt crypto exchange. The The post Skybridge Capital CEO Anthony Scaramucci Urges Sam Bankman-Fried To Tell Truth About FTX Debacle appeared first on The Daily Hodl .",NEGATIVE,없음,BUSINESS | EXCHANGE | TRADING,,0,0,The Daily Hodl,https://dailyhodl.com/2022/11/13/skybridge-capital-ceo-anthony-scaramucci-urges-sam-bankman-fried-to-tell-truth-about-ftx-debacle/,https://images.cryptocompare.com/news/default/dailyhodl.png
4179759,https://ambcrypto.com/?p=270492,1668360647,"Solana drops to $13.5, can traders expect a short-term bounce from this level","Disclaimer: The findings of the following analysis are the sole opinions of the writer and should not be considered investment advice Bullish order block on lower timeframe spotted Futures markets did not see another build-up in short positions FTX filed for bankruptcy. Merely a week ago it was regarded as a giant in the industry, possibly",NEUTRAL,없음,ALTCOIN | MARKET | SOL | TRADING,,0,0,AMB Crypto,https://ambcrypto.com/solana-drops-to-13-5-can-traders-expect-a-short-term-bounce-from-this-level/,https://images.cryptocompare.com/news/default/ambcrypto.png
4179715,https://thecoinrise.com/?p=53684,1668360580,CoinShares reports 11% of its total net asset value stuck on FTX,"Around 11% of the total net asset value of CoinShares, Europe's largest digital asset investment and trading group, is stuck on FTX. The post CoinShares reports 11% of its total net asset value stuck on FTX appeared first on Blockchain, Crypto and Stock News .",NEUTRAL,없음,BLOCKCHAIN | BUSINESS | TRADING,,0,0,The Coin Rise,https://thecoinrise.com/coinshares-reports-11-of-its-total-net-asset-value-stuck-on-ftx/,https://images.cryptocompare.com/news/default/thecoinrise.png
42388655,1WhGe7o17bdD4QO5qRQJ8F,1668360340,Democrats Keep the US Senate but Crypto Only Has Eyes for FTX Collapse,"Democrats have retained control of the U.S. Senate following the midterm elections. Although a number of pro-crypto candidates from both sides are in, crypto exchange FTX’s fresh collapse will likely spell more regulations for the space.  The result was called on Sunday, five days after the elections were held, with election officials still counting votes for several members of the House of Representatives. It is not yet clear which party will control the lower body of Congress.  It’s also unclear how much the election outcome could sway crypto legislation already in the works, as the laws have had bipartisan support and the key lawmakers behind the initiatives remain in office. The crypto industry made a concerted effort to make its mark on Capitol Hill this year, and a number of proponents from both parties have won their respective races.  But the market could be a wild card.  On the day of the election, Sam Bankman-Fried, founder of FTX, made a surprise announcement on Twitter that rival platform Binance had signed a non-binding letter of intent to acquire FTX. In the days that followed, the deal was scrapped and the once multi-billion dollar exchange filed for bankruptcy on Friday. Over the weekend, FTX and FTX US were hacked with $600 million worth of crypto moved off the exchange.  Crypto prices across the board took a nosedive following the news, with bitcoin price dropping 22% in the last seven days, according to CoinMarketCap data on Sunday.  Bankman-Fried, who said he had spent much of his time talking to lawmakers and regulators in D.C. these last months, may still influence crypto rules, but not in the way he might have intended.  Several key Senators within the Democratic Party have expressed concern over the collapse of crypto exchange FTX, which was led by major election donor Sam Bankman-Fried. Sen. Sherrod Brown, who will continue to chair the Senate Banking Committee, and Sen. Elizabeth Warren, who sits on that committee, have both called for investigations into the exchange.  Read more: Crypto Has Prepared for Divided US Government, Republican Rise",NEGATIVE,없음,BTC | EXCHANGE | MARKET | REGULATION | BNB,Sandali Handagama,0,0,CoinDesk,https://coindesk.com/policy/2022/11/13/democrats-keep-the-us-senate-but-crypto-only-has-eyes-for-ftx-collapse,https://cdn.sanity.io/images/s3y3vcno/production/9cc563317f9251f21213474b153c726266f3a964-1440x1080.jpg?w=300&h=300&fit=crop
4179084,https://thecoinrise.com/?p=53681,1668359340,Huobi Global Publish Asset Transparency Report Revealing $3.5B in Holdings,"Huobi Global has published an assets transparency report to reassure customers of the safety of their funds The post Huobi Global Publish Asset Transparency Report Revealing $3.5B in Holdings appeared first on Blockchain, Crypto and Stock News .",NEUTRAL,없음,BLOCKCHAIN | BUSINESS | EXCHANGE,,0,0,The Coin Rise,https://thecoinrise.com/huobi-global-publish-transparency-report-with-3-5b-in-holdings/,https://images.cryptocompare.com/news/default/thecoinrise.png
4178946,https://thecoinrise.com/?p=53678,1668359099,Binance CEO CZ Shares Safety Tips to Users of Crypto Platforms,"Changpeng Zhao (CZ), the CEO and co-founder of Binance has shared some red flags investors using cryptocurrency exchange platforms The post Binance CEO CZ Shares Safety Tips to Users of Crypto Platforms appeared first on Blockchain, Crypto and Stock News .",NEUTRAL,없음,BLOCKCHAIN | BUSINESS | EXCHANGE | BNB,,0,0,The Coin Rise,https://thecoinrise.com/binance-ceo-cz-shares-safety-tips-to-users-of-crypto-platforms/,https://images.cryptocompare.com/news/default/thecoinrise.png
4178992,https://cryptonews.com/news/ftx-hack-and-balance-sheet-mystery-crypto-prices-weak-as-up-to-2-billion-of-client-funds-missing-where-is-sbf.htm,1668358920,FTX Hack and Balance Sheet Mystery – Crypto Prices Weak As Up to $2 Billion of Client Funds Missing. Where is SBF?,"Aside from losses resulting from the FTX hack, the bankrupt exchange is apparently unable to account for $1 billion to $2 billion of client funds, say people familiar with the matter, and its balance sheet shows liabilities of $8,859 million against assets of just $899 million. ... Read More: FTX Hack and Balance Sheet Mystery – Crypto Prices Weak As Up to $2 Billion of Client Funds Missing. Where is SBF?",NEGATIVE,없음,EXCHANGE | MARKET,,0,0,cryptonews,https://cryptonews.com/news/ftx-hack-and-balance-sheet-mystery-crypto-prices-weak-as-up-to-2-billion-of-client-funds-missing-where-is-sbf.htm,https://resources.cryptocompare.com/news/52/4178992.jpeg
4178853,https://news.bitcoin.com/?p=558461,1668358859,"SBF’s ‘Truly Trustless’ Protocol —  Serum’s Upgrade Authority May Be Tainted, Devs Look to Fork Project","According to Solana’s founder, Anatoly Yakovenko, Serum developers are forking the platform because the “upgrade key to the current one is compromised.” Serum, created by FTX’s Sam Bankman-Fried (SBF), was touted as “completely permissionless,” but now that the exchange has fallen, it’s suspected that Serum’s upgrade authority is tainted. **Editor’s Note: An update has",NEGATIVE,없음,ALTCOIN | BLOCKCHAIN | EXCHANGE | SOL,,0,0,Bitcoin.com,https://news.bitcoin.com/sbfs-truly-trustless-protocol-serums-upgrade-authority-may-be-tainted-devs-look-to-fork-project/,https://resources.cryptocompare.com/news/14/4178853.jpeg
4178440,https://www.cryptonewsz.com/?p=174034,1668358060,A Large Number of Imaginary One NFT Holders Buy Toon Finance,"If you are looking for unique NFTs in the market, you may have heard about the Imaginary One NFTs. They have been in talks due to their 3D NFTs, something new in the market. However, the Toon Finance presale gathered the attention of various other NFT holders, and Imaginary One NFT holders were surely one …",NEUTRAL,없음,MARKET,,0,0,CryptoNewsZ,https://www.cryptonewsz.com/a-large-number-of-imaginary-one-nft-holders-buy-toon-finance/,https://images.cryptocompare.com/news/default/cryptonewsz.png
4178198,https://www.cryptopolitan.com/?p=237633,1668357659,Cardano price analysis: Cryptocurrency faces break down to $0.3363 as bears take over,"Cardano price analysis shows a bearish trend in the cryptocurrency market today. Cardano prices are currently trading above key support at $0.3282, and a breakdown to this level could signal further declines toward the next major support at $0.3363. The bearish wave is being driven by strong selling pressure from investors, who are concerned about … Cardano price analysis: Cryptocurrency faces break down to $0.3363 as bears take over Read More »",NEGATIVE,없음,ADA | BUSINESS | MARKET | TRADING,,0,0,Cryptopolitan,https://www.cryptopolitan.com/cardano-price-analysis-2022-11-13/,https://resources.cryptocompare.com/news/43/4178198.jpeg
4178175,https://www.cryptopolitan.com/?p=237631,1668357594,"Bitcoin, Binance Coin, Helium, and Loopring Daily Price Analyses – 13 November Morning Prediction","The global crypto market has seen no positive change over the last day. The performance of Bitcoin, Binance Coin, and others continues to show losses. The market has witnessed a decline in value due to the recent upsets in the market. The major one is the crash of the FTX exchange and experts suggest that … Bitcoin, Binance Coin, Helium, and Loopring Daily Price Analyses – 13 November Morning Prediction Read More »",NEGATIVE,없음,BTC | EXCHANGE | LRC | TRADING | BNB,,0,0,Cryptopolitan,https://www.cryptopolitan.com/bitcoin-binance-coin-helium-and-loopring-daily-price-analyses-13-november-morning-prediction/,https://resources.cryptocompare.com/news/43/4178175.jpeg
4178264,https://cointelegraph.com/news/liquidity-hub-serum-forked-by-developers-after-ftx-hack,1668357573,Liquidity hub Serum forked by developers after FTX hack,"SRM and MSRM tokens and fees discounts were not changed and were working as before, said developers.",NEUTRAL,없음,OTHER,,0,0,CoinTelegraph,https://cointelegraph.com/news/liquidity-hub-serum-forked-by-developers-after-ftx-hack,https://resources.cryptocompare.com/news/16/4178264.jpeg
4178029,https://seekingalpha.com/news/3906642-heres-what-happened-in-the-week-long-ftx-fiasco-and-what-it-means-for-crypto?utm_source=cryptocompare.com&utm_medium=referral,1668357120,"Here's what happened in the week-long FTX fiasco, and what it means for crypto","Sam Bankman-Fried's FTX, the once-mighty cryptocurrency exchange that extended lifelines to distressed crypto-related firms, was unable to prevent its own Chapter 11 bankruptcy filing. Here's what happened, from beginning to end-ish: Monday The rapid meltdown of Bankman-Fried's crypto empire came about after crypto exchange rival Binance, an early investor in FTX, said it would offload the rest of its holdings in FTX token ( FTT-USD ), the coin issued by FTX. That was ""due to recent revelations"" likely referring to a CoinDesk story from the prior week that raised questions about the overlap between FTX and SBF's trading firm, Alameda Research. Alameda's balance sheet reportedly owned $5.8B of FTX token ( FTT-USD ) as of June 30, accounting for a huge portion of its $14.6B in total assets, thus highlighting the close ties between FTX and Alameda despite the fact that they're two separate entities. The troubling part was how much of FTT that Alameda owned compared with roughly 200M FTT coins in circulation worth $4.56B at the time. The price of FTX token ( FTT-USD ) slid some 30% to $16.47 on November 7 as market participants weighed Alameda's financial health as well as a simultaneous slump in FTX token ( FTT-USD ). In the initial uncovering of Alameda's finances, SBF shrugged off growing speculation about the solvency of FTX, saying its ""assets are fine"" and it ""has enough to cover all client holdings."" Tuesday FTX was said to have seen around $6B of customer withdrawals over the past three days, well above the typical average daily flows in the tens of millions of dollars range, as the exchange came under liquidity pressure as investors became more worried about its insolvency risk. Looking at on-chain data at the time, the exchange appeared to have suspended processing withdrawal requests from its clients (which later proved to be a more than 48-hour pause), as FTX struggled to fill the overwhelming amount of withdrawal requests in the wake of its liquidity crunch. In turn, FTT token ( FTT-USD ) dropped to just $3.59, and the liquidity crunch became that more serious. Binance appeared to come to the rescue by signing a non-binding deal to buy the non-U.S. portion of FTX, with both SBF and Binance chief Changpeng Zhao confirming the agreement via Twitter. Of course, the acquisition was not guaranteed. Wednesday Binance walked away from its initial offer to buy FTX.com due to reports about fund mishandling and regulatory issues at the exchange. The U.S. Securities and Exchange Commission and the Commodity Futures Trading Commission probed FTX on whether it appropriately handled client funds, as well as its financial relationship with FTX US, the American division of FTX, and FTX's sister company Alameda. ""In the beginning, our hope was to be able to support FTX’s customers to provide liquidity, but the issues are beyond our control or ability to help,"" Binance wrote in a Twitter post. While Binance's move to back out of its letter of intent to buy FTX.com was widely expected, cryptos like bitcoin ( BTC-USD ) and ethereum ( ETH-USD ) collapsed by double-digit percentages, underscoring the negative implications of FTX's collapse for the cryptoverse. Binance's retreat forced FTX to scramble for rescue financing. In fact, SBF reportedly told investors that his exchange would need to file for bankruptcy unless it could garner more capital to cover its $8B shortfall. The crypto ""industry is due for some soul-searching,” said Mikkel Morch, chairman at crypto hedge fund ARK36. But there's some positive developments underway following FTX's downfall, including Binance ""pushing for major exchanges to adopt proof of reserves as an industry standard. Some have already started publishing it. Newcomers to the space are discovering the importance of self-custody of their assets,” he added. Thursday: The final nail in the coffin The Wall Street Journal reported that FTX.com loaned out more than half of its customer funds to back risky wagers by Alameda, prompting the exchange's downfall. Specifically, FTX was said to have $16B in customer assets but lent $10B of those funds to Alameda. SBF took to Twitter and apologized for his mistakes, pledging to use ""every penny"" the liquidity-strapped exchange has to repay its users. He wrote that Alameda was ""winding down trading"" and ""one way or another, soon they won't be trading on FTX anymore."" He said that he should've been more transparent with communication, and he also misjudged users' margin given ""a poor internal labeling of bank-related accounts,"" which was once of the main reasons why Binance backed away from its proposed FTX deal. The 30-year-old claimed that FTX.com still has a chance to survive despite its ongoing liquidity crunch, noting ""there are a number of players who we are in talks with, LOIs, term sheets, etc.” Friday In the face of its multibillion-dollar shortfall and its inability to meet a colossal amount of customer withdrawals, SBF stepped down from his CEO role as FTX Group, comprised of FTX.com, FTX.US, Alameda Research and ~130 affiliated entities, have all filed for Chapter 11 bankruptcy proceedings in the U.S. That doesn't necessarily mean that FTX is going fully under, but instead the exchange, founded in 2019, can continue operating as it determines how to pay its creditors. While SBF made claims all week that FTX.US was not impacted by FTX.com's crisis, the former reportedly stopped processing withdrawals at about midday New York time on Friday. What's at stake for the crypto space? The knock-on effects for the broader crypto ecosystem has only started to take hold. Troubled crypto lender BlockFi, for instance, paused client withdrawals due to the ""lack of clarity"" on the status of SBF's crumbling empire. And Bloomberg reported that SoftBank Group ( OTCPK:SFTBY ) ( OTCPK:SFTBF ) ( OTCPK:SOBKY ) had invested nearly $100M in FTX.com but expects to write off the full value of its stake. This week's events certainly weren't the first major blow to the crypto space. In May, the Terra ecosystem failed, and crypto lender Celsius and crypto hedge fund Three Arrows Capital filed for bankruptcy protection, resulting in depressed token prices, industry-wide pain and regulatory scrutiny. Some industry experts suggested the FTX drama will only add to those developments. ARK36 CEO and Executive Director Anto Paroian noted that given FTX's ""diverse ties"" to the crypto industry, ""it will take weeks before we see the full extent of the damage done."" Previously, (Nov. 11) Binance CEO warned that FTX-driven crypto market woes echo 2008 GFC .",NEGATIVE,FTT,EXCHANGE | ICO | TRADING | BNB | FTT,,0,0,Seeking Alpha,https://seekingalpha.com/news/3906642-heres-what-happened-in-the-week-long-ftx-fiasco-and-what-it-means-for-crypto?utm_source=cryptocompare.com&utm_medium=referral,https://resources.cryptocompare.com/news/50/4178029.jpeg
4204201,https://coinpedia.org/?p=164170,1668355825,"A Glance Over The Charts – Snowfall (SNW), Toncoin, Dogecoin","The post A Glance Over The Charts – Snowfall (SNW), Toncoin, Dogecoin appeared first on Coinpedia Fintech News Everyone is probably aware that the market is narrative-driven. To speak of the bitcoin ecosystem, it may depend more on trends and the stories surrounding them. Regular customers have little to no influence over the values and rates of bitcoin coins. This article will examine three coins that are now popular and supported in the …",NEUTRAL,없음,BTC | DOGE | MARKET,,0,0,coinpedia,https://coinpedia.org/press-release/a-glance-over-the-charts-snowfall-snw-toncoin-dogecoin/,https://images.cryptocompare.com/news/default/coinpedia.png
4177088,https://cryptobriefing.com/?p=122765,1668355598,The FTX Saga: Lessons We Knew but Didn’t Learn,"After Do Kwon, Three Arrows Capital, and Alex Mashinsky set the standard for outrageous misbehavior in the crypto space this year, Sam Bankman-Frieds spectacular fall from grace has recalled one...",NEGATIVE,없음,OTHER,,0,0,Crypto Briefing,https://cryptobriefing.com/ftx-lessons-we-knew-but-didnt-learn/?utm_source=feed&#038;utm_medium=rss,https://resources.cryptocompare.com/news/34/4177088.jpeg
4177048,https://cryptopotato.com/?p=224089,1668355508,Vitalik Buterin Shares Thoughts About Sam Bankman-Fried Following FTX Fallout,Vitalik Buterin has shared some thoughts on SBF and the way the community has reacted to the whole fiasco so far.,NEUTRAL,없음,ETH,,0,0,Crypto Potato,https://cryptopotato.com/vitalik-buterin-shares-thoughts-about-sam-bankman-fried-following-ftx-fallout/,https://resources.cryptocompare.com/news/27/4177048.jpeg
4176776,https://www.cryptopolitan.com/?p=237547,1668355015,Binance’s CZ makes bold promise; is he reiterating his title as the crypto lord?,"The past couple of days in the cryptocurrency industry have been filled with plenty of setbacks. It’s been all glum since the world’s second-largest cryptocurrency exchange, FTX, became insolvent. FTX is widely considered to be Binance’s primary opponent seeing as they used to be the top two exchanges. Before the full-blown meltdown of the exchange, … Binance’s CZ makes bold promise; is he reiterating his title as the crypto lord? Read More »",NEUTRAL,없음,EXCHANGE | BNB,,0,0,Cryptopolitan,https://www.cryptopolitan.com/crypto-lord-cz-makes-bold-promise/,https://resources.cryptocompare.com/news/43/4176776.jpeg
4176777,https://zycrypto.com/?p=75427,1668354981,"Even As Whales Offload ADA, Cardano Could See Huge Price Boost If This Happens","Cardano (ADA), like the rest of the crypto market, has traded with massive volatility in 2022. However, a Santiment analyst has noted several indicators to look out for in the market...",NEUTRAL,ADA,ADA | MARKET | TRADING,,0,0,ZyCrypto,https://zycrypto.com/even-as-whales-offload-ada-cardano-could-see-huge-price-boost-if-this-happens/,https://images.cryptocompare.com/news/default/zycrypto.png
4176843,https://decrypt.co/?p=114312,1668354896,Bahamas Police Are Investigating Potential 'Criminal Misconduct' by FTX,"The Royal Bahamas Police Force is ""working closely with the Bahamas Securities Commission to investigate if any criminal misconduct occurred.""",NEGATIVE,없음,BUSINESS,,0,0,Decrypt,https://decrypt.co/114312/bahamas-police-are-investigating-potential-criminal-misconduct-by-ftx,https://resources.cryptocompare.com/news/44/4176843.jpeg
4176455,https://cryptopotato.com/?p=224109,1668354425,Was This Capitulation or More Pain Ahead for BTC Following the FTX Bankruptcy? (Bitcoin Price Analysis),"Market participants are going through a period of fear and uncertainty as the FTX exchange has recently announced bankruptcy after facing a massive liquidity crunch. As a result, Bitcoin plunged and marked a new low at $15.5K. Technical Analysis By Shayan The Daily Chart The $18K level had been supporting the price for several months.",NEGATIVE,BTC,BTC | EXCHANGE | MARKET | TRADING,,0,0,Crypto Potato,https://cryptopotato.com/was-this-capitulation-or-more-pain-ahead-for-btc-following-the-ftx-bankruptcy-bitcoin-price-analysis/,https://resources.cryptocompare.com/news/27/4176455.jpeg
