뉴스ID,뉴스GUID,일자(UTC timestamp),뉴스제목,본문,SENTIMENT,주요코인,카테고리,작성자,추천수,비추천수,출처,뉴스URL,이미지URL
42397351,DbF8Q09kuKX2XWBxAaq27s,1391707798,Butterfly Labs Faces $5 Million Lawsuit Over Unfulfilled Order,"Butterfly Labs  is facing a lawsuit for over $5 million that alleges that it was negligent in its business dealings, and even accuses the company of downright fraud.  The suit was brought by Martin Meissner, who placed a $62,000 order for BFL miners back in March 2013. Meissner claims he did not received the units or a refund for his payment, according to a report in Ars Technica.  The suit was filed in December, and it accuses Butterfly Labs of fraud, negligent representation and breach of contract.  Motion to dismiss  Butterfly Labs and its attorneys refused to comment on the matter, but Meissner’s attorney, Robert Flynn, was keen to share his views, saying to Ars Technica that he has been contracted by multiple people with similar complaints, but this is the first one to result in a lawsuit.  Although Butterfly Labs isn’t talking, it is making some legal moves. Earlier this week, the company filed a motion to dismiss Meissner’s claims, arguing that it does not state a claim that can be compensated.  The plaintiff “is not entitled to consequential damages as a matter of law because they are too speculative,” the company said.  Delays and disputes  On March 25, 2013, Meissner ordered two 1,500 GH/s bitcoin miners (product code MRG015T) and transferred $62,598 to Butterfly Labs. The contract stated that initial shipments were expected in April, but, since products are shipped according to the order queue, Meissner would get them “two months or more after order.”  Things quickly went downhill from there. In May, Butterfly Labs told Meissner that they received his payment, but they were unable to match it to any order until they got an email from him. Butterfly Labs invoiced him the same day. However, Meissner’s miners were not shipped. Instead Butterfly Labs offered to ship him six 500GH/s miners but it is unclear whether Meissner accepted or refused the offer.  This is where it gets a bit blurry, but, in any case, Meissner did not receive the 500 GH/s miners, either.  In mid-October, Meissner’s lawyer sent the company a letter, saying that any shipment at such a late date would be refused. Butterfly Labs refused his request for a refund, saying that all sales are final. However, Meissner argues that no sale was ever made, since he never got the product.  ‘Speculative claim’  The most obvious question is why Butterfly Labs allowed the dispute to escalate and get them in the news. After all, it could have refunded Meissner and sold the miners to someone else, when they become available.  There is a bit of a problem, though. Meissner is not just asking for his $62,000 back – he also wants compensation for lost revenue. The complaint states that Meissner missed out on an opportunity to mine between $5- and $7.5-million worth of bitcoins.  The complaint states  :  “Plaintiff Martin Meissner prays for judgment in his favor, and against Defendant BF Labs Inc., on all claims; that the Court award him the full extent of his damages, including direct damages of $62,632.19 and consequential damages in excess of $5,000,000.00; for costs and attorneys’ fees; and for all such other relief as the Court deems just and equitable.”  This is probably why Butterfly Labs insists his damage claims are “speculative” and dismisses them outright.  Call in the jury  Butterfly Labs blames Meissner for the mess, insisting that his order was not finalised. Although it received the payment in March, it could not tie it to any existing order, as it did not include an order number. The company then waited for Meissner to get in touch, which he did in May.  A Butterfly Labs document sheds more light on the matter: “In the case of the product generation (65nm) that the Plaintiff pre-ordered, BF Labs experienced technical delays in its development that held up manufacturing the new technology at commercial scale”. It continues:  “When BF Labs had resolved the issues and was ready to commit the orders to the final stages of manufacture, an email notice was sent to customers advising that orders would be shipped as produced and that if anyone was unwilling to endure the wait, they had a final opportunity to cancel their order and receive a full refund.”  In addition, the company points out that it increased its prices in April 2013, following a rise in the price of bitcoin. Since Meissner’s order was not finalized, Butterfly Labs assumed it was abandoned when he did not reply to the email notice.  This is not the first legal dispute involving a mining hardware company and it probably won’t be the last. There are always risks involved with pre-ordering untested and unproven silicon, regardless of legal fine print. In this particular case, it may be that both parties share at least part of the blame, but that’s ultimately for a jury to decide.",NEGATIVE,없음,BTC | BUSINESS | MINING | REGULATION | TRADING,Nermin Hajdarbegovic,0,0,CoinDesk,https://coindesk.com/tech/2014/02/06/butterfly-labs-faces-5-million-lawsuit-over-unfulfilled-order,https://cdn.sanity.io/images/s3y3vcno/production/f4df61194c5fea15fbcce2365003d5c40f9d28a2-1010x768.jpg?w=300&h=300&fit=crop
42397363,DbF8Q09kuKX2XWBxAaq2Kf,1391697974,57% of Young Americans Believe Bitcoin Boosts Global Economy,"The majority of young consumers in the US believe that bitcoin 'helps the global economy', a new survey commissioned by The Street has revealed.  57% of the 18- to 25-year-olds that took part in the nationwide GfK survey believe bitcoin benefits the global economy, while 33% believe it helps the US dollar.  It seems younger consumers are more comfortable with bitcoin than their parents or grandparents. This is not surprising, as previous surveys have indicated that younger generations are more open to digital currencies like bitcoin and litecoin.  What is surprising is the fact that the 50- to 65-year-olds that took part showed the greatest familiarity with bitcoin, at 30%.  Of the 18-24 year-olds quizzed, 32% said they would consider using alternative currencies, versus just 11% of those over the age of 65. In addition, 15% of the younger age bracket would rather own bitcoins than gold, versus 14% of those over 65.  However, the vast majority of consumers in the US haven’t heard of bitcoin and wouldn’t use it, either.  The nationwide survey found that American consumers are not only unfamiliar with bitcoin, they are uncomfortable with the idea of holding and using it.  Of those surveyed, 76% said they are not familiar with bitcoin, while 79% said they have never and would never consider using alternative currencies.  ""If the survey says that 24% of Americans have heard about bitcoin then I’m pleased. I would honestly rather that the other 76% weren’t yet on board as it’s still not ready for prime-time,"" said Paul Gordon, organiser of London's CoinScrum bitcoin meetups.  Interestingly, 38% believe bitcoin “hurts” the US dollar, while 80% said they would rather own gold than bitcoins.  Across income brackets  ""While bitcoin has attracted the attention of influential hedge fund managers and the research desks of major US banks, an overwhelming majority of Americans remain unaware of cryptocurrency,"" said Joe Deaux, The Street's Economics Analyst, adding:  ""Bitcoin's supporters would argue that the virtual currency remains in its infancy and that a year ago most of Wall Street hadn't heard of it, but The Street's survey shows that there isn't great deviation across income brackets as to how many people know about bitcoin, own bitcoin and prefer it to owning gold.""  In contrast, Gordon said he's currently excited by the pace at which bitcoin foundations are being developed across the world, so that wider adoption can occur in a ""more secure and user-friendly environment"".  ""Our CoinScrum networking and learning group in London, which is now the largest of its kind in the world with over 1,250 members, has seen a 100-fold increase in membership in the last year alone and we attracted 250 people to our most recent event,"" he added.  A recent survey by Bloomberg found that 42% of Americans were able to correctly identify bitcoin as a digital currency. However, 6% of participants mistook it for an iPhone app and another 6% believed it was an Xbox game.  Tech in Motion recently carried out a survey among tech professionals and found that 51% would like to be paid in bitcoin, while 18% said they would wait and see what happens to the currency over the next couple of years.  ""I remain convinced that bitcoin, along with the various technologies it has already spawned, is on the right trajectory,"" concluded Gordon.  Analysis Image via Shutterstock",NEUTRAL,없음,BTC | FIAT | RESEARCH,Nermin Hajdarbegovic,0,0,CoinDesk,https://coindesk.com/markets/2014/02/06/57-of-young-americans-believe-bitcoin-boosts-global-economy,https://cdn.sanity.io/images/s3y3vcno/production/e50816a15a290f6f553f18aab0cf706d775a8352-1000x830.jpg?w=300&h=300&fit=crop
42397364,DbF8Q09kuKX2XWBxAaq2Md,1391694304,Leading Anti-Malware Firm Malwarebytes Starts Accepting Bitcoin,"Leading anti-malware software provider Malwarebytes has announced its decision to accept bitcoin payments.  The company  has been fascinated with bitcoin ever since its inception, and has followed the currency's evolution closely.  “As a leader in security, we are excited to accept a crypto currency that provides a level of anonymity to our security-conscious customers,” said Marcin Kleczynski, CEO of Malwarebytes.  “Protecting customer privacy is part of our DNA, and taking payment in bitcoins is a logical extension of that ethos. We think the story behind Bitcoin is an exciting one as well, and we’re thrilled to support the bitcoin community. Malwarebytes is a forward-leaning company, and this is a natural fit.”  Malwarebytes has been an advocate of online privacy rights for years, and has integrated powerful anti-spyware detection in its software suites.  This approach seems to be paying off, as the company is one of the most popular anti-malware solutions on the market. Hence, its decision to accept bitcoin payments can be viewed as an extension of its rigorous privacy policies.  Going live  Malwarebytes teamed up with Coinbase to process the transactions for the service, which is already live on the Malwarebytes website.  However, for the time being, the offer is limited to the Malwarebytes Anti-Malware Pro suite (priced at $24.95 worth of BTC). Future products that can be purchased with the cryptocurrency will have a bitcoin logo displayed on the page.  Although privacy and bitcoin go hand in hand, the same is true of malware, to a certain extent. Many malware makers are 'using' bitcoin, too.  The currency's relative anonymity allows them to cash out easily before they get caught, to transfer funds or pay fellow malware makers for various services rendered in the darker corners of the Internet.  Bitcoin-mining malware  Some malware makers have even devised bitcoin-mining malware that relies on huge botnets to mine coins, but so far these attempts have had very limited success.  Yahoo was recently involved in a security breach that could have exposed up to two million European computers with mining malware. However, in reality the number of devices infected appears to be much lower.  Similarly, in late 2013, Microsoft moved to dismantle the Sefnit botnet which hijacked vulnerable versions of the Tor browser.  Virus Image via Shutterstock",POSITIVE,BTC,BTC | EXCHANGE | MARKET | MINING | TECHNOLOGY,Nermin Hajdarbegovic,0,0,CoinDesk,https://coindesk.com/markets/2014/02/06/leading-anti-malware-firm-malwarebytes-starts-accepting-bitcoin,https://cdn.sanity.io/images/s3y3vcno/production/cb39a061080fbfcaddad36b459b44cf5c7551f40-1000x750.jpg?w=300&h=300&fit=crop
42397356,DbF8Q09kuKX2XWBxAaq2Dm,1391689979,"Indonesia Central Bank Takes New, More Neutral Stance on Bitcoin","Indonesia's central bank, Bank Indonesia, has issued a new statement defining its stance on bitcoin.  The comments bear similarities to others released over the past few months, but suggest the government will now take a hands-off approach to digital currency. Today's statement differs slightly from the reports issued last month, in which Bank Indonesia's deputy Governor suggested digital currency might break the bank's rules.  Since then, representatives from the local bitcoin business community have participated in informal discussions with regulators to clarify the boundaries of their operating environment. The latest statement reads (translated from Indonesian):    ""Noting the Law no. 7 of 2011 on Currency and the Law no. 23 of 1999 which was amended several times, most recently by Act no. 6 In 2009, Bank Indonesia states that the virtual currency bitcoin and others do not constitute currency or legal tender in Indonesia.      People are encouraged to be careful of bitcoin and other virtual currencies. All risks related to ownership/use of bitcoin will be borne by the owner/user of the virtual currency bitcoin and others.""    Bitcoin businesses  Local bitcoin entrepreneur Oscar Darmawan was optimistic about the statement, saying bitcoin users can now move foward with plans to promote its use in the world's fourth-largest country by population.  ""We are really glad for that stance. It seems Indonesia Central Bank's final stance will be in neutral position and will not prohibit bitcoin in Indonesia. Indonesia will regulate bitcoin as an e-commodity instead of e-currency.""  He added: ""Indonesia will have bright future for bitcoin to grow as 'media transfer' for payments, instead of for e-currency – as it should be. The stance will also means bitcoin will be regulated in the same way as Singapore did. Really thank you to our government.""  Darmawan, who also heads Indonesia's largest bitcoin exchange Bitcoin.co.id and was a key participant in the discussions, said he also plans to introduce the country's first bitcoin ATM soon and hopes the government's clarification would make bitcoin investors more comfortable about reaching out to local startups.  Despite a population of over 240 million and membership in the G20 group of world's major economies, Indonesia's bitcoin scene is relatively small.  A clear hands-off approach could see it grow soon, reaching out first to a young and technology-friendly public in large cities like Jakarta, and then possibly to millions of unbanked and under-banked people in regional locales.  Jakarta, Indonesia Image via Shutterstock",POSITIVE,없음,ASIA | BTC | BUSINESS | FIAT | REGULATION,Jon Southurst,0,0,CoinDesk,https://coindesk.com/markets/2014/02/06/indonesia-central-bank-takes-new-more-neutral-stance-on-bitcoin,https://cdn.sanity.io/images/s3y3vcno/production/560eed475c6b4e5495a3a7686005e43fb1e2cc7a-1000x743.jpg?w=300&h=300&fit=crop
42425410,sd6iOBkuiC3F0LYOyHwTth,1391686829,"You Can Now Pay Cash For Bitcoin at 28,000 UK Stores","Bitcoiners can now pay cash for bitcoins at 28,000 shops across the UK, thanks to a new service set up by ZipZap.  The service enables people to head to their nearest ZipZap payment location, hand over cash and see bitcoins deposited in their wallets almost instantly.  Currently available via Bittylicious, BuyBitcoin.sg and BIPS Market, the service will go live with ANXBTC and ANXPRO next week, followed by Kraken, CoinMKT and BTCX.se.  Customers simply have to log into their accounts with one of these companies and select the cash payment option, they then choose the amount of bitcoins they want to purchase and head to their local ZipZap payment location to complete the transaction.  Thousands of independent local shops are registered as ZipZap locations, as are Spar, Asda, Tesco Express branches and many other stores across the country.  The minimum a user can choose to spend is £10 and the maximum per transaction is £300, but up to four transactions can be completed per customer, per day.  Lasse Birk Olesen, founder and CEO of BuyBitcoin.sg, said: ""We are very excited to present the easiest and fastest way to buy bitcoins in United Kingdom! This is a key piece of infrastructure that allows bitcoin to grow further in the UK.""  He went on to say that, after a customer pays in cash, their bitcoins are delivered ""within minutes"", adding:  ""No more waiting for days for bank transfers – this is as fast as it gets and makes bitcoin more attractive.""  Marc Warne, CEO of Bittylicious, is equally excited by the new service he is able to offer his customers.  ""This is a really neat way for people in the UK to get their hands on bitcoins,"" he said.  Testing the service  I tested out the service using Bittylicious. I have to admit, I was a bit sceptical at first – why would I bother going through the effort of visiting a shop to buy bitcoins when I could do it all online? However, I found the whole process incredibly simple, and I can see why some people would prefer it and would enjoy the novelty of handing over physical cash for digital currency.  While Bittylicious currently enables unregistered users to buy small amounts of bitcoins via bank transfer and Barclays Pingit, it doesn't allow them to use the cash payment service. This means you have to register with the company and submit identity documents (to comply with anti-money-laundering and know-your-customer rules).  Warne told me ID verification on Bittylicious currently takes 12 hours, on average, but the company is working on reducing this over the course of the next few days.  I'm already registered and verified with Bittylicious, so I just logged in, then the home page displayed the ""Cash Payment"" option.  After entering my bitcoin wallet address and selecting the amount in BTC or GBP I wanted to purchase, I was told I had 30 minutes to choose my payment location and confirm the trade.  I entered my postcode to find my nearest ZipZap payment location and found there were 13 shops for me to choose from within a radius of around 0.6 miles (bear in mind the CoinDesk office is in central London).  After selecting my most convenient shop, I hit the ""I am ready to pay"" button and was provided with a PDF document to print. This features all the order details, the address and a map of my chosen payment centre, plus the barcode required by the shopkeeper.  Bittylicious gives you a leisurely two hours to complete the payment and the PDF payment slip details the time by which the transaction must be finalised.  Once in the shop, I handed over the payment slip to the newsagent, he scanned the barcode, I handed over the cash, he printed a receipt and that was that. (You don't actually have to print the payment slip – you can just bring the barcode up on your smartphone and have the shopkeeper scan it straight from there.)  Precisely eight minutes later, the BTC arrived in my bitcoin wallet.  The verdict  Being able to pay cash over the counter for bitcoin was pretty cool – experiencing the ultimate transition from old money to new money. But aside from that, I'm not entirely sure what the major benefits are for someone like me, who has a bank account and can use a fast bank transfer to receive their bitcoins quickly and easily, without having to venture into the great outdoors.  It's also worth bearing in mind you pay a premium to use this service. At the time of writing, the exchange rate displayed on Bittylicious for cash payments was £537.80 per bitcoin, which is quite a bit higher than the £520 per bitcoin if paying via bank transfer, and greater still than the £517.18 displayed on the CoinDesk Bitcoin Price Index at the time.  Some say they are attracted to the service as it allows consumers to remain anonymous, because their bank accounts aren't involved. However, given that the service can't be used without first registering with one of the bitcoin companies listed above, customers don't actually remain completely anonymous.  Warne said that, regardless, the service will appeal to those who want to buy bitcoins without involving their bank in any way.  He said: ""It's not really about getting bitcoins anonymously. It's more about getting them without needing to rely on any other institutions.""  He added:  ""Some people don't have bank accounts, have unsuitable bank accounts or simply don't want to associate their bank account with bitcoins, so this is perfect for them.""  According to research by Social Finance, more than 1.5 million adults in the UK are unbanked (do not have access to a transactional bank account), so I can see that there is a sector of society that would find this service extremely useful.  If/when it becomes available in countries where the majority of the population is unbanked, I can see the service really starting to take off.  Upcoming developments  Currently the barcodes featured on the payment slips are single use only, however, ZipZap is working on creating a system that will produce a reusable barcode. This will enable customers to 'top up' their bitcoin wallet with funds without having to go online each time to confirm their payment.  ""A lot of people are put off investing in or purchasing bitcoin as they see the process as too complicated. ZipZap aims to change this, making it easier and faster for people to swap their money for bitcoins,"" said Eric Benz, VP of business development at ZipZap.  He went on to say his company aims to roll out the cash-for-bitcoins service globally, though ZipZap wouldn’t confirm which territories will be next, or when.  The company is also looking to expand its service so that people can exchange their funds the other way around, swapping their bitcoins for cash over the counter.  As for developments set to take place specifically here in the UK, Warne (of Bittylicious) hinted that the service could soon also be available for altcoins, such as litecoin and peercoin.  ""Although not available yet, there's no reason why the altcoins on Bittylicious shouldn't be available for cash too in the near future,"" he explained.  What do you make of the cash-for-bitcoins service? Would you use it? Let us know in the comments.  Cash image via Flickr.",POSITIVE,BTC,ALTCOIN | BTC | EXCHANGE | FIAT | MARKET,Emily Spaven,0,0,CoinDesk,https://coindesk.com/markets/2014/02/06/you-can-now-pay-cash-for-bitcoin-at-28000-uk-stores,https://cdn.sanity.io/images/s3y3vcno/production/2aecf36c929965b678a774895222c15ec403167a-1024x680.jpg?w=300&h=300&fit=crop
