뉴스ID,뉴스GUID,일자(UTC timestamp),뉴스제목,본문,SENTIMENT,주요코인,카테고리,작성자,추천수,비추천수,출처,뉴스URL,이미지URL
42401506,DbF8Q09kuKX2XWBxAczuGf,1525890416,"This Blockchain Tosses Blocks: Naval, MetaStable Back Twist on Crypto 'Cash'","A blockchain without the blocks?  Not exactly, but a company launching Wednesday called O(1) is seeking to take the unorthodox approach of throwing out the blocks its new Coda protocol produces as soon as they elapse. While that might seem illogical since blockchain's immutable history is to many its principal benefit, an impressive line-up of investors believes the idea could be just what cryptocurrency needs.  Led by Metastable, AngelList co-founder Naval Ravikant, and Twitter and Google alum Elad Gil, O(1) has secured a $3.5 million seed equity round, with investment from Coinbase alums Fred Ehrsam and Linda Xie and Polychain Capital joining to complete the fundraise.  ""What attracted me was a small, scalable blockchain that’s still independently verifiable on small nodes,"" Ravikant told CoinDesk.  And that's no small feat given the growing costs of storing major blockchains, which are designed largely to keep a record of every transaction ever made over the network. Still, that transaction history is also a strength since that's what allows miners and users to check the accuracy of transactions.  But if there's no requirement to hold the ledger, why would anyone trust the Coda Protocol to be accurate?  Because it uses something called ""snarks"" in a clever way. If you've been around crypto, you've likely heard the term zk-snarks, most widely known as a privacy technology advanced by zcash, but which has recently gained momentum with other blockchain projects including ethereum and even JPMorgan's private blockchain Quorom.  Yet, O(1) isn't so much concerned about the privacy aspects of the technology (it's not a privacy coin, because a validator could hold onto the ledger if they really wanted to) but believes it can be adapted to build a blockchain that doesn't have the scalability hurdles of blockchain's today.  ""It's a cryptocurrency that's decentralized at scale,"" O(1)'s co-founder and CTO Izaak Meckler explained.  He told CoinDesk:  ""I think what we're building is really decentralized peer-to-peer cash. So, basically people who are enthusiastic about that idea would be enthusiastic about our protocol.""  O(1)'s protocol will support a native cryptocurrency called Coda coins using an uncapped networked of proof-of-stake validators, but distribution plans and the size of the cryptocurrency pool have yet to be determined.  All O(1) would commit to was launching the testnet in the third quarter of this year.  Snarks for scale  There should be lots of people excited about the concept, but probably many wondering how exactly it works.  Simply, a snarks cryptographic proof – one that can demonstrate that every wallet on the blockchain has the crypto that it should – stands in for the full ledger. The ledger then does not need to be stored forever; the proof stands in for the transaction history and explains the blockchain's state.  Each new block will generate a new proof, which reflects the validity of past proofs that will be transmitted to every wallet. Because the proof will be only a few hundred bytes, vastly smaller than the gigabytes a bitcoin node needs to download to participate in that protocol's verification, O(1) contends even smartphones will be able to run verification on the snarks proof.  ""There's this tension between scaling and decentralization because the burden of decentralization increases as the network grows,"" Meckler said.  But the Coda Protocol has been designed so that every new proof stays the same size.  ""In our, case it's really succinctness that's important. These things are a few hundred bytes, like a few tweets, and they can be checked quickly,"" Meckler said. ""So the chain itself never grows.""  According to Meckler:  ""It's like a picture of a picture of a picture.""  Making it understandable  This is what makes the Coda Protocol so technically compelling but also psychologically daunting.  Knowing that the bitcoin blockchain has a line item for every transaction ever made is something many can grasp intuitively. O(1)'s use of snarks proofs blurs that process a bit and could be challenging for many to really wrap their head around, or more importantly trust.  Meckler acknowledges this, saying, ""Something is not truly a proof unless it's legible to you. A core design constraint for us is: Let's make this something that's something easy to read.""  To that end, O(1) wrote a programming language called Snarky for writing verifiable computations.  And while that may still be over the average user's head, the O(1) detailed a hypothetical applicationhttps://o1labs.org/blog/posts/snarky.html on their blog.  The example outlines how votes would be hashed and counted when a group was trying to decide what pizza toppings to order. While silly, the example displays how each vote is hashed separately and then hashed together so that all users can tell their vote was counted, but can't view any other user's vote.  Speaking to the trustworthiness of snarks, Ravikant said, ""So far so good although the only real solution here is more time and more scrutiny.""  Yet, the O(1) team itself seems is optimistic its design will drastically change the blockchain space, saying in a statement:  ""By compressing the blockchain down to the size of a couple tweets, Coda makes entirely new things possible.""  Colorful blocks image via Shutterstock",POSITIVE,없음,BLOCKCHAIN | BTC | BUSINESS | TECHNOLOGY | WALLET,Brady Dale,0,0,CoinDesk,https://coindesk.com/markets/2018/05/09/this-blockchain-tosses-blocks-naval-metastable-back-twist-on-crypto-cash,https://cdn.sanity.io/images/s3y3vcno/production/22bc5b0b3ff408bef594c9c59a335567106d8457-1500x1000.jpg?w=300&h=300&fit=crop
42401520,DbF8Q09kuKX2XWBxAczuWP,1525889709,Bloomberg Partners with Novogratz to Launch Crypto Index,"Bloomberg has launched a cryptocurrency index in conjunction with Galaxy Digital Capital Management, a digital assets merchant bank headed by billionaire ex-hedge fund manager Michael Novogratz.  The capitalization-weighted Bloomberg Galaxy Crypto Index (BGCI) will track the ""performance of the largest, most liquid portion of the cryptocurrency market,"" specifically following bitcoin, ethereum, ethereum classic, monero, XRP, zcash, EOS, litecoin and dash, according to an announcement.  The companies said in a statement that the index utilizes a ""rules-based methodology and data"" derived from sources that both companies have scrutinized, though they did not reveal further details.  ""The herd is on the move,"" Novogratz said of the partnership on Twitter. ""This is an important piece of the architecture that institutional accounts need to treat crypto as a new asset class.""  Bloomberg operates several other indices pertaining to traditional finance, including indices for fixed income index, strategy, commodities and leading global fiat currencies.  ""The index brings our rigorous approach to index construction to cryptos and will provide investors with a transparent benchmark to gauge the performance of the broader market,"" Alan Campbell, Bloomberg Indices' global product manager said in the statement.  Bloomberg logo image via Sharaf Maksumov / Shutterstock",POSITIVE,없음,BTC | BUSINESS | ETC | FIAT | MARKET,Annaliese Milano,0,0,CoinDesk,https://coindesk.com/markets/2018/05/09/bloomberg-partners-with-novogratz-to-launch-crypto-index,https://cdn.sanity.io/images/s3y3vcno/production/22b4b82e594d0866b2a89bfde8a696a6d2e39140-1500x1000.jpg?w=300&h=300&fit=crop
13474999,https://www.trustnodes.com/?p=12719,1525889005,"Ethereum More Popular Than Bill Gates, Warren Buffett, JP Morgan or NYSE, Bitcoin More Popular Than Elon Musk, Lambos, Stocks or NYT","People are a lot more interested in ethereum than Microsoft&apos;s former CEO and once the richest man, Bill Gates, or the so called saga, Warren Buffet, according to google trends....The post Ethereum More Popular Than Bill Gates, Warren Buffett, JP Morgan or NYSE, Bitcoin More Popular Than Elon Musk, Lambos, Stocks or NYT appeared first on Trustnodes.",POSITIVE,없음,BTC | ETH,,0,0,TrustNodes,https://www.trustnodes.com/2018/05/09/ethereum-popular-bill-gates-warren-buffett-jp-morgan-nyse-bitcoin-popular-elon-musk-lambos-stocks-nyt,https://images.cryptocompare.com/news/trustnodes/cw0042300w0.png
13249449,https://themerkle.com/?p=56622,1525888827,New York Stock Exchange’s Parent Company Is Building a Bitcoin Exchange,"Financial entities have shown an increased interest in blockchain technology and cryptocurrency. It now appears there are multiple efforts underway which have been kept in the dark for some time. The owner of the New York Stock Exchange, for example, has been working on a Bitcoin exchange. That is a pretty interesting development which could impact the cryptocurrency industry in a positive manner. ICE Wants a Bitcoin Exchange? It is always interesting to see how financial firms look at Bitcoin and other cryptocurrencies. Over the past few years, it has become evident that there is a lot of bias toward this new",POSITIVE,없음,BLOCKCHAIN | BTC | BUSINESS | EXCHANGE | TECHNOLOGY,,0,0,NullTx,https://themerkle.com/new-york-stock-exchanges-parent-company-is-building-a-bitcoin-exchange/,https://images.cryptocompare.com/news/themerkle/80000000000.jpeg
13454267,http://bitcoinist.com/?p=67993,1525888807,SportyCo Welcomes Luís Figo and Prepares to Host the World Sports BIockchain Summit,"SportyCo has achieved so much this year already, and we&apos;re not even half-way through! From their exciting rebrand to their successful beta release, the only way seems to be up for this innovative decentralized sports investment platform. SportyCo is pushing for financial equality and inclusivity in the $1.3 trillion-dollar sports industry. This goes for both professional athletes who need that financial push to realize their sporting dreams, as well as smaller investors who are lookingRead MoreThe post SportyCo Welcomes Luís Figo and Prepares to Host the World Sports BIockchain Summit appeared first on Bitcoinist.com.",POSITIVE,없음,BUSINESS,,0,0,Bitcoinist,https://bitcoinist.com/sportyco-welcomes-luis-figo-prepares-host-world-sports-biockchain-summit/,https://images.cryptocompare.com/news/bitcoinist/8GoBaJRs2D3.jpeg
13365794,https://cointelegraph.com/news/bloomberg-partners-novogratzs-galaxy-digital-capital-to-release-crypto-benchmark-index,1525888170,Bloomberg Partners Novogratz’s Galaxy Digital Capital To Release Crypto Benchmark Index,Bloomberg announced the launch of a crypto benchmark index with Mike Novogratz&apos;s crypto merchant bank,POSITIVE,없음,BTC | FIAT | MARKET,,0,0,CoinTelegraph,https://cointelegraph.com/news/bloomberg-partners-novogratzs-galaxy-digital-capital-to-release-crypto-benchmark-index,https://images.cryptocompare.com/news/cointelegraph/cEwA0000000.jpeg
13439041,https://news.bitcoin.com/?p=158295,1525887325,"New HOB Podcast: Ver’s Sci-Fi Novel Life, Voorhees Buys Tucker’s Tie for $72k","Humans of Bitcoin (HOB) is off to a rousing start in its second season on the Bitcoin.com Podcast Network, diving deeply into Bitcoin pioneers over two installments. The current episode features crypto evangelist Jeffrey Tucker, Editorial Director at the American Institute for Economic Research, in a fast-moving interview exploring his intellectual development and discovery of ...The post New HOB Podcast: Ver&apos;s Sci-Fi Novel Life, Voorhees Buys Tucker&apos;s Tie for $72k appeared first on Bitcoin News.",NEUTRAL,없음,BTC | RESEARCH,,0,0,Bitcoin.com,https://news.bitcoin.com/new-hob-podcast-vers-sci-fi-novel-life-voorhees-buys-tuckers-tie-for-72k/,https://images.cryptocompare.com/news/bitcoin.com/d1qL$14N0NI.jpeg
13238350,https://www.newsbtc.com/?p=331472,1525887310,DEEP AERO: An AI Blockchain Solution for The Drone Industry,"According to a new research report by Global Market Insights, the commercial Drone/UAV Market is expected to reach USD 17 billion by 2024. This is quite impressive when you consider that in 2016, the commercial drone/UAV market saw 100,000 units sold, worth $2 billion. While this growth is impressive, it will not come without challenges....The post DEEP AERO: An AI Blockchain Solution for The Drone Industry appeared first on NewsBTC.",POSITIVE,없음,BLOCKCHAIN | MARKET | SPONSORED | RESEARCH,,0,0,NewsBTC,https://www.newsbtc.com/2018/05/09/deep-aero-ai-blockchain-solution-drone-industry/,https://images.cryptocompare.com/news/newsbtc/dhF00g04g52.jpeg
13249450,https://themerkle.com/?p=56712,1525887038,Decentralized ID Verification Platform VeriMe Teams Up With Vietnamese Bank,"Blockchain was originally seen as an alternative to traditional banking, where the system offered smoother and quicker service experience. This led to natural hostility towards the technology by the financial institutions from around the world. Today, however, there are banks that understand the power of blockchain and that the future lies not in aversion, but integration of the technology in their systems. Disclosure: This is a Sponsored Article VeriME And Maritime Bank VeriMe is a Singaporean blockchain based verification-as-a-service platform that facilitates other organizations in easy and fast user authentication. The platform relies on the secure, high speed working of",POSITIVE,없음,BLOCKCHAIN | FIAT | SPONSORED | TECHNOLOGY,,0,0,NullTx,https://themerkle.com/decentralized-id-verification-platform-verime-teams-up-with-vietnamese-bank/,https://images.cryptocompare.com/news/themerkle/cu3a1x4y010.png
13439042,https://news.bitcoin.com/?p=158254,1525887003,PR: SPINDLE to Launch Crowdsale – One Week Only (Until May 15),"SPINDLE, which instantaneously became the largest ICO in Japan , will launch its first crowdsale. The crowdsale will be held globally for one week only (except for residents in Japan / USA / China). In this Crowdsale, only ETH and BCH will be accepted from strategic implications.The post PR: SPINDLE to Launch Crowdsale - One Week Only (Until May 15) appeared first on Bitcoin News.",POSITIVE,BCH | ETH,ASIA | BCH | BTC | BUSINESS | ETH,,0,0,Bitcoin.com,https://news.bitcoin.com/pr-spindle-to-launch-crowdsale-one-week-only-until-may-15/,https://images.cryptocompare.com/news/bitcoin.com/cU0000w0022.png
13365795,https://cointelegraph.com/news/crypto-markets-see-mix-of-green-and-red-after-weekend-selloff,1525885552,Crypto Markets See Mix Of Green And Red After Weekend Selloff,"Crypto markets are holding their ground despite criticism from Warren Buffett, Charlie Munger and Bill Gates. BTC, ETH, BCH make gains",POSITIVE,BCH | BTC | ETH,ALTCOIN | BCH | BTC | ETH | MARKET,,0,0,CoinTelegraph,https://cointelegraph.com/news/crypto-markets-see-mix-of-green-and-red-after-weekend-selloff,https://images.cryptocompare.com/news/cointelegraph/84baxkA50gI.jpeg
13249451,https://themerkle.com/?p=56625,1525885226,Tron Foundation Completes $1.7 Million Airdrop to Ethereum Holders,"Airdrops are becoming the new normal in the world of cryptocurrency. Owners of popular cryptocurrencies will regularly see some free tokens show up in their wallet, assuming they have control over that wallet at all times. The Tron team, for example, recently completed a 30 million TRX airdrop to the Ethereum community. Another Milestone for Tron The year 2018 will prove to be rather interesting for Tron if all things go according to plan. Earlier this year, the project launched its testnet to bring their technology to the masses. Although this is not the same as a live network for building",POSITIVE,TRX,ETH | TECHNOLOGY | TRX | AIRDROP,,0,0,NullTx,https://themerkle.com/tron-foundation-completes-1-7-million-airdrop-to-ethereum-holders/,https://images.cryptocompare.com/news/themerkle/980wh100080.png
42401505,DbF8Q09kuKX2XWBxAczuId,1525885214,Reddit Founder Says Crypto Can 'Fuel a Potential New Internet',"Bitcoin and cryptocurrencies are poised to ""fuel a potential new internet,"" even with a high level of volatility, said Alexis Ohanian, founder of the social media giant Reddit.  Appearing as a guest at the Late Show with Stephen Colbert on Tuesday, Ohanian touted the idea of a digital currency acting as a ""store of value not backed by a single country."" While he said that idea may sound silly to people living in more developed nations such as the U.S., Ohanian believes the real value of cryptocurrency is its ability to secure and transfer assets across national borders, especially for countries that are less economically stable.  ""In so many states, there are uncertainties about government and money. And people see their lives savings disappear. There’s a real value of having a currency that - as volatile as bitcoin is - are still potentially less volatile than some of the states that see hyper inflation,"" Ohanian said, adding:  ""For so many people in the world to have that security of knowing what’s yours is yours - because it [cryptocurrency] is now digital, it can be transferred with you wherever you are going - is actually pretty empowering.  Later in the show, Ohanian noted that he ceased managing the day-to-day operation of Reddit in January this year and has initiated a venture capital fund together with former Y Combinator partner Garry Tan.  As part of that effort, Ohanian and Tan have also recently participated in a funding round for the sharing economy blockchain startup Origin through a Simple Agreement for Future Tokens (SAFT) sale as previously reported by CoinDesk.  Reddit itself is also looking into cryptocurrencies - just last week, Reddit's technology head indicated that platform is planning to reintroduce cryptocurrency as a payment method for Reddit Gold members, and may feature ethereum and litecoin in addition to bitcoin.  Alexis Ohanian image via YouTube",POSITIVE,없음,BLOCKCHAIN | BTC | ETH | FIAT | LTC,Wolfie Zhao,0,0,CoinDesk,https://coindesk.com/markets/2018/05/09/reddit-founder-says-crypto-can-fuel-a-potential-new-internet,https://cdn.sanity.io/images/s3y3vcno/production/cc702a413793ca42fc2ea41cd7b1bec57c3b1017-1016x653.png?w=300&h=300&fit=crop
13454268,http://bitcoinist.com/?p=67844,1525885213,Bill Gates on Bitcoin: ‘I Would Short It If There Was an Easy Way to Do It’,The practice of traditional market figureheads taking stabs at Bitcoin is back. Statements given by Bill Gates and Warren Buffett over the past week has caused the cryptocurrency community to erupt in disbelief due to some outrageous statements. Bitcoin Under Attack Again? It seems that the good name of Bitcoin is back under attack by traditionalists who have constantly objected to the world-changing effects which cryptocurrency has. On an appearance on the Squawk BoxRead MoreThe post Bill Gates on Bitcoin: &apos;I Would Short It If There Was an Easy Way to Do It&apos; appeared first on Bitcoinist.com.,NEGATIVE,없음,BTC | MARKET,,0,0,Bitcoinist,https://bitcoinist.com/bill-gates-i-agree-i-would-short-it-if-there-was-an-easy-way-to-do-it/,https://images.cryptocompare.com/news/bitcoinist/9mkM0E0c10w.jpeg
13238351,https://www.newsbtc.com/?p=331479,1525883716,Mike Novogratz Partners With Bloomberg to Launch Cryptocurrency Index,"The founder of Galaxy Digital Capital Management LP is joining forces with Bloomberg LP to start an index for the cryptocurrency industry, according to a statement from the two companies. Michael Novogratz, ex-hedge fund manager of the Fortress Investment Group, today launched the Bloomberg Galaxy Crypto Index (BGCI). According to the statement, the index is designed...The post Mike Novogratz Partners With Bloomberg to Launch Cryptocurrency Index appeared first on NewsBTC.",POSITIVE,BTC,BTC | MARKET,,0,0,NewsBTC,https://www.newsbtc.com/2018/05/09/mike-novogratz-partners-with-bloomberg-to-launch-cryptocurrency-index/,https://images.cryptocompare.com/news/newsbtc/cy6M0200000.jpeg
13249452,https://themerkle.com/?p=56708,1525883414,Production Needs Disruption: Decentralizing Smart Manufacturing,"Smart Manufacturing (or Industry 4.0) is a term that was coined to describe the symbiosis between advancements in communications technology with various aspects of the industrial supply chain. Disclosure: This is a Sponsored Article If the verdicts of researchers, pundits and governmental authorities are to be believed, then smart manufacturing is a key contributing factor to the disarray that defines the current state of these sectors. Disparity and a desperate situation As with many industries, the growth of disruptive innovations such as big data, self-learning machines, and cloud computing have changed the face of production irreversibly. Unlike some, though, this",POSITIVE,없음,SPONSORED | TECHNOLOGY,,0,0,NullTx,https://themerkle.com/production-needs-disruption-decentralizing-smart-manufacturing/,https://images.cryptocompare.com/news/themerkle/aj0Ykxh00o0.png
13238352,https://www.newsbtc.com/?p=331469,1525881629,Why Governments Should be Promoting Integration Over Mining,"It was reported on April 25, 2018, that the Philippines is going to create a special economic zone for cryptocurrency and blockchain companies. This special economic zone will help to stimulate operations and growth for blockchain companies in a regulatory favorable and low tax environment. The move was reminiscent of Belarus&apos; actions in the past...The post Why Governments Should be Promoting Integration Over Mining appeared first on NewsBTC.",POSITIVE,없음,BLOCKCHAIN | MINING | REGULATION | SPONSORED,,0,0,NewsBTC,https://www.newsbtc.com/2018/05/09/governments-promoting-integration-mining/,https://images.cryptocompare.com/news/newsbtc/f8w2100w000.jpeg
13249453,https://themerkle.com/?p=56627,1525881625,DMG Blockchain Solutions Addresses AML Risk Through BitScore API,"In the world of cryptocurrency, exchanges and trading platforms need to adhere to some very strict guidelines and rules. DMG Blockchain Solutions recently introduced BitScore, which serves as a cryptocurrency deposit and withdrawal risk-scoring web API for AML and anti-fraud compliance. BitScore can Make a Positive Impact Trading platforms and exchanges dealing in cryptocurrency face a lot of scrutiny from regulators and governments these days. It is paramount that these companies pay close attention to developments in this industry and improve their protocols on a regular basis. Addressing any money laundering and fraud concerns must be a top priority. Finding the right solutions to",POSITIVE,없음,BLOCKCHAIN | TRADING,,0,0,NullTx,https://themerkle.com/dmg-blockchain-solutions-addresses-aml-risk-through-bitscore-api/,https://images.cryptocompare.com/news/themerkle/82AAOw91wI0.jpeg
42401501,DbF8Q09kuKX2XWBxAcztQW,1525881611,Zilliqa Becomes Latest Crypto to Break $1 Billion Market Cap,"Zilliqa has become one of just 28 cryptocurrencies to boast a market capitalization over $1 billion.  According to CoinMarketCap, Zilliqa passed the $1 billion threshold late Monday and is worth nearly $1.2 billion at the time of writing, making it the world's 23rd-most valuable cryptocurrency. The rise coincided with the announcement that Zilliqa is available to trade on OKEx, the third-highest volume cryptocurrency exchange tracked by CoinMarketCap.  The coin is also available to trade on Binance, Huobi and Gate.io, among others.  The Singapore-based project presents itself as solving the scalability problems endemic to blockchain technology through sharding, an efficiency-boosting technique that predates bitcoin but has yet to prove its viability in big permissionless networks. First introduced last year, the team's white paper claims that ""at ethereum's present network size of 30,000 miners, Zilliqa would expect to process about [1,000] times the transaction rates of ethereum.""  The ethereum network plans to introduce sharding in the future, perhaps undercutting Zilliqa's value proposition.  Zilliqa's market cap has more than tripled in the past 30 days, from $295 million on April 9. The coin is worth just over $0.16 at the time of writing, and is up 16.9 percent over the past 24 hours.  Coaster image via Shutterstock",POSITIVE,없음,BLOCKCHAIN | ETH | EXCHANGE | MARKET | BNB,David Floyd,0,0,CoinDesk,https://coindesk.com/markets/2018/05/09/zilliqa-becomes-latest-crypto-to-break-1-billion-market-cap,https://cdn.sanity.io/images/s3y3vcno/production/39f7dc6ddc8061b280e7ab23a41026320c7f4fa9-1900x1268.jpg?w=300&h=300&fit=crop
13439043,https://news.bitcoin.com/?p=158135,1525880152,US State Issues Emergency Cease and Desist Orders to Two Crypto Investment Firms,"A U.S. state has issued emergency cease and desist orders to two companies and related persons purportedly engaged in cryptocurrency investment schemes. The first company posted videos of three mining farms composed of online stock images, according to the order. Both companies made numerous materially misleading claims and violated U.S. securities laws. Also read: Yahoo! Japan ...The post US State Issues Emergency Cease and Desist Orders to Two Crypto Investment Firms appeared first on Bitcoin News.",NEGATIVE,없음,ALTCOIN | ASIA | BTC | BUSINESS | REGULATION,,0,0,Bitcoin.com,https://news.bitcoin.com/us-state-cease-desist-orders-crypto-investment-firms/,https://images.cryptocompare.com/news/bitcoin.com/cwA8FB6i4ha.png
