뉴스ID,뉴스GUID,일자(UTC timestamp),뉴스제목,본문,SENTIMENT,주요코인,카테고리,작성자,추천수,비추천수,출처,뉴스URL,이미지URL
42411326,GJVPKSa3D710Liw1glN0Hk,1668354300,"All Custodial Crypto Exchanges Should Adopt Proof-of-Reserve Programs, but Even That Isn’t Enough","Last week FTX, once the third-largest crypto exchange by volume, owned and run by founder Sam Bankman-Fried (SBF), went through a meltdown. Here’s how that went down:  On Nov. 2, a CoinDesk scoop showed that Alameda Research, SBF’s quantitative crypto trading firm, had a funny-looking balance sheet  On Nov. 6, Changpeng “CZ” Zhao, founder and CEO of the largest crypto exchange, Binance, announced his firm would sell all of the FTT, FTX’s exchange token (more on that below), that it held  Then, FTX claimed there were no issues at FTX  Then, FTT’s price tanked  Then, we got this headline: FTX Agrees to Sell Itself to Rival Binance Amid Liquidity Scare at Crypto Exchange  You’re reading Crypto Long & Short, our weekly newsletter featuring insights, news and analysis for the professional investor. Sign up here to get it in your inbox every Sunday.  I think it’s more accurate to attribute FTX’s fall to a “solvency issue” rather than a “liquidity scare” (which just means FTX owed people some money and it couldn’t pay). But that doesn’t really matter because this potential purchase was subject to a due diligence process.  That due diligence process took almost no time at all before we got another CoinDesk scoop: Binance Is Strongly Leaning Toward Scrapping FTX Rescue Takeover After First Glance at Books  … followed hours later by official confirmation: Binance Walks Away From Deal to Acquire FTX  The market, unsurprisingly, was puking everywhere as it grappled with sparse details as events unfolded in real time. Binance ultimately pulled out of the deal because FTX’s issue were ""beyond [Binance’s] control or ability to help.""  A crude description of what this means is that FTX would be unable to satisfy customer withdrawal requests for the funds stored on its platform because FTX had been doing all sorts of things with those deposited funds and those things turned out to be bad for the value of the deposited funds. Now, this is a relatively normal practice. Even your local credit union does things with funds you deposit with them; “doing stuff” wasn’t FTX’s transgression.  By way of example, when you deposit money into a bank account, the bank lends your money out to other customers who want to buy cars, houses or a new gaming rig in exchange for an interest rate. Some banks do more exotic things, like allow customers to put up collateral (like a stock, bond or cash) to borrow some other asset to trade it. Herein lies FTX’s transgression.  FTX was doing that. It allowed customers to borrow things like bitcoin for cash to make trading bets. That’s all fine and dandy as long as FTX manages risk responsibly (whatever that means) and is transparent with its customers (much clearer, just tell customers everything).  Where FTX went wrong, besides the lack of transparency, was behavior regarding FTT, its native crypto token. FTT is like an equity stake in FTX itself, because every so often FTX uses its profits to buy some FTT off the open market (which should increase FTT’s price because of supply and demand). Customers were allowed to deposit FTT with FTX and use that as collateral to borrow other crypto assets or cash to make trading bets.  Now it’s not immediately obvious but this is an awful idea. Here’s why:  If the health of FTX is even remotely questioned (like how a company with the same founder in the same industry has a funny-looking balance sheet), then its equity (or things that are sort of equity) loses value. And if FTX is holding a lot of FTT on behalf of customers who are making trading bets, then that FTT is less valuable collateral, which means that the health of FTX degrades, which means FTT would lose value.  And so on and so forth.  You know what this sounds like? Yeah, it sounds like how roughly $60 billion of value evaporated basically overnight in May 2022 with the collapse of Terra.  Dizzy yet? Me, too. Let’s pause for a moment.  I’m not sure about you, but this sounds like something else I’ve heard about before. That is: What was happening in the leadup to the Great Financial Crisis in 2007 when financial institutions were doing all sorts of exotic things with mortgages, and taking trading bets on the performance of those mortgages.  So given the insistence of crypto-natives to avoid the failings of traditional finance (TradFi), what has the reaction been from people in the industry?  One of the more reasonable calls to action has been the urging for cryptocurrency exchanges to implement “proof-of-reserves” to combat the huge loss in credibility the collective body of cryptocurrency exchanges just felt.  So what is proof-of-reserves and how can it save us?  Proof-of-reserves is basically a fancy way of saying: “Hey, here’s proof that we have what we say we have.”  A very simple example: Let’s say you have 1 bitcoin that you bought on an exchange called “Shh! Just Trust George” and you leave it there for the exchange to take care of it on your behalf. For all intents and purposes, that 1 bitcoin is your bitcoin; Shh! Just Trust George is just holding it for you. Because of the transparency of the Bitcoin blockchain, there should exist some proof (cryptographic or whatever) that Shh! Just Trust George does in fact have your 1 bitcoin in its reserve.  From a finance-talk perspective, Shh! Just Trust George should be able to easily prove that its assets, the bitcoin it holds, match up with its liabilities, the promise that Shh! Just Trust George will give a customer their bitcoins when they ask for them.  Some proponents, like CoinDesk columnist Nic Carter, have been urging cryptocurrency exchanges to implement this for a while. Some have, like Kraken and BitMEX, and since the FTX-and-related meltdown the likes of Binance, OKX, KuCoin, Poloniex and Huobi have all promised to issue a proof-of-reserves attestation (or similar) in the coming days, weeks or months.  Papering over some technological details, there’s a way to use Merkle trees, which are data structures used in bitcoin, to do this in a sleek and cost-effective way. I think this is great. We should aspire for more transparency in our financial services, and proof-of-reserves could provide that.  But there’s a missing piece to the practical implementation of proof-of-reserves that enterprising readers might recognize as a potential flaw. In practice there will likely also have to be a third-party auditor hired to attest to the proof-of-reserves (as Kraken has).  You might see where this is going … more third parties, more potential centralizing choke points. So while implementing proof-of-reserves is a massive step in the right direction, it is certainly still not enough.  We need more than proof-of-reserves  Here are two of the (potentially many) reasons why we need more than proof-of-reserves from crypto exchanges:  We’re still partially depending on humans. Sure, these are humans at audit firms, but the humans at defunct accounting firm Arthur Andersen didn’t catch that the humans at Enron were engaged in fraud.  While a proof-of-reserves attestation might show that an exchange does in fact have the bitcoin (or other asset) you asked it to hold for you, there’s no guarantee it hasn’t done a bunch of other stuff with your funds.  So human fallibility can still upend proof-of-reserves. Somehow the hefty financial rewards that come with the financial shenanigans needs to be outweighed.  Here, though, are some shreds of hope.  Modern finance has consistently seen busts that are worse than the booms that preceded them. And the busts have hurt enough people in a short enough timespan that these people will demand more clarity and transparency going forward. If customers don’t, the policymakers will be sure to try to make that happen (even though it hasn’t really been successful so far yet).  On top of that, at risk of sounding like a Luddite, I also think consumers are wising up to one of the problems with contemporary business: complexity. Sure, without complicated things we wouldn’t have, say, circuit boards. But there’s a glut of companies, businesses, movements and jobs that can’t be simply explained anymore. That’s a problem for transparency, whatever the protagonists’ intentions.  So, after a week of dizzying revelations involving a once-heralded new business of the New Era, I leave you with one simple idea: Let’s get back to the basics.",NEGATIVE,FTT,BTC | EXCHANGE | TRADING | BNB | FTT,George Kaloudis,0,0,CoinDesk,https://coindesk.com/business/2022/11/13/all-custodial-crypto-exchanges-should-adopt-proof-of-reserve-programs-but-even-that-isnt-enough,https://cdn.sanity.io/images/s3y3vcno/production/333a384df19b8a3b8dbab74ac0df30101328d92f-1440x1080.jpg?w=300&h=300&fit=crop
4176187,https://www.cryptopolitan.com/?p=237606,1668353855,Tezos price analysis: XTZ price correct down to $1.02 amid bearish market,"Tezos price analysis shows that the cryptocurrency has been experiencing a downtrend over the past 24-hours. The market opened trading in bullish territory, with XTZ prices hitting a high of $10.5 on the day. However, as the market began to show signs of weakness, there was a sharp decline in price that led to XTZ … Tezos price analysis: XTZ price correct down to $1.02 amid bearish market Read More »",NEGATIVE,XTZ,MARKET | TRADING | XTZ,,0,0,Cryptopolitan,https://www.cryptopolitan.com/tezos-price-analysis-2022-11-13/,https://resources.cryptocompare.com/news/43/4176187.jpeg
4175999,https://news.bitcoin.com/?p=558437,1668353459,"FTX Contract Deployer Unlocks 192 Million FTT, Exchange Token’s Questionable Tokenomics Highlights Red Flags","Following the collapse of FTX and the exchange filing bankruptcy on Nov. 11, the trading platform’s exchange token called ftx (FTT) has shed 91.6% in value during the last seven days. While the FTT token’s utility is based entirely on the backing of the now-bankrupt FTX and Alameda Research, the token is still trading for",NEGATIVE,FTT,ALTCOIN | EXCHANGE | ICO | LUNA | FTT,,0,0,Bitcoin.com,https://news.bitcoin.com/ftx-contract-deployer-unlocks-192-million-ftt-exchange-tokens-questionable-tokenomics-highlights-red-flags/,https://resources.cryptocompare.com/news/14/4175999.jpeg
4175951,https://ambcrypto.com/?p=270503,1668353429,The BAYC-FTX connection: Why the Apes may not climb any price trees soon,"BAYC’s royalties and treasury were stored on the FTX US exchange Floor price and volume dropped significantly over the week The NFT market felt the impact of falling prices as crypto rates plunged over the last few days. In fact, even Ethereum [ETH] blue-chip collections like Bored Ape Yacht Club [BAYC] could not bank on",NEGATIVE,ETH,ALTCOIN | ETH | EXCHANGE | MARKET | TRADING,,0,0,AMB Crypto,https://ambcrypto.com/the-bayc-ftx-connection-why-the-apes-may-not-climb-any-price-trees-soon/,https://images.cryptocompare.com/news/default/ambcrypto.png
4175952,https://dailyhodl.com/?p=225147,1668353415,Analyst Who Called May 2021 Bitcoin Crash Says BTC Can Absorb Most Horrendous News,"The crypto strategist who accurately predicted Bitcoin’s collapse last year believes BTC can handle even the most unfavorable developments. Pseudonymous analyst Dave the Wave tells his 130,200 Twitter followers that crypto markets are facing a huge loss of public credibility after crypto exchange FTX filed for bankruptcy. However, the analyst also reminds his followers that The post Analyst Who Called May 2021 Bitcoin Crash Says BTC Can Absorb Most Horrendous News appeared first on The Daily Hodl .",NEUTRAL,BTC,BTC | EXCHANGE | MARKET | TRADING,,0,0,The Daily Hodl,https://dailyhodl.com/2022/11/13/analyst-who-called-may-2021-bitcoin-crash-says-btc-can-absorb-most-horrendous-news/,https://images.cryptocompare.com/news/default/dailyhodl.png
4175005,https://decrypt.co/?p=114310,1668351564,"Crypto.com Accidentally Sent $400M in Ethereum to Wrong Address, CEO Calls Concerns ‘FUD’",Crypto.com’s $400 million mishap leaves its token down 50% and raises doubts over the exchange’s transparency following FTX’s collapse.,NEGATIVE,없음,BUSINESS | ETH | EXCHANGE | ICO,,0,0,Decrypt,https://decrypt.co/114310/crypto-com-accidentally-sent-400m-in-ethereum-to-wrong-address-ceo-calls-concerns-fud,https://resources.cryptocompare.com/news/44/4175005.jpeg
4174731,https://cryptonews.com/news/cryptocom-sends-400-million-worth-of-ethereum-wrong-address-binance-ceo-warns-users-stay-away.htm,1668351060,"Crypto.com Sends $400 Million Worth of Ethereum to Wrong Address, Binance CEO Warns Users to Stay Away","Cryptocurrency exchange Crypto.com mistakenly sent 320,000 ETH to a wallet address linked to Gate.io in late October. While the platform has since recovered the assets, Binance CEO Changpeng Zhao advised users that it is best they stay away from the platform. ... Read More: Crypto.com Sends $400 Million Worth of Ethereum to Wrong Address, Binance CEO Warns Users to Stay Away",NEGATIVE,ETH,ETH | EXCHANGE | BNB,,0,0,cryptonews,https://cryptonews.com/news/cryptocom-sends-400-million-worth-of-ethereum-wrong-address-binance-ceo-warns-users-stay-away.htm,https://resources.cryptocompare.com/news/52/4174731.jpeg
4174547,https://www.cryptopolitan.com/?p=237455,1668350814,Sam Bankman-Fried currently under supervision in the Bahamas,"Sam Bankman-Fried former FTX’s CEO, co-founder Gary Wang, and director of engineering Nishad Singh are reportedly in the Bahamas and “under supervision” by the government there as of November 13, 2022 (Nassau). According to a source with knowledge of the situation, the three former FTX executives and Alameda Research CEO Caroline Ellison are searching for … Sam Bankman-Fried currently under supervision in the Bahamas Read More »",NEUTRAL,없음,RESEARCH,,0,0,Cryptopolitan,https://www.cryptopolitan.com/sam-bankman-under-supervision-in-bahamas/,https://resources.cryptocompare.com/news/43/4174547.jpeg
4174037,https://www.cryptopolitan.com/?p=237577,1668349802,Polkadot price analysis: Bullish uptrend marks DOT price above $5.81,"Polkadot price analysis confirms an increasing trend for cryptocurrency today as the coin value has increased tremendously, reaching above $5.81, the resistance level for DOT/USD is at $5.95 and the support level is at $5.69. The bullish momentum that we are seeing in this market is likely to continue as more investors and traders enter … Polkadot price analysis: Bullish uptrend marks DOT price above $5.81 Read More »",POSITIVE,DOT,BUSINESS | DOT | MARKET | TRADING,,0,0,Cryptopolitan,https://www.cryptopolitan.com/polkadot-price-analysis-2022-11-13/,https://resources.cryptocompare.com/news/43/4174037.jpeg
4353499,https://blockworks.co/news/doxed-tokensoft-cold-storage-wallets,1668349491,"4,500 Doxed Tokensoft Users, a Rush on Cold Storage Wallets: Where’s the Silver Lining?","If crypto is to evolve, more people need to learn that exchanges are not necessarily the safest place for their assets – and their data safety is paramount.",NEUTRAL,없음,WALLET,,0,0,Blockworks,https://blockworks.co/news/doxed-tokensoft-cold-storage-wallets,https://images.cryptocompare.com/news/default/blockworks.png
4173381,https://cointelegraph.com/news/how-to-build-a-bitcoin-beach-advice-from-the-pros,1668348600,How to build a Bitcoin Beach: Advice from the pros,"Founders of Bitcoin Beach El Salavdor, Bitcoin Ekasi in South africa, Dakar Bitcoin Days in Senegal and Global Bitcoin Fest shed light on building Bitcoin communities around the world.",NEUTRAL,없음,BTC,,0,0,CoinTelegraph,https://cointelegraph.com/news/how-to-build-a-bitcoin-beach-advice-from-the-pros,https://resources.cryptocompare.com/news/16/4173381.jpeg
4173109,https://news.bitcoin.com/?p=558428&preview=true&preview_id=558428,1668348030,"Crypto Exchange Kraken Freezes Accounts of FTX, Alameda Research, Their Executives","Crypto exchange Kraken has frozen a handful of accounts owned by the bankrupt FTX Group, Alameda Research, and their executives. Kraken has been in contact with law enforcement after discovering that an account on its platform was used in connection with unauthorized transfers at FTX. Kraken Freezes Accounts Belonging to FTX, Alameda Research, and Executives",NEGATIVE,없음,EXCHANGE | REGULATION | RESEARCH,,0,0,Bitcoin.com,https://news.bitcoin.com/crypto-exchange-kraken-freezes-accounts-of-ftx-alameda-research-their-executives/,https://resources.cryptocompare.com/news/14/4173109.jpeg
4172090,https://ambcrypto.com/?p=270499,1668346216,Is BNB’s confidence in its best performers enough to reverse its downtrend,"BNB Chain was quite heated due to multiple positive developments BNB’s stochastic was oversold, but the rest of the metrics were negative BNB’s performance last week was not what investors expected. Its price went down considerably, like most other cryptos in the market. The credit for this price decline goes to the current market, which",NEUTRAL,BNB,ALTCOIN | EXCHANGE | MARKET | TRADING | BNB,,0,0,AMB Crypto,https://ambcrypto.com/is-bnb-confidence-in-its-best-performers-enough-to-reverse-its-downtrend/,https://images.cryptocompare.com/news/default/ambcrypto.png
4172057,https://www.cryptopolitan.com/?p=237557,1668346154,ChainLink price analysis: LINK loses value at $6.1,"ChainLink price analysis for November 13, 2022, reveals the market following a complete bearish movement, obtaining massive negative momentum, signifying a decline for the LINK market. The price of ChainLink has remained negative over the past few hours. Today, the price crashed and went from $7 to $6.5. However, the market started to further decrease in … ChainLink price analysis: LINK loses value at $6.1 Read More »",NEGATIVE,LINK,LINK | MARKET | TRADING,,0,0,Cryptopolitan,https://www.cryptopolitan.com/chainlink-price-analysis-2022-11-13/,https://resources.cryptocompare.com/news/43/4172057.jpeg
4353260,http://localhost:3000/news/doxed-tokensoft-cold-storage-wallets,1668345891,"4,500 Doxed Tokensoft Users, a Rush on Cold Storage Wallets: Where’s the Silver Lining?","If crypto is to evolve, more people need to learn that exchanges are not necessarily the safest place for their assets – and their data safety is paramount.",NEUTRAL,없음,WALLET,,0,0,Blockworks,http://localhost:3000/news/doxed-tokensoft-cold-storage-wallets,https://images.cryptocompare.com/news/default/blockworks.png
4171939,https://cointelegraph.com/news/what-is-a-helium-miner-and-how-does-it-work,1668345540,What is a Helium miner and how does it work?,"A wireless device called a hotspot, or helium miner, uses radio technologies for HNT minting and rewards HNT tokens for providing coverage.",NEUTRAL,HNT,HNT,,0,0,CoinTelegraph,https://cointelegraph.com/news/what-is-a-helium-miner-and-how-does-it-work,https://resources.cryptocompare.com/news/16/4171939.jpeg
4171481,https://www.cryptopolitan.com/?p=237549,1668345130,"Ethereum price analysis: ETH slowly consolidates around $1,250, spike higher incoming?","Ethereum price analysis is bullish today as we have seen consolidation around $1,250 after buyers failed to return overnight. Therefore, the current quick retest of previous support will likely be enough for ETH/USD to rapidly continue higher over the next 24 hours. The market has traded in the red over the last 24 hours. The … Ethereum price analysis: ETH slowly consolidates around $1,250, spike higher incoming? Read More »",POSITIVE,ETH,ETH | MARKET | TRADING,,0,0,Cryptopolitan,https://www.cryptopolitan.com/ethereum-price-analysis-2022-11-13/,https://resources.cryptocompare.com/news/43/4171481.jpeg
4170655,https://cryptopotato.com/?p=224087,1668343542,"CryptoCom Accidentally Sends $400 Million Worth of ETH To Gate, Funds Recovered Later","In what seems to be a repeated mistake, CryptoCom has once again sent money accidentally, only to recover it later.",NEUTRAL,ETH,ETH,,0,0,Crypto Potato,https://cryptopotato.com/cryptocom-accidentally-sends-400-million-worth-of-eth-to-gate-funds-recovered-later/,https://resources.cryptocompare.com/news/27/4170655.jpeg
4170652,https://dailyhodl.com/?p=225143,1668343512,"Binance CEO Changpeng Zhao Reveals Why Deal With FTX Collapsed, Says Industry Now Facing 2008-Style Meltdown","The chief executive of the world’s largest crypto exchange is revealing why the potential deal with former competitor and bankrupt firm FTX failed to go through. In an interview at the 2022 Indonesia Fintech Summit, Changpeng Zhao says that rescuing FTX from bankruptcy did not make sense for Binance from both business and legal standpoints. The post Binance CEO Changpeng Zhao Reveals Why Deal With FTX Collapsed, Says Industry Now Facing 2008-Style Meltdown appeared first on The Daily Hodl .",NEGATIVE,없음,BUSINESS | EXCHANGE | REGULATION | TRADING | BNB,,0,0,The Daily Hodl,https://dailyhodl.com/2022/11/13/binance-ceo-changpeng-zhao-reveals-why-deal-with-ftx-collapsed-says-industry-now-facing-2008-style-meltdown/,https://images.cryptocompare.com/news/default/dailyhodl.png
4170201,https://news.bitcoin.com/?p=558211,1668342648,"The Mysterious FTX Debacle, Tim Draper’s BTC Price Prediction, More Support for Ripple in SEC Lawsuit — Week in Review","As theories proliferate wildly about the true nature of what happened to failed crypto exchange FTX, little is yet clear to the crypto community. Former CEO of FTX Sam Bankman-Fried has addressed the issue publicly on social media, mentioning a mysterious “sparring partner.” This week, Bitcoin.com News has also provided an in-depth look at the",NEUTRAL,BTC,BTC | EXCHANGE | REGULATION | TRADING | FTT,,0,0,Bitcoin.com,https://news.bitcoin.com/the-mysterious-ftx-debacle-tim-drapers-btc-price-prediction-more-support-for-ripple-in-sec-lawsuit-week-in-review/,https://resources.cryptocompare.com/news/14/4170201.jpeg
4169215,https://finbold.com/?p=73455,1668340835,Elon Musk says his ‘bullshit meter was redlining’ when talking with FTX’s Sam Bankman-Fried,Tesla (NASDAQ: TSLA) CEO Elon Musk is the latest high-profile individual to comment on the FTX crypto exchange crisis and … Continued The post Elon Musk says his ‘bullshit meter was redlining’ when talking with FTX’s Sam Bankman-Fried appeared first on Finbold .,NEGATIVE,없음,EXCHANGE,,0,0,Finbold,https://finbold.com/elon-musk-says-his-bullshit-meter-was-redlining-when-talking-with-ftxs-sam-bankman-fried/,https://images.cryptocompare.com/news/default/finbold.png
4169192,https://dailyhodl.com/?p=225185,1668340793,"$389,233,378 in FTT Abruptly Leaves FTX Contract Address, Moves to Unknown Crypto Wallet","Sixty percent of all the FTX Token (FTT) in existence has suddenly been transferred between crypto wallets as the fallen crypto exchange’s dramatic collapse continues. First reported by blockchain tracking service WhaleAlert, Etherscan data shows 195,869,335 FTT worth $389,233,378 leaving FTX’s contract address and into an unknown wallet. The FTT sent was originally part of The post $389,233,378 in FTT Abruptly Leaves FTX Contract Address, Moves to Unknown Crypto Wallet appeared first on The Daily Hodl .",NEGATIVE,FTT,ALTCOIN | BLOCKCHAIN | EXCHANGE | BNB | FTT,,0,0,The Daily Hodl,https://dailyhodl.com/2022/11/13/389233378-in-ftt-abruptly-leaves-ftx-contract-address-moves-to-unknown-crypto-wallet/,https://images.cryptocompare.com/news/default/dailyhodl.png
4168862,https://cointelegraph.com/news/3-billion-in-bitcoin-left-exchanges-this-week-amid-ftx-contagion-fears,1668340052,$3 billion in Bitcoin left exchanges this week amid FTX contagion fears,It appears that more investors are choosing to self-custody their BTC funds in the wake of the FTX scandal and fallout.,NEUTRAL,BTC,BTC | BUSINESS,,0,0,CoinTelegraph,https://cointelegraph.com/news/3-billion-in-bitcoin-left-exchanges-this-week-amid-ftx-contagion-fears,https://resources.cryptocompare.com/news/16/4168862.jpeg
4168217,https://ambcrypto.com/?p=270527,1668339006,Crypto.com: Experts claim proof-of-reserves may be suspicious because…,"Crypto.com might have transferred from exchanges to cold wallet shortly before asset declaration Research experts claim exchange could be trading with customer funds and also be in debt Unpleasant events rocked the crypto ecosystem lately, which subsequently led exchanges to release their proof-of-reserves, such as Crypto.com. As of 11 November, Kris Marszalek, the CEO of",NEGATIVE,없음,EXCHANGE | SPONSORED | TRADING | RESEARCH,,0,0,AMB Crypto,https://ambcrypto.com/crypto-com-experts-claim-proof-of-reserves-may-be-suspicious-because/,https://images.cryptocompare.com/news/default/ambcrypto.png
4167803,https://cointelegraph.com/news/hong-kong-to-avoid-ftx-like-scenario-through-transparency-and-supervision,1668338195,Hong Kong to avoid FTX-like scenario through transparency and supervision,Financial Secretary Paul Chan highlighted the importance of being “steady and cautious” when promoting the development of the virtual asset industry in Hong Kong.,NEUTRAL,없음,ASIA,,0,0,CoinTelegraph,https://cointelegraph.com/news/hong-kong-to-avoid-ftx-like-scenario-through-transparency-and-supervision,https://resources.cryptocompare.com/news/16/4167803.jpeg
