뉴스ID,뉴스GUID,일자(UTC timestamp),뉴스제목,본문,SENTIMENT,주요코인,카테고리,작성자,추천수,비추천수,출처,뉴스URL,이미지URL
42425209,sd6iOBkuiC3F0LYOyHvGBh,1386849646,Bitcoin Law: Compliance and Avoidance Strategies,"Marco Santori is a blockchain and bitcoin specialist who leads the FinTech practice at law firm Cooley LLP.  In this multi-part series, Santori gives a basic primer on the state of US law as it applies to digital currency entrepreneurs.      In the first two parts of the series, we covered the law of money transmission on the federal and state-level in the United States. We learned that not all digital currency businesses need to register or obtain a license, but for those that do, the process can prove expensive and time-consuming.  So, how can a business effectively comply with the registration and licensing requirements? What alternatives exist? How can a business avoid them altogether?  You can seek licenses, but it’s expensive  The first and most obvious option for complying with state and federal requirements is to register with FinCEN and seek licenses from each of the states in which your customers reside.  Registration with FinCEN is a fairly simple exercise: 15 minutes and a few mouse clicks on FinCEN’s website will satisfy that obligation. The real burden here comes from the ongoing costs of compliance, like verifying customer information and filing Suspicious Activity Reports.  Likewise, compliance on the state level is expensive.  The up-front costs alone of obtaining 48 state money transmission licenses can exceed six-figures for some applicants. On top of that, satisfying the ongoing state requirements is a business unto itself.  For more information on federal compliance, see part one of this series. For compliance on the State level, see part two. If that process is not appetizing to you, you’re not alone. Many businesses have sought to avoid US customers altogether.  You can avoid US customers, but it takes work  Plenty of businesses, some of my own clients included, have decided that the US market just isn’t for them.  They’ve either soured on the idea of servicing US clients altogether, or have decided to launch and wait it out in jurisdictions like Canada until the US sees regulatory reform.  This can be both profitable and practical, but simply incorporating the overseas market isn’t going to cut it.  The smart business will develop a set of policies and procedures reasonably calculated to keep US residents out. A competent attorney can help guide you through this process, and I can give some very basic principles here.  Firstly, a pre-emptive response to a question I get asked weekly: geofiltering incoming IP addresses is only the beginning. The business itself should detect the jurisdiction of the customer’s IP address, display that address, and ask the customer to confirm that this is his or her jurisdiction.  Both customer and business can take affirmative steps: the customer can be required to click a button stating “I affirm that I am a resident of *country*,” and the business can require verifying documentation, like a passport or utility bill.  Several providers offer these kinds of onboarding services. Your business should develop a risk profile for each of its customers in real time setting forth the probability that the customer is a US resident.  The risk profile should take into account different factors like: (i) whether the customer registers a US bank account with your business, (ii) how many transfers to US bank accounts the customer requests (if you offer such a service), and (iii) how many times the customer accesses your service from within the US after setting up a new account.  [post-quote]  A customer whose activities, over time, start to resemble those of a US resident, might be a US resident – and your business should consider closing that customer’s account.  Once these policies are in place, your business should implement them and record the results in case of future enforcement by a US regulatory body.  The record shouldn't just show that your business followed its own policies, but that those policies worked. If push comes to shove, a judge and jury would probably like to see that, every once in a while, your procedures actually caught a US resident trying to use your service, and that you closed his or her account.  Finally, it should go without saying that your business should not advertise to US customers. This all might seem excessive for, or inapplicable to, your business and indeed it might be. The proper set of procedures will depend heavily upon the details of your business model and your degree of risk tolerance.  For some, even crafting and implementing these policies may be just as unappetising as compliance. There is, in fact, a way to service US customers and avoid these burdens.  Namely, you can become the agent of a Bank or Credit Union, as existing MSB Certified agents of banks, credit unions and money services businesses are typically exempt from registration and licensure requirements.  Functionally, becoming an agent means hiring an attorney to negotiate and execute an agreement with the bank, credit union or MSB (called the “principal”) setting forth your relative rights and obligations.  Becoming an agent implies two important consequences. First, you will lose some control over your business. As the agent, you will act at the principal’s direction. The principal will likely possess more leverage in the negotiation of the agreement and its performance.  Second, you will not avoid the compliance requirements altogether. To be sure, your business won’t need to seek out state licenses or to register with FinCEN, but it will still have to comply with any anti-money laundering and know your customer (KYC) requirements put in place by the principal.  Furthermore, your business will need to implement those requirements in the way the principal wants them implemented – which may or may not map onto your business plan.  For a digital currency business, an agency relationship might be difficult to find.  Existing money transmitter license holders are wary of alienating their current agents by signing on an untested and exotic digital currency business.  Worse, banks and credit unions have yet to develop a compliance program properly tailored to digital currency technology. If no existing licensee is interested, or the ongoing costs of compliance are still too high, not all is lost.  Your business model can fit into an exception, or avoid the MSB rules entirely  There are several exceptions to the MSB registration requirements. The most popular – at least in my experience – are the so-called “payment processor” exemptions.  Businesses that merely perform payment processing services for a merchant are exempt from registration with FinCEN, even though they otherwise fit the definition of a money transmitter. These businesses can thrive in the digital currency ecosystem without ever having to verify their customer’s identifying information or file a Suspicious Activity Report.  The answer to the question: “Am I a payment processor?” is not always obvious, and even then, not all business owners necessarily want to know the answer for sure. After all, the answer might be “no”.  To the attorney’s lament, many clients would prefer to beg forgiveness rather than ask permission. For those who value peace of mind, though, the best way to find out is for your attorney to prepare a “request for ruling” to FinCEN and ask them directly.  I talked about this process in the context of state regulatory bodies in part two, but the same is true for the federal regulators at FinCEN.  Sometimes better than fitting into an exception, some digital businesses have found success in avoiding the money transmission regime entirely. They accomplish this by carefully structuring their business model to avoid the common characteristics of money transmission.  The real-world permutations here are literally infinite, but two simplistic examples might be helpful.  Firstly, a business that would otherwise be a payment processor, but also offers hosted wallet functionality, might offload that responsibility to a third party, or require the customer to provide his own wallet address.  Secondly, an institutional bitcoin miner might, instead of selling his mined bitcoins for dollars, sell his hashing power in bulk to customers who can either hold their mined coins or sell them for dollars themselves.  Another very specific example of adjusting a business model to comply with regulation is a time-tested practice: pass the buck to someone else.  You can white label your product  You’ve probably heard of white labeling. It means developing your product to completion and bringing it to the cusp of launch, but instead of dealing with the regulation required to use it, selling it or licensing it to someone else.  This has the effect of passing the regulatory burden onto the customer and can be successful whether your product is hardware or software. For example, the manufacturer of a Bitcoin ATM machine need not operate it. The manufacturer can successfully sell machines to a third party who will plug it in, collect the cash and deal with the regulatory worries.  The same is true for developers of Bitcoin exchange software. Developers can always operate the exchange in-house under its own brand and manage the regulatory risk.  Alternatively, it can license the exchange Software As A Service (you’ve probably heard the expression “SAAS”) to a third party in a jurisdiction with less stringent regulatory requirements. A competent attorney can guide your business through this process, and prepare the contracts required to get the job done correctly.  This completes the Bitcoin money transmission trilogy.  In part one, we learned about the federal requirements for money transmitters. In part two, we discussed how state money transmission laws could make or break a digital currency business. In this article, part three, we canvassed some strategies for complying with and avoiding those requirements.  What would you like to see in Part 4?  Marco Santori is a business attorney in New York City with Pillsbury Winthrop Shaw Pittman LLP. He is a lawyer, but he is not your lawyer, and this is not legal advice. You can reach Marco at marco.santori@pillsburylaw.com.  Dollar Stack image via Shutterstock",NEUTRAL,없음,BTC | BUSINESS | EXCHANGE | FIAT | REGULATION,Marco Santori,0,0,CoinDesk,https://coindesk.com/markets/2013/12/12/bitcoin-law-compliance-and-avoidance-strategies,https://cdn.sanity.io/images/s3y3vcno/production/284e8a6d193bbd05db9573285b013bcce015a0b9-1000x750.jpg?w=300&h=300&fit=crop
42425190,sd6iOBkuiC3F0LYOyHvFbh,1386846054,Coinbase Raises $25 Million in Bitcoin's Biggest Ever Funding Deal,"Coinbase has managed to secure $25m in series B funding led by Silicon Valley-based venture capital firm Andreessen Horowitz. This brings the total amount raised by the company to $31.9m.  The firm, which describes itself as an ""international digital wallet that allows you to securely buy, use, and accept bitcoin currency"", is going from strength to strength, with an estimated 600,000 people now using its wallet service, up from 200,000 in August.  The $31.9m raised so far represents the biggest fundraising success of any bitcoin company, dwarfing Circle’s $9m of Series A funding from multiple tech investors. To say that this is huge is not an overstatement.  Coinbase  is getting a lot of positive press, too. Last week it was named the second most exciting tech start-up by Time magazine.  “This funding solidifies our position as the largest and fastest growing bitcoin service in the US. We plan to use the funds to expand our team, continue to educate the market, and promote the mainstream adoption of bitcoin,” Coinbase said in a statement, adding:  “We’ll also expand our referral program, where you can give and get $5 in bitcoin for free when you refer a friend who buys or sells at least $100 of bitcoin.”  Coinbase also announced that Bitcoin developer Gavin Andresen has joined the company in an advisory role. Andresen said Coinbase has already become a “critical piece of the Bitcoin infrastructure” in the United States. He added that the best part of his job as chief scientist of the Bitcoin Foundation is interacting with brilliant people at Coinbase and other start-ups who are working to bring bitcoin to a wider audience.  “We're very excited about the investment. The team at Andreessen is very far up on the curve on their thinking on bitcoin, especially as a way to bring simple economics in to the web in a low level way,” Coinbase co-founder Fred Ehrsam told CoinDesk. “The money will allow us to continue building a world class engineering team, to continue to play offense when it comes to regulation and compliance, and to throw fuel on the fire for our referral program.”  Ehrsam said it is all about continuing to build a user experience that continues to reduce any friction in bitcoin - whether by making it easier to buy bitcoin with more pay-in options, getting more world-class merchants on board to what is the most seamless checkout experience in bitcoin, or adding to the Coinbase API, which is currently the most active developer platform in the bitcoin ecosystem.  Coinbase likes to point out that it is the only company in the bitcoin ecosystem that encompasses both consumers, merchants and developers.  “We are averaging 10,000 new customer sign-ups a day, and are now working with over 16,000 merchants including OkCupid, Khan Academy, and reddit, who use Coinbase to accept bitcoin,” said Coinbase.",POSITIVE,없음,BTC | BUSINESS | EXCHANGE | MARKET | REGULATION,Nermin Hajdarbegovic,0,0,CoinDesk,https://coindesk.com/markets/2013/12/12/coinbase-raises-25-million-in-bitcoins-biggest-ever-funding-deal,https://cdn.sanity.io/images/s3y3vcno/production/d2d2b62006bb4c2ed8cc1881ab80e53462e180b6-1000x667.jpg?w=300&h=300&fit=crop
42425192,sd6iOBkuiC3F0LYOyHvFhh,1386842431,What Do Australia's Biggest Banks Think About Bitcoin?,"Much like their counterparts in Europe and North America, banks in Australia have had mixed reactions to bitcoin.  While some financial institutions are working together with bitcoin businesses to understand the issues at hand, others have given conflicting messages, and at least one is ridding itself of bitcoin customers altogether.  Banks’ willingness to work with entrepreneurs in the bitcoin world is vital to building a healthy and stable bitcoin ecosystem.  Exchanges, ATMs, payment processors and even some face-to-face traders all need to move vast amounts of money through traditional financial networks, as they bridge the present gap between the fiat and cryptocurrency systems.  Banking reactions to bitcoin around the world have so far fallen into one of these categories:  1) Curiosity and a willingness to learn more.  2) Ignorance.  3) Suspicion of criminal activity and/or a threat to the banking industry’s business model.  There may also be opposing views within the banks, just as there are differing views on the banking industry among those involved with bitcoin.  Australia's banking industry is dominated by the 'Big Four' banking groups: the Commonwealth Bank of Australia (CBA), National Australia Bank (NAB), the Australia and New Zealand Banking Group (ANZ), and Westpac.  While there are other smaller players, anyone engaging in commerce in Australia is bound to encounter one of the Big Four at some stage.  Commonwealth Bank: avoiding bitcoin  Melbourne-based exchange CoinJar, which recently secured half a million US dollars in venture funding, was the highest-profile Australian company to feel their bank’s wrath so far. Back in August, the Commonwealth Bank froze transactions to and from CoinJar’s account.  In an additional move that sent chills through the entrepreneurial community, the bank also closed down the personal accounts of co-founders Asher Tan and Ryan Zhou without notification.  Though CoinJar has rebounded and gathered strength since, both actions by the bank harmed its daily operations as it tried to transact in dollars with customers, dealt with confusing explanations from the bank, and sought to defend its own reputation.  In addition, the Commonwealth Bank is said to have blacklisted Bitstamp, one of the world’s largest exchanges, and blocked payments to and from the company.  Customer Ian MacKay said he had used his CBA account to transfer to Bitstamp without issue in June 2013, but received a text message in November to contact the bank after attempting to send AU$10,000. He said:  “I was informed that they had blocked all transfers for all customers to that payment address. They promptly reversed it without charge.”  “When questioned they stated they were ‘not allowed’ to say anything more than that. I expressed polite dismay that CBA should choose the path of censorship when Bitstamp is clearly 100% above board and, as far as I know, Australia has basically said they will treat BTC like cash.”  MacKay then convinced the customer service representative to look into bitcoin for himself on “non-bank time.”  National Australia Bank: bitcoin friendly  In a twist of fate, a representative from another ‘Big Four’ bank, the National Australia Bank, approached Tan at a startup event and offered to help out.  CoinJar has spoken highly of NAB’s attitude to bitcoin and startup businesses in general, and have publicly recommended them to other entrepreneurs.  ANZ Bank: Mixed  But what of the other two major banks? ANZ appears mixed on the issue, with some customers receiving account closure notices and others (so far) receiving assistance combating fraud.  Chris Cameron, a doctor who trades on LocalBitcoins in his spare time, claims the ANZ bank is moving to close down his account and others. Chatting to fellow traders on LocalBitcoins, he discovered others have received notices advising them their accounts will be closed in January 2014.  Having previously had his Commonwealth Bank account closed around the same time as CoinJar’s, Cameron was dismayed at ANZ’s decision to follow suit:  “This is despite having an amazing credit rating and I am actually classified as a premium client of theirs,” he said.  “Therefore it seems that NAB is the only bank left in Australia with a favorable approach to bitcoins. Just thought I would let you know… now it seems that ANZ has also joined the anti-BTC.”  Another LocalBitcoins trader, Trent Churchill, told a different story. He had heard of three other ANZ customers involved with trading whose bank accounts had been compromised. This was ""most likely due to poor security on the customers’ part,"" and involved the theft of LocalBitcoins-related details.  Following this, Churchill personally experienced a number of attempts at fraudulent transactions by a user armed with the same previously-safe account details.  After one transaction had not cleared over a weekend, he contacted ANZ and was told a bank representative had been trying to get in touch with him. Upon reaching the appropriate department, he had the following exchange:  “‘So you trade bitcoins, do you?’ she asked. ‘Yes’ I replied. ‘Well I'm here to make that safer and more efficient’ she said. ‘We have many bitcoin-trading customers and some of them are very notable clients. We wish to work with them and help them trade safely.’ She then proceeded to tell me she was the lead fraud investigator of the ANZ Falcon Fraud Prevention Team and that I was not in any trouble. ‘In fact I'm now your personal fraud prevention officer,’ she said, and gave me details on how to contact her directly during business hours, and the fraud team after hours.”  “I was amazed at this bank’s attitude and helpful nature towards bitcoin,” Churchill added. “Very refreshing. I was able to point out that the local bitcoins account [in question] also had an ad for selling bitcoins for cash, and a street address had been left on the ad. I hope they nailed him.”  Joshua Ballard, who operates the online store Bit-Cash, spoke highly of ANZ, claiming the bank had actively helped him identify fraud.  “They are amazing in regards to my business. I have regular help and support with them, and a good dialogue with their fraud division who actively help me spot fraud in the making (when someone pays me with a hacked bank account for bitcoin). They have even spotted my losses a few times when the fraud has snuck through. Their main goal is to help me with my business, it seems.”  “ANZ has not officially stated anything about bitcoin, but by their actions and supportive frameworks i think that they are not anti-bitcoin, as they know well what I am doing. They are even happy about me starting with Litecoin.”  Westpac  There are fewer reports about the other ‘Big-Four’ bank, Westpac. Trent Churchill claimed he made a personal visit to a branch to talk with a manager about bank policy on digital currencies, but the manager seemed confused and had never heard anything about “Bit-o-coin.”  Building a Bitcoin Payment Infrastructure in Australia  Stephen Rowlison is the CTO of Diamond Circle Pty Ltd, which is attempting to introduce a bitcoin ATM and point-of-sale payment network featuring bitcoin transfer via near-field communication (NFC) tags to Australia.  Given bitcoin’s high value of late, Diamond Circle also wants to incorporate credit/debit card payment options into its machines, but Rowlison admits it has presented a “significant challenge” so far.  Building these extra functions into the ATMs has also brought the company into contact with the Australian Payments Clearing Association (APCA), a self-regulatory body which counts all major financial institutions among its members.  APCA has said little about bitcoin but mentions under 'Future of Payments' on its website: “New digital currencies, such as Bitcoin, may [...] reshape the payments landscape.”  While he has heard several other tales of Australian account shutdowns, Rowlison says he’s more concerned with the big players in the credit card industry.  “My issue presently is whether Visa and Mastercard will approve us to issue bitcoins from our ATM and merchant point-of-sale equipment. This is going to be a global decision.”  Failing these companies’ approval, bitcoin ATM users will find themselves feeding large quantities of paper (or in Australia’s case, polymer plastic) banknotes into the machine to get their bitcoins.  As long as some of their banks don’t find out what disruptive things they’re doing with that cash, it seems.  CoinDesk contacted a Commonwealth Bank spokesperson and ANZ Media Relations for comments, but had not received any responses at the time of writing.  Australian Dollar Image via Shutterstock",NEUTRAL,BTC,BTC | BUSINESS | EXCHANGE | FIAT | REGULATION,Jon Southurst,0,0,CoinDesk,https://coindesk.com/markets/2013/12/12/what-do-australias-biggest-banks-think-about-bitcoin,https://cdn.sanity.io/images/s3y3vcno/production/f3b9f48b256a0af9e4307544031b92a73840b957-1000x667.jpg?w=300&h=300&fit=crop
