뉴스ID,뉴스GUID,일자(UTC timestamp),뉴스제목,본문,SENTIMENT,주요코인,카테고리,작성자,추천수,비추천수,출처,뉴스URL,이미지URL
13249454,https://themerkle.com/?p=56706,1525879833,World Governments Target Summer 2018 To Regulate Cryptocurrencies,"A G-20 meeting attended by the world&apos;s economic leaders last month concluded that government regulations on cryptocurrencies were overdue. It was proposed that specific recommendations should be finalised by the summer of 2018. Disclosure: This is a Sponsored Article The mere mention of government regulations strikes fear into the hearts of cryptocurrency firms. Rumblings emerging from the financial sector typically call for a ban on digital currencies. Fortunately, some of the threats were laid to rest during the meeting between global watchdogs in Buenos Aires. Acting chairman of the Financial Stability Board, Mark Carney, declared that crypto-assets do not pose",NEGATIVE,없음,REGULATION | SPONSORED,,0,0,NullTx,https://themerkle.com/world-governments-target-summer-2018-to-regulate-cryptocurrencies/,https://images.cryptocompare.com/news/themerkle/8p2wyc91088.jpeg
13454269,http://bitcoinist.com/?p=67990,1525878933,TokenMarket Announces Inaugural Token Economy Conference in Gibraltar,"GIBRALTAR, GIB. MAY 9, 2018 - The leading ICO advisory firm TokenMarket is pleased to announce its inaugural blockchain event &apos;TokenMarket 2018: Insights into the Token Economy&apos;. The conference will be held on the five-star Sunborn Yacht Hotel in Gibraltar, taking place from the 28th to the 29th of June 2018. TokenMarket has confirmed a range of industry experts within the blockchain space including, William Mougayar, Simon Dixon, Jon Matonis, David Drake, and Ransu Salovaara.Read MoreThe post TokenMarket Announces Inaugural Token Economy Conference in Gibraltar appeared first on Bitcoinist.com.",POSITIVE,ICO,BLOCKCHAIN | ICO | TOKEN SALE,,0,0,Bitcoinist,https://bitcoinist.com/tokenmarket-announces-inaugural-token-economy-conference-gibraltar/,https://images.cryptocompare.com/news/bitcoinist/8w080000000.jpeg
42401492,DbF8Q09kuKX2XWBxAcztKc,1525878906,Sumatra to Pilot Blockchain App for 'Decentralised Decision-Making',"An Australian startup is launching a blockchain application in Indonesia that could eventually allow citizens to vote in elections.  The pilot project from Horizon State is expected to launch on the island of Sumatra in July, with the roll-out expected to continue till December, the platform's co-founder, Nimo Naamani, told CoinDesk via email.  The blockchain-based platform will be made available to locals via a mobile app and is initially aimed to help provide ""decentralised decision making and community engagement,"" according to Naamani.  Ultimately, the startup hopes the app could extend to voting to counter fraud and address local electoral challenges, as well as other services.  Naamani said:  ""Through the platform, we can provide communities with tools to increase engagement and discussions. Through our partners, we can provide the constituency with additional benefits such as access to financial services on a micro-level – something that’s not so easy with existing banking infrastructure.""  Should the Sumatra pilot prove successful, Horizon State is hoping to expand the project across the country.  ""Once this is done, I believe additional expansions into more provinces and communities will happen throughout 2019,"" he said.  While the Indonesian government is not involved in the effort as yet, he noted that the company would be in a position to approach the authorities over a variety of use cases, including elections, after the Sumatra roll-out.  ""We’re seeing a surge of interest from organisations that want to use blockchain-based community engagement to drive progress forward,"" Naamani said.  For the pilot, Horizon State will be partnering with cryptocurrency finance startup MCV-CAP, as well as another partner to be announced in the next few weeks, according to the co-founder.  Sumatran town image via Shutterstock",POSITIVE,없음,BLOCKCHAIN,Sujha Sundararajan,0,0,CoinDesk,https://coindesk.com/markets/2018/05/09/sumatra-to-pilot-blockchain-app-for-decentralised-decision-making,https://cdn.sanity.io/images/s3y3vcno/production/573a1257ed75db15f7871d80ca5be60fb1ea86c9-1500x878.jpg?w=300&h=300&fit=crop
13475000,https://www.trustnodes.com/?p=12714,1525878413,Is Facebook Planning a Token After Launching a Blockchain Unit?,"News that Facebook has launched a new internal team dedicated to exploring blockchain technology would have been stupendously big news last year. Now, nearing summer 2018, it is &apos;merely&apos; the...The post Is Facebook Planning a Token After Launching a Blockchain Unit? appeared first on Trustnodes.",NEUTRAL,없음,BLOCKCHAIN | ICO | TECHNOLOGY,,0,0,TrustNodes,https://www.trustnodes.com/2018/05/09/facebook-planning-token-launching-blockchain-unit,https://images.cryptocompare.com/news/trustnodes/bPk9kEgEk0g.jpeg
13238353,https://www.newsbtc.com/?p=331459,1525878058,"China Favors Blockchain for Logistics, Government, and Healthcare, Survey Finds","A joint survey conducted by PwC and VeChain between November and December 2017 has found that logistics, government, and medical services are the sectors with the greatest potential to adapt blockchain technology in China. PwC and VeChain Survey Finds Logistics, Government, and Healthcare Are Favorites for Blockchain Adoption The Popular Republic of China has declared...The post China Favors Blockchain for Logistics, Government, and Healthcare, Survey Finds appeared first on NewsBTC.",POSITIVE,없음,ASIA | BLOCKCHAIN | TECHNOLOGY,,0,0,NewsBTC,https://www.newsbtc.com/2018/05/09/china-favors-blockchain-logistics-government-healthcare-survey-finds/,https://images.cryptocompare.com/news/newsbtc/cbwayo9Gg0M.jpeg
13249455,https://themerkle.com/?p=56629,1525878054,Buying Apple Shares 10 Years Ago Yielded Meager Returns Compared to Bitcoin,"There have been numerous investment opportunities over the past few decades. Especially where technology companies are concerned, the returns have been quite spectacular at times. Even so, almost none of those returns can hold a candle to the gains enjoyed by investing in Bitcoin and other cryptocurrencies. Even Apple&apos;s stock doesn&apos;t come anywhere close to the actual year-by-year performance of Bitcoin. Apple Stock Is a Minor Investment A recent article on CNBC.com explained how people could have gotten rich by buying Apple stock ten years ago. While the company still had a lot to prove back then, these investments have proven to be relatively successful in the",POSITIVE,없음,BTC | BUSINESS | TECHNOLOGY,,0,0,NullTx,https://themerkle.com/buying-apple-shares-10-years-ago-yielded-meager-returns-compared-to-bitcoin/,https://images.cryptocompare.com/news/themerkle/ewwx026O402.jpeg
13454270,http://bitcoinist.com/?p=67973,1525878048,Xapo Vaults Store $10 Billion in Bitcoin as Investors Stir,"Cryptocurrency wallet and cold storage provider Xapo now holds around $10 billion in Bitcoin, sources have said. $10 Billion On 5 Continents Speaking to Bloomberg about the startup&apos;s network of underground vault, two clients and a further anonymous source &apos;close to the venture&apos; confirmed the figure was an &apos;accurate approximation&apos; of its holdings. Xapo made headlines when it began storing Bitcoin in a mountainside vault in Switzerland after moving to the country from California. Now,Read MoreThe post Xapo Vaults Store $10 Billion in Bitcoin as Investors Stir appeared first on Bitcoinist.com.",POSITIVE,없음,BTC | BUSINESS,,0,0,Bitcoinist,https://bitcoinist.com/xapo-vaults-store-10-billion-bitcoin-investors/,https://images.cryptocompare.com/news/bitcoinist/e9vfdg000wa.jpeg
13365796,https://cointelegraph.com/news/world-first-universal-wallet-for-crypto-and-tokens-launches-new-features,1525877483,‘World First’ Universal Wallet For Crypto And Tokens Launches New Features,A company says it has achieved a &apos;world first&apos; by creating a wallet that can store major cryptocurrencies and smart contract tokens in one place #SPONSORED,POSITIVE,없음,BLOCKCHAIN | DOGE | ETH | ICO,,0,0,CoinTelegraph,https://cointelegraph.com/news/world-first-universal-wallet-for-crypto-and-tokens-launches-new-features,https://images.cryptocompare.com/news/cointelegraph/d3wky5HT0Ue.jpeg
13249456,https://themerkle.com/?p=56690,1525876210,Tearing Down the Barriers Holding Back Mainstream Crypto Adoption,"Ever since the cryptocurrency markets gained mainstream attention towards the end of 2017, there&apos;s been a lot of talk about integrating cryptocurrency into day-to-day transactions. Even though we&apos;re currently experiencing a boom in blockchain development, cryptocurrencies are still looked at as more of a niche investment than actual money. In fact, less than 20% of North Americans who own cryptocurrency use it for ecommerce; and slightly more than 30% of Europeans and Asian holders use cryptocurrency to buy things. Disclosure: This is a Sponsored Article The problem is that cryptocurrency is still targeting a very specialized group of people, many",NEUTRAL,없음,BLOCKCHAIN | MARKET | SPONSORED,,0,0,NullTx,https://themerkle.com/tearing-down-the-barriers-holding-back-mainstream-crypto-adoption/,https://images.cryptocompare.com/news/themerkle/8M0cg3c0300.png
13365797,https://cointelegraph.com/news/winklevoss-twins-gain-fifth-patent-for-exchange-traded-products-using-crypto,1525874857,Winklevoss Twins Gain Fifth Patent For Exchange-Traded Products Using Crypto,"Cameron and Tyler Winklevoss have won their fifth patent this year, which refers to crypto-based exchange-traded products (ETPs)",POSITIVE,없음,BTC | ETH,,0,0,CoinTelegraph,https://cointelegraph.com/news/winklevoss-twins-gain-fifth-patent-for-exchange-traded-products-using-crypto,https://images.cryptocompare.com/news/cointelegraph/cI0jw3k06w0.jpeg
13249457,https://themerkle.com/?p=56631,1525874453,World of Warcraft Virtual Gold Continues to Gain on the Venezuelan Bolivar,"There is never a boring day in the world of finance. While most developments are not interesting to a lot of people, some trends are quite peculiar. Venezuela&apos;s bolivar, for example, has devalued so much over the past few years, it is now worth one-seventh of the gold in World of Warcraft. The Venezuelan Bolivar is a Joke Currency Anyone who has paid any attention to economic developments in Venezuela knows the country is not in a good place right now. There has been a lot of pressure on the bolivar, and it seems things will not improve anytime soon. In fact,",NEGATIVE,없음,FIAT,,0,0,NullTx,https://themerkle.com/world-of-warcraft-virtual-gold-continues-to-gain-on-the-venezuelan-bolivar/,https://images.cryptocompare.com/news/themerkle/86ka60Ag130.jpeg
42401503,DbF8Q09kuKX2XWBxAcztSU,1525874418,EOS Looks Poised for a Move Toward Record Highs,"EOS seems to be preparing for a move back toward all-time highs, price chart analysis indicates.  The cryptocurrency's pullback from the April 29 record high of $23.03 on the Bitfinex exchange ran out of steam near $15.71 – the 38.2 percent Fibonacci retracement of the rally from the March 18 low of $3.87 to April 29 high.  Stepping back a bit, the 38.2 percent Fibonacci retracement is one of the three golden ratios of technical analysis, with the others being 50 and 61.8 percent. They are often considered strong support/resistance levels. If prices break below the 38.2 percent Fibonacci retracement level, then the next support is the 50 percent, followed by 61.8 percent.  However, if the 38.2 percent support level holds, as is the case with EOS currently, then it is considered a sign a pullback has run its course.  EOS daily chart  As seen in the chart above, EOS bounced-off from near 38.2 percent Fibonacci retracement support on May 1 and seems to have built a base around $16.30 in the eight days since.  Notably, daily trading volumes have dropped sharply in the last two weeks, indicating the pullback is likely nothing more than a bout of profit-taking.  Further, the long-run momentum studies are biased bullish (sloping upwards). For instance, the 20-day and 50-day moving averages (MAs) are trending up and EOS is sitting well above those levels.  EOS/USD longs peak on Bitfinex  Interestingly, EOS/USD long trades on Bitfinex have risen to record highs, despite the pullback and recent sideways action in prices, indicating that dips are being viewed as buying opportunity.  Hence, EOS looks likely to scale the $20 mark soon and could have another go at the record high of $23.03 ahead of the mainnet launch, scheduled for June 2 – an event keenly anticipated by the community and investors.  As of writing, EOS is trading at $17.81 on Bitfinex – down 0.78 percent from the previous day's close of $17.95. The cryptocurrency notably rallied 193 percent in April and was the best performing top 25 cryptocurrency by market capitalization.  View  EOS could re-test $20.00 in a few days and may find acceptance above that psychological hurdle. In such a case, a rally to fresh record highs above $23.029 cannot be ruled out.  On the downside, a daily close below $15.71 (38.2 percent Fibonacci retracement level) would signal the rally from the March 18 low of $3.87 has ended and could yield a deeper pullback to $11.19 (61.8 percent Fibonacci retracement).  Additionally, prices could suffer an exaggerated drop on even slightly bad news, courtesy of extreme positioning as represented by record EOS/USD long trades on Bitfinex.  Building blocks image via Shutterstock",POSITIVE,없음,EXCHANGE | MARKET | TRADING,Omkar Godbole,0,0,CoinDesk,https://coindesk.com/markets/2018/05/09/eos-looks-poised-for-a-move-toward-record-highs,https://cdn.sanity.io/images/s3y3vcno/production/f4dbbd165b4f3642ae87ad85b6958d07e660511b-1500x1026.jpg?w=300&h=300&fit=crop
13238354,https://www.newsbtc.com/?p=331419,1525874416,OmiseGO to Initiate Decentralization In Q4 2018,"OmiseGO, a decentralized cryptocurrency exchange issued on Ethereum who has raised $25 million in its initial coin offering in Q2 2017, has updated its roadmap to clarify the timelines and milestones ahead. OmiseGO Shares Updated Visual Roadmap The dynamic, evolving process, which has started with the ICO in Q2 2017, was followed by an airdrop...The post OmiseGO to Initiate Decentralization In Q4 2018 appeared first on NewsBTC.",POSITIVE,BTC | ICO,ALTCOIN | BLOCKCHAIN | BTC | ICO | TOKEN SALE,,0,0,NewsBTC,https://www.newsbtc.com/2018/05/09/omisego-to-initiate-decentralization-in-q4-2018/,https://images.cryptocompare.com/news/newsbtc/ci4J3Ms10h0.jpeg
13365798,https://cointelegraph.com/news/local-media-belarus-to-introduce-education-income-requirements-to-invest-in-icos-crypto,1525873870,"Local Media: Belarus To Introduce Education, Income Requirements To Invest In ICOs, Crypto","The Belarusian national bank is reportedly introducing educational standards, and a minimum income in order to invest in ICOs and trade on crypto exchanges",NEUTRAL,ICO,FIAT | ICO | TOKEN SALE,,0,0,CoinTelegraph,https://cointelegraph.com/news/local-media-belarus-to-introduce-education-income-requirements-to-invest-in-icos-crypto,https://images.cryptocompare.com/news/cointelegraph/fIzM80c00Og.jpeg
13475001,https://www.trustnodes.com/?p=12708,1525873259,SEC Commissioner: “Technological Progress Should Not be Bound by The Limits of the Regulator’s Lawyerly Imagination”,Trump appointed SEC Commissioner Hester Peirce has become the first senior official at the SEC to thoroughly address the role of SEC in the tokens and ICO space during a...The post SEC Commissioner: &apos;Technological Progress Should Not be Bound by The Limits of the Regulator&apos;s Lawyerly Imagination&apos; appeared first on Trustnodes.,POSITIVE,ICO,ETH | ICO | REGULATION | TOKEN SALE,,0,0,TrustNodes,https://www.trustnodes.com/2018/05/09/sec-commissioner-technological-progress-not-bound-limits-regulators-lawyerly-imagination,https://images.cryptocompare.com/news/trustnodes/ds023r06Ei0.jpeg
13439044,https://news.bitcoin.com/?p=158125,1525873239,Researchers Find Bitcoin Network 3X More ‘Evil’ Than the Public Internet,"Just recently a research group called Rapid7 published a report that reveals over a year&apos;s worth of research regarding malicious activity tethered to Bitcoin Core (BTC) full nodes. By utilizing data collected from a network called &apos;Project Heisenberg,&apos; and its internet scanner &apos;Project Sonar,&apos; alongside intelligence from Bitnodes, the team had found quite a lot ...The post Researchers Find Bitcoin Network 3X More &apos;Evil&apos; Than the Public Internet appeared first on Bitcoin News.",NEGATIVE,BTC,ASIA | BLOCKCHAIN | BTC | RESEARCH,,0,0,Bitcoin.com,https://news.bitcoin.com/researchers-find-bitcoin-network-3x-more-evil-than-the-public-internet/,https://images.cryptocompare.com/news/bitcoin.com/df2rhMUqcoj.jpeg
13249458,https://themerkle.com/?p=56685,1525872629,DEEP AERO Deploys Drone Marketplace by Leveraging Blockchain and AI,"DEEP AERO is a young company that aims to accelerate the drone technology adoption by smartly leveraging innovative technologies like blockchain and artificial intelligence (AI). Based in the United Arab Emirates (UAE), the startup is currently conducting its initial coin offering (ICO) and hopes to launch three revolutionary products in line with its roadmap. Disclosure: This is a Sponsored Article For those unfamiliar with such machines, the drones, also referred to as unmanned aerial vehicles (UAVs), are aircraft units that operate without human pilots. The UAVs can be controlled remotely by a human operator or can fly autonomously based on",POSITIVE,ICO,BLOCKCHAIN | ICO | SPONSORED | TECHNOLOGY | TOKEN SALE,,0,0,NullTx,https://themerkle.com/deep-aero-deploys-drone-marketplace-by-leveraging-blockchain-and-ai/,https://images.cryptocompare.com/news/themerkle/cUzsYi7g0xw.png
13238355,https://www.newsbtc.com/?p=331461,1525871262,SportyCo’s World Sports Blockchain Summit to Introduce Blockchain-Based Crowd-Financing to Sports Industry,"The innovative blockchain based sports microfinancing platform, SportyCo is further encouraging the use of cryptocurrency technology in world sports by organizing the World Sports Blockchain Summit. It is going to be one of the largest live online events, targeting crypto investors, athletes and sports enthusiasts. The initiative has received support from some of the leading...The post SportyCo&apos;s World Sports Blockchain Summit to Introduce Blockchain-Based Crowd-Financing to Sports Industry appeared first on NewsBTC.",POSITIVE,없음,BLOCKCHAIN | BUSINESS | SPONSORED | TECHNOLOGY,,0,0,NewsBTC,https://www.newsbtc.com/2018/05/09/sportyco-world-sports-blockchain-summit-introduce-sports-crowdfinancing/,https://images.cryptocompare.com/news/newsbtc/9k2u1yFwk9C.png
13249459,https://themerkle.com/?p=56636,1525870851,Cryptocurrency Scam Education: Proof of Trevon James,"Scammers are a very big problem in the world of cryptocurrency right now. A lot of people see this industry as a get-rich-quick scheme even though it is nothing of the sort. Addressing these scammers is also difficult; if it were easy, individuals such as Trevon James wouldn&apos;t be around any longer. In reality, however, James is able to issue his own &apos;tewkens&apos; in an effort to rip off even more people. The Proof of Trevon James Scam Anyone who has kept an eye on developments in the world of cryptocurrency will recall the rise and subsequent implosion of BitConnect. Even though",NEGATIVE,없음,OTHER,,0,0,NullTx,https://themerkle.com/cryptocurrency-scam-education-proof-of-trevon-james/,https://images.cryptocompare.com/news/themerkle/b10w0200000.jpeg
42401487,DbF8Q09kuKX2XWBxAcztFh,1525870842,Crypto Exchange Coinone Taps Ripple for New Remittance Service,"South Korean cryptocurrency exchange Coinone is turning to Ripple's enterprise blockchain network for cross-border payments.  Coinone Transfer, an arm of the exchange that focuses on remittances, joined RippleNet on Monday, making it the first exchange in the nation to do so. The firm will be using xCurrent, one of Ripple’s three blockchain solutions, a press release states  Citing World Bank data that shows that there has been an increase in volume of international remittances from South Korea over the past decade, the firm said it plans to launch a new remittance service called Cross to be powered by xCurrent. The product will target workers in South Korea who want to send funds back to family across Southeast Asia.  Wonhee Shin, CEO of Coinone Transfer, said the xCurrent solution allows the firm to offer customers a ""real-time, low-cost global remittance service.""  The news arrives a week after Muscat-based financial management firm Bank Dhofar become the first Oman bank to join RippleNet.  And back in in February, two banks and three money remittance companies from four different countries Brazil, India, Singapore and Canada adopted various Ripple platforms to facilitate real-time international payments.  Korean won and accounts image via Shutterstock",POSITIVE,없음,ASIA | BLOCKCHAIN | EXCHANGE | FIAT | SPONSORED,Sujha Sundararajan,0,0,CoinDesk,https://coindesk.com/markets/2018/05/09/crypto-exchange-coinone-taps-ripple-for-new-remittance-service,https://cdn.sanity.io/images/s3y3vcno/production/54691ae27f1eec9a4d4ec14c37334ce6966554cb-1500x1075.jpg?w=300&h=300&fit=crop
13454271,http://bitcoinist.com/?p=67935,1525870818,"Facebook Creates Blockchain Research Group With Messenger, Instagram Execs","Facebook is dedicating the head of its Messenger app to launch a Blockchain research push as part of a senior staff reshuffle. &apos;Starting From Scratch&apos; On Blockchain As Recode originally reported, a shift of responsibilities at the top of the social media giant will see sub-owned brands such as Whatsapp and Instagram move in closer with central management. Messenger&apos;s David Marcus, who has overseen development since 2014, will change tact completely, heading what he describesRead MoreThe post Facebook Creates Blockchain Research Group With Messenger, Instagram Execs appeared first on Bitcoinist.com.",POSITIVE,없음,BLOCKCHAIN | RESEARCH,,0,0,Bitcoinist,https://bitcoinist.com/facebook-blockchain-research-messenger-instagram/,https://images.cryptocompare.com/news/bitcoinist/c5ww90Mw500.jpeg
13365799,https://cointelegraph.com/news/chinas-2nd-largest-bitcoin-mining-hardware-producer-plans-to-launch-1-bln-ipo-in-hong-kong,1525870036,China's 2nd Largest Bitcoin Mining Hardware Producer Plans To Launch $1 Bln IPO In Hong Kong,"China&apos;s second-largest BTC mining hardware manufacturer is planning to list a $1 bln IPO on the Hong Kong Stock Exchange, local media reports",POSITIVE,BTC,ASIA | BTC | BUSINESS | MARKET | MINING,,0,0,CoinTelegraph,https://cointelegraph.com/news/chinas-2nd-largest-bitcoin-mining-hardware-producer-plans-to-launch-1-bln-ipo-in-hong-kong,https://images.cryptocompare.com/news/cointelegraph/aIhhK0p0B02.jpeg
13238356,https://www.newsbtc.com/?p=331417,1525869021,Chinese Blockchain Industry Thriving Despite ICO Ban,"Despite China&apos;s ban on trading cryptocurrency and ICO&apos;s the blockchain industry is growing exponentially, says Managing Director of the Floor, Hong Kong. Crypto Trading and ICOs are a No No &apos;The situation with China is a little bit sensitive at this point around here.&apos; Said Desmond Marshall in a recent interview with Finance Magnets regarding the status...The post Chinese Blockchain Industry Thriving Despite ICO Ban appeared first on NewsBTC.",POSITIVE,ICO,ASIA | BLOCKCHAIN | ICO | TRADING | TOKEN SALE,,0,0,NewsBTC,https://www.newsbtc.com/2018/05/09/in-china-crypto-is-a-no-no-but-blockchain-thrives-according-to-md-of-the-floor-hk/,https://images.cryptocompare.com/news/newsbtc/99FACmmp94P.jpeg
13249460,https://themerkle.com/?p=56682,1525869012,ImmVRse VR Blockchain Educational Platform Partners With Basis Neuro,"ImmVRse is a blockchain based startup that focuses on utilizing VR as an educational platform, focusing on learning and teaching in a revolutionary way. Disclosure: This is a Sponsored Article While VR&apos;s first major market was video games and entertainment, it has also made its way into classrooms due to the potential benefits it has for both students and teachers. Students could apply new skills in simulated environments, record and track their progress, as well as allow them to connect with experts, all from one headset. VR could produce engaged students with better grades Keeping students engaged is a problem,",POSITIVE,없음,BLOCKCHAIN | MARKET | SPONSORED,,0,0,NullTx,https://themerkle.com/immvrse-vr-blockchain-educational-platform-partners-with-basis-neuro/,https://images.cryptocompare.com/news/themerkle/d1qwa23o1w4.png
13238357,https://www.newsbtc.com/?p=331455,1525868975,A White Label Solution to Easily Set up Exchange Platforms,"Stoxum is introducing a hybrid cryptocurrency exchange system that comes with a white label solution to help companies to set up their exchange platforms. After a gloomy winter, the cryptomarket is returning to a bullish sentiment and the doom and gloom predictions are looking up. Interest in the market continues to grow, making it attractive...The post A White Label Solution to Easily Set up Exchange Platforms appeared first on NewsBTC.",POSITIVE,없음,EXCHANGE | MARKET | SPONSORED | TRADING,,0,0,NewsBTC,https://www.newsbtc.com/2018/05/09/white-label-solution-easily-set-exchange-platforms/,https://images.cryptocompare.com/news/newsbtc/eo0Og0S0000.png
