뉴스ID,뉴스GUID,일자(UTC timestamp),뉴스제목,본문,SENTIMENT,주요코인,카테고리,작성자,추천수,비추천수,출처,뉴스URL,이미지URL
42425201,sd6iOBkuiC3F0LYOyHvFxh,1386863797,Baidu-owned Hao123 Launches Dedicated Bitcoin News Portal,"There were signs of bitcoin life from Chinese internet giant Baidu this week: Hao123, one of its subsidiaries and China's largest web directory, launched a dedicated bitcoin channel and news aggregator for bitcoin-related stories.  The launch  happened the same day another of Baidu's subsidiaries, Jiasule, announced it would stop, or 'pause', accepting bitcoin payments for its security software.  Jiasule's impact  Jiasule caused an initial stir with its decision to accept bitcoin, leading to headlines suggesting the so-called 'Google of China' was now accepting bitcoin. It was also cited as a reason for bitcoin's recent drop in value, after it announced the suspension.  It should be noted that Hao123 is not actually selling anything, nor accepting bitcoin for payment.  As well as headlines for all the latest bitcoin news, the new site also features a chart with all the latest bitcoin (and even litecoin) exchange rates in Chinese yuan from the leading exchanges.  There is a timeline of major events in the history of the world's first cryptocurrency, starting from ""January 3rd 2009: Satoshi Nakamoto mined the first 50 Bitcoins on a server located in Helsinki, Finland,"" and ending with ""Future: ?""  Alexa ranks  Hao123's traffic 17th globally and 5th in China.  Central bank statements  Baidu's Jiasule Internet security service cited volatility in bitcoin exchange rates and the People's Bank of China's December 5th announcement as reasons for suspending bitcoin payments.  The central bank's statement denied bitcoin's official status as a currency, due to its decentralized and multi-national nature – barring Chinese financial institutions from trading in bitcoins.  Jiangsu Telecom, a subsidiary of China Telecom, also withdrew its bitcoin payment promotion at the same time.  Speculators wondered if the decision had been prompted by orders from government officials, leading to fears the Chinese authorities were about to crack down on bitcoin use. Bitcoin fell from an all-time high of over $1,200 to under $700 just minutes after the news broke.  Redditer 'okahira' pointed out that Hao123 actually added its bitcoin news page at the very same time Jiasule removed their payment option, but the news had been drowned out.  'Ordinary people'  Of course, simply posting news about bitcoin is not the same as accepting it for payment. So far, no major mainland Chinese site has re-introduced bitcoin as a payment option. However, Hao123's actions do indicate a high-level of interest among Chinese internet users.  The central bank's statement also made it clear that ordinary people were free to trade and use bitcoin; the directive applied only to 'financial institutions.'  This means bitcoin in China is now regulated by the Ministry of Industry and Information Technology (MIIT).  Banker Joseph Wang's explanation on Quora gave a clearer view of the scene; suggesting the statement was no big deal.  Reddit user 'JChief' added that this meant there was now a regulator for bitcoin where previously there had been none, and as such it was prudent for any Baidu or China Telecom subsidiaries to stop accepting bitcoin until they received further advice.  ""It would be idiotic and very much unlike how China works, if they continued to accept bitcoin without guidance from the MIIT,"" he wrote.  At the time of writing, bitcoin's value on BTC China was CNY 5,398.98 ($889.26), down from yesterday's high of CNY 6,059.98 ($998).  Story co-authored with Eric Mu  Web Address image via Shutterstock",NEUTRAL,BTC,ASIA | BTC | EXCHANGE | FIAT | LTC,Jon Southurst,0,0,CoinDesk,https://coindesk.com/markets/2013/12/12/baidu-owned-hao123-launches-dedicated-bitcoin-news-portal,https://cdn.sanity.io/images/s3y3vcno/production/89652ccec78498a358b6c3e24e87ffac3ab0b2a0-1000x665.jpg?w=300&h=300&fit=crop
42425206,sd6iOBkuiC3F0LYOyHvG3h,1386859548,Lemon Wallet Acquired by LifeLock for $42.6 Million,"Identity theft protection company LifeLock has acquired Lemon Inc, creator of an innovative digital wallet, for $42.6m.  Lemon Wallet launched in 2012 with the aim of ""delivering the most consumer focused, secure and innovative digital wallet experience on the market"".  The app was initially designed as a backup of a physical wallet, but it went on to develop more and more useful features, with users being able access real time account balances and fraud alerts.  LifeLock launched its own new app today – LifeLock Wallet – which utilizes all of Lemon's technology to aid users in the management and protection of their digital identity.    Exciting news today: @LifeLock acquires @LemonWallet and releases new LifeLock Wallet http://t.co/F8joixYccJ      — LifeLock (@LifeLock) December 12, 2013        Back in August, Wences Casares, founder and CEO of Lemon, said he was looking into supporting bitcoin on Lemon Wallet, but this wasn’t implemented before the sale of Lemon Inc. He told CoinDesk today that the LifeLock Wallet will not integrate bitcoin as it ""is not, and will not be, a transactional product"".  ""It is about keeping your transactional identity handy in your phone and making it secure,"" he added.  Casares, personally, is still a big believer in digital currency, though, reiterating what he said back in August: ""I think bitcoin is going to do for money what TCP/IP did to information. [It is] probably the most revolutionary technology since the Internet itself.”  Speaking about today's acquisition, LifeLock CEO Todd Davis said:  “The acquisition of Lemon dramatically expands our mobile capabilities, enabling us to launch a robust consumer wallet app in the marketplace on day one. The innovation and expertise from a mobile-first company like Lemon gives us powerful new ways to engage with current and future members.”  Lemon Wallet was downloaded more than 3.6m times, enabling users to store a digital copy of the contents of their wallets. This means users could keep a record of their credit card numbers, loyalty card details, ID card information and much more.  “At Lemon, we’ve built our business around digitizing everything in your physical wallet and making it available anywhere and anytime on your smartphone,” said Casares, adding:  “Joining forces with LifeLock makes tremendous strategic sense and provides something completely new in the market: a digital wallet combined with a way to help protect it.""  He said that now that LifeLock's acquisition of Lemon is complete, his role is to run LifeLock's mobile division.  LifeLock was founded in 2005 and has raised $178m in funding, with investors including Goldman Sachs and Symantec, according to Crunchbase.  Lemon received $8m in Series A funding back in June 2012. The company's investors included Maveron, CampVentures and Lightspeed Venture Partners, which was part of a $5m funding round for bitcoin exchange BTC China last month.",POSITIVE,BTC,ASIA | BTC | BUSINESS | EXCHANGE | TECHNOLOGY,Emily Spaven,0,0,CoinDesk,https://coindesk.com/markets/2013/12/12/lemon-wallet-acquired-by-lifelock-for-426-million,https://cdn.sanity.io/images/s3y3vcno/production/5b021f9206669b42abab53c5e2b087d9132d24ed-989x698.png?w=300&h=300&fit=crop
42425202,sd6iOBkuiC3F0LYOyHvG1h,1386856844,Bitcoin Foundation Officially Launches International Chapters,"The Bitcoin Foundation has officially rolled out its internationalization programme, signing national affiliates in Canada and Australia, just as another organization makes plans to promote bitcoin on a global basis.  The Global Bitcoin Alliance, with members across the globe, will take a fundamentally different approach.  The Foundation  is requesting affiliate chapters to pay the Foundation directly for membership, under what executives are calling a 'membership sharing arrangement'.  In contrast, the Global Bitcoin Alliance will be a loose group of regional bitcoin associations, which retain complete autonomy and are not required to share members with a single organization.  The Foundation, which began in the US, marked the initiative by opening its London office. It will be headed by Jon Matonis, executive director of the Bitcoin Foundation and a contributing editor to CoinDesk.  [post-quote]  The Foundation has already signed the Bitcoin Association of Australia and the Bitcoin Embassy in Canada under its international affiliate program. It also has a memoranda of understanding with groups in India and Argentina, and has received ""strong interest"" from China, Germany, and the Netherlands.  It is offering considerable benefits to affiliates who sign up. Namely, reimbursement of the expenses for their paperwork, and the ability to use the Bitcoin Foundation brand.  It will also provide logistical support in areas such as handling press queries, should a local affiliate be unable to deal with a request.  The 15-month old Bitcoin Foundation, which has over a thousand members, has become one of the most powerful organizations in the bitcoin community. Its executives testified at a recent US Senate hearing into the virtual currency.  “We believe that we can achieve bitcoin’s potential and promise if we are just a little more organized in our efforts,” said the Bitcoin Foundation’s director of public affairs Jinyoung Englund, who has been advocating a hands-off approach to affiliates. She added:  “We don’t need to control the future of bitcoin, but we want to facilitate an environment where we can develop a network of local communities.”  How affiliate membership works  The process for becoming an affiliate starts with a memorandum of understanding (MOU).  This lets potential affiliates spend between 30 and 60 days negotiating contract terms and organizing local administrative paperwork, for which they are reimbursed.  This includes picking a name and deciding on a local leadership structure. The Bitcoin Foundation does not control the appointment of board members, although it does request that affiliates have at least five board members.  However, there is at least one area in the Foundation’s template affiliate agreement that has been causing concern with potential affiliates: membership sharing.  A local organization would have to ask its members to pay any membership dues to the Bitcoin Foundation. The Foundation would then pay a proportion of that membership back to the affiliate, based on the proportion of members that they bought to the overall Bitcoin Foundation membership.  If an organization was already charging fees to its own members, then there would have to be a “transition period,” said Englund, who insists that this is negotiable.  “The group that reached out to us reads it, and if they don’t like something then we discuss it,” she said of the template agreement.  Regional pushback  However, the clause seems to be enough of a sticking point for the Foundation that it contributed to the collapse of at least one affiliate negotiation.  By the time the Bitcoin Embassy committed to the affiliate program, the Bitcoin Alliance, another organization representing bitcoiners in Canada with 150 members, had already passed. Alliance leader Anthony Di Iorio had balked at the membership part of the agreement.  “We are glad that we are keeping all of our membership,” he said, adding that he still looked forward to working with both the Bitcoin Embassy and the Bitcoin Foundation.  “We would like to work with anybody. We just feel better taking our membership, and not forcing people to join or combine memberships if they don’t want to.”  Englund argued that membership sharing is a reasonable request, given the benefits that the Foundation brings to the affiliates.  She insisted that the Foundation remains sensitive to local bitcoin groups’ needs, and does not want to control their memberships under the affiliate agreement.  “I’d quote Bill Cosby. The fastest road to failure is trying to please everybody,” she said. “We’re not trying to pre-emptively stop anyone from building their own initiatives or trying to start their own memberships.”  She cited the bitcoin grant and sponsorship programs as prime examples. “We support people who aren’t members, who are not doing things that are on our agenda.”  Nevertheless, others also expressed concerns over the affiliate agreement this week. “We believe it is not between equals. The central Bitcoin Foundation [has] much more rights compared to the affiliates,” said Mats Henricson, organizer of the Stockholm bitcoin meetup, and a main contributor to the Java Bitcoin API – citing personal views which he said were in line with those of his peers in Sweden. Henricson said:  “We also believe too much money ends up in the US. We have objections to the proposed split of money, where large affiliates would get more % of the money [sic] compared to small affiliates.”  He plans to create an independent association alongside his colleagues, he added.  “If Bitcoin Foundation is serious about this, then they should start by creating a US affiliate, and make a proper split with the central foundation,” he continued.  The US part of the Foundation’s membership is in the process of becoming a subsidiary, which is a larger organization with “more responsibility” than an affiliate, said Englund.  Subsidiaries will sit underneath the international Bitcoin Foundation, just as affiliates do. There are no concrete plans to create other subsidiaries at this time, and the US subsdiary will retain all of its membership fees.  The Global Bitcoin Alliance  Key members of the Israeli bitcoin community have also reconsidered their relationship with the Foundation, postponing joining the Bitcoin Foundation indefinitely due to what insiders call “several disagreements with them”.  “We currently prefer to adopt a bottom-down grassroots approach,” said Ron Gross, founder of Israeli bitcoin startup BitBlu.  “Each country elects their representative organizations, and these organizations form a loosely-coupled global organization.”  Gross is said to be a key driver behind this loosely-coupled collection of organisations, named the Global Bitcoin Alliance.  Gross is also the executive director of the Mastercoin Foundation, which is an effort to promote a new protocol layer designed to run on top of bitcoin, adding new features to it. Mastercoin is also designed so that it could migrate away from the bitcoin block chain in the future.  The Global Bitcoin Alliance was conceived in September at Amsterdam’s Bitcoin Europe conference, when various groups met to discuss the Bitcoin Foundation’s internationalization proposals, says Di Iorio, who is also involved in the initiative.  Currently, it consists of a Google Group mailing list, with several participating groups from around the world. It will differ from the Foundation's approach in that it will be flat, non-hierarchical and entirely decentralized, he argued. Di Iorio said:  “It will share resources and help to expedite the growth of communities worldwide, without tying ourselves down to each other. It’s very loose fitting. In no way do we believe that we should be decentralized in one organization in different countries. It’s a collaborative, independent organization.”  Although the Alliance hasn’t officially launched, it has retained a marketing organization, and should be sending out a press release soon, said Di Iorio.  Some are happy about membership sharing  Some are happy with the proposed membership agreement, however.  Bitcoin Argentina  , which has signed an MOU with the Foundation, sees it positively. The organization brings 150 “collaborators” and hundreds of additional supporters to the Foundation, said co-founder Rodolfo Andragnes, adding that the organization had already planned to begin asking for some paid memberships.  The Foundation has proven open to negotiations on a per-country basis, said Andragnes, adding that Bitcoin Argentina is also hoping to expand to form eight new foundations in Spanish-speaking countries within South America.  “We expect that our supporters also understand the need of supporting a global Foundation with their payment to us,” he said.  Lars Holdgaard, co-organiser of Dansk Bitcoinforening (the Danish Bitcoin Foundation), was also generally positive about the Bitcoin Foundation’s proposal.  “We're definitely positive. It's a fair and good affiliate contract, but of course there are points we have to discuss and agree upon,” he said.  Dansk Bitcoinforening hadn’t agreed on the membership sharing position, he admitted, under which the Bitcoin Foundation has asked for 50% of their membership fees. “But we're positive towards that as well, because they bring good things to the table.”  The Bitcoin Foundation’s membership is charged in bitcoin prices (from the Coindesk Bitcoin Price Index) that fluctuate regularly to reflect the price of the virtual currency. There is no free membership option for the Foundation.  World Map image via Shutterstock",POSITIVE,없음,ASIA | BTC | MARKET | SPONSORED | TRADING,Danny Bradbury,0,0,CoinDesk,https://coindesk.com/markets/2013/12/12/bitcoin-foundation-officially-launches-international-chapters,https://cdn.sanity.io/images/s3y3vcno/production/729680e53d5779023036d8774789a938a9e15972-1000x679.jpg?w=300&h=300&fit=crop
42425204,sd6iOBkuiC3F0LYOyHvG5h,1386853944,BTC China Reports 10x Volume Increase From $5 Million to $50 Million at Inside Bitcoins,"It was representatives from BTC China who stole the show at day two of the Inside Bitcoins conference in Las Vegas, Nevada.  The day started out with ‘A Practical Guide to Bitcoin Compliance and Regulation’ hosted by Bill Haraf, Managing Director of Promontory Financial Group and Adam Shapiro, the Group's Director.  The two were both in agreement that consumer compliance would be big in 2014.  Following this, Steve Beauregard, CEO & Founder of GoCoin, talked about existing value systems that bear similarities to virtual currencies – like the ‘token economy’ that exists in credit card rewards. “You have loyalty points, other things in the ‘token’ economy,” he explained.  Interestingly enough, Beauregard pointed to gifts and donations as the biggest payment methods of virtual currencies like bitcoin.  Beauregard also discussed the decision to base his GoCoin exchange in Singapore, where regulations are being tailored to foster innovation. “The government down there has been quite perceptive,” he said.  The highlight of the day was a session focused on bitcoin's influence in China. Bobby Lee, CEO of BTC China and Malcom CasSelle of Timeline Labs had a number of interesting things to say on the subject.  “Trading volume has risen from $5m to $50m,” Lee said about BTC China's trading platform. Both Lee and CasSelle expect this growth to continue. CasSelle disclosed:  “We’re transacting 150,000 BTC per day.”  Lee guided the audience through the specific regulatory advice that was offered by China this past week.  “Bitcoin is not a currency, and will not be regulated as a currency,” said Lee. CasSelle added that banking is not the main problem for BTC China going forward. He said:  “BTC China as a business will not have problems with deposits and withdrawals [from banks].”  Rather, the issues that BTC China will face relate specifically to making payments in bitcoin, at least in the near future.  “Goods and services cannot be paid for by bitcoin,” said Lee.  This is the likely reason why an alleged BTC China Deal with Chinese Retail Giant Suning did not come to fruition.  The regulatory issues surrounding bitcoin continued to be a major topic at many of the conference's talks.  John Bates, Founder of MindArk and Michael Bombace, Identity Management and Alternative Payments for Booz Allen Hamilton, held a talk titled: ‘Virtual Currency Guidance: Blaze the Trail or Get Run Over’.  The pair made it clear that regulators don’t like to be confronted with something they don’t fully understand. Bitcoin represents a new way of thinking that they have to now consider.  “Regulators hate to be surprised,” said Bates, “And so does law enforcement,” added Bombace.  The final item on the conference agenda was: ‘Moving Bitcoin Forward: Bringing Trust, Legitimacy and Transparency to the Market’.  It featured; Andreas M. Antonopoulos, founder of RootEleven; Eric Benz, VP of Business Development for ZipZap Inc; Robert Cho, VP of SecondMarket; Adam Ettinger, Partner at Strategic Counsel Corp; Izzy Klein, Principal of Podesta Group; and Ardon Lukasiewicz, Founder of Bitmarkers and the session's moderator.  The discussion served as a look towards what might happen for 2014. All the panelists agreed that Bitcoin regulation will likely have more clarity next year.  “Regulators will wrap their heads around this for the US in Q1 or Q2,” said Robert Cho from SecondMarket.  Given the number of scams involving bitcoin, regulators are scrambling to figure out how to best write policy. “Bitcoin is known for complex scam tactics,” said Ardon Lukasiewicz.  Mediabistro will be taking its Inside Bitcoins conference on the road over the next year. Germany, Hong Kong, London and NYC are locations where the company will hold bitcoin conferences in 2014.",POSITIVE,BTC,ASIA | BTC | BUSINESS | REGULATION | ZRX,Daniel Cawrey,0,0,CoinDesk,https://coindesk.com/markets/2013/12/12/btc-china-reports-10x-volume-increase-from-5-million-to-50-million-at-inside-bitcoins,https://cdn.sanity.io/images/s3y3vcno/production/8cda7f18d9f3c431ddc0c5df39f112a541dab98b-1296x718.png?w=300&h=300&fit=crop
