뉴스ID,뉴스GUID,일자(UTC timestamp),뉴스제목,본문,SENTIMENT,주요코인,카테고리,작성자,추천수,비추천수,출처,뉴스URL,이미지URL
13474230,https://www.trustnodes.com/?p=18588,1540390082,Changpeng Zhao Announces the Blockchain Charity Foundation at the United Nations,Changpeng Zhao introduced today the Blockchain Charity Foundation at the United Nations&apos; World Investment Forum in Geneva where Zhao said blockchain can bring transparency to charity. He said many were reluctant...The post Changpeng Zhao Announces the Blockchain Charity Foundation at the United Nations appeared first on Trustnodes.,POSITIVE,없음,BLOCKCHAIN,,0,0,TrustNodes,https://www.trustnodes.com/2018/10/24/changpeng-zhao-announces-the-blockchain-charity-foundation-at-the-united-nations,https://images.cryptocompare.com/news/trustnodes/fZiE0h80o0g.png
13370524,https://blokt.com/?p=25107,1540389850,Ripple XRP Price Recovers Since 0x Project [ZRX] Listing,"Ripple&apos;s digital currency XRP was on a downward spiral at the start of this month. The downward spiral was catalyzed by a bearish divergence which took place between price and RSI. The bearish divergence resulted in price forming higher highs while RSI formed a lower high, indicating that price continued to increase despite buying pressure ...Ripple XRP Price Recovers Since 0x Project [ZRX] Listing was originally found on [blokt] - Blockchain, Bitcoin &amp; Cryptocurrency News.",POSITIVE,XRP | ZRX,BLOCKCHAIN | BTC | TRADING | XRP | ZRX,,0,0,Blokt,https://blokt.com/technical-analysis/ripple-xrp-price-recovers-since-0x-project-zrx-listing,https://images.cryptocompare.com/news/blokt/80000000000.png
13437075,https://news.bitcoin.com/?p=234920,1540389623,"The Daily: Square Open-Sources Subzero, Coin Stats Launches Chat Platform","In this edition of The Daily, we look at Square&apos;s recent decision to open-source its Subzero cold storage solution. We also focus on Bitcurate&apos;s new cryptocurrency market intelligence service, as well as the chat platform that Coin Stats is launching for cryptocurrency investors and coin teams. Also read: Binance to Expand in Singapore, Uphold Launches Loan ...The post The Daily: Square Open-Sources Subzero, Coin Stats Launches Chat Platform appeared first on Bitcoin News.",NEUTRAL,없음,ASIA | BTC | BUSINESS | EXCHANGE | BNB,,0,0,Bitcoin.com,https://news.bitcoin.com/the-daily-square-open-sources-subzero-coin-stats-launches-chat-platform/,https://images.cryptocompare.com/news/bitcoin.com/aRFdd8a10gc.jpeg
13370525,https://blokt.com/?p=25015,1540389561,Klaytn Blockchain Project by Kakao Announces First 9 Service Partners,"Klaytn, the public blockchain arm of South Korean mobile platform Kakao, recently announced in a press release its partnership with nine initial service providers from a variety of industry domains. These partners will help in expanding the reach of the blockchain in gaming and content. The partners will also help in advancing the platform and releasing ...Klaytn Blockchain Project by Kakao Announces First 9 Service Partners was originally found on [blokt] - Blockchain, Bitcoin &amp; Cryptocurrency News.",POSITIVE,없음,BLOCKCHAIN | BTC | SPONSORED,,0,0,Blokt,https://blokt.com/news/klaytn-blockchain-project-by-kakao-announces-first-9-service-partners,https://images.cryptocompare.com/news/blokt/cG804q0w020.jpeg
13363395,https://cointelegraph.com/news/binances-first-crypto-fiat-exchange-in-uganda-goes-live,1540389000,Binance’s First Crypto-Fiat Exchange in Uganda Goes Live,"The Binance Uganda fiat-to-crypto exchange has gone live, and users can now buy Bitcoin and Ethereum with Ugandan shillings",POSITIVE,없음,BTC | ETH | EXCHANGE | BNB,,0,0,CoinTelegraph,https://cointelegraph.com/news/binances-first-crypto-fiat-exchange-in-uganda-goes-live,https://images.cryptocompare.com/news/cointelegraph/bfwq7Nygw0g.jpeg
13370526,https://blokt.com/?p=25092,1540388644,Where is the Bitcoin Breakout? Price Continues to Consolidate as Volatility Hits New 2018 Low.,"Last week started bullish for Bitcoin with a 10% spike in price. Since the spike, the price of Bitcoin has consolidated around $6400 on low volume. Volatility, as measured by the average true range, has formed new 2018 lows. Traders have been anticipating either a bullish or a bearish breakout for the past few months, ...Where is the Bitcoin Breakout? Price Continues to Consolidate as Volatility Hits New 2018 Low. was originally found on [blokt] - Blockchain, Bitcoin &amp; Cryptocurrency News.",NEUTRAL,없음,BLOCKCHAIN | BTC | TRADING,,0,0,Blokt,https://blokt.com/technical-analysis/where-is-the-bitcoin-breakout-price-continues-to-consolidate-as-volatility-hits-new-2018-low,https://images.cryptocompare.com/news/blokt/a0000000000.png
13235553,https://www.newsbtc.com/?p=355015,1540387821,Institutional Investors Increasingly Using OTC to Avoid Crypto Exchange Limits,"Institutional investors are choosing over-the-counter (OTC) markets over standard exchanges to enter the bitcoin space, revealed Forbes. An OTC market executes trades via a private dealer network as opposed to a formal exchange in which counter parties expose their offers to the party in public. That allows big investors to purchase a large number of...The post Institutional Investors Increasingly Using OTC to Avoid Crypto Exchange Limits appeared first on NewsBTC.",POSITIVE,BTC,BTC | BUSINESS | EXCHANGE | MARKET,,0,0,NewsBTC,https://www.newsbtc.com/2018/10/24/institutional-investors-increasingly-using-otc-to-avoid-crypto-exchange-limits/,https://images.cryptocompare.com/news/newsbtc/dMR5V9MRIap.jpeg
13370527,https://blokt.com/?p=25056,1540387780,"Tron Gives $3,000,000 to Charity as Justin Sun Prepares to Speak at UNCTAD Event","The Tron Foundation is working to create a decentralized platform that can cater to the needs of millions of people. It is also involved with charitable causes. Recently, Tron donated $3 million to Binance&apos;s Blockchain Charity Foundation (BCF). The donation could be used to partner with and contribute to programs at the United National Development ...Tron Gives $3,000,000 to Charity as Justin Sun Prepares to Speak at UNCTAD Event was originally found on [blokt] - Blockchain, Bitcoin &amp; Cryptocurrency News.",POSITIVE,없음,BLOCKCHAIN | BTC,,0,0,Blokt,https://blokt.com/news/tron-gives-3000000-to-charity-as-justin-sun-prepares-to-speak-at-unctad-event,https://images.cryptocompare.com/news/blokt/c0veI0uqz76.jpeg
13411207,https://cryptopotato.com/?p=23103,1540386192,"Ethereum Price Analysis Oct.24: Still Sideways, with Bearish Signs","Not much have changed since our last Ethereum price analysis from Sunday; The Market is continuing the sideway move, and ETH follows it. Looking at the 4 hours chart - ETH was trying to break the resistance at the $205 price level for the second time, but buyers didn&apos;t gain enough momentum to cross above ...The post Ethereum Price Analysis Oct.24: Still Sideways, with Bearish Signs appeared first on CryptoPotato.",NEUTRAL,ETH,ETH | MARKET | TRADING,,0,0,Crypto Potato,https://cryptopotato.com/ethereum-price-analysis-oct-24-still-sideways-with-bearish-signs/,https://images.cryptocompare.com/news/cryptopotato/cnY73eMom1C.jpeg
42402069,DbF8Q09kuKX2XWBxAd3Kdo,1540386062,South Korea's Financial Watchdog Warns Investors Over Crypto Funds,"South Korea's Financial Services Commission has warned the public to exercise caution when investing in cryptocurrency funds.  The FSC issued a note to investors Wednesday, saying cryptocurrency funds have a structure similar to mutual funds and, thus, investors may mistakenly believe such funds are legal investments under the country's Capital Markets Act.  As per the law, funds that raise capital from the public must be approved by and registered with the FSC. However, cryptocurrency funds are neither approved nor registered, the regulator says.  ""Therefore, cryptocurrency funds are subject to Capital Markets Act violation,"" the FSC writes.  The commission further indicates that it plans to take measures regarding crypto funds, after consulting with the relevant authorities, to protect investors from any financial harm.  The note comes after a recent review of crypto funds by South Korean financial regulators that took place last week, as reported by CoinDesk Korea.  As part of the review, the FSC is also reportedly scrutinizing a crypto fund issued by an exchange called Zeniex. Based on the note to investors, the FSC could ultimately hand over the Zeniex case to prosecutors.  The news comes as the Korean regulator is becoming increasingly involved in the cryptocurrency and blockchain space.  In July, the FSC announced that it is setting up a new department dedicated primarily to cryptocurrencies and blockchain – called the Financial Innovation Bureau – to focus on developing policy-making initiatives for the domestic blockchain and fintech industry.  The commission is also reportedly mulling whether to allow initial coin offerings in the country after they were banned last year. A government position could be announced as soon as next month.  Korean won and bitcoin image via Shutterstock",NEGATIVE,없음,ASIA | BLOCKCHAIN | BUSINESS | REGULATION | TOKEN SALE,Yogita Khatri,0,0,CoinDesk,https://coindesk.com/markets/2018/10/24/south-koreas-financial-watchdog-warns-investors-over-crypto-funds,https://cdn.sanity.io/images/s3y3vcno/production/8f6edd17792e6fc247c6110c055e55517cc97d5d-1500x916.jpg?w=300&h=300&fit=crop
13452341,https://bitcoinist.com/?p=90707,1540386057,Rumors: Chances of SEC Bitcoin ETF Approval ‘High’ After VanEck Meeting,"SEC Commissioner Kara Stein says a Bitcoin ETF approval will not happen until applicants meet a set of key criteria - which has been mitigated, if not resolved according to VanEck. Are We There Yet? As the end of 2018 draws near, it increasingly seems that the SEC holds the key to the cryptocurrency market success. Most conversations regarding Bitcoin price revolve around a long-awaited approval of a Bitcoin ETF, and investors have unintentionally mandatedRead MoreThe post Rumors: Chances of SEC Bitcoin ETF Approval &apos;High&apos; After VanEck Meeting appeared first on Bitcoinist.com.",POSITIVE,없음,BTC | BUSINESS | MARKET | REGULATION | TRADING,,0,0,Bitcoinist,https://bitcoinist.com/sec-bitcoin-etf-chances-high/,https://images.cryptocompare.com/news/bitcoinist/cG0A42gw800.jpeg
13370528,https://blokt.com/?p=25006,1540385945,"Number of DApps on Tron Blockchain Surges, Mainnet Accounts Reach 500K in Just 4 Months","The recent activation of the Tron Virtual Machine (TVM) might be a game changer for the blockchain platform. Since TVM was launched in October, there has been a substantial rise in the number of Tron-based decentralized applications, which, if sustained, could further increase the number of users of the platform. Tron-Based DApps Almost Triples in ...Number of DApps on Tron Blockchain Surges, Mainnet Accounts Reach 500K in Just 4 Months was originally found on [blokt] - Blockchain, Bitcoin &amp; Cryptocurrency News.",POSITIVE,없음,BLOCKCHAIN | BTC,,0,0,Blokt,https://blokt.com/news/number-of-dapps-on-tron-blockchain-surges-mainnet-accounts-reach-500k-in-just-4-months,https://images.cryptocompare.com/news/blokt/cz285W54401.jpeg
13363396,https://cointelegraph.com/news/johnny-depp-to-produce-film-within-crypto-powered-content-distribution-platform-tatatu,1540385760,Johnny Depp to Produce Film Within Crypto-Powered Content Distribution Platform TaTaTu,Johnny Depp is teaming up with crypto-powered social entertainment platform TaTaTu to produce content via his own production firm.,POSITIVE,없음,BLOCKCHAIN | ICO,,0,0,CoinTelegraph,https://cointelegraph.com/news/johnny-depp-to-produce-film-within-crypto-powered-content-distribution-platform-tatatu,https://images.cryptocompare.com/news/cointelegraph/9H8rjai01c0.jpeg
13363397,https://cointelegraph.com/news/estate-of-rap-group-wu-tangs-odb-plans-december-launch-of-odb-coin,1540384860,Estate of Rap Group Wu Tang’s O.D.B. Plans December Launch of O.D.B. Coin,"Ol&apos; Dirty Bastard&apos;s would-be altcoin to go live next month, say developers",POSITIVE,없음,ALTCOIN | ICO | TOKEN SALE,,0,0,CoinTelegraph,https://cointelegraph.com/news/estate-of-rap-group-wu-tangs-odb-plans-december-launch-of-odb-coin,https://images.cryptocompare.com/news/cointelegraph/cYrCc1w64w0.jpeg
13235554,https://www.newsbtc.com/?p=355027,1540384237,"South Korea Mulls Lifting ICO Ban in November, Will Crypto Prices Surge?","While delivering her keynote at the 2018 Korea Blockchain Expo, chairperson of The National Assembly Special Committee, Lee Hye-hoon, said the blanket Initial Coin Offering (ICO) ban will be lifted in the &apos;near future&apos;. Even if this is tentative, odds are South Korea will legalize the controversial fund-raising model as early as November 2018 when...The post South Korea Mulls Lifting ICO Ban in November, Will Crypto Prices Surge? appeared first on NewsBTC.",POSITIVE,ICO,ASIA | BLOCKCHAIN | ICO | MARKET | TOKEN SALE,,0,0,NewsBTC,https://www.newsbtc.com/2018/10/24/south-korea-mulls-lifting-ico-ban-november/,https://images.cryptocompare.com/news/newsbtc/fWWAM2Mp0o1.jpeg
13370529,https://blokt.com/?p=25000,1540384146,Report: A Surge in Blockchain-Related Job Listings,"Glassdoor, an employer review company, published a report on Oct. 18 that showed impressive growth in blockchain-job-related openings this year, with job listings proposing a median salary 61.8% higher than the US national one. The report also found out that employers are mainly looking for subject-matter experts, mostly software engineers and coders rather than traditional ...Report: A Surge in Blockchain-Related Job Listings was originally found on [blokt] - Blockchain, Bitcoin &amp; Cryptocurrency News.",POSITIVE,없음,BLOCKCHAIN | BTC | TECHNOLOGY,,0,0,Blokt,https://blokt.com/news/report-a-surge-in-blockchain-related-job-listings,https://images.cryptocompare.com/news/blokt/eO053z01x20.jpeg
13411208,https://cryptopotato.com/?p=23094,1540383821,The End of Alibabacoin? Dropped 50% Following Court Decision Against Alibaba,"Crypto startup, Alibabacoin Foundation, the firm behind Alibabacoin (ABBC) found itself on the wrong side of a Court&apos;s decision. Alibaba, the multi-billion Chinese ecommerce company, was granted application for a preliminary injunction in a court case which it filed in April against Alibabacoin for using its trademarks to promote their crypto currency. The case, however, ...The post The End of Alibabacoin? Dropped 50% Following Court Decision Against Alibaba appeared first on CryptoPotato.",NEGATIVE,없음,OTHER,,0,0,Crypto Potato,https://cryptopotato.com/the-end-of-alibabacoin-dropped-50-following-court-decision-against-alibaba/,https://images.cryptocompare.com/news/cryptopotato/8gd672oq950.jpeg
13363398,https://cointelegraph.com/news/japanese-financial-watchdog-grants-self-regulatory-status-to-local-crypto-exchanges,1540382820,Japanese Financial Watchdog Grants Self-Regulatory Status to Local Crypto Exchanges,"A self-regulatory body, the Japan Virtual Currency Exchange Association, has been certified to oversee the local crypto industry and plans to increase staff",POSITIVE,없음,ASIA | EXCHANGE,,0,0,CoinTelegraph,https://cointelegraph.com/news/japanese-financial-watchdog-grants-self-regulatory-status-to-local-crypto-exchanges,https://images.cryptocompare.com/news/cointelegraph/dhyM0Mxx4f1.jpeg
13474231,https://www.trustnodes.com/?p=18582,1540382671,"Coinbase Joins the Tokenized Dollars Bonanza, is this Good for Ethereum?","The dollar is going crypto. Coinbase has joined forces with Goldman Sachs backed Circle to launch a new ethereum based token that is pegged to the dollar. The system is...The post Coinbase Joins the Tokenized Dollars Bonanza, is this Good for Ethereum? appeared first on Trustnodes.",POSITIVE,없음,ETH | EXCHANGE | ICO,,0,0,TrustNodes,https://www.trustnodes.com/2018/10/24/coinbase-joins-the-tokenized-dollars-bonanza-is-this-good-for-ethereum,https://images.cryptocompare.com/news/trustnodes/8g0ew3008g0.png
13370530,https://blokt.com/?p=24948,1540382391,CoinGeek’s Public Mining Pool Opens for Bitcoin Miners,"SVPool, the public mining pool for miners on the Bitcoin BCH network, announced that it has opened for business on Monday, Oct. 22. The public pool is managed by CoinGeek Mining and claims to be following the original vision of Satoshi Nakamoto, which helps miners in generating long-term revenue. The mining pool is an initiative ...CoinGeek&apos;s Public Mining Pool Opens for Bitcoin Miners was originally found on [blokt] - Blockchain, Bitcoin &amp; Cryptocurrency News.",POSITIVE,BCH,BCH | BLOCKCHAIN | BTC | BUSINESS | MINING,,0,0,Blokt,https://blokt.com/news/coingeeks-public-mining-pool-opens-for-bitcoin-miners,https://images.cryptocompare.com/news/blokt/9nwp60042xI.jpeg
42402078,DbF8Q09kuKX2XWBxAd3Klg,1540380655,Nasdaq Wins Patent for Newswire Service Built on a Blockchain,"Nasdaq has won a patent outlining how blockchain could be used to release information as part of a wire service.  The patent, released Tuesday by the U.S. Patent and Trademark Office, specifically explains how a blockchain could be used to securely release time-sensitive information when necessary. As the document explains, wire, newswire, news release or other digital distribution services currently share information at pre-set embargo times to the intended outlets.  While existing platforms can already distribute information at specific times and to only the appropriate recipients, the patent notes that these systems may leave audit trail gaps – and some platforms may not be audit-friendly at all.  As such, ""new and improved techniques and systems for delivering and securing such time-sensitive information are continually sought after,"" the document explains.  To solve this, Nasdaq's patent describes a blockchain platform that can utilize smart contracts to both incorporate a number of encryption and workflow features, while maintaining a log that becomes more difficult to change over time.  It explains that the computer system and blockchain are programmed to allow sharing of information directly to selected recipients at a pre-set time by using smart contracts that have been added to the blockchain.  ""Access to the sensitive information that is stored on the blockchain may include a multi-signature requirement that is part of the embedded scripts that make up a given blockchain transaction,"" the patent adds.  ""The intended recipients of the information may then directly interface with the blockchain at the scheduled time ... to access information that has been securely stored,"" it continues.  Nasdaq image via Goran Vrhovac/Shutterstock",POSITIVE,없음,BLOCKCHAIN,Nikhilesh De,0,0,CoinDesk,https://coindesk.com/markets/2018/10/24/nasdaq-wins-patent-for-newswire-service-built-on-a-blockchain,https://cdn.sanity.io/images/s3y3vcno/production/c08b4f33dbd159f52c695130fd4db7738425c50d-1500x1000.jpg?w=300&h=300&fit=crop
13235555,https://www.newsbtc.com/?p=355022,1540380622,ICO Trust Returning as Caspian Rakes in Nearly $20 Million Ahead of Deadline,"A crypto project has revived the investors&apos; trust in initial coin offerings by raking in $19.5 million via crowdfunding. Caspian, a Cayman Island-based project, achieved its hard cap before the set date, implying a successful kick-start for the development of its institutional crypto trading platform. A beta-testing round of the platform is live already, which...The post ICO Trust Returning as Caspian Rakes in Nearly $20 Million Ahead of Deadline appeared first on NewsBTC.",POSITIVE,BTC | ICO,BTC | ICO | TRADING | TOKEN SALE,,0,0,NewsBTC,https://www.newsbtc.com/2018/10/24/ico-trust-returning-as-caspian-rakes-in-nearly-20-million-ahead-of-deadline/,https://images.cryptocompare.com/news/newsbtc/9j0sQ8yaw2w.jpeg
13363399,https://cointelegraph.com/news/taiwan-will-issue-draft-ico-rules-by-june-2019-regulator-says,1540380420,"Taiwan Will Issue Draft ICO Rules By June 2019, Regulator Says","Time for Initial Coin Offerings to be regulated, says Taiwan&apos;s finance regulator",NEUTRAL,ICO,ASIA | ICO | TOKEN SALE,,0,0,CoinTelegraph,https://cointelegraph.com/news/taiwan-will-issue-draft-ico-rules-by-june-2019-regulator-says,https://images.cryptocompare.com/news/cointelegraph/c8VhU0eh44s.jpeg
13370531,https://blokt.com/?p=24834,1540378764,London Gold Association to Approve Blockchain Trackers,"As the use cases of blockchain are increasing by the day, traditional finance and related markets are slowly opening up to the possibility of distributed ledger technology (DLT) solutions. The London Bullion Market Association (LBMA) is planning to employ distributed ledgers for gold tracking. The new, modernized version of its gold movement tracking technology will help ...London Gold Association to Approve Blockchain Trackers was originally found on [blokt] - Blockchain, Bitcoin &amp; Cryptocurrency News.",POSITIVE,없음,BLOCKCHAIN | BTC | FIAT | MARKET | TECHNOLOGY,,0,0,Blokt,https://blokt.com/news/london-gold-association-to-approve-blockchain-trackers,https://images.cryptocompare.com/news/blokt/9527yxGxe2Q.jpeg
13452342,https://bitcoinist.com/?p=90755,1540377030,BREAKING: Japan Allows Cryptocurrency Industry To Regulate Itself,"Japan has given formal approval for its cryptocurrency industry to regulate itself, the Japan Virtual Currency Exchange Association (JVCEA) confirmed October 24. JVCEA Can Police Exchanges In a significant development for the country, regulators opted to allow the JVCEA to ensure cryptocurrency exchanges followed legal requirements, a statement reads. Under the deal, the body will also have the power to punish those operators, which do not conform to the stringent safety regulations Japanese authorities have put inRead MoreThe post BREAKING: Japan Allows Cryptocurrency Industry To Regulate Itself appeared first on Bitcoinist.com.",POSITIVE,없음,ASIA | BTC | EXCHANGE | REGULATION,,0,0,Bitcoinist,https://bitcoinist.com/japan-cryptocurrency-self-regulate/,https://images.cryptocompare.com/news/bitcoinist/ej14W20Fx2Q.jpeg
42402060,DbF8Q09kuKX2XWBxAd3KWv,1540377017,Japanese Crypto Exchange Group Gets Legal Status to Self-Regulate,"The Financial Services Agency (FSA), Japan's finance regulator, has formally approved a cryptocurrency exchange association as a self-regulatory industry body.  The FSA said in a notice on Wednesday that it has accredited the Japanese Virtual Currency Exchange Association (JVCEA) as a ""certified fund settlement business association,"" a status that will let the body set rules for the nation's exchanges and take action over any violations.  While the group has not announced any rules yet, a recent report from Reuters said it may require member exchanges to hold separate bank deposits and government bonds, based on a draft obtained by the news agency. The move would be aimed to ensure exchanges have sufficient funds to compensate users in the event of a hack.  The association was created by 16 licensed crypto trading platforms in Japan in the wake of a $530 million hack on the Coincheck exchange early this year, and filed an application for approval with the FSA in August.  Recently, the Zaif crypto exchange, one of the 16 licensed platforms, was hacked for $60 million and subsequently had to sign itself over to another firm last month because it did not have enough reserves to refund users for their losses.  The association has previously made other proposals, such as imposing regular audits on crypto exchanges and limiting the amount of borrowing available to margin traders.  In a separate announcement, the FSA also noted it had seen an increasing number of companies expressing interest in applying for a cryptocurrency exchange license. As such, it has updated and released the documents it requires for firms seeking to be licensed.  Exchanges must now complete a 83-page Q&A form that includes details such as a platforms' crypto reserves, offered trading pairs and their maximum leverage ratio in margin trading.  Based on the FSA document, the review process will also focus on security measures taken by exchanges – for instance, whether their platform is developed in-house or whether they use third-party agencies to manage customer outreach and marketing efforts.  The FSA also indicated that after reviewing written submissions it will also conduct on-site inspections at exchanges.  In September, the agency said it was planning to increase staffing levels next year for its cryptocurrency exchange license scheme, stating that over 160 firms were looking to submit applications at the time.  FSA image via Shutterstock",POSITIVE,없음,ASIA | BUSINESS | EXCHANGE | REGULATION | TRADING,Wolfie Zhao,0,0,CoinDesk,https://coindesk.com/markets/2018/10/24/japanese-crypto-exchange-group-gets-legal-status-to-self-regulate,https://cdn.sanity.io/images/s3y3vcno/production/c733568cb48c8a6822bbfb79ec4cec82f967d921-1500x1000.jpg?w=300&h=300&fit=crop
13235556,https://www.newsbtc.com/?p=355016,1540377001,Bitcoin ETF Hopefuls Speak to SEC in Closed-Door Meeting,"While a majority of crypto-related news is sculpted for public consumption, in juxtaposition to the transparency that public blockchains provide, recently-released documents from the U.S. Securities and Exchange Commission (SEC) indicate that a paramount closed-door meeting recently occurred. VanEck: Our Bitcoin ETF Issues Have Been Resolved Two weeks ago, stowed far away from the prying...The post Bitcoin ETF Hopefuls Speak to SEC in Closed-Door Meeting appeared first on NewsBTC.",NEUTRAL,BTC,BTC | EXCHANGE | REGULATION,,0,0,NewsBTC,https://www.newsbtc.com/2018/10/24/bitcoin-etf-hopefuls-speak-to-sec-in-closed-door-meeting/,https://images.cryptocompare.com/news/newsbtc/ew0wg000000.jpeg
