뉴스ID,뉴스GUID,일자(UTC timestamp),뉴스제목,본문,SENTIMENT,주요코인,카테고리,작성자,추천수,비추천수,출처,뉴스URL,이미지URL
13363387,https://cointelegraph.com/news/tom-lee-speaker-at-the-upcoming-blockshow-asia-bitcoin-is-preparing-to-breakout,1540415700,"Tom Lee, Speaker at the Upcoming Blockshow Asia: ‘Bitcoin is Preparing to Breakout’","&apos;Bitcoin should have a great 2019!&apos; Blockshow team asked Tom Lee why he believes Bitcoin is preparing to breakout. Thomas Lee will be one of the speakers at Asia Blockchain Week in Singapore from Nov. 27 until Dec. 1, 2018 #SPONSORED",POSITIVE,없음,ASIA | BLOCKCHAIN | BTC,,0,0,CoinTelegraph,https://cointelegraph.com/news/tom-lee-speaker-at-the-upcoming-blockshow-asia-bitcoin-is-preparing-to-breakout,https://images.cryptocompare.com/news/cointelegraph/8IHF5h0oYd3.jpeg
42381347,0r6Zag11PPDEMKgUX94t4b,1540415131,AMD: GPU Sales to Crypto Miners Was 'Negligible' in Q3,"AMD's sales of graphics cards to cryptocurrency miners have all but dried up.  The chip manufacturer generated ""negligible"" revenue from blockchain-related GPU sales in the third quarter, accounting for only a ""high single digit percentage"" of the company's top line, AMD said Wednesday. This followed a drop in this type of revenue in the previous quarter.  Overall, AMD'S computing and graphics revenue slid 14 percent from the second quarter, though revenue from this business line was up 12 percent compared to a year earlier.  In its last quarterly report in July, AMD stated that about 6 percent of its second-quarter revenue came from selling to crypto miners – down from 10 percent in the first quarter.  At the time, AMD said that it expected GPU sales to miners to continue to decline, a prediction that was borne out by Wednesday's report.  On a July 25 conference call, CEO Lisa Su said the company was ""expecting very little from blockchain,"" and it had lowered its forecast for revenue from the industry.  The company has been tempering market expectations for revenue from GPUs since at least March, however. In its annual 10-K filing, AMD warned that the instability in the cryptocurrency market could hurt its revenue from sales in the sector.  AMD image via JHVEPhoto / Shutterstock",NEGATIVE,없음,BLOCKCHAIN | BUSINESS | MARKET,Nikhilesh De,0,0,CoinDesk,https://coindesk.com/markets/2018/10/24/amd-gpu-sales-to-crypto-miners-was-negligible-in-q3,https://cdn.sanity.io/images/s3y3vcno/production/4ecdf82322e16e5f7e21130065dbacf32b9cfd02-1500x1000.jpg?w=300&h=300&fit=crop
13452337,https://bitcoinist.com/?p=90768,1540414843,‘Adoption is Real’: Nearly 5 Percent of Canadians Now Own Bitcoin,"At least four different studies by institutional authorities indicate that between 3 and 5 percent of people in Canada own Bitcoin. Bitcoin Investors Are Spreading in Canada Bitcoinist reported in July that 500,000 people in Ontario own cryptocurrencies. The findings were revealed in a survey of more than 2,500 Ontarians conducted by the Investor Office of the Ontario Securities Commission (OSC). Bylls CEO Francis Pouliot concluded that numerous studies determine that between 3 and 5 percentRead MoreThe post &apos;Adoption is Real&apos;: Nearly 5 Percent of Canadians Now Own Bitcoin appeared first on Bitcoinist.com.",POSITIVE,없음,BLOCKCHAIN | BTC | BUSINESS,,0,0,Bitcoinist,https://bitcoinist.com/5-percent-canada-invest-bitcoin/,https://images.cryptocompare.com/news/bitcoinist/fC7Nw0ze3w4.jpeg
13235546,https://www.newsbtc.com/?p=355103,1540414843,Report: Unrest Over Tether Instability Causing Outflow into Bitcoin,"As fear, uncertainty, and doubt (FUD) surrounding leading stablecoin cryptocurrency Tether mounts, capital has begun to flow out of Tether and into Bitcoin and other competiting stablecoins, according to a new report. Diar: Trading Flows from Tether to Bitcoin Due to Continued FUD Cryptocurrency market research firm Diar has, in their latest research report, put...The post Report: Unrest Over Tether Instability Causing Outflow into Bitcoin appeared first on NewsBTC.",NEGATIVE,BTC,ALTCOIN | BTC | MARKET | USDT | RESEARCH,,0,0,NewsBTC,https://www.newsbtc.com/2018/10/24/report-unrest-over-tether-instability-causing-outflow-into-bitcoin/,https://images.cryptocompare.com/news/newsbtc/cjMcggoU1j0.jpeg
13363388,https://cointelegraph.com/news/crypto-markets-keep-trading-sideways-remaining-relatively-stable-over-the-past-10-days,1540413000,"Crypto Markets Keep Trading Sideways, Remaining Relatively Stable Over the Past 10 Days","Crypto markets continue trading sideways today, remaining relatively stable over the last 10 days",NEUTRAL,없음,ALTCOIN | MARKET | TRADING | ZEC,,0,0,CoinTelegraph,https://cointelegraph.com/news/crypto-markets-keep-trading-sideways-remaining-relatively-stable-over-the-past-10-days,https://images.cryptocompare.com/news/cointelegraph/9F58g1x0100.jpeg
13235547,https://www.newsbtc.com/?p=355083,1540411217,"Binance Uganda Launches Fiat-to-Crypto, CEO Donates $500,000 to National Charities","Fiat-to-crypto trading is now live on the Uganda-facing division of the hugely successful trading platform Binance. As part of a wider commitment to encouraging blockchain being used for charitable causes, its CEO, Changpeng Zhao, announced that his exchange would donate $500,000 to local causes through the firm&apos;s charitable wing. Binance Execs Spy Big Opportunities in...The post Binance Uganda Launches Fiat-to-Crypto, CEO Donates $500,000 to National Charities appeared first on NewsBTC.",POSITIVE,BTC,ALTCOIN | BTC | EXCHANGE | TRADING | BNB,,0,0,NewsBTC,https://www.newsbtc.com/2018/10/24/binance-uganda-launches-fiat-to-crypto-ceo-donates-500000-to-national-charities/,https://images.cryptocompare.com/news/newsbtc/epowwa88F8w.jpeg
13437071,https://news.bitcoin.com/?p=235022,1540410939,"Cryptocurrency Roundup App Gets $100,000 Shark Tank Investment","Services that allow individuals to invest small amounts of money on a recurring basis have become popular in recent years, especially for young people. An automatic cryptocurrency buying app that rounds up everyday purchases has just secured a $100,000 investment on Shark Tank. Also Read: Cointext Launches SMS Bitcoin Cash Wallet in 4 New Markets ...The post Cryptocurrency Roundup App Gets $100,000 Shark Tank Investment appeared first on Bitcoin News.",POSITIVE,없음,BCH | MARKET,,0,0,Bitcoin.com,https://news.bitcoin.com/cryptocurrency-roundup-app-gets-100000-shark-tank-investment/,https://images.cryptocompare.com/news/bitcoin.com/aJ0Q8i4w08w.jpeg
13246846,https://nulltx.com/?p=71400,1540410912,BlockchainDefender – Defending the Reputation of the Blockchain Industry,"The new BlockchainDefender service from the industry-leading ReputationDefender is now available to those in the crypto and blockchain industries. This service helps companies, individuals and projects to maintain a positive reputation online so they can make a strong first impression on potential investors or customers. BlockchainDefender takes the already stellar reputation management skills from ReputationDefender ...The post BlockchainDefender - Defending the Reputation of the Blockchain Industry appeared first on NullTX.",POSITIVE,없음,BLOCKCHAIN | BUSINESS,,0,0,NullTx,https://nulltx.com/blockchaindefender-defending-the-reputation-of-the-blockchain-industry/,https://images.cryptocompare.com/news/themerkle/a0000000000.png
13363389,https://cointelegraph.com/news/tether-redeems-and-burns-more-than-half-of-usdt-in-circulation,1540408200,Tether Redeems and ‘Burns’ More than Half of USDT in Circulation,"Tether says it has &apos;redeemed a significant amount&apos; of USDT from the circulating supply, and will now &apos;destroy&apos; 500 million USDT from its treasury wallet, leaving just 446 million",NEUTRAL,USDT,BLOCKCHAIN | EXCHANGE | FIAT | REGULATION | USDT,,0,0,CoinTelegraph,https://cointelegraph.com/news/tether-redeems-and-burns-more-than-half-of-usdt-in-circulation,https://images.cryptocompare.com/news/cointelegraph/94piFai9011.jpeg
13235548,https://www.newsbtc.com/?p=355059,1540407625,Japan’s FSA Grants Self-Regulatory Status to Crypto Industry,"New reports from Japan confirm that the country&apos;s financial watchdog has granted a self-regulatory status to the crypto industry. The decision will allow the Japan Virtual Currency Exchange Association (JVCEA) to bring new rules for Japanese crypto exchanges, as well as to sanction those that fail to comply. New Move Expected to Improve Exchange Security...The post Japan&apos;s FSA Grants Self-Regulatory Status to Crypto Industry appeared first on NewsBTC.",POSITIVE,없음,ASIA | EXCHANGE,,0,0,NewsBTC,https://www.newsbtc.com/2018/10/24/japans-fsa-grants-self-regulatory-status-to-crypto-industry/,https://images.cryptocompare.com/news/newsbtc/bpYc0bw480c.jpeg
13452338,https://bitcoinist.com/?p=90771,1540407617,UnoCoin Founder Arrested For Operating India’s First Bitcoin ATM,"Police in Bengaluru, India recently arrested UnoCoin cofounder Harish BV for &apos;illegally&apos; operating a Bitcoin ATM in the city barely a week after it was installed. &apos;Not Taken Any Permission from the State Gov&apos;t&apos; According to The News Minutes, Bengaluru&apos;s Cyber Crime Police unit brought forward a case against Unocoin for illegally installing a BTC ATM without any permission. A part of the statement given by the unit to the press reads: The ATM kiosk installedRead MoreThe post UnoCoin Founder Arrested For Operating India&apos;s First Bitcoin ATM appeared first on Bitcoinist.com.",NEGATIVE,BTC,BTC,,0,0,Bitcoinist,https://bitcoinist.com/bitcoin-atm-unocoin-arrested-india/,https://images.cryptocompare.com/news/bitcoinist/a1a3VdAAyqA.jpeg
13363390,https://cointelegraph.com/news/uk-blockchain-startup-to-enter-eu-settlement-system-after-french-regulators-approval,1540407300,UK Blockchain Startup to Enter EU Settlement System After French Regulator’s Approval,"Setl, a U.K. startup that develops blockchain solutions for the financial sector, will join an E.U. settlement platform after gaining approval to run a securities depository",POSITIVE,없음,BLOCKCHAIN,,0,0,CoinTelegraph,https://cointelegraph.com/news/uk-blockchain-startup-to-enter-eu-settlement-system-after-french-regulators-approval,https://images.cryptocompare.com/news/cointelegraph/9oa1v1FAg4x.jpeg
42381328,0r6Zag11PPDEMKgUX94slj,1540406743,Tether Just Burned 500 Million USDT Stablecoin Tokens,"UPDATE (24 October 19:25 UTC): This article has been updated to include comments from a Bitfinex spokesman.      Shortly before 1:00 p.m. ET Wednesday, Tether, the company behind the dollar-linked stablecoin of the same name, announced via Twitter that it had destroyed 500 million tether (USDT) tokens.  Previously, those tokens were held in an account known as the ""Tether treasury."" The past few weeks have seen massive influxes of USDT to the Treasury, particularly after the cryptocurrency lost parity with the U.S. dollar last week amid questions about Tether's access to banking services.  From Oct. 14, when USDT started to slip below $1.00, to Oct. 23, 680 million USDT were transferred to the company-controlled Treasury wallet. All of these transfers came from an address controlled by Bitfinex, a cryptocurrency exchange that overlaps with Tether in terms of ownership and management.  Bitfinex's cold wallet's balance has fallen by around 100,000 bitcoin since early September, leading some to speculate that the exchange has been spending bitcoin in order to take tether off the market – perhaps to push the exchange rate back towards the $1.00 mark, or perhaps even to exit the stablecoin business entirely.  As a result of these transfers, the supply of tethers in circulation has dropped by around a quarter in a week and a half, to approximately $2 billion. Now many of these tokens, in addition to having been taken out of circulation, have been ""burned"" or destroyed by the company.  Kasper Rasmussen, Bitfinex's director of communications, said the action ""does not have anything to do with defending dollar parity,"" since both the exchange and Tether guarantee 1-for-1 redemptions. He denied that Tether is intentionally scaling back supply.  Tether tokens are redeemed ""when the amount circulating exceeds the amount required for e.g. Bitfinex or Tether to operate,"" Rasmussen said, and the reason most of the destroyed tokens came from Bitfinex's wallet is that ""Bitfinex is one of the main customers of Tether.""  In its announcement Wednesday, Tether said that it had not burned all of the USDT in the Treasury account, and that around 466 million USDT remain in the account ""as a preparatory measure for future USDT issuances.""  True redemption?  The announcement characterized transfers of USDT to the Treasury as ""redemption,"" a process that Tether described in its original white paper.  The 2016 white paper specifies that USDT holders can redeem their tokens for U.S. dollars directly with the company. Tether maintains that every USDT token is backed by a U.S. dollar deposit, but has not convinced many skeptics that the cryptocurrency is in fact fully collateralized.  The anonymous anti-Tether campaigner ""Bitfinex'ed,"" however, disputed Tether's characterization of transfers to the Treasury as a ""redemption,"" writing: ""Not one person can come forward and say that they converted Tethers to dollars and got wired money from Tether.""  Rasmussen, the Bitfinex spokesman, claimed otherwise, telling CoinDesk: ""Yes, direct customers of Tether are able to redeem USDT through Tether Ltd.""  But many others allege that it is not possible to redeem USDT tokens for dollars with Tether.  Burning match image via Shutterstock",NEUTRAL,USDT,BLOCKCHAIN | BTC | EXCHANGE | REGULATION | USDT,David Floyd,0,0,CoinDesk,https://coindesk.com/markets/2018/10/24/tether-just-burned-500-million-usdt-stablecoin-tokens,https://cdn.sanity.io/images/s3y3vcno/production/d7a5e31fbb2d4569ab2b7af0c9830a502ddd7d8a-1500x745.jpg?w=300&h=300&fit=crop
13235549,https://www.newsbtc.com/?p=355089,1540404005,"Cryptocurrency Could Pave Way for New Financial Order, Says Expert","Despite the persisting bear market and low market sentiment, the potential impacts of cryptocurrency and blockchain technology remain astounding, and many investors have maintained their confidence in this fact. One industry insider shares this sentiment, explaining in a recent interview with the Express, that cryptocurrency will likely change the current economic system for the better. Marcus...The post Cryptocurrency Could Pave Way for New Financial Order, Says Expert appeared first on NewsBTC.",POSITIVE,BTC,BLOCKCHAIN | BTC | BUSINESS | MARKET | TECHNOLOGY,,0,0,NewsBTC,https://www.newsbtc.com/2018/10/24/cryptocurrency-could-pave-way-for-new-financial-order-says-expert/,https://images.cryptocompare.com/news/newsbtc/a8c3wuoA8w2.jpeg
13370516,https://blokt.com/?p=25091,1540403957,A Gambling DApp Helps Tron Push Its Daily Transaction Volume Beyond Ethereum,"A gambling app on Tron has helped the blockchain network register higher daily transaction volumes than Ethereum for the first time. The app, known as TRONbet, is the first large-scale decentralized application (DApp) deployed on the Tron network. The dice game clocked in more than 500,000 transactions during the weekend. What Caused the Surge? The DApp ...A Gambling DApp Helps Tron Push Its Daily Transaction Volume Beyond Ethereum was originally found on [blokt] - Blockchain, Bitcoin &amp; Cryptocurrency News.",POSITIVE,없음,BLOCKCHAIN | BTC | ETH,,0,0,Blokt,https://blokt.com/news/a-gambling-dapp-helps-tron-push-its-daily-transaction-volume-beyond-ethereum,https://images.cryptocompare.com/news/blokt/aoyxf20000c.jpeg
13437072,https://news.bitcoin.com/?p=235091,1540403704,"Regulations Roundup: Investors Not Protected in China, Albania to Regulate","In recent regulatory news, a court in China&apos;s Futian District has ruled that cryptocurrency investments are not protected by law, Albania&apos;s government has indicated that it intends to develop a regulatory framework for crypto, and the United States Securities and Exchange Commission has published a memorandum from a recent meeting pertaining to the proposed Vaneck ...The post Regulations Roundup: Investors Not Protected in China, Albania to Regulate appeared first on Bitcoin News.",NEUTRAL,없음,ASIA | BTC | BUSINESS | EXCHANGE | REGULATION,,0,0,Bitcoin.com,https://news.bitcoin.com/regulations-roundup-china-albania/,https://images.cryptocompare.com/news/bitcoin.com/db47jFwo600.jpeg
13437073,https://news.bitcoin.com/?p=234492,1540402259,PR: trade.io Effectively Contains Breach of Cold Storage Wallet and Protects TIO Holders,"The trade.io security team was alerted to a large transaction originating from our wallet holding 50M Trade Tokens (TIO) owned by trade.io reserved for the liquidity pool. Immediately following the alert, our trade monitoring observed abnormal trading of TIO on external exchanges. These exchanges were immediately alerted to disable deposits/withdrawals and trading of TIO, and our security team began its investigation. The responsiveness by the various teams within trade.io prevented the situation from deteriorating and helped quarantine the issue.The post PR: trade.io Effectively Contains Breach of Cold Storage Wallet and Protects TIO Holders appeared first on Bitcoin News.",POSITIVE,없음,BTC | EXCHANGE | ICO | TRADING,,0,0,Bitcoin.com,https://news.bitcoin.com/pr-trade-io-effectively-contains-breach-of-cold-storage-wallet-and-protects-tio-holders/,https://images.cryptocompare.com/news/bitcoin.com/9pDjFOmC9bp.png
13370517,https://blokt.com/?p=25047,1540402186,Ripple CTO David Schwartz Presents Strong Arguments Supporting Blockchain in Payments at Money20/20 USA,"The CTO of Ripple, David Schwartz, attended the Money20/20 USA conference and participated in a debate with Esther Pigg, senior vice president of product strategy at FIS Payments. The debate, moderated by Tony Hayes, revolved around the traditional payment system and how blockchain technology could replace it. Schwartz presented his side of the argument, with ...Ripple CTO David Schwartz Presents Strong Arguments Supporting Blockchain in Payments at Money20/20 USA was originally found on [blokt] - Blockchain, Bitcoin &amp; Cryptocurrency News.",POSITIVE,없음,BLOCKCHAIN | BTC | REGULATION | TECHNOLOGY,,0,0,Blokt,https://blokt.com/news/ripple-cto-david-schwartz-presents-strong-arguments-supporting-blockchain-in-payments-at-money20-20-usa,https://images.cryptocompare.com/news/blokt/dj1iREYA90M.jpeg
13474227,https://www.trustnodes.com/?p=18614,1540401762,Heavy Consolidation Says This Week’s Crypto Technical Analysis,"The weekly Technical Analysis is provided by Dmitriy Gurkovskiy, Chief Analyst at RoboForex. Needless to say, all statements and views expressed below and any forecasts contained herein are solely based on...The post Heavy Consolidation Says This Week&apos;s Crypto Technical Analysis appeared first on Trustnodes.",NEUTRAL,없음,MARKET | TRADING,,0,0,TrustNodes,https://www.trustnodes.com/2018/10/24/heavy-consolidation-says-this-weeks-crypto-technical-analysis,https://images.cryptocompare.com/news/trustnodes/e2wox80koAo.png
13246847,https://nulltx.com/?p=71396,1540401689,"Bitcoin Price Watch: Currency Slightly Up, but Is Interest Subsiding?","At press time, the father of cryptocurrency is back up in the $6,400 range after falling to just over $6,300 during our previous price coverage. As mentioned before, the currency has seemingly found a comfortable spot between $6,300 and $6,500 and hasn&apos;t moved from here for several weeks minus a few small jumps and falls ...The post Bitcoin Price Watch: Currency Slightly Up, but Is Interest Subsiding? appeared first on NullTX.",POSITIVE,없음,BTC | TRADING,,0,0,NullTx,https://nulltx.com/bitcoin-price-watch-currency-slightly-up-but-is-interest-subsiding/,https://images.cryptocompare.com/news/themerkle/8F9ogWkxzxM.jpeg
13363391,https://cointelegraph.com/news/south-korean-financial-regulator-says-crypto-funds-violate-capital-markets-act,1540401300,South Korean Financial Regulator Says Crypto Funds Violate Capital Markets Act,South Korea&apos;s financial watchdog has warned investors that local crypto funds are neither approved or registered,NEGATIVE,없음,BUSINESS | MARKET,,0,0,CoinTelegraph,https://cointelegraph.com/news/south-korean-financial-regulator-says-crypto-funds-violate-capital-markets-act,https://images.cryptocompare.com/news/cointelegraph/fWygQV81gMw.jpeg
42381349,0r6Zag11PPDEMKgUX94t77,1540400453,CoinMarketCap Excludes Some Tether Data After Clarification by Bitfinex,"CoinMarketCap, the most-visited aggregator of cryptocurrency market data, has changed the way it uses data from the Bitfinex exchange in response to a report by CoinDesk.  On Tuesday, CoinDesk pointed out that a trading pair shown on CoinMarketCap – seemingly, for trades between the tether stablecoin (USDT) and U.S. dollars – did not, in fact, represent a pair that's available for trading on Bitfinex. From looking at CoinMarketCap data, the ostensible pair appeared to be the second-highest by 24-hour volume on the exchange at the time the article was written.  In response to CoinDesk's report, Bitfinex clarified that the volume shown on CoinMarketCap represented the sum of withdrawals and deposits of USDT to and from Bitfinex.  After receiving that clarification, Carylyne Chan, CoinMarketCap's global head of marketing, told CoinDesk:  ""The team has revised to exclude its volume. This will represent it accordingly and ensure it does not have any contributions to volume going forward. You can see this on the page with ** pointing to volume exclusion.""  She included the following screenshot:  However, while the Bitfinex USDT/USD pair's volume appears to be excluded from calculations on CoinMarketCap's tether markets page, it is unclear whether it's been excluded from volume totals on the site's Bitfinex page.  For one thing, the pair is not labeled with a double asterisk, denoting ""volume excluded,"" on the Bitfinex exchange page. Further, the sum of all listed Bifinex pairs' 24-hour volumes yielded the total volume listed at the top of the page, suggesting that the $39.5 million in USDT/USD volume had not been excluded. Chan did not immediately respond to a follow-up question on this.  Kasper Rasmussen, Bitfinex's head of marketing, said of the change at CoinMarketCap, ""It means nothing to us as the API tracks something which is used internally only. It is not a USD/USDT trading pair.""  Push and pull  While Bitfinex has suggested that CoinMarketCap is responsible for how it presents data from the exchange's application programming interface (API), CoinMarketCap described a lack of communication on Bitfinex's part.  As noted in Tuesday's article, Chan of CoinMarketCap told CoinDesk that Bitfinex had ""not responded to multiple direct requests from our team members"" regarding the data point, which she said was drawn from Bitfinex's API.  Prior to the article's publication, Rasmussen had confirmed to CoinDesk that the USDT/USD pair was not available for trading on Bitfinex and said he would follow up ""asap"" regarding the data displayed on CoinMarketCap.  CoinDesk's subsequent emails – which included statements from CoinMarketCap – did not receive a reply, however, until after the story was posted.  Following the article's publication, Bitfinex objected to the headline's description of the exchange as ""publishing data for a tether market that doesn't exist,"" on the grounds that CoinMarketCap is responsible for how it uses the API data. Bitfinex wrote on Twitter:    ""We are not 'publishing' fake numbers; the API method is called 'movement_volume' and isn't part of our ticker API. Not pushed by us, pulled by CMC. Another not-so-brilliant example of anti Bitfinex/Tether FUD.""            Bitfinex has close ties to Tether, the company that issues USDT, with the two firms sharing common managers and shareholders. The stablecoin lost its market parity with the U.S. dollar last week amid renewed speculation that tether tokens are not fully collateralized by dollar bank deposits.  At midday Wednesday, USDT was still below $1, trading at $0.98, according to CoinMarketCap.  CoinMarketCap image via Shutterstock",NEUTRAL,USDT,EXCHANGE | FIAT | MARKET | TRADING | USDT,David Floyd,0,0,CoinDesk,https://coindesk.com/markets/2018/10/24/coinmarketcap-excludes-some-tether-data-after-clarification-by-bitfinex,https://cdn.sanity.io/images/s3y3vcno/production/271114bd03e62688702ed5e3c170b7a6ef7db84f-1000x667.jpg?w=300&h=300&fit=crop
13452339,https://bitcoinist.com/?p=90742,1540400446,"‘Bitcoin Premier League Transfers Within A Year,’ Says eToro","Following the bitcoin signing of a Turkish Amateur player in January, could crypto-transfers be heading to the English Premier League? &apos;Yes&apos; and &apos;Soon&apos;, according to eToro&apos;s UK Managing Director, Iqbal V Gandham. Premier League Transfers Paid in Bitcoin eToro announced partnerships with seven Premier League clubs earlier this season, including former champions Leicester City, and Tottenham Hotspur. Each club is receiving sponsorship monies in bitcoin, in return for promoting the platform. The clubs have alsoRead MoreThe post &apos;Bitcoin Premier League Transfers Within A Year,&apos; Says eToro appeared first on Bitcoinist.com.",POSITIVE,없음,ALTCOIN | BTC,,0,0,Bitcoinist,https://bitcoinist.com/premier-league-bitcoin-transfers-etoro/,https://images.cryptocompare.com/news/bitcoinist/9Nam9Qr1UKo.jpeg
