뉴스ID,뉴스GUID,일자(UTC timestamp),뉴스제목,본문,SENTIMENT,주요코인,카테고리,작성자,추천수,비추천수,출처,뉴스URL,이미지URL
42427279,sd6iOBkuiC3F0LYOyK1BDh,1484778559,Coinbase Co-Founder Fred Ehrsam is Leaving the Company,"Former Goldman Sachs trader and Coinbase co-founder Fred Ehrsam is leaving the San Francisco bitcoin startup for new opportunities.  Revealed to the company today via an internal meeting, Ehrsam told CoinDesk he intends to now ""step back"" from his daily duties at the end of January, take some time off, and potentially, plot a new venture in the blockchain industry.  ""There's a high probability it will be in the crypto space,"" he said.  Ehrsam will continue to hold a position on the Coinbase board.  When asked about the reasons behind the move, Ehrsam said that he believes both the company and the wider blockchain industry to be at an ""inflection point"".  ""This is the first time I've thought it could support a diverse set of businesses and ideas,"" he said.  Ehrsam first joined Coinbase at the end of 2012 after exchanging emails with co-founder and CEO Brian Armstrong, who was then building the bitcoin wallet startup at Y Combinator. (Forbes has a longer profile of the story here).  Ehrsam said the move had been discussed for some time, and that, over time, he expects more employees will likely leave Coinbase for new ventures.  Coinbase's first employee, Olaf Carlson-Wee, for example, left the company in July to start a hedge fund focused on the trading of blockchain-based tokens, a funding model of which Ehrsam has emerged as a noteworthy proponent.  ""If you look at the really successful companies, the big ones that emerge in a whole new industry, the most successful ones throw off entrepreneurs,"" he said, adding:  ""It's like the PayPal mafia. We're creating the Coinbase mafia.""  During his time at the startup, Ehrsam made 30 Under 30 lists from publications including Time and Forbes, while also attending high-profile events as a representative of the company.  As part of the news, Coinbase also announced Mike Lempres will be joining as chief legal and risk officer.  The company added in a statement: ""Coinbase has never been in a stronger position and we are optimistic for 2017 and beyond.""  Disclosure: CoinDesk is a subsidiary of Digital Currency Group, which has an ownership stake in Coinbase.  Fred Ehrsam image via YouTube",NEUTRAL,없음,BLOCKCHAIN | BTC | EXCHANGE | REGULATION | TRADING,Pete Rizzo,0,0,CoinDesk,https://coindesk.com/markets/2017/01/18/coinbase-co-founder-fred-ehrsam-is-leaving-the-company,https://cdn.sanity.io/images/s3y3vcno/production/dbadbebab06f43c0806e6900024b6436ab2fb20a-1500x772.png?w=300&h=300&fit=crop
42427265,sd6iOBkuiC3F0LYOyK1Anh,1484776814,Fed Chair Yellen: Blockchain is an 'Important Technology',"Blockchain is an ""important technology"" given its potential impact on the global financial system, Federal Reserve chief Janet Yellen said today.  The remarks were issued during a speech at the Commonwealth Club, a US public affairs forum, in which Yellen took part in a question-and-answer session with club board chair George Scalise.  At one point, Scalise asked Yellen whether the Federal Reserve – which released its first major research paper on distributed ledgers in December – was looking at using the tech for its own purposes.  Here’s what Yellen had to say in response:  ""[Blockchain] is a very important, new technology that could have implications for the way in which transactions are handled throughout the financial system. We're looking at it in terms of its promise in some of the technologies we use ourselves and many financial institutions are looking at it. It could make a big difference to the way in which transactions are cleared and settled in the global economy.""  In a way, Yellen's remarks echo those given in September of last year, when the Fed chair told a Congressional committee that the tech could have ""very significant implications"" for the US payments ecosystem and beyond.  ""I think innovation using these technologies could be extremely helpful and bring benefits to society,"" she said at the time.  The Fed is currently pursuing additional research into the tech, with an eye to release a follow-up paper sometime this year.  Image via Commonwealth Club/YouTube",POSITIVE,없음,BLOCKCHAIN | FIAT | REGULATION | TECHNOLOGY | RESEARCH,Stan Higgins,0,0,CoinDesk,https://coindesk.com/markets/2017/01/18/fed-chair-yellen-blockchain-is-an-important-technology,https://cdn.sanity.io/images/s3y3vcno/production/15d4a911ebeb0e291220dcad7dd90fc666ff883b-1500x732.jpg?w=300&h=300&fit=crop
42427273,sd6iOBkuiC3F0LYOyK1B3h,1484767211,Where's Casper? Inside Ethereum's Race to Reinvent its Blockchain,"If you've been following ethereum at all, you're likely aware the blockchain project has a lot riding on something called 'proof of stake'.  A radical change to how the network forms consensus, the idea is somewhat simple in aim, but potentially history-changing in scope.  The story goes like this: As far back as2011, some developers began to worry about the energy that bitcoin – which uses a process called 'proof of work' (PoW) – would require at scale (some recently estimated that it would consume as much energy as Denmark). Further, bitcoin's mining firms were already becoming big businesses, and there was fear that this change would negatively impact user growth.  Sure, there is the argument that proof-of-work's competition created a more secure network (and that pegging mining competition to Moore's Law led to natural market regulation), but some were eager for a greener alternative.  Enter proof of stake.  To date, the protocol has been embraced by several projects (peercoin, NXT and others) but ethereum's transition would be unique in that it would essentially switch protocols mid-flight, so to speak. As a result, it's faced heavy criticism from those who long have alleged that both PoS, and ethereum's implementation, might not work.  The idea has been met its fair share of skepticism, partly because it's taking a long time to implement a version that developers agree is secure.  In late 2015, Bitfury Group released a white paper exploring the differences between PoW and PoS, and the attack vectors that could have destroyed early “naive” versions of PoS.  Yet, against this backdrop, ethereum developers have continued working on an alternative, arguing that they're making headway.  Work has gone through many iterations and materialized in an idea known as 'Casper', after the movie ghost, which ethereum creator Vitalik Buterin has described as ""consensus by bet"".  Buterin told CoinDesk that the development process is now exploring how to incentivize the functioning of ethereum in a wholly new way, stating:  ""The development process involves heavy exploration of both economic and game-theoretic considerations and Byzantine-fault-tolerant protocols, trying to create a protocol that satisfies one of several constraints simultaneously.""  While Buterin's description may sound complex, what the statement essentially boils down to is that ethereum is still seeking to get its incentive scheme for its proof-of-work alternative right.  As far back as September, both Buterin and fellow developer Vlad Zamfir were working on competing implementations of the idea. Both are essentially betting that the cost of buying physical miners (as well as their competition) can be replicated virtually, given the right conditions.  Now, after years of research, Buterin said, he's ""quite confident on the general principle"" though ""details need to be worked out.""  Casper, explained  The team often holds public discussions on its research, and has posted three open-source simulations so far (the latest, posted in August, is here), which show how the protocol works and that it can converge on one history.  Recently, Buterin offered a research update covering the protocol, while Zamfir has been running a blog series on the history of his thought process. Developer Rick Dudley, computer science PhD student Loi Luu and others have also contributed to the protocol.  To recap, proof of work, used by both bitcoin and ethereum right now, requires a network of powerful computers to validate transactions, and proof of stake is another means to this end.  The goal of both is the same: for the nodes in the network to come to agreement on a correct transaction history.  PoS hasn't been easy to implement, seeing several stages of development since 2013, when Buterin stated that ethereum would ""likely"" switch from PoW.  The first of these stages, which they now call ""naive PoS"", suffers from what has been called the 'nothing-at-stake' problem. It doesn’t punish actors for validating more than one history — meaning the network could easily disagree on the real history.  ""This is clearly a fatal flaw for a technology whose raison d’être is to provide an undisputed canonical order of transactions,"" blockchain consultant Ciaran Murray remarked.  What separates Casper (and other more recent versions) from traditional PoS, is that it punishes participants who don't play by the rules.  Buterin described it with a rough analogy: imagine 100 people sitting around a circular table. One person has a bundle of papers, each with a different transaction history. The first participant picks up a pen and signs one, then passes it onto the next person, who makes a similar choice.  Each participant only gets $1 if they sign the transaction history that most of the participants sign in the end.  ""And if you sign one page and later sign a different page, your house burns down,"" Buterin added, arguing that this is probably a good incentive to sign the right piece of paper.  Remaining problems  But Buterin and others are working on a few remaining problems.  They come down to ""crypto-economics,"" a word often heard in the ethereum community to describe what could be an emerging field of study, focusing on how cryptography can be used to help steer participants in a certain direction with the right incentives.  The best-known example might be PoW, where miners have an incentive to play fair and validate correct transactions, or else they’ll lose money. It drives miners to act honestly by paying them bitcoin.  Buterin and others are trying to get players to continue to play by the rules without the miners.  For it to work, the validators need to behave politely, Buterin said. But, there are some situations where it's more difficult to concoct the right incentives.  One is that, once a block is 'finalized' or added to the blockchain, it shouldn’t be possible for a recent block to be replaced unless most of the validators (who are roughly equivalent to the miners) sign a second time to lose their deposits.  Another is that the validators should be barred from cheating competing validators out of their money (a problem called ""bounding the griefing factor"").  All in all, the way Vitalik sees it, there are three steps left: finalize the algorithm, review it and build a testnet, and then implement it across all seven of the ethereum clients.  Murray said:  ""In attempting to solve the nothing-at-stake problem, the cartel problem and the issue of finality, Casper promises to be, by a distance, the most advanced consensus mechanism to emerge in the public blockchain sphere.""  No deadline  Yet, it remains to be seen when that might be.  ""I prefer not to give timelines,"" Buterin said, though on social media he recently gave a perhaps too rosy estimate of late 2017.  If that's the case, even PoS's skeptics would probably rejoice.  ""If there was a proof-of-stake algorithm, I would probably support it,"" Bitcoin Core contributor Luke Dashjr said earlier this year on social media. Until then, he (and many others) consider it 'vaporware'.  For now, the ethereum community appears eager to see a final version.  However, Murray suggested that even then it will probably need further inspection, saying:  ”I’m looking forward to seeing a full specification of Casper available for peer review in order to ascertain if this complexity may create new problems of its own.”  Purple light image via Shutterstock",NEUTRAL,없음,BLOCKCHAIN | BTC | ETH | TECHNOLOGY | RESEARCH,Alyssa Hertig,0,0,CoinDesk,https://coindesk.com/markets/2017/01/18/wheres-casper-inside-ethereums-race-to-reinvent-its-blockchain,https://cdn.sanity.io/images/s3y3vcno/production/a88df981b471f7e84b2906da2a5c2acde7239df2-2446x1284.png?w=300&h=300&fit=crop
42427277,sd6iOBkuiC3F0LYOyK1B1h,1484758030,Nigeria: Banks That Handle Bitcoin Do So 'At Their Own Risk',"Nigeria’s central bank has a message for domestic financial firms and institutions: don’t touch virtual currencies.  The Central Bank of Nigeria’s Financial Policy and Regulation Department has released a new circular advising banks not to ""use, hold and/or transact in any way"" with the technology. The document cites bitcoin, onecoin, monero and dogecoin as examples, noting that banks that opt to handle digital currencies “do so at [their] own risk”.  Notably, the circular also calls for banks to keep tabs on any customers they may have that operate digital currency exchanges. Specifically, the central bank said that institutions should make sure those exchanges are adhering to AML/KYC rules. Those that aren’t in compliance, the Central Bank of Nigeria said, should have their accounts closed as a result.  The central bank went on to say:  ""Where banks and other institutions are not satisfied with the controls put in place by the virtual currency exchange/customers, the relationship should be terminated immediately….and any suspicious transactions should immediately be reported to the Nigerian Financial Intelligence Unit.""  The release comes more than a year after the central bank issued a call for new regulation for bitcoin. At the time, officials cited money laundering risks as a justification for pursuing possible regulation.  Other parts of the Nigerian government have moved to scrutinize the tech more closely in recent days as well. Earlier this week Nigeria’s top securities regulator warned local investors about buying digital currencies, citing local radio advertisements as a source of concern.  Image via Shutterstock",NEGATIVE,없음,BTC | BUSINESS | FIAT | REGULATION | XMR,Stan Higgins,0,0,CoinDesk,https://coindesk.com/markets/2017/01/18/nigeria-banks-that-handle-bitcoin-do-so-at-their-own-risk,https://cdn.sanity.io/images/s3y3vcno/production/5e11235b144f15a97252e3c4105c6e14f37bc696-1500x1000.jpg?w=300&h=300&fit=crop
42427270,sd6iOBkuiC3F0LYOyK1Avh,1484752207,China's Central Bank Finds Bitcoin Exchanges Out of Step on Regulation,"The business management division of the People's Bank of China (PBOC) has reportedly released the results of a previously announced inspection of domestic bitcoin trading platforms.  In reports today, the central bank is said to have found irregularities in the operations of major bitcoin exchanges BTCC, Huobi and OKCoin that it believes were the cause of abnormal fluctuations in the price of bitcoin.  Specifically, the report concludes that the companies were found to be carrying out margin trading activities, though no details on any punishments were issued.  The reports, by China-based news source Hexun and Jiefang Daily, further state that the platforms were also found to be operating outside of anti-money laundering rules, an area of concern the PBOC previously highlighted in public releases.  It further moved to warn investors about the downside risks of purchasing bitcoin, a product considered under Chinese law to be a ""virtual good"".  In statements, members of China's bitcoin community (perhaps unsurprisingly) sought to downplay the findings.  Eric Zhao, an engineer at the Chinese Academy of Sciences, for instance, told CoinDesk that the result was ""to be expected"", even though he acknowledged that the reports do not provide much detail on what was discovered.  China-based bitcoin mining firm founder Eric Mu, commented similarly, deriding the reports as ""nothing new"".  The news comes nearly two weeks after reports first surfaced that the PBOC had held meetings with the exchanges, a development that followed a rapid increase in the price of bitcoin at the start of 2017.  At press time, only BTCC had issued a formal response via its online Weibo account.  ""BTCC will continue to actively cooperate with the central bank and its associated departments and carry out rectifications. BTCC is currently operating normally,"" the exchange said.  CEO Bobby Lee would not confirm or deny any of the findings, but told CoinDesk that he is looking forward to the results of the report to determine how the market can best move forward in accordance with government guidance.  He added:  ""We're open to all ideas and modifications.""  At time of press, bitcoin was down nearly 5% on the day's trading.  PBOC image via Shutterstock",NEGATIVE,BTC,ASIA | BTC | FIAT | REGULATION | TRADING,Daniel Palmer,0,0,CoinDesk,https://coindesk.com/markets/2017/01/18/chinas-central-bank-finds-bitcoin-exchanges-out-of-step-on-regulation,https://cdn.sanity.io/images/s3y3vcno/production/731779ef4bb2676760fcc8e468441d075765b61d-1500x1125.jpg?w=300&h=300&fit=crop
42427266,sd6iOBkuiC3F0LYOyK1Aph,1484751798,Digital Trade Chain: 7 Banks Could Go Live With Blockchain in 2017,"Seven major European banks are partnering on a new blockchain-based trade finance platform, with a tentative plan to launch sometime in the second half of 2017.  Dubbed Digital Trade Chain (DTC), the initiative grew out of an earlier proof-of-concept spearheaded by Belgium-based bank KBC and first unveiled in July of last year.  Those backing the platform’s development are looking to establish a secure place to manage open account trade transactions for both domestic and international commerce. DTC utilizes a permissioned ledger, with authorized parties allowed to submit transactions on the platform.  Open account trade transactions involve products being shipped before the actual payment is due, meaning that trust among the transaction’s parties is imperative. With DTC, those plugged into the system will be able to track the progression of those transactions, from initiation to settlement.  Thus far, the banks involved – KBC, Deutsche Bank, HSBC, Natixis, Rabobank, Société Générale and UniCredit – have signed a memorandum of understanding that lays out the basic groundwork for future development. That said, the banks are looking to launch DTC sometime in 2017, with an eye to building support in markets like France, Germany and the UK.  In statements to CoinDesk, the banks involved say the goal is to cut transacting costs for European businesses, particularly for more modestly sized firms.  Roberto Mancone, global head of disruptive technologies and solutions for Deutsche Bank, said of the initiative:  “The aim of the platform is to make domestic and cross-border commerce easier for European small and medium-size (SME) businesses by harnessing the power of digital distributed ledger technology.”  Shared costs  Following the expected launch later in 2017, in addition to major markets like Germany and the UK, countries like Belgium, Luxembourg and the Netherlands are also being actively considered for roll-outs.  Andrew Betts, head of global trade and receivable finance for HSBC’s Europe division, said the 2017 release target was an ambitious but realistic one.  “It’s an aggressive timeframe but we believe it’s achievable,” Betts told CoinDesk.  That success, the banks indicated, will be incumbent, at least in part, on attracting a sufficient number of businesses to build a network effect.  ""For DTC to be successful, it needs to be available and accessible by a large number of SMEs – hence the importance of having a number of banks involved,"" Mancone explained.  To help meet that goal, the banks are backstopping the project with an undisclosed amount of capital, with each putting up an equal amount to pay for developers and other costs.  Mancone concluded:  “By pooling our resources, the platform has a greater chance of success.”  Image via Shutterstock",POSITIVE,없음,BLOCKCHAIN | BUSINESS | FIAT | MARKET | TECHNOLOGY,Stan Higgins,0,0,CoinDesk,https://coindesk.com/markets/2017/01/18/digital-trade-chain-7-banks-could-go-live-with-blockchain-in-2017,https://cdn.sanity.io/images/s3y3vcno/production/755bc1ae40f9fb3b8941af3c07f0ef85a0184da3-1500x1000.jpg?w=300&h=300&fit=crop
