뉴스ID,뉴스GUID,일자(UTC timestamp),뉴스제목,본문,SENTIMENT,주요코인,카테고리,작성자,추천수,비추천수,출처,뉴스URL,이미지URL
13587811,https://finbold.com/?p=41680,1648725165,"Ethereum is ‘becoming the collateral of the internet,’ says commodity expert","In recent weeks, the price of Ethereum (ETH) has skyrocketed, with the second-biggest cryptocurrency by market cap climbing by as... Continue reading The post Ethereum is &apos;becoming the collateral of the internet,&apos; says commodity expert appeared first on Finbold.",POSITIVE,ETH,ETH | MARKET | TRADING,,0,0,Finbold,https://finbold.com/ethereum-is-becoming-the-collateral-of-the-internet-says-commodity-expert/,https://images.cryptocompare.com/news/default/finbold.png
13496662,https://coinquora.com/?p=145540,1648725150,"After Security Breach, Axie Infinity Postpones Origin Launch Week","Axie Infinity planned to launch on March 31, however, due to a security breach the Origin launch has been moved ...Read More...",NEGATIVE,없음,AXS,,0,0,Coin Edition,https://coinquora.com/after-security-breach-axie-infinity-postpones-origin-launch-week/,https://images.cryptocompare.com/news/default/coinquora.png
61845,https://www.bitdegree.org/crypto/news/shiba-inu-metaverse-announcement-angers-creator-of-dogecoin,1648725021,"Shiba Inu Announces Metaverse, Dogecoin’s Billy Markus Not Happy About It","The creators behind the second most talked about memecoin SHIB have announced their metaverse initiative. However, the creator of the original altcoin DOGE is skeptical about where this is going.",NEUTRAL,DOGE | SHIB,ALTCOIN | DOGE | SHIB,,0,0,BitDegree,https://www.bitdegree.org/crypto/news/shiba-inu-metaverse-announcement-angers-creator-of-dogecoin,https://resources.cryptocompare.com/news/66/61845.jpeg
13400050,https://www.cryptoknowmics.com/news/?p=230736,1648724704,Number of Norwegian Women Owners of Crypto Doubles,"A recent survey by a well-known research platform reports that the number of Norwegian women who own cryptocurrency has doubled since 2018. The research platform focused on digital assets, Arcane Research shared their findings on Twitter. 420,000 Norwegians (10% of the adult population) own cryptocurrencies Over the last year, we&apos;ve seen a doubling in the female ownership rate in crypto. 330,000 Norwegian adults aged 39 and younger own crypto, compared to 198,000 Norwegians owning stocks.https://t.co/keg8p7xbT8 — Arcane Research (@ArcaneResearch) March 30, 2022 Latest Figures of Crypto Enthusiasts The adult population of Norway consists of 420,000 residents owning cryptocurrencies. The latest figures have been known to have doubled since 2018 when the recorded rate of ownership was 210,000. The growth rate of users joining crypto is even higher than ever, at a recorded number of 255,000 residents of Norway. It is thus proved that the crypto ownership rate in the country has doubled from 5 to 10 percent from 2018 to the present time. Arcane Research&apos;s report explains the figures, stating &apos;Younger adults are far more inclined to own crypto than older adults, with 19 percent of all participants aged 15 to 39 stating that they own crypto compared to 4% of those aged 40 or more.&apos; Women Stake Out Space in Crypto World The survey notes that 63 percent of women revealed that they initially purchased crypto in 2021 or 2022. Women are n...",POSITIVE,없음,RESEARCH,,0,0,Cryptoknowmics,https://www.cryptoknowmics.com/news/number-of-norwegian-women-owners-of-crypto-doubles/,https://images.cryptocompare.com/news/default/cryptoknowmics.png
42422847,sd6iOBkuiC3F0LYOy0qThh,1648724595,Crypto Industry Mobilizes Against Proposed EU Transparency Rules,"Robert Kopitsch has been working around the clock to engage with European Union (EU) lawmakers ahead of a parliamentary committee vote targeting crypto transfers.  Kopitsch, secretary general of Brussels-based lobby group Blockchain for Europe, and other crypto advocates have been rallying supporters worldwide to sway members of the European Parliament’s Committee on Economic and Monetary Affairs. The committee is set to vote Thursday on measures that could effectively end all anonymous crypto transfers in the bloc, require verification of transfers to private or “unhosted” wallets, and prohibit crypto transfers between the EU and tax havens.  The provisions, put in place over concerns that crypto is used for illicit activities such as money laundering and terrorist financing, seem to have the support of a majority of lawmakers. Critics say the measures are a violation of privacy.  “We're encouraging everybody to write to their [representatives], reach out to them with tweets and social media, and to give them the feeling that what they're doing is super wrong. And it's not so easy, obviously, right? Because here, it's a more political topic,” Kopitsch said.  Crypto heavyweights from around the world such as Coinbase (COIN) CEO Brian Armstrong and other EU lawmakers such as Vice President of the European Parliament Eva Kaili have shown support for measures that do not over-regulate the space.  Those in favor of heavy anti-money laundering (AML) measures for crypto transfers including Paul Tang, an EU parliamentarian and chair of the tax committee, took issue with the campaign.  “The #crypto sector demands to be taken seriously yet they refuse to take seriously their role in the fight against criminal money. Their aggressive campaigning only shows that strong regulation is urgently needed,” he tweeted on Wednesday.  Kopitsch agreed regulation is needed, but said the proposed regulations may be too heavy handed. “They think that all the transactions that run [on] crypto are all done by criminals. It's all money laundering. It's all child pornography, terrorist financing,” Kopitsch said, adding that politicians in favor of such provisions do not see the many benefits of crypto and their underlying technologies.  From Germany, Patrick Hansen, head of strategy at Unstoppable Finance, and an outspoken critic of the provision calling for AML checks on transfers to unhosted wallets, has also been rallying members of the crypto community to engage with lawmakers.  Both Kopitsch and Hansen say the vote is too close to call.  The MiCA campaign  Earlier this month, lobbying by the industry reaped benefits. Hansen spearheaded a campaign to persuade an economic committee to vote against a provision in a draft of the Markets in Crypto Assets (MiCA) regulations, the EU’s main legislation package for governing crypto assets, that would have effectively outlawed popular cryptocurrencies like bitcoin and ether.  While that provision did not make it through the vote, Hansen and others were quite certain that even if wasn't rejected at the committee stage, it would not make it into the final version of the legislation after further negotiations with the EU government branches.  But in this case, Hansen fears that if it goes through, the provision on AML checks for transfers to unhosted wallets may make it to the final draft.  “There might be a window of opportunity to change minor things, but the chances are way higher that if it goes through the parliament committee on Thursday, and then it's not challenged, that basically this will just be adopted,” Hansen said.  Meanwhile, Hansen said another provision, calling for an end to the 1,000 euro ($1,100 U.S.) minimum threshold for reporting crypto transactions, is likely to make it through the committee vote.  “I feel like if there is multi-party support for dropping that threshold, who should we convince? ... Generally, everyone's in favor. So let's focus on more contentious issues,” Hansen said, referring to the provision involving unhosted wallets.  Read more: Crypto Privacy Positions Harden Ahead of Crunch EU Vote  UPDATE (April 2, 2022, 14:00 UTC): Adds additional comment from Robert Kopitsch.",NEGATIVE,없음,BLOCKCHAIN | BTC | EXCHANGE | MARKET | REGULATION,Sandali Handagama,0,0,CoinDesk,https://coindesk.com/policy/2022/03/31/crypto-industry-mobilizes-against-proposed-eu-transparency-rules,https://images.cryptocompare.com/news/default/coindesk.png
13266150,https://ambcrypto.com/?p=225457,1648724428,IOST launches Project Entroverse to become EVM-compatible,"Ultra-fast, scalable, next-generation smart-contract platform IOST (IOST) announces a major strategic move of launching a Secret Weapon called Project Entroverse. IOST&apos;s Project Entroverse gears towards capitalizing on the craze of Dapps on Ethereum and its network to ramp up the IOST ecosystem. The kick-off of Project Entroverse enables IOST to inch closer to becoming a ...",POSITIVE,없음,ETH,,0,0,AMB Crypto,https://ambcrypto.com/iost-launches-project-entroverse-to-become-evm-compatible/,https://images.cryptocompare.com/news/default/ambcrypto.png
13334044,https://cointelegraph.com/news/investment-tracker-delta-expands-its-web3-offering-with-an-nft-explorer,1648724400,Investment tracker Delta expands its Web3 offering with an NFT explorer,"The new NFT tracker and explorer services will support Ethereum wallets to start with, while multi-chain support is expected to arrive by the end of the year.",POSITIVE,없음,ETH | ICO,,0,0,CoinTelegraph,https://cointelegraph.com/news/investment-tracker-delta-expands-its-web3-offering-with-an-nft-explorer,https://images.cryptocompare.com/news/default/cointelegraph.png
4353899,ted-cruzs-senate-bill-on-cbdcs-replicates-january-house-proposal,1648724385,Ted Cruz’s Senate Bill on CBDCs Replicates January House Proposal,The senator’s legislation calls to prohibit the Federal Reserve from issuing a government-backed currency to individuals,NEGATIVE,없음,FIAT | REGULATION,,0,0,Blockworks,https://blockworks-editorial-gefdq3na6-blockworks.vercel.app/news/ted-cruzs-senate-bill-on-cbdcs-replicates-january-house-proposal,https://images.cryptocompare.com/news/default/blockworks.png
13496663,https://coinquora.com/?p=145386,1648723800,"SWOOSH! DC Announces 200,000 Unique Batman NFTs in Cowl Collection","Warner Bros. Consumer Products and Palm NFT Studio announce the Bat Cowl Collection. The Collection includes 200,000 3D-rendered Batman cowl ...Read More...",POSITIVE,없음,OTHER,,0,0,Coin Edition,https://coinquora.com/swoosh-dc-announces-200000-unique-batman-nfts-in-cowl-collection/,https://images.cryptocompare.com/news/default/coinquora.png
13266151,https://ambcrypto.com/?p=225433,1648723559,The AEX platform token GAT’s price rise leads the crypto revival trend,"Crypto market obtained its reverse in March after two months of dropping. When Bitcoin reached its peak at $48,000, the whole capital market focused on cryptocurrency again. The International Ecosystem Plan launched by AEX Global attracted the attention of users worldwide and with the promotion of AEX Vietnam Support Fund of $100 million, AEX Platform ...",POSITIVE,없음,BTC | ICO | MARKET | TRADING,,0,0,AMB Crypto,https://ambcrypto.com/the-aex-platform-token-gats-price-rise-leads-the-crypto-revival-trend/,https://images.cryptocompare.com/news/default/ambcrypto.png
13458657,https://www.cryptonewsz.com/?p=134014,1648723535,Aradena Announces Pre-Seed Round Headed by Animoca Brands,"Aradena, which created a popular Play-and-Earn medieval metaverse, announced that a pre-seed equity financing headed by Animoca Brands had been completed. Aradena is paving the way for the next generation of blockchain gaming by making peer-to-peer (P2P) games as enjoyable to play as traditional games. Aradena provides users with a range of the latest economic …",POSITIVE,없음,BLOCKCHAIN,,0,0,CryptoNewsZ,https://www.cryptonewsz.com/aradena-announces-pre-seed-round-headed-by-animoca-brands/,https://images.cryptocompare.com/news/default/cryptonewsz.png
13480884,https://cryptobriefing.com/?p=113684,1648722853,"NFT Project Spotlight: Edenhorde, the NFT-Based Immersive World",,POSITIVE,없음,OTHER,,0,0,Crypto Briefing,https://cryptobriefing.com/nft-project-spotlight-edenhorde-the-nft-based-immersive-world/?utm_source=main_feed&utm_medium=rss,https://images.cryptocompare.com/news/default/cryptobriefing.png
13400051,https://www.cryptoknowmics.com/news/?p=230730,1648722817,"Chandler, Arizona Accepts Cryptocurrency Via PayPal","A city in Arizona named Chandler has begun accepting cryptocurrency as a mode of payment to pay utility bills. Customers who have their cryptocurrency linked to PayPal can clear out their bills. Chandler Decides To Evolve The decision to adopt cryptocurrency as a mode of payment was in talks during March. Followed by the authorities determining if this was the feasible option for residents of Chandler or not. Chandler is known to be one of the first &apos;valley&apos; cities to offer cryptocurrency payment. A council member of Chandler, Mark Strewart states, &apos;Digital currency and blockchain are advancing quickly, and as the Community of Innovation, we feel it is important to be on the forefront of this technology and offer it to our residents as a payment method for utility payments and other fees.&apos; How Does Crypto Payment Function Via PayPal? By opting for PayPal as the mode of payment, the cryptocurrency option will be immediately displayed during the checkout. It must be noted that only customers who are logged in can avail this option. The city of Arizona has also requested its present payment partner Invoice Cloud to incorporate an additional payment option to pay utility bills. The Deputy City Manager, Dawn Lang briefly explains, &apos;Invoice Cloud will manage the conversion of cryptocurrency payment into dollars, thereby eliminating any market volatility risk for Chandler.&apos; It must be highlighted that Chandler is not the first city i...",POSITIVE,없음,BLOCKCHAIN | BTC | ETH | LTC | MARKET,,0,0,Cryptoknowmics,https://www.cryptoknowmics.com/news/chandler-arizona-accepts-cryptocurrency-via-paypal/,https://images.cryptocompare.com/news/default/cryptoknowmics.png
13266152,https://ambcrypto.com/?p=225375,1648722637,XLM or XRP- Decoding LatAm’s crypto cross-border remittance preference,"Cross border remittances are a matter of life and death as the Russia-Ukraine war and Afghanistan&apos;s frozen funds have shown us. However, there are plenty of high-stakes use cases for crypto investors even in less precarious financial situations. I said, don&apos;t cross me! This naturally raises the question of which crypto might be best suited ...",NEUTRAL,XLM,BUSINESS | XLM,,0,0,AMB Crypto,https://ambcrypto.com/xlm-or-xrp-decoding-latams-crypto-cross-border-remittance-preference/,https://images.cryptocompare.com/news/default/ambcrypto.png
13290176,https://cryptonews.com/news/financial-markets-not-ready-for-bitcoin-backed-bonds-microstrategy-ceo.htm,1648722480,Financial Markets Not Ready for Bitcoin-Backed Bonds – MicroStrategy CEO,"The financial markets of the world are not ready for bonds backed by bitcoin (BTC) yet, according to the CEO of the enterprise software firm MicroStrategy, Michael Saylor. However, El Salvador&apos;s planned &apos;volcano bonds&apos; could be a different story....Read More: Financial Markets Not Ready for Bitcoin-Backed Bonds - MicroStrategy CEO",NEUTRAL,BTC,BTC | BUSINESS | MARKET | TECHNOLOGY,,0,0,cryptonews,https://cryptonews.com/news/financial-markets-not-ready-for-bitcoin-backed-bonds-microstrategy-ceo.htm,https://images.cryptocompare.com/news/default/cryptonews.png
13388057,https://decrypt.co/?p=96515,1648722426,Game Developer Faces User Backlash Following FTX Acquisition,"Players of Storybook Brawl are up in arms against FTX&apos;s purchase of the free-to-play game&apos;s developer, Good Luck Games.",NEGATIVE,없음,BUSINESS | FTT,,0,0,Decrypt,https://decrypt.co/96515/game-developer-faces-user-backlash-following-ftx-acquisition,https://images.cryptocompare.com/news/default/decrypt.png
13400052,https://www.cryptoknowmics.com/news/?p=230731,1648722130,Burger Joint Pickl Becomes the First Restaurant to Enter the Metaverse,"Burger joint Pickl has become the first UAE-based restaurant to enter the metaverse. The food outlet also plans to launch its first virtual restaurant later this year. UAE Restaurant Goes Metaverse Pickl customers exploring the Metaverse will be able to participate in brand-themed games, purchase Pickl-inspired NFTs, virtual apparel which can be worn by their virtual avatar or exchanged for Pickl apparel in physical stores. Pickl intends to create a virtual restaurant in the metaverse that would replicate the full customer experience of the real world. The company also plans to integrate a real-world delivery services. For instance, when a customer orders Nashville chicken Sando or double cheeseburger in the metaverse, it will get delivered to their in-real doorsteps. &apos;We are excited to take our first steps into the metaverse with the launch of a digital Pickl. It&apos;s the beginning of what we are sure will be a bright future for the brand in the virtual world. In the short term, we will be able to hold meetings with our international teams and showcase our brand to our franchise partners in the metaverse, giving us greater global reach than ever before,&apos; Pickl founder and CEO, Steve Flawith, said. Pickl fans exploring the #Metaverse will be able to participate in exclusive brand-themed games, purchase virtual apparel, and pick up @eatpickl-inspired #NFTs, which can be redeemed for physical items or be used as virtual apparel to ...",POSITIVE,없음,OTHER,,0,0,Cryptoknowmics,https://www.cryptoknowmics.com/news/burger-joint-pickl-becomes-the-first-restaurant-to-enter-the-metaverse/,https://images.cryptocompare.com/news/default/cryptoknowmics.png
13496664,https://coinquora.com/?p=145434,1648721909,Large-scale Crypto Miners in Texas May Struggle With New Policies,Crypto miners in Texas are facing new challenges with the &apos;approval to energize&apos; studies. The first notice was announced on ...Read More...,NEUTRAL,없음,BLOCKCHAIN | MINING,,0,0,Coin Edition,https://coinquora.com/large-scale-crypto-miners-in-texas-may-struggle-with-new-policies/,https://images.cryptocompare.com/news/default/coinquora.png
13571331,https://www.cryptopolitan.com/?p=161173,1648721771,DeFi TVL rise as crypto market booms,TL; DR Breakdown DeFi TVL increases as crypto market surges Tokens are seeing two-digit gains NFT market continues to surge The tale of the crypto market has been bittersweet since ...,POSITIVE,없음,ICO | MARKET,,0,0,Cryptopolitan,https://www.cryptopolitan.com/defi-tvl-rise-as-crypto-market-booms/,https://images.cryptocompare.com/news/default/cryptopolitan.png
13458658,https://www.cryptonewsz.com/?p=134000,1648721747,OCI Is Enlisted by EOS Network to Implement Transaction Lifecycle Features,"After collaborating with hundreds of contributors in EOS Network Foundation (ENF)-sponsored working groups, their research has resulted in the publication of four EOS Blue Papers: Audit+: For EOSIO-based applications, it provides an overarching framework for security analysis tooling and contract audit. Core+: Reestablishing EOSIO as a global leader in blockchain technology. API+: Allowing the next …",NEUTRAL,없음,BLOCKCHAIN | MARKET | TECHNOLOGY | RESEARCH,,0,0,CryptoNewsZ,https://www.cryptonewsz.com/oci-is-enlisted-by-eos-network-to-implement-transaction-lifecycle-features/,https://images.cryptocompare.com/news/default/cryptonewsz.png
13266153,https://ambcrypto.com/?p=225421,1648721715,Chimeras P2E metaverse launches alpha version and new NFT collection,"Chimeras is launching the Alpha Version of the game, which becomes available to users from March 30th and will last for 2-3 months. Accompanying the Alpha game launch, the Chimeras metaverse is announcing the sale of brand new NFT packs containing regular in-game characters. The launch of the Chimeras game is divided into 2 stages. ...",POSITIVE,없음,OTHER,,0,0,AMB Crypto,https://ambcrypto.com/chimeras-p2e-metaverse-launches-alpha-version-and-new-nft-collection/,https://images.cryptocompare.com/news/default/ambcrypto.png
13388058,https://decrypt.co/?p=96513,1648721583,Metaverse Cryptocurrencies Enjoy Bullish Week Despite Axie Infinity's Ronin Hack,"Gaming and NFT cryptos including Enjin and The Sandbox have risen over the week, despite a $552 million hack of Axie Infinity&apos;s Ronin sidechain.",POSITIVE,없음,AXS | ENJ | MARKET | TRADING,,0,0,Decrypt,https://decrypt.co/96513/gaming-nft-cryptocurrencies-enjoy-bullish-week-axie-infinity-hack,https://images.cryptocompare.com/news/default/decrypt.png
13413838,https://coinpedia.org/?p=122687,1648721229,"Aquasis Protocol (AQS) To See 10,000% Gains Like Solana (SOL) & Gala Games (GALA)","The post Aquasis Protocol (AQS) To See 10,000% Gains Like Solana (SOL) &amp; Gala Games (GALA) appeared first on Coinpedia - Fintech &amp; Cryptocurreny News Media| Crypto GuideSolana (SOL) and Gala Games (GALA) were two of the most successful coins in 2021 and made their long term holders or HODLers a lot of money. Solana (SOL) rose to success as the number one &apos;Ethereum Killer&apos; whilst Gala Games (GALA) capitalised on the explosion of the Metaverse into our lives. A great way …",POSITIVE,SOL | GALA,BLOCKCHAIN | SOL | GALA,,0,0,coinpedia,https://coinpedia.org/guest-post/aquasis-protocol-aqs-to-see-10000-gains-like-solana-sol-gala-games-gala/,https://images.cryptocompare.com/news/default/coinpedia.png
13571332,https://www.cryptopolitan.com/?p=161169,1648721184,"Pokmi Announces Token Listing on MEXC, Aims to Reshape The Adult Entertainment Industry","Los Angeles, USA, 31st March, 2022, Chainwire Pokmi, home to the biggest and largest decentralized uncensored collection on the internet, will be rolling out its multi-chain token POKEN ($PKN) on ...",POSITIVE,없음,ICO | TOKEN LISTING AND DELISTING,,0,0,Cryptopolitan,https://www.cryptopolitan.com/pokmi-announces-token-listing-on-mexc-aims-to-reshape-the-adult-entertainment-industry/,https://images.cryptocompare.com/news/default/cryptopolitan.png
13411503,https://blockworks.co/?p=19648,1648720800,"Blockchain Gaming Firm Cross The Ages Gets $12M From Ubisoft, Polygon","The NFT blockchain-based game has attracted a large pool of talent including 70 artists from well known titles including Star Wars and GOTThe post Blockchain Gaming Firm Cross The Ages Gets $12M From Ubisoft, Polygon appeared first on Blockworks.",POSITIVE,없음,BLOCKCHAIN | MARKET | MATIC,,0,0,Blockworks,https://blockworks.co/blockchain-gaming-firm-cross-the-ages-gets-12m-from-ubisoft-polygon/,https://images.cryptocompare.com/news/default/blockworks.png
13458659,https://www.cryptonewsz.com/?p=133999,1648720766,Kitty Party Integrates Price and Chainlink Keepers and Feeds for Better Experience,"Chainlink Keepers and Chainlink Price Feeds have been incorporated into the Polygon mainnet by Kitty Party, a DeFi platform aimed toward onboarding Web3 beginners. With this integration, Kitty party will now have access to Chainlink Keepers&apos; secure smart contract automation solution to reduce Kittens&apos; manual labor by leveraging the industry-leading decentralized oracle network. Kittens may …",POSITIVE,없음,LINK | MATIC | TRADING,,0,0,CryptoNewsZ,https://www.cryptonewsz.com/kitty-party-integrates-price-and-chainlink-keepers-and-feeds-for-better-experience/,https://images.cryptocompare.com/news/default/cryptonewsz.png
13400053,https://www.cryptoknowmics.com/news/?p=230728,1648720032,MANA Technical Analysis: Buyers Finally Break The Formidable Trendline,"MANA coin price shows a bullish recovery surpassing the long-coming trendline. Will this breakout shape a new upside trend? Key technical points: MANA prices gained 25% in the last ten days. Next, the meta token price surpasses the 100-day EMA. Finally, the 24-hour trading volume of Decentraland is $544 Million, marking a 13% rise. Past Performance of MANA MANA coin price action shows a long coming resistance trendline in the daily chart that has crushed multiple bullish recoveries. However, the recent reversal from the $2 mark accounts for a 25% price jump and tests the confluence of the resistance trendline and the $2.81 horizontal level. Source-Tradingview MANA Technical Analysis MANA prices show a symmetrical triangle pattern in the daily chart with the uptrend testing confluence of resistance trendline and $2.81 level. However, the long-wick formation warns of a bearish reversal. The crucial daily EMAs (50, 100, and 200-days) strive to regain the bullish alignment with the 50 and 100-day EMA crossover. Meanwhile, the 200-day EMA stands strong at $2.45 and continues the sideways trend. RSI Indicator: The RSI slope crosses above the halfway mark and shows a bullish continuation above the 14-day SMA. Hence, the indicator reflects a solid underlying bullishness. MACD Indicator: The MACD and signal lines significantly spread as they surpass the zero value mark. Moreover, the rising trend in bullish histograms highlights a soli...",POSITIVE,MANA,ICO | MANA | MARKET | TRADING,,0,0,Cryptoknowmics,https://www.cryptoknowmics.com/news/mana-technical-analysis-buyers-finally-break-the-formidable-trendline/,https://images.cryptocompare.com/news/default/cryptoknowmics.png
13442265,https://bitcoinist.com/?p=176575,1648719915,From Dep’t Chief To CEO: Grab Exec Resigns To Lead Metaverse Gaming Company,"The skills shortage from Web2 to Web3 continues with the disclosure of a senior executive leaving food-delivery Grab to join a blockchain gaming company. According to a Bloomberg report on Wednesday, Wui Ngiap Foo — the head of technology at Asian ride-hailing app Grab — is quitting to lead a metaverse game company. Foo was ...",POSITIVE,없음,BLOCKCHAIN | TECHNOLOGY,,0,0,Bitcoinist,https://bitcoinist.com/grab-senior-exec-resigns/,https://images.cryptocompare.com/news/default/bitcoinist.png
