뉴스ID,뉴스GUID,일자(UTC timestamp),뉴스제목,본문,SENTIMENT,주요코인,카테고리,작성자,추천수,비추천수,출처,뉴스URL,이미지URL
4167648,https://www.cryptopolitan.com/?p=237523,1668338037,Dogecoin price analysis: Expectations remain low as bears cause a downturn up to $0.08584,"Dogecoin price analysis is showing bearish results for the day as the price underwent a loss once again. The price has decreased up to $0.08584, continuing the downtrend that started during the last week. The short-term trending line is going downwards, which means that the bears are in the leading position. The price is on … Dogecoin price analysis: Expectations remain low as bears cause a downturn up to $0.08584 Read More »",NEGATIVE,없음,DOGE | MARKET | TRADING,,0,0,Cryptopolitan,https://www.cryptopolitan.com/dogecoin-price-analysis-2022-11-13/,https://resources.cryptocompare.com/news/43/4167648.jpeg
4167232,https://news.bitcoin.com/?p=558369,1668337253,FTX Collapse: Africa-Focused Payments Firm AZA Finance Slams ‘Erroneous Inclusion’ in FTX Bankruptcy Filing,"The founder and CEO of an Africa-focused payments firm, Elizabeth Rossiello, claimed on Nov. 11 that the beleaguered crypto exchange FTX had incorrectly included AZ Finance in its chapter 11 bankruptcy protection filing. The CEO insisted that her firm does not hold customer funds and is presently taking steps to correct the “erroneous court filings.”",NEUTRAL,없음,EXCHANGE | SPONSORED,,0,0,Bitcoin.com,https://news.bitcoin.com/ftx-collapse-africa-focused-payments-firm-aza-finance-slams-erroneous-inclusion-in-ftx-bankruptcy-filing/,https://resources.cryptocompare.com/news/14/4167232.jpeg
4167164,https://www.cryptopolitan.com/?p=237501,1668337184,Solana price analysis: SOL/USD depreciates to $13.85  after a bearish run,Solana price analysis reveals that the cryptocurrency has been facing a downward trend today as the bears are in control of the market and are likely to maintain their momentum. The bears have caused a decrease in the price up to the $13.85 level. Solana is ranked number 14 in terms of cryptocurrency and this … Solana price analysis: SOL/USD depreciates to $13.85 after a bearish run Read More »,NEGATIVE,SOL,MARKET | SOL | TRADING,,0,0,Cryptopolitan,https://www.cryptopolitan.com/solana-price-analysis-2022-11-13/,https://resources.cryptocompare.com/news/43/4167164.jpeg
4167077,https://cryptonews.com/news/former-us-treasury-compares-ftx-collapse-infamous-enron-fraud-crypto-regulation-incoming.htm,1668336780,Former US Treasury Compares FTX Collapse to Infamous Enron Fraud –  Crypto Regulation Incoming?,"Former Treasury Secretary Larry Summers has compared the sudden fall of cryptocurrency exchange FTX to energy trader Enron's scandal in the early 2000s. In a ""Wall Street Week"" interview with Bloomberg, he said that while ""a lot of"" people have compared this to Lehman, he believes it is more similar to Enron's scandal. ... Read More: Former US Treasury Compares FTX Collapse to Infamous Enron Fraud – Crypto Regulation Incoming?",NEGATIVE,없음,EXCHANGE | REGULATION,,0,0,cryptonews,https://cryptonews.com/news/former-us-treasury-compares-ftx-collapse-infamous-enron-fraud-crypto-regulation-incoming.htm,https://resources.cryptocompare.com/news/52/4167077.jpeg
4203560,https://coinpedia.org/?p=164171,1668336759,"Orbeon Protocol (ORBN) Could Rise 60x in Presale, Whilst Hedera (HBAR) Struggles To Post Gains","The post Orbeon Protocol (ORBN) Could Rise 60x in Presale, Whilst Hedera (HBAR) Struggles To Post Gains appeared first on Coinpedia Fintech News There’s a new project emerging that is quickly becoming a favorite of the most experienced crypto investors. Orbeon Protocol is in stage 1 of its presale and is predicted to surge by over 60x, and with projects like Hedera seeing their HBAR token struggling to post any price growth, many are wondering whether Orbeon’s dramatic …",POSITIVE,HBAR,BLOCKCHAIN | BUSINESS | ICO | ZRX | HBAR,,0,0,coinpedia,https://coinpedia.org/press-release/orbeon-protocol-orbn-could-rise-60x-in-presale-whilst-hedera-hbar-struggles-to-post-gains/,https://images.cryptocompare.com/news/default/coinpedia.png
4165722,https://dailyhodl.com/?p=225145,1668334511,"Top Crypto Strategist Warns Dogecoin and Polygon Holders, Says DOGE and MATIC Could Witness Drastic Corrections","A crypto analyst who continues to build a following with accurate Bitcoin and altcoin calls as of late is addressing holders of Dogecoin (DOGE) and Polygon (MATIC). Pseudonymous analyst Capo tells his 647,500 Twitter followers that leading meme token DOGE will likely lose nearly 90% of its value after flipping support at $0.15 into resistance. The post Top Crypto Strategist Warns Dogecoin and Polygon Holders, Says DOGE and MATIC Could Witness Drastic Corrections appeared first on The Daily Hodl .",NEGATIVE,DOGE | MATIC,ALTCOIN | BTC | DOGE | MATIC | TRADING,,0,0,The Daily Hodl,https://dailyhodl.com/2022/11/13/top-crypto-strategist-warns-dogecoin-and-polygon-holders-says-doge-and-matic-could-witness-drastic-corrections/,https://images.cryptocompare.com/news/default/dailyhodl.png
4165013,https://cryptopotato.com/?p=224058,1668333182,Solana Crashes 12% Overnight as Crypto Markets Bleed Out (Market Watch),Solana crashed by around 12% in the past 24 hours as the market continues bleeding out following the FTX fallout.,NEGATIVE,없음,MARKET | SOL,,0,0,Crypto Potato,https://cryptopotato.com/solana-crashes-12-overnight-as-crypt-markets-bleed-out-market-watch/,https://resources.cryptocompare.com/news/27/4165013.jpeg
4165240,https://www.cryptopolitan.com/?p=237054,1668332220,"Cryptocurrencies That Will Survive The Bear Market: Dogecoin, Cardano And BudBlockz","Cryptocurrencies are going through a bear market, and many might not survive in the long run. However, a few have the potential to make it through. Three cryptocurrencies that have the potential to survive are Dogecoin, Cardano, and BudBlockz. These cryptocurrencies have unique features that could help them thrive in the bear market. We will … Cryptocurrencies That Will Survive The Bear Market: Dogecoin, Cardano And BudBlockz Read More »",NEUTRAL,없음,ADA | DOGE | MARKET | TRADING,,0,0,Cryptopolitan,https://www.cryptopolitan.com/cryptocurrencies-that-will-survive-the-bear-market-dogecoin-cardano-and-budblockz/,https://resources.cryptocompare.com/news/43/4165240.jpeg
4164435,https://www.cryptopolitan.com/?p=237485,1668332147,Litecoin price analysis: Bears drag price level down to $58.16 in the latest strike,"Litecoin price analysis shows that the market for this cryptocurrency has been in a downtrend over the past few hours. The price level is currently facing rejection at $60.82, and heavy selling pressure is limiting any upward momentum. Support can be found at the $58.15 extreme, which represents an important level of support for the … Litecoin price analysis: Bears drag price level down to $58.16 in the latest strike Read More »",NEGATIVE,없음,LTC | MARKET | TRADING,,0,0,Cryptopolitan,https://www.cryptopolitan.com/litecoin-price-analysis-2022-11-13/,https://resources.cryptocompare.com/news/43/4164435.jpeg
4164249,https://ambcrypto.com/?p=270441,1668331814,Assessing DOGE’s odds of sustaining its bullish momentum amid ongoing unrest,"Dogecoin [DOGE] rallied 5.84% between 11 and 12 November, in the opposite direction, as opposed to most assets in the top ten. The current trend of the memecoin was different to what it was before the price increase. According to CoinMarketCap, DOGE had initially decreased to $0.81. Notable was the fact that it had been",NEUTRAL,DOGE,ALTCOIN | DOGE | TRADING,,0,0,AMB Crypto,https://ambcrypto.com/assessing-doges-odds-of-sustaining-its-bullish-momentum-amid-ongoing-unrest/,https://images.cryptocompare.com/news/default/ambcrypto.png
4164295,https://news.bitcoin.com/?p=558266,1668331812,"From Mercedes F1 to Miami Heat, Sports Teams Suspend FTX Sponsorships",A string of organizations competing in various sports are pulling out of sponsorship deals with beleaguered cryptocurrency exchange FTX. The coin trading platform had pledged millions of dollars to building up brand recognition among sports fans before it went bankrupt. FTX Sign Being Dismantled as Miami Heat Seeks New Naming Rights Partner for Its Arena,NEGATIVE,없음,EXCHANGE | TRADING,,0,0,Bitcoin.com,https://news.bitcoin.com/from-mercedes-f1-to-miami-heat-sports-teams-suspend-ftx-sponsorships/,https://resources.cryptocompare.com/news/14/4164295.jpeg
4163033,https://cointelegraph.com/news/vitalik-buterin-calls-out-ftx-for-virtue-signaling-deserves-what-its-getting,1668329400,Vitalik Buterin calls out FTX for virtue signaling:  ‘Deserves what it’s getting’,"While acknowledging the damage caused by FTX, Buterin believes that FTX CEO Sam Bankman-Fried, as a person, deserves love.",NEUTRAL,없음,ETH | EXCHANGE | BNB,,0,0,CoinTelegraph,https://cointelegraph.com/news/vitalik-buterin-calls-out-ftx-for-virtue-signaling-deserves-what-its-getting,https://resources.cryptocompare.com/news/16/4163033.jpeg
4202474,https://coinpedia.org/?p=164166,1668327556,Uniglo.io begins to gain momentum after massive burn announcement alongside Shiba Inu and Dogecoin,The post Uniglo.io begins to gain momentum after massive burn announcement alongside Shiba Inu and Dogecoin appeared first on Coinpedia Fintech News Uniglo recently sent shockwaves throughout the crypto presale world by announcing the platform will carry out a mega-burn event after it officially launches in just a few days. This adds to GLO’s already-incredible ongoing burn credentials and could help skyrocket the token’s price to the moon and beyond over the coming months. If you missed …,POSITIVE,없음,DOGE | ICO | SHIB | TRADING,,0,0,coinpedia,https://coinpedia.org/press-release/uniglo-io-begins-to-gain-momentum-after-massive-burn-announcement-alongside-shiba-inu-and-dogecoin/,https://images.cryptocompare.com/news/default/coinpedia.png
4190977,https://timestabloid.com/?p=11888,1668327402,WAHED Coin to Launch on LBank Exchange on December 5,"Cranfield, England, 13th November, 2022, Chainwire WAHED Coin, the native cryptocurrency of the WAHED ecosystem, is to be listed on LBank on December 5. The asset powers a growing array of features within WAHED’s next-generation investment hub. The listing of WAHED Coin on LBank will make the digital asset available to a global audience, empowering The post WAHED Coin to Launch on LBank Exchange on December 5 appeared first on Times Tabloid .",NEUTRAL,없음,EXCHANGE,,0,0,TimesTabloid,https://timestabloid.com/wahed-coin-to-launch-on-lbank-exchange-on-december-5/,https://resources.cryptocompare.com/news/67/default.png
4161493,https://dailyhodl.com/?p=225122,1668326685,Here’s How Long Crypto Needs To Recover From Embarrassing FTX Mess: Analyst Nicholas Merten,"Popular analyst Nicholas Merten is laying out a timeline for Bitcoin (BTC) and crypto to recover from the collapse of digital asset exchange FTX and its associated entities. In a new strategy session, Merten tells his 512,000 YouTube subscribers that with Bitcoin showing obvious weakness as it remains below the 200-week moving average, another leg The post Here’s How Long Crypto Needs To Recover From Embarrassing FTX Mess: Analyst Nicholas Merten appeared first on The Daily Hodl .",NEUTRAL,BTC,BTC | EXCHANGE | TRADING,,0,0,The Daily Hodl,https://dailyhodl.com/2022/11/13/heres-how-long-crypto-needs-to-recover-from-embarrassing-ftx-mess-analyst-nicholas-merten/,https://images.cryptocompare.com/news/default/dailyhodl.png
42388654,1WhGe7o17bdD4QO5qRQJ3Z,1668325050,"Binance, Huobi Block FTT Deposits After $400M Worth of Tokens Unexpectedly Released","Crypto exchanges Binance and Huobi blocked deposits of FTT, FTX’s native tokens, Sunday after about $400 million worth of the tokens were released out of schedule, with no official explanation.  FTT tokens follow an unlocking schedule wherein large batches of the tokens are periodically released. On Sunday, however, the tokens were released out of schedule without warning or communication from FTX or related parties.  Over 192 million FTT tokens were released, blockchain data shows. These were released from the main deployer address.  Binance founder Changpeng Zhao noted on Twitter: “Binance has stopped FTT deposit, to prevent potential of questionable additional supplies affecting the market. Also encourage other exchanges to do the same.”  Justin Sun-backed Huobi Global followed the move shortly afterwards. “(We) will closely monitor the situation,” Sun tweeted.  The FTT release follows the week-long drama involving FTX, which filed for Chapter 11 bankruptcy protection on Friday. Contagion risks are now permeating throughout the broader crypto market.  The FTT token fell 18% on Sunday to $1.78. The spectacular collapse of the FTX exchange has led to price declines on eight of the past nine days, leaving it down 93% just in November alone.  A year ago, FTT's market capitalization stood at around $8 billion, and now it's down to about $350 million, according to CoinGecko, though the new questions about the token's circulating supply might complicate the calculation.",NEGATIVE,FTT,BLOCKCHAIN | EXCHANGE | MARKET | BNB | FTT,Shaurya Malwa,0,0,CoinDesk,https://coindesk.com/business/2022/11/13/binance-huobi-block-ftt-deposits-after-420m-worth-of-tokens-illicitly-released,https://cdn.sanity.io/images/s3y3vcno/production/d16543e94117c00850a068d36e8a92f535ff52e8-1440x1080.jpg?w=300&h=300&fit=crop
4160442,https://news.bitcoin.com/?p=558305&preview=true&preview_id=558305,1668324659,Indian Authority Freezes 150 Bitcoins Held at Binance Crypto Exchange,"India’s Enforcement Directorate (ED) says that it has frozen 150.22 more bitcoins held at cryptocurrency exchange Binance. The freeze is part of an investigation into mobile gaming application E-nuggets, which was designed to defraud the public, the ED said. India Freezes More Bitcoins at Binance India’s Enforcement Directorate (ED) announced Friday that it has frozen",NEGATIVE,없음,EXCHANGE | REGULATION | BNB,,0,0,Bitcoin.com,https://news.bitcoin.com/indian-authority-freezes-150-bitcoins-held-at-binance-crypto-exchange/,https://resources.cryptocompare.com/news/14/4160442.jpeg
4160397,https://ambcrypto.com/?p=270486,1668324603,Attention KCS holders! This week may be far from your expectations because…,"Crypto assets or firms, thanks to the FTX exposure, are either being dumped like FTT or closing shop like BlockFi. And allegedly KuCoin exchange’s exposure to FTX spooked users. Amidst the overall bearish market sentiment and BTC struggling to break the $18K resistance, users feared the exchange could be adversely affected alongside its native token",NEGATIVE,BTC | FTT,ALTCOIN | BTC | EXCHANGE | KSC | FTT,,0,0,AMB Crypto,https://ambcrypto.com/attention-kcs-holders-this-week-may-be-far-from-your-expectations-because/,https://images.cryptocompare.com/news/default/ambcrypto.png
4160328,https://www.cryptopolitan.com/?p=237456,1668324469,Avalanche price analysis: AVAX to retest $12.8 as support,"The Avalanche price analysis shows a bearish daily trend. The bears have taken over the market again after a bullish start observed by the coin, but now, the trend is again shifting towards the bearish side. The price has decreased considerably during the last four hours and has now reached the $13.02 mark. The past … Avalanche price analysis: AVAX to retest $12.8 as support Read More »",NEGATIVE,AVAX,AVAX | MARKET | TRADING,,0,0,Cryptopolitan,https://www.cryptopolitan.com/avalanche-price-analysis-2022-11-13/,https://resources.cryptocompare.com/news/43/4160328.jpeg
4159854,https://coinpedia.org/?p=164146,1668323590,Bitcoin (BTC) Price Will Drop To This Well level Before Starting a Super Rally,"The post Bitcoin (BTC) Price Will Drop To This Well level Before Starting a Super Rally appeared first on Coinpedia Fintech News After the market’s leading cryptocurrency hit two-year lows due to FTX collapse and Sam Bankman-Fried dramatic fall, cryptocurrency analyst is outlining the long-term bull case for Bitcoin (BTC). Vays has said that even if Bitcoin drops to about $11,000, it might still achieve a new all-time high of $100,000 next year. The trader thinks that …",NEUTRAL,BTC,BTC | MARKET | TRADING,,0,0,coinpedia,https://coinpedia.org/bitcoin/bitcoin-btc-price-will-drop-to-this-well-level-before-starting-a-super-rally/,https://images.cryptocompare.com/news/default/coinpedia.png
4159741,https://coinpedia.org/?p=164143,1668323404,Ethereum on Brink Of 40% Crash – ETH Price May Plunge To 3-Digit in Coming Weeks,"The post Ethereum on Brink Of 40% Crash – ETH Price May Plunge To 3-Digit in Coming Weeks appeared first on Coinpedia Fintech News Cryptocurrencies retain the bearish mood into the weekend after a turbulent week, with both Bitcoin and Ethereum slumping. On Saturday, Bitcoin fell beneath $17,000 once more after another development of the troubled FTX surfaced online. Today’s decline in Ethereum’s price kept the currency below $1,300. . Following a carnage week, the markets were given a …",NEGATIVE,ETH,BTC | ETH | MARKET | TRADING,,0,0,coinpedia,https://coinpedia.org/ethereum/ethereum-on-brink-of-40-crash-eth-price-may-plunge-to-3-digit-in-coming-weeks/,https://images.cryptocompare.com/news/default/coinpedia.png
4159631,https://coinpedia.org/?p=164140,1668323164,"After FTX s alleged $600 Million hack, is Sam Bankman-Fried Flying to Argentina?","The post After FTX s alleged $600 Million hack, is Sam Bankman-Fried Flying to Argentina? appeared first on Coinpedia Fintech News FTX, which was once among the top cryptocurrency exchanges in the world, essentially collapsed this week. For a brief while, it appeared that rival Binance would step in to buy FTX, but after seeing FTX’s financial records, Binance quickly withdrew. Sam Bankman-Fried, the founder of FTX, is reportedly flying to Argentina, albeit the information has …",NEUTRAL,없음,EXCHANGE | BNB,,0,0,coinpedia,https://coinpedia.org/news/after-ftx-s-alleged-600-million-hack-is-sam-bankman-fried-flying-to-argentina/,https://images.cryptocompare.com/news/default/coinpedia.png
4159622,https://timestabloid.com/?p=11876,1668323126,Terra Classic Burns Surpass 27 Billion LUNC and Total Staked Now More Than 857 Billion Tokens,"The effort to get Terra Classic (LUNC) back on track is still very active as the number of LUNC tokens removed from circulating supply increases on a daily basis. As reported by LUNC Burn, the platform that tracks the movement of LUNC tokens to the inferno wallet, a total of 27.2 billion tokens have been The post Terra Classic Burns Surpass 27 Billion LUNC and Total Staked Now More Than 857 Billion Tokens appeared first on Times Tabloid .",NEUTRAL,LUNC,ICO | LUNC,,0,0,TimesTabloid,https://timestabloid.com/terra-classic-burns-surpasses-27-billion-lunc-and-total-staked-now-more-than-857-billion-tokens/,https://resources.cryptocompare.com/news/67/default.png
4159564,https://coinpedia.org/?p=164136,1668323039,Kraken CSO claims to Identify the Hacker Who Stole $600 Million From FTX,"The post Kraken CSO claims to Identify the Hacker Who Stole $600 Million From FTX appeared first on Coinpedia Fintech News Going into the weekend, FTX developments kept the cryptocurrency market on its toes. After hearing that FTX CEO Sam Bankman-Fried had declared bankruptcy and resigned, FTX reported account access violations. Reports claim that hackers stole more than $600 million worth of cryptocurrency from FTX wallets, causing FTX to relocate all of the company’s remaining digital …",NEGATIVE,없음,EXCHANGE | MARKET,,0,0,coinpedia,https://coinpedia.org/hack/kraken-cso-claims-to-identify-the-hacker-who-stole-600-million-from-ftx/,https://images.cryptocompare.com/news/default/coinpedia.png
4158923,https://cointelegraph.com/news/huobi-and-gate-io-under-fire-for-allegedly-sharing-snapshots-using-loaned-funds,1668321720,Huobi and Gate.io under fire for allegedly sharing snapshots using loaned funds,"A wallet address linked to the Huobi exchange was found transferring 10,000 ETH to Binance and OKX deposit wallets soon after releasing its asset snapshot.",NEGATIVE,ETH,ETH | EXCHANGE | BNB,,0,0,CoinTelegraph,https://cointelegraph.com/news/huobi-and-gate-io-under-fire-for-allegedly-sharing-snapshots-using-loaned-funds,https://resources.cryptocompare.com/news/16/4158923.jpeg
4158249,https://cryptonews.com/news/bitcoin-price-ethereum-prediction-ftt-drops-90-over-ftx-bankruptcy.htm,1668320400,"Bitcoin Price and Ethereum Prediction, FTT Drops 90% Over FTX Bankruptcy & Hack","Bitcoin is down nearly 1.5% to $16,800 as a result of the FTX bankruptcy, which has caused market chaos and risk-off sentiment. Ethereum, the second most valuable cryptocurrency, on the other hand, has gained over 1.5% to trade at $1,264. Major cryptocurrencies were trading in the negative early on November 13, as the global crypto market cap fell 2% on the previous day to $855 billion. Over the last 24 hours, total crypto market volume fell 33% to $96.72 billion. ... Read More: Bitcoin Price and Ethereum Prediction, FTT Drops 90% Over FTX Bankruptcy & Hack",NEGATIVE,FTT,BTC | ETH | MARKET | TRADING | FTT,,0,0,cryptonews,https://cryptonews.com/news/bitcoin-price-ethereum-prediction-ftt-drops-90-over-ftx-bankruptcy.htm,https://resources.cryptocompare.com/news/52/4158249.jpeg
42388669,1WhGe7o17bdD4QO5qRQJMH,1668319459,Huobi Asset Transparency Report Reveals $3.5B in Crypto Holdings,"Huobi Global, once China's top crypto exchange, published an asset transparency report on Sunday to reassure users that its funds remain safe.  As of Nov. 12, there were 191.84 million Huobi token, or HT, ($900 million) on the platform along with 9.7 billion TRX, 820 million USDT, 274,000 ETH and 32,000 BTC, and several other coins, including ATOM, ADA, BCH, DOGE, DOT, MATIC, SHIB and ETC.  The total estimated value of reserves was $3.5 billion, the report said.  Huobi said HT tokens are not only held by the Huobi Global, but some of them are also held by Huobi Global’s users.  The revelation came days after FTX, formerly the third largest digital assets exchange by volume, imploded in response to a CoinDesk report that showed the exchange's sister company Alameda Research's balance sheet, was primarily made up of FTX's native token, FTT.  Since then, crypto exchanges worldwide have been scrambling to publish so-called proof of reserves to assure users that their funds aren't being channeled into other investments. On Nov. 10, leading crypto exchange Binance released the list of its cold wallets and reserves, disclosing $69 billion in crypto reserve.  ""Huobi is acting now to disclose the balance details of our hot and cold wallets and make this disclosure a routine going forward,"" the exchange said in the report, adding that it performed a Merkle Tree Proof of Reserves audit early last month when the exchange's founder Leon Li sold his controller stake to About Capital.  Huobi promised to publish another Merkle Tree Proof of Reserves audit conducted by a third party within 30 days to boost user confidence further.  Under the Merkel Tree audit, an independent entity takes an anonymized snapshot of all crypto balances held by the exchange and aggregates them into a Merkel tree, a structure normally used to check the integrity of block data.  Huobi's disclosure, however, failed to calm market nerves. The HT token was recently trading at $4.8, down 8.9% over the last 24 hours, according to CoinDesk data.  The exchange reportedly saw an outflow of 10,000 ETH after it published the asset reserve report. Data from South Korea-based blockchain analytics firm CryptoQuant shows a total of 12,000 ETH ($15.14 million) have left Huobi in the past six hours.  Huobi said the outflow was part of routine operations. ""The true situation is that the addresses we listed include some hot wallets; the on-chain deposits and withdrawals are part of the normal operation. The exchange is operating normally now,"" a spokesperson from Huobi's PR team told CoinDesk in an email.  The platform has the ""ability and strength to ensure the safety of users' assets and 100% payment, and there is not and will not be any restrictions on users' withdrawal,"" the spokesperson added.  12:45 UTC: Edits the DEK and the third para to say there were 191.84 millions of HT on the platform. Adds Huobi's comment that some amount of HT is held by users. The previous version said Huobi held $900 million worth of its own HT token.  12:48 UTC: Adds Huobi's comments on ETH outflow in the last paragraph.",NEUTRAL,ADA | ETH,ADA | ASIA | ETH | EXCHANGE | MARKET,Omkar Godbole,0,0,CoinDesk,https://coindesk.com/markets/2022/11/13/huobi-publishes-asset-transparency-report-revealing-35b-in-crypto-asset-holdings,https://cdn.sanity.io/images/s3y3vcno/production/e9b6ec890129dbfdb33f46394b981a07ba2b51c8-1440x1080.jpg?w=300&h=300&fit=crop
4156663,https://news.bitcoin.com/?p=558311&preview=true&preview_id=558311,1668317433,US Treasury Secretary and Indian Finance Minister Discuss Crypto Regulation,U.S. Treasury Secretary Janet Yellen and Indian Finance Minister Nirmala Sitharaman discussed crypto regulation during the ninth India-U.S. Economic and Financial Partnership meeting. They stressed the importance of international cooperation and setting high regulatory standards globally. US and India Discuss Issues Surrounding Crypto Indian Union Minister of Finance & Corporate Affairs Nirmala Sitharaman and U.S.,NEUTRAL,없음,REGULATION,,0,0,Bitcoin.com,https://news.bitcoin.com/us-treasury-secretary-and-indian-finance-minister-discuss-crypto-regulation/,https://resources.cryptocompare.com/news/14/4156663.jpeg
