뉴스ID,뉴스GUID,일자(UTC timestamp),뉴스제목,본문,SENTIMENT,주요코인,카테고리,작성자,추천수,비추천수,출처,뉴스URL,이미지URL
13249462,https://themerkle.com/?p=56774,1525857613,XRP Price Seeks Stability at $0.75 After Overnight Onslaught,"The cryptocurrency markets do not look to be in great shape as of right now. All top currencies have seen a massive dip in the past two days, although the momentum may finally turn in favor of Bitcoin and consorts once again. With the XRP price fighting for control over $0.75 as of right now, an interesting trend is beginning to form. The XRP Price Momentum is a Strong Indicator Even though a lot of cryptocurrency enthusiasts dislike Ripple and its XRP asset, it remains one of the bigger markets ranked by market cap. There&apos;s a very good reason for",NEUTRAL,XRP,BTC | MARKET | TRADING | XRP,,0,0,NullTx,https://themerkle.com/xrp-price-seeks-stability-at-0-75-after-overnight-onslaught/,https://images.cryptocompare.com/news/themerkle/ejS46y0142o.jpeg
13454273,http://bitcoinist.com/?p=67830,1525856418,Silicon Valley Philanthropists Dig Deep into their Crypto Wallets during Fundraising Event,"In a time when we&apos;re bombarded with the supposed evils of Bitcoin (right, Mr. Baby Brains Munger?) on a seemingly daily basis, it&apos;s refreshing to see crypto take the spotlight for a worthy cause. According to Bloomberg, this is exactly what happened at a San Francisco fundraising gala held on the 3rd of May. The event was held to raise money to combat poverty in the Bay Area and was planned by the Tipping PointRead MoreThe post Silicon Valley Philanthropists Dig Deep into their Crypto Wallets during Fundraising Event appeared first on Bitcoinist.com.",POSITIVE,없음,BTC | ETH | EXCHANGE | ICO,,0,0,Bitcoinist,https://bitcoinist.com/silicon-valley-philanthropists-dig-deep-crypto-wallets-fundraising-event/,https://images.cryptocompare.com/news/bitcoinist/8qII9842E10.jpeg
13238362,https://www.newsbtc.com/?p=331430,1525856410,Bitcoin Price Watch: Can BTC/USD Hold This Support?,"Key Points Bitcoin price declined recently and broke the $9,300 support against the US Dollar. There is a crucial bearish trend line in place with resistance at $9,150 on the hourly chart of the BTC/USD pair (data feed from Kraken). The pair must stay above the $8,990 and $8,870 support levels to avoid further losses....The post Bitcoin Price Watch: Can BTC/USD Hold This Support? appeared first on NewsBTC.",NEGATIVE,BTC,BLOCKCHAIN | BTC | EXCHANGE | MARKET | TRADING,,0,0,NewsBTC,https://www.newsbtc.com/2018/05/09/bitcoin-price-watch-can-btc-usd-hold-support/,https://images.cryptocompare.com/news/newsbtc/8uBN6ThNFb2.jpeg
42401498,DbF8Q09kuKX2XWBxAcztPX,1525856408,Topping Out? Bitcoin Bulls Need to Defend $9K,"Having hit seven-day lows below $9,000 this morning, bitcoin (BTC) is looking decidedly weak.  The cryptocurrency fell to $8,980 on Bitfinex a few hours ago and was last seen changing hands at $9,080 – down 1.13 percent from the previous day's close (as per UTC) of $9,184.  The downwards move does not come as a surprise, however, with the bear flag breakdown witnessed yesterday opening the doors for a fall to $8,865.  Now, unless the bulls can make a defense of support at $9,055 (seen in chart below), the cryptocurrency risks once more falling below $8,000.  4-hour chart  Bitcoin risks a deeper sell-off to $8,652 (April 26 low) if the failure to beat inverse head-and-shoulders neckline hurdle (as seen over the weekend) is followed by a 4-hour close below the trendline support, currently seen at $9,055.  The 50-candle and 100-candle moving averages (MAs) have shed bullish bias (topped out) and BTC is trading well below other key moving averages. Meanwhile, the relative strength index (RSI) is holding well below 50.00 (in the bearish territory), also signaling scope for further losses.  Additionally, the action in the hourly chart below also suggests that BTC is risking a move downwards.  Hourly chart        As of writing, BTC is trading on a weaker footing as indicated by the series of lower highs and lower lows, represented by the falling channel (bearish pattern).  The 50-hour, 100-hour and 200-hour MAs are all biased to the bears (trending south). The bear flag breakdown, seen yesterday, also favors a drop below $9,055.  The only factor that might stall the decline is the bullish relative strength index (RSI) divergence. Note that the RSI has not formed lower lows in response to lower lows in prices.  View  BTC will likely find acceptance below $9,055 (trendline support in the 4-hour chart) and drop towards $8,652 (April 26 low).  A daily close (as per UTC) below $8,652 would mean the rally from the April 1 low of $6,425 has ended and the bears have regained control. In this case, BTC could extend the decline to $7,787 (61.8 percent Fibonacci retracement of the rally from $6,425 to $9,990).  However, an upside break of the falling channel seen in the hourly chart could yield a rally to $9,300.  Meanwhile, a close (as per UTC) above the 10-day MA, seen today at $9,413 would indicate the pullback from the recent high of $9,990 has ended.  Funfair ride image via Shutterstock",NEGATIVE,BTC,BTC | EXCHANGE | MARKET | TRADING,Omkar Godbole,0,0,CoinDesk,https://coindesk.com/markets/2018/05/09/topping-out-bitcoin-bulls-need-to-defend-9k,https://cdn.sanity.io/images/s3y3vcno/production/220f6ab496a8cda8b8e3e9ba374ed5ac3c2fd5dd-1500x1073.jpg?w=300&h=300&fit=crop
13238363,https://www.newsbtc.com/?p=331398,1525852837,Cardano Price Technical Analysis – ADA/USD Support Turned Resistance,"Key Highlights ADA price moved down recently and traded close to the $0.2900 level against the US Dollar (tethered). There is a significant bearish trend line in place with resistance at $0.3200 on the hourly chart of the ADA/USD pair (data feed via Bittrex). The pair may correct higher in the short term, but the...The post Cardano Price Technical Analysis - ADA/USD Support Turned Resistance appeared first on NewsBTC.",NEUTRAL,ADA,ADA | FIAT | MARKET | TRADING,,0,0,NewsBTC,https://www.newsbtc.com/2018/05/09/cardano-price-technical-analysis-ada-usd-support-turned-resistance/,https://images.cryptocompare.com/news/newsbtc/9h9$8x8g5aM.jpeg
42401484,DbF8Q09kuKX2XWBxAcztAm,1525852820,SEC Commissioner Cautions Against 'Blanket' ICO Classification,"A sandbox for ICOs is not the best approach to token regulation, an SEC commissioner said last week.  Speaking at the Medici Conference on May 2, Commissioner Hester Peirce told the audience:  ""My fear that regulators will grab hold of the shovels and buckets is why I am often wary of so-called regulatory sandboxes. I am entirely in favor of finding ways to make appropriate regulatory allowances that clear the way for innovation to flourish. What troubles me about sandboxes, however, is that the regulator is typically sitting there next to the entrepreneurs.""  Peirce went on to argue in her ICO-focused speech that ""open communication"" between regulators and those they regulate is possible without a sandbox, and instead advocated for a ""lifeguard"" approach in which the regulator ""watches over what is happening, but she is not sitting with sandcastle builders monitoring their every design decision.""  Peirce did, however, acknowledge that sandboxes have been successful for some regulators, including those in the U.K., the U.A.E. and Singapore.  Blockchain sandboxes have become increasingly popular amongst global regulators, and advocates argue that they are a means of satisfying regulators without quashing innovation. Lithuania, Bermuda and Malta are among other countries experimenting with the idea.  In another notable part of the speech, the Commissioner broke with SEC Chairman Jay Clayton's statement at a U.S. Senate hearing in February in which he stated, ""I believe every ICO I've seen is a security.""  Contrarily, Peirce remarked: ""Given the undeveloped nature of this area, I am wary of any blanket designation for all ICOs."" She instead suggested that regulators ""evaluate the facts and circumstances of each offering.""  The Commissioner also addressed the potential for regulation to impact innovation and argued that the classification of tokens as securities, for example, could create boundaries for innovation.  ""They will, over time, come to look more and more like securities and securities offering. Innovations that might otherwise have occurred that don't fit within that 'security' framework may never come to fruition,"" she told event attendees.  Additionally, Peirce expressed regret that the SEC has largely communicated with ICO issuers via its Division of Enforcement and cautioned that the Commission should not lead ""with its enforcement powers."" She also suggested that the SEC set up a website to field questions and comments on ICOs, tokens, blockchain technology and cryptocurrencies.  SEC emblem image via Shutterstock",NEUTRAL,없음,BLOCKCHAIN | REGULATION | TECHNOLOGY | TOKEN SALE,Annaliese Milano,0,0,CoinDesk,https://coindesk.com/markets/2018/05/09/sec-commissioner-cautions-against-blanket-ico-classification,https://cdn.sanity.io/images/s3y3vcno/production/1cd35601da0f5df2c0d74dec2aa8fcdb6ed2a54e-1700x1133.jpg?w=300&h=300&fit=crop
13488631,https://www.cryptocompare.com/email-updates/daily/2018/may/09/,1525852397,Market Analysis Report (09 May 2018),MVIS-CryptoCompare Index | The First Version of Ethereum&apos;s Casper Upgrade Has Been Published | Winklevoss Brothers Win Crypto Exchange Patent | Zcash Foundation to Make ASIC Resistance,NEUTRAL,없음,BTC | ETH | EXCHANGE | MARKET | ZEC,,0,0,CryptoCompare,https://www.cryptocompare.com/email-updates/daily/2018/may/09/,https://images.cryptocompare.com/news/default/cryptocompare.png
13439049,https://news.bitcoin.com/?p=158007,1525851601,Indian Ponzi Scheme-Funded Cryptocurrency Mine Raided by Police,Indian police have raided a cryptocurrency mining operation whose establishment was funded by a nearly $15 million USD ponzi scheme. Police seized hundreds of mining cards. Also Read: Another Indian Company Challenges Ban on Crypto Banking Ponzi-Financed Ethereum Mine Raided in India Delhi Police&apos;s Cyber Cell has conducted a raid on a cryptocurrency mining operation held ...The post Indian Ponzi Scheme-Funded Cryptocurrency Mine Raided by Police appeared first on Bitcoin News.,NEGATIVE,없음,BTC | ETH | MINING | REGULATION,,0,0,Bitcoin.com,https://news.bitcoin.com/indian-ponzi-scheme-funded-cryptocurrency-mine-raided-by-police/,https://images.cryptocompare.com/news/bitcoin.com/95Eozi000Mg.jpeg
13454274,http://bitcoinist.com/?p=67910,1525849255,3 Things that Drive Crypto Traders Crazy,The world of crypto trading is extremely exciting and those who are able to do it well are seeing far greater returns than any stock market day trader has been able to accomplish in the past. That is because this new and innovative industry has hit the open market very suddenly and allowed virtually anyone to get involved from the ground floor. Keep in mind that blockchain technology and the infrastructure of the crypto-market areRead MoreThe post 3 Things that Drive Crypto Traders Crazy appeared first on Bitcoinist.com.,POSITIVE,없음,BLOCKCHAIN | BUSINESS | MARKET | TECHNOLOGY | TRADING,,0,0,Bitcoinist,https://bitcoinist.com/3-things-drive-crypto-trading-crazy/,https://images.cryptocompare.com/news/bitcoinist/dcIN2MIQo4b.jpeg
13454275,http://bitcoinist.com/?p=67801,1525849206,Power Ledger is Helping Rebuild Puerto Rico’s Electrical Grid,"Power Ledger, the Australian-based blockchain startup is helping restore power to Puerto Rico. The U.S. commonwealth island was hit by severe hurricanes in September 2017. The devastation caused by the storms in addition to the loss of life and property also destroyed a significant portion of the country&apos;s electrical grid. Power Ledger: Blockchain-powered Electricity Supply in Puerto Rico Power Ledger is partnering with local firms to establish the Island&apos;s power infrastructure. Jemma Green, the company&apos;s co-founderRead MoreThe post Power Ledger is Helping Rebuild Puerto Rico&apos;s Electrical Grid appeared first on Bitcoinist.com.",POSITIVE,없음,ALTCOIN | BLOCKCHAIN | TECHNOLOGY | WALLET,,0,0,Bitcoinist,https://bitcoinist.com/puerto-rico-power-ledger-blockchain/,https://images.cryptocompare.com/news/bitcoinist/c6wOTwM1E00.jpeg
13238364,https://www.newsbtc.com/?p=331401,1525848330,Asian Cryptocurrency Trading Roundup: Zilliqa surges on OKEx Listing,"FOMO Moments Following a day of what appeared to be signs of a recovery, crypto markets have fallen once again. The selloff has continued and total market capitalization is below $420 billion and falling, a sea of red is currently dominating all cryptocurrencies. Bitcoin never made it back and has lost 3% on the day...The post Asian Cryptocurrency Trading Roundup: Zilliqa surges on OKEx Listing appeared first on NewsBTC.",NEGATIVE,BTC,ALTCOIN | BTC | MARKET | TRADING,,0,0,NewsBTC,https://www.newsbtc.com/2018/05/09/asian-cryptocurrency-trading-roundup-zilliqa-surges-on-okex-listing/,https://images.cryptocompare.com/news/newsbtc/diw148k08w0.jpeg
13238365,https://www.newsbtc.com/?p=331395,1525847452,Ripple Price Technical Analysis – XRP/USD Accelerating Declines,Key Highlights Ripple price declined further and broke the $0.7800 support level against the US dollar. Yesterday&apos;s highlighted important bearish trend line is still intact with resistance near $0.7950 on the hourly chart of the XRP/USD pair (data source from Kraken). The pair is likely to accelerate declines and it could soon test the next...The post Ripple Price Technical Analysis - XRP/USD Accelerating Declines appeared first on NewsBTC.,NEGATIVE,없음,EXCHANGE | MARKET | TRADING,,0,0,NewsBTC,https://www.newsbtc.com/2018/05/09/ripple-price-technical-analysis-xrp-usd-accelerating-declines/,https://images.cryptocompare.com/news/newsbtc/81wcbcujceo.jpeg
13454276,http://bitcoinist.com/?p=67906,1525845842,What Is EOS? Here’s What You Should Know Before Investing,"The cryptocurrency and blockchain revolution are no longer just buzzwords. They are real-world phenomena that have impacted the global economy and have the potential to generate great changes in both the high tech and financial industries. Joining the crypto space mid-2017, EOS.IO, developed by Hong Kong-based company block.one, is a fine example of a blockchain entity that has the potential to impact both industries. Launched in July, 2017, the EOS cryptocurrency is the token usedRead MoreThe post What Is EOS? Here&apos;s What You Should Know Before Investing appeared first on Bitcoinist.com.",NEUTRAL,없음,ASIA | BLOCKCHAIN | ICO | TRADING,,0,0,Bitcoinist,https://bitcoinist.com/eos-heres-know-investing/,https://images.cryptocompare.com/news/bitcoinist/doFupr8C64i.jpeg
42401494,DbF8Q09kuKX2XWBxAcztJd,1525845626,Winklevoss Brothers Win Crypto Exchange Patent,"Winklevoss IP, the company owned by Gemini founders Cameron and Tyler Winklevoss, has been awarded with a patent claim that aims to settle exchange traded products (ETPs) holding cryptocurrencies.  The company outlined a system that can execute transactions for ETPs holding cryptocurrencies ""such as bitcoins ... ripple, dogecoins ... ether"" as well as BBQCoin, among others, according to patent published by the U.S. Patent and Trademark Office on Tuesday. The company first filed the application in December of last year.  ETPs, which include exchange-traded-funds (ETF), are a type of security whose prices derive from other investment instruments they are tied to, which in the Winklevoss case, would be cryptocurrencies.  The patent reward is notable as it provides a glimpse into the Winklevoss brothers' continuing efforts to push forward the trading of cryptocurrency-related ETFs after having met hurdles from U.S. regulators.  As previously reported by CoinDesk, the U.S. Securities and Exchange Commission (SEC) has rejected the brothers' last bid in March 2017 that sought to list a bitcoin-tied ETF on the Bats BZX Exchange, citing risk associated with the trading and regulatory uncertainty.  Currently, the SEC has yet to green-light any bitcoin-related ETFs on exchanges. And in January this year, several firms that were proposing a rule change to the SEC had also withdrawn their filings per requirement by the securities regulator.  Today's patent reward also comes just a month after the Winklevoss IP won another patent claim for strengthening cryptocurrencies' transaction security that could be used in the Gemini exchange, as previously reported by CoinDesk.  The Winklevoss brothers image via CoinDesk",POSITIVE,없음,EXCHANGE | MARKET | MINING | REGULATION | TRADING,Wolfie Zhao,0,0,CoinDesk,https://coindesk.com/markets/2018/05/09/winklevoss-brothers-win-crypto-exchange-patent,https://cdn.sanity.io/images/s3y3vcno/production/3d0a4edbfa95f1538fcb26674f320618da56c948-1536x1024.jpg?w=300&h=300&fit=crop
13439050,https://news.bitcoin.com/?p=157942,1525844532,Details Emerge on Foxconn-Manufactured Ultra-Secure Crypto Phone,"Bitcoin paranoids rejoice. The technical details have emerged about Sirin Finney, an ultra secure mobile device promising to keep your cryptocurrency transactions private. The phone will feature an embedded cold storage wallet, and will be build by the same company that builds the iPhone. Also Read: Elon Musk Takes on Bitcoin-Bashing Warren Buffett Secure Element ...The post Details Emerge on Foxconn-Manufactured Ultra-Secure Crypto Phone appeared first on Bitcoin News.",POSITIVE,없음,BTC | TRADING,,0,0,Bitcoin.com,https://news.bitcoin.com/details-emerge-on-foxconn-manufactured-ultra-secure-crypto-phone/,https://images.cryptocompare.com/news/bitcoin.com/ex8C00Mw806.jpeg
13238366,https://www.newsbtc.com/?p=331389,1525842043,Ethereum Price Technical Analysis – ETH/USD Struggling Near 100 SMA,"Key Highlights ETH price traded higher, but it failed to break the $760 and $770 resistance levels against the US Dollar. There is a key connecting bearish trend line forming with resistance at $745 on the hourly chart of ETH/USD (data feed via Kraken). The pair is currently under pressure and it may well extend...The post Ethereum Price Technical Analysis - ETH/USD Struggling Near 100 SMA appeared first on NewsBTC.",NEUTRAL,ETH,ETH | EXCHANGE | FIAT | MARKET | TRADING,,0,0,NewsBTC,https://www.newsbtc.com/2018/05/09/ethereum-price-technical-analysis-eth-usd-struggling-near-100-sma-2/,https://images.cryptocompare.com/news/newsbtc/c42wm00wA0M.jpeg
13454277,http://bitcoinist.com/?p=67848,1525842007,Canada Steals Crypto Startup From the U.S. With Less Stringent Laws,"CBlocks, a Miami based-based cryptocurrency startup is moving to Canada to avoid regulatory trouble in the United States. The firm has been unable to obtain clear legal guidance concerning its status, hence the move. Cryptocurrency laws in Canada are a lot less stringent than in the United States. Unclear U.S. Regulations to Blame for the Move According to the firm&apos;s co-founders, they are not sure of how the regulatory agencies would classify the company. TheyRead MoreThe post Canada Steals Crypto Startup From the U.S. With Less Stringent Laws appeared first on Bitcoinist.com.",NEGATIVE,없음,ALTCOIN | BTC | REGULATION,,0,0,Bitcoinist,https://bitcoinist.com/crypto-startup-cblocks-moves-canada/,https://images.cryptocompare.com/news/bitcoinist/c0my70O820E.jpeg
13238367,https://www.newsbtc.com/?p=331386,1525838926,Bitcoin Cash Price Technical Analysis – BCH/USD Likely to Extend Declines,"Key Points Bitcoin cash price failed to move above the $1,700 resistance and declined against the US Dollar. Yesterday&apos;s highlighted connecting bearish trend line with current resistance at $1,630 prevented gains on the hourly chart of the BCH/USD pair (data feed from Kraken). The pair may continue to move down and it could even break...The post Bitcoin Cash Price Technical Analysis - BCH/USD Likely to Extend Declines appeared first on NewsBTC.",NEGATIVE,BCH,BCH | BLOCKCHAIN | EXCHANGE | MARKET | TRADING,,0,0,NewsBTC,https://www.newsbtc.com/2018/05/09/bitcoin-cash-price-technical-analysis-bch-usd-likely-extend-declines/,https://images.cryptocompare.com/news/newsbtc/cA0i20000gw.jpeg
