뉴스ID,뉴스GUID,일자(UTC timestamp),뉴스제목,본문,SENTIMENT,주요코인,카테고리,작성자,추천수,비추천수,출처,뉴스URL,이미지URL
42411815,GJVPKSa3D710Liw1glgD8o,1648752653,How to Buy a House With Crypto: US Edition,"Today, more than one-third of small businesses reportedly accept crypto payments, and some speculate that crypto mortgage payments are going to be more common in the coming years.  Fintech platforms such as BitPay, BTCPay, CoinBase Commerce and OpenNode are making it easier to transfer crypto peer-to-peer and even between consumers and businesses, and some mortgage lenders have already begun to experiment with giving consumers the option to pay in crypto.  For instance, United Wholesale Mortgage, the nation’s second-largest mortgage lender, unveiled a short-lived plan last August to start accepting bitcoin payments, but quickly scrapped the program, citing the high costs and regulatory uncertainty.  Yet the thought of buying a house with crypto may be too enticing for developers and innovators to simply give up. While it’s not yet fully normalized, there are still ways you can legally buy a home with bitcoin (BTC), ethereum (ETH) and other crypto assets in the United States – whether through a financial institution or simply as a private transaction between two consumers.  How to buy a house using crypto  For the savvy crypto natives and crypto-curious homebuyers, here are some options that presently exist.  Use your crypto as collateral  One way to leverage your crypto for real estate is to use it as a down payment. A number of new fintech platforms are rolling out products for this very purpose. Crypto lenders like BlockFi, Celsius and Unchained Capital offer crypto-backed loans with annual percentage rates ranging from 1% to 6%. The loans can be used for major purchases of things like autos and real estate.  These companies claim to help everyone from the unbanked to high-net-worth individuals expand their lending options by leveraging crypto assets.  The concept of a crypto-collateralized loan is intriguing in that borrowers don’t have to liquidate their crypto holdings in order to access financing. This prevents the need to cash out your crypto and avoids creating a taxable event in order to buy a house.  The tricky parts about crypto-collateralized loans are that: (A) they aren’t available in all states yet, and (B) it’s hard to determine the loan-to-value (LTV) ratio because cryptocurrencies are highly volatile.  Assuming you get a loan at a 1:1 ratio and use 1 BTC for collateral, you could theoretically get a loan for the market price of $47,500 (the value of BTC at the time of writing). Each lender will have a different LTV equation.  Just remember: Unless you are using a stablecoin such as USDC or USDT, the value of the cryptocurrency backing the loan will likely swing wildly in price. That volatility could affect your LTV in two ways:  If bitcoin’s price leaps to $100,000, you now have an extra $66,000 worth of bitcoin that you could tap into without having to touch your home’s equity.  A drop in prices could alter the LTV negatively, which could trigger something called a margin call. If a margin call was triggered, the lender would require you to deposit more crypto to bring the LTV back to the original level.  That said, there’s some argument that as you build equity in the home, the real estate value will eventually become a large enough part of the collateral to help neutralize or even out the crypto down payment, even if the value of your original collateral drops. The value of real estate, however, rises at a much slower pace than a mooning crypto, and so you could also stand to lose money in the short term. This dynamic illustrates both the risk and potential benefits associated with a crypto-backed loan.  Direct crypto transfer from buyer to seller  There’s nothing stopping two individuals from creating a private agreement to sell a home in exchange for crypto using a direct wallet-to-wallet transfer. It’s probably wise to get your agreement in writing and talk to a lawyer who is familiar with both real estate law and crypto.  This method probably isn’t going to fly if you use a real estate agent, who likely isn’t prepared to receive a commission in the form of crypto. Not to mention that the traditional escrow process will need to go through an accredited bank.  Using NFTs to buy a house  Non-fungible tokens (NFTs) are most familiar as a way to own digital art collectibles. But the digitally coded records known as smart contracts that result when NFTs are minted open up new possibilities for both real estate deeds and payment.  An NFT can both represent the “normal” sale of a piece of real estate and act as a form of payment or collateral or both if the owner or financing institution accepts its value.  A recent Florida house sale demonstrates the first process: In May, the real estate startup Propy sold its first NFT-backed property in the U.S. In the experimental transaction, the owner purchased a 2,000-square-foot house for 210 ETH ($653,000) and received an NFT as proof of ownership. Some industry professionals argue that NFTs are superior records to paper deeds, which can get lost and create ambiguity about a property’s value, size, taxes, sale history and other details. With smart contracts, these specifics will theoretically remain well-documented on a blockchain, where they will live forever.  NFT-backed home sales, however, aren't the norm, as the logistics are still new. In the case above, the NFT had to be linked to an limited-liability company (LLC), which actually owns the physical property and against which consumers can borrow. This adds an extra step in the process that most consumers aren't used to. There’s also the question of how an NFT can be accurately valued when used as collateral. Crypto lending protocol Helio, which is working with Propy, advertises no-margin-call loans if the value of your crypto or NFT goes down. However, you will want to make sure the details are clear and in writing.  Cashing out your crypto  Just as you can pay for a house with crypto in a for-sale-by-owner situation, you can also pay in cash just as easily.  Likewise, if you need cash for financing, you can cash out a portion of your crypto holdings to put toward the initial down payment.  Why buy a house with a decentralized asset?  Before you choose one of the above options and move ahead with your real estate purchase, consider why you would want to buy a house with crypto in the first place.  Crypto was created to be a decentralized asset, while the mortgage industry is built upon a structure of lenders and financing – aka centralized banks. It’s a little odd to consider taking out a mortgage from a bank and then use a novel, permissionless and fully decentralized algorithmic currency to pay back the fiat (government) currency that you borrowed in order to buy a physical asset in the real world.  Nonetheless, there are several arguments for trading your digital assets for a physical one. At its core, doing so is a type of arbitrage that helps you blend your portfolio with more kinds of assets. That is, it helps you diversify. Buying a house with crypto is essentially trading a volatile asset for a much more predictable one that historically has appreciated. This may be particularly appealing if you find yourself in a situation where you have more dispensable crypto than fiat currency and want to leverage some of it to buy real estate. Those who bought bitcoin back in 2010, for instance, and are now relishing the fruits of the 2021 euphoric bull market may be in this boat. Early crypto adopters may now find that they now have millions of dollars' worth of digital assets and feel OK about allocating a percentage of that toward a house or land.  Just remember to factor in capital gains if you plan to cash out your crypto for U.S. dollars, or even if you exchange it to another type of crypto in the process of buying your home.  When you cash out your crypto holdings, make sure to note the price point at which you sold your assets and whether you made a profit or loss from the sale. You will need that information to report capital gains or losses when you do your taxes.  Read More: Location, Location, Location: Investing in Real Estate in the Metaverse",POSITIVE,BTC | ETH,BTC | ETH | FIAT | MARKET | TRADING,Megan DeMatteo,0,0,CoinDesk,https://coindesk.com/learn/how-to-buy-a-house-with-crypto-us-edition,https://cdn.sanity.io/images/s3y3vcno/production/41f4b468b8045167739284200cddbfaf7a7afe93-2548x1177.jpg?w=300&h=300&fit=crop
42374944,0r6Zag11PPDEMKgUWw4daH,1648752528,Bitcoin Dips From $48K Resistance; Support at $43K,"Bitcoin (BTC) is in pullback mode after sellers responded to resistance at $48,000. The cryptocurrency could find support at $43,000 into the Asia trading day, which could stabilize the down move.  BTC was trading around $45,800 at press time and is down 3% over the past 24 hours.  The relative strength index (RSI) on the daily chart is declining from overbought levels, which typically precede pullbacks in price. On the weekly chart, however, the RSI is neutral with positive momentum readings. That means buyers could remain active at lower support levels.  Still, BTC is attempting to break below a two-week long uptrend, similar to what occurred in early February, which preceded a brief price drop.  For now, buyers will need to maintain the breakout above $45,000 to yield an upside target toward $50,966.",NEUTRAL,BTC,ASIA | BTC | MARKET | TRADING,Damanick Dantes,0,0,CoinDesk,https://coindesk.com/markets/2022/03/31/bitcoin-dips-from-48k-resistance-support-at-43k,https://cdn.sanity.io/images/s3y3vcno/production/363c0c11f9f20273ce658283af8667ecb8c34d8a-2076x810.png?w=300&h=300&fit=crop
13255006,https://dailyhodl.com/?p=196775,1648752353,"Axie Infinity’s Ronin Network Vows to Recover or Reimburse Victims of $600,000,000 Exploit","The developers behind the Axie Infinity (AXS) bridge that was hacked for over $600,000,000 ago say they will recover or reimburse of all the stolen funds. In an updated newsletter, Axie Infinity&apos;s Ronin Network says it is conducting a thorough investigation with blockchain explorer Chainalysis and security company Crowdstrike to discover who stole more than ...The post Axie Infinity&apos;s Ronin Network Vows to Recover or Reimburse Victims of $600,000,000 Exploit appeared first on The Daily Hodl.",POSITIVE,AXS,ALTCOIN | AXS | BLOCKCHAIN,,0,0,The Daily Hodl,https://dailyhodl.com/2022/03/31/axie-infinitys-ronin-network-vows-to-recover-or-reimburse-victims-of-600000000-exploit/,https://images.cryptocompare.com/news/default/dailyhodl.png
13334035,https://cointelegraph.com/news/circle-selects-bny-mellon-as-custodian-for-usdc-reserves,1648752300,Circle selects BNY Mellon as custodian for USDC reserves,The firm previously said its reserves would be in cash and treasuries.,POSITIVE,USDC,USDC,,0,0,CoinTelegraph,https://cointelegraph.com/news/circle-selects-bny-mellon-as-custodian-for-usdc-reserves,https://images.cryptocompare.com/news/default/cointelegraph.png
13255007,https://dailyhodl.com/?p=196927,1648752077,Payments Giant Visa Launches New NFT-Focused Program for Crypto Entrepreneurs,"Global credit card giant Visa is launching a new crypto program to help content creators and entrepreneurs grow small businesses with non-fungible tokens (NFTs). According to a new company blog post, since NFTs authenticate the ownership of digital media and collectibles, they can help small and micro businesses expand and generate more revenue. Says Cuy ...The post Payments Giant Visa Launches New NFT-Focused Program for Crypto Entrepreneurs appeared first on The Daily Hodl.",POSITIVE,없음,BUSINESS,,0,0,The Daily Hodl,https://dailyhodl.com/2022/03/31/payments-giant-visa-launches-new-nft-focused-program-for-crypto-entrepreneurs/,https://images.cryptocompare.com/news/default/dailyhodl.png
13493132,https://seekingalpha.com/article/4499038-solana-opensea-integration-potentially-big-deal?utm_source=cryptocompare.com&utm_medium=referral,1648751684,Solana: OpenSea Integration Is Potentially A Big Deal,"NFT marketplace OpenSea will be integrating the Solana blockchain on the platform.Solana&apos;s lower-cost NFT collections have fostered an increase in unique buyers in recent months.Based on network activity, Solana is overvalued compared to peers.",NEUTRAL,없음,BLOCKCHAIN | SOL,,0,0,Seeking Alpha,https://seekingalpha.com/article/4499038-solana-opensea-integration-potentially-big-deal?utm_source=cryptocompare.com&utm_medium=referral,https://images.cryptocompare.com/news/default/seekingalpha.png
42394262,CpI5Y2Su0uMQDo69bvaoev,1648751442,Vitalik Buterin on Ethereum's 'Roads Not Taken',"Ethereum co-founder Vitalik Buterin published a blog post this week reflecting on the possible directions his creation could have taken. The piece, titled, ""The roads not taken,"" is technical in places, but the main conclusions are easy to grasp.  Ethereum today has resulted from previous choices, decisions that were constrained by resources and “brain cycles” and implementations where sometimes it was worth waiting for perfect and other times when good enough sufficed.  This article is excerpted from The Node, CoinDesk's daily roundup of the most pivotal stories in blockchain and crypto news. You can subscribe to get the full newsletter here.  Ethereum could have been less complex, Buterin writes. Its virtual machine could have used existing code rather than a bespoke solution. Its developers could have gone with a crude version of proof-of-stake (the consensus algorithm that will eventually secure Ethereum) that existed in 2013. Ethereum could have been “more Bitcoin-like,” Buterin said, referencing that first blockchain, which aims to do one thing well – serve as a global, peer-to-peer settlements layer denominated in a secure, digital bearer-asset, BTC.  “In general, it sometimes feels to me like Ethereum's biggest challenges come from balancing between two visions – a pure and simple blockchain that values safety and simplicity, and a highly performant and functional platform for building advanced applications,” Buterin wrote.  Ethereum initially wanted to become the “world computer,” or a decentralized platform, powered by cryptocurrency to execute any conceivable application. Today, Ethereum supports a multibillion-dollar economy, attracts some of the world’s smartest computer scientists and is the wellspring from which a number of novel computer “primitives” surface.  This balancing act between elegant design and complexity is complicated by Ethereum’s being an open network. It exists so anyone with an idea and sufficient capital can build their dream applications or chase a quick buck.  Ethereum is often criticized within the crypto industry, especially by bitcoiners, for its hierarchy of developers. There are certainly people and organizations with sway over Ethereum, but the network is arguably democratic. Or, at the very least, its oligopoly exists in the open.  When Buterin speaks, people listen. Earlier this month, Time magazine ran a cover story about Buterin, where he suggested he would take a more defined leadership role going forward. “One of the decisions I made in 2022 is to try to be more risk-taking and less neutral,” Buterin said. “I would rather Ethereum offend some people than turn into something that stands for nothing.”  He’s long been critical of the many ways people abuse his machine. In 2017, he asked if the network had earned its $1 billion valuation (largely propelled by the speculative initial coin offering boom).  He is likewise skeptical now of the many decentralized autonomous organizations (DAOs), in which the presence of venture capitalists and self-interested actors has become the “de facto standard,” and where token-voting becomes a stand-in for plutocracy.  Some of this is the natural outcome of Ethereum “premine,” which Buterin fairly categorized as “not credibly neutral” in his recent blog. About 12 million ETH (about 10% of the total supply today) was distributed to the Ethereum Foundation and about “~100 early [protocol] contributors,'' he wrote, adding that “a few recipient addresses were hand-picked through a closed process,” and that “the premine over-rewarded very early contributors, and left too little for later contributors.”  See also: Women-Led DAO Tackles (Lack of) Gender Diversity in Crypto  Although the Ethereum Foundation was quickly forced to sell the majority of its stake to pay for early, continued development, the process has colored all of Ethereum’s history to date.  A revisionist view may have preferred that the ETH distribution event was managed by a DAO or kept more to pay for later development. Buterin considers both but is comfortable accepting history as it unfolded. There are some that may never accept Ethereum because of its checkered history and because of what it used for today.  All too often in the world of software, losing sight of a machine (even a virtual one’s) material circumstances is easy. But these systems, world changing as they may be, still exist.",NEUTRAL,ETH,BLOCKCHAIN | ETH | TECHNOLOGY | TRADING | TOKEN SALE,Daniel Kuhn,0,0,CoinDesk,https://coindesk.com/opinion/2022/03/31/vitalik-buterin-on-ethereums-roads-not-taken,https://cdn.sanity.io/images/s3y3vcno/production/6f523c4a347a324eefc1c80b2556b65c6bdf2c9e-1920x1280.jpg?w=300&h=300&fit=crop
13371618,https://thecoinrise.com/?p=19748,1648751439,"Female crypto investors in Norway doubles, mirroring global trends","As per a recent survey conducted by Arcane Research and Ernst &amp; Young, the number of women in Norway who own any kind of digital assets doubled during the whole last year. The survey found that the rate of female ownership of digital assets in the country surged from 3% in early 2021 to 6% by March ...The post Female crypto investors in Norway doubles, mirroring global trends appeared first on Blockchain, Crypto and Stock News.",POSITIVE,없음,BLOCKCHAIN | BUSINESS | RESEARCH,,0,0,The Coin Rise,https://thecoinrise.com/female-crypto-investors-in-norway-doubles-mirroring-global-trends/,https://images.cryptocompare.com/news/default/thecoinrise.png
13266138,https://ambcrypto.com/?p=225405,1648751435,Filecoin could be crypto’s filing solution but the caveat lingers,"Ever been struck by a surge of inspiration and entrepreneurial passion as you open your file cabinet? No, that does feel like a stretch. However, in the crypto industry, there is a booming interest in solving the growing storage demands of Web2 and Web3. Projects offering their solution to this problem have a chance of ...",POSITIVE,없음,ALTCOIN | FIL | ICO,,0,0,AMB Crypto,https://ambcrypto.com/filecoin-could-be-cryptos-filing-solution-but-the-caveat-lingers/,https://images.cryptocompare.com/news/default/ambcrypto.png
13401493,https://cryptopotato.com/?p=179881,1648751408,Sen. Ted Cruz Introduces a Bill to Prevent the Fed From Issuing a CBDC,"Ted Cruz submitted a companion legislation, which could forbid the Fed to issue a direct-to-consumer digital dollar to American consumers.",NEUTRAL,없음,BTC | REGULATION,,0,0,Crypto Potato,https://cryptopotato.com/sen-ted-cruz-introduces-a-bill-to-prevent-the-fed-from-issuing-a-cbdc/,https://images.cryptocompare.com/news/default/cryptopotato.png
13382632,https://zycrypto.com/?p=66477,1648751065,Shiba Inu Devs Set Out To “Deliver An Exceptional Product” As SHIB Metaverse Is Finally Unveiled,The Shiba Inu metaverse is finally coming together even as uncertainty soars.,POSITIVE,SHIB,SHIB,,0,0,ZyCrypto,https://zycrypto.com/shiba-inu-devs-set-out-to-deliver-an-exceptional-product-as-shib-metaverse-is-finally-unveiled/,https://images.cryptocompare.com/news/default/zycrypto.png
13496643,https://coinquora.com/?p=145654,1648750392,Blockchain Gaming Launchpads And Their Unique Offering To Developers,GameFi is taking over the world of gaming with P2E as a motive. Attarius Network is now a launchpad for ...Read More...,POSITIVE,없음,BLOCKCHAIN | ICO,,0,0,Coin Edition,https://coinquora.com/blockchain-gaming-launchpads-and-their-unique-offering-to-developers/,https://images.cryptocompare.com/news/default/coinquora.png
13371619,https://thecoinrise.com/?p=19741,1648750310,ECB stresses the importance of online and physical stores accepting CBDC,"European Central Bank&apos;s or ECB executive board member, Fabio Panetta, talked about the importance of the potential rollout of a digital euro and its ability to be used at online and physical stores could be its key feature. The major goal of a digital euro is to keep central bank money accessible and usable in an increasingly ...The post ECB stresses the importance of online and physical stores accepting CBDC appeared first on Blockchain, Crypto and Stock News.",POSITIVE,없음,BLOCKCHAIN | BUSINESS | FIAT,,0,0,The Coin Rise,https://thecoinrise.com/ecb-stresses-the-importance-of-online-and-physical-stores-accepting-cbdc/,https://images.cryptocompare.com/news/default/thecoinrise.png
13255008,https://dailyhodl.com/?p=196936,1648749908,"‘Astonishing’ Bot Known for Outperforming Crypto Markets Flocks to Bitcoin, Ethereum, Cardano and Several Top-Tier Altcoins","A robot with a reputation for outperforming the markets is unveiling its latest crypto portfolio allocations. Each week the Real Vision Bot conducts surveys of cryptocurrency-related data in order to create algorithmic portfolio assessments consistent with the consensus of the &apos;hive mind.&apos; According to Real Vision, the bot has had an &apos;astonishing&apos; record as it ...The post &apos;Astonishing&apos; Bot Known for Outperforming Crypto Markets Flocks to Bitcoin, Ethereum, Cardano and Several Top-Tier Altcoins appeared first on The Daily Hodl.",POSITIVE,없음,ADA | ALTCOIN | BTC | ETH | MARKET,,0,0,The Daily Hodl,https://dailyhodl.com/2022/03/31/astonishing-bot-known-for-outperforming-crypto-markets-flocks-to-bitcoin-ethereum-cardano-and-several-top-tier-altcoins/,https://images.cryptocompare.com/news/default/dailyhodl.png
4353904,bitmex-top-execs-plan-to-acquire-german-bank-falls-through,1648749851,BitMEX Top Execs’ Plan To Acquire German Bank Falls Through,BXM Operations AG first announced plans to buy Bankhaus von der Heydt in January,NEUTRAL,없음,FIAT,,0,0,Blockworks,https://blockworks-editorial-gefdq3na6-blockworks.vercel.app/news/bitmex-top-execs-plan-to-acquire-german-bank-falls-through,https://images.cryptocompare.com/news/default/blockworks.png
13496644,https://coinquora.com/?p=145688,1648749720,Investment Tracker Delta Adds NFT Explorer to Its Web3 Offering,"An investment tracker app, Delta, is adding an NFT explorer service to their offering. The new NFT tracker functionality will ...Read More...",POSITIVE,없음,ICO,,0,0,Coin Edition,https://coinquora.com/investment-tracker-delta-adds-nft-explorer-to-its-web3-offering/,https://images.cryptocompare.com/news/default/coinquora.png
13411499,https://blockworks.co/?p=19670,1648749676,Ankr Doubles Down on Decentralization of Web3 Infrastructure,"&apos;I think what we&apos;ve seen is there&apos;s literally no vertical that doesn&apos;t need this,&apos; Ankr Head of Product Josh Neuroth saidThe post Ankr Doubles Down on Decentralization of Web3 Infrastructure appeared first on Blockworks.",POSITIVE,없음,OTHER,,0,0,Blockworks,https://blockworks.co/ankr-doubles-down-on-decentralization-of-web3-infrastructure/,https://images.cryptocompare.com/news/default/blockworks.png
13400045,https://www.cryptoknowmics.com/news/?p=230444,1648749637,2023 is the Year for Web 3.0. Here’s Why.,"The last couple of years has witnessed the birth and growth of new blockchain-based innovations such as cryptocurrencies, non-fungible tokens (NFTs), decentralized finance (DeFi), and decentralized autonomous organizations (DAOs). The latest addition to this impressive collection is likely to be Web 3.0. Web 3.0 is the newest iteration of the internet, and it is a convergence of artificial intelligence (AI), machine learning (ML), and distributed ledger technology (DLT). This version of the World Wide Web will allow individual users to own and control their own data and content. In the current version of the internet, giant centralized corporations own user data and also take large chunks of earnings deriving from user-generated content. It will probably take a while before the use of Web 3.0 becomes more widespread. But starting in 2023, expect to see a more marked utilization of the &apos;semantic web,&apos; especially in social gaming networks and blockchain-enabled business models. In this short article, we will take a look at some of the areas we expect to be highly influenced by Web 3.0 in 2023. DeFi Protocols Decentralized finance is a system that makes financial products available to consumers on decentralized peer-to-peer networks. This system also removes the control and influence that traditional transactional intermediaries, such as banks, had on money and other financial products and services. The development of Web 3.0 wil...",POSITIVE,없음,BUSINESS | TECHNOLOGY | WALLET,,0,0,Cryptoknowmics,https://www.cryptoknowmics.com/news/2023-is-the-year-for-web-3-0-heres-why/,https://images.cryptocompare.com/news/default/cryptoknowmics.png
