뉴스ID,뉴스GUID,일자(UTC timestamp),뉴스제목,본문,SENTIMENT,주요코인,카테고리,작성자,추천수,비추천수,출처,뉴스URL,이미지URL
42400206,DbF8Q09kuKX2XWBxAcIvBR,1500672044,Understanding Bitcoin's Scaling Debate: Politics Comes First,"Jim Harper is vice president of the Competitive Enterprise Institute, where he works to adapt law and policy to the information age. A former counsel to committees in both the US House and the US Senate, he served as Global Policy Counsel for the Bitcoin Foundation in 2014.  In this opinion piece, Harper lays out how politics controls many of the decisions being made in the bitcoin scaling debate, offering a solution for those involved.      Software programmers are usually collegial and collaborative, but parts of the bitcoin developer community have been displaying the kind of acrimony familiar to political capitols like Washington, D.C.  Understanding the nature of the scaling debate might help the bitcoin community better iterate on the protocol and software in the future. What's behind the strife when amendments to bitcoin's rules – or stasis – become so controversial? What unrecognized dimensions of the debate have allowed it to become so divisive and debased?  One is collective resistance to the fact that decisions about bitcoin's direction are political decisions, which technical decisions must follow. Priorities vary, but the bitcoin community's aims include global financial inclusion and economic development, human liberty and dignity, privacy and a truly stable money supply.  By debating only in terms of technology, the leading advocates for different paths have failed to articulate any unifying human vision for bitcoin's future. That's a recipe for alienating intellectual war.  The news isn't all bad: The scaling debate will be concluded using market forces. Bitcoin escapes politics as practiced in coercive government.  It just doesn't escape politics all the way.  Group choices are political  The bitcoin protocol and software are technical, obviously, in that they involve the application of technology to interesting challenges. How to configure bitcoin is political, though, because it involves choices made by groups.  Choosing in groups is no simple thing. The first step in group decision-making is to constitute a group. People are usually better off when they work together under a common set of rules. Bitcoin's protocol is a clear example. But what commits them to any group?  Social contract theory is the leading explanation in modern Western philosophy for life under governments. Nobody ever actually signs that contract, so it’s a little dissatisfying.  Bitcoin's version of the social contract is ""consensus."" That commonly used word contains the idea that using the bitcoin protocol reflects agreement with its terms. But this isn't necessarily the case. Treating use as agreement is probably insulting to dissenters from the status quo – just like ""social contract"" dissatisfies many U.S. citizens obligated to pay taxes for unending war.  Confusingly, ""consensus"" is also used to denote synchronization of blockchain data among bitcoin nodes.  However they feel about it, bitcoin users have joined a group, and they have choices to make together.  Open-source despotism?  Once a group is constituted, ""it may appear that the chiefs, leaders or shamans of the group exert coercive force on members."" Those are the words of public choice economists Michael and Kevin Munger in their book Choosing in Groups.  Happily, there is no literal coercion in bitcoin-land, but it harkens to the observation of Konrad Graf that the maximum block size, a ""production ceiling"" on transactions, is economically equivalent to a government intervention. Dissenters from the status quo feel the familiar strains of tyranny, which they thought bitcoin would help everyone escape.  That is nonsensical and shocking to the Core side, who see themselves as following standard open-source development processes. Their conservative approach, including maintenance of the 1MB limit on bitcoin blocks, safeguards a $40 billion asset, securing it against the predations of real governments.  To them, the most satisfying explanations for opposition to their approach range from simple ignorance to profit-hungry short-termism on the part of bitcoin companies.  Open source in the commercial layer  The software development mode exemplified by Internet Engineering Task Force (IETF) standard-setting processes is an attractive and successful model of cooperation. But bitcoin development may diverge from the theory about open source that the IETF helped spawn.  Open-source development does not automatically digest and balance community values, enshrining them in code. In the dominant bitcoin implementation, a small number of people have commit access, and they have disproportionate power to determine what goes into the code base. These humans, intending only the best, are subject to the influence of their own premises, their social circle and a simple incapacity to capture and prioritize all the interests that would be served by a global public utility such as bitcoin.  The user side of the equation also fails the theory, stated well by economist Vili Lehdonvirta that ""Bitcoin is purely 'math-based money,' and all the developers are doing is purely apolitical plumbing work.""  Developers have relatively greater power because many bitcoin users do not have the technical capacity to reconfigure their own code or to choose wisely from among competing implementations.  Bitcoin developers have also had far fewer meetings than the IETF did at a similar stage. The reservoir of goodwill was already low before the scaling debate drained it.  And bitcoin development may be materially different from other standards-setting efforts. We may be seeing for the first time what happens when open-source software development hits the commercial layer.  Technical communications standards are essentially neutral as to the content or meaning they will convey. Bitcoin standards define and shape markets.  One illustration of the power of the protocol is the rise in transaction fees, which for the time being has cut off use cases such as payments and savings for people in poorer parts of the world. That is no technical engineering decision. It delays crucial economic development that otherwise would sustain and bring joy to potentially millions or even billions of people.  Needed: visionary leadership  That vision – of bitcoin at its best, having its most tremendous consequences – has been notably absent from the scaling debate. If at all, the sides represent their animating goals ambiguously as ""payments"" on the one hand or ""digital gold"" on the other.  Among many of its social capital deficits, bitcoin lacks visionary leadership.  The outcomes sought by the bitcoin community are widely agreed upon, but they are typically left unspoken.  A development team that articulates a view of bitcoin's horizons in human terms could unify the community. Then, given more study of the economics of bitcoin's systems, technical decisions could follow. Such decisions could be made with wide understanding that the trade-offs involved are faithful to the bitcoin community’s widely agreed-upon goals. At present that is left unclear.  Network effects  Network effects, of course, are the shackles that keep many dissenters chained to bitcoin, and (they feel) under the yoke of Core. The current threat of chain splits may produce a real-world test of how many bitcoin versions can exist.  Experience with ethereum and ethereum classic suggest that multiple chains can co-exist. And, for three reasons, network effects don't dictate disaster from chain splits:  It is easy to transfer among cryptocurrencies, for instance via Shapeshift.io. This means there can be a viable digital gold, a viable payments crypto and many others.  At a global scale, there are enough users to maintain several currencies. A global niche market may still be a big market.  It is a relatively small technical iteration to make all wallets, exchanges, payments gateways, etc. accept all major cryptocurrencies. The relevant ""network"" may not be any one cryptocurrency, but all of them.  The bitcoin community has a lot to learn about itself and what it is doing in the scaling debate.  The debate's tenor – those angry words and base insinuations – are commonplace in political capitols like Washington, D.C. But at the end of the day in those places, vicious political opponents can also get together to cooperate on matters of agreement.  Whatever the outcome, bitcoin users should expect that kind of professionalism and maturity from all participants in the scaling debate.  Political gridlock image via Shutterstock",NEUTRAL,없음,BLOCKCHAIN | BTC | TECHNOLOGY | TRADING | FORKS,Jim Harper,0,0,CoinDesk,https://coindesk.com/markets/2017/07/21/understanding-bitcoins-scaling-debate-politics-comes-first,https://cdn.sanity.io/images/s3y3vcno/production/5cee4ed68a73fa72eb661b604150a2e94cb44056-1500x996.jpg?w=300&h=300&fit=crop
42400202,DbF8Q09kuKX2XWBxAcIv8U,1500669047,Faster Payments? Startup Pitches Federal Reserve Group on Cryptocurrency,"A specialized task force set up by the U.S. Federal Reserve has received a slew of new proposals outlining how it might utilize technology to speed up services.  In total, 16 proposals from various payment providers were submitted to the Faster Payments Task Force, convened by the Federal Reserve in 2015 as a way to channel strategic thinking on how it could update its processes and technology.  As outlined in a new report, five submissions incorporated some form of blockchain technology, including filings by companies Eccho, Hub Culture, Kalypton Group, Nanopay Corporation, Ripple, Thought Matrix Consulting and Xalgorithms.  But perhaps the most notable published is by Wingcash, which goes as far as to propose that the Federal Reserve issue its own cryptocurrency.  The proposal states:  ""(WingCash Faster Payment Network is) a software platform that would be owned and operated by the Federal Reserve and the Governing Organization. The Federal Reserve would issue digital currency (digital Fed notes) and is tied to the Internet domain (Fednotes.com).""  Written by Bradley Wilkes, who according to the company's website is the founder and CEO of WingCash, the proposal, if ever adopted, would find the US central bank taking steps toward embracing the long-discussed ""Fedcoin"" concept long used as an illustration of the technology and its potential.  While central banking authorities from countries like U.K., Russia and China have indicated interests in issuing their own cryptocurrencies, this may be the first time a proposal has been addressed directly to the Federal Reserve.  Still, the report notes the inclusion of the proposal should not ""imply any endorsement or recommendation"" on behalf of the Federal Reserve.  Disclosure: CoinDesk is a subsidiary of Digital Currency Group, which has an ownership stake in Ripple.  Federal Reserve image via Shutterstock",POSITIVE,없음,ASIA | BLOCKCHAIN | FIAT | REGULATION | TECHNOLOGY,Wolfie Zhao,0,0,CoinDesk,https://coindesk.com/markets/2017/07/21/faster-payments-startup-pitches-federal-reserve-group-on-cryptocurrency,https://cdn.sanity.io/images/s3y3vcno/production/d53772b1ccfdcf3929dadc3c2bcd4a25a245dbc5-1000x665.jpg?w=300&h=300&fit=crop
42400221,DbF8Q09kuKX2XWBxAcIvQC,1500655555,NRI Subsidiary Launches Blockchain Technology Assessment Service,"NRI SecureTechnologies, a cybersecurity subsidiary of Japanese information security provider NRI, has announced a new blockchain service.  But what separates this offering, according to the release, is that it is designed specifically for systems that use blockchain technology. More specifically, it will seek to analyze and simulate attacks on smart contracts, or self-executing code that runs on a blockchain.  The firms said in future phases, it will develop the service to be able to assess the overall architecture of a blockchain system, including its API, multi-signature wallets, key management systems and top-level applications.  The need for such an offering can be seen as the broader industry responds to recent heists in the cryptocurrency and blockchain world.  Last year, for example, the infamous hack of DAO resulted in customers losing $60 million worth of ether, at the time through a coding error in the smart contract.  Further, just this week, CoinDash had 34,000 ethers stolen during its initial coin offering, and another hacker drained 150,000 ethers through a security bug in multi-signature wallet software offered by Parity Technologies.  The product launch also follows Japan's decision to regulate bitcoin as a legal payment method, a decision that made it the first country to put in place national rules for the industry.  Digital lock image via Shutterstock",POSITIVE,없음,ASIA | BLOCKCHAIN | BTC | TECHNOLOGY | TOKEN SALE,Wolfie Zhao,0,0,CoinDesk,https://coindesk.com/markets/2017/07/21/nri-subsidiary-launches-blockchain-technology-assessment-service,https://cdn.sanity.io/images/s3y3vcno/production/afa2a71b30f1a653ec260b54306b66bd82826edd-1500x1125.jpg?w=300&h=300&fit=crop
42400204,DbF8Q09kuKX2XWBxAcIv9T,1500649829,Blockchain Startup Billon Nets €2 Million From EU Research Fund,"UK blockchain payment startup Billon Group has received €2 million in new funding from Horizon 2020, a notable European Union research program.      According to a statement from the startup, the grant seeks to formally recognize its capacity in developing corporate payment solutions based on distributed ledger technologies (DLT). The startup said the funds would be used to its suite of develop e-commerce and content monetization solutions.      Further, while Horizon 2020 provides €80 billion in funds from 2014 to 2020 for a wide range of innovation companies, this is perhaps the first funding offer from the program to a blockchain-related startup. Specifically Billon Group's grant came from a subsidiary SME Instrument program, which has offered €3 billion during the same period for high-potential SMEs.      Tadeusz Kuropatwinski, Billion's managing director of digital payments business, added:      ""We believe content monetization and eCommerce payments will be one of the main drivers behind the global demand for micropayments, especially in emerging markets. Billon expects to launch merchant services for eCommerce and content monetization this autumn in Poland and in 2018 in the UK.""              The funding also continues Billion's history of working with government programs.      As reported in November last year, Billon was selected to the first phase of a Sandbox program launched by the U.K.'s regulation watchdog Financial Conduct Authority, designed specifically for testing DLT products in a supervised environment.      Stack of coins via Shutterstock",POSITIVE,없음,BLOCKCHAIN | BUSINESS | MARKET | REGULATION | RESEARCH,Wolfie Zhao,0,0,CoinDesk,https://coindesk.com/markets/2017/07/21/blockchain-startup-billon-nets-2-million-from-eu-research-fund,https://cdn.sanity.io/images/s3y3vcno/production/34e3c1cab715e3772f4f351f475b252b65a7a8b4-2560x1707.jpg?w=300&h=300&fit=crop
42400214,DbF8Q09kuKX2XWBxAcIvLH,1500644731,Crypto Asset Class Clears $90 Billion as Bitcoin Price Spikes,"Spurred by a massive uptick in the price of bitcoin, the total value of all cryptocurrencies passed $90 billion yesterday, a high not observed since early July.  With the move, the market capitalization of the asset class is again advancing toward $100bn, a figure it first exceeded in June when it reached an all-time high of $115bn.  At press time, the market is valued at just over $94 billion.  Still, it remains to be seen how much of that capital will remain given the rapid escalation observed in the price.  On Thursday, the price of bitcoin increased from just under $2,500 to a high of $2,889 amid an increasingly positive outlook for its technology development, analysts said.  Data from Coinmarketcap indicates the market capitalization of the digital asset increased accordingly, rising to $46 billion, from an opening figure of $37.9 billion.  Despite the rising bitcoin price, however, other assets have been performing strongly.  At publication, nine of the top 10 cryptocurrencies were showing gains, with only one, ether, showcasing a slight 24-hour decline. The figures further suggest an influx of largely new capital into bitcoin, rather than investors repositioning prior investments.  Roulette image via Shutterstock",POSITIVE,없음,BTC | BUSINESS | MARKET | TECHNOLOGY | TRADING,Pete Rizzo,0,0,CoinDesk,https://coindesk.com/markets/2017/07/21/crypto-asset-class-clears-90-billion-as-bitcoin-price-spikes,https://cdn.sanity.io/images/s3y3vcno/production/7b01d4d05b33031bf98032eb96b618c526e28d7b-1500x1000.jpg?w=300&h=300&fit=crop
42400198,DbF8Q09kuKX2XWBxAcItAU,1500642014,Utility Settlement Coin Creator to Open-Source Modular Blockchain Software,"The company behind the Utility Settlement Coin project, one of the first designed to enable central banks to utilize distributed ledger tech, is preparing a coming-out party of sorts.  After working in almost complete secret on what founder and CEO Robert Sams calls ""foundational technology,"" venture-backed blockchain startup Clearmatics will soon begin a rather unusual roll-out of new offerings for the open-source community.  In a new exclusive interview, Sams said he plans to share the first of several waves of software with the financial sector before the year’s end.  He told CoinDesk:  ""We view the technology – the actual source code – in a very modular way, and we think that not only is this a space that definitely, firmly belongs in the open-source domain, the approach to the development of the software needs to be more modular.""  While little is being revealed about the technology itself, Sams contrasted his platform with bitcoin, which relies on an unspent-transaction model, and ethereum, which uses an account-based system.  Instead, Sams said the yet-to-be named software will be ""tightly coupled"" implementations of various components, distributed consensus algorithms and networking stacks.  He compared the modular architecture to the various components of the Linux operating system, saying the software would be coupled with standards for how users implement the solution.  ""You'll see over time less and less discussion about this or that platform,"" said Sams. ""And more and more discussion ... on how to put these components together to conform to a set of standardizations.""  Twin projects  While Sams acknowledged that his work with the Utility Settlement Coin, his most well-known project, ""informs"" the soon-to-be-revealed open-source code, he made explicit that they are distinct from each other.  Last year, Clearmatics unveiled a Utility Settlement Coin consortium comprised of BNY Mellon, Deutsche Bank, Santander and ICAP – since rebranded as NEX.  Sams said the group recently completed the second phase of its work to help central banks and other financial infrastructure providers capitalize on blockchain, but that the results would remain proprietary.  While the Utility Settlement Coin project is largely focused on the business logic required to help legacy financial infrastructures increase efficiency using blockchain technology, Sams said the open-source work itself will largely consist of technology and an early version of related standards.  Sams concluded:  ""The open-sourcing of Clearmatics is not the open-sourcing of Utility Settlement Coin.""  Copper coils image via Shutterstock",POSITIVE,없음,BLOCKCHAIN | BTC | BUSINESS | ETH | TECHNOLOGY,Michael del Castillo,0,0,CoinDesk,https://coindesk.com/markets/2017/07/21/utility-settlement-coin-creator-to-open-source-modular-blockchain-software,https://cdn.sanity.io/images/s3y3vcno/production/d015970fe04575c3819700e01e757b872ee9ad32-1500x1000.jpg?w=300&h=300&fit=crop
42400184,DbF8Q09kuKX2XWBxAcIt0e,1500639316,ECB President: Cryptocurrency Price Boom Having Limited Effect on Economy,"The president of the European Central Bank (ECB) has issued remarks addressing the rising interest in cryptocurrencies as an asset class.  In a letter  to members of the European parliament this week, Mario Draghi built on statements made during a May hearing, in which he first discussed financial innovation, including the ""rapid pace of development"" in digital ledger (DLT) and related technologies. At the time, he cautioned that care must be taken so that fintech, including blockchain and DLT, does not disrupt the financial system.  Published this week, the new letter builds on this commentary, addressing more directly the rise in cryptocurrency prices so far in 2017. Driven by big gains in bitcoin and ether, the value of the total supply of all cryptocurrencies is now $93bn, down slightly from an all-time high of $115bn earlier this year.  Still, in the face of this increase, Draghi used the opportunity to restate his belief that cryptocurrencies still have a limited impact on the financial system.  Draghi wrote:  ""Although the market capitalisation of [virtual currency schemes] has increased since the publication of these reports, there is no evidence to suggest that the connection of VCS to the real economy has strengthened significantly.""  Citing past research from the ECB, Draghi indicated he still believes there could be a ""build-up of risks"" due to the use of cryptocurrencies, which may necessitate an international regulatory response.  Still, for now, he said the ECB would likely take steps to continue to monitor the ecosystem, tracking the ""number, structure and scope"" of public blockchain tokens.  ""An increase in the usage of [virtual currency schemes] is conceivable. It is thus important to monitor the take-up of VCS from a financial stability perspective,"" he said.  For more on how the ECB is approaching blockchain and cryptocurrencies, read our most recent interview.  https://www.coindesk.com/ecb-fintech-lead-central-banks-wont-compete-blockchain-tech/  Mario Draghi image via Shutterstock",NEUTRAL,없음,BLOCKCHAIN | BTC | MARKET | REGULATION | TRADING,Pete Rizzo,0,0,CoinDesk,https://coindesk.com/markets/2017/07/21/ecb-president-cryptocurrency-price-boom-having-limited-effect-on-economy,https://cdn.sanity.io/images/s3y3vcno/production/7a2a98b49eb106a1773480d0a15e45401297e456-1500x999.jpg?w=300&h=300&fit=crop
