뉴스ID,뉴스GUID,일자(UTC timestamp),뉴스제목,본문,SENTIMENT,주요코인,카테고리,작성자,추천수,비추천수,출처,뉴스URL,이미지URL
13235550,https://www.newsbtc.com/?p=355076,1540400424,"Indian Police Arrest Unocoin Co-Founder, Claim Operating Bitcoin ATM Kiosk is Illegal","Law enforcement officers in India have arrested Unocoin&apos;s co-founder for operating a Bitcoin ATM kiosk, which the police called illegal. More arrests are likely, according to the police. Law Enforcement in India Expects to Make Further Arrests After Jailing Unocoin Co-Founder The co-founder of India&apos;s first bitcoin ATM kiosk was arrested yesterday, the Times of...The post Indian Police Arrest Unocoin Co-Founder, Claim Operating Bitcoin ATM Kiosk is Illegal appeared first on NewsBTC.",NEGATIVE,BTC,BTC | REGULATION,,0,0,NewsBTC,https://www.newsbtc.com/2018/10/24/indian-police-arrest-unocoin-co-founder-claim-operating-bitcoin-atm-kiosk-is-illegal/,https://images.cryptocompare.com/news/newsbtc/eH8Rh0g8o63.jpeg
13370518,https://blokt.com/?p=25044,1540400357,Investors Can Now Purchase USDC – The Digital Programmable Dollar Backed by Coinbase and Circle,"With the volatility of the crypto market, stablecoins, cryptocurrencies backed by assets such as fiat currencies or precious metals, have been gaining in popularity in recent months. For investors that want to include some stablecoin in their digital portfolios, there is a new kid on the block. Called the USD Coin stablecoin (USDC), the crypto ...Investors Can Now Purchase USDC - The Digital Programmable Dollar Backed by Coinbase and Circle was originally found on [blokt] - Blockchain, Bitcoin &amp; Cryptocurrency News.",POSITIVE,USDC,BLOCKCHAIN | BUSINESS | EXCHANGE | FIAT | USDC,,0,0,Blokt,https://blokt.com/news/investors-can-now-purchase-usdc-the-digital-programmable-dollar-backed-by-coinbase-and-circle,https://images.cryptocompare.com/news/blokt/ek8410g410g.jpeg
13246848,https://nulltx.com/?p=71393,1540400151,"Xu Jizhe,The Founder of Newton: I Hope Newton Becomes Congested Too","Xu Jizhe is the founder of the Newton Project and was previously in charge of mailbox technology in the early years of Sina.com. He was the CTO of an e-commerce platform and started doing business in 3D printing, smart hardwareand other fields. In 2005, he established the Zeuux community to promote Free Software in China. ...The post Xu Jizhe,The Founder of Newton: I Hope Newton Becomes Congested Too appeared first on NullTX.",NEUTRAL,없음,ASIA | BUSINESS | TECHNOLOGY,,0,0,NullTx,https://nulltx.com/xu-jizhethe-founder-of-newton-i-hope-newton-becomes-congested-too/,https://images.cryptocompare.com/news/themerkle/8hIx5G08130.jpeg
13246849,https://nulltx.com/?p=71386,1540399895,"One-Week-Old Bitcoin ATM Seized In India, Owner Arrested","Barely a week after installation, India&apos;s first Bitcoin ATM has been seized by the police. The ATM was installed in one of the country&apos;s most popular malls and facilitated the withdrawal and deposit of Bitcoins. The police also arrested one of the co-founders of Unocoin, the company that had installed the ATM. The country&apos;s ...The post One-Week-Old Bitcoin ATM Seized In India, Owner Arrested appeared first on NullTX.",NEGATIVE,없음,BTC,,0,0,NullTx,https://nulltx.com/one-week-old-bitcoin-atm-seized-in-india-owner-arrested/,https://images.cryptocompare.com/news/themerkle/awCxk0czxys.jpeg
13474228,https://www.trustnodes.com/?p=18608,1540399712,Japan Green-Lights World’s First Self-Regulatory Crypto Organization,Japan has become the first country to approve a self-regulatory organization to oversee crypto exchanges. &apos;It&apos;s a very fast moving industry. It&apos;s better for experts to make rules in a...The post Japan Green-Lights World&apos;s First Self-Regulatory Crypto Organization appeared first on Trustnodes.,POSITIVE,없음,ASIA,,0,0,TrustNodes,https://www.trustnodes.com/2018/10/24/japan-green-lights-worlds-first-self-regulatory-crypto-organization,https://images.cryptocompare.com/news/trustnodes/ch4wg000000.png
13363392,https://cointelegraph.com/news/chinese-e-commerce-giant-alibaba-wins-preliminary-injunction-against-alibabacoin,1540398900,Chinese E-commerce Giant Alibaba Wins Preliminary Injunction Against Alibabacoin,"A U.S. judge has ruled in favour of Alibaba in its trademark infringement case, stating that Alibabacoin&apos;s name is confusing and thus should not be used in the U.S",NEGATIVE,없음,ASIA | BLOCKCHAIN | REGULATION,,0,0,CoinTelegraph,https://cointelegraph.com/news/chinese-e-commerce-giant-alibaba-wins-preliminary-injunction-against-alibabacoin,https://images.cryptocompare.com/news/cointelegraph/dj0Oo20M80o.jpeg
13370519,https://blokt.com/?p=25064,1540398573,Binance Releases Heart-Warming Report on 2018 West Japan Disaster Relief Project,"The Blockchain Charity Foundation (BCF), the charity arm of Binance cryptocurrency exchange, released a report on Oct. 24 of how it played a crucial role in providing relief to the victims of Japan&apos;s worst floods in 36 years. Binance&apos;s West Japan Disaster Relief Project ran from July 8 to Sept. 21 and had a secondary ...Binance Releases Heart-Warming Report on 2018 West Japan Disaster Relief Project was originally found on [blokt] - Blockchain, Bitcoin &amp; Cryptocurrency News.",POSITIVE,없음,ASIA | BLOCKCHAIN | BTC | EXCHANGE | BNB,,0,0,Blokt,https://blokt.com/news/binance-releases-heart-warming-report-on-2018-west-japan-disaster-relief-project,https://images.cryptocompare.com/news/blokt/aj4r0020200.jpeg
13363393,https://cointelegraph.com/news/nasdaq-wins-blockchain-patent-for-smart-contract-based-information-release-system,1540397100,Nasdaq Wins Blockchain Patent for Smart Contract-Based Information Release System,"Nasdaq gets regulator approval for latest blockchain patent, which aims to secure the release of information to the media",POSITIVE,없음,BLOCKCHAIN,,0,0,CoinTelegraph,https://cointelegraph.com/news/nasdaq-wins-blockchain-patent-for-smart-contract-based-information-release-system,https://images.cryptocompare.com/news/cointelegraph/9zw60o0w442.jpeg
42381339,0r6Zag11PPDEMKgUX94sx3,1540396869,This College Freshman Is Out to 51% Attack Your Cryptocurrency,"A college freshman is coming after your cryptocurrency – but not to steal your coins, just to prove that someone could do so pretty easily.  According to a crypto enthusiast and security researcher going by the handle ""geocold51,"" most small-scale cryptocurrencies are at risk from the industry's most feared vulnerability – the 51% attack. During this attack, a miner takes over more than half of a cryptocurrency's mining power, which then allows them to erase a past transaction and replace it with another transaction – called a double spend.  While the ecosystem that's been built up around bitcoin and other top-tier cryptos make them resistant to these kinds of attacks, other cryptocurrencies with less of a community of miners aren't as secure.  Sure enough, on smaller coins, these kinds of attacks are getting more common. In a new report, Group-1B found $20 million worth of crypto theft accomplished with such attacks in 2018, as TNW reported.  On Saturday, October 13, geocold51 decided to display just how easy it was – livestreaming his attempt to 51% attack Bitcoin Private, a crypto with close to a $47 million market cap (at the time of writing).  Speaking to CoinDesk, geocold51 said, if a cryptocurrency can be so easily attacked, ""it's sort of a misvalue of a given currency by different investors.""  Geocold51 estimates he spent $100 to get to the point where he could have done a demonstration double spend on bitcoin private, but he stopped because his livestream got pulled.  Just to be clear, geocold51 wasn't interested in stealing, and so he set up the demonstration where he'd send the bitcoin private he owned to two different wallets he owned. In that way, no user or exchange provider gets ripped off.  For him, it's about displaying that many coins are vulnerable and, therefore, perhaps vastly over-valued.  That said, he estimates that to make a profit off a 51% attack, it would cost a malicious attacker roughly double – so around $200 – to buy some bitcoin on an exchange with his bitcoin private and then make another transaction on the longer chain that invalidates the first transaction, giving him his bitcoin private coins back and leaving the exchange coming up short.  While going through the exchange process costs more, the 51% attack has still become quite economical due to the rise of cloud computing. According to geocold51, without access to cloud mining, an attack like he did on bitcoin private would have cost him about $100,000 in hardware.  ""Nicehash and the ability to rent hashing power fundamentally changes the landscape of 51% attacks,"" geocold51 told CoinDesk, adding:  ""If there's not a lot of hashing power to secure it, but there is a lot of value associated with it, that's where you can do a 51% attack.""  Because geocold51 announced the livestream on Reddit (the post got 1500 upvotes and 60,000 views, he said), the attempted attack got quite a bit of attention – even dogecoin creator Jackson Palmer tweeted about watching.  Still, the livestream didn't work exactly as planned, and because of that, geocold51 said he would run a complete attack later. He told CoinDesk he will do it without a stream this week and release a recording of his demonstration on YouTube shortly after.  The inspiration  The young security researcher's handle might remind some of another security guru.  According to geocold51, he was inspired by one of the most legendary hackers of recent years: geohot, who famously jailbroke the original iPhone, which means the restrictions on carriers and apps were removed.  These days, geohot likes to livestream himself searching for vulnerabilities.  And geocold51 figured he could start doing the same within the cryptocurrency ecosystem.  Geocold51 has a good knowledge of crypto. Back when GPU hardware was still lucrative for hobbyist miners, geocold51 mined quite a bit of bitcoin. He then began trading money on Cryptsy, before the exchange's CEO allegedly walked away with millions of dollars in its user's money.  In that, he lost nearly all his bitcoin.  But he still remained interested in the space, and continued to study up on how it all worked. And as the industry divided into hundreds and thousands of different cryptocurrencies, geocold51 thought he might be able to shine some light on the security pitfalls.  And others were interested in that too. His Reddit post about the challenge garnered 1500 upvotes and over Twitch, he received $888 in donations.  The day of the attack  What's also interesting is that bitcoin private wasn't his first target.  Instead, geocold51 had intended to go after einsteinium, a volunteer-run litecoin fork with a $19 million market cap and $598,000 in trading volume per day, at the time of this writing.  He announced his intent publicly, and as he got ready for the attack, commenters within his Twitch feed noted that the cryptocurrency's hash rate was spiking.  Because he had announced the attack in advance, the einsteinium community boosted the hash rate because it was worried that such an attack could cause a chain split and create a second blockchain that people could get stuck on, according to Ben Kurland, one of the project's board members. At that time, einsteinium was in the middle of a wallet upgrade. If users or exchanges did not upgrade their wallets in time, the blockchain split could have caused property loss.  Seeing the increased hash power, geocold51 decided to attack bitcoin private instead.  According to geocold51, he got over 600 views during the Twitch livestream, before Twitch shut the stream down. The team at Twitch, he said, temporarily suspended him under the ""attempts of threats of harm"" section of its community guidelines.  He got another livestream up on Stream.Me a half-hour later.  Once broadcasting there, he was able to hire miners through Nicehash to mine bitcoin private. In fact, he almost immediately mined a block. And in very little time, he was controlling more than 50 percent of the hash power on the blockchain.  Pretty soon an account called ""CommunityWatch"" popped up in the stream and wrote: ""Just a quick question: I'm assuming everything we are doing here is legal?""  Minutes later, geocold51's video feed on Stream.Me cut out.  Geocold51 told CoinDesk that he had already gotten about two-thirds of the hash rate on bitcoin private. He'd transmitted his first transaction to a second wallet he controlled. And he had written another transaction onto an offline chain that went to a third wallet he controlled.  He was about to send this longer chain to the network, but since the whole point was to show people the attack could be done easily, he stopped once the livestreams shut off.  Protected in another way  Still, geocold51 is determined to follow through with his mission, and so will record his next attack to share on YouTube soon.  And while this vulnerability is likely to be worrying to many in the community, geocold51 noted that there is another way these coins are protected based on cryptocurrency game theory.  If someone tried to sell any significant volume of the coins, their price would likely plummet, since the community isn't robust enough and doesn't have huge amounts of liquidity. As such, geocold51 argued, even if it is easy to buy hash power and take over a network, it might not be feasible to make a lot of money from an attack.  Nevertheless, geocold51 is committed to continuing, using the donations he received to maybe even try to 51% attack more cryptocurrencies as well.  In fact, he told CoinDesk, he may intentionally attack some cryptocurrencies that have set up preventative measures for 51% attacks, to test them in production. For instance, the team developing Horizen (formerly zencash) believes it's found a way to disincentivize 51% attacks by introducing certain miner penalties.  Geocold51 said he would be happy to fail against some of these measures.  Running the demonstrations privately and adding some production value on the final recording will likely make for more edifying content, according to geocold51, but he's still a bit disappointed that his original plan didn't pan out.  To CoinDesk, he concluded:  ""There is something kind of neat about it being live.""  Twitch, Stream.Me and bitcoin private's teams did not reply to a request for comment for this story.  UPDATE (25 October 14:46 UTC): This story has corrected the number of views on the Twitch stream.  Hand shadow on keyboard image via Shutterstock",NEGATIVE,없음,BTC | EXCHANGE | MINING | TRADING | FORKS,Brady Dale,0,0,CoinDesk,https://coindesk.com/markets/2018/10/24/this-college-freshman-is-out-to-51-attack-your-cryptocurrency,https://cdn.sanity.io/images/s3y3vcno/production/0b4e757d70e62df6e1fa33a23ad7c9212f63ad1d-1500x1000.jpg?w=300&h=300&fit=crop
13370520,https://blokt.com/?p=25079,1540396762,"Bakkt, ICE’s Cryptocurrency Trading Platform, Will Launch Bitcoin Futures in December","Bakkt, an upcoming cryptocurrency exchange backed by the Intercontinental Exchange (ICE), owner of the New York Stock Exchange (NYSE), will offer a physically settled Bitcoin futures contract, subject to regulatory review and approval. The new offering will provide greater access for institutional investors via a regulated market infrastructure. Bitcoin Futures to Begin Trading on Dec. ...Bakkt, ICE&apos;s Cryptocurrency Trading Platform, Will Launch Bitcoin Futures in December was originally found on [blokt] - Blockchain, Bitcoin &amp; Cryptocurrency News.",POSITIVE,없음,BLOCKCHAIN | BTC | BUSINESS | EXCHANGE | TRADING,,0,0,Blokt,https://blokt.com/news/bakkt-ices-cryptocurrency-trading-platform-will-launch-bitcoin-futures-in-december,https://images.cryptocompare.com/news/blokt/ccYNV0YMo8Y.jpeg
13437074,https://news.bitcoin.com/?p=235050,1540396525,"IDEX Blacklists New York Residents, Setting a Worrying Precedent","IDEX, the supposedly decentralized exchange, plans to start blocking traders who reside in the state of New York. The decision sets an alarming precedent for decentralized exchanges (DEX), which have traditionally given short shrift to regional regulations in their pursuit of censorship-resistance. Also read: Circle&apos;s USDC Stablecoin Added to Coinbase World&apos;s Largest Censorship-Resistant DEX Starts Censoring ...The post IDEX Blacklists New York Residents, Setting a Worrying Precedent appeared first on Bitcoin News.",NEGATIVE,USDC,BTC | EXCHANGE | USDC | TOKEN LISTING AND DELISTING,,0,0,Bitcoin.com,https://news.bitcoin.com/idex-blacklists-new-york-residents-setting-a-worrying-precedent/,https://images.cryptocompare.com/news/bitcoin.com/eb2p40B280g.jpeg
13474229,https://www.trustnodes.com/?p=18600,1540395219,Roisman Lobbied on Bitcoin ETF While Stein Wants “Accurate Valuations”,"Elad Roisman, the newest commissioner at the Securities and Exchanges Commission (SEC), has met with representatives from SolidX, VanEck, and CBOE which have a pending application for a bitcoin ETF...The post Roisman Lobbied on Bitcoin ETF While Stein Wants &apos;Accurate Valuations&apos; appeared first on Trustnodes.",NEUTRAL,없음,BTC | REGULATION,,0,0,TrustNodes,https://www.trustnodes.com/2018/10/24/roisman-lobbied-on-bitcoin-etf-while-stein-wants-accurate-valuations,https://images.cryptocompare.com/news/trustnodes/clkGCG0wp0e.png
13235551,https://www.newsbtc.com/?p=355062,1540395059,Tech Lead at Capgemini Defends Bitcoin Against Nouriel Roubini’s Testimony,"Despite the growing popularity and acceptance of Bitcoin, every now and then there is someone who lambastes it. Recently, it was Nouriel Roubini, an economist and professor at New York University&apos;s Stern School of Business, who attacked cryptocurrencies, calling them the &apos;mother of all scams and bubbles.&apos; Jan-Willem Burgers, the technology lead at Capgemini&apos;s Distributed...The post Tech Lead at Capgemini Defends Bitcoin Against Nouriel Roubini&apos;s Testimony appeared first on NewsBTC.",POSITIVE,BTC,BTC | BUSINESS | TECHNOLOGY,,0,0,NewsBTC,https://www.newsbtc.com/2018/10/24/tech-lead-at-capgemini-defends-bitcoin-against-nouriel-roubinis-testimony/,https://images.cryptocompare.com/news/newsbtc/bWm22migd0E.jpeg
13363394,https://cointelegraph.com/news/crypto-exchange-bitfinex-denies-allegedly-fake-tether-volumes-listed-on-coinmarketcap,1540394400,Crypto Exchange Bitfinex Denies Allegedly 'Fake' Tether Volumes Listed on CoinMarketCap,Crypto exchange Bitfinex hits back at a media report that accused it of publishing trading volume data from &apos;a market that doesn&apos;t exist&apos;,NEGATIVE,없음,BLOCKCHAIN | EXCHANGE | FIAT | MARKET | USDT,,0,0,CoinTelegraph,https://cointelegraph.com/news/crypto-exchange-bitfinex-denies-allegedly-fake-tether-volumes-listed-on-coinmarketcap,https://images.cryptocompare.com/news/cointelegraph/91o1wxU6461.jpeg
13452340,https://bitcoinist.com/?p=90749,1540393236,"Bitcoin Price Has Maximum $22K Potential By End Of 2018, Says Tom Lee","Bitcoin could end 2018 at $22,000, Fundstrat Global Investors analyst Tom Lee repeated in new predictions about the end of the cryptocurrency bear market October 19. Lee: 200-day MA &apos;Very Important&apos; Speaking during an interview with social media blog Crypto Tips, Lee, who is known for his bullish stance on Bitcoin in particular, highlighted the 200-day moving average price trend as a key factor in determining its future performance. &apos;When Bitcoin&apos;s below its 200-day, itRead MoreThe post Bitcoin Price Has Maximum $22K Potential By End Of 2018, Says Tom Lee appeared first on Bitcoinist.com.",POSITIVE,없음,ALTCOIN | BTC | BUSINESS | ETH | TRADING,,0,0,Bitcoinist,https://bitcoinist.com/bitcoin-price-22k-end-2018-tom-lee/,https://images.cryptocompare.com/news/bitcoinist/cq0n6O_C510.jpeg
13370521,https://blokt.com/?p=25018,1540393143,Hitachi Consulting to Participate in the Oracle OpenWorld 2018 Event,"The Oracle OpenWorld 2018 event will feature Hitachi Consulting Corporation, which will deliver a keynote address on &apos;IoT, AI, and Blockchain Power Business Growth, Efficiency, and Productivity.&apos; The event is set to take place between Oct. 22 and 25 at the Moscone Center in San Francisco. Hitachi&apos;s keynote address will be delivered on Tuesday, Oct. 23, ...Hitachi Consulting to Participate in the Oracle OpenWorld 2018 Event was originally found on [blokt] - Blockchain, Bitcoin &amp; Cryptocurrency News.",POSITIVE,없음,BLOCKCHAIN | BTC | BUSINESS,,0,0,Blokt,https://blokt.com/news/hitachi-consulting-to-participate-in-the-oracle-openworld-2018-event,https://images.cryptocompare.com/news/blokt/cilbfwiRhv0.jpeg
13235552,https://www.newsbtc.com/?p=355051,1540391448,"Another Stablecoin Announced, First on Stellar Network in Aussie Dollars","Stablecoin popularity continues to grow, and ever since Tether (USDT) started the trend, numerous other stablecoins have emerged around the world. Despite the recent Tether controversy that has seen the pegged coin&apos;s value drop below $1 — which should never happen, since each coin is supposedly backed by a buck — other stablecoins continue to...The post Another Stablecoin Announced, First on Stellar Network in Aussie Dollars appeared first on NewsBTC.",POSITIVE,USDT,ALTCOIN | USDT | XLM,,0,0,NewsBTC,https://www.newsbtc.com/2018/10/24/another-stablecoin-announced-first-on-stellar-network-in-aussie-dollars/,https://images.cryptocompare.com/news/newsbtc/c8411800210.jpeg
13370522,https://blokt.com/?p=25025,1540391351,Minds Blockchain Social Network Raises $6 Million From Medici Ventures in Series A Funding,"Minds, a blockchain-based social network, announced on Oct. 22 that it had received $6 million in Series A funding from Medici Ventures, an Overstock.com subsidiary that focuses on crypto venture funding activities. In a reciprocal move, Patrick M. Byrne, founder, and CEO of Overstock.com, gets a seat at Minds&apos; board of directors. Minds utilizes what ...Minds Blockchain Social Network Raises $6 Million From Medici Ventures in Series A Funding was originally found on [blokt] - Blockchain, Bitcoin &amp; Cryptocurrency News.",POSITIVE,없음,BLOCKCHAIN | BTC,,0,0,Blokt,https://blokt.com/news/minds-blockchain-social-network-raises-6-million-from-medici-ventures-in-series-a-funding,https://images.cryptocompare.com/news/blokt/d1Aicd8xCg0.jpeg
42381337,0r6Zag11PPDEMKgUX94suX,1540391146,Blockchain Firm SETL Wins License to Operate Central Securities Depository,"U.K.-based settlement infrastructure provider Setl has been granted a license from France's securities regulator to operate a central securities depository system using blockchain tech.  With the license from the Autorité des Marchés Financiers now in place, according to a report from the FT on Tuesday, the company will be able to plug into TARGET2-Securities (T2S) – a pan-European system recently set up to unite the previously fragmented European securities settlement infrastructure.  Approval to join T2S is expected to be issued in the next few weeks, the FT says, with Setl's securities depository slated for launch early next year.  SETL introduced its settlement solution in October of last year. The firm describes its product as ""multi-asset, multi-currency institutional payment and settlements infrastructure based on blockchain technology.""  The system, using a permissioned distributed ledger to log ownership and transaction records, is designed to enable market participants to directly exchange cash and assets, ""facilitating the immediate and final settlement of market transactions.""  SETL was founded in 2015 and is backed by major institutions including Citi, which bought a stake in the firm in February. According to CrunchBase, it has received $39 million in funding to date.  Also announced this week, Setl has appointed a new chief executive officer, while its former CEO and co-founder Peter Randall is now president of the firm.  Euros image via Shutterstock",POSITIVE,없음,BLOCKCHAIN | EXCHANGE | MARKET | REGULATION | WALLET,Yogita Khatri,0,0,CoinDesk,https://coindesk.com/markets/2018/10/24/blockchain-firm-setl-wins-license-to-operate-central-securities-depository,https://cdn.sanity.io/images/s3y3vcno/production/de7b2d6f9f7c7ef2988bb140139612aa5ddf902c-1500x1000.jpg?w=300&h=300&fit=crop
13370523,https://blokt.com/?p=25122,1540391085,Dogecoin [DOGE] Declines 33% While Rest of Cryptocurrency Market Consolidates,"The famous meme-based digital currency Dogecoin has been on a downward spiral this month which has seen the coin decline from $0.006 to $0.004. The cryptocurrency which is commonly used as a tipping coin had a large spike at the start of September where it appreciated from support at $0.0022 to a high around $0.007. ...Dogecoin [DOGE] Declines 33% While Rest of Cryptocurrency Market Consolidates was originally found on [blokt] - Blockchain, Bitcoin &amp; Cryptocurrency News.",NEGATIVE,DOGE,BLOCKCHAIN | BTC | DOGE | MARKET,,0,0,Blokt,https://blokt.com/technical-analysis/dogecoin-doge-declines-33-while-rest-of-cryptocurrency-market-consolidates,https://images.cryptocompare.com/news/blokt/80000000000.png
