뉴스ID,뉴스GUID,일자(UTC timestamp),뉴스제목,본문,SENTIMENT,주요코인,카테고리,작성자,추천수,비추천수,출처,뉴스URL,이미지URL
42377540,0r6Zag11PPDEMKgUX71gVh,1407441646,Vogogo Raises $8.5 Million to Boost Bitcoin Exchange Security,"Calgary-based online payment services provider Vogogo, a platform that automates payment processing, regulatory compliance and risk management for businesses, including clients in the bitcoin and digital currency sector, has raised $8.5m in new funding.  The round was led by Cormark Securities Inc and included Beacon Securities Limited, Canaccord Genuity Corp, Clarus Securities and Salmon Partners, with the capital aimed at helping the company expand its service beyond Canada to the US and Europe.  Speaking to CoinDesk, Vogogo CSO Rodney Thompson said that his firm has become more actively involved in the digital currency space, owing to the need of the industry's businesses for a partner that can handle fiat compliance and the associated fraud mitigation responsibilities that coincide with these offerings.  Thompson told CoinDesk that most of his firm's partners are digital currency exchanges that have turned to Vogogo to handle their risk management, know your customer (KYC), anti-money laundering (AML), fraud mitigation and dispute resolution needs, explaining:  ""Our banking partners are willing to work with us so we can put our payment processing behind that. It's been proven that [the digital currency industry] is trying to put its best foot forward, but people are having a difficult time with managing the platform side of it.""  Thompson indicates that Vogogo has become a valuable third-party partner that allows digital currency businesses to mitigate fraud in real time, without having to build in-house systems that meet this need.  Now, Thompson indicated, his firm is looking to build on this success to perform similar services to digital currency companies operating outside of Canada, adding:  ""For us, it's just about growth, taking what we've been doing in Canada and expanding out globally. From our side, we're specializing this piece of what we do for the crypto industry, for crypto businesses.""  Early market entrance  Thompson indicated that though Vogogo and its employees have had an internal interest in bitcoin for some time, as the company's CTO was an early and active bitcoin miner.  Despite the familiarity, it wasn't until the June 2013 closure of LibertyBit, then the second-largest exchange in Canada, that the company became convinced it could serve a real business need in the budding industry.  Thompson recalls:  ""LibertyBit really stands out to me, because they were ran into a problem where they were doing online bank maintenance and they thought they were indemnified, and of course there really is no such thing as an indemnified payment, and they went down. So, it was then that you were just starting to see the issues around it.""  This development, as well as similar shutdowns from other major exchanges, pushed Vogogo to look more closely at the opportunity. After about three months of development, Vogogo tailored its offering to the digital currency space and began serving the market.  How Vogogo works  Thompson revealed Vogogo is currently working on a new product release that will allow it to handle KYC, AML and compliance requirements for digital currency exchanges.  ""We [will] do the ongoing fraud mitigation. So, we will set the customer with their payment and all the ongoing fraud mitigation around it,"" Thompson said. ""What that means is we'll manage all your bad debt, any fraud scenarios that happen, we manage all that.""  Vogogo doesn't actually handle bitcoins or altcoins for its clients. Instead, Vogogo ensures that fiat payments are managed correctly, limiting its clients' risk for chargebacks and the other previously mentioned issues that come with the responsibility for customer funds.  Thompson added: ""When an end user gets to that exchange to deal in bitcoin or altcoin, that's on the exchange. When they want to take whatever they've sold and move the fiat back into the currency of their choice, that's also on [the exchange.""  No pivot needed  Thompson said that while Vogogo is happy to serve clients in the digital currency space, extending its services to this community doesn't necessitate a fundamental change in its business. Vogogo had historically served e-commerce platforms, and continues to do so.  Rather, Thompson indicated that all Vogogo needed to do was gear its existing offerings to the needs of the space while capitalizing on existing expertise.  He continued:  ""We've always dealt in secondary payment options, and that being payments that aren't credit card related, and because of that, we've always had a risk engine in front of those payments.""  When asked about potential upcoming digital currency regulation in Canada, the CSO said that this, too, won't require Vogogo to shift or change its product offering.  ""For us, we have a really strong payments team, we have a really strong risk management team, legal team, so we're constantly adapting what we do on the shifts, regulatory or other. If there is a change on the regulatory side that we need to address, it's pretty easy for us to make those changes and to make our platforms compliant.""  Expanding to new markets  As for the funding, Thompson indicated that it will be necessary given the company's desire to enter new markets in Europe and North America, especially owing to the expense of expanding a risk platform globally.  This expansion, Thompson said, will require Vogogo's payment solutions to be customized and integrated with domestic banks.  Thompson concluded:  ""We take working with our banking partners and any regulatory requirements very seriously, we don't cut any corners. [If] we're set up to be somewhere, it's all set up properly.""  For more information on Vogogo and its payment solutions, visit the company's website.  Images via Vogogo",POSITIVE,없음,ALTCOIN | BTC | BUSINESS | EXCHANGE | FIAT,Pete Rizzo,0,0,CoinDesk,https://coindesk.com/markets/2014/08/07/vogogo-raises-85-million-to-boost-bitcoin-exchange-security,https://cdn.sanity.io/images/s3y3vcno/production/5b5fc2118703565fdbf729044488874fc0bd5562-1256x668.jpg?w=300&h=300&fit=crop
42377501,0r6Zag11PPDEMKgUX71gHr,1407436358,Avalancha Opens Online Store to Argentina's Bitcoin Shoppers,"Argentina-based e-commerce company Avalancha has announced it will now accept bitcoin through a new strategic partnership with bitcoin merchant processor BitPagos and Latin America-focused bitcoin exchange Bitex.la.  Avalancha  , which launched in May, aims to provide Argentinian consumers with a convenient buying option for electronics and home appliances, and it sees bitcoin as a key investment that will help it better serve its growing customer base.  Miguel Klurfan, CEO of Avalancha, told CoinDesk his company is focused on giving online shoppers a greater degree of convenience, and that Argentina's credit card processors simply add too much friction to the buying process.  He explained:  ""Paying with bitcoin is seamless, while [...] payment processing companies in Argentina are not so well prepared for online business. That's why we are very interested in developing bitcoin as soon as possible.""  Klurfan went on to express his hope that Avalancha's decision will be as beneficial to bitcoin, which has grown increasingly popular in the region amid concerns about the country's financial status.  ""For Argentinians that may be hesitant about bitcoin, hearing the news that you can buy a refrigerator with bitcoin will encourage them to increase the adoption of the currency,"" Klurfan noted.  Avalancha has earned $10m pesos in revenue since its launch, with the goal of earning $25m pesos by the year's end.  Inside the partnership  As part of the deal, Avalancha will use BitPagos as its payment processor, providing bitcoin users in South America with the ability to purchase a wide range of goods with bitcoin from major brands that include Nintendo, Samsung, Whirlpool and more. Bitex.la's role will be to help sell some of the bitcoins Avalancha receives for US dollars at the company's request.  Members of Bitex.la and BitPagos say that Avalancha sees bitcoin as a payment tool that will help encourage consumer spending, and one that positions the company for long-term growth.  Klurfan was also optimistic about his selection of partners and their enthusiasm for the project, saying:  ""We see ourself as a technology company and everyone on our team is young and an early-adopter. We made a really good match with the guys from Bitex.la and BitPagos.""  BitPagos raised $600,000 earlier this year from investors including bitcoin hedge fund Pantera Capital, Bitcoin Investment Trust CEO Barry Silbert and Silk Road auction winner Tim Draper. Likewise, Bitex.la launched in May with a $2m investment to provide bitcoin exchanges services to Latin American markets.  Competitive advantage  Christian Nubis, chief product officer at Bitex.la, explained that the move benefits Avalancha by providing the company with a compelling way to attract new consumers, explaining:  ""The entire consumer electronics and appliance space is very competitive and they always want to be ahead of the curve. A lot of these retail chain stores have been looking into bitcoin in order to have a competitive advantage over the competition.""  Fran Buero, the company's chief operating officer, elaborated further, suggesting that the partnership will allow Avalancha to receive money faster than if it waited for credit card payment, while protecting the company from inflation.  Nubis added:  ""If Avalancha sells a washing machine and the consumer pays with credit card, inflation is so high they might end up losing money, because with the money they get 20 days from now, the washing machine might be more expensive, at least with the current situation in Argentina.""  Argentinian consumers have been said to be turning to bitcoin as a solution to inflation in recent years, although figures for adoption in the country aren't widely known.  Still, while consumer adoption has been allegedly strong, merchant adoption has lagged behind owing to uncertainty around potential bitcoin regulation and worries that Argentina could crack down on bitcoin in moves that echo recent decisions in Bolivia and Ecuador.  Ready to spend  However, given that many Argentina-based bitcoin consumers are using bitcoin as a way to guard against inflation, it remains to be seen whether they would be comfortable spending it given the opportunity.  Klurfan, however, is optimistic about the new initiative, dismissing suggestions that Argentina's consumers might be seeking to simply preserve value in bitcoin, saying:  ""I know that there are not so many Argentinians holding bitcoin right now, but I believe those who do would be really really excited about it.""  Nubis suggested that this concern may be unwarranted. Bitcoin, he asserts, will actually provide a powerful incentive for spending by making it easier for consumers to tap wealth that may be stored outside of Argentina:  ""It will be very compelling for people to spend bitcoin for a number of reasons. [...] If you have to bring money into the country, it's very expensive if you want to bring small amounts, whereas buying bitcoin overseas is quite cheap and using that directly for payment is also very convenient.""  He added: ""We think a lot of people are going to find bitcoin a more convenient way of buying electronics and home appliances.""  Image via Avalancha",POSITIVE,없음,BTC | BUSINESS | EXCHANGE | REGULATION | TECHNOLOGY,Pete Rizzo,0,0,CoinDesk,https://coindesk.com/markets/2014/08/07/avalancha-opens-online-store-to-argentinas-bitcoin-shoppers,https://cdn.sanity.io/images/s3y3vcno/production/19f28f7adb0df010113d0d0baa786f909c9d5f2e-1689x619.png?w=300&h=300&fit=crop
42377506,0r6Zag11PPDEMKgUX71gMt,1407432618,Wikipedia Raises $140k in First Week of Bitcoin Donations,"The Wikimedia Foundation, the non-profit that owns and curates noted online encyclopedia Wikipedia, has received more than $140,000 in bitcoin donations since it began accepting contributions in the digital currency last week.  The news follows the announcement of the organization's partnership with California-based payments processor Coinbase to accept bitcoin on 30th July, a development that was widely seen as a validation of bitcoin's potential to impact non-profit fundraising.  Coinbase revealed the fundraising milestone in a new blog post, saying that the $140,000 – an amount worth approximately 237 BTC – is a sign that bitcoin and the open-source site will continue to prove to be a powerful combination.  The company added:  “We were particularly excited to enable the Wikimedia Foundation to accept bitcoin donations because we feel that the decentralized, inclusive nature of Wikipedia is well aligned with bitcoin and we wanted to help the bitcoin community contribute to the democratization of information.”  The Wikimedia Foundation had been internally discussing the addition of a bitcoin donation option for months as grassroots support within its community grew.  Notably, Coinbase announced on 1st August that it had dropped all processing fees for the non-profits it serves, including the Wikimedia Foundation.  Sign of success  The bitcoin acceptance – and the ability to raise a significant amount – suggests the staying power of digital currency donations, owing to the combination of tax benefits and transaction cost savings.  In the past, the Wikimedia Foundation has said that the decision was made only after strong internal debate about the legal and financial implications of doing so.  The company previously said:  “Using Coinbase, a bitcoin exchange, we’re able to immediately convert bitcoin to US dollars, requiring minimal technical implementation on our end. Since we now also have guidance on how to account for bitcoin, there is a clear understanding of how to legally manage it.”  The Wikimedia Foundation was unavailable for comment at press time.  Donation visualization via Shutterstock",POSITIVE,BTC,BTC | EXCHANGE | REGULATION | TRADING,Stan Higgins,0,0,CoinDesk,https://coindesk.com/markets/2014/08/07/wikipedia-raises-140k-in-first-week-of-bitcoin-donations,https://cdn.sanity.io/images/s3y3vcno/production/60cdf9ea914164ab356bb8d6876590231af0edd1-2560x1920.jpg?w=300&h=300&fit=crop
42377500,0r6Zag11PPDEMKgUX71gGb,1407421781,How Altcoin Payments Paid Off for Hustler,"Founded in 1974, Hustler is perhaps best known as the publisher of its sometimes controversial pornographic magazine. However, over the years, it's become a powerful brand, grossing roughly $300m annually as of 2009 through initiatives that include a California casino, a chain of bars and clubs, and branded retail stores.  Of course, the company is inseparable from founder Larry Flynt, the larger-than-life personality that was notably brought to the big screen in the 1996 drama The People vs. Larry Flynt, a film that grossed $20m and was nominated for two Academy Awards. Cinema aside, Flynt continues to remain active despite longstanding health problems, and maintains a role in his business.  For example, on 9th July, Flynt gave the green-light for Hustler to embrace yet another sometimes controversial idea – digital currency – when it partnered with digital payments processor GoCoin to accept bitcoin, litecoin and dogecoin for its lifetime Hustler.com memberships.  This was a move that Derek Meklir, vice president of the Larry Flynt Publications Internet Group, suggested was in line with the founder's classic decision making, telling CoinDesk:  ""Larry likes to be on the cutting edge of technology, that's what he's always done, and that's how he's done well over the years.""  However, despite his brand's affiliation with risqué and fringe tastes, Meklir said Hustler decided to take digital currency in part due to how widely it has now been adopted in the mainstream.  ""The adult industry has led the way in a lot of technologies and, in this case, actually a lot of mainstream companies have been doing it as well,"" he said. ""There have been cable providers that are accepting bitcoin, and we're going to be one of the first ones, but it already seems like a lot of people are seeing the value of bitcoin.""  The former Playboy Enterprises VP said his company is happy with the returns bitcoin sales have generated so far. While Meklir doesn't see bitcoin becoming Hustler's largest source of income, he believes it will become one of the company's most frequently used payment methods.  Altcoin successes  Perhaps most surprising to Meklir has been the popularity of Hustler.com's litecoin and dogecoin payment options.  He indicated that, although these currencies initially seemed just a nice addition to the overall package, they have proven the enthusiasm and purchasing power of their respective audiences.  Meklir said:  ""I wasn't expecting more than bitcoin, I thought the others were nice to have, but it turns out we're seeing transactions across all currency types.""  While he declined to offer specific sales figures, Meklir did say that he expects the volume of transactions on all three digital currencies to increase over time.  In particular, he noted that Hustler is seeking to expand the offer to overseas markets, although he declined to provide a specific timeframe for the service, stating: ""We're still implementing how it's going to [work] for foreign transactions.""  Niche market  Even though mainstream consumers are increasingly adopting digital currency, Meklir suggested he still sees the technology's enthusiasts as a bit of a niche audience.  When asked if he believed porn could provide a compelling use case for first-time bitcoin buyers, Meklir suggested he feels this transition is still one that will take time and won't be helped by any single use case.  ""What I think is going on, is there's a consumer base that is already part of the digital currency market, and they have options of what they can do with their bitcoins and other digital currencies – whether it's holding on to them or spending them,"" Meklir said.  Still, he did acknowledge the appeal of bitcoin's relative anonymity for his brand and his industry, adding: ""If you're going to spend, it might make sense to do it on things you want more anonymity with.""  Meklir went on to say that it is likely to be the porn industry's established embracing of new technologies, rather than user demand, that encourages wider digital currency adoption among Hustler's competitors.  Removing limitations  Above all, Meklir stressed that his brand's embrace of digital currency payments was simply a logical way for Hustler to expand its audience.  For example, he noted the potential downsides of refusing to offer a digital currency payment option, stating:  ""We want to be able to open up our site to [...] as large of an audience as possible. If we were only accepting US dollars, it would limit us.""  As for Flynt's involvement in the project, Meklir said he keeps the founder updated on the bitcoin payments program, and that Flynt is eager to see the results.  He concluded:  ""I keep him up-to-date on how things are going. We may be looking to expand on it.""  Image via HotNVegas.com",POSITIVE,없음,ALTCOIN | BTC | DOGE | LTC | MARKET,Pete Rizzo,0,0,CoinDesk,https://coindesk.com/markets/2014/08/07/how-altcoin-payments-paid-off-for-hustler,https://cdn.sanity.io/images/s3y3vcno/production/09bf91f80cd8d5270b7d8455c0cd3ec84976109a-1422x678.png?w=300&h=300&fit=crop
42377513,0r6Zag11PPDEMKgUX71gRv,1407405903,From Hackers to Hipsters: Social Media's Influence on Bitcoin Price,"A new study carried out by ETH Zurich, Switzerland's leading technology university, has found that the public perception of bitcoin is changing.  Rather than being a mysterious cryptocurrency for geeks or criminals, bitcoin has transformed into a much bigger phenomenon.  David Garcia, a postdoctoral fellow at the ETH Zurich Department of Systems Design, said the image of bitcoin has changed fundamentally:  ""Previously bitcoins were something for hackers and computer nerds. Today hipsters pay for their drinks with it.""  The research paper, which is entitled 'The Digital Traces of Bubbles: Feedback Cycles Between Socio-Economic Signals in the Bitcoin Economy', looks at how the social dimensions of the users of bitcoin and their interactions with social media affect its price.  The authors say:  ""Amidst the hype surrounding the cryptocurrency, it is difficult to recognize which factors participate in its growth and influence its value. Bitcoin's decentralised structure, based on the contribution of its users rather than a central authority, implies that the dynamics of its economy may be strongly driven by social factors, which are composed of interactions between the actors of the market.""  Spikes in the data  Garcia and his colleagues examined the spikes in Google searches for bitcoin, and postulated that the increase in value was accelerated by online activity, especially social media.  To test their hypothesis the researchers analysed four different socioeconomic parameters: the development of the user base, price fluctuations, search trends and interactions on social media platforms like Twitter.  The researchers found strong correlations between price development, the number of new bitcoin users, Internet searches and tweets related to bitcoin. They also identified two positive feedback loops. In the first, the increased popularity led to growing demand, which in turn stimulated activity on social media. The second loop relates to the user base: the more users join the network, the higher the price.  However, there is also negative feedback: before a significant drop in prices, the level of activity on the Internet skyrockets. The researchers concluded that big changes in online and social media activities lead to major price fluctuations.  The power of the network  Garcia's colleague and co-author Nicolas Perony sees great potential in the quantitative analysis of social phenomena.  ""With digital currencies we can examine certain aspects of the economy which cannot be observed with cash,"" said Perony. ""That way we can better understand how the market really works.""  Perony argues that the same methodology can be applied to other areas of society, thanks to block-chain technology. He points out that the bitcoin network is 300 times more powerful than the 500 most powerful supercomputers combined.  ""The big question is how one could use such a powerful system for collaborative activities that go beyond the production of money,"" said Perony.  Perony believes it would be possible to use the system to manage ownership of certain goods or to help collaborative research efforts, as the network could be used to conduct research on various collaborative concepts.  Social media image via Twin Design / Shutterstock.com",POSITIVE,없음,BTC | MARKET | TECHNOLOGY | TRADING | RESEARCH,Nermin Hajdarbegovic,0,0,CoinDesk,https://coindesk.com/markets/2014/08/07/from-hackers-to-hipsters-social-medias-influence-on-bitcoin-price,https://cdn.sanity.io/images/s3y3vcno/production/00e9972371ac6120c6590540123acced85ab173a-1300x897.jpg?w=300&h=300&fit=crop
